0	working my way thought masses of work I have been given, whilst listening to the Wishes sound track...oh how I miss Disney 
0	Working my way through a lot of e-mail and snail mail
0	Working my way through http://tinyurl.com/2bl9q7 My brute force solutions look so crappy next to people's elegantly mathematical ones.
0	Working my weekend away
0	working nights is becoming increasingly difficult for me in terms of sleep, and I never seem to get much accomplished around the house 
0	working office today  minus...
0	Working on  the Solstice, boo 
1	Working on #php #mafiawars online RPG game... Looks good for now
0	Working on "Pilot Readiness" assessment; supposed to turn on the platform on Monday for the first group. I think we need to push 1 week
0	Working on : Shi Ji project
1	working on misc. kicking off summer session with our new set of founders this week...! can't wait.
1	Working on 12 with
0	working on a bank holiday
0	working on a beautful day
0	Working on a beautiful day... boo!
0	working on a blog idea. too many things to choose from and not enough mechanisms that reinforce our choices. we design for short run
0	Working on a broken portable cd player.
0	WORKING ON A CD. KILLA WEATHER WERE HAVING, THIS SHIT SUCKS 
1	Working on a Chamber of Commerce document  and happy to boot! http://ff.im/3xaxN
1	working on a few critiques and two paintings at the moment. Multi Tasking
1	Working on a film. Have been busy. Have a nice day everyone
1	Working on a friday just isn't right! Thanks god I'm going home shortly.
0	working on a Friday night
0	working on a friday night!!! .. not good!!!!  xxx
1	working on a great new website, filled with stuff you're going to enjoy, I promise 
1	Working on a home made shelf for my books... Sanding, cutting... 
1	Working on a little anniversary present for my huz  will post pics of the process  on my blog in a few
1	working on a LOT of things at the same time
1	Working on a massive article about while our education system is failing. It's gonna be great
1	working on a max/msp step sequencer to be used in ableton 7 through pluggo so that i can control battery with my touchOSC on my iphone.
1	Working on a MIS system...
1	Working on a new art project -- feeling a little inspired
1	working on a new dj mix thats a bit funky, jazzy, dubby, housey, jungley and meaty, 
1	Working on a new project... http://dev.vzerohost.com/ - It outputs the name and extension.
1	working on a new song  will post it on youtube soon!
1	Working on a new video...Beautiful song that I got to cover.  Look for it on my youtube - youtube.com/tarabethw
0	Working on a new youtube video. For some reason I am not satisfied with my voice
0	working on a nice day again and have a mega sick girl friend
0	Working on a paper  called "hmhmhm Compliance hmhmhm" -> my  workmate forced me to obfuscate the real name
1	Working on a PCI compliance report...rather be fishing
1	Working on a poster for an '80s pajama party at a local bar in a college town. A bit specific & not quite so easy as it may sound. Help!
1	Working on a PR plan. Then it is on to awards.
1	Working on a project plan
1	working on a psych paper....
1	Working on a public holiday in AU. Office is nearly empty, fun 
1	Working on a public holiday in Germany "saugt Arsch" but well someone has to do it
1	Working on a recipe for cocoa butter body scrub.
1	Working on a Reporting Requirements project in Maryland by BWI. Heading to Boston, MA this week to see my son graduate from Harvard U! 
0	Working on a Saturday  How cute is John Lengends dog?
0	Working on a saturday is definitely not fun
0	Working on a Saturday is not fun
0	working on a saturday is really not fun
0	working on a saturday morning... revoke yesterday's premature celebratory TFFIF.
0	Working on a Saturday night
0	Working on a Saturday. Bad time management Monday thru Friday
0	Working on a Saturday...
0	working on a saturday... yet again!!
0	Working on a schoolproject.. I want to go outside but I have to finish this first...
0	working on a simple portfolio. need work.......
1	working on a solo flute piece! simulating counterpoint with one instrument is my new favorite past time.
1	Working on a spreadsheet wishing I had some numbers to plug into it. I'm waiting. You know who you are
0	Working on a Sunday   My husband had to bring me in because my car is having issues too...today is going to be a sucky day I think!
0	working on a sunday  getting some stuff done... but not enough.
0	Working on a Sunday ....
1	Working on a Sunday can be nice if you are doing it for yourself
0	Working on a sunny day. Again   http://yfrog.com/67ec6mj
1	Working on a template for the Dark Regions 2.0 website
1	working on a website and house sitting
1	Working on all my pages. I soooo do not want to do this today. Chemo started today. So far, so good. /So much family. I am loved 
1	Working on ALMTJF episode 4 while episode 3 uploadss!
1	Working on an email form. Turning out realllllly good. The code looks so clean
0	Working on an on-going series of CD cover matrials, I just noticed a *really* retarded typo that's been propagated for god knows how long 
0	working on an online store. waiting to hear back from Carbone about why my car is making a thumping noise
0	working on an Rnb track....only time ill get to make a beat. tomorrow i gotta start my freakn 7 pg paper. ugh.
1	Working on another painting...will list and post here soon
1	working on another YT cover song! Should be done Tuesday night!  Stay tuned!!! - Off to bed!
1	working on arts
1	working on baby shower stuff with danielle
0	Working on Beatrix tonight I think, very hot and humid here though 
1	Working on becoming a pro one day
1	working on catching up after being gone for almost a week.   It's a good thing   #fb
1	working on cleaning up some stuff
1	Working on Cloud app's icon
0	Working on comics... still feeling sick and very weak. Doctors didn't call me back.
1	working on co-op project  allllllllmost done
0	working on cutting images with photoshop CS4. it's pretty slow....
0	working on deadboombox
1	Working on dissertation...I am excited!
0	working on english project
0	Working on English timeline.
0	working on fall 3... forgot it was an 84-page book.
0	working on freelance
0	Working on geometry... Why did I choose to take this over the summer again??
0	working on getting a version of IE6 on my mac....  for testing only... stupid world... stuck in ie!! GRRR
0	Working on getting my teething baby back to sleep. Poor thing
1	Working on getting the creature to behave, it has begun to ignore player input  #iPhone #games
1	working on getting the website ready to go
0	working on health AIDS paper, then english speech, studying for math & spanish finals... joy  but only 7 days of school left!!
0	working on her English essay
0	Working on her rug. It might be ready for my college dorm but probably not for August.  Sadness!
0	Working on his final paper and watching the cavs who will lose
1	working on his myspace music page tomorrow so far its brand new and plain but not for long!   http://www.myspace.com/michaelcoponmusic
1	Working on http://www.feedicon.net again
0	Working on IW source code to fix some bugs. It seems some things we fixed for Delphi does not works for C++Builder
0	Working on Jully
0	Working on last HUGE final.. while everyone else is happily sun bathing and swimming at my house  sleep tomorrow
0	Working on Legend, not going to download new iPhone software until later 
0	Working on level three! Having trouble with inspiration, though... 
1	Working on live show this next two weeks with vision & valor. Hope they're ready!
0	working on logistics, taxation and law. motviationlevel= zero 
0	working on mapping apis distance calculations and comparisons, though 
1	Working on Market Tree's new brand brand launch - exciting stuff!
1	working on mothers day slideshow, cake, card, and balloons  she deserves the best!
1	Working on my "Minnesota accent" so I can fit in for the upcoming graduation trip.
0	Working on my B-Day  Global Crew Logistics http://loopt.us/bhFJfA.t
1	Working on my blog post for tomorrow!  Almost done.
1	working on my blog... would love some feedback! - http://www.cl.gs/aRns2b
0	working on my CJ PAPER!!
0	Working on my class   paper
0	working on my damn art history project that is due tomorrow that I have not even started yet
0	working on my day off   - glad the weather is rainy...
0	working on my excel project
1	working on my files.
1	working on my final project for my fashion design class   SKATE/PUNK line.  LOVES IT<3
1	working on my final study guide for english due tomorrow & with cameron
0	Working on my job application and online portfolio... designing for myself is hard work
1	Working on my labels!!  Have to hit it hard this week
1	working on my major assignment today  cant wait till its over!
1	working on my multi fandom vid, trying to get it finished today 
0	Working on my new Toshiba. I miss my MacBook.
1	Working on my new website and taking sign ups for Psychic parties!! Wahoo!
1	Working on my next Ad campaign starting tomorrow excited
0	working on my online classes  ugh this sucks
0	working on my oral presentation for english
0	Working on my outline for my persuasive speech... not going as well as I hoped
1	Working on my paper all day long, then seeing Natalie for her birthday 
0	working on my pictures for college. not too sure how everything is gonna turn out..
0	working on my project god cant find the jewish heritage
1	Working on my review of TweetGenius.
1	Working on my Science powerpoint
1	working on my screenplay...the Killer is ripping off Ronda's fingernails.
0	Working on my siociology- anthropology  help
1	working on my slides a bit
0	Working on my stupid novel for school! I can say that it's not going good at all!
0	working on my TPA's while curing my hives
1	Working on my tutorial and cooking food for Kyan and keeping an eye on him while he is playing
1	working on my volunteer post test & watching tyra. aka making my boyfriend proud
1	working on my website...n myspace
1	Working on my Wishlist. It'd needed revamped for a few months now.
1	Working on new features for twitter-patter.com - launch in three weeks - delayed two weeks due to client additions.
1	working on new items, prepping for the photoshoot on saturday. my newest veil style reminds me of a ghost from pacman 
1	working on new playlists on iTunes... Music was so much better back in the days
1	Working on new remix playlist
0	Working on new show ideas...kinda bored
1	Working on Nufface.com
0	Working on PHP
0	working on populating this new account. isn't playing ball on updating who I follow (comes and goes and goes and goes and ...)
1	working on powerpoint for uni. all tuckered out from chasing after my two cousins all day. and being with my mama of course!
0	working on PP introduction. hooo this effing intro is killing me
0	working on presentation and waiting for the IPL match.... but feeling sleepy
1	working on presentation... long way to go
1	Working on press release so that we can blast this event out tomorrow all over the US...well Pacific Northwest mostly but still!
1	Working on production for my new song "So Weightless"...smoove and groovay
0	Working on proposal for tomorrow's meeting - how stimulus $$ will be spent on technology for our campus. Too many options-not enough $$
0	Working on purging unnecessary pics from my computer and then backing up the good ones, my hard drive is limping! 
0	working on quarterly taxes = no fun
1	Working on refinishing my cabinets some more today. 2 more coats if stain, 2 coats of clear then I'll finally have them back 
1	Working on report center plugin. Managed to get it started last night, relatively pain free 
0	Working on research after 3-week hiatus. Going is slow, but it's hard to tell if that's because of time off, congestion, or both. 
0	working on research paper, which consists of 10-12 pgs  5/10-12
0	Working on residency paper work all day...blargh
1	Working on rewriting a sales page today...want help with your next project? DM me.  www.writesyntax.com
0	Working on Saturday
1	Working on Script Rundowns, and preparing for next week's premier! 
1	working on scripts for July taping...
0	working on sending out my sons Sr graduation invitations...whew!! sigh.....little sad too
1	working on setting up my ipod touch, which as of today is officially mine!! 
0	Working on site today... It's very very cold in this office
1	Working on some art today.    I already walked and did my yoga.  I love doing yoga.  Talk about relaxing your body and mind.
0	working on some exam study guides... 2 more finals tomorrow
1	working on some hw still, only 7 days left of school.  i'm so excited.
1	Working on some music advocacy links
0	Working on some new merch.  We are running low yo
1	Working on some pages
1	working on some stamping projects  First idea was a wash, moving on now
0	Working on something exciting... and I cannot tweet about it for several months
0	Working on something to go on my poppop's grave tomorrow for Father's Day
1	working on somthin<different>  tet me
0	Working on stage 3 of college report. SUCKS!!
1	working on stuff for Em and Rich's wedding ... Currently looking at pictures from the day Em was born
0	working on stuff for work
0	Working on such a nice day  Home http://loopt.us/1E2F3Q.t
0	Working on summer school curriculum.
0	Working on Summer School work
1	Working on sundays suck!!
1	Working on the AMV on LT as the movie buffers here on the PC.
0	working on the blog - blah
0	Working on the blog, I never have the time to finish this  also cuz I get lazy   
0	working on the cart all day, then back on campus to finish painting my room...no more pink 
1	working on the climb season 2 episode 5!!
0	working on the computer at work
0	Working on the DVD menu. Not a lot of inspiration
1	Working on the Gernant for Congress campaign!  http://tylergernant.com
0	Working on the Holy Week
0	Working on the lame powerpoint for college english.  I miss California already!
0	Working on the last two parts of Crazier.  sad, but their gonna be good. Not as predictable as you may think.
0	working on the last work booklet for psychology, which has NOTHING to do with psychology 
1	working on the lay-out of our family newsletter.. lots of articles this month
0	working on the mac for a while, the terminal is "ugly", with or without antialias-text 
1	working on the NDD: RED manual - you can now 'pause' the game
1	working on the new logo and watchin tv on the new 50"
1	Working on the new lay!
1	Working on the new portland website today!
1	working on the new T2T site.
1	Working on the next big giveaway.  Hopefully I can top the 20 bottles of water
0	Working on the train rather than sleeping
0	working on the two essays i have to get done by tomorrow.. I'm half way done with one of them, and the other i didn't even start yet.. 
1	Working on the Website
0	working on the weekends is starting to get really old
0	Working on the Williamsburgh Terrace and Brown Place Project Bids. Bids due on Monday morning
1	working on these hundreds of photos is so tiring! good morning so far though! wes makes the best coffee
0	Working on this beatyful day.
0	working on this beautiful day. someone pls visit me
0	working on this beautiful Saturday
0	Working on this beautiful Saturday.
1	working on this darnn web-page project!  I want to pull my hair out but I love the challenge!
0	working on this early on a Sat. morning
0	Working on this fine day
0	working on this rainy day
0	working on this thesis wow.... my life is exciting
0	Working on three papers
1	working on tomorrow's comic.. gonna have to redo it if the election turns out differently, but hey, who cares 
0	Working on tomorrow's newspaper is just not conducive to being surprised by tonight's Apprentice final      I'm saying nowt!
1	Working on tonight's post
0	Working on travel plans for June and despairing. In Atlanta first week, then Rome, then Boston. Home only a week, altogether. 
1	Working on Vanessa Hudgens' art work.
1	Working on website for album launch
0	Working on website for the last 20 hours
0	working on weekends in my notice period  m managing it very badly!!
0	working on words next to the friendly AIR install button to reassure user that scary install dialog is ok (certificate is not enough)
1	working on work and visiting cherry blossom festival this afternoon  sweet
0	Working on WWF banners now. Was very upset when I figured out that WWF was some panda stuff and not World Wrestling Federation
0	working once again.....lets see how long i can last w my knee feeling like shit
0	working open to close.............
0	Working OT this evening  . What a drag!
0	working out for the first time since graduation
0	working out how to handle an uploaded file on the server...I might have to read the documentation  I hope not #yui
0	working out how to use twitter with a hangover
0	Working out my relationship issues with Kaze. It doesn't seem very promising yet.
1	Working out on WOWY
1	working out sucks, just saying but i wont give up, im going to make the cross country team in the fall. 
1	Working out taking advantage of this nice weather
1	working out to & listening to the Jonas B rothers motivates me
1	Working Out Tomorrow.  Have Some Good Plans For Something Else Two!
1	Working Out Twitter !  x
0	working out with a headache.. it just has to be done  dynamos tonight
