1	In san diego?  and just what does via do for me now . . Where's my dd . . Or my fat bar chick
0	In San Diegoooooooo. Culture shock. Missing everyone. Homesick 24 hours in?
1	In San Francisco! 2 days of awesome city
0	In Sant Joan Despi at office, belly hurts from Sushi last night 
1	in santa barbara. reunion starts now. damien rice - rootless tree
0	In savannah wt the other family
0	In school  really bored!
1	in school . last day , finally! 
0	in school about to go to class
0	in school ICT class BORING
0	in school on twitter.. how rebellious! aha booooorred though
0	in school w. linda doing nothing  ;i miss you
0	In school, and i saw someone wearing the same top as me!  i dont like it.
0	in school, i have to go to the class but i don't wanna go  school sucks
1	in school, talking to my brother bebo, janette & jojo. <3 last day of school! (like elvis saids "highschool is over forever.) 
1	In School... In The V E Room With The Losers!
1	in school..... cant wait to see mi love today.....
0	In science class  ugh... Hate school its a waste of time
0	in science class. want to sleep so bad. i want more food
0	in science finished my work bored cant wait 4 lunch (not) i have to finish math homework@lunch study hall  i guess its my fault 4 waiting
0	in science reall bored  making a skull.
1	in science watchoing evolution
0	In Science!!!  What a Waste!
1	In SD! Laundry and watching a movie with my mama! Can't wait to go to the fair tomorrow with my loved one's
0	in search of the perfect allergy med
0	in Seattle...hate the weather
1	in seattle's best coffee! weeeee
0	In serious need of a cuppa rooibos chai and a backrub. Instead have to cook dinner and put away the shopping and chivvy the kids
0	In serious pain. Can't go to the doctor till 2pm. Fuck
0	In sf I didn't make it so see them at bfd
1	In SF now!!  iChatting w/ candace cuz there's free wifi at the hotel   SHOW TOMORROW w/ GabeBondoc,Leejay,Passion!!  WOOTWOOT!
0	In SF now. Excited about WWDC! Miss the kids terribly
1	In SF today meeting Cynthia's best friend for the first time.
1	In SF..."The City"...I love it here. If Gavin Newsom will marry me I'll stay.
0	In SG airport heading to KL - flight is delayed
0	in shock that I lost ANOTHER iphone.
1	In short, thought, #thedecemberists played the best show I've ever heard. Thank you and for making me go. 
1	in Singapore! its so warm over here! Having a blast already
1	in singapore..  just finished watching terminator salvation with baby.. ganda!
1	in skul nly 5 more classes then im hme yay.!.!.!
0	In Sloane Sq surrounded by the middle classes
0	IN SO MUCH PAIN  DONT USE SUNBEDS KIDS
0	is working on Astronomy homework
1	is working on developing a blog all about #PARENTING and #PLAY with young children.  Stay tuned!  Enjoy your #children!
1	is working on her listography.  http://plurk.com/p/n233g
1	is working on her new cd in a bizzle ;D  and I will upload the first song soon!  http://plurk.com/p/xpte8
0	is working on her school  assignments.
0	is working on his six week diet plan! day 2 Cod and rice! nice but i don't know how i will last 6 weeks!
0	is working on human anatomy and studying for the test on Monday
0	is working on locally requested portraits today...and a little sick  http://bit.ly/52o2G
0	is working on my history essay
0	is working on selling a new beginning bunch of stuff and it looks like the BMW is one of the items that won't make the trip
1	is working on some cartoons...
1	Is working on some new tunage. New tunes to be uploaded within the next few weeks
0	Is working on 'The Ashes 2009' I feckin hate cricket
0	is working on the report for work.
1	is working on the senior paper with daniel the jerk
1	Is working out the twitter kinks
0	is working out... then taking and what not... going to jons going away party tonight!!
1	is working peacefully.
0	is working sooo in need of a vacation lol how was everyones weekend? mines was good but somewhat sad
1	is working the stockroom!!  also, needs some direction...and also, why did the sausage roll I ate taste spicy? it's plain pork!
1	Is working then with the girl
0	is working this beautiful sunny day away behind the bar
0	is working til 2pm
0	Is working till 7 and works by herself for the last 3 hours  no fun
1	is working till six THEN seeing a brand new pupppppy
0	is working to figure out what projection techniques are.
1	is working until 3:30pm and then enjoying the rest of the afternoon
0	is working when he should be getting ready for the BBQ
0	is working while freezing...
0	is working without jeremy and joseph today
0	is working, will never get used to working on a sunday! 
0	is working,huhuhuhu.. 
0	is working.  Lee is making me.  Boooo.    Big mean Daddy is being harrassed by cute sweet boy.  Send blue things to distract him.
0	Is Working. I'll be back at 5.. arff
0	is working...   and yet the beach is only 3 miles away from where I sit... how can I possibly focus on work??
0	is working....
1	is working....looking forward to my gran coming down from glasgow 2moz  for a visit....
0	is working...but really wants to go home...due to cramps
1	is worn out from a day full of the kids' baseball... but it was a lot of fun!
0	is worried
0	is worried about a friend
0	is worried about feasib grouping.
0	is worried about finding volunteers for the camp
0	is worried about getting NO revision done today
0	is worried about grandma
0	is worried about her cat, Wotsit. I haven't seen him for 3 days!! 
0	I'm bored, at work 
0	I'm bored, entertain me please? Or else i'm going to sleep 
0	I'm bored, have a terrible headache and can't sleep. 
0	I'm bored, mother I'd appreciate if you let me go to the next door party 
0	I'm bored, no one's online. 
0	I'm bored, nothin to do   zzzzz
1	I'm bored, or something. Can't be fucked getting out of bed to turn the computer on. in 15min 
1	I'm bored, waiting for me that the fran send the report 
0	i'm bored, what can i do?  
0	I'm bored,, Got nothing to do,. 
0	I'm bored,the boys are discussing something I dont understand so I better be quiet.booooo 
1	im bored. alot. make plans for tommorow, im open and the pools up 
1	Im bored. Ann is mean. The dude sitting next to me is obnoxious.  he is.... my homie (Thats what ann says) hehehehe <3
0	I'm bored. But I'm also more than poor so unfortunately that means staying home is the only thing I can do.
0	i'm bored. cant sleep well lately
0	I'm bored. I want to eat something, but I don't know what is it.  Henyekoe. MAGA-BOUNCE nalang meeee.
1	I'm bored. if you have my number and happen to be reading this, text or call me.  I took a nap and will now be awake all night
0	I'm bored. It's so frustrating.
1	I'm bored. My dream last night was so perfect  ... but it was a dream ):
0	i'm bored. somebody come play with me
0	i'm bored. this storm is scary
1	i'm bored. time for youtube! haha.
0	i'm bored.. and i'm going to miss cell time this week..
1	im bored... a lucky few of you may find that ive drawn you
0	im bored... and its only been a week of summer
0	I'm bored... and lonely...
1	I'm bored... Hate mondays.. Just realized that I'm like Garfield, the cat.. Miau.... 
0	i'm bored... i thought this was supposed to be fun!
1	I'm bored... someone entertain me! >=[ I'm hungry... someone feed me! >=[ I want new shades! Kyle buy me the one I told you about.
1	I'm bored... Think I'll make a music video  songs, anyone?
1	I'm bored.... Someone has to go live! Once again... NOT BOSSY!  maybe a little
1	im bored....... hangin out with t.a.f. before school
0	I'm bored...Maybe that's cuz it's 2:08am and no one is online
1	Im bored..my goal car is nissan 350z
0	im boredd  but im txting jesse, and watching Saturday Night Live.
1	im boreddd. so boredd. thanks paige for making me laughhh
0	I'm boreddd. Working 5pm-2am tonighttt
1	im boredddd!! taking pictures of myself is usually the result
0	Im boreddddd. I wish Eric or Sammy was up.  There's a party in your bedroom all night long.
0	I'm boreddddddd  someone come amuse meee xD
0	im boreddddddd loll  my friendds ditched me b4 we went to the movies
0	im boreddddddddd school today and i have to swim
0	I'm Boreeed  any1 here ?!
0	Im Boreeeeeeeeeeed
0	Im bores and hoping to get my facebook bakkkk
0	im boring  and alone..
0	is worried about her friends in Australia
0	is worried about her grandma
0	is worried about her granny, but happy thet shes out of the hospital so soon. cannot get herself up to learn  damn bloody sunday...
0	is worried about his good friend Joe who suffered a stroke yesterday...
0	is worried about rodger :/
0	is worried about this tornado in mboro
0	is worried about tomorrow...plans discontinued? </3
0	is worried as her laptop has gone all funny all of a sudden!
0	is worried because he doesn't keep good enough records..
0	Is worried because kentut's fever turun naik turun naik
1	is worried bout her brother. I love you
0	Is worried bout my step dad.
0	is worried for her boo.   http://plurk.com/p/ozf2h
0	is worried Maci may have a broken left arm. Darn trampolines and Dad's that bounce little kids too high.
0	is worried sick about Lu  Grrrrr, wait till i get my hands on them!!!!!!!!
0	is worried sick for E. Go home soon, boy 
0	is worried that my body clock is still on U.K's time. Anyway, I am missing Europe so much now 
0	is worried that the meatloaf and miller lite isn't going to do the trick afterall.
0	is worried that the Rams will be leaving St. Louis
0	is worried.  One of the guest last night came from Taiwan. :-o http://plurk.com/p/xdcsm
0	is worried. Bk d mko lg mkPlurk.  http://plurk.com/p/11bg1c
0	is worryiing about her Nissin votes :'-( guys, help me promote nmn!  http://plurk.com/p/ri5yc
0	is worrying about stuff and can't sleep.
0	is worrying over my boyfriend and his friend's safety.
1	is worrying unnecessarily about roadie....  It'll happen if it's meant to.  As always.... http://www.howitends.tv
0	is woundering when she will start feeling better
1	is wrapping up loading for the day. Just odds and ends left now. Wish I couls say we were done.
0	is writing an essay ! laaameeeeeeo . not having a goood day
0	is writing and wants to have a Munchkin party
1	is writing future articles for the website
0	is writing her last report card for a long time
1	is writing holiday lists but stopping for lunch in the city 'ron.
1	is writing now! setting up desk to do so
0	is writing unit tests by the fucking boatload
0	is writing useless documentation for useless software  On Air: Word Up! - Korn
1	is writing, producing and working. 
1	is wtaching HannahMontana the best of both worlds concert on Disney Channel
1	is wtaching hotel for dogs and eating dinner; yummy
1	is yaaaaaaay farrel is on the fa cuppp! She has my toopshop skirt
0	Is yard selling alone today  but someone gave us 200 dollars for our old couches
0	is yawning on the job
1	is yehii .  http://plurk.com/p/xe7rw
0	Is yet to sample my Spin playlists...
0	is yil3an shopping! where did all the gorgeous shirts go? Wait for me
0	Is your business buck naked? If you're like most small businesses, the answer is yes.  http://snipr.com/j6aii
0	im boring  im going to watch tv
0	Im bothered by this whole h1n1 thingy. it gets to me at a different level it gets to everybody else
1	I'm bout 2 b 200  3k posts.....*tear*
1	im bout 2 go get sum food 4 ma belly lol
0	I'm bout 2 go lay down....my ibuprofen and orajel is wearing off
0	I'M BOUT DONE WIT PPL!  2 BAD 4 THEM  BUT ITS BETTER 4 ME! I'M WORKIN ON ME U SHOULD DO THE SAME. I'M SO CAKED UP BOO
0	im bout ready for a tat, but im scared its gone hurt 
1	I'm bout to get ready for drinks...tweet with you twitters later!
1	im bout to get ready for wk im soooo tired I fell asleep on a good movie but gotta make this paper ill holler when im w my boo.
1	Im bout to get that Sprint Palm Pre this morning at 10:30am BITCHES!!!
0	im bout to go to bed gotta get up at 3 am
0	im bout to pull out my hair :/ im stressing so badly about finals i rly need to relax i cnt w8 till school is over ugghhhh
0	im bout to start hatin goin places after a certain hr...cuz i spend most of my time lookin for a park
1	I'm bout to switch back to Japanese.BBL you English speaking people...
0	Im bout to take my but to sleep didnt stay up late after all... Fail
1	Im brand new
1	I'm brand new at this, anyone worth following, plead your case now 
0	I'm breaking my head with this Linux/Ubuntu. 8.10 #Fails
0	I'm broke as hell, stuck in Canada away from home  Why? Because I used all my $ to buy me & TNA floor seats for july!
0	I'm broken. Neck and back pains. Damn you hurricane harbor rides. Damn you. Attempting to sleep. Night
1	i'm brushing my teets. well isn't this progress?!
1	Im building a shop in SL, and when Im finish can you get a lm or a SLurl if you wont. 
0	Im bummed cuz josh might not make it thursday
0	I'm bummed out that Danny Gokey was voted off AI last night.
0	I'm bummed out that I'm sick of Jon & Kate. I've watched them from the beginning.
0	I'm bummed that Gap bought out Athleta - I hate it when cool brands sell out, esp female POWER brands going mainstream - bleh! 
0	I'm Bummed that I can't be at the LA Coliseum for the LAKERS Rally!
0	Im bummed that i cant book Confide till like.... next month
0	Im bummed that i have yet to see SKINS season 3 last episode
0	I'm bummed that the contest is only for the 48 states   What about Hawaii??
0	i'm bummed today
0	I'm bummed. Getting our first foster and she turns out to be alpha, just like Heimdall.  Disaster!
0	im bummed. Should've gone.
0	I'm bumming that someone owns my name on both Facebook and Twitter...can there possibly be more than one Matt Morrow??
0	I'm buried deep inside myself, barely scraping by, covered by a not so perfect shell.   http://blip.fm/~8izf8
0	i'm burned  it's a hard, dangerous life being pale in Hawaii
1	Im burning my memories in the backyard
0	I'm burning up...our air conditioning at work is broken
0	im burnt  , my poor shoulder
0	im burnt  i dont burn...
0	im burnt and it hurts
0	I'm burnt from yesterday! I cannot look like this tomorrow!!! help!!
0	I'm burnt so bad i ache.
0	Im burnt to a crisp
0	I'm busy as hell. But at least I'm making money. Wish I could be a part of Saturday night festivities
0	i'm busy doing nothing  . .
0	I'm busy in Kokomo being stood up for an appt.
0	im busy..listenin 2 music...dats d only thng dat...keeps me alivve in diz deserted place.!!!! i miss my friends...so much..!!!
1	I'm buying the cool Pisay shirt tomorrow!!  Kayo rin! Hahaha )
1	I'm buying tickets to go see dane cook on june 19th!! Anyone wanna join me?
0	Im buzzin and scared
0	i'm buzzing and home alone. . .
0	Im by the pool having a fabulous time WHEN! I notice a really hot guy. And I was going to go talk to him and I forgot my towel!So no talk
0	Im calling into Radio Disney now.i made it through but me being the idiot i am cut it off by accident...now its just ringing and ringing
1	im calling it a night. i cant wait till tomorrow, the last day of school!!! wooooohoooooooooooo!!!!!!!!  
1	I'm calling it a night. Tweet you all later.
1	im catching on JONAS
1	i'm change my design
1	Im chasing the mythical creature called a haggis, short and stumpy little creature quite fast though 
1	I'm checking out TweetDeck!  Tried Twhirl, but already see the power, customization, and functionality here... 
1	i'm cheking you so hot so hot wonder if you lalalala..
1	im chill as a cucumber
1	I'm chillen' in the red f150 where the magic happens.. With my beautiful princess.
1	I'm chillin' after prom. Great night -- great memories.
1	Im chillin at a really nice hotel with family and enjoying my vacation I LOVE NOT WORKING AT AMERICALL YAY!!!!!!
