1	tell me when!
0	But... How do I download it? It says 'available now' but I can't find a download link  #tweetie
1	pretty cold in there now man, you are better off in the pub bit I think 
1	lol what would I do without you...?
1	RU Serious?....and you held out....how can I ever trust you again? ronic, I know. By keeping PJ faith you shattered mine. 
1	thanx! I was looking for that video
0	ps i just did the see you in the dark dance and it's no fun by myself
0	Bad news really, hope everything is ok 
1	Thank you! I love them!!!! Update often!
0	I definitely won't be able to get my stuff done before 5!    #squarespace
1	Ah, I see. 
0	Where is there a live feed? I wanna watch but fear I'll be on a liveblog...
1	yeh I shall watch it!
0	Dang! Of course, I'm just jealous 'cuz I didn't think of it first 
0	I knew I shouldn't tweet before coffee
0	oh yeah...forgot about them! everyone hates me!
1	gotta live the J-Man! That kid is awesome
0	Maths and Science were the strongest for me i think..dunno bout geography, only did like 1 day of study for 1/2 a year of work! 
1	naww...thanks!  Us fellow nerds! lol, they were mostly easy, except my graphics exam coz my teacher left 2 have her baby...
1	hey doll! Long time no gossip
0	 Are you going today?
1	Will you drop off some Great Plains in Cedar Falls on your way home?
0	Yeah me too...i just want all these exams to be over, they're making me so ill and im not really coping  Good luck x
1	Thanks for the FF recommendation! Who knows, i might eventually have 12k followers.  
0	well, I made the bf clean his room and after he did, he launched an attack on me using the vacuum cleaner  (much to his glee)
1	yes, you're correct--installing os x on non-apple hardware is ILLEGAL! 
0	Nice. I have it already. Just to bad COD had given so few keys. Make millions and PC users get it for free, but not Xbox users 
0	the new map pack 2 trophies, not the best really... Rather easy! 
1	battery pushing will be a global phenomenon by 2012 trust me
0	sigh. they definitely didn't forget *I* graduated.
1	Anyways, I think we've stumbled on yet another excellent discussion that would be best served over a beer in person. 
0	Talking to you on MSN! HAHHAHA. Aww, what did she do?  Your twitter background is adorable, btw. <3
0	haaayyy  i thought i was ur friend work
1	#hug sorry I didn't have enough space. I thought of you tho
1	Oh dear, what time !!! I will stay in doors 
1	It's really true. He doesn't want to work things out between us. It's okay, thanks Justin. 
1	Just landed in Indy. I'll take a rain check though.
1	good movie huh  *puts a big smirk on my face hehe
0	No, Hawks scored 3-2 w/ 5mins left in 3rd period.  
0	 Safari can't find the server. Its tough being a MAC sometimes!
1	Glad you made it home okay.
1	Rio Bravo was cool but my fave is Rooster Cogburn.  I have Jerk and Ahole as nicknames as well
0	 your missing someone....hmmm..oh yeah...ME lol..nah have fun my love and be safe sweetie!!! lol
0	awww...I shoulda came!
0	when I didn't get the invite  next time I'm rollin.......
1	WOW!!! love the look, you look almost 30! 
0	No.  I wish. I just follow him on here so I know he is back in Kalamazoo. We were joking about going up there to find him. Haha.
0	janet call me i need hepl with the l&t letter thingy
1	ahh. so, you rent a bike when you stay over for a week end. I guess I underestimated how into biking you were 
0	i miss you
1	I'll come see ya'll when I'm not playing Mommy and can party it up!
0	 i'm not a freak, i'm just a bit special 
1	cheers for retweet
0	so sorry to hear that  my heart goes out to you and your family. know how hard it is to lose a matriarch.
0	lol that was a bad one indeed... now i got my week off n nowhere to go though
1	Free Iran, dear. Cause everyone deserves equal and fair representation. 
0	sucks I have to wait for mine
1	Ahahaha, yes, I fucking love it! 
1	The jerks! How dare they take away our procrastination time!
0	hope everything is okay?!
1	Joeyyyyyyyyyyyyy miss youuu<333 hope all is well.
1	Glad to see u been successful wat u luv doin.  Much success to u. Stay focused- I told u time is patience
0	wow...those pics are something else, speechless, I feel for them, and reminds me of my blessing 
1	Hey Rick!!  Yeah, I've seen that one before -- I love the indian guys in the background "He's just chilling" ... hahaha 
0	 dag just when i decide to throw that frek em dress on, my most expensive get em heels & my fox lashes.. didda sys zzzz.. wtf
0	tell mikey I said sorry!!  I know he wants to kill me right now
1	me too. And i will, no worries 
1	Wow - loved it!!  Thanks for sharing
1	being don't you love the backpack
1	oh yes. I'm going to WalMart the night before and get it at 12am
0	cept we left  i miss you bunches!!!
0	I guess I won't send you my album then.
1	Yo! I haven't seen you in a while! Lets all hang out sooon
1	 In pre-Twitter days, I'd need   to wait  for a formal  invitation  to speak on edu2.0  from  #Y4IT  
1	a year tomorrow though - can't wait   Maybe we should have a little celebration tonight though for it being 52 weeks?!?
1	Knight,, will send U the pics later...  Sleep well
1	thanks for lending the power guys a hand to get it back online
1	me too, got it on my lovefilm list 
0	True, but I'd like to go home as well.  I miss my family. 
0	done & done!! haha hopefully she'll do it! and don't be annoyed  your true friends in maryland love you and always will
1	i have a dog named toto so i'm dorothy
1	hey there J
1	One More Thing . Your Sexy
1	  Are you a celeb ?
1	love it - totally makes sense - all setup with git/GitX and messing around locally - now just need a project
0	Twitpic clips the bottom of the flyer.
1	well... cable --> connection --> automatic read --> automatic logging --> numbers you can do something with
0	Hello Stress...
0	Ppl love to see you quwheel....
1	preciate it
0	:O no  flippin Royal Mail! They're useless!
0	:O That flippin DVDVD Still hasn't arrived!  Ho was English?
1	:O You're too young!... save one for me will 'ya? =P Hope the DVD comes tomorrow
1	scratch that. I can't as i dont have a bank account yet. I owe you for the film  assassinate.... i mean Tweet later
1	LOL now you can let the world now how cool you are on status update at a time
1	mothers day is next Sunday   But thank you
1	make sure my bed is made...
1	the look pretty snazy too
1	I love you too Jimmy supporter  "SHE CANT WAAAALKKK CAN YOU GUYS LET HER LIVVEEE?!?!?"
1	just found http://bit.ly/WJKpl  so I will try taskset
1	rest assured, I'll make sure the Moblin web browser is comparable (better?) in every way, eventually 
0	hey u! I likeddiddid that movi...whre u been tho giant!? I missed u! Was lookin at our last picture
1	ditto. love that
1	i'd be watching it if it was still on  and the most evil subject in all the land. textiles.
0	Traffic was way nasty this morning.
1	learning new sofware programs are always fun. Makes me feel just a little bit smarter
1	Loving Boulder... Rep the 3oh3 my friend
0	Mine are terrible too  Can't believe how much this is hitting me. Eden's post really helped, but today I'm feeling down again.
1	You day sounds better than mine! Revenge always helps to spice up a day
0	ugh, why do you hate me? How can you rub it in my face like that?!  I'm dying.
0	it's sad, but http://tweetake.com/ only took me back to April of this year 
1	Annie Lennox was born about 15 miles from here
1	just started following you based off a FF rec - looking forward to your tweets
0	that blows. sorry to hear it
0	that's totally going to leave a wicked scar... think of the war stories you could tell! ouch  serious note: hope it heals quick!
1	we're drinking. Come now !
0	WHA?! WHO ARE YOU TALKING TO?!
0	same old stuff for me. Wish the weekend were here
1	Hur är det  The sun's shining here, amazing 
1	just installed it; thanks   yes, we have had gloom here, but honestly, I'll take it cuz the temps have been so coastal cool 
1	  Have a lovely weekend
1	I saw you on FP last night.Congrats on your sale
1	I know what you mean! It's time for BED
1	Thank you for retweeting that wonderful quote, Jean! 
1	yes we do. I have 2 dogs and 3 cats
1	ooc I can't stand those damn things. Just twitter search for the url and block all of them, that works quite well. 
1	OOC:  DM Janeway and ask.  She would know more.
0	OOC:  it didn't look like he was tweeting all that much when it happened.
0	OOC:  Sorry to hear that.
0	sorry can't watch movie on Friday. Just got back from the ER.
0	 eek! That would keep me up all night!
1	my bday was monday, so heading out tomorrow night with my best friend for some fun! 
1	It'll be a double 4 me cause Charles has 2 pay up when the Lakers win 2nite. I almost feel bad... just takin his $$ like that
1	Thanks for #FF mention.
0	J'attends l'assistance-routière: Crevaison. Won't be able to go...
0	 aw hugs  <-- I have armour on though just incase I annoy you... :p hope your day gets better hun xx
1	8th june at coveentryy  x
1	haha, i wonder how many it would have got to! anyway im off to bed now! so night night  xxx
1	he looks ever so fetch!
1	no, the place where you met ant, haha! i might listen a bit of V later 
1	Not really, just been working. Trying to keep from going mad, and saving for England in aug  You been up too much in KEEEENT?
1	thank you so much!! youre an angel
0	You're seeing Take That?! I hate you now
0	oh Lana  The docs think Lily was a twin but we can't be sure. They think all the clotting and bloodloss was a misscarriage.
0	new man maybe after shouting at hubby
1	I did so many evil things. Can't wait to carry on my quest to become the evilest bastard in the galaxy
0	i would but i cant reach you
1	Oooh I shall look now  Ty very much!
0	Crap! Did I miss a great sunset?
1	LOL like the second way, no space LOL ur learning  u following mark? Ludwigdrummer89
1	 yep!  tomorrow's our 4 year anniversary!
1	Haha, don't be! I'm like, just bored outta my mind right now &supaaaa HYPER. I rarely ever go out, aha. 
0	heyy!! now you think just because of the thing with JT i'm gonna find a way to offend carl too?? not nice hash.
0	AWWWWWW I MISS MY DOMINICAN SAYING THAT IM ANNOYING HER
1	awww that is sooo cute! make sure u hide it all well cause vip is strict. good luck!
0	email them, cause u normally get it a few days prior but that seems so late. u reminded me i didn't get mine either 
1	i know what u mean, wait until after u meet, then u still won't be sleeping. it's all good, stay positive 
1	omgosh  i really got brown D so much difference!!should i still awake and look mtv movie awards? i don't know. i love you besti
0	I know... I miss that version... what happened?
0	I want Particle Illusion but I dont think it's formatted for my computer.  *cries*
1	Get 100 followers a day using www.tweeteradder.com Once you add everyone you are on the train or pay vip
1	I can't reply to your DM because you're not following me. Yes, we know each other, u don't remember?  Hehe.
1	Which phone are you going with? Did I ask you this already? If I did, I apologize for being a forgetful moron. 
1	god yeah  i love dec hes lush aha and as for shaun well lol xx
1	yeah it was boiling and the aircon was naff lol least its sunny today  xx
1	yeah we are lol  yeah i do  do you?xxx
0	 don't listen to thought of the day - you might catch religion. that's how they get you, when you're vulnerable. what ails?
1	yep what? eeek! yep whaaat?  seriously... yep what? lol
0	neither can we. That's wy we are stuck - I repeat, stuck - at a bar. So sad 
1	lol thanks loving the hair
1	Good Morning to you too
0	  no other damage, BUT can't find hub's keys..hope it wasn't in the van!! Imagine keys to house, van, apts, FS.
1	Sending you an email
1	haha sure i'll take you.  remember when you didnt like twilight...lol
0	oops! what kind of problems?
1	http://bit.ly/tS4CE  there you go
1	ahaha  well, i guess i already knew that 
0	I have a cut in my finger  but i'm okay
1	Ahhhh the illusion of love  the problem with being swept off your feet is they never put you back on your feet!
1	drink a cup for me
1	haha yet I can tweet even more now
0	 That's no good. You should go home and rest (if you're not already).
0	i tried to get you before you got off...i'm sorry
1	YESSSS!!!!!!  you have no idea how much that excites me! ILY
1	bangin tune man...my body is 2 bootylicious 4 ya babaaaayyy.... ha ur in english paper 2 now :L....ha yeah de rosary beads
0	jealooooous! I'm sitting at home. Doing nothing.
0	Noes .   But I did learn some valuable lessons or some junk so it's cool.
0	Confession: I think Donnie ruins "Never Let You Go" with his chitter chatter.  I'm so ashamed to admit that.
1	I reckon your eyes would stick together or something as it dried, too. Don't fear, I'd never actually do it, just curious 
1	http://bit.ly/o8UZz  there  for you. Julian is so drunk haha! He mulber something.
0	Aww.  Atleast your going though!!
0	sunny in musselburgh lol oh your drinking without me
0	NO WAY.. does that mean I cant call you tomorrow? I probably wont be able to meet tomorrow. got called to work
1	Go on then chick!  that would be fab! X
0	Stop with the brownie talk already!
0	aww that sucks, 
1	thank you  The question is: Which game do Nick and Kevin tease Joe that he's been playing since they were kids?
1	it was VERY annoying! Haha! See ya in Newcastle
0	monday mornings
0	woow. bummmerr
0	Ok, did you watch the scrubs Finale?  
1	grr naplan. just finished my commerce & geo exams  good luck (Y)
0	yeah I think so  I'm so sad
1	hello  , nafen much you , i only got that comment there now :$ ? ahaha xox
1	You had me at bourbon pecan pie...actually, let's be honest, you had me at bourbon. 
0	I am lost. Please help me find a good home.
0	this twitter is sooooo confusing... my head hurts now
1	Wishing you a great day!
1	(thats me)
1	Mabye she was there to pick up kstew...
1	will doooo...... lets hang when you get home  luv yasss!
0	sorry, a client texted me & i had to leave a bit. Saw ur msg via email. Couldn't get direct msg on mobile  Philippines.
0	Thank you, it is a dark dark day, they are such liars 
0	sorry buddy. Shooting a wedding.  happy bday!
1	lets just face it ... the majority of their songs are good. lol
1	anytime   it was great meeting you, loved the article!
1	 i adore her, omgg if u ever heard her sing shes amazing,   i mean jeez.. every one its a must to got to CENTRAL. god is love
1	Awesome! What have you said in it?  Xx
0	but i have no money
0	I heard about TR yeah.. verrah sad..
1	Hey hey! Life is awesome.....exams are not. One more to go....its all plane sailing from here  x
0	my iPhone is fucked. So so many things wrong with it, I'ma have to take it to get fixed  I LOVE flight control (Y)
0	just had a bad night
1	that's a great looking office and working alongside your partner is good
1	anything excitificating?
1	 glad to hear that  hope you're enjoying this beautiful weekend!
1	too funny. Peeps are the best!
0	i know i tried emailing you this moring  ... i know i'm so glad my father is a pro. and yes i want to see you! LUNCH!
0	What's wrong w/ us?! I honestly wish I could come to Canada but I always have to pay the border b/c I was a bad boy.
1	eee check you out tweeting! I'm glad it's holliday time too
0	I working till 2  so we're in the same boat
1	please, can we go to a fun gig together.... its been so long? I need some fun 
0	I am lost. Please help me find a good home.
1	I got an A in that paper
0	LOL she is okay, its just he songs are so catchy they get stuck in my head 
0	No haha! I'm actually worried about you woman! There was no mention of Assassin's Creed 2 either
1	Did you see the way I was dancing when I first saw U? U got me all excited & shit! I'm ur biggest groupie!
1	Thank you!  #followfriday
1	Sweet me too! i cant wait to tell the receptionist in the Doctors office about it  she likes hearing about our adventures ...
0	Sad isn't it? The Josh/Donna list I'm on is in shock
1	 Thanks guys for the following and thanks for being apart of our family
1	MAKE ME SOME
0	 Yeah, I'll be online, but not until around 1:30ish your time  I'll be online tomorrow though if you're not on tonight
1	Haha, I thought that was you 
0	lauraaaaaaaa. come baaaaaaack. my guests distracted meee.
1	Um, kind of!  And I find it funny that we're having two different conversations right now. 
1	hello indeed  xxx
0	 you are enjoying this far far too much!
0	i have an aweful cough  and feel like shit
0	i just got it  sorry i havent had any messages all day
0	noooooo  don't make me cry
0	u really dont right now! i am as sick as a newt in a freezer! its aweful  x
0	well I can open the window and oh bummer  I wanna seeeeeeee youuuu!!! Are you out at all tonight?
1	HEEEEEEEEEEEEYYYY LAURA!!!  "LET THAT BOOTIE FREE" LOL (inside joke guys)
1	I've noticed..lol his hand ALWAYS goes right for your tummy--like he's protecting his baby
0	Right back at ya pal, turning down nights out because i have no money 
0	take meeeeeee. Im green.im uncool
0	the mineralista didnt come!
1	I hate you. He's still on my bed though
0	though they didnt kiss  oceanup were just being bullcrapperrrrs
0	no more culinary attempts for me... I have embarked on silly detox, day one and counting 
0	You don't have any decent supermarkets near you either
1	Am fine, cheers  Good luck w/your running ))
0	Sadly not  Wet, grey and really quite yuck again. Any better over there?
0	you coming back to KG? I am 99% positive it is the last known location of dial-up. Good luck not ripping your hair out 
1	 Now.... how to stay calm enough to function until then LOL!
0	omg i think rob brought this girl that he met in  Cannes to the Movie Awards
1	I dm you  how cute haha
1	which song is it?
0	Im in all day too, im getting so bored but till I find a flat I dont wanna get myself  doing something else  got nething to do?
0	I have finals this week  But I like the idea of having one next tuesday or this friday!
0	They're both gone.
1	I'm going back tomorrow!!! We can do it
1	have you no shame girl?! Turn on the a/c and wash the hands!
1	Eeee  It's about time! I only have 3 weeks in school, then work experience, 4 days in school... then off! YEY!
1	considering i technically owe you money i'll bring you some for RFL tomorrow
1	I crochet Laura. Simple stitches...I can make a mean afgan!
1	hello   I'm full of hayfever and STILL have a vodka hangover LOL
0	Not available in the dutch store
1	Do not complain - the sun will go away!  I really it want it to stay for the next 3 months!!!
1	but then i hope you start follow me...
1	might have one of Marina Sirtis also...   I need to find that stuff...
1	Lauren's mine (:  Audrina is good friends with Val Dibendetto
1	I heart u too!
1	thanks for the birthday wishes.
0	Wait, it was for during the M&G. I dunno if reg. ticket holders will get 2 see it.  That sux.
1	Glad you're digging it dude!
1	Regent Street has been (and still is) incredibly sunny and crowded.
1	sounds a plan
1	Tx Laura, I am thinking now just snail mail is possible for new client ppwk, hv a great day 
1	I bought it already pink...  Its the #Nicoletta brand of cake decorations!
0	Lets hope they're good unexpected announcements, in these troubled times I worry about the other kind 
1	PMSL! Love that... only in Pretoria
0	Thanks. Will process it in time but not feeling too safe right now and that really sucks!
0	yes, sorry! Saturday ... haha, was obviously very hopeful about the number of days left in this week 
0	I too support #iranelection, but clearly am techno-idiot when it comes to twitter.  Hi there. xoxo
0	My sources say no
1	in NYC he only sang 5 so it was a short set too. but maybe he'll sing zero gravity? I'll be watching the cellcast
1	-- sorry about the groaner. I couldn't help myself.
1	Holy shit hey! It's been a lonnng time!
1	just got the mail! I love youuu!
1	i just noticed...in your picture...conan looks thrilled..what did you say to upset him?
1	http://twitpic.com/6i6zp - Aww, you are so lucky. That game looks AMAZING! 
0	Yay! We can't get it over here in book shops  ... But it's on it's way now
1	sorry sweety, I am now   Such awesome pics!
0	dunno == , we're not going to the cinema anymore 
0	Nothing just was wondering because I've heard she calls when ppl win stuff. I have yet to win a contest  lol
0	 I wish I knew an answer for ya((hugs)) Sometimes it just takes time and growing out of that stuff, I think.
0	It tastes good, but I am not crazy about the texture.  It's not creamy.  Actually it has some itty bitty ice crystals 
1	Mosby! What a great name for a dog.
0	I have my cousin's wedding saturday in Saginaw and we are staying overnight  sad.
1	you just got a gold star twinny
0	stop cheating on me
1	dont even know what it means myself, copied it out a book hahaah 
1	Hey  Did you have a good time at the concert last night?
1	I can't wait! It's coming on Wednesday
0	text me its you...lost contacts
1	good luck with it..Do well!! My best wishes are with you!
0	Hello Ms Plurker!! Yes I am! But I couldn't resist the wedding  will power will power.
0	-i was expecting a "thank you baby for welcoming me to this world" thaaaaaaaaaaaaanks
0	im sry.  ur like the only person i know who doesn't like the movie that's all
1	it's set up!
1	lol ok i will but my phone's not working right now! D: and yayy i learned the whole song!
0	everything r just not working out today..   I need a drink! Come, we drink Ribena.
1	Good evening friend. I see you've found your face.
0	NO?? Deep sadness.
1	No such thing.  Ask my dad.
1	Hey Mama  How are you doing ?
0	i miss youuuuuuu too jeanet  everyone keeps asking for you!! 8 more more dayss til your back hahahah >
1	Yes. Thanks. That's good info.
0	great loss indeed  I hope the find what went wrong and prevent future incidents
1	A coffee roasting lesson? Sure.  It's really easy.
1	Coffee with cream is served Madame !  Welcome on the earth again
1	If it's important, it'll come around again. 
1	The firepit. Can't tell you how many smores we've eaten there  http://twitpic.com/69w3x
1	When the wife is away ....... The boys (me and my son) will play
1	Get 100 followers a day using www.tweeteradder.com Once you add everyone you are on the train or pay vip
1	Rest that machine of yours alright!
0	I'm trying! But it's soo hard, just too hard.  I'd rather learn drums. HAHA. \m/
1	LOL, may have been sticker shock on my face. 
0	ha ha ha! I'm just not in the mood today.  I'm trying to be cool, but I'm just not having it. Already had to curse someone out
1	i am wonderful  how are you ?
0	I just said that on my fb status about the weather being oh so nice in Queens. I'm not going to the BLACKSTAR show  BBQ wit fam.
0	if ur a fan of Wolverine and the original Marvel story line - it's TERRIBLE!
1	lol...  aww now Im all purple frm blushing. LOL
0	oh I kno what it was. stupid pocket stud. I cut my finger on it too. my bad, guys 
1	That was nice to say. Thanks, Jeanie! 
1	hahah my Chiqui loves sleeping in the hammovck too! and Kenzo, but only when Im with him 
0	 i'm so sad now. i guess...next year? aww.
1	Those kebabs were rather good. Thanks heaps
0	I can't see you
0	 I was going to say let's go to lunch...
0	YES I AM!   no im prob not but i want to!
0	they didn't let me in..and cassidys homie adam str8 played me outside
1	i wanna see show me
0	i love rain but this is the scary kind of rain
0	lool, ya leii el articuloo hahah don't wanna be mean but i'm glad that fans felt guilty! casi lo chocaaaaann.. ayayayyy 
1	It should be a film! Do you have a roof I could borrow and some chocolate cake I could borrow?
0	 re: "Greatest Generation" - they had a moral certitude in that war, that too many since have lacked 
0	err ... yeah, something else we import now 
1	It gives me such a rush to snatch that #kettlebell in the air! Gets the blood pumping! A sense of power! All of the above!
0	not back till Friday at 4pm. Muchos travelling before then
0	I know that feeling. Dads are just to hard to buy for  lol
1	ohhh yum. i had pancakes with melted choco spread ha  x
1	sincerley appreciate ur followfriday action - thx
0	Bleurgh, I gave her the benefit of the doubt for so long 
0	This is true, but our accents sound horrible on tv 
1	Yayayayay  hopefully there's no problems extracting it or whatever >_>
0	not trying to pop a bubble....but if I'm prego or have a baby....next year won't seem possible for us
0	I wish.  The soda machine is still broken so somebody got desperate.  Or two did since I had two of them.
1	same  tis a cool song.
1	Yum!  Can you say which one
1	Laura, You're Soooo Sweet  Looking forward to more of your videos. xxx Love ya~
0	lol woOord?! i aint seen no video search!!!
1	nice! making good progress then  can't wait to hear the album..it's gonna be awesome!
1	You are sooooo right.
1	Awh Cool Kk I Will Thanks
1	I so will now and you better perform it
1	'Course they win
1	Okay  Cause you said "io" and that means "i" in italian. That made me a bit confused
0	Ah, yes, my normal...between 5 & 6am daily. Like early morn as it is so deliciously quiet. Quiet is so undervalued anymore 
1	sorry for long time reply. Now i am happy  to read Mr.Q tweet!.i am looking forward to watch QMB!
0	chello you are in california. how will you ever see hp at midnight or go to brand new concerts?
0	EK guess whats just arrived  just enough time to change my shorts and vest b4 going on school run
0	I sent mine in yesterday!  Haven't heard anything back yet but it's still good to do it!  Definately a let down
1	Hi! I've been following Eunice since I got my Twitter
1	http://twitpic.com/6g89e - [...] It's clear to see, you're the reason that God made the girl. [...]  
1	eh, june 15th  are you going to the signing on the 18th, i think it is? x
1	fine i don't get hangovers and i'm allways up early no matter how drunk i get
1	hay don't stop tweetin inane crap makes me smile
1	Hey laura ... I know stuart has a facebook account and one on Myspace ... he hasn't quite got into Twitter yet
1	Doing great, Jeanne! How are you? 
1	I'd love to do that for sure
