0	still workin out....but no more lost weight!   getting a little discouraged!
0	Still working  someones gotta make that bread.
0	Still working dad's office
0	Still working and its still sunny outside
0	still working hard in the office, not going as expected, well it's taking much longer than i thought 
0	still working on homework
1	still working on my bio. why can't i write this mutha?  my brain is racked to bone.  maybe a few drinks tonight at the bar will help.
0	Still working on my laundry. And now I have to mark 23 maths assessments! Sunday? Not really!
0	still working on that research paper
0	Still working on the CSS for my layout... at the moment it's an ugly mixture of floats and absolutes
1	Still working on the SAP Skills Map on SAP Aspirin List.com - so complicated...any bright ideas?
0	Still working on this stupid paper....taking longer than expected
0	still working up the nerve to venture into petey's room to clean it.
0	Still working! Damn, I'm getting a headache 
0	still working, a very busy week 
1	Still working. Gotta a poop. Wanna go see someone tonight.  Hopefully not too late.
0	still working. its 3am and i'm soooo tired  gonna watch some big bang theory episodes and drink some vanillia tea
1	Still working. Started new project managing refurb of 30,000 sq ft office space and meeting notes don't write themselves!  
0	still working..
0	Still working....
0	Still working....     ...and working and working.
0	Still worrying about Steve. Still in hospital. I miss him so much. Home not the same. Things will get better...someday.
1	Still writing - still reading out aloud, much to the dismay of wife 
0	still writing my paper. not doing so well. bad grade here I come.   *using twitter to update to feel better about not writing my paper
1	Still writing this blog post, it should be finished soon 
1	still writing... seems it will be all i do from now on
1	Still writing..I think I'm going well..
0	Still wroting the post for The MP almost there.....
0	Still, doesn't see the sense of doing something 
0	Still, I really hope Rockstar does another Vice City themed GTA in the future...  I wanted to play GTA VC again but it feels really dated 
1	Still, it is definitely worth getting one! 
1	Still, most websites render pretty fast using Opera Mini, which is good 
0	Still, none of this satisfies me. My true calling is in the arts, but that hardly pays the bills. 
0	still... no rain...
0	stillathome. i blame lily for this!  i miss him, even though he's a douche bag. not a big fan of summer so far. /:
1	stilll awakee :] and its 3am
0	Stilll haven't slept
1	stilll here, mc donalds was yummy and daisy is lovin the hell out of me, pics of the most adorable rottie later 
0	Tweet....my head hurts
0	tweet_genius v5 device code on 8900 - can't get tweet genius to login, always says user/pwd invalid, ubertweet and twitterberry work ok 
0	Tweet4Skype could be a nice impementation, but it doesn't work 
0	tweetdeck blacked out tweeting from the web soo lame!
0	tweetdeck died on me
1	TweetDeck fajny
1	tweetdeck fix0r. Still smiling
0	Tweetdeck for iPhone discards my tweet if I exit the app before pressing send.  Tweetie handles this better.
0	Tweetdeck for iPhone doesn't let you tap links from the feed view, you have to go to the tweet detail screen.  Back to Twitterfon for now.
0	Tweetdeck for iPhone has promise but crashy, no full screen picture viewing, no nearby search, trends or google map app option is bunk. 
0	Tweetdeck for iPhone is kinda cool, but crashes a lot 
0	tweetdeck for iphone keeps crashing!
0	TweetDeck for iPhone. The good: powerful UI & price (FREE!). The bad: it crashes. The ugly: crashes a lot
0	Tweetdeck has been glitchy lately, 
0	TweetDeck is being weird.  Also, my room is so full of junk I cannot walk. Moving =  (Happy tomorrow, I promise.)
0	Tweetdeck is losing out to Tweetie... I'm not impressed yet...
0	tweetdeck isn't working for me...i can't keep up with watkins on here.
0	Tweetdeck isn't working.
0	tweetdeck not working
0	TweetDeck on iPhone seems promising, if only it would stop crashing on me...  
0	TweetDeck put me in Twitter jail.  I had to come back to the web!
1	Tweetdeck rocks my boat
0	tweetdeck seems to have died on me  Need to find a reliable twitter platform. Any ideas?
0	tweetdeck seems to not want to work...  boo!
1	TweetDeck supports ??????
0	TweetDeck v0.25.1b doesn't seem to minimize into an icon in the system tray. Argh
1	tweetdeck was being a douche a while ago but we're cool now
0	Tweetdeck was insisting that even tweets without '@' in them were unable to be delivered because 'recipient not following you'.
0	Tweetdeck without mobypicture  - http://mobypicture.com/?vyrz4a
1	TweetDeck! have ur twitter and facebook in one instance   get it here http://is.gd/MeZ #twitter #wolfram|alpha #3hotwords #delongeday
0	Tweetdeck... Huhuhu... My trusty reliable Tweetdeck is failing me today...
0	tweetdeck.com is down  I was looking forward to the new desktop app
0	TweetDeck: Unknown desktop manager, only Gnome and KDE are supported 
0	tweetdeck's being bitchy to me
1	tweetdeck's not updating!! blah better change to the web
0	Tweete going beserk again. Why? WHY?  Back in a bit. More jamming to ensue... ;-)
1	Tweeten Out  Tix deals for NKOTB 5/28 Was $43 NOW *$38 http://tinyurl.com/NKOTBTweetenTixsDeal <-or other SEAT Prices /NKOTB Dates
0	Tweeter Fail! my first Josh Groban tweet. I misspelled his name.
1	Tweeter is cute and Oprah's on it
1	tweeter is like telepathy... almost
1	Tweeter.. yay!  Awesome weekend even with the cold.. Mtv movie awards was simply the best ever!
0	Stilll lampin tho LoL wit da homies in da east dis my last day of fun  hw 2morrow & school nd work alllll next week
0	StiLLL WAitliNG FoR MOM 2 CuM oUttA SURGERY
0	stillll exhausted
0	stillll in the PICU  bt my lil man is doin A LOT better !!!!
0	Stillll sick  thanks bubba
0	stilllll cleaning blue cruisers out of my car
0	stilllll raining
0	stillllll editing
1	stillllllll awake?! yes bitch, i am 
0	StillvSHOCKED about David Carradine
0	Stinkers is in LOTS of pain... got fixed on friday    http://apps.facebook.com/catbook/profile/view/6456054
1	Stinkin' poopy cold weather... My photo shoot cancelled.  Well, laundry and hanging with the family for me today.. a good trade 
0	Stinkin' Rushkies score  1-1
0	stinking thunderstorm!  blew in really fast too....now I get to miss both my shows cause of lightning....NOT HAPPY
0	stinky men are sitting beside me in the jeep  this sucks so bad...
1	Stir fry is sooo good
0	stir fry was a disappointment
1	Stirring around. What is going on today. I'm ready for some fun I think.
1	stitch is eating my brains.
1	STL/CHC goes over 9.5 early in the 8th. Good news and a fitting end to a nice profitable day
1	Stockholm Marathon, 4.08.55 
0	Stockholm was breathtaking.  The Vasa museum was worth the trip alone.  Perfect weather today, don't want to leave here.  
0	Stockton summers give me headaches and bouts of depression  italia on Wednesday!
1	Stoked about my lunch date with tomorrow at Pure Juice & Takeaway!
1	stoked for sunday
0	stoked for the nothing personal presale on glamour kills. i think i need more money though
1	stoked for the zoo.
1	stoked i have a fallower! haha thanks ashton
1	stoked on getting my city and colour tickets.
1	stoked to see Urb 100 feature which is apparently a whole page
0	stoked will.i.ams security guard got charged for hitting Perez. Poooor perez  those fukin wankers
1	stoked with his wife for winning Busselton Half Ironman yesterday - only 2 weeks after her IM China win... go champ
0	Stole a fajita for breakfast.. A is in turkey, it would have gone off.. Is my justification. I have no foods for breakfasting 
1	Stole a road sign last night... how do I give it back? also, full time job to me 
0	Stole and chewed up another item from mommies desk.  I don't think she is too happy .... But I had fun w/it until she took it away
1	stole my mums eyeliner... its amazing
0	Stolen car.  Omg.  sorry rob and nicki
0	Stomach ache and watching Vegas vacation...
0	stomach ache at work >_< help meee  http://myloc.me/2kJy
0	stomach ache suck.
0	Stomach ache today, stupid dodgy tum 
0	stomach ache!!
0	stomach ache!! aaaarrrgggggghhh....i think it's cramp!SHIT!!
0	Stomach ache, also.  Geez, what's wrong with me?!  
0	stomach ache.....
0	stomach ain't feeling so great right now
1	tweeterizing from a mobile
1	Tweeters, help me think of a middle name for Ava so I can send in her AKC registration papers. Please! 
0	tweetfakes keeps losing followers.
1	Tweethearts I follow & who follow me are TWOCKIN' LOL  #LOVE ? YOU! ?~�*???~.�*???*~?~�*???~�*�???* ? ? Thank You! Lori
0	Tweetie doesn't type in landscape
0	Tweetie for iPhone keeps crashing out whenever I attach an image. Tried reinstalling too
1	Tweetie for mac love!
0	Tweetie for Mac seems slow on updating posts, I feel people are tweeting faster than this is updating (nothing in 10 minutes+), API limit 
0	Tweetie for the Mac needs to update faster, or have a preference setting to do so. Sometimes, I'm not even sure if its gone deaf 
0	Tweetie has no growl support  I thought that is a given on Mac applications these days?
0	Tweetie iPhone app has Twitter Trending - desktop doesn't seem to.
0	Tweetie is the most beautiful twitter app, but functional? Not really  No faves, no growl, small compose, no customizing, ... #tweetie
0	Tweetie isn't working well.. it doesn't tell  me when there are new tweets
0	Tweetie keeps crashing when I try to add a picture
1	Tweetie now out as Mac client?? Gleeee. I live on the iPhone app, as I am indeed doing right now. Though I still have love for the 'deck 
0	Tweetie on my Mac is asking me to sign in & is not recognising my Twitter credentials...
1	Tweetie today! 
0	Tweetie won't open on my mac
1	Tweetie's looking pretty good, and working well too! I think i'll make it my main client 
1	Tweetie's shortcuts for new tweets and the main window mean I pretty much never touch the mouse anymore.  Quicksilver = Love.
1	TWEETIES.. i did want to say GOODMORNING to all you early birds..  have a great weekend!!
0	Tweetie---you kinda suck!! I paid $3 for you dammit. Could've gotten myself a red bull with that money. Or a ball to play with outside.
0	Tweetiful people, I am sick. 
0	Tweetimg shall shortly b over..almost there  wounder if I'll get lunch 2day...and what time will I be able to leave? :s o maaaaannnnnnnnnn
1	tweetin from the airport. au revoir, loves. 
1	Tweeting and driving. Not safe
1	Tweeting and posting at TG about BBF... I can't get enough of it... Will watch again...
1	Tweeting declined a bit today. Well, what is everyone doing? 
1	Tweeting directly from my blog... how cool...!
1	Tweeting driving n talking on the phone...I'm so dangerous LOL. About to take it to the casa! But had fun wid my bookie
1	tweeting for Sustainability
1	tweeting for Tihachu
0	tweeting from ally court for the last time.... its a sad sad moment
0	Tweeting from church! Dave's last day -
1	Tweeting from Dublin (: So happy to see everyone! Weathers just the same though :-/ Lol. Girls Aloud - 8 days! Ahhh  xo
1	Tweeting from iPhone
0	Tweeting from my "back-to-life" iMac G5, with some drawbacks, caps lock and tab keys not working 
0	tweeting from my 2009 Camaro (rental  - and waiting for it to Transform... I feel wicked macho
0	stomach cramps; sat in bed with a hot water bottle having some hot milk & toast, i feel like a wi girl again :') minus the stomach cramps 
0	Stomach feels a little off right now. Gonna go get a snack or something. I know what I want, but it isn't in the house 
0	stomach full of alcohol
0	stomach growling. would give anything to be able to open mouth wide and chomp down on a burger, or pizza, or even rice! 
0	Stomach hurts  About to go on any second now...Vermont is live!
0	stomach hurts  ow.
0	stomach hurts a little. my poor cat  she can't go out in the streets cause it's raining
0	stomach hurts again  PrinceCharming
0	stomach hurts and nothing will mellow it out. I tried feeding it. eating grapefruit. drinking ginger tea and sparkling water.
0	Stomach hurts like a bitch! chem regents tomorrow
0	stomach hurts rly bad. staying home sick
0	stomach hurts super badly.i want to crawl in to a ball but instead i have to work
0	stomach hurts, i can't even sit properly 
0	stomach hurts.  i hate exclamation points
0	Stomach is churning from all the obscene greed. If you buy a Lotto ticket, I will be a little disappointed in you.   
0	stomach is grumbling. haven't got my chicken ass burger fix
0	stomach is queezy..tried to get but i HAD to lay back down. ooo this isnt fun
0	Stomach is sore
0	Stomach turning - BP up - epidural starting in 1 min. - IV in. AcK! Needle going into spine.  Send LIGHT, healing, peace please. Gratze!i
0	stomachache is killing mee awrgh i got my period n it's sooo hurt
0	stomach-ache isn't nice
0	stomach's been acting up
0	Stomach's doing that weird thing again. And I feel like I'ma pass out... I need to know what's wrong with me.
1	Stomp the yard! Stomp the yard!
0	stomped all over a beach with his big dinosaur feet. Poor crabs
1	Stone mountain laser show was awesome! Wonderful night with some of my favorite people.
0	Stood Bolton bus station n just been mistaken for a coach driver by a posse of old dears
0	stood on my curlers and burnt myself  then burnt my hand when i picked them up..
0	Stood up on a Saturday again
0	stood up twice by the same person in less than two weeks. i'm sad. thought i was at least a little important. guess not
0	Stooooopid third kitty in the house got sick too!  Guess I'm being clean-up-nurse again...
0	stooopppiddd Abbey National!! i need to get dosh out and its blooming shut!
0	stoopid capped internet, so slow 
1	Stop and shop from 12-6. Come visit me please.
1	Stop and wiggle with it
0	stop asking me  i'm only going to mess things up.
0	Stop avoiding me on weekends its been fucking 2 years now. Is it me or you? Fuck you beautiful friend!
1	Stop being an A**Hole TODAY! yeah you ,you know who I'm talking about 
1	Stop by the Cambridge Bus Stop (Tomorrow 6/16/2009 9am) and pick up a NICE, COOL CUP OF SWEET TEA!!!  **See you there 
0	Stop coughing
1	stop counting stay ~ Steely Dan: HEY NINETEEN ~ forever immortal   ? http://blip.fm/~6t706
1	tweeting from my brand new Sony PSP... just because I CAN!!
1	Tweeting from my new Chinese number
0	Tweeting from my new home... I now live in old room... So not woot for me
1	Tweeting from my palm in love
1	Tweeting from my parents house on my new laptop. It's their old laptop but it's now my new one. I have awesome parents.
0	tweeting from my phone for the first time: having silent inner tantrum - I don't wanna go!
1	Tweeting from new phone. Cool
1	Tweeting from phone
1	Tweeting from sun lounger in my back garden; I like having a house
1	Tweeting from the garden again...and it's lovely
0	Tweeting from this phone is no fun.
0	Tweeting from under the covers! There's seriously a ghost in my room!  if anyone laughs at this I effing hate you.
1	Tweeting in band haha
0	Tweeting in class. Getting bored of revision. But my knowledge is still very shallow.
1	Tweeting in Math class, how fun. 
1	tweeting instead of watching "Talking bout your Generation". Sorry Americans...you havent seen it  (for like the first time!!)
0	tweeting isn't so fun
1	Tweeting live from my bed getting ready for some overdue sleep  I LUV MY SLEEP!!
1	Tweeting off for the night. Have a good night/day
1	tweeting on psp
1	Tweeting under this name TNT... So I can. Say as I feel
0	tweeting using globe 3g. zero dsl connection here. still like twitteriffic more than twitterfon.  limited tweets shown here.
0	Tweeting with the birds cos in my befuddled state left the house an hour before I needed to. Hate that. Being rained on now too
1	tweeting, and going to bed! Up early to go to the dentist...yippie! 
1	tweeting... hehe... it was the first day of some universities' classes but in my case, I still have a lot of time to relax... haha!!! 
1	tweetinq via sidekick 08 -- nOt fOr lOnq miqht switch back tO my Other phOne tOmOrrOw
1	Tweetland...time for bed. Can't run tonight so I'll be up at 6am to do it. Gotta sleep as long as I can. Have a good knight!
1	tweets again  i miss this thing
0	Tweets aren't coming to my phone today, either. 
1	Tweets from this account are from ME (Bradley S. Rees) not a staffer (like I HAVE any) ;-) I'm just me, and will STAY me, win or lose. 
0	Tweets have been so revision centred of late  that shall all change at 4pm on the 2nd June whoop whoop
0	Tweets help i cant sleep.  malem ini campaknya bikin gateeeel2 bgttt the worst deh. Gatel in every parts of my body ! Imagine that !!
1	Tweets I am going to get my  network on and  my boogie!!  Dream Team keep the  GREATNESS going
1	Tweets per day: 0.7 !!! LOL  www.twanalyst.com
1	tweetshot:: Congrats to ted and queena ha!  woooo! Wishing you both a God-centered marriage! http://bit.ly/UDvlT
1	Tweetsound test  - http://u.nu/74b8 #sndtwt
1	TWEET-TWEET: it's summer
1	Tweety Bum  ♫ http://blip.fm/~7fnyc
1	tweety peeps, goodnight  sweet dreams to all :* mwa
0	tweevning is another twitter word XD damn, can't use it right now 
1	Stop following me ok? What ocean isnt big enough for ya? (nemo) lol sorry moods swings accure offten.  try to handle it
0	stop frowning at me blobfish!
1	STOP LOOKING!!!! It's ok - I found a way!
0	stop making those stupid mission impossible movies already too......
1	Stop mentioning chocolate! I have to lose weight.
1	Stop mosh and roll
0	stop raining on my vacation parade.
0	Stop raining or the creek will flood and I will be stranded
0	stop saying lyrics about someone that isn't me  It hurts
0	Stop shopping: http://www.revbilly.com/ you see?! so senile i'm forgetting to add the links
1	stop singing this early
1	stop staring at me! eat your checkers. i love overboard. so funny
0	Stop swine flu spam..thre was a little girl tht died less thn 45 min away frm hre..n people I know knew her. Stop the spam about it plz.
0	Stop telling me to get tweeteradder
0	Stop that ugly noises! Plz!
0	STOP WITH THE DRILLING!!!!!!! Next door are drilling and it's sooooo loud
0	Stop! no more AntiMiley
1	Stop, drop, and roll, baby. You are on fire. -- (Y) 
0	STOP. Hammertime! Literally -- upstairs.
0	stoped textin gary since i found out he had a fiancee en a kid... ^o)  shit one fer me hi. the cunt didn tell me tho :| eugh.
1	Stoping : Ebi - atalmatal ... going to next track
0	Stopped 4 the night in Ohio, not gonna make it 2 Dover race on time 
1	Stopped at another service station  Strawberry and banana smoothie!
1	stopped at hardware store, returned rental truck, went to grocery store for food for today, and haven't touched my car once! 
1	stopped at home to cook dinner; chicken asparagus stir fry.
1	Stopped at the Blue Beacon in Dexter, MI to get the trailer washed out & maybe breakfast 
0	Stopped at the McDonalds Eastland for lunch then back on the road for another 3 hours
0	stopped at the store to pick up some items and debit card is missing
0	Stopped by for their delicious turkey wrap but they're all out of turkey  off to Subway...
0	Stopped by a train. It's 92 degrees outside, and my AC just cut out. HOT....... 
0	Stopped by Madre's house to print some stuff...she doesn't have snacks
1	Stopped by to holla at my people at  #fb
1	stopped following Conor during the twitter war.  AND my C key is broken. Ultimate fail muh?
0	Stopped for a bite to eat just inside county Durham on a dodgy motorway layby. Don't feel safe  http://twitpic.com/7w5zw
0	stopped for coffee at Maryland rest area; so did at least five entire middle schools; just my luck
0	Stopped for Starbucks espresso trufffle on way home, spilled drops strategically down front of white blouse before I even got home. 
0	Stopped on the way home to get breakfast. I'm reaaly bummed out. I thought that today was going to be the day
0	Stopped reading Club Dead to get some work done. I don't wannnnaa.
0	stopped smoking today i wonder how long it will take before i take it out on some one
0	twelve years later, it still hurts. 
1	Twenty minutes till i can sleep
1	twenty to one in the afternoon and just getting ready to hop into the shower - ah, i love saturdays! hi to my new follower molly 
1	Twenty two minutes after one and i'm still awake eating a mini cupcake. Sweet.
0	Twenty20 cricket, beer and sunshine very good. Well apart from the beer cause i'm on tablets! 
0	Twenty-one down....one to go....but as usual ...have left the hardest to last! ...
1	twenty-six days.
0	Tweople, please don't unfollow me if I don't do the green overlay. I _DO_ support democracy in Iran, but this has become peer pressure. 
0	twhirl has problems with its unfollow function  .. tweetdeck keeps crashing on my laptop, dont like destroytwitter.. anythin else outher?
1	twhirl is cool. Saw on Tim O'Reilly's blog
0	twibble's gone all funny, I so want an iPhone 
0	twice just now I felt like puking
1	TWICHASSNESS 09- RED SPEEDOS..the end!
0	Twidroid let me down  back to good old twitteride..
1	twighlight is a trending topic
0	twighlight? kinda. and semi weird talks. ohhhh florida.. we are leaving you tomorrow.
1	twilight  http://bit.ly/BcHRu
1	Twilight - why even I started it!? I LOVE.... Edward!
1	twilight  x
1	twilight and avatar!  http://bit.ly/15y5Dq
1	Twilight and cheesecake bites at 1am. Life is good
1	twilight crew looks amazing at MTV awards  so very proud of them <3333333333
1	Twilight did it! Yehey!
0	Twilight didn't come yesterday  fingers crossed for today
1	TWILIGHT IS AMAZING! THEY ARE GETTING LIKE EVERY AWARD ON MTVMovieAwards  Ahhh I<3TWILIGHT! http://twitpic.com/6dn8k
1	twilight is on or coming to box office on sky
0	Twilight is such a POS movie.. my mouth hurts.. my best friend fell asleep.
0	Twilight Nation, Libsyn fails at life. they are updating billing regulations and space, so the episode will not be up till late 2night 
0	twilight sucks well im off to bed...sadly i dont feel any excitment 4 2mrrw
0	twilight trailer is OMG! btw... can't wait any longer
1	Twilight won in the MTV Movie awards!!
1	twilight!!!!!!! then sleep
1	twilight.. haha. twilight! trending, baby! TWILIGHT! 
1	Twilight..... Team Switzerland but Team Lautner  hwo agrees?
1	Twilight: New Moon trailer looks amazing! cant wait to see it! come on november
0	Twilights gonna win everything
1	twilighttt   kristian stewart droppjng her MTV award priceless
1	Twins game in 55 minutes  yaaaaay!
1	twins itv1 next #tvguru brilliant film
0	twirl wont give me my direct messages damnit
1	twishTJ can you speak german ??
0	Twisted ankle , and massive leg cramp at 6 am this morning had me thrashing around the bed. 
0	twisted her ankle last night
0	twisted his shoulder again while playing cricket..
0	Twisted knee at 3am, spent all night in absolute agony. So much for the 10k tunnel run 
0	twisted my back something weird  Can barely walk and can't sit down booooo :*(
0	twisted my freak'n ankle n dnt know how, damnit. ish hurts helllaaa bad 
0	Twisted my god damn neck! Now I'm moving around like a robot again.
0	Twit Twit twooooooooo I think an own has just pooed on my car! Damn bloody birds so many cars and it bloody picks mine grrrrrrrr!
1	twit twit! good mornin guys! just woke up..
1	twit twit... long time.. Yay.. i hav 46 followers!!!!
1	twit, twit, 
0	Twitaaarrrrrrr goodmorning sunshine.dk why im now getting more in love with him...while i have to forget him
0	Twitlites, I'm bored  What's goody?
1	Twitmorning my lovely friends! I remember when I was YOUNG we'd say God was angry when we heard the sounds of thunder n heavy rains...
1	Twitpic  comes in handy.
0	twitpic doesn't work from my phone  and i still can't find my nintendo DS
0	Twitpic doesnt work in my phone.  want an iphone
0	Twitpic erases my pics at it's own accord  I'm going to boycott it soon, can't keep uloading over n over. humbug
0	Twitpic fora do ar
1	twitpic is back
0	Twitpic isnt getting my messages along with the picture  guess I will just have to update them as I get in at night
0	Twitpic of my pathetic hire car (enclosed sit on lawnmower) when the rain stops & passers by stop laughing at it
1	Twitpic was my sis trying on her wedding dress.
0	TwitPic...why do you hate me?
0	twitpocalypse broke my aggregator
0	Twitt' Mornin' !!! Damn, this mornin is worst than the last... And unfortunately, i think it's gonna be a long day for me 
1	Twitted before going to bed
1	Twitted dance!
1	Twittedific = love  Thanks for feeding my twitted addiction
0	Twittedific has decided it doesn't want to work anymore.
1	Twitter - I'm back!  Did you miss me cherubs!    xxxx
0	twitter -- im bored
1	Twitter - It's So Hot Right Now!  http://bit.ly/3wj1b9 I'm guest speaking, come along!  #IM0509
0	Twitter = amphetamines for your clock
0	twitter and myspace are websensed
0	Twitter and paper toss are my only friends today.  Just had camera talk. Ha!  This will be fun...not, I miss my boys. 
1	twitter and pet society ) multipy too
0	Twitter API dead but website working nicely.. that sorta sucks
0	Twitter API is the bane of my existence. I always run out.
0	twitter app for my iphone has been broken for a week.  iphone updated, no change.  
1	Twitter app keeps crashing...stupid. Night everyone
1	Twitter at this time - As America says Goodnight, England says Hangover 
0	twitter ate my picture
1	Twitter back on. Had a lovely time.
0	twitter being wierd, not saving my updates and i cant find my friends in seatch. 
0	twitter berry.......not working pour moi
1	Twitter bitches. Oh wait yous are just generally bitches 
1	Twitter Brake I Tweet Way ToMuch Lol I Dont No How Log This Brake Will Be But! WhatEvers.MyMood..Hereing.MyIpod.Thinking!
0	So nice to have a relaxing weekend. Now back to reality though
1	so nice to know i have nothing to do tomorrow. a whole freeee day to just do whatever the heck i want!
1	so nice to recognize the spine. must sit up straight, you must! 
