0	And now it rains... bye bye summer
0	And now it's all gone
0	and now its already lunch time... u have just finished with twitter,FB,orkut,gmail..!!! damn.. when will my work start.. 
0	And now it's bright outside... Soo not fallin asleep
1	And NOW it's nice out.. Of course, it always works that way. Oh well. Grad 2009! 
1	and now its time for gym. coke + chocolate + lunch = super boost for gym.
1	and now it's time for some shut eye! good night
0	and now itunes store is down
0	And now I've got a migraine. Brilliant
0	And now Liz Cheney on George Stephanopoulos. These people are messing up my Sunday morning. I miss Tim Russert.
1	and now making sourdough bread the old way: slow rise and baked in the oven in a bread tin - yum - prob like the great-grandparents did
1	and now my FAV song!!!! COLDPLAY  evening is getting better and better...  liking shuffling on my iphone tonight....
0	and now my keys are locked in the car.  What a great day already.  - http://bkite.com/06Foa
0	and now my wallet got stolen. NOTHING IS GOING OKAY
0	and now no one will IM me back
1	and now off to bed after an amazing night chatting with a pretty amazing guy  ( you know who you are)
0	and now on hold with Comcast for 25 minutes
1	and now she doesn't let me sleep
0	And now slimy from the Nivea slathered on the burns
1	as long as i get the message tonight it will be..and even if i do should i make you wait??
1	Howdy!  Marissa here!  Following you on twitter!
1	lol....thank you
0	Thanks. Sadly, he passed away last year. My grandfather (who was a gunner on the USS Alabama) 3 years before that. 
1	Im not trying to replace you...you are my hubby for life!
1	sure! send them a.s.a.p. I have nothing better to od hahaha JK I love messing with new stuff  thanx a lot
0	those are probably mine  me sad.
0	no, I still haven't figured it out 
0	Park... Cutting watermelon, looks like rain is showing up soon 
0	he thinks hes a ninja onstage and done his triple kick flip and hurt his knee
0	Ah crap  those are usually fun
1	whats gooooooooooooooood??
1	 you're awesome Yam
1	my birthday, of course  
0	thought was into the ticket site ...the browser stuck on no waiting time
1	You could very well be the exception to the rule.    Although.. I've been known to exaggerate.
1	9.40 yay   i havnt even typed mine up yet lol, im still trying to find info on prostitution cause itll be funny lol
1	tjip, it's need a feeling and sense, but the more u practise, the more u know ... but I'm not guarantee 100% 
1	happy sunday, tyas 
0	yes well I got scheduled to go to Hugo like all week last week.
1	-- feeling jealous right about now, Mr. Going to Maker Faire... 
1	anything for you.
0	I'm affected, too, but I can't avoid the bluescreen  Maybe I should wait for 10.5.8?
0	I think my favorite will now lose - people casting for Darkmagic before will probably swing to Lookouts
0	yeah X2 closed early (830) so I didn't get to go on it...super sadness
0	no spoilers!! I'm missing it!
1	morning Ty. It's about time you got up.
1	133 bpm please we don't get enough tracks in that range
0	dammit wish i'd requested "I Come Running"  one of my absolute favourite vocal trance remixes of last year!!
1	Love you toooooooooo!!!!
0	thanks for coming to the black & white party last night
0	what is so scary about it??
1	lol yayyy another stay till 4 in the morning  dies jay goin to sleep .. I'm stuck in the laundry
1	I loooove my Sony Alpha 200. Slowly learning the settings. Always have it with me, am quite addicted 
0	aww man we can't talk all the shit we use 2 talk bout breezy anymore  (nothing but good things)
1	 im  on twitter !
0	I really need a Mac. My dad wants the chipin money for the camera. I don't want him to have it, I'm working as hard as I can 
1	Lovely to meet you
0	coz, I dun really have friends anymore here... 
0	And now starts the journey back home...
0	And now the cop gave me a ticket. My poor Boris!  (yes I named my fj cruiser Boris!)
1	And now The Simpsons' Movie. LOL ! This flick changed my bias about Simpsons being crappy
1	and now to sleep  Goodnight & GodBless all !
1	and now you wish that you meant something to somebody else â™« is very good
1	and now! ITS #starwarsday!!!! To celebrate i should watch some star wars  - Richard
1	And now! Noulath left the building  Good Night all. And don't forget to trend #ABUGABU
1	And now, for my favorite part of the day....DINNER 
0	and now, i don't know when or if i'll be able to see THEM again 
0	and now, sleepy... but need to wash my face... remove make-up... 
1	And now, we can see  my Dirty Face ! 
0	And obviously I can't type right now either. *meow* It's to early.
0	And of course I forgot to take cash out so I'm now walking to Manc in the pissing rain.
1	And of course John Oates (off of Hall & Oates) Happy Birthday
1	And of course you can't forget the MILs.   Ernie K. Doe - Mother In Law ? http://blip.fm/~5zm1c
1	And of course, Sterling Silver with gemstones and/or diamonds is now in vogue...some of us already knew this!  
0	and of cous=rse robert pattinson won best breakthrough performance male on the mtv movie awards
0	And off I go. Later tweeps! I'll find time later since I'll prolly arrive here around more or less 10pm and I have to wake up tom at 4am.
1	And off I go. Wish me luckk.
1	And off to pick up Jamie and Kit from tumbling. I could use a raspa after
0	And off to the dentist I go again. They're going to use needles this time.
1	and off we go
1	and off we go. Have a nice day
0	And oh fucksticks, it's fathers day tomorrow isn't it =\ Titty-wanking-shit-potatoes. Can you tell I might have forgotten? 
1	And oh how i love my new phone
0	and oh! fyi, the cimory yogurt is strawberry which i really really like. oh  brothaaaaaaa, why u sooo annoying 
1	and oh. thanks ches for introducing me this.  *hugs
1	And ohh yeaa! Adam, dips, matt i love the shit outta you guys!  and even tho you couldn't make it, i love you JP!
0	and omg exam tomorrow
0	and on a side note...i'm guessing the whole point of twitter is to have followers huh?? that must mean i suck i only have 4 followers
1	And on that note my Twitter peeps, gnite. 
1	And on that note, gotta start 2 work now. Loads of questions 2day re recent activity of Utv_Romania. Have a fab week everyone! 
1	And on that note: I wish you all a good night
1	And on the verge of the vSphere GA release we are configuring a 3.5U4 cluster
0	And on the way back from court on his First two tickets. He gets another. That sucks.
1	and on thursday i'm getting a new phone
0	And once again, no iPhone for me from #trackle or #Squarespace 
1	and once my coffee n drugs kick in its a wrap for this sizzong!!! ooowwwwwww
1	and one heck of a sour throat
0	and ordered them. two for the sunday, nice one! but they've still not came and it's this weekend  oooops
0	and our excellent guest artist Susanna Majuri left Bergen for Helsinki today
1	And PEGI Wins. The Fear Spider Will Be Staying With Us
0	and people who was suppose to tear da stage up with me can't make it so imma be up there by myself
0	and philosophy down the drain, total retake, bummer. 
0	and pizza run - another early night - not good for the food industry in the northern suburbs
0	And plus I lost my tooth
1	And plus I wanna drank tomorro sooo I put a lil extra wizzork in
1	and ps, The Hangover is quite awesome 
1	and ps:Bruce is doing great people! thanx for the nice tweets  my hands aren't fine though, little cuts lol he doesn't like the medicine
1	And Queen Bitch is the second Greatest  #BowieROCKS ? http://blip.fm/~78sqs
1	And ready for action so.....let's talk.
0	and sad  why do some people never reply to you on facebook, but you can see they are online. they hate me 
1	and said thats what she wants to do when she gets bigger
0	And samatha is gonna get so busted for over spending dad's credit card
1	And say okay back when you get that lol so i know you got it
1	and second: the poster - przeglad filmow - Woody Allen - needs to find a place on my wall...so competition with the map of the world...
1	and selling at $150  im helping a fren to sell btw.. And oh u cant get tat price in here..
1	and she loved it!
1	and she meant it. and i can't convey how it moves me. i'd believed she doubted me and disagreed with my choices. i'm a fool.
1	And she said
1	And she said I love you too. That made my day
1	and she said the Stamos hug made her day and she was flustered!  #Tonys rehearsal
1	And she said, "But Nick is also pretty serious, too. And Joe... Joe's just a cute goof... Am i right?" Aww. That means a lot  i love her.
0	And she'll be (sort of) with alex, and her friends, and swimming, and eating!! Ugghhh! 
1	and she's doing it from here other account- ! That's dedication to bigotry if I ever saw it!   (via
0	and she's gone.
1	and SHUT THE FUCK UP
0	And sitting again, not off until 5:45  x
1	and slightly cheesey
1	and so another week begins. this one has got to be better than the last
1	And so begins an incredibly busy week.  Mental note - take the occasional time out to stop and smell the roses.
1	And so begins another work week.  Fam time is great, but sometimes it's good to get back to work 
1	And so castles made of sand melt into the sea...eventually
0	And so hell week begins, Andrew last morning leading and night preaching... then a farewell or final thing every day  moving is hard
1	and so i finish my looong poem story thing for ext eng  pretty proud actually! i'm happy
0	And so I go to bed, full of happy, and slightly disturbing, web surfing memories. Goodnight internets, for I must awaken at 5 AM for work 
0	and so is April
0	singapore... Well, I have some but dun feel like asking them... Heehee.. I wish you are here... 
1	Sundance has a 5:44 am on Sunday for 18 bucks...would be kinda cool.  literally.   If not there, I'd like to play Coyote
0	 Well FINE, Love you too
1	 Yeah I'm up for whatever.
1	oh im down  wait for me
1	I wanna win a cruise trip with y'all!  How freakin' fun would that be!?
1	Only 2 days left for the $75 starter kit...and until the new catty sneak peek!
0	so please forgive me
0	 Hahaha Yeah true. I'll get to 500 someday!
1	thanks for the tweet...
0	longggggggg stupid corny story that I don't even wanna yalk about it. Fuck my life. Tyleeeeee I misssh u and boyfriend!
1	Thanks! Hope you find a job soon!...OH, almost forgot: I landed a role in an indie flick!  My first audition ever lol.
1	omg i thought i was the only one. i swoon at vincent d'onofrio during every episode.
0	Miss You. It was my b day on the 21st, I'm old! 
1	Oke!!....I hope the XL Jersey fits  Thanks for the fast shipping
1	and show some love to Windows 95  It changed the computing world as we knew it at the time!
1	awww thanks soooo much!!!  that's so nice of you! thanks so much for all the support!!! we truly appreciate it!
0	ME TOO! About the throat thing, never eat a tblsp of cinnomon and try and swallow it. It hurts SO bad. 
1	haha, I'll teach you what you need to know. You'll save loads of money  and see as many shows as me 
1	Changing the music. So basically I've had the same music on there since 8th grade without an update.
0	it's not happening until 4 am, i believe 
1	I can be your friend.
0	aww man that bites. I guess i need to go to the doctor then
0	haha no  im scared of doctors and i have no money!
0	no fevers, thank god. But it really hurts just to swallow my own saliva  i do sweat like a madman in my sleep though too.
0	wish i could go to the show tomorrow!
0	right there with you.. went to bed at 2, got up at six, its gonna be a super long day 
0	i want my name
0	oh, that's so sad 
0	sad thing about kickball, I haven't made it to one single game because of work and will miss this one because I am moving 
0	 Do you need someone to talk to?
1	that's amazing about your book! I'm so happy for you  I hope you come to oklacon
0	all alone?
1	Ok, hope everything is ok  Good luck!!!!!!!
0	It's a summer 2007 model, without AppleCare. I did have it checked out by a Genius, who replaced my battery with no luck. 
0	mmm. I wasn't invited.
1	haha this is awesome! Afternoon would be best
0	And so its rains
1	And SO my weekend finally begins. Out to dinner with the boyfriend tonight
0	and so the angry letters from parents begin  i feel like im back at school and i have been causeing mischief
1	And so the day begins...Audition at 10:15 then straight to work. We're getting the paint out today  mischief is probable...
0	And so the last day has dawned on our adventure.  looks to be a good'un. Just packing everything away for the last time.
1	and so the micro blogging begins!!
1	and so the trip ends... we are checking out.. well my friends are checking out as i speak
1	And so the work week begins again. I am not a fan of working on Sundays, but we all have to have our turn. Time to be happy about it! 
0	And so, as returns from work, i must depart 
0	and some apps on gentoo 64bit run even slower
1	And some interesting friends as well
1	and some Monster spaghetti meatballs. YEAAAAAAAHHHHH.
1	and some people are just too kind, people who are willing to listen to anything. 
0	and still, there are things that keeps me waiting. 
1	And strangely enough lots of other 'outdoor' jobs
0	and suddenly hyped for work experience: 10.30 till 6, monday to friday. although there's a heatwave next week so four sweaty tubes a day 
1	And suddenly, boom. The strangest things happenï¿½ 
1	and surfing d net on their machine ..
1	and suspension by mae. fuck, this song will always be good. (i just downloaded a bunch of "oldies") 
0	and talk to him and he does not want that
1	and thank u 2 everyone that check it out http://twitpic.com/5dbon  im so proud of people like n the others!
1	And thanks for the gorgeous flowers.
1	and thanks to everyone who saying im too nice to do that   I love you guys, and I don't even know how to hack!!?!?!?
1	and thanks, , fr. yr congratulatory gweetin' 
0	and that a friendship with opposites is not a good idea at all. that i really need to let her go, even after all we have been through 
0	And that Harry Potter sucks because he rides on a broom.
0	And that makes me.... Defeated
0	and that my tan is leaving me
0	And that sucks, I was hoping that really was Christian 
0	and that was another day without a call from the boss that they have an assignment for me  #bsb
0	And that was goodbye to my home of 2 years. Missing it already.  May the new place cure my heartache.
0	And that weather celebration has lead to an upset stomach
0	And that would be , damn twitter not putting spaces where there should be spaces 
1	And that's a wrap! Done for the day ~ so much fun on set! Kevin Spacey is truly a brilliant actor!
1	And that's how I became ambidextrous.
1	and that's the way the cookie crumble's!!!!
1	And that's what i'm doing...living
1	and thats what makes my life so fucking fantastic
0	and that's why i never got an iphone, how bloody expensive. in a bit of a shitty mood tonight again. balls. 
1	it's gonna be a digital hi. because I'm more near the amsterdam area than the charlotte area
1	morning!!!! or afternoon.... but evening is BAD BAD BAD..... i hope everyone agrees
0	Yes, Yes it does! i miss my other home!!  ROCK IT TODAY!!
0	You may have some shrimp... as soon as you help cut the heads off the poor things
1	hey hope you do well on that test!! Tell us how ya do whenever you find out!
1	Its where you belong tyler
0	the guy mailed me back re:mgmt. r18. all of them
1	been busy, i also haven't seen the last two episodes of lost yet. maybe tonight. 
1	im from Queensland xx
1	|@RSPCA_official might be able to help - or try the batphone! - i think there is a charity for bats too!
1	but only eat 1 & wait a bit, dont eat all 15 at once or the devil WILL visit u & he WILL try n rip yr heart through yr knees 
1	Tyler: Voted most likely to be most normal out of his finishing class! Doesn't look like a tough job!
1	we could have some fantastic discussions  ....when i move there in a couple of years, we'll def. have to talk 
1	Would be great if you could make a #bestcovers Spotify playlist - maybe a collaborative one that people could add to.
1	you think thats bad? Try memorising different species!? lol
1	Done. To my bff: "Hey, can I just tell you how much I appreciate you? Love you tons!" . . . great idea, by the way 
1	Make it  please
1	You're probably like the best/ coolest uncle ever!
1	I tried to test it out but you answered the phone!  That was me who hung up ....
1	wow, that is PERFECT! thank you so much! 
0	i'm sick. and it's one of THOSE days.
0	 you love Relient K too?  yay! haha i love them, they came here in PA but i couldnt go   i was so bummed
0	dang it! i was gonna go cause it was literally 5 minutes from my house
0	I miss you
0	i wont see you tomorrow
1	I'm going to miss you!!!! You are already in my prayers. If you get bored on your 40 hour drive to Canada... give me a ring!
1	and thanks for my nickname lmao.  Listening to music texting my buddies.  swimming pool is done  yay!
1	I think I can identify with that!
1	*literally* it is just finished. I'd be gratified to have a user with as many followers as you, in order to help test it 
0	You know I saw some others as well the other day, I think Mark had them.. can't remember.. too terrible 
0	here in the philippines the thyphoon will come to our house in15 hours
1	I have a website concept planned! It looks good
0	I understand that The Big Bang Theory > Cameron
1	Funny, Dan, the cats just tweeted that they feel the same way about you.  
1	and the 2nd  http://www.designbyhumans.com/vote/detail/55352
1	And the answer was Winchester!
1	And the award for 'Longest Ever Interview' goes to Steve Rudd. This interview is mammoth, I'm on my 3rd coffee ! 
0	And the bad part is that i got to be up by seven
0	'And the black keys never loked so beautiful'  sooo wanna see miley cyrus at the O2 in december
1	and the breakfast is toast
1	and the celebration begins! and by celebration i mean the most low-key birthday in the history of 19-year-olds. but excited anyways
1	And the crowning glory of the week is a sales meeting in Southampton. Travel not involving planes.
1	And the Da Vinci code is AMAZING, 30 pages left to go.
