1	Used to be a lector in church (Catholic). Was asked to substitute "God" for any reference to "Him" or "He". Wouldn't do it. Early rebel.
0	used up all my staples making a junior mint heart.....oh how disheartening
1	Useful science at last! Ha Ha I knew it was true - Man Flu Exists  - http://news.bbc.co.uk/1/hi/health/8047321.htm
0	useless fecks...Well i suppose i'll spend my night writing more of J.U, and reading Twelfth Night...Quite wanted to go bowling though  FUB
0	User <> Designer. An User shapes "things" according their own idiosincracies, some unexperienced or bad designers too... 
0	username changed from to Seems weird! Kinda got used to T&J  but think that it's probably for the best! #fb
0	Usernames: K_Con and KCon were already taken...
1	Usha Uthup is singing ' Ente Keralam'
1	usher here i stand..best song on that abum to me..thats just my opinion
0	totally craving for ice cream at 2 am
0	Totally crawfished on her brother
1	totally decked out in a fashion scarf and v-neck  going to hit up some stores.
0	Totally deflated! Just checked ticket prices to Kenya - they have gone up about ï¿½100 since last week
0	totally didn't sleep last night and thar makes me sad. mark farina may not be an option tonight. only bed.
0	totally different games.. I like more shooting & war games. I'm re-playing GTA & Fable due to 3 red ring thing & everything's gone!!
0	Totally dissapointed about my dad. Turns out that he doesn't trust me enough to let me go to my gradparents to Poland this summer.
0	Totally down after my hospital visit  please god! Fix me
0	totally dreading tuesday! geography revision is failing and latin prose is just scary
0	Totally dredding today - Today is injections day
0	totally dreding exams studying!!!
0	totally exhausted!  not a good night last night
1	totally exhausted.  very hard day.   good night tweeters
0	totally failed that english thing this morning.
0	totally feel like crap, def. getting sick... refuse to be sick on my birthday 
0	Totally feel like I've been drugged. Ugh.  Going to a baby shower at 2 and straight back to bed after.
1	totally feelin it....i think?!?  ahhhh friday+nice weather+relaxation=AMAZINGGGG <3
0	Totally feels like i just got punched in the stomach. I feel terrible
1	totally fixed my computer.     when is it?
1	Totally forgot here's an English palm tree   http://twitpic.com/6v4mx
1	totally forgot about shutdown day ...and ended up using my lappy for few hrs. I need to be more determined for the same
0	totally forgot about this crowd's gig last friday  http://vimeo.com/2725174
1	Totally forgot I have a pot of Ben 'n' Jerry's 'Caramel Chew Chew' in the fridge mmmmmm
0	Totally forgot it was Matt Bellamys bday on tuesday  </3
0	Totally forgot that I was in a wreck last night. So depressing to remember that your car is busted up
1	Totally forgot to mention that I'm wearing the Wolford Twenties today.  And yup, I still love 'em.  
0	totally fucked up ^^ . in my oppinion a day needs 48 hours
0	totally fucked up maths today  now, to conclude my speech which i was supposed to do yesterday...
1	Totally going to Bumbershoot this year!  Off to go clean, ha, joy.
0	totally gorgot about mothersday, again 
0	Totally got crushed in my softball ball game.  AND I got hit by a pitch.  Right on my arm. Ow
1	Totally got the credit card back!
1	Totally grateful to my friend Andrea
0	Totally have the hickups right now
1	totally in love w bc she bakes cookies and read the Twilight series
0	totally in support of a re-count done by an impartial faction for the Iran elections. freedom isn't free
0	Totally in the editing groove... at 12am
0	totally isn't playing habbohotel right. and totally didn't get "banned" temporarly for sexually harassing people  play with me!
0	using (var me = new James()) { james.DoWork(); } // I'm disposable
0	using (var me = new James()) { james.DoWork(); } // I'm disposable  #meCode
0	Using a dying social network is kind of like being the last one left at a hot party  http://bit.ly/ajblog
1	Using a more O.O approach to these forms, busted the mailer logic out to a separate class, it seems faster 
0	Using a round foot rest as a step stool isn't the smartest idea... Owww
1	Using a translator for my Filipino homework. Don't you just love Google?
1	Using Amanda's computer, Yay  Just one more day and Dad will be gone.
0	using blip.fm, Opera Browser dies every 5 minutes on Ubuntu  
1	Using Chrome (pre)alpha for Linux for all things Google - a long forgotten perform  - and FF3.5 for browsing - a long forgotten perform
1	using chrome theme in FireFox. It looks smart
1	using facebook and myspace
0	using foul language is disgusting didn't anyone ever tell you??? like your mother?
1	using get_iplayer getting loads of videos
0	using her loptop  my  computeeeeeeeer is sira. tsss.waiting for sachi
0	Using IPhone3.0 with 1st Gen. No A2DP, not so exited 
0	using laptop, can't use my desktop, it won't start i think it's broken need to reformat -.- 
1	Using lassekongo83's new visual style for XP, its approach matches my current bright dark mood (yeah, paradoxical.) http://bit.ly/v9fgc 
0	using mcdonalds wireless - vmware guest and local os each have their own 50mb limit, locked mac address...? but no outbound ssh 
0	Using MSDevStudio, RMB->"Go to Declaration" on Menu::CEntry::~CEntry in Menu.h jumps too SaveData::CEntry::~CEntry in SaveData.cpp!  #fail
0	using my brothers G1 phone.. love it! driving to vegas... my phone died this morning and my charger broke
1	Using my cousin's lappytop.
0	Using my hand as a hammer is really unenjoyable. But that is what i wil be doing for the next 2 hours
0	Using my most recently acquired robot to clean the carpet, ..where I tracked in mud. 
1	using my new desk - ok my wife's new desk - it's nice having some place to use the compy other than the couch
1	Using my sleepless time to peruse New Stuff on RYFO Network! There's always something New & Interesting there!
0	Using OWA in iPhone Safari browser is not cool ... I want my exchange mailbox to work
1	Using RemotePad. This is so cool!
1	Using rybka3 on my Mac with the help of cross over and Scid, life is great! 
1	Using seesmic
0	Using sister's laptop to surf. Using mobile sites because I exhausted a lot of bandwidth yesterday and today.
1	Using that profile photo of mine you said you like
0	using the computer,no one online in my ym 
1	Using the laptop and listening to Radio One
1	Using the lenovo that mom brought home from the office. GO TECH-Y TIME!
0	Using the L'Occitane lotion that put me in hives on husband's dry skin. Him: "Don't rub that on me. I don't wanna look like you did."
0	Using the mobile internet (i.e. m.gmail.com) is the only way to get online on my grandparents' dial up  #fb
1	Woohoo!! Aparently being treated to "a boot full" of a popular brand of malt loaf today following a job I did yesterday!  mmmmm...
1	woohoo!! I'm tweeting!! hahaha I love my new phone!
1	woohoo!! our comp still doesn't have internet connection, but.. computer shops saves my day!! wooh!! 
1	WooHoo!!! My new iPhone shipped today!
1	woohoo!!! today is going to be a good one.
1	woohoo!!!! My laptop's internet looooves me again   ..Watching silly soaps with Grams and drinking my GreenBerry Shakeology shake..mmm x
1	Woohoo!!my not so "wee" umbrella from Scotland is found-thank you mr. Baker of the comissionaires desk at 111 Sussex
1	woohoo,  im in a pure bliss type of mood. ha.
1	Woohoo, got an email from my very excitable-sounding supervisor at the Nagasaki city BoE! 
1	woohoo, i finally got Ki today! 
0	Woohoo, it's almost not cold... 
1	woohoo, just beat ass at typeracer...once. 
1	Woohoo, my kidlet is off to camp, I'm at home alone for 2.5 days (except when work).  Will not be answering phone so don't even try. 
1	Woohoo. Welcome to hurricane season everyone.
1	Woohoo.. The Da Vinci Code on Pro7 this evening  #OTR
1	Woohoo...it's the Bank Holiday weekend - huzzah!!  And Fudge is getting better - double huzzah!!
1	Woohoo...woke up at 7am, but I am finished. Everyone keep you fingers crossed I receive this scholarship 
0	Woohoohoo,missing my cousin Noah.  Noah,Noah.I miss you and hahaha,it'd be better if I have those people: and noah
1	woohooo just joined Gevalia.com to get a free coffeemaker, carafe, travel mug, & 2 types of coffee  HEAVEN
0	WOOHOOO! 150th UPDATE!  roland's nawt here 2 celebrate
0	Woohooo! I did get a nice apartment! Can't wait to move in but have to wait like 1.5 month
1	Woohooo! I lost 6lbs since my last weigh in. Operation "Get It Right Get It Tight" is in full effect
1	WooHooo! Naomi is AWESOME i LOVE her! Were off to the safari park today! TY naomi!  <3
1	woohooo!!! 20 followers thanks guys   now where are yas????
1	woohooo!!! Thank You God for the abundant blessings You be store upon ed me
1	Woohoooo xD Slept like 5 hours or so  but had breakfast and Aly and andy just left. Kai, Tiffy and nicki r still sleeping xD Kickass night
1	woohoooo! Anoop is in the house!!!
1	Wool, time for the top cote 
0	Woolworths is now B&M Bargains, and not a HMV as promised.  Makes Home Bargains seem posh in comparison.
1	Wooo #downloadfestival lineup! #wearetheocean wooo opening Sunday!
1	wooo 2 new followers hey guys thanks 4dat. hws u
1	wooo 500 followers! thanks so much
1	Wooo 'Benidorm' is coming on now! Omg it's so funny  xx
1	Wooo cant wait for MTV Awards
1	wooo curly hair for partayyy
1	wooo day of fun tomorrow  Auction followed by pub followed by BBQ and games. OH YEAH!
1	wooo Diversity at least did deserve to win
1	WOOO DIVERSITY WON BRITAINS GOT TALENT
1	wooo going to see night at the museum 2 tonight..  i am still a MUUFFIINN!!..
1	Totally jamming out in the car!
0	Totally just broke my flat iron! Ugh.
1	Totally just got breath tested!! First time EVER!!!
1	Totally just made me a batch of chocolate crackles
0	Totally just skid all over the road.
0	Totally just squirted shaving cream in my mouth cause i thought it was faced the oher way! Ick
0	Totally just tried to go to West 6th and got lost
0	totally just washed the heck outta myy caar... home by myself and bored
1	Totally kicked my 15YO cousin's butt in smash bros.  Princess and Olimar power FTW!
0	totally lame move i burnt my hand
0	totally let down  #fb
0	totally looking forward to getting ready for an hour
0	Totally loving the sun and warmth.....to bad crappy weather is on its way tomorrow
1	Totally loving the weather
0	totally luvin the sun1  gonna miss the final 2nite
0	totally missed big bang theory finale
0	Totally missing the beach  I hate packing! http://mypict.me/2Ywq
1	totally my style hahhhh  http://bit.ly/8SwId
1	totally nailed that exam! 2 down 2 to go!
1	totally nailed the alien in mass effect
0	Totally narked with my recent barber experience. Far too short for comfort  He *was* bald; maybe he hated my flowing locks? #sigh #grr
0	Totally not excited about working til 10 tonight and then again at 6:45 tommorow morning
0	totally not feeling good right now  feels like a docter apointment is coming
0	Totally not ready for work
0	Totally on hold for 15 minutes and when I tried to check my battery life I accidently hung up...
1	totally on staceys twitter
0	Totally overslept  Oh well... Time for the gym
1	totally passed that exam. oh yeah, im a BAD ASS 
1	Totally practicing my karaoke chops on So much goodness.
1	Totally pumped for the 2009 CMT Music Awards... you better watch AND take notes.... there will be a quiz
0	Totally regrets not going to senior week
1	Totally relaxing today...reading, catching up on dvr'd shows, possibly a nap... 
0	Totally seeing it in 3d- waiting an extra hour for it though. Got pwned in guitar hero arcade in a freak nerd encounter, too 
0	totally shocked at the death of such a good mate
0	Totally sick and on a bus to Disneyland. None of my closest kids are on my bus.  But I do have a great group of kids at least!
0	Totally slacking on the working out  Next week will be better
0	Totally slept on this whole Facebook username thing. Now THIS GUY has my URL  http://www.facebook.com/winstonford
0	totally still sick! Unfortunately, cable gets boring after the first 48 hours of Swine death  back to broth and theraflu...
1	Totally stole the Twittascope idea from  hope he don't mind <3
0	Totally sucked in our games today. We better play well tomorrow
0	totally sucks my girlfriends asleep and I am wide awake
1	Totally sunny day! Luuuuvz it
0	totally tired, wish I had gone out and instead I was up but because I have neighbours who are, well to nicely put it........thoughtless 
0	using the mouse too much gave my right hand massive cramps.
1	Using the word "tiemz" even if ironically = instantdeath 
1	using trainer
1	using tweetdeck
1	Using Twhirl's saved search term feature to pull in #cfobjective tweets regardless of whether or not I follow the folks....I see it all!
1	Using twitter berry! Weee
0	using twitter for teh first time and that too from office... waiting for other members of car pool to be free...
1	using twitter to follow people..  haha!
1	Using twitter with itouch.
1	using wikipedia instead of study books - no reason to complicate things unnecessarily
0	using xbox cntrllr 4 keyboard. i think buddy 8 the keyboard dongle...
0	USPS finally decided to update the tracking number on my Red Faction order. It is in my home town! but wont go out until tomorrow
0	USPS lost my package of sisterly love  #fb
1	ust got a text...........Why's it not a good ideato give a womaen over 70 a smear test ??? have u ever tried opeing a Cheese Toastie
1	UStream over, and my gosh was it filthy. I CAN'T BELIEVE YOU MISSED IT! 
1	Usually don't like flash sites, but this one is good  http://snipr.com/j9t7u
0	Usually I am really productive on Tuesdays, but not today. 
0	Usually I love B&N but sometimes they seriously suck.
0	Usually I really love my job and all of the customers, I guess that yesterday was just one of those days 
1	Usually im a night owl...whats up with this zonked by 12 crappola? Gnight my fellow tweeps
0	usually my obliques look killer! Not lately tho!  Fuck
0	Usually reading in bed makes me sleepy, but it's NOT WORKING. I have to be up around 6am. This is bad. I'll finish my book at this rate. 
0	usually when im gone celebs come on its so unfair
0	UT has ended! Finally! Buat there will be n0 internet c0nnection till 5pm.
0	ut oh! Tanya is grounded!
0	U-Talk: last year... i was caught cutting classes by my teacher.
1	UTC & cast you were such a blessing 2 us. P.K's we love you. (Joey, Marcos,  Lil Fernie, Destiny, Lil Sister Mayes   See u Y-Convention
1	utd 2-0 up - league title looking pretty good now
0	ut-oh, pain, flashing lights behind my eyes ... I know this party and I don't like it one bit ... migraine coming on fast 
1	utoh...kels i wanna see you w a tan
0	Utterly exhausted, but can't sleep. Curse you jet lag. 
1	Uuff! I can't study any more! is too much! I need sleep
0	Uuggggh i'm soooo boooored. i wish i had more friends  loneliness kills.
0	UUGGGH! cleaning my house...again! i hate dishes they never stop!  i totally want the robot from the jetzins (i think thts how u spell it)
0	uuggghhh!! all my friends just found out what school they are going to and i am upstate with out the letter!!!
0	uugghh my feet hurt!!
0	Uugghh my polka dotted dusty car is killin me! On site car wash was mia at work today!
0	uugghhh bout to knock out driving to tj 2morrow
0	uugghhh...no more boookkksss!
0	Totally wasted money when I coulda bought JB's album for $3.25 on iTunes. I think I might just go buy the cd now cuz I feel so dumb.
0	Totally wasting my admin rights in the project sharepoint  gotta_rack_brain_n_do_some
0	Totally wiped out!!! I don't want to work an 8 hr shift tomorrow!!
0	totally wishing me + ray j tonight  pshhh someone should come with me.
1	Totally!!!  and I <3 gambit. Glad they made him awesome (and not with a french accent)
1	Totals look correct now! I am so relieved
1	TOTALY DONE!!! recording some vocals today and theeeen: all american rejects live...man this gonna be awesome!!!!!
0	Totaly sick
1	Totaly smell like camp fire now lol its gross to feel the dirtiness but the smell seem to just relax me  i wonder why:S
0	Totattly wasted a Saturday getting drunk but the burrito from the great lost bear absorbed all of it sooo going to bed soberish.
1	Totoo kayang c ashton c Hehe.. Curious
1	tottally watching the MTVMA  !! awsomeness.. congrats you looked beautiful & you deserved that award! xoxo
1	Tottenham - Newcastle 1 - 0!
1	Touch down turnaround! Listenig to hellogoodbye, Demi lovato, and the script 
1	touch me t-touch me baby but dont mess up my hair!
0	Touch of food poisoning tonight  Not sure what set it off.
0	Touch of the heat exhaustion.  Not so much fun
1	Touchdown in ATL. The lap baby didn't make a peep, the entire time. 
1	Touchdown los angeles.
1	Touched down in Stockholm. Enroute to the client. bright & sunny, Just like me ... 
1	touching heaven
0	Tough decision.  Should I get a Mac Pro and have more power or a Macbook Pro and have portability.  Sigh...Why can't I just have both
1	Tough love advice: grow a pair and ask them out. Thanks K.
0	Tough Love just broke my heart.
0	Tough talk w/dad abt his inevitable divorce, #family court+custody battles. Signs that my !BDSM "lifestyle" might be brought against him. 
1	tough times dont last but tough people do  have a great day, all
0	Tough WoW raid tonight. Amazing how much the group's skills and 'cohesiveness' has slipped since the last big dungeon  #warcraft
0	toughcustomersi'm so nervous for  you are brave! my thoughts are with you
0	tour passes not happeneing  unless i fly to sydney for the all ages show but dates clash with year 12 exams. FREE! arghh
1	tour?! dates posted soon
0	toured a beautiful building today in Old Town with lovely condos. Too bad they're out of her price range.
1	Touren Lexus ( ESP Off )
0	touring boston college, boston university, and northeastern. flying home at 3 
1	Tournament baaaaby  Played Badminton since Thursday! FUN FUN FUN
1	Toward Secure Services From Untrusted Developers: http://bit.ly/G04FY
1	Towel finally dry shower time!
0	Tower over me. (8) everyone does anyway.
1	Town boring as usual  but it was fun
1	Town Today  Jordan And Blondie In I Thiiiinkkkk
1	Town today with the besties fs!  sun sun
0	uugh !! so i seriously need to update this
0	uugh englsih, science & french listening exam todayy :S glad to get those over with though (: R.S, Maths & another french tomorrow though 
0	Uugh ii jus ate 3 slices of pizza..I feel fat  I feel liiike (Thrown it ï€„ ;(
0	uugh super bad day
0	uugh the 101 is fucked up
0	uugh up way toooo early. SOO sick last night   still not feelin so hott..in bed, all day?
0	Uugh...Hte bein sick peeps
0	uughh,. nothing to do! 
0	Uuh bed , tomorrow's final school show FML. 
0	uuh i have headache..
0	Uuhhh I'm still tired, I don't wanna work.. 
0	uuhhh, maybe I shouldn't have had the lasange!! feeling a bit stuffed now!! I always feel this way when I have pasta!! please help???? 
1	uuhhm .. spending time by reading Glam Girls
0	uumm....  .... Being Single Again Doesnt Feel As I Thought It Would ... Work Flow!
1	uummm i just figured this tweeter deck thing out lol sorry if i didnt reply guys...i'm on it now though!!!
0	Uurgh, city tommorow 
1	Uurgh.media exam.at least i can sunbathe afterwards
0	UURRGGHH CANT BELIEVE SHE DID THAT.. ON THE WAY TO SEE MR.LAWSON..  SMH
0	Uurrgh. Not enough sleep. Washingmachine chap may arrive in an hour though so have to be presentable.
1	uuu...just made my twitter...wooohoo...looks cool...
0	Uuuggghhh these back pains are effin killin me!!!!
0	uuuggghhh! my god! what happen to DSL! grrrrrrrr..
0	uuuggghhh... my body hurts... especially my ARMS!!!!
0	UUUGGGHHHH this Laudry will never end!!!  I've been doing it all day!
0	Uuuggghhhh today is not a good day 4 me
0	uuuggghhhh work  this sucks ... damnitman
0	uuugh i miss my boyfriend a lot
0	uuugh no twittering this weekend  text me bishes!!!!
0	Uuugh, that migrain still in my head. 
0	UUUGHH I had to get off the train when I reached the GOOD part of the novel: his childhood. mboo
0	Uuughhh...I'm so disappointed in myself today...I've been doing so well on my diet & I blew it...Damn Mother's Cookies for being so good
1	Uuuugghhhhhh i want to watch New moon RIGHT NOW!!! i can't wait any longer
0	uuuugh...how mad am i that blink182 has not posted a tour date in MD or in DC....very very very sad right now  Work all day..flags owns me
0	uuuughh why is everyone gone and/or busy?
1	uuuupdated.    So we meet again, 3 am...
0	uuuuugggggghhhhhh so much work to do
0	UUUUUGH!!! I HATE I MISSED INTERVIEW!!! I WASNT AT HOME!!! DARN!!!
0	UUUuuugh! Can't watch The Spirit, video has been removed  But IronMan was gooood I may have to buy that one day!
0	Uuuuuugh! Im tiiiiiiired
0	uuuuuuuuugh still ill. have avoided WoW today though so thats progress. Work not rly happening and exam TOMORROW.
0	UUUUUUUUUUUUUGGGGGGGGGGGGGGGHHHHHHHHHHH why can't i friggen sleep? work is going to be mighty difficult 2-morrow.
0	u've forgotten about me..;__; Ã¶h...
0	UW lost  its okay they can get it back again later tonight! hopin the Ms can hold this up!
0	town tomorrow = window shopping cos im broke
1	town tomoz wiv mates after our exam in the morn for 4o mins  mine and sophyees icecreamf ace xD pmsl
1	town was mean last night!
1	Town, work, music ^^ , friends, Telleh!   SLEEEEP  Maybe a movie. All in a day's work!!
0	Town. Uncle and Gabriel are coming in. I miss Gabe  Tempted to ask if I can go back to Baton Rouge with and stay with other side of fam...
1	Toy Selectah and Uproot Andy were amazing in Toronto tonight. The club was rammed and dancing and happy. Mexisound massive.
1	toy story 3 ??? wha?!
0	Toy Story 3 and Cars 2?   The effect of Disney owning Pixar.  Hopefully it won't be straight to DVD quality
0	Toy Story 3 teaser trailer is up on youtube, but it wont be released until june 18... 2010!! thats soo far away 
1	Toy Story 3 teaser: http://bit.ly/evtut
1	Toy Story 3 trailer http://digg.com/u14urk -> nice  I likes
1	Toy Story 3 trailer posted!! AHHH! I loved Mr. Potatohead in it - haha  http://bit.ly/26zea4
1	TOY STORY 3! I AM IN LOVE ALREADY
0	toy story 3!!! but all the way next year...
0	toyo ito was in berkeley and again i missed another starchitect.
1	TR Just say what you're doing or what you think. It's a fun way to interact
1	TR   I hear that - Just took a while to learn to listen to what I was hearing
1	TR yeah, it sure is. Worked nights, so gonna crash now for a while. zzzzz 
0	TR Wish I coulda heard your rendition of Margaritaville.
1	TR - thxs so much for the special #followfriday - very appreciated & right back atcha!
1	TR    Thanks for the follow     I followed back
0	TR is not going to be happy. I think it doesn't help that they reply to these people  goodbye nincommunication
0	Trace TV, stop showing the Clean Version of Paparazzi 
1	Trace027Have look... i'm now on 211 votes http://bit.ly/fP04b you are now 212 votes
0	track and field tomorrow. I'm going to fail
1	Track awards was so fun  I love how our pictures turned out too!
1	track side tomorrow testing Stock cars on the road course
1	tracking vox for a new song as we speak.  get ready for "Descend" in a few weeks!
0	Tracy can't believe the drunken facebook party I missed.  damn applebees forcing me to leave the computer. http://tinyurl.com/c2gpkc
0	tracy chapman probably never eats bad stuff
1	Tracy is on her way over. After that, I'll make her some chicken enchiladas and then we're off to see Terminator! 
0	Tracy No rain today - it went right by...  Good thing someone invented water hoses! http://ff.im/46LVZ
0	Traded her iPod for my brother`s cellphone. My phone died, e 
1	Traded with this morning  3 of her rusks for 3 on air mentions of the website!
0	Trademarking is so expensive. Ughhh
1	UW SOFTBALL NATIONAL CHAMPS
0	uwawauwa.. that was very dissapointing..
0	uweekk! no more fb access!
1	uying my mum a green day ticket for her birthday
1	Uzlabots otras puses meklÄ“tÄ?js, viss ir kÄ¼uvis Ä“rtÄ?ks, Ä?trÄ?ks un detalizÄ“tÄ?ks 
0	v annoyed. both movies I chose for tonight (Matrix or STNG First Contact) are only VHS and machine is not hooked up anymore  now what?
1	V Factory was great.  And so was Without Watching. Ahh, I had so much fun.
0	V friendly and sweet student used homophobic language in submission to school mag
1	V is preparing for an awesome Re-Vision student night tonight with DJ Chris Connor. Â£1.50 drinks!
0	V ok, now I feel really dizzy and sick. This is not fun. It feels like death 
0	V poslednÃ­ch pÄ›ti dnech sledujÃ­ exponenciÃ¡lnÃ­ nÃ¡rust spamu ve svÃ©m mailu
1	V, edited by me.  http://twitgoo.com/78mp
1	V. Excited, packing for Hay festival. My inner nerd is sated 
0	V. has left to go meet up with some friends. So very bored. Gem won't even entertain me
0	V. sorry to everyone I've just unfollowed =(. But its just impossible to keep track of my fave tweeters when I'm following 150+. Sorry!
1	V... why dont we hang out? i need a drunk night like those incahoot days  minus the aussie bmxers and jessie hahaha
0	v.annoyed at domain parkers holding domain names I want to ransom
0	v.sad I had to bail on the party  stuuuuudy!
0	V?a bï¿½ d?y kh?i gi??ng. M?t quï¿½
1	v0.9.5 is ready, repository watching is now implemented - from here on it's just polishing for v1.0 
0	VA Beach on yesterday... Had soo much fun with our family n friends and hate when we have to leave
0	VA beach soon! But now were stuck in traffic!
0	Vá»«a lÃ m 1 hÃ nh Ä‘á»™ng giáº¿t ngÆ°á»?i, giá»? pháº£i kháº¯c phá»¥c háº­u quáº£ 
0	Vá»«a má»›i tá»« quÃª lÃªn, Ä‘áº§u cá»© ong ong 
0	Vaca is officially over  Gretchen and Chris Hotell's wedding was the best ever!
1	vacancy starring kate beckinsale and luke wilson gonna watch it  fariah lynnnnnn rocks !
1	Vacation coming up
1	Vacation day
