0	Digg: Pogo Stick Fail [Gif]: He tried to do a backflip.  http://digg.com/u152BZ
1	Diggbar (which is awesome) should not bring me random websites I've already dugg. Otherwise its really cool!
0	Diggin' her new do. Boooored though.
1	Diggin' this song today   ♫ http://blip.fm/~7qfsd
0	diggin thru old winter coats looking for roaches or old sacks
1	Digging and turning up stones all day!!  #asot400 Good leads know more REAL soon!  http://www.THECIRCUITDOG.com.  FIRST in REAL news!!
0	Digging everything but the character limit. I feel censored, or like I'm editing a college paper that has a page maximum. 
0	Digging in to my soul jazz collection in an attempt to cheer myself up. I think it's working a little.
1	Digging the glasvegas album.... the dude is a dead ringer for Joe Strummer (minus the Clash
0	digging through boxes before its given away tomorrow our garage sale  sad
0	digging through invoice.scm to get more decent #gnucash invoices - customizations beyond the provided mechanisms are cumbersome
0	Diggy is half my age and got on my hat
1	Digiqom welcomed new team members in the company today
0	Digital transitioning gave me free porno.
0	digsby ate my tweets
1	Digsby is working at school! YES! Now i'm back on MSN
1	dil se.. another of my favs... created for a performance  - http://filesocial.com/e8cfa
0	Dileme over.... kinda. My sister just told me her friend won 2.5 million on wednesdays lottery. Shame they aren't BFF's.  Jealous tho.
0	dilemma. so there is meeting, dinner dayi's house, erjie's bbq, CIRCUS SG RIVER all on sat night  so which one?
0	dillon just called me a twitore  aka a twitter whore
1	Dilly-dalling around!1
0	diming the lights again, glowing inside again.. rocked. its sad to see a band with so much talent breaking up 
1	dimples in the lower back . .thats where my thumbs at
1	Dimples... are beautiful. glad I have them
0	DIMSUM in AN HOUR  YEY.. in the mean time. gotta complete all necessary documents for a damned room
0	Din dins time woop. Keep falling asleep  so goin for a sleep in the sun by the duck pond haha good times
1	berharap kampanye pilpres damai !!  http://plurk.com/p/xlaxl
1	Berkeley and Brad had a magical adventure. And will have many more. it is our destiny
1	berlin this weekend!!
1	Berlusconi troubles cloud Italy poll http://is.gd/RW3q Something about publicly pious conservatives who may privately be bad
1	Besides 80% of my updates have been for these cats out here hating on my Orlando Magic! They're going 4 a title I'm going 4 R-E-S-P-E-C-T
1	besides drowining myself in the Da Vinci Code -- which, by the way, was awesome!).
1	besides feeling sick...some things have made me feel particularly happy
1	Besides once I get a recurring role in this tv show I won't be doing hair much longer after that. I wanna go out with a bang!
1	besides pachas madness, the lakers  won last night-woohoooo-im so glad i stood my ass home with the hubbers-we had a safe quiet night 
0	Besides, Da Vinci Code sucks...
1	Besides, I could use the exercise of the hike through the Ikea maze 
1	besides, the company was beyond excellent !!  
1	besoooo with my loves  its gonna be a good nightttt
0	Bessiee thinks she likes someone
0	besst frannn crann!!!  its empty here. hahahaa trixie says hi. GreenDay<3
1	Best act won BGT by far I reckon!! Awesome performance
1	Best advice a good friend just gave me: Never take a job that doesn't scare the CRAP out of you.
0	best and worst onscreen deaths in cinema; but no Mulholland Dr.  http://tinyurl.com/olvqoq
1	Best bday ever.... Bday party, then dane cook, then ptown bars! 
0	Best birthday ever. Untill the house sold.
1	Best birthday weekend ever!  what a beautiful day it is today. Pink tonight, Barcelona on Wednesday!!
1	Best blog post I've read today   http://bit.ly/46Jjt
1	best body shot of my life! hahah and first
1	Best boyfriend ever award. Brad weber. Thanks for rubbing my back and putting up with my crankiness right now. Love you
0	Best buy cut me deep, i paid for the tv but i won't get it till saturday  Mr. Bungle
0	Best Buy Mobile to get some Pre stock on June 7th �-�Engadget $1000 for unlocked phone   I better stop thinking about palm pre
0	best buy no longer has 5D2 on sale
0	best buy. i need a new portable dvd player... my dad broke mine  boooooo and i have 6 hours in chemo manana... boooo
1	best class, best class, 8n is best class 
1	Best damn costume at the party!
0	BEST DAY EVER ♥ ahhh, i wish it didn't have to end 
1	Best day ever hanging out with my man!
1	Best day ever!
1	Best day EVER! I love Canberra. Kelly and I are keeping the details a secret til Wednesday, where we will reveal them "happy things" 
1	best day ever. first day of summer and i have lines
1	Best Day Ever.! Got My Jb Concert Tix Today! Their Freaking Sold Out For The 19th, 20th, and 21st:0 
1	BEST DAY EVER...see, if you just hold on long enough and the tide will always turn! 
1	best day i've had in a long time. very happy clients. Should I stay home and get some needed sleep in? nah lets go to mollys.
1	Din with the parentals-
1	Dineke has brought in some stroopwafels!  Currently warming mine over my coffee cup....yummy
1	Ding-dong the witch is dead...well fired anyway
1	Dining and watching the soap opera
0	Dining in Hendersonville. Mana Rosas closed on Sunday  so..... Barefoot Charlies it IS!!!! All good.
1	Dinner & a movie  Watchin' the Hangover AGAiNN!! Yessss
1	dinner & cool springs CARNIVAL with friends -- 'twas an amazzzzzzing night!
0	Dinner & shower time...then back to revision  5 days left!!!!
1	Dinner coffee bean with K
0	dinner dai bai dang, then next day air...im dumb ass full. & 2day i was suppd 2 start "doing good". im like the lil engine that couldnt 
0	Dinner almost ready...shouldn't have had that snack, now my tummy is feeling bad 
1	Dinner AND a movie???  that's what I'm talkin bout!
1	Dinner and dancing w/the girls. Good times
1	Dinner and drinks at BD's Mongolian Grill with the girls
1	dinner and drinks with my girls
1	Dinner and drinks with the birthday girl then out comes the pony tail- letting my hair down...I've been a good girl all week
1	dinner and movies tonight wifffff nicole
1	dinner and pinkberry
1	Dinner and Star Trek on IMAX with great company tonight.
1	Dinner and Star Trek with friends tonight. Aw yea.
0	dinner at 9pm isn't a good idea
1	Dinner at DDMA! Tonight- Hot Dogs!
1	Dinner at grandma's house
1	Dinner at manpuku now! Cant wait for the food to arrive! Pictures time too.  - http://tweet.sg
1	dinner at my brothers place
1	Dinner at Portland city grill with 15 people !!!!! Hope the check isn't fatter than the wallet
1	dinner by the beach with jake
0	Dinner Date  .... This should be interesting! Damn the rain mang I wanted to sit on the patio
1	Dinner date with Maybe this will help me cheer up.
0	Dinner done and time to sleep - hate it when my holidays are gonna end -  juat 2 more days to go
1	dinner done. boys doing the dishes and getting settled into the house! Newport is beautiful
0	Dinner eaten, ribroast overcooked, choclate fondant was crap! No sauce inside  Now dyeing my roots, then paint toenails, what a life, lol
1	dinner for 4.25... can't beat chinatown
0	Dinner in Bexley with the inlaws
0	dinner is done. daddy is happy. life is good.. now, back to greenwood I go. 
0	dinner is not agreeing with me!
1	Dinner is served  if u hungy, stop by the crib
1	dinner last night was good at least   http://bit.ly/v7DOl
1	dinner made, and carrot cake almost done 
1	dinner over and one in bed now how to get the others to go
1	Dinner party just wrapping up. The ex is asleep... in our double bed, after listening to some emo Indonesian music. 
1	Dinner party was great!  Happy, full clients that is what I like to end my day with 
1	Dinner party with new roommates was fantastic! I also love that they are into dinner parties
0	crap. it's raining hard! maybe i'll just stay in!
1	Crap. I've been here all day still dont understand how dis site works. My alter ego ... er ... Kazumi? Can fix this!! Peace out  x Luv ya!
0	Crap. Just remembered I forgot to blog tonight.  Maybe tomorrow.
0	Crap. Left my badge at home, I think. 
0	Crap. Left the library book & dvd sitting in the car. Gonna have to put on clothes to go get them.
0	crap. makerbot class status "No more tickets available."
0	crap. my jaw is hurting like crazy
0	Crap. My mom is giving me a really difficult time about taking a year off school. Oh well. I don't want my sister's education fund.
0	Crap. Sister's home. Which brings on the migraines and suffering. *curses everything* There goes my starting the models today.
0	crap. someone stole my last pack of superthin.  now i'm hungryyyyy.
0	CRAP. Still  miss them.  )
0	Crap. There is about 25 schools buses here.
0	Crap. There's a hipster judge on the plane and I'm not being cool
0	Crap. too tired to do all I need to do now, 
0	Crap. Troubleshooting a client's email server wasn't on the agenda this afternoon  Oh well...
0	Crap.. i ran out of cappuccino
0	Crap... School tomorrow  Better not miss the school bus.. Be well annoying if I do
0	crap... wht the hell... this website has a prob  i decamp, depart, retreat and retire...
0	Crap.... I think I'm getting sick.  looks like I'm not getting out of bed anytime this weekend other than to go to work. Moviethon in bed!
0	Crap......I have a ragin cold now
0	Crap....got nothing to do
0	Crap...already broke the view on my phone for Twitter...now I have to figure out how to fix it.
0	crap...i really dont like the twitter hit thingy...     dont use it!
0	crap...just found out tomorrow's showing is sold out..guess I'll have to wait until next week
1	crap...safe for work = sfw = i can't speeeellll
0	Crap...supposed to be 107 tomorrow.  Not the day to try the serve ice cream to the entire school outside.
0	Crapp!! Berry is running out of battery!!  but I think I lost the charger. I don't remember where I left it. Boo!
1	Crappest day of the week today. Meetings & more dull & tedious meetings. Will have to take it extra easy the rest of the week to recover
0	Crappy crap weather today
0	crappy day
0	Crappy Day...
0	Crappy internet connection interferes with vids  Buffering...
1	Crappy Monday - I need more COFFEE!! And my mom says I need a Secretary... but then I'd have to *pay* them... What shall I do??
0	crappy music on the radio
0	Crappy paper: check, Extra credit: check, Three more finals: Not check 
0	Crappy start to the day. Need some cheering up music but the iPod isn't delivering
0	Crappy traffic, it pisses me off  http://yfrog.com/11ng8j
0	crappy weather   at least the next 3 days are supposed to be sunny
1	crappy weather but the days going well so far so good. although ny hair needs to be straightend again now
1	Dinner party with the gaytourage
0	Dinner plans didn't work out
0	Dinner plans utterly nukes by sick childminder and sick children-to-be-minded. Bah. Double whammy upset. In, no supper, mopping brows. 
0	Dinner prep delayed. Meat hasn't completely thawed.
1	Dinner re-scheduled 4 mananana..my girls wanna go 2 Mexico cuz Jamaica is $$ & 1 is goin with her boo in oct.she did research & no swine!
0	Dinner smells good, but i feel sick to my stomach 
0	Dinner then giving a voice lesson.  Missing the bf
1	dinner then starbucks with hil and colleen!
1	dinner time already ?  here's to a good week everyone
1	Dinner time! Back later, Tweeple! 
0	dinner time. ear still blocked.
0	Dinner time. Man my legs are killin me
0	Dinner time. We're low on funds so we'll have to scran on anything we can find.  New songs sounding great! Make sure you get tix for tuts!
1	dinner time. yea baby! haha! i'll be out for the mean time. be back tomorrow tweeters.
1	Dinner today is at Etta's ... Pic of the salmon for  http://twitpic.com/4yog4
1	Dinner tonight = out
0	Dinner tonight is baked chicken with italian seasoning and light mayo. Not sure about this recipe.  Need more salad  frozen veggies it is
0	Dinner tonight was teriyaki pork tenderloin sliced onto an asian salad.. YUMMY!!! Need lunch options... lately not eating... not good
0	dinner tonight with good friends, boo it's raining  Columbus on Saturday can't wait!
1	Dinner tonight with my family  then hopefully funn!!!!
1	Dinner w the fam then hang time with the girls
0	Dinner was chicken and rice after a cereal bar.  But then I ate the rest of my chocolate covered blueberries.
1	dinner was delicious - now planing our trip to italy  this will be gorgeous ;)
0	Dinner Was Good  Dont Wanna Do History Homework
0	Dinner was good. Went back to hotel past town hall to see the lights, but telecom were too cheap to keep them going 
0	dinner was gr8..nw wnt to multi-game bt no bro..  so gnna cntinue wth surfin n dwnldin apps..
1	Dinner was great! I have missed my college roomies.  Got home and boys were dismantling a door so they could play beerpong. wow.
0	Dinner was gross. Took forever and tasted like dog food. It was probably nice, but i hate food. 
0	Dinner was just ok.  Had the mussels as an appetizer, followed by the chicken stew. The "stew" was like a pot pie and WAY too creamy. 
0	Dinner wasn't as good as I thought it would be.
1	Dinner went well  .....Just got done gettin dressed! heading out with my lovely sissy!!!
1	Dinner with mary mac's
0	Dinner with and then off to the company party in Greenhills. I feel sick!
1	Dinner with & her rommie Erin tonight. Yum!
1	Dinner with and  Gbye!
1	Dinner with all the girls, gonna be so much fun! 
1	Dinner with Blake and Gio. It's tough having two boyfriends.
1	Dinner with family
1	Dinner with friends, great food, great people. 
1	best day i've had in a looooooong time.
1	best days of your life-kellie pickler i love the video with
1	Best decision I ever made was to have my daughter when I was 16. Saved my life. Happy Mother's Day to all Moms + extra love to teen moms.
0	Best Drama Banquet EVER!!! Still wearing my glow bracelets. I love you guys!...senior check out monday
1	Best food ever tonight. Now I really need to go to the gym. Planned my fairytale wedding too  party hopping tomorrow ha
0	Best friend is leaving to go back to school today..I am so sad
1	Best friends are a treasure, but friends... MORE THE MERRIER!! 
1	best friends birthday party tonight!! yay! i looove being in Nac with the best friends ever.
0	best friends, why do you have to be grounded? 
1	best friggin day ever thanks to jared   that hug made my day (LL)
1	Best fucking movie ever yes  go see it!
0	best get ready for work
0	Best Get Up  Off To Class At 11 Grr
1	Best idea ever! Peanut butter AND syrup on pancakes!
0	Best idea for art came to me. but i cant work on it now. ppl are sleeping and the scanner is really loud.
0	Best iPhone OS 3.0 feature so far: email server search! Worst: I lost my YouTube bookmarks during the update and had to redo em all
1	best lakers game ever . going to bed. im about dead..its been a LONG weekend..sleep tight my dear tweets. peace out til am
1	Best load of muffins so far  Appleby Cheese & Chive scones next on baking list, together with chicken Biryani for tea today.
1	Best lunch ever!! Balance bar and sfrb. What more could a girl ask for?! Thanks ro
1	Best makeout song, evah!   ♫ http://blip.fm/~7h6hh
1	Best moment of the womens FO final:  Steffi Graf coming onto court for the presentation.
1	best mood today
1	best movie evaaa  too cute, russel reminds me so much of josh, r.i.p. bigboy i love you
1	Best Mr OU competition ever. Congrats big black & beautiful and thanks for making my day
0	Best nap ever. Now up again watching intervention, sippin on Barcardi lemonade & writing this paper...I'm gonna miss this come July. 
0	best night evah. teeth hurt  but I don't look THAT awful with braces
1	best night ever! Got to spend the better part of half an hour letting off fireworks
0	Best night ive had in a long time, wish you didnt have to leave 
1	best night i've had in a long, long while 
1	Best nite ever! Ahh cant wait to do it again.. GRADUATION my nigga!
1	Best nite.. Evah! Haha. If it's as big as u make out for it 2 b u can use ur own mouth 2. Oh I'm so hilarious  hadeha
0	Best of luck for me, I got a flat tire on the highway 
1	best of luck to the Peeps in his new job tomorrow
0	Best part of my day.  Walking my girls home from school. What will I do this summer when they are gone  http://yfrog.com/0q189jpdj
1	best part of that movie was that kirk was a total babe
1	Best party ever! Whole bar did the Macarena. Classic.
1	Best Party ever,Wont remember it 
1	Dinner with Gingey and Daddy
1	Dinner with Kate. Gave her the ear rings  Then Angels and Demons. Great flick. Some Gossip Girl then bed before my last day here...
1	Dinner with mommy
1	dinner with my family
1	Dinner with my family...perfect
1	Dinner with my favorite brother in Seattle!
1	dinner with my meeeen
0	Dinner with my mom and bro at pancake pan O pp..ouch I miss pancake on the rocks   http://myloc.me/48pN
1	Dinner with the family
1	Dinner with the family  in Santa Clarita, CA http://loopt.us/EzrGnw.t
1	dinner with the IT project in Pasadena
1	dinner with the senior hotties in a jiffy
1	Dinner with the young adult group yippeee!! I love having something to do on a week night
1	Dinner, movie, shower... now a bit of reading before bed. 
1	dinner. hw. mtv awards.. new moon trailer!!
1	dinner...going to see "hangover"...then out
1	Dinners almost ready!!  I cooked a roast go me..
1	DinnerShereka, don't hate) free subway  turkey on wheat and tuna on wheat. Mmmmm!!!
1	dinnner/the hangover!/drinkks at meagans  texxt
1	Dinosaur Day. Is this the day they arrived, left, or walked? Boom boom acka-lacka lacka boom.  Walk the Dinosaur - Was (Not Was). ahh.  
1	DINOSAUR IS SO HUNGRY AND HE WANTS TO EAT SOME HUMAN...
1	Dinosaur shaped I should say
0	Dinosaurs have small brains and that's so sad.
0	Din't get any email yet
0	dint go for my sisters wedding because of my exams  *sad* *sad*
0	Dionneeeeeeeee!!!! Where are ya? Wish u were here
0	dioreah is not fun
0	dio's holy diver played on radio. reminds me of my ex-mat.
0	dios mio tanto aburrimiento no puede ser legal!! i need to buy a book! i wanna read something
1	Diplomat is some1 who can tell u to go to hell in such a way that u will look fwd to the trip: I m perfect for it  ... will work for India
0	direct messages disappeared
0	direct them 2 yr profile & follow who U follow or else! Gah! my #ff'll B freakin #fsat by the time I get a min 2 myself
0	direct tv canceled our trial to showtime.  it's a sad day my friends.
1	directing a theatre play
0	Directing traffic at work what a long day
1	Directions please
0	Directors late....  damn him
1	Dirk 42 pts  17 in the fourth alone thats the captain takin his team on his back
1	Dirty Dancing. Lynch edition   http://bit.ly/oL2pO
1	dirty dancing...omg abc family has the best movies on today lol
0	Dirty Projectors are great live...rain sucks tho...
0	Dirty Sexy Money on next! And its season finale 2!
0	dis damn usb charger is good for nothin. gotta find that verizon store. my fone been dead since last nite
0	dis dental surgery is such a pain
1	Dis is my tabby babby  http://mypict.me/2TbR
0	Dis is sum bullshit!!! I'm at ihop and dese bitches eatin all kinda shit!my sad ass sittin here eatin broccoli and potatoes
1	dis iz ma first vomit in twitter ..
1	Best possible thing today: Japanese client brought a translator with her while we figured out her dog's paperwork!!!
0	Best prom ever!!! I'm really gonna miss everyone   Love you Kaylee, Sheena. Kelly, and Belle, we finally made it
0	Best purchases at today at the yard sales: 2 large dog crates ($30) and a refrigerator for the office ($35) didn't buy anything old
1	Best quote of firefly they got boy whores how thoughtfull
1	Best regards from Serbia and congrats for 2mil, 
1	best show of the tour tonight
0	best sleep ever but now its over
1	BEST SONG FROM A MOVIE IS ... Miley Cyrus "The Climb"     XXXXX
0	Best song from a movie winner is .... Miley Cyrus, Hannah Montana not Decode by Paramore 
1	Best Songbird addons extensions http://bit.ly/p4EWt
1	Best team lead ever
1	Best thing in the world... to wake up to my 3 yr old licking my face. LOL. thank you baby..
1	Best to stay positive  Got a secret and brilliant present for Steve, he needs happy in him!
1	Best t-shirt evah: "will work for anime' - Terran
1	Best vendor booth so far at #niri09 ..... Hands down......O'Malleys on Boardwalk.  http://yfrog.com/5hj43j
0	Best way .. By myself
1	best weather ever had a great weekend sun beer bbqs!! was awesome
0	Best weather ever. And my parents are going to sea world... So lucky
1	Best weekend ever- not sure how i'm going to survive the 2nd!  WOOT WOOT backstage NIN here i come!
1	Best WTF moment is :kristen didn't kiss robert . it was my best WTF moment for the MTV movie awards :)))) What the hell is she thinking
0	BEST!!!!! I MISS YOU   ♥
1	BEST. OF. THE. NIGHT  #bgt
1	best. weekend. EVAR. well, I'd say in the last couple months or so. 
0	Best.Day.Ever.  Car overheated and died on the way to the interview. had to get it towed back home. Interview rescheduled for 4:30..
1	BESTBUY * May 26th ..can't wait >> view site   http://twurl.nl/vy4g1t
1	Bestest Dayy Of Myy LifeeeN-dubz Tinchyy Chipmunk Fe-niix Amaziin  x
0	bestfr, i need you  come home soon!!
0	besttt night everrr. i feel like shit and i have a big bruise?!
1	bet on a car on eBay ... 3, 2, 1, mine  Schnäppchen
1	Bet on for the derby.
0	beta site is down right now.  working on it.
1	Beta testers for unibody drives icons are needed. Please send DM with your email. Thanks
1	Beta-ing a friends fanfic.
1	Betavine Widget Competition 2009 results announced tomorrow at Mobile Web 2.0 Summit. Can't wait to see if I won anything with WidgetCity
1	'betcha can't do it like me
0	betcha just left he goin 2 hard rock i wish i could go but i got cramps
1	Beth Henshall thinks marks a belllleenndddd  <3. http://tinyurl.com/mzjf9v
1	Beth is waiting for Rob to arrive
1	bethh_i want too go to  the bgt tour soo bad. i will
0	Beths leaving  byeeeeeeeeeee
0	Betis are relegated  fuuuuuuuuck!
0	Betrayal is the word of the day.
0	DIS WEATHER GETS ME DOWN
0	Disadvantage to laptop on the porch. Fruit flies in my bourbon.
0	Disapointed about some people of my family  ... xD
0	DISAPOINTED IN MYSELF, I GOT NOTHING ACCOMPLISHED THIS WEEKEND BESIDES CATCH UP ON SLEEP  GOD IS LOVE, GOD IS GREAT ALL THE TIME!!!!!
0	Disapointed with the soap awards last night, I have to say!!! 
0	disappointed  Victoria's Secret doesn't have CSU in their collegiate line...
0	Disappointed ! Got put in wrong place on tweeterwall !
0	Disappointed cancelled their concert
0	Disappointed at the female eliminated. The blonds were both MEH, at least she had personality.  #SYTYCD
0	Disappointed by everyones apparent silence so far this morning   Been poorly for over a week so need some major cheering up please!!!!
0	disappointed by Keyboard Cat's appearance on the MTV movie awards.  he's "sold out" to "the Man" already
0	Disappointed by the Landmark.  Away We Go doesn't start until FRIDAY. I wanted to see it TODAY!
0	Disappointed can't go laker parade  last minute stuff came up, damn well hoping next year will happn again so I can go!!!!!
0	Disappointed everything rumored to be in the #PalmPre update was just that, a big rumor... 
0	disappointed for a reason that's too personal but childish..
1	Disappointed- I didn't get to see the show!
0	disappointed i was praying all night wishing Miley would won!  I still love Miley Cyrus!
0	Disappointed in the NCAA Football 10 rosters released today  Every team is very inaccurate. Oh well; gym then studying Statistics
0	disappointed she's not having a roomie outing tonight!
0	disappointed that doesn't support safari  wanted to subscribe for fare alert and all that
0	disappointed that i didn't wake up with a black eye today. we were sure i would after chloe elbowed me in the face on the trampoline
0	Disappointed that my bff is not coming into town this weekend
0	Disappointed that our 5 year old tv has a problem with the convergence at the bottom.  Likely fixable for about $70 if I do it or ++$$.
0	Disappointed that the Mavs made it to play another game
0	disappointed that unable to waterski at the moment due to re-occuring migraines every time I ski
0	Disappointed the buyer didn't even turn up to see my treadmill
0	disappointed to be missing church this morning.  But happy mothers day everyone!!
0	disappointed to forgo cooking workshop for pathetic swollen eyes
0	disappointed to know that I got the Silver Award. I want the GOLD award. I hate being second best.
0	Disappointed to learn that one of tomorrow's guests does NOT, in fact, share a name with Beverly Hills Cop villain. 
0	Disappointed w/Tsukushinbo today; sauce in tempura donburi had no flavor.  At least the service was good. Next time, I want to try Kaname.
0	Disappointed with breakfast
0	Disappointed with Ciara's performance with JT on #SNL ... it was just bad.  A good song was ruined
0	Disappointed with Harper's island. Night, gotta wake up early tmr 
0	betrayed by my own pencil..stabbed me in the hand
1	Better  And hungry, but all the vegetarian places around here look disgusting. I want riiiice
0	better avoid malls these days, or i cud empty my savings and cancel my bali trip this august 
0	better avoid malls these days, unless i cud empty my savings and cancel my bali trip this august 
0	better be off fo now..work alllllll weekend  Bubs will be hear in bout 10 minutes and then i'll get my 'small suprise'...his words...
0	better do my tips for this weekends AFL matches. Don't know why tho. I'm sitting 2nd from bottom... For shame
0	Better dreams last night, thankfully. Hope I was wrong this time. 
0	better get beak to revision now!!!
0	better get to bed - cross country run in the morning, work from 1-5 and 7-9 
0	Better go and fight the cats for a place in ma bed
1	better go. nite all have fun ) soz for my ranting )* puttin on happy face now
1	Better have a text from my favorite person in the morning when I wake up!!!
