0	Stella turned the video back on. Nice one
0	Stellan is in bad shape
0	Stella's ears are causing her a lot of discomfort today.
1	stella's for brunch with the roomies & birthday girl
0	Steo hard 2 look at pictures of my dad  iLUV n god knows how much iMIZ u luv u dad
0	step 4(?):keep promises and commitments...i've been having trouble with this one
1	step brothers is a funny ass movie 
1	step out sweetly  night folks - http://bit.ly/kj1Yk
0	Stepbrother might be coming over soon. have to do stupid math homework. then maybe go swim. school tomorrow  blah
0	STEPH IS A WHOREY UNTWEETING TWAT. >.< she ditched me for her nana, and left me in tour with the boys 
1	Steph is jumping with my sister  to donate google chiltern ms and it's the first link.  http://twitpic.com/68wxj
1	Stephanie Konarski 7 exams down 3 to go  and 1 doesnt even matter . http://tinyurl.com/ma48ma
0	Stephen Baldwin is on here. i wish it was Alec.  give me some eye candy to look at the whole time.
1	Stephen has blogged about the past couple days in his life! Read if you please!  http://tinyurl.com/r95ow7 G'night! Xoxo!
1	Stephen has FINALLY blogged about his trip! Check it out!  http://tinyurl.com/r95ow7
0	Stephen is 18. Idt my parents will approve of him now lol
1	Stephen is taking his mommy and me for tea  for #mothersday
0	Stephen just left,  i miss him sooo much....
0	Stephen's first tattoo!... Makes me want one so bad  http://twitpic.com/89bon
0	stephens gone im all alone  better go then night twitter
0	steph's friday video will be posted today. sorry its late
0	Stephs on her period. Sucks.
0	stephy mad at me
0	Stepped on Stubb in the dark then almost broke his leg off  But he is okay and asleep on my bed
1	Sterling silver & garnet one of a kind bracelet just listed  http://bit.ly/15sFdf
0	Sterling WOULD be at the Grove for Mitchel while I'm in Vegas
1	Steve and i are going to stop at the strip club for drinks  woo hoo
1	Steve Ballmer a Berlusconi  http://tinyurl.com/q2rx4d "Finding the right balance between optimism and realism"
0	Steve Ballmer looks scary
1	Steve from MSI and Lucinda had their baby? Aw yay! Congrats guys
0	Steve is gone! i am still crying and i can't stop  worst day of my life!!!
0	Steve Jobs had a liver transplant  i hope he is very well!  We miss you Steve  come back soon!
0	Steve Martin is so comical! Then again, maybe I think that bc it's 1 AM, storming outside, and Andi isn't awake  Should I sleep? Not yet!!
1	Steve MIller Band - The Joker  http://bit.ly/g9VHi For all the Tokers, Ummm I mean Tweeters Out There! 
0	Steve Wiebe  What was the power outage nonsense?!
0	Steven is mean. He said im dumb and an idiot.  and stupid.
0	steverubel  - Telecommunication - Hardware Systems - Networking - Consumer Electronics ) ...: Elgan says the .. http://tinyurl.com/mkhduk
0	steves in the hospital for a few days, this sucks  going to see him after work today.
1	Stevie Ray Vaughan. Basically, I have a very wide variety of music! I'm very musical. It's a big part of my life 
1	Stewie Griffin .... on Bones ... Breeeeeeilliant piece of television that  Bravo Fox, bravo.
1	Stfu already. - allivictoria: Keep his stuff, and sell it on Ebay!  Cheers!  http://tumblr.com/xay1z5hit
0	STG might not be coming to Australia  They have tour dates in America lined up for the end of June/start of July.
0	Stick in Miserable traffic
0	Stick learning for a scinece GCSE
0	stickam is getting way outta hand tonight. im sorry guys.  i just left. ily! it was fun for a while.
1	stickam.com/sowrongitscourt  my voice is retarted so I'm not talking haha.
1	stickammmm. come talk.  stickam.com/megg_lolz
0	Stickgal decided to stop drawing!
1	Sticking to launch dates kinda sucks. Not that we need more time... we are just done, and I'm ready to show people. 
1	Stiff dicks feel sweet in this little petite.
0	stiff neck and another rainy, chilly day... great start to the week 
0	stiiiil doing PIP but like this is the crappest thing ever  lifesucks
1	stiiill cannot sleeep ugh!... still lving the dublyfe tilll wed  ..
0	stiil feeling shit
1	Stil 's house practicing for the show in Carson! Come thru guys and support Generation4Christ and All else Fades  see u there
0	stil cant find my baby.
0	stil finking bout who she luvs  but unfortunatey 4 me its neva gna happen
1	Stil sore, but difficult to tell if that's just waking up. A trip to gym/swim shoud give me a better idea. Thanks for prayers 
1	Still Empire Hotel Rooftop party... All white joint... It started already! Next up 90's party
0	STILL panera...studying for "mock" board exams tomorrow!! So tired.
1	still the living room, with parents and brother  hahahah em so laughin' hard. Dad is so funny, hahaa. LOL
0	Still work. Boooo! I aint gettin out this bitch til 2am!!! Kill me nowwwww
1	Still music.. aand veryy tireedd,wanna back home 'n get some zzzzz |-) haha.. 
0	still 1 hour
0	still 1 hour 30 min more............office
1	Still 1 week of vacation to go
0	Still 21 hrs till my placebo Album can be legally downloaded
1	STILL 25 DAYS!!  Gran Canariaaaaaaaaaa! I come
0	Still 29 Celsius inside. Hunger is gone because it's so hot inside. And I can't open a window because of that construction site
0	Still 3 more days until my Internet gets uncapped
0	Still 45 minutes before my flight takes off... Going through my mails and stuff, I am really bored 
0	Still a bit sick  But working on 2 articles today
1	Still a couple hours away from being back up. We do thank you for your understanding and promise it will be worth it
1	still a few hours and the first offiicial new moon trailer will be relased
1	Still a lit bit hangoverish :o) listen the new Green Day Album   http://bit.ly/12pno4
1	Still a little cold here, Soph has to wait til mid-June for swim lessons.  She's looking fwd to it, esp diving off the diving board...NOT 
1	still a newbie in twitter!
0	Still a shame that i cannot sync my iphone wireless/wifi with my mac
0	still afraid of the mouse in her house
0	Still aint a pimp.
0	still ain't slept  teachin friend how to drive manual car in a few. shower!!
0	Still alive all the way back to the Philippines.
0	still alive.. pissed that the alarm ruined my sleep.. why would they let a thing like that go off at 1 am for no good reason?
0	Still amazed and pissed of at the same time. Fucking weather, why in the middle of "Head like a Hole"?  #Novarock
0	Still an hour to go... watched the rest of My Fair Lady which I started watching last night and now I have nothing to do
0	still an hour to work
1	Still an insomniac, but now my dog has a gas problem =( thinking about driving to the coast for a nice beach day to myself 
1	still at alex's place. Hannah giggled at me  !!!!!!
1	Still at baby's house. Loving putri's new katie look
0	Still at BIAP   About to go for a run.
1	still at emmas. we jsut took some super creeper pictures! awesome
0	still at home goodness
0	Still at home with bronkit and asthma. Guatemala and Baghdad in the same month were too much for my body  I need to rest, says my body...
0	Still at home.
0	Still at home. J still in pain & fevery.  No one will take my camping spot, including my campaholic mom. Gr.
1	still at melissas house... ur slow melissa!!!
0	still at office, nothing sucks more than making cost reports for management 
0	Still at rehab facility with dad. Not going well.
0	Still at school again!!  wanna go home!!!  xx
1	still at starbucks with ain talking to michael on stickam
0	Still at the airport  bored as hell
0	Still at the dentist. Looks like no BJJ class for me tonight. Boo!
0	Still at the doctor's.
0	still at the effin hospital.. worried.
0	still at the eye docter
0	still at the hospital with my grandma  Sigh...
0	Still at the office working ....  . I swear Im leaving in a couple hours. Hope everyones having a fantastic Saturday!!!!!
1	still at the or. i've seen veins, intertines, tonsils, a uterus.. hahaha love it! 
0	Still at work  but I get off in 30 minutes!!! Wa hoooo!!!
0	Still at work after 12 hrs
1	still at work and getting texts from people on hols. grr
0	Still at work and we are now really quiet  Bored bored bored! Another 3hours to go
0	still at work bored  whoever created boredom...........
0	Still at work for 3 more hours  BUT Ryan came to the store and surprised me with a latte! best boyfriend ever! xoxoxo
1	Still at work not much happening I've got a direcot coming down from head office today oh what fun still only 4 hrs & 32 minutes to go.
1	Still at work so happy I got to stay working at coasters are awsome only when the crew Is awsome 2  alyse aka U haha
0	Still at work!!
0	still at work, wondering why i do this, it's not like anyone for whom i work appreciates it 
1	still at work.  12-hour days should not be allowed on Fridays
0	still at work. feel like a zombie just ate my brains.
0	Still at work. I hope my super fixed the shower today.
1	Still at work. My last appointment in 10 then to hangout with my best friend ever.
0	Still at work.. Can't believe I've got like 3hrs to go yet!  http://myloc.me/4thC
0	still at work.. tired I actually worked all day, didn't even get to see Gene 
0	Still at work...because I am obsessive...
0	still at work...e-filing is great but now we can work till the new court deadline of midnight
0	still at wurk  bad times!!
0	still atemping to get the paint off my nails. maybe I should start investing in *shudder* oil paints.
0	still awake  exciteddd for tomorrow after school
0	Still awake  watching cool in your code on nyc tv. This episode is about Park Slope. Did yall kno yall had a super hero store?!
0	still awake and not because im out having a good time  6 more hours to face time with my cozy cozy blanket.
0	still awake at like 3;50 am kinda tipsy but ive got work in 8 hours  n its sunrise already n i kinda like this girl called beth sum1 help!
1	still awake enjoying some hindi numbers and having vodka with lemon soda at place in Pune. good times!
1	still awake from LAST night...
0	Still awake I I wish I could sleep I am so sick 103.4 fever mo cheer or dance competition this weekend!  I wish I was better! I love you!
1	Still awake lol Finished talking to a really good Brawl player. We talking in SmashSpace.ning.com  Join the website if you like SSBB!
0	Still awake my husbands granny just passed away......
1	Still awake st 1130.  I am proud
0	still awake, and needing a big spoon 
1	Still awake, been watching the recording of BGT!    Very good 
0	Still awake, haven't slept all night. 
0	still awake, was moving my gobs of $ n vampires/mobsterslive until they were down 4 maintainence  what else can i do w/o internet on laptp
0	still awake, with one hour left before getting up to go to work. I can foresee already a long and miserable day ahead of me.  
1	still awake. just finished watching The Black Book with my brother  and now, we are off too sleep lol
0	Still awake. Should probably go to bed. With nothing for Pastor Ken.  I'll be in tears tomorrow. </3
1	still awake. today was crazy and fun and weird and hazy though!
0	Still awake.. missin him so muchhhhh  butttt fortunately, being awake is allowing me to learn new things.. HmmMm!! http://mypict.me/2rAJ
1	still awake...today better be a good day
0	Still awake...whyyyy
0	Still b....y working!
0	still battling fever off and on..I hate being sick  I just want to get up and go
1	Still be tweeting
0	STILL behind  BUT, posted music by Mogwai, Goose and Eels!  Check 'em out http://musicperdiem.blogspot.com  More to come later, promise
0	still behind desk at home - thought I would be saved by dp conf call but no call today so just work
0	still bleak with my iphone.. (which I was totally in love with )..
1	Still blushing about what happened at the awards ) he just texted me &asked if he can take me to the top of the world
0	Still bored  #mcflyforgermany #mcflyforgermany #mcflyforgermany
0	still bored always bored and my muscles are hurtin so proly no riding today
0	still bored. didn't make it to the y, again. stomache still hurts. 
0	Still boring in AZ.. really need a hobby or a work from home job or something. Haven't been this bored since I was teenager.  HELP!!
0	still bugged by the flu
1	Still building http://www.christianmentalhealth.org.uk/ coming along nicely if i say so myself!
0	still bummed.  somebody cheer me up.
0	Still burning the DVD. The first time, it would not play on the DVD player... 
0	still burnt  but my Sky+ is gettin fitted !
1	still buzzing from 's show last night  so ace to finally of seen them! i wonder what today will bring
1	Still buzzing from seeing Star Trek on the IMAX screen. A. MAZE. ING. One of my fave films of all time. Not perfect, but oh so loveable.  
1	still buzzing from SIETAR... thanks to for pushing the old boundaries - boy, someone could make money off a twitter manual... 
0	Still cannot get the hang of Twitter
0	Still cannot open the bloody pictures
0	Still cannot sleep
0	Still can't believe has already left.. Didn't even get a chance for a proper goodbye  unacceptable
0	still can't believe all of the gig posters in the Little Civic have been taken down!?
0	still cant believe her rabbit got stolen
1	Still can't believe I'm opening for the Bangles! Wow. Holy crap. Seriously.
0	Still can't believe Jims dead.
0	Still can't believe kate gosslin hit lean
1	Still can't believe mcfly came on with the jo bros tonight! And were on jimmy kimmel live!
0	Still cant believe suki is gone.
1	Still cant believe that i'm in Smd!
0	Still can't believe that school starts tomorrow.
0	Still can't believe that Summer is officially over...
0	still cant believe that the blue jays came from behind and beat the redsox
0	still can't believe youtube deleted my channel for that stupid Always Sunny tribute video. >:-O i had soooo many views
0	Still can't belive they blocked facebook site!!!!" it's like i checked into rehab baby ur my disease... "
0	Still can't breathe right. Wish my sinuses would clear up. Got decent amount of work done today, hooray. Tons more, so no real dent made. 
0	still cant differntiate bid and offer rates despite countless revision
0	Still can't download 3.0
0	still can't eat through all of the pain.
0	Still can't fall asleep.
0	still can't figure out how to update my status on twitter by cellphones...
0	still cant figure out MMS on her iphone 3G
0	still can't figure this twitter thing out, i can't my background pic to stick and i can't seem to change my profile pic 
0	still cant find any friends on here
0	still cant find any of my friends
0	still can't find her lead that connects her phone to the computer and has pictures to upload from it!
0	still cant find my car keys   god dam it
0	still can't find my david cook cd..  nooo!
0	Still can't find my id and is going to be very VERY upset if I can't go out with my deltas tonight
0	Still cant find my shoes. Now i have to get new ones but the store is in Kansas and i an in Hawaii  <r0@+0@n
0	Still can't find my Twilight DVD
0	Still can't find that phone. Retracing your steps takes alot of work. Finals this week
0	still can't finish my homework.
0	still cant get empathy's V.chat working
0	still can't get in my myspace
0	Still cant get Jonas Bros tickets..dreading facing my niece later on ( I can see the tantrum now). Hope they put on another gig in Dublin
0	still cant get over Britneys and Ciaras performance at the O2 on 13th June! so sad thats its over now  x x
1	Still cant get over how epic 21st century breakdown is! Goodnight now
0	still cant get over how much fun the beach was, i just want to go back 
1	still cant get over the fact that i have a phone that lets you have ringtones now XD and i have filled it with music already
0	Still can't get the hang of this  haha
0	Still can't get the lie thingy to work for me. Am feeling disenfranchised
1	still can't have sex normally. but we exchanged some great handjob yesterday.
0	Still can't make a food baby.
0	still can't print from my laptop due to the inefficient IT "support" we have, it's only been a month... 
0	Still cant sleep
0	still can't sleep  ahh oh wells need more money 2 design shades
0	Still can't sleep  my back is gettin worse....... I haven't hurt this much since I had my kids :'(
1	still can't sleep so i'm watching the wonder that is beauty and the beast AGAIN. beautiful! reminds me of my beast/diamond in the rough
0	Still can't sleep, 3:42 AM 
0	Still can't sleep..missin' my dobby...
0	Still cant upload a pic, doin my head in grrrrrr  
0	Still can't upload a picture.
0	still can't upload my pic  wish twitter would fix the prob
0	still can't use my student email
0	STILL CASING UP CDS
1	Still celebrating winning the double  Glasgow Rangers champions oohh ohhh ohhh ooohhh (8)
0	still chillin
0	Still chillin at home... Boring day so far
0	Still chilling. My co-worker said I have to work.  - off to work!
0	Still cleaning  almost done.. ish
0	Still cleaning dog shit off of my floors from last night...... Yucky!!!!
0	still cleaning from the yard sale
0	Still cold
1	still coloring  having a really good time
1	Still coming down from a FABULOUS day today!! Even if I may have broken my little toe!!
0	Still completely nervous.
0	Still computerless... ::sigh::
0	still confuse how to use this twitter stuff
1	Still convincing a cousin to use twitter! Instead of plurk.
0	Still Cough, too bad 
0	Still coughing... If I don't approve till Monday, I'll have to see my MD 
0	Still couldn't fund a blazer I like that's less than Â£200
0	still countin calories sadly its been tougher than i thought
0	still craving bacon... BUT I guess I have to settle for salad
0	still cries when the Sam dies in I Am Legend
1	Still crushin on Wil Nieves.....yeah...married.  Do we see a pattern here?
1	Still crushing on Justin Timberlake. I'm a sucker for a fella who doesn't take himself too seriously.
0	still dealing with my terrible adnoidtonsilectomy
1	still developing the pro sections - the galleries are getting fullers - thanks everyone
0	Still didn't get my coffee
0	still didnt start those sketches, guess i should start them now 
0	still disappointed.... some people never change   what a shame
0	still does not have any news
0	still does not know what to have my mom get me as pasalubong
0	still doesn't feel good.   i need to feel betterrr.  going out to lunch with justin and ashley. <33 text.
0	still doesn't feel well  come take care of me.
0	still doesnt get this crap
0	Still doesn't get Twitter??? I'm very confused still  (via
0	still doesn't know what to think. Sooo frustrating!!  xxx
0	still doesn't like leaving her mum
0	still doesnt understand twitter
0	still doesn't understand twitter
0	Still doin uni work... got to take lil boy to the doctors for his pre-school injection
1	Still doing Economics revision in the library. At least I talked to a friend about project Natal for a while  I doubt it will be released!
1	Still Doing Grench paper and still getting distracted
0	still doing h/w!! some schools are just soo annoyin!!!(espeicially qegs)
0	still doing his environmental systems work
0	Still doing homework! I am starting to think I should have started earlier! YUCK!
0	Still doing homework.
0	still doing homework.. but I'm making awesome progress... I have a good system going.. but my stomach's starting to hurt again..
0	still doing housework just need to hover the livingroom and do the dishes i hate dishes  See ya'all laters Jack
0	STILL DOING IT!
0	Still doing my homework
0	still doing the Macbeth essay!! its actually sooo boring lol n to make it worse it makes absolutely no sense to me
0	Still doing this fecking SCM assignment! Oh how I hate it
1	still doing: NOTHING. just listening to music in bed, james blunt is on right now. he is SO calm, i like it   thinking alone about life
0	Still donï¿½t understand
0	Still don't feel good
0	still dont feel good   hope i get better soon!
0	Still don't feel good, my throat hurts 
0	still dont get this,  whats up wiv me  :L
0	Still don't have the inspiration for my essay on Spanish culture
0	still dont kn0w h0w t0 use twitter
0	still dont know how to talk to ppl on twitter
0	Still don't know how TWITTER works
0	Still don't know what country to visit
1	Still don't know what to wear tonight, will have to look for something whilst working 
0	still dont understand why the youtube account was removes  not soo happy about it GTG watch some T.V so TTYL byee for now!!
0	Still don't want to go to school. I still feel a bit sick.
0	Still down about that Traffic Camera
0	still downloading ImageMagick. Going to die
0	Still driving home... Should've good to bed when i had the chance
0	Still dying from sat night
0	Still dying. I am very, very ill. 
1	Still Eastre celebration  thinking to go to BBQ but the weather is cold
1	Still editing my desktop edition rant video,  at this rate I will probably end up uploading tomorrow sometime 
1	Still ended up without my shoes last night.
0	Still enjoying the almost nice day out.  Now it's down to +13, and calling for rain...  
1	Still enjoying the win that is the Twilight Zone.
1	still estimating the roof
1	Still exspazzing over last night  ill never forget it  hands down the best concert you could EVER go to!  x
0	Still fascinated with this Air France deal
0	Still fcking sick & my mom didn't wake me up for church
0	still feel exhausted. but i cleane up my room now i feel way better :3 // going to a party 2night but im really tired
1	Still feel like craaaap and like everyone on earth needs to know this lol... Have fun birdies
0	still feel like crap  why ? help me
0	still feel like death.
1	Still feel like dirt, but at least i'm with my sweetie 
0	still feel like i was hit by a train...
0	Still feel like I've been hit by a truck... No fun... No idea why... Kinda freaking/stressing me out.
0	still feel like shit  but tha party needs me lol
0	still feel lyk shit soz ave not bin in touch guys got the tonsilitus  kinda gay!
0	Still feel shit. Not enjoying this in the slightest  At least I get to see all my lovely work friends today, never thought i'd say that...
0	Still feel sick after being ill on Friday  got to go to football soon
0	still feelign a bit sick from how dirty my parents are now
0	Still feelin' not good..  need more panadol I guess..
0	Still feelin sicko!! Damn it got me bad
1	still feeling a bit jetlagged...looking forward to soccer & p!nk concert tomorrow
0	Still feeling awful, I have no clue why, thinking it might be allergies or something.. 
0	Still feeling bad about it  alcohol isn't an excuse but without it in my system then I dnt thnk this will ever happen.
0	Still feeling bereft without my Fudge cat.  It's been over a week now
0	Still feeling bleh... Spew burps and all
0	Still feeling crappy! Soup sounds so good right about now.. Whaa!!!
1	Still feeling energized from this morning's workout
0	still feeling icky today  and it's pouring down rain
0	Still feeling icky...mostly it's my allergies which I can't do anything about
0	Still feeling kinda crappy - not a very productive day     Hope to get over "whatever I have" this weekend and start fresh on Monday!
0	Still feeling like a sieve, Sick as a dog and not even Left4Dead seems to be helping 
1	Still feeling like a woman  But it's better now ^^
1	still feeling like crap but ive got a week off due to study leave  so praying that the weather will get better!
0	Still feeling like crap...
0	Still feeling like crud.  Probably spending tomorrow at the doctor's figuring this out for good!
0	still feeling like s#!t , so ill  wish i didnt wake up so early
0	Still feeling nautious seeing that girl dying  #iranelection #iranrevolution #gr88
1	Still feeling pretty bad today. Guess I tweet less when sick.
0	Still feeling pretty crappy
0	still feeling pretty ill :'( i hoped it wouldn't last all day but it has
0	Still feeling really ill.//
0	Still feeling really sick and can't sleep because of it.
0	Still feeling really unwell
0	Still feeling rubbish. Note to self: swimming does note cure pain, it makes it worse. 
0	still feeling sick from being in the sun yesterday, UGH! 
0	Still feeling the urge to cough from the syrup i accidentally inhaled last night.  Haha.
0	Still feeling under the weather today   Think I'm gonna go find me some chicken soup
0	Still feeling very sick today.     But too much work to do to call in sick.
0	still feeling washed out and drained...I hope I feel better soon
0	still feels alittle sick but i wanna go to alisonnnnnns
0	Still feels crappy...
0	still feels ill  Elevate tomorrow though
0	Still Feels Shitty  Sucks .. But Has To Go To Work Today !!
0	still feels sick but has to get her butt out of bed anyway
1	Still figuring out ad placement! Because I left, um, ZERO notes for myself about what I did. Thanks, Me! 
1	still FIGURING OUT how to do this?
0	still freaking burn bad
0	still fuckin sick  HELP ME
1	Still full after a wonderful Chinese restaurant Neal last night with friends
0	Still fuming over the iphone issue! From my calculations I think I am stuck with smegging 3 until Feb!
0	still gets a tear when Rufio dies in Hook "I wish i had a father like you"
0	still getting notifications about failed backup for a web site we moved 2 yrs ago. No contact info so I can't complain
0	Still getting over Adam Lambert losing  But hey, at least it was Kris who won ! ( Yay 4 the underdog )
0	still getting ready.. steressing out cause i cant find my necklace
0	Still getting really tired really early.... This is why I hate being sick the most  'Night!
1	Still getting to grips with this! Not entirely convinced to use this all the time yet! But am still open to hints...
1	still getting used to twitter.. hmmm
1	still goin' crazy but at least i m going too see my grand parents.. wait for it  it will be Legend... wait wait .. daryy..
0	Still going through the recovery process on my laptop.....
1	Still going thru a slow thaw in Winnipeg, only God knows how to control a flood. Noah was the only one who listened.   lololo
