1	waiting for my mum to come home  so i can hopefuly go out today.
0	waiting for my mum to pick us up! seeing Nanny Doll today,havent seen her for a while! she not well  we'll cheer her up!
0	waiting for my nasi lemak to siap! I just feel so useless that i didnt pack lunch 4 daniel this satsun
1	waiting for my new camera, Holga 135BC 
0	Waiting for my nieces to get here. Too bad its raining. Now i cant take them out to play  ...movie day! ...games!
0	Waiting for my peeps... there are cops all around the movie theater. Better keep my penis in my pants tonight.
1	waiting for my pizza
0	Waiting for my pizza pizza hut.. Its so hot outside that it's making me wanna cry
0	Waiting For my replacement palm pre.
0	Waiting for my ride to get here so i can go to zero hour...ugh my allergies are killing me
0	waiting for my ride, since my tire on the beetle is all screwed up. My poor V.W. 
0	waiting for my scooter(50 N/1974).motor will be refit,bottom be weld and paint again in nightlila. started at 11.3. done in a few weeks 
0	Waiting for my second wind . . . I don't think it's coming.
1	waiting for my shows to come on
1	Waiting for my sister to come home from China
0	Waiting for my son to bring me myspare car keys, as I have locked myself out of my car - Monday b***** Monday 
0	Waiting for my train back home for summer
0	Waiting for my train doors to open. OC line today. Oh, and I'm battling a headache... 
0	Waiting for my train to Amsterdammm! I want april 18th back!
0	Waiting for Natie to come online I miss him.
1	waiting for nephew... so he can go and see his lil Niece
1	Waiting for new TNT triathletes to get to the store after their brick. Gonna teach em about nutrition and the value of Endurolytes in FL
1	Waiting for next to normal to start  does anyone know why there are lawn chairs all over times square?
0	Waiting for October, 23rd.  http://bit.ly/eLimg 
1	Waiting for our pizza with bf. I can't remember the last time I ate pizza which wasn't home-baked
1	Waiting for our resident chef
1	waiting for pansyyyy so pumped
0	waiting for photographer to come to my house now... im soooo sleepy
1	Waiting for Pink Panther 2 to start with the Lad
0	Waiting for pizza couldn't go to six flags
0	waiting for pizza hungry oh n the race is on
0	waiting for pizza to cook.. kinda sucks getting flaked off then having to have a night in instead
1	waiting for pj, toks and pakko  cant wait to see my Godson!!
0	waiting for PRINCES PROTECTION PROGRAM online in English version  so long
0	waiting for public transit sucks when you alternative mode of transportation is unreliable and late makes me late for 8a class
0	waiting for quickpwn to come up for iphone OS 3.0 so that I can upgrade my phone
1	Waiting for Rachel! HURRYYYYY UPPPPPPP
0	Waiting for Ramsy to come pick me and my sis up... Heading down to Arlington to bbq at Jermz house. Nope, not Danas house. She aint there 
0	Waiting for Ryan to get here. My phone doesn't work
1	waiting for sam... see you tomorrow
1	Waiting for Samuel to come getme
1	waiting for sara to get here so we can leave soon. listening to oasis  i am so grateful to have all of my music back!
0	waiting for Sarah to arrive and missing hubby too much for my liking!
1	Waiting for school to end!  TGIF! This week went by helllla fast! Way to fast! I miss may 23rd );
0	Waiting for sims3 to come to walmart....The EA site teases me by telling me its downloadable now
0	Waiting for sis to come back. Stuck outside my house. Forgot to bring house keys.  - http://tweet.sg
0	waiting for sissy to come home and make me dinner. I don't want to go back to wollongong tomorrow.
1	waiting for some sort of entertain ment to pop out of thin air i guess..in other words..im boredddd!!!
1	waiting for someone to confirm if he's leaving or not.
0	waiting for someone to talk back to me...as of right now im talking to people and i get nothing back. not really sure if this is fun
0	waiting for someone to talk to
0	Waiting for someone's reply
0	Waiting for something good to do... Aw i'm not going anymore to watch Jonas Brthers: 3D Concert Experience...
0	I'm goooood!!! Lol.. I wish I was watching care bears  lol how are u?
1	thats a good hope u all have fun sounds like u gunna have a good night
0	I have to be here to sign for it but it's today or tomorrow, so frustrating!  I'm fed up. just wanna go riding
0	Ah, too much information! Please don't give me any more details of hamster porn 
1	don't worry ... You'll be addicted soon enuff to twitter
1	*love* that Natalie Portman film!
1	the guys behind the scenes have been working hard to please you (and the other millions of fans!)
0	http://twitpic.com/5n73j - hey im wotur i met you on myspace.... my country dont sell stuff like that  is it the vide ...
1	Maybelline's Colossal Volume is pretty good, its the fat yellow one 
0	no, blackberry. I don't qualify for an upgrade for 6 months 
1	Almost bought a set of rims from them 4 or 5 years ago. Heard they were the best place to go. My tires were free though.
0	oh damn, that sucks. 
0	ok just saw your pic now that I'm on twitter! love it. dunno why it didnt come through to the phone. stupid phone.
1	good thing we compiling a list of all time raptor hotness  feel free to pour in suggestinos
1	hahaha if I am then I am very proud of that title  GO ORLANDO MAGIIIIIIIC
1	Ding! Grats.
1	Excuse me,Trini bajan handsome man 
1	well our current can kill you
1	im from australia.
1	yes they are! I spent like 6 dollars on them! They had better last this time!
1	yes, it was waving its lens at me mockingly. 
0	*gasp* i'm sorry
1	have a good day, bro! 
0	I didnt work  Ima have to figure it out 2morow
0	 Rainen are you gonna be at the Irvine CA show?? I didn't see you at the Hollywood Pallidium...
0	Don't wanna miss ANY of your shows...you guys kick it! Sad to say...my plane is in the shop...
0	ahh you said meet and greet but I thought you meant after the whole show... Not just your part! Ohh man!
1	GOOD LUCK! GOOD LUCK! You'll be awesome!! So excited to see you next weekend
0	have a blast!!!!  Wish I was in Toronto today.
1	Have an amazing Jersey show! I am sure you will bring it. Ps. Loving the wock the block and other fun lingo
0	heyyyy u guys didnt do that in ATL!
0	Hi guys I love u sooooooooooooo much!!! Its just so sad that I cant go to your presentations  But still U R DA BEST!!
1	i wanna say thanks for brining hiphop to a nkotb show. i'm a hiphop junkie & loose my mind when y'all hit the stage!! thanks
0	I'm missin u guys by a day!! Ill b there tomorrow  butttt see u june 18th with the blockkkkk!!!!
0	loved you guys at Jet! I almost gave up after waiting for 2 hours in 3 inch heels   Oh the madness. lol
1	Man what a busy life you have! Have fun at rehearsal!! Can't wait to see you guys in MA
0	Oh, to be in Ohio tonight ... 
1	Phi was in our sect last nite & missed getting u a set of twins ;) lol Bad DDUB! jk  lol http://pix.im/E2NBk
1	remember "we <3 jabbawockeez!"
1	cause I bought a pass and I need to go process it + yucky weather = no lines
1	Nice! Any idea why it doesnt support Chrome (yet)? They dont like google maybe?
1	just saw your messages. Thank you for your kind words
0	no i didnt i know he won an award but the sad thing is that i couldnt record it
0	nope!no friday classes for me!  BUT,I have 2 work 1  lol
0	I am lost. Please help me find a good home.
1	LOL!!!  You're so cute. Thanks honey!
1	Ditto!!  #mmwanted
0	don't think my hubby will let me join the party tonight, he wants to watch a movie... 
0	I hope so! Cuz I'm not winning crap  #mmwanted
0	I want to win  #theonlinemom
0	that fire does sound awful!  i'm sorry. and yeah, i hate people who are bitchy on the phone and make me cranky. >
1	http://twitpic.com/67ll7 - Aaaaaaahahahahaaaaa!!!  I f**ken love it!!! hahahahah!!!
0	I watched it. Unfortunately my email wasnt read out  oh well mayb nxt time! xx
1	any of my shooter songs showing? waylons boy? like those to~
1	Had a busy day. Nice to put my feet up finally.
1	"My Fav Song, subject to change in fifteen minutes tho!"~ That is a great song.  ♫ http://blip.fm/~7sbh8
0	I tried that with greenday but got told I wasn't allowed near the cd player again
0	I've been in the office all weekend so I'm even more thrilled to be back in it today!
1	nothing wrong with Air, fab band 
0	 i hate that feeling. hey, it's only bank holiday sunday fwd once in a while right!!!
1	hehe yep.. officially 18... yet, you can start whenever you want 
1	I don't know who got it, but I'm practically bouncing off the walls for it. And there's four more to go! 
1	I plagiarize
1	no *still crying* ... but eerrr.. maybe in septembery time there will be
1	u put it back wards!! staht trams
1	hey Thea  you can cook
0	I think I'll be half snoozing today after a particularly wakeful night with the baby. I think she's teething
0	So sorry you're having a hard day. Hopefully you'll wake up tomorrow feeling better. Being a Mom makes everything harder
1	Really? Omg that's awesome!!!
1	maybe they have started but you just can't tell! Watching WSB - far more exciting
1	YAY! Cool bananas
0	you are right of course - I have no time to sort it (during working hours) as I am stupidly busy.
1	That happens alot...Hmmmmm...
0	there is not enough I'm sorry in the world
1	And I'm seriously in love with LiLo and Tina Fey
1	glad you feeling better   ...
0	Oh shit! Sorry to hear that  Hope you're able to find something new, and better, soon.
1	I watched 17 Again today. Didnt know you were in there so I was kinda surprised when I saw you
1	...I LOVE YOU!!!!  You are my American Idol
1	Adam If you have any Noxzema it works wonders. Takes the burn out and heals faster, 100% aloe works good too! 
1	hey!  Are you the real adam? Im confused between you and
1	It should have been you that won! Kris is good but your in your own league!
1	whatever important decision you make, i hope it is the best for you.  you are such an intelligent performer and person. 
1	Wishing you all the best of luck!! You are an amazing man in so many ways. You've inspired me in so many ways. Thank you!
0	true   ...... just get over it e7na still wa5din eldawry
1	... I think the answer to #1 is the fact that people have loosen up a bit (along with their shirts!).     Happy Friday!
1	lmfao.. why u calling me compton..? im glad you know where i be at..
1	BABY!!! I MISS YOU AND <3 YU SOOOOO MUCH!!!! COME HOME!! I wanna see you sooooo bad!!  Call me at 10 yur time.
1	I am always watching you
0	I dont know. I just had my hands out and he walked up to ME and directly gave it to me... who knows. but he is ugly so poo
1	how was your night last night
1	Hope you had a better day than you started out having!!
0	Glad you enjoyed it mate. Any more gigs lined up in the near future? None on the horizon for me at the mo
0	its a sad day when u leave town
1	My moms wouldn't buy me them cause they were too expensive. I begged for months. finally my grandmother sneakily got me a pair
0	That's so sweet! It does suck you never get to see him
1	Congrats on the upcoming one year! Time flies when you're having fun.
1	hehe.. saying there's no saying no.. but 1 night and it would be yes, YES, YES!! 
1	Not bad. A little slow and sleepy for a Monday but not bad.
1	I know, it's a awesome game  Do you have it as well?
1	Hi! How is the artic adventure going? I'm glad that you guys got to Nordkapp safe and sound
0	d00d i just read this i wish i would have seen it earlier my walk was scary  it would have been much better with you!!
1	happy birthday!
0	left nip now looks like a small sideways buttcheek......with its 2 halves lolz....sad but true
1	Yes I KNOW you will  and it sounds beautiful!
0	aww I'm sorry I'm missing it! I'm babysitting tonight
0	I would like to be able to go just to ONE of those
0	It has now changed to the guys in the studios  penchant for loud repetitive drivel
1	i already do such a thing 
1	haha, loving that you get cool makeup people.  post a picture of you in your dress!!
1	have outacted all of em. with priv prctice on break, maybe he wants u to just rest, or maybe u just wanna rest 
0	last day of first day? Can I have a car too? I'm being deported from warm Australia to cold Canada - boo.
1	so true! I love traveling, but sometimes it's nice to be able to go out with friends after my wedding, ya know? 
0	 that's not fairrrrr.
0	spiegelshire they played the song   the one song that I wanted to hear live still
0	Can you get a #bck5 Tshirt for me? I couldn't come.
0	Page Not Found
0	The only way is to use 'mark as spam'. No other option left. We are no so lucky to block every unwanted mail.
0	yea, and takes more of my memory too! 
0	Dude. I've had front row season seats there since I was 13  One less family outing to enjoy. /pout.
1	are you going to be at the elvis week festivities in memphis this august?
0	dear god, he's probably gonna die like phil hartman or from alcoholism    white man comedian curse
0	dear god, this wound/rash/thing on my leg is fucking spreading!!  fuck you 
1	have you heard of arion? he's  4eally good elvis impersonator. ALMOST the best.
1	thank u for answerin the phone
0	yeah I was on my death bed for like 2 days from it too.  but I'm easy today
1	Conrgats!!!  They're picking up on the 16th of June, and I'm about to get baking, so you'll have some freshies 
1	Watch out for bands of Merry Men.
0	ahh, very nice, thanks... good info.  Also, for some reason, I'm unable at this time to change my profile pic... it's locked 
1	and I know what you did last summer!
1	awww I am glad!  I'm sure hubby will be happy too
1	less awful? yay?
1	I like them too! But I am not sure if my neighbours would like them
1	Lucky you,have no neighbours  I saw one yourte display in Budapest last year.Some people making them here in Hungary.
0	my local proxy won't let me download it.  I'll have to go to an internet cafe. Excited about it though.
0	Sir Alan Sugar's Apprentice sidekick Margaret Mountford has announced she is leaving the show
1	bring me the horizon
1	watchout! There's ghosts from Lodi, CA 
1	haha. whatever. you can browse flickr for you bg.
1	fo' sho motherfunky
0	we should meet up sometime. however, i'm busy until late july 
0	no, but my compositions are all in a format that no one but someone with the program can read for now anyways 
0	-- My thoughts and prayers with you & your little one. My gramother had the same sorts of troubles, except she lost infants 2 
1	Thanks for the #FollowFriday love!
1	don't think so, but go ahead 
1	glad to hear things are going well with your pregnacy  Please do keep me informed! I love talkin about babies!
1	I will pray for life too
1	why limit your story to 140 ch. Tell all what is #annoying you at www.iamsoannoyed.com
0	 i know man  when i saw the previews for that show, I was like are you serious
1	what u doing in NY when its so darn HOT in LA and SD
1	the books are way better.
0	Are you serious??? That happened to me last month.
1	I guess, I didn't really mean it as a bad thing. Having spirit is the best thing either of is could have given her. 
0	Unfortunately.
0	what did u expect kate is a total bitch? And damn your workout innuendo!
1	Follow This person is great. And the way they put up their stories is really inventive
0	 back to square one of break up recovery
1	I Miss You ASSHOLE!!!!!!.....Come Contaminate My Life With German-ness.
0	 I have no idea!!
1	my pleasure!!
0	Oh my god!  But I am afraid cases like this are on the rise.
0	They shouldn't even get married in the first place  But ppl feel trapped by societal pressure... sigh..
1	I can see you as Napoleon!
0	Hahaha no he won't be over until later tonight
1	i just got zebra print sunglasses i thought you should know  you would love them husband
1	Thanks for the recommendation. Hope I can live up to it.
0	Yup, Twitter has been having a lot of background uploading issues lately. 
1	gefeliciteerd
1	Gefeliciteerd dude! Have a nice day.
0	omg that is sooo sad
1	the reference library doesn't have caffeine
0	 I can't go on the walk b/c my family's having a "bonding day" lol. But JONAS rocked. Kevin is so cool.
1	i like to joke to my friends about that... that my job is that im ACTUALLY a scrubber !!
1	Same here.  Bring on the weekend.
1	yah, it's a stretch isn't it   Thx 4 that Some high end restrnt just destroyed my insides....I need 2 get right
1	I thought you were going to watch a horse race?
0	... your website has gone missing.
0	dont quit.
0	barely got anywhere with it yet; if i manage to do some tonight i'll tweet u a pic its a bitch trying to hide the brows
1	Happy anniversary! Here's some diet motivation: Thx to my diet--I have went from a size 10 to a 5/6. So keep up that diet!
0	KStew looks miserable pumping gas.She singing I hate myself for loving you to Rob right about now?Sucks to be her lately
1	No Ted, that's why we follow you so you can tell us 
0	why do you hate us ted?  first NR, then MF and now Camilla?  
0	Sounds like SF was v interesting! wish i was there
1	looks like there is atleast a Panasonic Vid Cam
1	the amount of tweets however could also indicate the amount of free time you have
1	whoops what a terrible faux pas on my part. didn't mean any disrespect, Sir 
0	yeah. it's super-crawling speed, alrite. 1 more tormenting week before month-end before the cap, recoil 
1	thank you thank you
1	Thanks. 51 in two weeks now. I think I'm hooked.
1	 Goodnight.
1	Ooh! Is you across the pond then?
1	Thanx, das idd een mooie 
0	I can't believe what has happened it's just so tragic  Also I l thinkTraffic Cops and Police Interceptors are waay better
0	no one knows yet Jules  http://bit.ly/IX4fc
1	... "Have you met our drummer, the lawyer?" 
1	if u need new account with new name, as happened 2 some of us too, then how about calling urselves BANDFROMTWITTER LOL! 
0	I had a seven hour shift. It was the shittet work day ever. I hated it. It was so busy I was going to have a melt down.
1	mmmm, that sounds yummy  haha. who doesn't love fries AND salad?! so the two together is beyond amazing. haha.
0	All I get is random followers who do not seem to have any interest in me whatsoever and I just get email spam.
1	creation & destruction  that's nice! what ethnicity are you?
1	DVR'd last night, missed it, will watch today 
1	haha it's ok I was just teasin
0	good morning...I'm about the same, unfortunately  - M
1	expect replies to the max
0	I will tomorrow probably, right now it's so sore I don't even want to lift my arm 
1	I'm loving life this way as well. I haven't worn pants in a week.
0	I know  its so sad! Are ya gonna miss me? (L)
0	Turn you phone on i have an hour break  x
0	who is Oh and have a nice time  at the Britney concert I'm jealous.
1	 - sorry bout that; note to self: no downloading of porn during podcast recordings
1	tu t'apelle drunk
0	yeah it's here too
1	pls check out 's single Note to God on iTunes or Amazon & play it on the Beat!
1	are you guys having any signings coming up?
0	http://twitpic.com/6bh1k - aww...i guess u guys wont be at the mtv movie awards    but atleast ur havin fun in hawaii ...
0	Why only Ringo and Paul said a few words at E3? What about Yoko, Dhani and Olivia??!! They flew only to move one hand? 
1	I have to say Agnes. Although Leona is beautiful as well.
1	thank you for telling me - God is so good to us
1	makes you wonder of the filling  white cream i suppose? hehehe
0	online is my only option  so glad girls put swatches on specktra, it really helps!!
0	Oh... never mind 24 hours
1	*cough* so do I!
0	Oh, no [b] ... not Wal-Mart ... even in Alabama, I hate those SOBs .. refuse to shop there unless absolutely necessary! 
0	you have not been answering my calls all last night!
1	I read the article online yesterday, took me a minute to realize that I was on Twitter with you! 
0	I don't know.... I didn't know she was being harrassed
0	So sorry to here   pets are part of the family.
1	 Yep, you got it! Burnt orange will abound, the food will be magnificent & you'll have some awesome ribs!  I promise!  
1	of course!  and here's one more... sweet dreams!!
0	Why do you want to cry?
1	Sure have.   I ♥ my cowboy boots! I ♥ alawt of things... ;)
1	Thats the best news ever Luv
1	that's what's good!
1	i would fit right in with my crazy ass ..............................fml lmfao
1	Ordering some electronics components. MOQ = Minimum Order Quantity. SPQ = Standard Pack Quantity.
0	I know I want to DIE  NO HEROS FOR A FEW MONTHS
1	Yeah, go ahead with that one 
1	abt powerful woman - powerful woman uses word 'do it now'!
1	awwww, am here anytime you need me 
1	Thats wonderful  I agree, catching up is always great. Twitter is just great in particular lol 
0	 hope you feel better
1	Hmm... I believe u r still nt too old.
0	hope i can leave the office in time...! not looking good.
0	LOL u should have bought some!  wana munch on smthng sweet..not brownies..but donuts..kinda late to go out
1	ok.. getting there.. is there equivalents for the men? so a senior man will be baba and a junior will be babi ?
0	 how can you dislike obama? he likes mustard! and hamburgers! and basketball!
1	yeah strange.... haha. but yeah. im dylan
1	do the right thing!
1	 Heh!!!! Big up yourself
0	whats wrong
1	My hero's Nemo cuz he has a disability. I have mild Tourette's, so I was thrilled they made him with a bum flipper. 
0	oh dear. hope you feel better soon.
0	noooo  I didn't. Decided to just go to work instead. Especially since I had just got back in town late Sunday night
1	, just FYI , ap tour is doing a survey thing on who should be on next years AP TOUR &i said you guys. 
1	how are you boys?
1	NO YALL DIDNT!! ahhh!! wht about those tatts & piercings you were me about a few days ago, hmm? 
0	, big jern can you just come back to texas 
0	noooo  you're leaving too fast
1	yes thanks you! Everyone is ok
1	Enjoy the family time - take some wonderfully memorable pics
0	I was rained on last time...and it was miserable.  The beach right there and you can't enjoy it.  Plus it's expensive.
0	yeah, I could do it too. 
0	i think it was for a bit..and its supposed to rain a bit,guess what devin !  paul is going to resign at the end oftheyear
1	 If you don't like them because the participants are a PITA,just say so! 
1	yes it is! i was very excited to get 6 hours of sleep last night
1	We need to spread the word about twitter... our goal is to get Eddy on it. I just NEED to know what she's doing
1	About 1pm.  Squeaking?! Hell squeaking?! D:
0	... and Mariah can't dance
0	wat yall doin..?? im bored
1	here, where? In the Church, or in Ottawa? 
1	Thank you for the follow! Look forward to your tweets.  The Bivouac idea sounds amazing!
0	Only the one on at noon
1	glad you like the EP, seems like ago since I made those tracks. Hopefully more to come this Summer 
0	Yeah, CEO interviews are the worst, especially when they're forced on you by overenthusiastic PR people 
1	a pedicure is more productive than decorating neil's chair with gold ribbon, empty tamarind cups and a calculator. 
0	my doctor in CA was amazing.  I wish I still had insurance.
1	another 1,000 followers could we get a 12 vid too?? pleeeeaaaassseee??? 
1	cool dude awesome thanks hope I didnt make u feel hostile lol just asked
1	Hey there Christian! Thought i'd stop by and tweet Hello. Love the tracks on MySpace! Have a smashin' day!
1	lol oh hun someone must tape him walking you!!!!!!
0	so sorry she didn't make it
1	hi guys you were mentioned in my irish exam today!
1	striking resemblance--you didnt  send in a shot I take it....good morning btr Jen.
1	that is one.... uhm.... creative twitter badge
0	and claire is missing in action
1	i almost typed that line, but i decided on this one instead! 
1	hello, John. Tip: customise your Twitter background, so it's 'on brand' 
1	working in the sun,slow going but hot and sunny,quite relaxing really hope all those air cons are working in the offices 
0	Working in Toledo..
1	working interface tossed over the fence for a noon test on Times Square bulletin board at noon
0	working is crap.
1	Working is fun today!  loads of hot guys. Well at least two! ;)
0	Working is Gros
0	working is not fun when the sun is out, and i am so sick of dealing with retarded insurance...argh 
0	working is not fun.
0	Working is not so much fun
0	Working it !!!!!!!! Time of departure not sure
0	Working late at night on a Dell notebook, Dell's quality has gone down hill, warrenty service sucks too, poor people  buy a Mac instead
0	Working late due to system crash. Could be past 10pm
0	Working late in L+T towers, much to do but nothing to do with food unfort 
0	Working late on a Friday, bad times 
0	working late on set; gonna miss silly stringing folks at the Ahtspot Open Call!
0	working late to meet a deadline... i hate this..
1	Working late tomorrow.  Sleep in a bit, gym in the morning, then a nice jog down the Charles. 
0	Working late tonight   there one place i wish i can be at right now !!!
0	Working late tonight.  Not looking forward to it on a friday night.
0	Working late with only The House of Love for company. Just what I want to be doing on a summer evening when I should be out with people
0	Working late yesterday... forgot USB... can't work today!!!  My point: it's not worth it to work hard.
0	Working late.  Time to walk the dogs and its raining pretty good out there.
1	working late.. but yet so fun hearing my colleagues funny song lists
0	working late...again
0	working later. fucking fucking lazy!! i wanna go out & meet my mates
0	working like a bitch as always... dreading to see the amount i spent this weekend
0	working live on the air until 10 tonight, then heading home and going to bed... not feeling well.. maybe a cold or flu.... 
0	working madly
1	Working my ass off
0	Working my ass off, trying to catch up with renewals! Looking as tho it's going to be a long one today 
0	Working my booty off today. Ugh! Up waaaay too late last night to be so bored at work.
0	working my life away..
