0	yikes!  that sucks.  sorry bout that.
1	awww its your b day?!?!?! Ahhh have a party!!! lol and invite me
0	genevaaa! my picture isnt showing up  i dont think im doing it right
1	no you'll be fine
1	Yes, I am! Just came to SP from Rio ^^ Where the party is at? 
0	i miss you
1	Or learn to stop saying "I better leave this out, I'm totally going to use it later today!" (that's me)  
0	 i hope you're better now!
1	He might need someone to help clean him up. I am sure you could provide the assistance he needs.
0	Spambots (esp porn) = tonight's big topic for me ;-) Judging by other tweets ur not alone - U know 'em when U see 'em   NBH?!!
1	Awww that's sweeet! U so love nick!
0	i didnt go  so i guess i'm not one of thoses cousins :*(
1	I advise that you microwave the bread before making the sandwich.
0	get on AIM.
1	 That's our dog Max, he was our first "kid".  My hubby brought him home as a bday surprise and he's been great all along!  
0	I am lost. Please help me find a good home.
1	I'm happy to shout you out!
1	ya, i didn't want to deprive you of that "joy" 
1	"Get over it!!!" LOL  hope you feel better
1	And, unlike iPhone apps, TONS of BlackBerry apps are freeee. 
1	Phew. I was worried.  Don't have too much fun.
1	not a lot!! im bored! My names Crissy BTW lol How u doinnnn???
1	both. but mainly hair
0	Would love to come chew the cud re: GWS8 with y'all next weekend, but probably staying in Spokane 
0	Yes, will definitely be missed  But now I have a good reason to go caching in TX!
0	I'm about to knock out b/c I just realized it's 3am...and I hurt everywhere from batting practice...  :winces:
1	 hi! I was just emailing you - yes, tons of new fans!! Thank you! The piece looked great!!  Only 2 more days till the next 1!
1	Now that sounds really exciting.
1	You're welcome!   Where did u take that pic at?
1	hmm i see a conspiracy in last fridays dj contest ;) I should have bring a jupiler truck for you guys
0	are you on the plane that's been hijacked in Jamacia? Hope you haven't been he'll hostage with a chocolate gun
1	Heh. I think AC Clarke might've labeled dark energy as "magic". Only reason for believing it exists is our eqns don't work.
1	No, I was referring to MY misspelling of "coincidence"! 
1	I think your house would shame mine in the cleanliness contest!  jeez
1	thanks for that...am now following them...love good causes
1	Very good!
1	Heya, Cori!  It's Lyrix/Fizband/Jake/whatevah.  
1	ahh thatsssss awesome i love new york
1	good work  lol **has her DETECTIVE gear on**
1	oh girl, i had to!! it was so Forrest Gump  kidding... what time did you guys end up leaving?
1	tehe, that's the point. 
1	That's a good blog.
1	That's probably what I am going to do, just relax on comp tonight. 
1	XD It's five o'clock here, watchin weakest link, hope you're well  good sleep dear?
0	... Oh yeah!  I guess the trinity of 3 theory is complete
0	Ah my dilemma! I really like LA. Mmph I was looking pics from a year ago to now.. sup thickness!
1	I had so much fun with my bffs and iyla!!  love you!!!
1	yeah I showed you that song
0	 listen to the signs young man, listen to the signs...no gym for you today, in fact nothing that requires you to see...
1	They're gonna love it
1	we'll see....
1	oh ok then i am gonna go and buy one for when i come up there
1	Happy Anniversary!!
0	Oh no, Corinne. I can't believe you meant to send that tweet.  Did you follow the wrong link?
0	i don't know  hopefully in around two weeks. i also have to figure out if there is any way for me to stay on hhi next year...
0	No Fish today
1	We went fishing w/the kids...the kids and Marcel fished while I sat out and studied for my exam!  What about y'all?
0	its sad  Im so glad he is sober now!!
0	wat does he look like?? plz put a pic up of him plz!! i'll do anyfing for ya! i beg of u!  ANYTHING ABBY ANYTHING"
0	I applied it but will put more on before bed. Devastated. It has a pulse and it hurrrrrrts
1	I was laughing at your ongoing problems with long URLs
1	go for it that should be a daily event
1	yea, ain't he the cutest, i put it up cause my bg said happy mother's day, and i won't be a mother with out him 
1	Do it! There are lots of great people out there willing to do giveaways!  You just have to look. I'd do one for you!
1	Oops okay night hon!  See you tomorrow!
1	I love her aprons! Great feature
0	We had one (not built in) and the kidlets broke it.    I need 2 have 2 installed in my vehicle before our next long trip.
0	I'm in need of display stuff for shows but alas, I'm not local! 
1	You are welcome! Anything for a fellow Etsian!
0	Blessed Are The Forgetful Brendon/Spencer fic. It's really well written but not even a hopeful ending.
0	Can't DM as he's not following me.
0	Congrats on the many, many wines. I am off to work 
0	best one of the series so far... hope you enjoyed The Prisoner of Azkaban!! I'm off to my Law Translation exam
0	hey sis! U are u gonna study?
0	no, and i'm doing nothing here! 
0	haha... ian quited  for thecabb. alex is a cutie he not hot for keepers though its all bout alexjohnson & their manger
0	bad news  text me
0	no  i don't have any tickets ...
0	omg we missed browns....................... too late to wake up
0	at least you know now.  #whatsmysection #whatsmysection #whatsmysection #whatsmysection #whatsmysection #whatsmysection
0	I know right.
0	IMY.  are you feeling better?
1	no prob, bby  SKYPE MEEEEE.
0	not funny bea?
0	Asda is further away and in this heat, I fear I will shrivell up and look like a prune. 
1	hey guys  Bean like your tweets man, i saw emulators, Steve Weibe, and Shirt.Woot all in one day! 
1	no worries, i've been watching some of it on G4tv at night. 
1	called at the Farmers Market in the rain this morning, didn't buy coffee, sorry, I'm a tea drinker really! 
0	mm i concur - plus - they arent really keen if i am not studying at a uni/tafe. lame. i love Disney so much
0	mmm unfortunately ive lost my appetite. and being 3 hours away from my family no one is here to look after me. waa
0	At least not in Oerlinghausen: gray in gray
0	you ok?  *hugs*
1	 You are a woman . You can do it. Waiting for our friend Hendrik to arrive in Cph at 15.00
1	Haha thank you  <3
0	Nope. The South American tour ended
0	I know. I'm really pissed that I can't record videos  Are you able to send MMS? Because I can't.
1	 well im going to bed I am falling asleep at my laptop ttyl xox
1	haha  y'all should REALLY hurry up and announce AUSTRALIAN tour dates. it's been 3 freaking MONTHS!
0	i wish i knew  i just discovered it the other day.
1	haha I won't . It's a good thing
1	Hopefully I'll do it myself during lunch
1	Haha fail you dropping the phone on your face, silly. 
0	Yea but I have to go take an American Government first
0	Adios  #OppositeTuesday
0	Northern General or the Hallamshire ?  Rather you than me  Good luck.
1	OOC:  Wow!  Thanks for the compliment!
0	ooc  if you were nice to mrtribble..... LOL
0	my vps is down too
0	I'm presenting at #auremix! I'll be there ... It's who's depressed about not being able to make it.
1	that's something you discard when you build the whole application in one night
0	I'm back up, but I don't have any wine.  
0	 sooo....are you wearing jeans??
1	yo, I live in Jacksonville lets do lunch 
0	no . on tweet deck on the laptop
1	I may steal them from you at MFF if you don't want them.
1	hahaha nobody knows this one! so yeah tomorrow with this one mayne!
1	She says me being a dork is what caught caught heart.
1	yeah.. I agree.. I just woke up and late too haha cause i didnt see the sun coming in thru my window :/ hello kitty tomorrow!
1	True, it doesn't hurt when a game explores a new style. I just loved the crash mode so much, I want it back! 
1	yeah, not sure that's gonna happen, Kidd 
1	Next excuse: I'm too lazy
1	bro broo  why no parties ? parties i fuckign funn >:o
0	hardcore!!! Nothing in Oakland, sorry 
1	nope you were not lazy.. maybe i was too lazy to elucidate it
0	Oh  I haven't had any allergies yet, lol. I'm a freak of nature.
0	not happy wit it at all   . i just got a dm from gerry lol hes going mad sree is still in hes so funny
1	your bitches miss you!!!!
1	Tweet Dreams!
1	http://twitpic.com/67t8q - Fun times! I hope to meet y'all someday!
0	LOL. You are right! Should have been the fajita meat, tho. & I really wanted the fajitas! 
0	 take advantage of it now then!
0	love love LOVE the roboto tee! my boston is a little busty, so it's hard to fit her into shirts 
1	you have a good day
0	ew, you can giggle about it , but that just takes it a bit far with a yucky picture 
1	online shopping! Have had a wonderful idea for a necklace & needs some bits
1	thanks  Its so much fun to make, I really enjoy it  Guess it wouldnt be too good for knitting though LOL!
0	Ummmm- my inhaler makes me feel shaky especially if it happens twice in a short space of time
0	urgh, work? thats no fun 
1	yes that was from falling. Last night I could not move the knee at all - at least today it is moving, but taking it easier 
0	if it's too much trouble don't worry really.. i don't want u growling at me..
0	You can join us if you want! The light bulb in my room has blown. ohsnap
1	Welcome to your new home  *sends brownies*
1	would be a HUGE Mrkt event if true ...going thru my China Solars list
0	oh dear, u r not happy 
1	 You live! What's the matter, Lady Ash? Someone being mean to you?
0	i wish i could do the same but sadly father won't allow it
1	thats right HAHA
0	  how did you cut your finger? Mine's pretty bad. Opened up again today
0	 can you ask your friends or something? Sorry to hear that?
0	no kiss kiss? Hot liquids   "U kin do it"
1	3 More hours until you get off work!!!!! Yee Haw! 4 More until I do... Damn! Nice Quote..I run into things all the time!
1	good knight sweetie!!
1	ummm, yesss!!! It is, new moon, the hangover, up, year one, and a few more in there that I don't know yet. 
0	so sorry i missed out
1	I couldn't find it...o'well she still my girl! Lol
1	was helping my friends pack was tiring but now im well rested!!!
1	xoxo!!! how r u?? u r up late tonight!!!
0	OHMYGOD BUDDY! I MISS YOU SOOO MUCH! please come home.  i need someone to help me with my stalking. we havent had any luck. (
1	No wonder you're so sweet, then!  
0	thx for the rockin party last night, but my drums just don't seem good enough any more  ION drums FTW!
1	Thank you for including me in your #FF!
1	The SiteWarming parties usually do very well....if I do say so myself.    #sigjeans
1	bought tickets in advance this morning
0	so i finally figured out how to reply to you.i'm twitter challenged. its confusing! thats why i took so long to respond
0	Did you go through Salisbury, Maryland and didn't wave "hi?" 
1	what records?
1	Awww  I get bored with Ireland every so often and skedaddle off for couple of years here and there. Next stop London methinks
1	Heyy corbor  would you mind asking Uncle Brian a question for me?
1	Thanks for the help  The AutLabs project is actually about creating jobs for us rather than finding them
1	I am totally DYING to know who won the izea tickets!!!!
0	Ive forgotten how to snoo-snoo  I wonder if snoo-snoo and I will ever meet again...
0	meh. why does work suck so much?
0	omfggggggggggg i cant believe you posted that picture! my head looks so shiny fuck. i dont like
1	 Some peoples kids..
0	hold the sleep button and the home button at the same time. I'm not eligible for an upgrade until 2010.
0	Goddamn hell yeah! Best band name ever. Nobody can steal it
0	he's a great guy, funny funny dude! Still ragin with kitten, no medicine!!!  need to check that movie asap!!!
0	I think it more uncomfortable around the nipple
0	i wish i was married too  we are both losers lol
1	Going to bed
0	U haven't tweeted all day!
1	 God Bless you sis
1	Hey Cortnee!  How have you been?
1	Holy Goats Milk Cortnee! I think about two days ago you had 300 followers, and now you have 500. Yeeesh! 
0	I didn't even take a shower today!!!
1	I do Cortnee. "Oh my goodness... that's crazy!"
1	The video is an unmitigated disaster, but in the best way possible. 
0	Drive-in sounds fun, but I'm so wiped out still after this weekend. 
0	Yup, currently mirroring that to make sure that we have the most recent data, but it seems to be holier than swiss cheese 
1	please note the 'quotes'
1	Thanks!  I'll probably remake a better version later!
0	just a small one, its in my room cuz my old one sucks 
0	- hey chica! Why can't I get to shegeeks.net? Getting a weird "account suspended" notice from your host!
1	hi cindy from appleton! thx 4 the follow! snag me on http://pawmarkslinks.com and take the tour!
0	 And you seemed so excited.
0	 I read your tweets too! *hugs*
1	Not too badly, but it seems like a bad idea to give you another shot at it today. 
1	That's pretty pimp
1	Today is a perfect day for the lake!  Hope you kids have fun.
1	Good stuff
1	Nice pics - now... change the world, k? 
1	Sounds busy, but fun! 
1	...get through bad day...only thing can help...go to sleep! Really
1	- kick his rear end Cory!    Please
1	I've already been preaching
0	I am SO sorry I never caught that you asked me a question!  not online nearly enough. We went to FL to see****parents 5/16-5/25.
0	I don't get to the UK as often as I'd like.
1	I shall listen to the music from home this evening - it's all blocked here at work! But thank you for the thought
0	tito kant lowd da paj und hath ta gow tu beyd naow
1	I'm doing the same it seems.
0	When the weather changes or I get a bit stressed my skin decides to resemble that of a reptile. It's highly attractive. Oh wait
1	hard to be productive on Mondays.
0	i wish i was in austin with ya'll!!! it sounds like you're having a blast
0	I had mine this morning, done by my manager. Its his last day today as he was made redundant. 
0	whats there number,that curry made me sick 
1	And I've showered, shaved, had breakfast, AND had my hair cut! 
1	10 Twollars to get you started
0	Saw that yesterday; it's my old Uni and I can't make it  Have a good gig!
0	Pepito's been tormented with baths and rain recently. Poor little thing
1	no no no, the real deal - real cherries, pitted, soaked and cooked in maraschino liqueur, made at home. No dayglo red! 
1	that's not exactly a difficult task, kid. 
0	no... sorry.  i don't know what it's like to lose
1	im gonna need a link for itunes. 
0	i was supposed to but no tengo un coche.
1	A very good start IVAN  wish you all the very best
0	im not killing the goat
1	lol trust you to be backwards and have a cold in summer
0	loooool WIGGOFF WIGGFACE!! i dont have 10g's
0	I do it because in EVERY giveaway I've hosted, I've had at least one winner without contact information. I hate to have to do it 
0	Wow! How disappointing! I, for one, really looked forward to them each quarter. 
0	I had to throw it away  all the delicious syrupy stuff leaked out so it just tasted disgusting lol
0	None of mine do
0	Ummm.....sadly not a hell of a lot  Mates are all off doing stuff so been sat in the flat staring at the wall (TV)
1	Wife  Yeah, we really loved Toronto (we actually seriously thought about moving there), but also want to try Vancouver  ...
1	Hey.... more Tweets please! And photo!
1	itssss ok bae...yu can drink waaaaaheva i give yu lmao
1	K we'll tweet up laytta . Gday !  Goodluck w ur fone too . Bye Clyde
0	No water? Omg, does that mean you're dead now? 
0	lost your phone on haunted mansion two seconds after they said the ride had "broken down"
0	thats nothing my dad's Birthday is on Xmas day! double the expence
0	Lucky. I only have Images & memories of The Monkees series  hint, nudge, wink
0	that's what happens when you ride in a car for 16 hours  I was bored out of my freaking mind
0	it could also mean its rainy in toronto
0	Awwww!! Let's cuddle! That would be awesome.
1	U were great on "Real Time".  Excited for all the things you do for Jersey and ur enthusiasm.  It's contagious
1	vegetarian? Just won major points with me
1	Great to meet you+team yesterday. Please don't hesitate giving me a shout once the synapses reset  Safe travels. -Erik
1	I get to experiance that in sept. " they need gamerscore for life" diaper change 2 pts really bad diaper change 10 pts.
1	I'm going again today Cory!
1	 HAHAHAHA You really MUST be cool then or so you think!!
0	me too! i wanted to stay longer though
