1	Goodnight twitter  Early to rise tomorrow. boo loll
1	goodnight Twitter ! see you tomorrow
0	GOODNIGHT TWITTER I WISH I HAD SOME MAKEUP TO PLAY #LOFNOTC WITH but i don't
0	Goodnight Twitter It is past my bedtime....I have a final tomorrow...boo
0	Goodnight Twitter Land People ! ES is taking it in! (sniffing sadly)  until next time! yall hold it down...MUAH ! Sleep Tight
1	goodnight twitter world  of to bed
1	goodnight twitter world! church tomorrow! yay!
1	Goodnight twitter world, see you on the flip side! 
1	Goodnight twitter world. I have missed you
1	Goodnight twitter world.. I wish the best to anyone who's reading this
1	Goodnight Twitter!  *Smooches*
0	Goodnight twitter! Work in the morning  not looking forward to that.
1	goodnight twitter, ill see you after 10 + hours of sleep or more 
1	Goodnight twitter.  And btw, GOD, GIVE ME GOOD CLASSMATES. Lol.
1	Goodnight Twitter. I'll tweet ya'll tomorrow. Gonna go give myself some telie time  RAWR!
1	goodnight twitter. it's past 7:00, im going to sort out my life now DONT forget: www.isabelledotcom.tumblr.com  tell you papa. xxxxxxx
1	goodnight twitter... we shall meet again soon
1	goodnight twitterers <3. reeds disco on fridaaay. shopping saturdaaay. big brother starts again thursdaay.
1	GoodNight TwitterHeads
0	Goodnight twitterland!   I have to wake up at 7!!.... that's really early for me!
1	Goodnight Twitterland. Don't let the starling's steal your nest.
1	Goodnight twitterland. Hopefully ill sleep 2night. My anti spasm meds seem to work great
1	GOODNIGHT TWITTERLAND...This TWITTY IS OFF TO BED...WILL TWEET AGAIN ON THE MORROW
1	Goodnight twitters
1	Goodnight twitters  tomorrows friday for me. Yay for three day weekends.
1	Goodnight twitters  zzZZzzzzZzz
1	Goodnight twitters!!  Love ya!
0	goodnight twitters!! have to sleep early!!  i have to drive my mom tomorrow early in the morning,,, love yah all!! nyt too
1	goodnight twitters!!!!
1	Goodnight twittersphere its time for a wonderful night with my boyfriend sleep i love him
1	goodnight twitterverse
0	Goodnight Twitterverse  Remember,please follow and I want Alton Brown to be a tweep!!
1	goodnight twitterverse ♥ New Moon  hehe
0	Goodnight twitterverse can't stay up any longer
1	Goodnight Twitterverse. Maths Exam First Thing Then Down To The Park
0	Goodnight Twitterverse. Pray I don't die tomorrow..literally. I'm scared
1	GOODNIGHT TWITTERVILL MUAAAAAH
1	Goodnight Twitterworld!  Hasta manana a todos, descansen. God Bless 
1	Goodnight twitterworld, going to sleep n cuddle with my babe  Have a good nite n be safe!
1	Goodnight twitterworld. I'll tweet y'all later.  Goodnight, J. 
1	goodnight twittn friends! back to my dream-mobil!
1	goodnight twittterrellas!  tomorrow is monday! a new week,a fresh start and sooo much to do xoxo
1	goodnight twittville...not feeling to welll...hope i feel much better n da morning...luv u all muah
1	Goodnight wifey. Goodnight Zalamander. I luvs you both very much
1	Goodnight World  ... ...
1	Goodnight world  talk to yall lataz...
1	Goodnight world ;) I love you chloë! 6 more days
1	goodnight world i love you
1	Goodnight world see you when i arise to the sunlight beaming down on me
1	Goodnight world! haha I might go to bed I'll have to force myself
1	Goodnight World! Kind of excited to start work tomorrow
1	Goodnight World, Get Ready to "Get It Done Today!"....soon  Can't wait to share this with you!
1	goodnight world, heading to bed now 
0	goodnight world,gotta get up early 
1	goodnight world. I will see you all tomorrow!
1	Goodnight world. I'm so lucky.
1	Goodnight world. It's gonna get better keep your heads up from los angeles to Tokyo and all in between.
1	Goodnight world. Let's hope I dream about you again.
1	goodnight world. time to go dream of a more happier life.   <3
1	Goodnight world. Today was a good day.
0	Goodnight world. Unfortunately I must set my alarm for extra early so I'm not late for 9am meeting  Sleep well. Dream sweet. Happy Friday.
1	goodnight world.... goodnight eddplant.
1	goodnight ya all
1	Goodnight Y'all  Disneyland tommorrow.....I hope.....COME ON! No block out day please! Hehehe Sweetdreams! Im out
1	Goodnight ya'll. Drive safely and sleep well
1	Goodnight!  3hr nap :p yay
1	GOODNIGHT!  Church was SO good. Then dance was SICK!  Now, im going to call her, and talk to her!  I'll tweet...
1	goodnight!  going to sleep happyyy. or whatev.
1	Goodnight!  Happy Mothers Day!
1	goodnight!  that dodger game really burned my wallet and me :/
1	goodnight! cant wait till tomorrow!
1	goodnight! i can't wait to move in to our NEW house tommorrow!
1	Goodnight! Off to dream about being able to say that I have a degree, not that I have completed uni and am "pending graduation". 
1	Goodnight! Or should I say.. good morning! Lol.. well I'm going to sleep..
0	goodnight! school tomorrow.  i'll get to see Inaam,nese and jale there so thats awsomeee ;)
1	goodnight! sweet dreams!
1	goodnight! thanks for the party!  #20BoySummer
0	Goodnight! xxo; school exams in 10 days.
1	Goodnight!!!
0	Goodnight!!! My "twitterrific" app is not working so I'm forced to use "TwitterFon" for the mean time... Zzz.. Must wake up early...
1	goodnight!!!!
0	goodnight&goodbyee ;D see ya tomorrow,,I don't wanna go to school  ,,I don't have other option u.U
1	Goodnight, all. Got an early morning tomorrow. 
0	goodnight, David Carradine.  i never got to grab the pebble from your hand.  
0	goodnight, early rise. roll on sunday when I get a real lie in 
1	Goodnight, everybody 
0	Goodnight, everyone!! Sweet dreams... CU Law Accepted Students Day at 8am... Should I go?? So early 
0	Goodnight, going home tomorrow, sad 
1	goodnight, going to lye in bed, listen to jonas brothers and cry untill i fall asleep  sounds good x
1	Goodnight, good morning and HAPPY MOTHERS DAY! Visit my profile to see my silly offspring.Its funny, the love of my life picks his nose! 
0	goodnight, i love my sea lion   i wish i had my own place
1	Goodnight, people 
1	Goodnight, sending positive vibes to tomorrow 
1	Goodnight, sleep tight, sleep fast. And don't let the bedbugs bite your..........hiney!  http://u.mavrev.com/6n7y
1	Goodnight, tomorrow will be a long day 
1	Goodnight, tweet tight! Haha so proud of my tweet joke 
1	Goodnight, Twitter. Hope you all enjoy the new jam. Thanks for listening. 
1	Goodnight, Twitterverse.  <3
1	Goodnight, twittians!  C'ya tomorrow!  Sleep well. 
1	Goodnight, world 
1	Goodnight.      i love sleeping cuz of the amazing dreams
0	goodnight. *sobs*
1	Goodnight. . .glad I stayed in tonight
1	Goodnight. Already feel that I'm gonna wake up on the wrong side of the bed  YAY!
1	Goodnight. Early morning. Take child to school by 7:30, then a workout, then to the college ad work. Long day. 
1	Goodnight. Especially to you
0	Goodnight. Fml.
1	Goodnight. God Bless.  i'm so tired.
0	Goodnight. Have to get up early tomorrow
1	goodnight. hurrah.
0	Goodnight. I am genuinely tired
0	Goodnight. Idk why but I'm not looking forward to tomorrow
1	goodnight. Sleeping to dream about you!!
1	goodnight. sleeptight. don't let the bedbugs bite.
1	Goodnight. Snuggles and Spoons everyone! And sometimes Forks. But NEVER Sporks! OUCH!!
1	Goodnight. Swimming got me tireddddd ::::: tweet dreams
0	Goodnight. Up early... Work 8-7
1	goodnight. wearing my shitty failure of making tie dye tomorrow
0	Goodnight. Wish I was with my besties and tonight
1	Goodnight... see you at midnight! okay... it's then 6am here in germany!
0	goodnight..gotta read this book for class 2moro
1	goodnight..I got the best bf in the world
1	Goodnight/Good Morning World
1	goodnite all - big bday for me today! 27 and ALIVE
1	Goodnite thinking bout my relationships then sleep
1	Goodnite tweeps, Im thankful good friends and family!  
1	goodnite tweets., i need to rest...(im so excited to be with you my fiance) 
0	goodnite tweetz! gotta get up at 430 for werk!
1	goodnite twits
1	goodnite twitterverse. 2morrow will be a better day, hopefully. Ok. No hoping. it WILL be a better day. 
1	Goodnite Twitterville!!  Time to go chill and watch a little tv with my hubby b4 bed...
1	Goodnite twitties
1	Goodnite world. I is tired. {yawn}
1	GOODNITE! See ya'll in the morrow.
1	Goodnite!! Finally my BABE (puppy) is asleep
1	Goodnite!!!Sweet dreams
1	goodnite.  ....things to do all day tomorrow. love ya! xo.! chao.
0	Goodniteee, mum's nagging me to go sleep now   byee xo
1	goodniteeee gotta wake up early and get this moneyyyy  got me&MINES;) i gotta worry bout now.
1	GOODNYTE TWITTZ....OFF 2 LALA LAND SOON....NICK NYTE IN DA MEAN TIME
1	Goodtimes...anytime u need a payment
1	Goodwill is a wonderful place, so many baubles and other curiousities to discover 
0	Goodwill was a disappointment...I did get to talk to Hubby tonight, from Kuwait!! He sounded bummed...I wish he didn't have to go back! 
0	goody another day of work
0	Goody! the sun is out...Shame I will be stuck in all day...
1	goofing around!!!
1	Goofing off on the computer for now, but going to Payless for new shoes soon... BOGO  heheheheheeee
1	Google App Engine is not meant for terrorists  http://imgur.com/0rr82.png
0	Google chrome has reached version 2.0 but still no port for linux  #google #googlechrome
0	google chrome isn't much better than firefox  http://plurk.com/p/11cp6t
1	Google Chrome just became my new favorite browser... I really likes.
1	Google Chrome with extension is definitely a bonus :using gmail notification, RSS subscribe and Cleeki. Neat!  Could not wait to see WOT!
0	Google docs:  Server Error The server encountered a temporary error and could not complete your request. Please try again in 30 seconds.
1	Google Down -> Twitter over capacity -> News websites slow. It's the end of the world
1	Google has assigned TBPR2 to bing.com
1	Google is looking very good with the temporary tetrist image, happy birthday tetris 
0	Google 'ksurl' calling home from my mac every day  Here's the remedy. http://tr.im/lAeQ (caught thank to LittleSnitch)
0	google maps does not have eulogia drive balintawak quezon city.  http://plurk.com/p/xbt17
0	Google mentor found dead  http://bit.ly/aJn7r
1	GOOGLE MRLOVECHILD YALL !
0	Google not working for me
1	Google page seems to be unstable. I've to use yahoo to search. Memories from old times
1	Google Research: 'Personal Defeats' Just found some good stuff. Currently Bible stories, as a hardly-ever-practicing Christian, help me 
1	Google rocks. Type in almost any technical problem, and someone's discussing the answer 
0	google search is down too!! i think this is a short-sighted premonition of the inevitably and unexpectedly near apocalypse...
0	Google skymap is REALLY impressive
0	google sync update did not work for me..
0	Google Voice seems to be down at the moment.
1	Google Wave iam waiting for you
0	Google WAVE is an app I designed five years ago, to merge forums and chat, but never built  My design was almost _exactly_ what they made
1	google wave is the best
1	Google Wave looks like eMail 2.0
1	Google Wave looks pretty interesting. Appeals to my inner nerd
0	google wave will allow others to tag your messages, this will not help me with my Inbox 15,328 (and counting) strategy 
1	Google Wave will not hurt twitter, but improve it, with a little robot thingy that updates directly to your twitter 
1	Google Wave: Simply awesome
1	Google Waverines? Has anyone got hold of a Google Wave account, yet? 
0	Google, I love you, but I am having the utmost difficulties sorting out my accounts. I'm sure it's my fault, but just letting you know... 
1	googled #iran9 and time, CNN, BBC, washingon post, Cnet news, AFP, comp.wrld, itnews all have article quoting #iran9 #iranelections #GR88 
0	Google's still down outside of major cities
1	GoogleWave! FTW! Thanks Ant
0	Googling for Gases- one Google search generates approximately 7g of CO2
0	Googling Huixin , heartswithlove and to no avail 
1	Googling this UP movie everyone's talking about.    Without TV I miss trailers & have no idea movies are coming out, LOL!
1	gooing to duquoin, 
1	Gooing to my auntiss house
1	gooingg to the mall with mom^^
0	goom morning all,well what a bloody horrible day today!!! dark,rainy, 
1	goonight from me too 
0	Goonyttt guys... Gotta go to sleep. Stupidd school tmw. I really don't wanna go...  But  I have to. Well, bye! I'll talk to you guys tmw.
1	gooo LAKERSS!!! on the train back to l.a after a great weeken
1	Gooo Stavros Flately!!!!
1	Gooo... move up by 1  30. elitestv.com
1	Gooo... move up by 3  82. businessweek.com
1	Gooo... move up by 3  85. sulumitsretsambewmaster.com
1	goood day, happy birthday lyana!!!!   yummie dinner  hope yor having fun tonight  wish i was there!!
1	Goood morgen  http://bit.ly/CGC5g
1	goood morning  its going to be a good day
1	Goood morning  The sky looks rather gloomy. Don't let its gloominess rub off on you!! Haha
1	goood morning !!!!!  off to work only half an hour late   have a nice day everyone !!! xoxo
1	Goood morning Chicago On this great Friday Morning ! time to wake up and watch Fall Out Boy on the Today show
1	goood morning everyone! I just woke up, well i feel fine 
0	Goood morning everyone!!!! Still working on my bloody  essay  why can't i be a robot - then i would b probably finished already
1	goood morning to the world
0	Goood morning tweeties up early gettin My hair done! Ugghhh such a gloomy day in the bay  hates it!! Wat r yoooou doin today?!
1	Goood morning tweeties! Literally, let's make it just that. . .a GOOD morning! 
1	goood morning world. I wonder what sort of adventure you have in store for me today?
1	Goood Morning! Getting ready then on my way to North Carolina! Texts and Tweets would be wonderful
1	goood morning! out for a bike ride on this chili day
1	Goood morning, internet. It's 09.52 BST (08.52 UTC) and I have an email from Apple fixing a problem I sent to them.  Nice company.
0	Goood morningg! (619) > it's toooo early!  MSG. Me work instead of hotmail
1	goood night everyone
0	Goood night everyonee! studying tommorow for exmas
1	Goood Night Twitter im going to Bed Coz it Is Like 2:30am in the Morning the Uk so basicly It Is Monday today  bye a good reast of ur Sund
1	goood sex is me
1	Gooodafternooon
1	gooodbye everybodyyyyyyy!!
0	gooodbye ithaca
0	Gooodbye Tweeeeters  i'm off to vietnam for a month! I'll tweet you guys when I get there!
1	Gooodbye twitter  i have to study 4 my math test 2morrow..ughh xxx
0	gooodbyeee central  i never thought id actually be sad to leave
1	gooodluck yourrr amazinggg
1	Gooodmorning  at the cross, at the cross....
1	gooodmorning  leaving grands house, attempting to get dad a birthday present, now where would you get grilling supplies...
1	gooodmorning twittterrrrrrrrrrrs
0	gooodmorning... i will fail the economic test for sure
1	gooodnight  xxx
1	gooodnight twitter! session went very well  gotta keep pushing
1	GOOOO LAKKKERRSSS! This game will prove who the better team is. > there isn't gonna be a game on Sunday...btw.
0	Gooood Afternoon. I can't even wake up and say Good Morning, because it's not the morning when I wake up. 
0	Gooood mooorning world. I had a dream last night I fucked my knee again  Def need to kick start my strengthening ready for Bournemouth 7s!
1	Gooood morning  Golfing later on. Might go swimming? Idfk yet. Relay for life this week ))
1	gooood morning  http://plurk.com/p/vgy9f
1	Gooood Morning everyone..... and here we are again, doin' the hustle  happy Monday all. Have a fantastic day!!!
1	Gooood morning Nebraska! Kind of a gloomy beginning to this Tuesday, but hopefully it will perk up  am:gi begins in about 45 minutes.
1	Gooood morning tweets! I don't wanna get up. Sho nuf! But I promised the midget eggs and biscuits so *stretch* I'm up I'm up!
0	GOOOOD MORNING TWEETS!!!! Trying to find a ride to the ATL today...not going so well! Somebody help me!
1	gooood morning twitter wow nicky is as long from head to back paw as my body
1	Gooood morning twitterville!!  happy wednesday!..almost the weekend.
1	Gooood morning world
1	gooood morning!
0	gooood morning, soo tired  maybe piano will wake me up alittle bit...hmph..
1	Gooood morning.
0	Gooood morning..i have to do some cleaning today, unfortunately 
1	gooood morning~!! im watching vh1 video countdown and nibbling on a poptart... yum!
1	gooood mornnning tweeetie pies!!! another beautiful day! cant wait to lay out and watch the LAAAKER game babbby!!
1	Gooood Niiiiiiiiight Peeeeeps  <3  lol v.v
1	Gooooddddd EVEEEEEEEEEningggg ALL!!  *ok that is annoying* LMAO
1	goooodmorning  I've a soccer topurnament to go to, tell you when I get back, but we'll probably be last or something like that xD
0	goooodmorning! starting from home today due to traffic and external appointments no train for me today
1	goooodnight dallas texas.
1	goooodnight world, i can't wait to sleep in my bed! there's definitely no way you're sleeping in longer than me 
1	GOOOOL ♥ YEAAAAH!
1	Goooood morning  Today I woke up in my bedroom not knowing where I was... I think someone wasn't ready to get up.. Off to work!!
0	goooood morning guys.  i'm fucking tired but i have to do lots of work today   fuckin shite </3
1	goooood morning people of twitter  maisie is rather tired... mmm.
1	Goooood morning tweeps, moving furniture, car across countries is never fun 
0	Goooood morning Twitterbugs!! Hope you guys are feeling fresh today! I woke up super-energized and ready for the beach but the weather is
1	Goooood morning world
1	goooood morning!
1	Goooood morning!  i love this weather. I'm craving sushiland cause of it lol
1	goooood morning! Nice sunny monday! Checking my feeds and I'm already (11am) working on new iPhone U  #squarespace
1	Goooood morning!!! Best sleep ever. I feel so refreshed
1	Goooood morning, assholes  <3 http://mypict.me/2h4x
0	goooood morning. my eyes hurt.
1	goooood night. i'm going to sleep in a lovely mood!
1	goooooddd morning tweets!!  week three OF my workout. did i mention i got my new glasses yesterday?!?
1	goooooddd morning!!! ahh weather is looking better  hopefully it says like it tomorrow  xx
1	GOOoooddDD morning my twitterbirds... gonna get ready for work soon  dont worry i'll eat some cereal before work. talk to me prettys.
1	gooooodmorning twittersss.
1	Gooooodmorning! Up early today. Just half an hour and The Kid will be home from a week at his dad's
0	gooooodnight ;) last competition tomorrow, so tired. 
1	gooooodnight twits
1	Gooooodniteee Twitterrr ;amd; Chris Brown Is Calling Meeee ..
1	Gooooood mornin vietnam!!!!
1	gooooood morning Tuesday
1	gooooood morning twit loves
0	Gooooood MORNING!! Overcast in north #Somerset right now, 13C at the mo with 23C forecast - and not much sun today! 
1	Goooooodnight  xxx <3
1	goooooood evenin!  eat eat eat! :b
1	goooooood morning twitterfriends!!
1	Goooooood morning Twitter-World!
1	Goooooood Morning! Leaving for New York in an hour or so. Cool, I'll be in New York by tonight. 
1	Goooooood Morning! Sun + no work....
0	gooooooodmornight! :]] please. secret lng po na i slept ng gnito ka'late :| please please please  dnt tell him. hahahaha
1	gooooooodmorning twitter people
1	gooooooodnight
1	Gooooooodnight I'm pooped
1	gooooooodnight.
1	Gooooooood morning all. Man I need to DJ more often. I miss it.
1	Gooooooood morning twitizens ! anyone as upbeat about today as I am ?
1	gooooooood morning viatnam   http://yfrog.com/42rirj
1	Gooooooood Morning!
1	gooooooood morning!!!  Hubby has a day off today  supposed to be +14 this afternoon going to take jay to the park
1	Gooooooood morning.
1	Goooooooodnight twitterrssss
1	Goooooooodtimes
1	Gooooooooo Maaaagiiic! Now i can say i was a fan forever. I mean damn, I went to games in diapers. 
0	goooooooood morning errrbody! jumping into to shower and heading for my 9am class. TGIF? not yet  still got programming test at 3.
0	Goooooooood morninnng! It's 8:28 AM and I'm walking to college' I feel.......so tired!  oh well only got...10.5 Days left
1	goooooooood niiiiiiiiiiiiight
1	Goooooooooood morning  !! The sun is shining and the sky is blue, perfect weather for a party.
1	goooooooooood morning!!! I'm going to get my butt up and take the dogs for a walk to the park!   Its beautiful outside...rise & shine!!!!
1	goooooooooood night every one kisses to you all in your right and in your left cheek , sweet dreams and happy morning God bless you 
1	GOOOOOOOOOOOD!!!!!MORNING PEOPLE!!  How are you?¿¿??
1	Gooooooooooodmorning mah twittah peeps! *does the OMG where's my coffee shake it dance*
1	Goooooooooooood morning! Denis picked up our AdFix stickers yesterday - they look ace:  http://bit.ly/nhWg8 Check out those beauties!
1	Goooooooooooooood morning!
1	GOOOOOOOOOOOOOOOOOODNIGHT TWITTER  BUT STUDY SOOOOOOOOOOOOOOOOOOOOO MUCH
1	Goooooooooooooooooooood morning!
1	gooooooooooooooooooooooood mooooooooooorning!!! now?? On the beach..bye
1	Goooor morning twitterettes!!! What a great weekend!
0	goooosh i can believee it!,, my love, with exgirlfriend againnnn  (U)
0	Gooorgeous weather - sunshine and smell of flowers - and a shedload of practice questions to tackle
0	goose just died...saddest scene i've seen...
1	Gordia crunch from taco bell, and honey bbq wing's from checker's. now that's good eatin' 
1	Gordy is YouTubing again  Expenses get the nod for Brown pearls of wisdom http://www.number10.gov.uk/
0	Gorefest split up
0	Gorgedmyself on dinner because I was so hungry!  Now my tummy hurts.
1	Gorgeous chipboard letters for #scrapbooking and #cardmaking at http://www.peachycheap.com - 3 sets only $5.99!  Sweeeet.
1	gorgeous day  BBQ for tea and song writing sesh....good times
1	gorgeous day  having people over for cornhole & beer
0	gorgeous day again and have to work
1	Gorgeous day here in CO. I'm at Mike's Camera, Denver! I'm quite sure you should come by 
1	Gorgeous day in Denmark!! Seeing the sights of the city today-last meeting tonight of the whole tour-then off to Italy with kate to rest
0	Gorgeous day in jerseyy! Taking colleen back to the airport  what a great weekend!!!
1	Gorgeous day in Munich
0	Gorgeous day in NYC! Gonna lay outside & learn a script for short film audition 2mrw..but I'm scared! Not sure I'm ready for this one yet
1	Gorgeous day out
1	Gorgeous day today!!       I love it when it gets warm!  Finally, we had a never ending winter!
0	Gorgeous day today, shame I'm now in doors ironing 
1	gorgeous day today. gym at 11:30 then who knows ?
1	Gorgeous day, packing going badly, and I have no Idea who won BGT. And wouldn't know if someone told me! I think this is good thing. 
1	Gorgeous fp! Your little earrings are so sweet  http://www.etsy.com/
0	Gorgeous is gorgeous no more
1	Gorgeous morning
1	Gorgeous morning wharfside
1	Gorgeous movie so far, tho. Heath is amazing! Damn shame about him. Jake looks like a baby dyke. Loves it! 
0	Gorgeous sunny day is so getting wasted inside, but what can I do, I got work to do 
0	gorgeous sunny day, really want to go outside, still not sure i can walk on my stupid ankle, i need a wheelchair 
0	Gorgeous sunny day, stuck inside working 
0	Gorgeous sunny weekend almost over. Work in the morning. Bah
1	gorgeous warm, sunny morning here in East Sussex - lovely! Just right for a walk down the beach 
0	Gorgeous weather yesterday... unexpected rain this morning.   Ride to the beach today looks unlikely.
0	Gorgeous weather, but no bike 
1	Gorgeous! Sweety Darling!!!
1	Gorgeouuss ouutt! Soaking up the sunn - 6 more days till schools overr
1	Gorleston to Norwich
0	gorram pidgin is being a douche about the twitter plugin right now.
1	GOSH ! the hollywood tower ride was fun ! i taas ka den baba klng agd ! lngaw mxdo . people ! kng mg pnta kau sa calif adventure try it !
0	Gosh , i gotta spend all my weekend studying , and doing works .. psh ! 
0	Gosh dangit! I-5 is dead stop too. Poo.
0	gosh didnt even go late night  bummer; but im get that dress! no matter wat! deranged shopper right here! nah just jokes!
0	Gosh goodness home...
0	gosh gosh my heart can't stop beating  i am worrying something!
0	Gosh Groban has the most amazing male voice ever. I'm peacefully listening to all his records in my room. It almost makes me cry.
0	gosh guys, i miss my crappy phone. 
1	Gosh I had a life before twitter LOL. Must go do some shopping. Tweet later. Enjoy your day whatever you're doing.
0	gosh i hate my jetlack
0	gosh I have to go to work when there's an NCIS marathon on  oh well off the next two days at least
0	Gosh i just lost 3 followers
0	gosh i miss junpyo!  gotta hit quiapo for the the BOF dvd! LOL
0	Gosh I miss singer's theater.  I miss learning music, doing acting exercises, n I ESPECIALLY miss being onstage.
1	gosh i think i gonna drive some where far..shitty weather in germany ..3 days would be enough!
0	Gosh i tweet to much. Sorry guys.
0	gosh i wish i could be in the sway sway baby video. too bad its in sydney
0	Gosh i'm missing out stuff bout David
1	gosh i'm so sweaty. i love the park (: now i'm waiting for my sis so we can go hit up the gym
0	gosh i'm tired, and bored 
1	gosh is that i see peeking his beanie in?
0	Gosh its hard to come back to work after a fab weekend       xx
0	gosh it's sooooooo hot!!!!!
0	Gosh My Dad Is Smoking...Gosh People Are Stupid...Why Would You Want To Do Something That Might End Up Killing You...Hate You Dad
0	Gosh my life is awesome, i just to watch my boyfriend play videogames on a friday night while my brother is at the sounds 
0	gosh never knew producing could be soooooooooo depressing
0	Gosh that Zara shoes is a MUST HAVE! Haw ce beraattss! To bad they don't have my size.. Blm jodoh  http://myloc.me/5AUP
0	Gosh there is nothing on tv
0	Gosh this cough is killing me!!
0	Gosh Tyler >.< your so ughh your going to jail for sure
0	Gosh what will we do when twitter is down
0	Gosh why this is so difficult to me..  Going 2 bed! G-night Twitter world... ZzZzZz...
1	gosh! i'm freakin' bored! talk to me!
0	Gosh! It's only my first day and I already got an assignment! And I suck at turning people in!
0	gosh! my atm card dropped inside the toilet bowl!
0	Gosh! NOBODY answer me if ya've netlog  i cry! really
