1	I'm off to bed!  Meet you back here in twitterverse tomorrow!  Sleep well everyone
0	I'm off to bed, so exhausted!! I got a real bad headache  Thank God it's Saturday tomorrow! Xoxo
1	Im off to bed. Had a great weekend  Night all. i now have to go to the sth side of the L shaped building, south of Francis Intr. Airport.
1	it's like that first slow dance && the first long kiss; there ain't nothing baby better than this.
0	It's like there's a retarded business manager's meeting today, and they decided to have the meeting on my work phone line. Fun 
0	its like this game where you make a chracter and go in a chat rooom thing but everyone on there is really really mean!
0	It's like we both want the same thing when it comes to love, but we're too scared to do something about it.. 
0	It's like when the humane society comes knocking AGAIN and they show me adorable kitten and puppy pictures.     I always write that check
0	It's like whenever a blessing comes my way, another leaves...like a trade. 
0	it's like... really really really really really really really really really really really hard to get famous on YouTube nowadays.
0	its like.............an endless fight and i cant seem to win ..... sigh.......
0	Its literally raining on my (mermaid) parade. No Coney Island for me today
1	it's loading. !
0	Its lonely here
0	Its lonely on the moon....
1	It's looking good for my sister. The data is coming from the harddisk  1 disaster avoided.
0	it's looking like favre will play for the vikings, going out to buy purple 
0	It's looking likely that by the end of the week i will be jobless. How sad
0	It's love.
0	it's lovely and sunny here in Cornwall today, bit windy but I don't mind...just wish my car was back so we could go for a nice drive 
1	it's lovely and sunny now
1	it's lovely day to kill a king today.  ? http://blip.fm/~4miiw
0	It's lovely out and there's nothing to do!
1	its Loving Ashley Tisdales songs off her new Album
0	Its lowkey depressing when a dj spins and I know every song they played  ( not in referrence to the heist boys)
0	It's Lunch time, another frozen dinner 
1	it's LVATT day!!!!!! woo hoo!!!
1	it's ma birthday, therefore i am justified in eating cake for breakfast 
1	its maaa birthdaaay  ... it was in generell a great week! the only thing that is really going on my nerves is this shitty weather !
1	its macintosh backuptime
1	its MAGICal!!! haha good bye Cavs! let's beat the lakers now
0	It's making for a boring day on Twitter without or other sensible #tcot's to debate with... Just nut-jobs on today...
1	Its me again, but Im tired 
1	it's meeting day!  Wait, aren't all Mondays meeting days?  
0	Its Meeting time on a saturday...then have 2 take my hubby 2 the airport
1	It's MEGA swag bucks day! Win up to 100-- enough for an amazon gift card! I save for Amazon cards! http://swagbucks.com/refer/womenwhowin
1	It's memorial day weekend..... after my hair appt at 2pm LOL
1	It's Metallica day
1	its midnight &' i'm buying my JB Cd
0	It's Midnight Summer Party in Finland, but guess who's the lucky dude that has morning shift tomorrow. No drinkin' today. 
0	It's midnight, I'm back from my tweet up. I had a blast! Headed to bed to be up to catch 6AM flight. Yikes! & I have a 4 hr layover. 
1	it's midnight.
0	It's midnight. I couldn't sleep. I have to be at southbank tomorrow before 7.45am.
0	It's midnight. Why am I still at work?
1	it's midnight....my queue to bid you adieu...good morning everyone
0	It's midnight...I leave tomorrow at 4 AM...and I can't sleep.
1	IT'S MIGHTY CRUEL. i`m hatin` it.  haha.
0	its miserably hot outside
1	it's mommas day, THEN THE BEACH 
0	it's mommy's day annnd i have to work. it sucks  but tonight shall be lovely <3
0	It's Monday  Boston on Thursday.. yee haw.
0	it's monday  went to see the Hangover yesterday,hiliarious film! The bf enjoyed it a bit too much, stag do in vegas i think not
1	its mOnday !start of cLasses  tired . damn ,what a hot afterno0n ...
0	Its Monday Again
0	It's monday all over again
1	It's Monday already again! The Bachelorette
0	It's Monday already?? How did that happen? Working away and the office is freezing  Missing him xo xo
0	It's Monday morning and I'm back at work  Oh well just another 5 days till the weekend
0	It's Monday morning and u have 5 more days for the weekend!!!
1	Its Monday morning! and Ive had way too much coffee!! I feel the strange need to exclamation point everthing I type!!  java java java java
1	Its monday morning, and i'm sitting at work 
1	It's Monday morning, the sun is shining. Must be time for a run before work! 
1	It's Monday so bad moods likely in some. Approach all with kindness. Uplift others today. The world needs it.
1	It's Monday which means DWTS and I get to see it live and in person tonight!
0	It's Monday!  AHHH BOO
0	its Monday! lol!  ugh it took me forever to get my extensions out yesterday!
0	It's Monday! School's back on Wednesday! It's SO unfair. Other's gonna start next week
1	IT's Monday! So that means; BONES!
1	its monday, and another work week starts ...  hope everyone has a great day!
0	it's monday, and that means being slighty tired but having to work anyway 
0	It's Monday, it's cold, it's raining. Why do I have to be up? 
0	It's Monday. This means work. And that means I hafta leave the house. Which sucks cos it's gonna be 90* today! I dream of Alaska.
0	it's monday... off to work in the rain!
1	Its Monday....Hello my Twitter Friends!
0	it's Monday...blah
0	its mondayyy  wanting these next 3 weeks to go by fasttt!
0	It's more like a sponsored bloody walk at the moment...
0	its morning 8 and temperature is already 32 degree centigrade...
0	its morning and im tired. i am having facebook withdrawal symptoms...
1	It's morning!  Listening to Jingle Spells 2 while I doodle with my tablet.
0	Its morning! And im in pain  I swear in the night i've booted the wall or something :/. Quite tired but i'm up and ready to do more testy!
0	It's morning.  I'm bleary-eyed and not happy to be out of bed
0	it's morning. wah  *yawns*
1	It's Mothers Day & Happy Day to all the mom's out there. Have a GREAT Day I know I will     Planting some flowers & family  time...
1	it's mother's dayy. haha.
0	Its moving day for me today.
0	its much colder than it looks outside  i definately wont be sitting outside with the host today lol
0	its my 18th brithday and my poor mother is devastatedd  lol
0	its my 21st bday in 9 days :-O  im getting old  lol
0	Its my 25th birthday and have no plans as usual.  I love the Backstreet Boys!!!  #BSB   #BSB
1	It's my 3 year anniversary this year
1	Its my bday
1	It's my b'day
1	its my b'day
0	Its my bday 2day and my grandma didnt even say happy birthday!!!!
0	It's my b-day today and I still have 2 go to school...
1	Its my bday!  Thanks for the wishes!
1	it's my best friend's birthday!!
1	its my best friends birthdayyy!!!!!
1	Its my best mates b-day in 22 days luv you lots em  bowling will b ace X x X
1	its my birthdaayyy!!
1	its my birthday
1	It's my birthday
1	Its my birthday  yay! Had a fab day in Edinburgh. All tanned
1	Its my birthday and excited for today...I should get some rest bc I know that I won't be getting any later on today
1	Its my birthday and for the first time ever I am working! Thank God for employment
1	It's my birthday and I'll cry if I want to. Or not. Let's see what the day brings first
0	It's my birthday and I'm working the baseball game this guy Dayne
0	its my birthday and my phone is broken  no way of communicating
1	Its my birthday bitches. Dinner with thee boyfriend then going bowling with thee boyfriend and thee boys.
1	it's my birthday may 31 . . . happy birthday to ME
1	It's my birthday party tonight! Come celebrate with me
1	its my birthday sooon
1	its my birthday todat  17th May  i am 14 now  x
1	It's my birthday today  Running the mile tomorrow ughh. But then choir concert
1	it's my birthday todayyyy !!  finally 16.
1	its my birthday tomorrow, if anyone is planning on getting me summin, I'd really like Whitey Action 
1	it's my birthday tralalallaaaaaaaaaa
1	It's my birthday weekend.
1	Its my birthday!
1	It's my birthday!
0	its my birthday! I'm officially old today
1	Its my birthday!!
1	It's my birthday!!
1	It's my birthday!! I'm 21!!
1	It's my birthday!! yaaay..Happy Birthday to me!
1	its my birthday!!!!!!! finally 19, woohooooo!!! 
1	it's my birthdayy
1	its my bithday & i'll cry if i want to!!! .............. but i DONT want to .... cos its all soooooooo goooooooooood!!
0	Its my daddys birthday.  sure do miss him...
1	Its my daddys birthdayy
0	it's my dad's birthday today. and i can't seem to get reach him on the phone
1	its my day off
1	It's my day off
0	its my day off and its raining
0	it's my day off, why am i already driving somewhere  #sleepy #robot
1	It's my first day as a vegetarian  I'll update how I get on over the week
1	its my first day in law school, im nervous.. 
0	its my first mothers day and i have to work.
0	its my first mothers day without my mom   i miss her so much u r "l lucky 2 have still have ur mom!
0	its my first mothers day!!!! Well time to get ready to go to work  boo
0	it's my first tweet, i've been on the net all day and have not completed a page of homework.  tryin to avoid chuggin a mickey's get me
1	it's my first twitter
0	Its my friday!! I so wanted to talk to him  now i gotta wait til friday.. - xoxo Sandy
0	It's my grandfather's day of death...
1	it's my half birthday
0	It's my last day at eLocal....and it's so gloomy outside today! Man. Let's just hike up my depression a notch.
0	Its my last day in sunny southern california... Not looking forward to the Vegas heat tomorrow!!  bummer.
1	Its my last day of classes.
1	its my last day of school today
1	It's my last day of school!  And I am leaving early. I just have to go in tomorrow for 2 tests and I am done for the summerrrrr. !
0	its my last day of teen-dom
0	Its my last day on the job  I hope to God I am not making a mistake.
0	Its my last few hours of being 30...eeek! 31 Tomorrow
0	Its my last full week in New Orleans
0	It's my last week in Greece
1	its my late birthday and i got a new acoustic yumm and a laptop which i am now on :] have a great day guys cause i know i am  -fresh
1	its my little sister Laurens b-day today, Happy Birthday Lou !!! 
1	It's my mom's birthday
1	It's my mom's birthday! /afk
0	It's my mothers birthday and she came home drunk with her friends. Now, her one friend is going to steal my bed because she can't drive. 
1	It's my mums birthday so we gonna have a family day.  It will be fun!
0	It's my mum's birthday today. Unfortunately I'm still sunburnt so I can't do much for her.
1	its my one year kern today
0	Its my own fault if i fail? Thanks for the encouragement, family. Really appreciate it. 
1	It's my paddle night!! Alpha love
1	It's my three month anniversary today. Which is kinda a silly anniversary to be happy about but SHUT UP I DON'T CARE I AM HAPPY.
0	It's my youngest's 19th birthday today, how did she get so grown up all of a sudden? and she's been talking a lot about leaving home too 
1	Its nap time ladies and gents. I shall return shortly
1	It's National Cancer Survivor's Day! Just thankful to be alive
0	it's national donut day in america. you can get free donuts at krispy kreme. i wish i lived in america so i could get my free donut
1	It's National Donut Day!
1	its national ice cream week
0	It's nearly 11 AM and my son is not awake yet. I want to check on him, but that will surely wake him up and make him cry 
0	It's nearly 2am and I am bored. It was cold tonight, oh Mr.Sun where did you go!  
0	it's nearly 2am, am i done studying yet??? 
0	its nearly 330 in the am, i've barely slept & so i'm loopy, & i'm getting ready 2 drive my bff 2 the airport so she can leave me 4 3 wks 
1	it's nearly 4am and i start watching a movie right now
0	Its nearly half two in the morning. My mind is telling me I'm not tired. Its lying. I'm Shattered. But I can't fall asleep! Damn
1	It's nearly t t t time for Time Team
1	its nearly the weekend yipeeeeeeeeeeeeeeeeeeee
1	It's nearly the weekend!!! FA Cup final (couldn't get ticket, but going to the Bridge to watch it) and soooonshiiiiiine. Happy days 
1	its nearly wednesday...yay
0	It's never a good idea to go running when you can't breathe through your nose from jump. I'm hurting bad now  feels like a heart attack
0	it's never a good sign when you have to spend 20 mins troubleshooting just to get your laptop to boot on a Monday morning.
1	it's never any fun when he sleeps...(yeah, him)  ? http://blip.fm/~6gbq9
0	It's never fun when teachers come back to work, but today has been especially tough. 
0	It's never going to stop raining! No umbrella
0	It's never gonna last. It's never gonna make it back alive.. But I really hope we survive.
0	It's never good when an iMac won't recognize the HD and keeps spitting out the OS disk like it tasted something rotten. Sad Mac
0	it's never good when you hit your elbow on the corner of your laptop and it bruises instantly
0	Its new patient palooza in pt today. wonderful. someone please massage my hamstring
0	It's nice and sunny day!! I slept too long and couldn't enjoy the day!
1	it's nice laying out in the sun right now
1	it's nice out and I've been working at the office all day but to be honest, I kinda like it  i'll just sleep in next week and we're even
0	its nice out..but i have nothing to do..  taking the pup for a walk  i love her <333
1	It's nice outside
1	its nice to be back home ..
1	It's nice to be done w/ school & work for a bit, but I am in need of a real vaykay. Maybe a 21st birthday present? Wishful thinking, LOL 
0	it's nice to be in my own bed, buttt i'm still not happy. 
1	It's nice to get up early...3 hrs of work done already...feels like the rest of the day is mine.
1	Its nice to have something to look at while answering those practice test.  A good view.
1	It's nice to have the odd sunny day.
1	It's nice to have things to look forward to.
1	It's nice to know that certain people do actually care... They're always there when I need them.
0	It's nice to know that my bday(today) is the same as national egg day
1	it's nice to know that you missed me
1	It's nice to know you're part of the company and whatever you do makes a difference
1	its nice waking up to him* even in this slave cot we slept in lol
0	It's nice weather in Seoul, Korea. But my final exam isn't finished... I want to go home 
1	its nice when someone tells you you're swell  ? http://blip.fm/~6iwab
1	It's nice when you meet a distant friend's new spouse for the first time and they turn out to be really cool. I have seen the opposite.
1	it's nicee outside
0	it's nicer in england than where i am
0	It's night and it's dark and cold waiting to pick my sisters up.. I'm scared
0	Its nights like these when you find out who your true friends are. Love ya steph! I'm gunna miss you major
1	its nights like this I love my electric blankie  nightnighttt
0	its nights like this i wish i had a dude to come home to  and cure the lonely nights...SMH! O well! im over it! lol
1	It's no good, I'm going to have to make a move and go to work *sigh* but hurrah, star trekking tonight. YAyyy 
0	It's no longer allowed to use AdWhirl as frontend for AdMob.
1	It's no longer my bday, but I just want to say thank you to all those who wished me a happy birthday. I love my Twitterfam! Pics up soon! 
0	It's N-O-N  P-H-I-X-I-O-N!!!!!!! Miss my Jedi Mind Tricks Music..
0	it's noon how about now? too early for the potion of forgetfulness?  Darn its gonna be a Looong Day! Sing it Bob! ♫ http://blip.fm/~7i4a8
1	its not a d&b song, its a 132 bpm breakbeat tune called "The Time Is Now" . . . get ready 
0	It's not a huge quantity, but it has saddened me. This is like the second order I had to ever cancel.  It's rare but a definite downer.
0	It's not a joking matter really. Have been made redundant before and hope I don't have to go there again
0	It's not about walking to work in the rain
1	its not as usual, my eyes arent red now! however i wear the lenses, LOL!! my eyes are bigger than when i dont wear it 
1	It's not denial - I'm just very selective about the reality I choose to live in
0	Its not early enough for people to be ringing doorbells, is itt? 
0	It's not even 9 yet and I want to go to bed...I'm so lame
1	It's not even 930 and I'm tired and don't feel like drinking. 21 going on 97? I'm the party pooper at this party
0	its not even sunny here and the office is unbearably hot
0	It's not even that I'm tired. It's that I'm SO tired I can't even function...only 6 more hrs to go
0	It's not everyday you get to say "cock fight" on TV...I'm bummed I wasn't anchoring...
1	It's not exactly easy to be on Twitter when you only speak french, ahah 
0	its not fair joe , laney belives you but you dont believe her later on 
0	It's not fair that the sun makes everyone else feel lovely when it makes me feel poorly  sad banana
0	It's not fair, and i think your really mean...i think your really mean 
0	it's not fair, i think you really mean 
0	It's not fair, this was supposed to be our year 
0	its not fair. i have to wait until tomorrow nite to c MTV movie awards, living in england tonite sucks, i want to see it live 
0	it's not fair...
0	Its not faire !! Why cant Bon Jovi come to Montreal ?? Freaking arse holes
0	It's not Friday?! OMG.
0	Its not going down  believe me... If I could be in it right now I would
0	It's not gonna happen again
0	It's not good weather outside
1	It's NOT how many Twitter followers you FOLLOW, It's how many you KEEP interested 
0	It's not hurricane weather out today and I'm stuck at work
0	It's not just a bruised rib... pain across the chest now... can barely move w/o pain.  Need to fly back immediately to HK for hospital...
0	its not letting me change my pic
0	its not letting me upload pictures
0	its not letting me vote misha there isnt a x by his box?
0	its not like spring out there is snow
0	its not looking good for the nuggets
0	It's not looking to good for the Cavs  come in LeBron work yo magic
0	Its not May anymore
0	It's not monsoon season in Telluride yet, so why does it keep raining everyday?! 
0	It's not much of a Father's Day without the DaddyMan at home
0	Its not my birthday anymore
0	It's not my birthday anymore
0	It's not my day  no good cards in poker...
0	its not nice not having any freinds  #marsiscoming
0	It's not nice today
1	It's not now... Nor has it ever been Weigly North!! Have avoid drive home!!
1	It's not often I tweet on current news items, but I have to say, ROGER FEDERER - FRENCH OPEN 
1	IT'S NOT ONLY ROCK'N' ROLL BABY!
0	its not our fault    -leah + mckenna
