1	can't wait til big brother tonight
0	cant wait til im 17 so i can drive anywhere by myself.huahaha.im too sick of sleeping at home all the time  i need a JCOOL!shit
0	Can't wait til monday night Raw! YEAH ! i am also bored !  bot usually up this early in the morning !
0	cant wait til my relief gets here..it would b great if she came on time 2 day!! that soooo wont b happenin
1	can't wait til next week - gonna be fun at the beach
0	cant wait til play practice 2moro wish i didnt have to go to jr fair board  farmgirl@<3
1	can't wait til summer vacation!
1	can't wait til summer. american idols live is gonna be the highlight i just know it
1	can't wait til the new moon trailer
0	cant wait til this time next week and is still obcessing over simon stead
0	cant wait til this week. last week of school
1	can't wait til tomorrow to revamp my webby and (re)process all of my Production Stills!    I WANT ANOTHER GIG!!!
1	Cant wait til tomorrow.
0	Can't wait til tonight. Last week I waited years for, and this week is hopefully not the last time I'll watch P. Sawyer 
1	Can't wait til wednesday... I get to finally see my momma and little brother
1	cant wait till comes miss u so much sis
1	can't wait 'till 11 AM
1	cant wait till 19th june
1	cant wait till 3am, mcdonalds breakfast 
1	cant wait till 9 to talk to my Profita Roll again teehee
1	Cant wait till britains got talent, 
1	Can't wait till college is OVER!  Russell Howard in less than 10 days!
1	cant wait till dinner is ready...yummy roast chicken!
0	Can't wait till exams are over tomorrow. I still need a job  anyone wanna hook me up?
0	Can't wait till exterm rules to bad that i can't see it.  i'll be on the road that night.
0	can't wait till Hud gets back..
0	Can't wait till I don't work at west ed.
0	can't wait till I fly home tonight! i miss my family
1	Can't wait till I get home, so I can go out for a run 
0	Cant wait till I get my Blackberry back on monday *Fingers Crossed* .. I miss twitter and facebook wen on my travels  xx
0	cant wait till i go home and get the new iphone OS 3.0 . My comp at work wont let me get itunes
0	Can't wait till it stops raining so I can ride again........  http://myloc.me/1MtP
1	CANT WAIT TILL JANELLE MONAE/PARAMORE/NO DOUBT!!!!...then AZ!!!
0	cant wait till karl gets homeee  aint seen him since saturdaay night
1	Can't wait till my due date!
1	cant wait till next weekend, long weekend 
1	Cant wait till promm
1	can't wait till Saturday!  get to meet my new baby...100mm macro!! =D
1	can't wait till' school is out!!!!   i have gymnastics tonight
1	cant wait till schools done. then your face can appear in my mind alll it wants, and no one can try and wake me up  <3
0	can't wait till school's out, but gota get through finals first 
1	cant wait till st.john starts on wednesday agaiN! =3  imissust.john.
1	can't wait till Sunday tweets this is gonna be good
0	cant wait till that flat screen comes in the mail!! im missin all the good shows...I already missed True Blood, wuts next?? 
1	Cant Wait Till The 4th And 11th May x =D x x x  McFly Single And DVD  x Woop Woop x x x x
1	cant wait till the circuis
1	can't wait till the concert tomoz. no more exams  and a concert to celebrate.
1	Cant wait till the end of the year ENGLAND HERE I COME!!
1	can't wait till The Proposal comes out! i love chick flicks
1	can't wait till the summer break start!!!!  4 more weeks of school, theeen!!!
1	Can't wait till the weekend !!
1	cant wait till thursday an am freeeeeeeeeeeeeeeeee
1	Can't wait till Thursday! I get to go to the library!
0	can't wait 'till thursday.. i want to see Izzie's surgery  .. she can't die!!.. because i would stop seeing it (grey's anatomy)
0	can't wait till tomorrow night so I can sleep
1	Cant wait till tomorrow night!
0	can't wait till tomozz gonna c my cousions afta five years nd ive got too go to skool tomozz to finish I.C.T, i have 6 lessons  nt fair x
1	Cant wait till tues! Me n tia are going to see our other halfs, while theyre counseling at the camp grounds 
1	cant wait till VIA on tue. me and my diva chic neyce j is sooooo there  lol
0	Cant wait to  see u tomorrow night! I wish i can meet u
1	Can't wait to bake cakes with my boyfriend!! Just for the fun of it
1	Can't wait to be able to practice piano 7 hours a day after tomorrow
0	Can't wait to be done with packing. Boring, dusty and frustrating 
0	Can't wait to be home and actually pretend I have a summer....too many mixed feelings about a lot of things
0	can't wait to be home but i think i'll miss the greeness of illinois
0	can't wait to be out of schooool
1	Can't wait to c 18 year old niece & 5 year old nephew 2day! And partying with my sister-in-law! My tattoo bitch!!!
0	cant wait to c mtv movie awardzz n n the hills finally  finale epo
0	Can't wait to call Shae !!! She was my best friend but moved away across the county !!
1	can't wait to check out Queba! Mari, you wanna go dancing soon?  http://plurk.com/p/xbh63
0	Cant wait to chill with my girls after school!!! Im going to miss them
0	Can't Wait To Come Back To Cleveland To See My Friends Tomorrow But Really Don't Feel Like Driving 425 MILES!!!
0	Can't wait to come home! I miss my Bubba. Too bad my parents are taking him to Canada.
1	Can't wait to debut my new shoes.....I'm soooo in luv
1	Can't wait to do the screencast with tomorrow  Should be good! Hopefully
1	Can't wait to drown my sorrows in alcohol on Thursday.
1	Can't wait to find a hair style that works for me. Cutting my hair. When? Soon
1	can't wait to find her mythical unicorn
1	Cant wait to finish these commissions
1	can't wait to finish this boring shift and get down to the gym!  #fitnessfirst #Norwich
0	Can't wait to finish this stupid assignment - rest awaits. But will last for a mere couple of hours until I must move onto exam prep
1	Can't wait to finish work at 2 and get a whole week off. WooHoo.
1	cant wait to fisnih my last exam tommorow
0	Can't wait to fully move on with my life. I can no longer dwell on questions that have no answers  ugh.  #brokenheart
0	can't wait to get a car, walking in the cold is seriously not fun anymore 
0	Cant wait to get back COD4 and MK
0	can't wait to get back home to california
0	Can't wait to get back to a real bed. Sick of a blow up matress on the floor
0	Can't wait to get back to work. Spent the long weekend moping over what I'm missing on the other side of the world.. & failing to revise.
1	Can't wait to get her nose pierced!
0	can't wait to get his hands on his new blackberry, this one is dying on me 
0	can't wait to get home already!!!
1	can't wait to get home and play with my new palette!!
1	Can't wait to get home and watch the MTV awards on IQ....New Moon preview!!! So excited!!! Wow I feel like a bit of a loser
1	can't wait to get home from work and sleep all day
0	Cant wait to get my nails done they look like hell
1	can't wait to get my new phone so i can tweet all day long
1	Can't wait to get my PC back and start playing The Sims 3. Glad it's nearly holiday so it won't affect my ever important work
1	cant wait to get my wawa coffee this morning, nom mom nom  
0	Can't wait to get off work
1	can't wait to get off work & do fun stuff with
1	Cant wait to get out of Vegas
0	can't wait to get out of work and go straight to sleep
0	Can't wait to get outa here.. I just want to get drunk and forget about it all
1	cant wait to get over these ALLERGiES ! | GOiN OUT 2NiGHT WiD MY lADiES ) lO0kS like anOther interesting weekend
1	CAN'T WAIT TO GET THE LINES, VINES AND TRYING TIMES CD!!  LOVE THOSE BOYS.<3
1	Can't wait to get to the gym....... Its free pizza mondays
1	Can't wait to go camping this weekend with my friends!!!
0	Cant wait to go cash point and see how many monies I've got left after all my debt gone. Bet its not much
1	Can't wait to go crabbin n fishin this weekend!
1	cant wait to go down south this weekend!!
1	cant wait to go home and finish watching life
1	can't wait to go home and just relax
1	cant wait to go home.. its going to be a fun filled action packed weekend.
1	Can't wait to go home... Listening to bob Marley on Radio 1
0	Can't wait to go hoooooooome.  I still have tutoring  though.
1	can't wait to go on hol with ash next week and proper girly holiday in 2 weeks with loopy lou ! good times  x x
1	cant wait to go out 2moz nite all dressed up gona be amazin
0	Can't wait to go out! Only 4 and a half more hours at work! Help me!!!
1	Can't wait to go see Noah's tonite to check out where is going to be held.  I will fill ya'll in 2morrow! #MWMI
1	Can't wait to go to Bali
0	Cant wait to go to bed just one more load of laundry
0	cant wait to go to boone to see her favorites, but dreading saying one goodbye 
0	Cant wait to go to el salvador this summer only bad side no internet which means no videos
0	Can't wait to go to Florida with Kacy on Tuesday!! Oh so nervous about the flight though... I'm terrified of planes
0	Can't wait to go to ny soon.....miss my friends and family
1	can't wait to go to nyc in october... pre-birthday weekend... seeing hair (can't wait to see it again), shrek, P!NK (woohoo!), and more. 
1	cant wait to go to ravers foreva tribe on friday!
1	can't wait to go to socal. Spend time with life is good.
1	Can't wait to go to South Dakota!!!!  .
0	can't wait to go to the beach tomorrow! can't wait to get out of here.. so far away..tho i probably won't be happy there either
0	cant wait to go to the US OPEN in NYC in less than a month! love reunions but the event for the reunion is being done not fun, funeral 
1	Can't wait to go to Thomas Park in June! I LOVE that place! New green screen and bed spread.
1	cant wait to hang out with eliza. my sis has a beauty pageant tomorrow... fun
1	cant wait to hang out with my sister sunny luu!
1	Cant wait to hangout with the ones i <3 tonight!
1	can't wait to have new demi's album  and selena's one too (:
0	can't wait to have some real food
1	Can't wait to hear much better on the new album!
1	can't wait to hear new divide tomorrow
1	can't wait to leave for California Tuesday morning   It's about time I see places that aren't in the south.
1	can't wait to make music with AMY RAY!
1	cant wait to meet my new classmates today.
0	cant wait to move my neighbors are rude as F***! i want to move to east coast to get those peeps but i have to finish ca people first
1	Can't wait to pick up my boxer Babz! She's went to a sleep over at her grandma's house with her fav brother Thornie and sister Roxy
1	Can't Wait To Pick Up My Copy Of The Sims 3 Tomorrow
1	can't wait to play some halo wars tonight.
1	cant wait to play with emily and kevin tomorrow! i love babies  of course i do have to read for Art Law
1	cant wait to prove everyone wrong & make truee friends  4<3
1	can't wait to pussycatdolls
1	can't wait to read "I Love David Archuleta" book
1	can't wait to really get the garden going.
1	Can't wait to relax out back and read my book
1	Can't wait to run into Arditi, one of my faves  anyone else out there tonight? Look for the braid in a lot of colors
1	Can't Wait To See June 12th  So Excited!!
1	Can't wait to see and  at BAMBOOOOZLE!
1	can't wait to see and support her in her quest to become the next american idol
0	cant wait to see and (my two faves) on the CMT awards!!!!!! Still sad i can't get ticks for the concert!
1	Can't wait to see & at ABC on 22nd of september  its gonna be fresh!!
1	cant wait to see Angels and Demons on wednesday evening  i hope it lives up to the expectations
1	can't wait to see blake now.....my days off are all about quality time with the little monkey!!!cant wait til his summer hols
0	Can't wait to see boo tomorrow. i didn't get to see him that long tonight.
1	cant wait to see boyzone again in june
1	Can't wait to see charice pempengco at Oprah on May 18..
1	can't wait to see conan again
1	Can't wait to see everyone at monday night cell!! 6:30 till 8:30 at my place, all welcome 
1	cant wait to see everyone tonight  dinner at my house tonight, be there or be square ;)
0	can't wait to see her momma on monday...but wishes she could be in texas with the family on father's day..
1	can't wait to see his friends back in Philly, and is looking forward to going to Jen's wedding. 
1	can't wait to see Jessica Mauboy perform  sssooo pumped!!!! wooopwooop 'stylin up' here I come hehehe
1	can't wait to see Julian and Kim tomorrow night
1	Cant wait to see Malaysia, Vietnam & Singapore... traveling with my mom, aunt colleen & cousin Lynette 
1	can't wait to see M'sieur Le Wolf this evening
1	Can't wait to see MTV movie awards! But i'm from Denmark, so its comeing this thursday!!! 
0	Cant wait to see my baby on tuesdayyy. . miss u   Xxxxxxx
1	Can't wait to see my bffs and
1	Can't wait to see my boo tomorrow!  Nite Twitterville
1	Cant wait to see my boy tomorrow
1	cant wait to see my cute little british grandma  4 years is way too long to wait...
0	cant wait to see my fam in a couple of weeks. never been away from my mum for more than 2 weeks before.. now i LIVE in another state  misu
1	can't wait to see my fam tomorrow
1	Can't wait to see my hubby again in BOF season 2 on February '010
1	can't wait to see my lil sis walk across the stage to graduate in a couple weeks! im proud of her
1	cant wait to see my lil sis! i love her so much
0	Cant wait to see my man.... I miss him
1	cant wait to see new moon trailer!
0	CAN'T WAIT TO SEE NEW MOON.... but that wolf was looking kinda fake
1	can't wait to see paramore sunday!! i just finished the front of my shirt. i am stoked, to say the least!! 
1	can't wait to see SP on the 22nd...but until then, I'll be busy with work and such! see ya tonight Jen and Nick! luv ya!!! 
1	can't wait to see take that, and next tuesday.. 
1	Can't wait to see the boyfriend so he can cheer me up
1	Can't wait to see the dancers Britt and Alison we had such a good time on tour can't wait to do it all again
1	cant wait to see the harry potter cast! daniel, emma, and rupert .. and also the new moon sneek peek 
1	Can't wait to see the Lost finale tonight. Going up to cousins to watch it with a few beers.
1	Can't wait to see the MTV Movie awards.. 8pm tonight NZ.MTV14
1	Can't wait to see the WWDC Keynote tomorrow.
1	can't wait to see 'Transformers 2'.. C'me on, Shia! Yippiee! 
0	can't wait to see transformers! but i'm gonna have to wait one more day, no midnight showing for me 
1	cant wait to see Up with Tay tomorrow  .
1	cant wait to skool is over!!! imma miss dem chicks and dese niggas but its all godd...we can always keep in touch...KIT
1	Can't wait to sleep after a long cooking class  .... Night night *))
1	Cant wait to start my 2nd job on Tuesday. I gotta feeling im gone actually like it  Hope so. smh.
0	cant wait to stay in the lowry for jb in november. is so far away
1	can't wait to take advantage of being close to FRIENDS...!
1	can't wait to talk to celebs on here!
1	Can't wait to use her Freespirit discount
0	Can't wait to watch and see what happens with Jon & Kate....more than anything I feel for the children
1	Can't wait to watch good news week.... Ross Noble is on
1	Cant wait to watch my besties last concert of the year!
1	can't wait to watch pussycatdolls tommorow!!!
0	cant wait to watch tarix jabrix 2 .
0	Can't wait to watch the movie Up on tues! Til then I must suffer 2 more days at work
1	cant wait to watch the mtv movie awards  oh & the hills,lol. my bbygurl is comin home soon<3
1	cant wait to watch the MTV movie awards tonight
1	cant wait to watch the MTV MOVIE AWARDS, I am sure it will be great........HAPPY DANCE 
0	can't wait to watch the MTV Movie Awards. a shame that it isn't on UK tv until tomoz night.
0	can't wait to watch the Tonight Show, this evening last one with Jay 
1	can't wait tom. I hope I can update you guys tom. haha
1	CANT WAIT TOMMOROW - FAMILY REUNION  WOOT
1	Can't wait too see kings of leon perform at the movie awards
1	Can't wait until 10:45.
1	cant wait until 17th june going to see oasis in murrayfield
1	Can't wait until 2morrow New haircut, Mommy Bday && Day26 concert 
1	cant wait until august! TAI with nikki
1	can't wait until her grounding is over!!!!!!! only 107 more hours! then i got this!!
1	can't wait until june 16th
1	cant wait until lunch period<3
1	cant wait until my birthday
1	Can't wait until next weekend...Yes, I'm looking that far ahead...Going to GA and a 3 day weekend! Hollerrrrr!!!! 
1	can't wait until September! Going to Strathclyde Uni to do teaching and I'm soooo excited!
0	Can't wait until Sunday's USA vs BRA rematch.  Sad that I'll be at a baptism ceremony during the second half of the game.
1	Can't wait until the end of the week, no more exams 
1	can't wait until the new Melrose Place comes on in the fall!!
0	cant wait until the new moon movie hits theatres but in australia it usually hits us last
1	Can't wait until the new Star Trek movie comes out, looks good 
1	can't wait until tomorrow  and the day after that. and the day after that. and...
1	can't wait until tomorrow. getting tickets to smackdown/ecw.
1	can't wait until wednesday afternoon - no more exams!!
1	cant wait untill 3:00 2day
1	Can't wait untill i start my make up artistry course
1	can't wait untill summerbreak.  first is sundance festival, then kaivari festival, danish, german & then FINALLY england!
1	Can't wait! Have to take you some pictures  Have a wonderful day! xx
1	can't wait!! Must attend Bloombury festival one day
1	can't wait........................
1	can't waitt for liness,viness,&& tryinqq timess 
0	can't walk anymore!
0	Can't watch BGT  boys on one tv, OH and inlaws watching crap DVD on other. Thankgoodness for twitter keeping me informed!
0	Cant watch Conan because I forgot we have no cable. Fuck! No tonight show for me.
0	Can't watch it
0	cant watch the game tonight...too much homework. wishing i was at summerjam too
0	Can't watch the hills finale tonight  so mad!
0	cant watch the mtv movie awads tomoro
1	cant watch the thing on dateline about taylor swift, its red wings pre show. o well.. MTV movie awards pre show, MUCHHHH BETTER!! 
0	cant we just stay friends
0	can't wear that jacket
0	Can't weit for Mia to get up and come on bearshare, we didn't talk for 3 days 
0	cant work out if my headache is a result of too much sun or too much booze yesterday.
1	Can't work out the PR Connection today. Must be Movies
0	can't work out why firefox doesn't let me log into shelfari
0	cant work with the tedious noises of middle age mothers/children/dogs coming through her rapidly decaying windows
0	cant workout today... very upset... feel like i'm huge... not good
0	can't you just understand that I need to be loved and not hurt
0	Can't you see I'm trying? I don't even like it
1	can't you see my happiness?
0	Cant....fall.....asleep .....
1	Canton Choral Society concert 3-430. I'm one of 5 soloists for the Vivaldi Gloria
1	Cantona on this Friday. Can't wait
1	Cantonese sounds beautiful.  but learning is not easy. :/
0	cantt sleeep in with the heattt  ox
0	cantttt fall back to sleep.
0	cantwait for imats!! oh wait, im not going. darn. 
1	canucks vs. st. louis playoff game #2 - GO CANNUCKS GO !
1	Canyon wins, 0-1. Game 2, june 6th at 5. Be there or be square! 
0	Cao Cao flew away  i nw feel like a mother whose wilful child spends d nite outside. Is he hungry? Cold? Thirsty? Comfortable? Safe?
1	Cape cod for the weekend, two family cookouts  and the beach? summer is here!!
1	Cape Cod with the family and relatives for a couple of days
0	Cape Town!  transit   excited
0	capeeeeeeeeek, push up muluuuuu di camp pringayu  untung udah ngga push up, tp camp sick
0	Capital FM Ball!? If anyone knows of anybody who has ANY spare tickets, could they pleeease let me know? I'm desperate to go 
1	cap'n crunch, cleaning and laundry. THINKS she's taken my baby to get tortured, she's mistaken. 
0	Cap'n crunchberries are not real berries. All these years of fraud.
1	cap'n crunchh after a long day makes everything okay
0	Capped. Just got the email, on my way home now hoping the movies downloaded in time. Was meant to download last night but pc went 2 sleep 
0	Capped....so annoying
0	Capping vids for the Gallery. She's so sweet in interviews! No Is in London though  http://bit.ly/tOmWM
1	Capri boy want's me! Haha
1	Capri sun for bfast. I really enjoy the fact tht my parents are talking to me
0	Caps  Well, there's always next year.
0	Caps break my heart again
1	Capstone Draft v4.0 submitted. Presentation on 6/2/2009 EDT. Almost done
0	Capt. Van Note's award dinner later! Getting eyebrows done in a few...then studying for finals
1	Captain Jack is back
0	captcha virtual domain  DWREngine._handleResponse false  Hunf...
1	Caption this!   Need a caption for my goofy dog.  Thanks   http://bit.ly/xgUSc
0	Captioning photos from yesterday�s interview in Upper Nidderdale. Sadly, a shot I had  high hopes for is pretty disappointing 
0	Car 91 being towed off course
0	car accident before the gig in Darlington...
0	Car accident...smh nothing serious just sprain my pinky
0	Car accidents are no fun! My effen neck and head hurt.. I need a massage!
0	Car broke down
0	Car broken
0	Car cleaning...mine was pretty OK anyway. Nick's was horrid
0	Car damage.  can anyone fix this boo boo?  http://twitpic.com/6qnt8
0	Car dropped off to be serviced, but hopefully not for too long. 
0	Car electrical problem fixed, was just a bad ground. No A/C though.  
0	Car failed MOT
0	Car failed MOT then I got the new parts needed and they couldn't retest till Monday
1	Car finally repaired - sensor defective - set budget back a few but can't complain.  I'm on the road again.
1	car fire at 5am. fully involved. sweet. now back to sleep.
1	car free day.. nikmatnya mandi hangatnya mentari bebas asap polusi.. berharap every day is car free day..
1	car got a small makeover
0	car got bashed at my work!! not happy
0	Car got broken into last night, nothing taken though.... Great criminals lol.... Neighbors weren't so lucky 
0	Car got broken into last night. Feeling violated!
0	Car in for pre MOT service. Expecting a very big bill the way it's been groaning and creaking
0	car insurance bill came in the post today so I have to hold off upgrading my computer for a while
0	Car insurance is killing me  £1192! It's a killer when you're young, worse being male, car insurance is so sexist! Women are so lucky
0	car is all cleaned out now and awaiting it's pending doom sometime next week perhaps
0	Car is dead.
0	Car is fixed. I'm now £163.64 poorer
0	car is in the shop
0	Car is injured and stuck in Dallas
0	car is messed up  had to chill on freeway today while it mellowed
1	Car is now cleaned.  I can actually ferry passengers.  Amazing.  Although they still have to share the backseat with a ton of books.  LOL
0	car is overheating
0	car just got backed into  pooo!
0	Car less   I think I was bamboozle By niq348 aka Tricky Nicky Salazar.
1	Car loaded. Picnic packed. We're heading for the beach in County Clare. But which beach? Suggestions?
0	Car maketh loud noises when tilted (on hill, wheel turned left, etc). Should have it looked but am super f*ing poor...  May get skates?
0	Car misbehaving again.  Trying to make it work before practice starts...    #fb
0	Car needs a new starter  had to be the same time that road tax is due, isn't it?
0	Car needs MOT tomorrow
0	car not behaving.  it already needs a check up.  now it may need more.  $$$
0	Car over heated.
1	Car Party with Sami in the middle of the night...just like old times.
0	Car registration fees this year =
1	car ride to the bamboozle
0	Car rides suck...Twitterampaging with later...I twant to sleep
1	car searched, had Coldstone, now movie night... good day 
0	Car seat check called off, officer was not there.  now i've really wasted my morning.
0	Car shopping plans postponed. AGAIN!   but its ok.
0	Car shopping was a bust  i wish i was rich!
0	Car shopping with kacy yay
0	car shopping with/for mom
0	Car show season has started without me
1	Car show was really good but was knackered yesterday.  JUst went for a walk in the afternoon.  Got lunch with outlaws and dad today
0	car stinks of curry
1	car thermometer says 95 degrees...Welcome to Texas!
0	Car trouble!  Getting towed!
1	Car troubles suck...Moving sucks...But we'll make it through
0	Car trunk latch is NOT working...  Can't get stuff out... Have to wait 'til tomorrow
0	car was broken into last night. lost a couple CDs (1 of which wasn't mine), & my emergency USB solar charger. right in front of my apt. 
0	car was smashed and towed away
1	Car wash all morning..oh so hot out. Picnic now. I'm gonna get super tan. Text me.
0	Car without ac not good, too hot feel sick. 
0	Car wont start.
0	Car wouldn't shift into park again...  now I'm worried. Cars are money pits I'm moving to Europe and riding a bike.
0	Car wreck  my car's front bumper looks like wall-e when his one eye falls out and is hanging there by a few wires
1	cara to nina: okiess thank you so much  xx
1	Cara: Am out at a friends house atm. Really excited about tour starting! I wish i could go with them! lol. I love them!  x
1	Cara: Im half way!!  x
0	Cara: Today could be a long day  Fook all to do. hahahaha & no dad i dont want to go to a stupid kite festival! :L xO
0	cara: worst night sleep in history!! think i must have got about 3 hours at the most  Hateee being ill!  x
1	Caraleo :S The book is on the table....
0	caramel was a bad idea
0	Caran d'Ache Prismalo I in the US. These R my favorite pencils, the only ones I use. Almost impossible 2 find them here.  Advise 4 me?
0	caravan is in the field!!!  and in one piece. now gotta start work  booo....
0	carbs are the devil. but they make me so happy. so by that logic does that mean the devil makes me happy? oh no....
0	Card Machine not working  But fear not we simply call upon our ancestors from the stoneages and do it manually! Tedious
0	cardiac dysrhythmia again this weekend... need to take a break for some days
1	Cardiff giving Gloucester a 5-try thrashing! Great game  #rugby
