1	people usually don't enjoy being killed...not even camera-breaking-people...just saying
1	Thanks! and to you as well!
1	brilliant!!!! did you enjoy it
1	ahhaha. oh, what an embarassment! stop reading them 
0	come thru- I put it out there for my twit fam! U aint answer (as usual)
0	Fair dos, poor thing though 
0	It was freaking delicious!!! But I'm still hungry
1	i'm here  haha
0	WHAT??? Ok, lol, I do NOT look like Rafael Nadal!!!! Lol, more Tim Henman, well, thats what everyone says 
0	HAHAH cannot! My singing's like shit  & YOU MADE THE 'HOW WELL DO YOU KNOW ME' QUIZ ALR? Me&June wanted to make tgt with you tmr
1	may i congratulate you both on making an adorable lil boy
1	good movie indeed.
1	thank you!  glad the echelons like it!
1	#Starstrukk - I'm excited
1	#Starstrukk http://bit.ly/kf8ON <3 love them
1	'hott'  i love that song (of course i love more than just that one) ha
1	oh no he didnt! see you in Australia!
1	richman, so far 
0	 lol  still feell sorry for him lol  watch BB today?
0	ugh that sux  whyd it get pushed back?
1	We all have greater heights we can go in all of our talents!...see u at the top spot
0	Just couldn't pull it off with Win7, eh? 
1	Get 100 followers a day using www.tweeteradder.com Once you add everyone you are on the train or pay vip
1	haha! i know!  Twitter's very addicting!  And I shall meet  twitterholic celebs there like Demi (: â†’ http://twitpic.com/6np19
0	i cant help it im so tired. work is exhausting. lol.
0	we don't even have air  Thank God for window A/C units!!! The humidity is horrible.
0	aww  me monday morning Chinese paper 1&2 double crappy
0	boooo.  I underestimated the amount of zzz I have to revise.
1	can u sneak off too the bathroom for about 2 minutes so we can talk\?  would be much appreciated
1	don't i know it
0	good luck in the exams... junior cert starts tomorrow ..
1	Ha, ha! Thanks! Looking forward to getting to know you...  
0	I work at Schneider Electric, but not much longer. They are sending our jobs to Mexico 
0	Aye, Virgin partnered with T-Mobile. I paid ï¿½10 for their 24 hour access seeing as my train journey was 4.5hrs 
0	hahahhaa i'm dying, man. i missed these somehow. sorry about your dream. i hate that. 
0	9a7!! has been out of touch
1	Heheheh good stuff! Walla my day was extremely boring but thank GOD I'm home now.. Relaxing shway
1	HUGS  Yes, lady, survivors are a determined group  Last night went well...I did not cry!!!
0	 well ok then, u do that a lot lately.... 
1	a frog ontop of a frog ontop of a frog ontop of a frog, a pyramid of frogs, starting with biggest with littlest on the top plz 
1	Those are good enough reasons for me!!! Hope you've enjoyed it
1	I'm glad you aren't dating that guy anymore.  Sounds a little...weird.
1	sent   anyone else want some old scenarios? #MCRchat
1	hahaha, vici told me that like a week ago. but she said even though she likes them, she'd be one of the 5%  meanie.
0	no I had guests comeover at 7 so I couldn't go... Sorry
1	Same to you!
1	having a cappuccino in my new mug!  guna b a smooth nite 2nite yeh mush?! beautiful......X
1	relax i wasnt driving just bcuz. It was for a reason lol
1	heyhey! i'm a parawhore too! LOL!
1	mkay! thanks! i'll go check it out!  ugh! so stoked for the album! why can't it be sept. 9th already???
0	That sucks so much, I'm so sorry. We just lost Holly a few weeks ago. 
1	hahaha yay! that means he'll be up and ready to meet his future boyfriend...whiskers!
1	the link works for me
1	lol thank you. But I tweet nonsense, that's the difference between you and me. 
1	sounds like a lovely evening...Good night now
1	thats cruel but bloody funny!  x
1	 I had such a good time laertesgirl....
1	Ahhh but it's brilliant
1	http://twitpic.com/4e748 - Actually, that does look much better!  Your hair is great! Gorgeous colour.
0	Ohh of course. She did stop once though, end of Dream. John Woodvine & Zoe Thorne, only ones not signed my programme 
1	carm dwn hun im sure u do breath it will go fine  u will do amazing xx
1	i added you too.. you should so buy my album on iTunes
0	HAHa normally yeah BUT when its PP time the whole trip takes more time
1	if you like 2 laugh..have a good time..follow me..its just that simple
1	yeah, well i have no money cause i havent seen my dad for money and my is saving up for america, and plus i have seen it 
1	*snickers* crazy people pills that was a good one  but i think he stopped taking them lmao
1	Morning Chickie
1	i love you in all kinds of ways, and i love you in all kinds of social networking. 
1	eh, why not?   Maybe it's some sort of anniversary, ___ years since Tetris came out or something like that?
1	Thank you St. Anthony
0	if u want him off the bottle ya gotta let him cry  No fun! My son cried 2! But it will only take a couple of sleepless nights!
0	hope you understand too
1	 LOOOOL, what is a lenchen, how cute  
0	oh no  I hope he's ok
0	im so itchy!
1	All-American Rejects
0	Hope your back feels better today.
0	at least that's somewhat of an excuse.. it would be very hard to read no books  for me anyways!
0	raining in the midlands too
1	The whole country is getting pissed on this morning! Tomorrows forcast ain't much better. Least I ain't gotta do the garden
0	awake no party tho
1	GERMANY is sunny ... you here ???  if so.. enjoy the sun
1	you will love love love Hamburg.. go and take a walk around the "ALSTER" weather is beautiful
0	LOL The snakes were nothing, but did you see how the cooger was trying to get a piece of my leg?  lol
1	Man...working hard! I remember you too...so is it Deon or Izeko? Forgive me if I spelled Deon wrong
1	It was in response to you dear Jamie message from your lungs
1	Babe: Wake up. Friday. Night. Too. Much Stuff.  <3
0	you replaced me
0	Here's a haiku:  Your sister likes it Big. At least thirteen inches That's why she called Jeff
1	Woot! Happy Birthday!!!! I hope it's magical for you  ... and I owe you a big thanks ;) ? http://blip.fm/~63mju
0	11.20!  just got up!  the sun was out 20 mins ago and now its gone!   wait!  its not 4:20 by u is it!?!?!?!?!?!?
1	Good to know.  I'll report back later on my progress. Now I'm extremely motivated to finish my work
0	have a week left before our summer break starts out here
0	I could tell from your song selections.
0	i havent even smoked yet
0	I'm dry too
0	it was intentional. he planned it quite a bit ahead of time too.   I'll see if I can find the article I read earlier.
1	mmm indeed, enjoy 
1	sending u good weed karma  lotta warm vibes
1	LOL. Okay. I'll tell you when I come to it
0	was it random or during a friends cut? And did they say why? Also, 
0	Speed in for Joe again  Check out the article I posted on JNN
0	What happened to you?
0	I miss you way more than you can imagine
1	What is the theme you chose for the photos we are to take at 4am on June 21?
0	? ? ??? ?????, ??? ??? ???? ???? ?????? ? ?????????? 
1	??????? ??? ??????? ????? ??????????
1	Ð?Ð¸Ñ‡Ð¾, Ð±Ñ‹Ð²Ð°ÐµÑ‚. 
1	Ð¡Ð¿Ð°Ñ?Ð¸Ð±
1	Ð¨Ð°Ñ€Ð¸ÐºÐ¾Ð²Ñ‹ Ð²Ñ?ÐµÐ³Ð´Ð° Ð±ÑƒÐ´ÑƒÑ‚ Ñ€Ñ?Ð´Ð¾Ð¼ Ñ? Ð½Ð°Ð¼Ð¸-Ñ?Ñ‚Ð¾ Ñ„Ð°ÐºÑ‚.
1	Ð° Ð² #Moscow Ð¿Ð¾Ñ‡ÐµÐ¼Ñƒ Ð½ÐµÐ»ÑŒÐ·Ñ? Ñ…Ð¾Ð´Ð¸Ñ‚ÑŒ Ð² Ð±ÐµÐ»Ñ‹Ñ… ÑˆÑ‚Ð°Ð½Ð°Ñ…? Ð¯ Ñ?Ðµ Ð¿Ñ€Ð¸ÐºÑƒÐ¿Ð¸Ð»
0	Ñ? Ð°Ð±Ñ€Ð¸ÐºÐ¾Ñ?Ð¾Ð²Ñ‹Ð¼... Ð¼Ð¼Ð¼... Ð­Ñ… Ð¸Ð· Ñ?Ð»Ð°Ð´ÐºÐ¾Ð³Ð¾ Ñ‚Ð¾ÐºÐ° Ñ?Ð°Ñ…Ð°Ñ€
1	 hey saw that you followed me, I'm Angel 
1	I have no more props to give to you for the day so, I will give you a *thumbs up* 
0	17th, American timezones. We get it tomorrow. 
1	 My iPhone changes the words as I type them......I saw it after I posted it....try SINGING lol.
1	branches/movements just serve to divide us more...  Love & Light
0	  trust me though we're gonna be there till late!
0	 i don't get no bonding time lol;
1	heyyy boo..im here now
1	its iamsoannoyed.com
1	maybe it was the real MJ? what job is it?
0	why are you mad at me  I didn't lie to you!!!!! Better yet, HOW did I lie?
0	I don't have bbm
1	i prefer House
0	Yeah... it's ironic   And hereditary apparently.
1	its still piled up  naughty me, easily distracted 
1	hahaha yes to vegas!! We goin to hav e fun!!
1	ok beetje laat maar, what? breakfastpizza . student alert 100%  do me a fav and dont drink till you end up in the hospital ;p jwz
1	aaaawwww ur a good daddy.
0	- Season four! I don't like him.
0	Looks like Raleigh, NC will be our closest show to VA Beach on 10/17 or DC before that 
0	aww feel better jas! post more pics of ny, i am dyingggg to go back 
0	OK! i'll tell ma moma n pa 2 vote 4 her. Cos i'm too young
0	Aw really?  How did you see my Tweet? Demis video thing right?
0	i emailed your friend andrea about boston. i hope she emails me back  can u give her a heads up?
0	 *slaps* DON'T YOU EVER DO THAT TO MY TWIN!!!!! EVERR!!!! YOU PSYCHO!!! No i'm sorry!!!
1	lmao!! your fun to confuse!!
1	Loveeeee you!
1	 *shocked* oops, sprung. asked me to help him varnish. But I ahh, I dont like it 
1	i see it doesnt stop you at all  btw i am glad your doing well And i am glad to hear your doing well  too
0	Andrea was on Facebook 5 hours ago.
0	lmao!!! I'll do it all mare!!! I miss u!
1	xk tienes 2 twitters??????
0	I miss U sister.. When i can talk to u ? shit ! I want to talk to u right now on msn  i miss u sooooo much...
0	duke of ed silver thing
0	what did you say? lol. messenger wont open doh. have to get ready for work so dont have time to reboot
1	thats because u had a long weekend
0	lutz yea same but did u see d trailer ? It looks like they have cut out loads !
1	what did I ever do to AT&T? no love. thanks for trying.
0	no  6 more weeks of school UGH. Are u enjoying ur holiday then?
0	you know what? I'm jealous your sunbathing! and im at work
1	 Can't wait to see the new vid!!! Can't wait!!!!!
0	 What happened to your planned Orlando stop?    Gotta rearrange schedule now...can't miss tour!!!
1	Congrats on your #flipoutfriday win
0	sorry it was a pain  but thanks for voting for my little guy
1	http://twitpic.com/6m7c0 - Ha, wait what does the last word say i cant catch that 
1	  I'm probably signed up for it.
0	i know more dream songs than you, kid...so shush! *&. i mean as far as live streams..you lied to me 
0	I haven't heard anything like that.  I was just saying the way Donnie is talkin' ..feels like the end of the road...
0	damn got 2 be event 4 me 2 come see u?
0	lol... winter is the only season that I wanna experience sooo badly! Over here it's always hot cz of the tropical weather...
1	Hey good to see you on Twitter now too. Been reading since you came over to SB Nation.
0	haha i know xD i dont want to study for school
1	 Brandy don't feel bad, I am 37 and still don't know 
1	- free internet  as much as I travel thats good news, thanks for the heads up - www.ThePulseofEntertainment.com
1	ALRIGHT GIRL Ill try to get an answer another time. Peace and love Bandy!
1	BRAN! hiii  who was pregnant that last season of Moesha lmao no seriously i've been wanting to know 4 years!
0	brandy why dont you ever say hi?  i buy all your albums and support you to the fullest    i feel sadddd
1	hey bran bran  just wanted to say hey and i think ure the best! xoxo
1	I believe you were correct on the first round  *Ought*
1	love you too brandy
1	nice capture
1	Save it to your computer so you can use it too.  *Hugs and Blessings* ?Christine
0	that is so scary! I fear for celebrities some times. I'm so sorry u have to deal w/ that.
0	when are you coming to germany... maybe you will notice me if i mail this like 100 times  sad face --- asked like 100times...
1	you both are pretty bomb trust
1	youre so beautiful by the way, i love your new profile pic!!!!! God i wish i can be amazing like you!!!! 
0	Chatrooms make me dizzy.  LOL.  There was a video of Joe though.   I can't seem to make it work for me.
0	Holy cow.  And I was mad about my internet not working.  that sucks.
1	me tooooo, and i'll give you her # so you can text her happy bday 
0	OMG thats awful  im sorry
1	 I know 6 Ben Ides on Facebook
1	Never really got on with languages - apart from programming languages that is
0	re inspection and vle - we offered them login but don't think they looked
0	TMNE09 already full I'm afraid  Where are you again? Think a NW one coming up soon.
1	love that thanks. Which lottery?
1	The rush is here & my face hurts I'm smiling so much!!!!!  Must tell u my dream honey;)
0	, I heard from a little bird that you're coming to the Dusable Museum in Chi and it's sold out.  Say it ain't so!.  O well
1	oh and request;more Embrya songs on tour.Kthnxbai!
1	That should have been *where.*  I need Twitter spell check.
1	Welcome to Michigan
1	hey thanks for the meme tip will go and see what can be edited  thanks Cool last name
0	Omg don't scare me like that
0	OMG! i think something is wrong with your phone lol  because I havent gotten anything after u said you'll be back tues.   ???
0	  you still lovin my toast secret huh?
0	 just remember this too will pass, sucks! I had one last nite at work...murphy's law!
1	 NICE  - I did hear they got put on tv several times. That makes me happy.
1	I agree. The dancers have entirely too much clothing on...  It has been fun watching them improve, but popularity is not skill IMO
1	minced pork, those skinny Korean leeks, onions, spring onions and seasoning: salt+pepper, sesame oil and soy sauce 
1	...Mel, what are you counting time for? countdown to deadliest catch? logging your hours of boredom? 
0	why can't you dance/ball?!
1	I think I will. Thank you for always sharing these great books with me.  Is it a continuation of this story or is it different?
1	 Oh yours is so cute! I <3 it!  Maybe i'll give it a try
0	Morning B! I'm at work the whole day today
1	Nearly done. Y'know, if I weren't so soapy I'd definitely be sweaty. Hard work this, but so worth it 
1	You mean wouldn't like my beer flavoured bikini? Ah well. Have to shut your door, wings soaped up next 
1	 it looks like you just moved in! craigslist has FREE furniture, get some!  Also, fiesta at my house when I finish moving!
0	IT WAS AWESOME!! but guess what
1	I envy you, but I have only 4 more days, and then I'm not really going to high school... so its all good 
1	aww cutie from way back
1	fine just bored need a playmate
0	 But seriously I can understand if it's based on your why you'd have him try to ask what's wrong and speak a bit more in t' tube
0	Meh. MEH! Also apparently I'm too old to get money or presents from my uncle now  Sucky.
0	Stop getting angry at me, I was only trying to spread a little love and joy. LOVE AND JOY! 
1	i would say so!
0	me toooooo
1	*ahem* 'Twinkle tiwnkle little star.....' It works 4 my lil guy
1	*gasping for air* That was Perfect!!!
1	DM back!!    PS- still ignoring you
1	sounds like fun  watch out for bears and other wild life though ha
0	I know  I can only thing they were breaking too many food processors. They weren't exactly gentle...
