1	i just sent you a email on ur gmail acct..so go check it
0	i aint got any credit left
1	ahahahahahaha... just keep trading!  maybe we'll end up with a crumpled-up napkin, or even a dirty old sock!! 
1	you can buy iceblocks from the store.. I've done that before.
0	aw, deleon. 
0	awe.  I'm sorry sweetie.
1	HAHAHA ME! ME! ME! im like u should come, u better come, oh wait u dont have tickets! haha 
0	i cant go  when u guys come back
0	I hope you're ok, Singer 
0	Single? Aww  Are you okay?
0	I'm all out of Cabo
0	humidity sucks! it messes up my skin coz i have ultra sensitive skin  boohoo - hope u enjoyed those m&ms && cupcakes
1	~I have 2 vids to send to you.
1	no problem camii
0	when was BCP6 announced??? I absolutely have no idea abt it  damn missed something imp
0	technically not uni bound as Im at home. There is tea here! next week Ill be lab wench... sad  Enjoy the hol while u can
0	oh no...did kitteh cross the rainbow bridge?  *HUGS* sweetie
1	I believe it's pronounced "fuck off, you whiny bitch," which I will. 
1	thats so unhealthy!
0	 LOL...that doesn't sound very good.    I think I'll stick with DTV.  Tks 4 the info!
0	Such a sad night for the Cards!!
1	lemme know if ya like them I can suggest more
0	  ya know that feeling you were talking about last weekend? i was a'feelin' it just a little bit ago.
0	aw, I'm sorry love. Mine was killing me earlier too.   i command you to feel better!  <3
0	Only two shows in the US?  Maryland wants you!!
1	 maybe a good thing at this hour !
1	and what are you wearing that you wouldn't normally wear? Go on, give us a twit pic 
0	I'm at work
0	dang u gettn it in huh? Wat was the drink u made 2 stay awake? Um Im not goin in til later on 2day..Me got a hangova!
0	Hey Frat! So, the movie of my fav superhero is a bust?  
0	 Hey! Sorry u had to come back to work!  How was Hawaii?
0	I am lost. Please help me find a good home.
1	me likes the picture of your owl   'K'
1	bring back some mambo sauce
1	nope, it was another one.  Happened around 5ish yesterday....deleted FB post & thanks to you, changed all my passwords 
1	Thanks for the #FF shoutout! Hope you r hvng a nice weekend!
1	lol...looks  like the secret is out of the bag!
0	it did make me feel sad to see swineflu bods with blankets over heads but then I realised how ugly they were.. PR deals
1	to the Wonderland Arts Society, u should be highly recognized...you all do masterful work at making musical masterpieces 
0	no fun with out the gun
0	yes im following them now but they seem like a competitor  oh well ima be better LOL or maybe we can work together
1	Tweet tweet
1	 Thanks  Anyway my name is kamel
1	no. Dylan is my hot guitar teacher.
1	yeah, me too but instead of staring new ones i move the one i already have  i moved it like... 6 times since january 
0	Can yu make 1 for me  i lost alot money dix tym
1	night you two  i feel like i'm in a raison bran commercial - two scoops ...
0	Hey! Thanks for gettin in touch! Hotter is on itunes but no Espanol  My spanish song on itunes is Ilusion. Check it out
1	don't worry mate, you'll be fine, listen to some relaxing music and take plenty of water 
0	No you're not :O I'm so jealous
1	haha yer - what can I say? Nice someone's willing to look after me for a change
1	your the best!!!!  gracias!
1	haha, i don't know actually but i know a friend who found hers in Hong Kong in one random market so you might too, hehe 
0	boo!! It did not reply
0	bff I miss you
1	MIssions?!?!?
1	"off and my bathing suit and camera ON?!?! Tempting!!!" - wow.. I only caught this part of your tweet. lol
1	give me a month or two to get into better shape and i'll run alongside with a stopwatch and water bottle
1	hehe. found a nomnom friend for you . he looks almost as innocently michievious as you  http://tinyurl.com/c8p6sj
1	if you only got half done, you'd still out perform a majority. you're a true inspiration, christina 
1	LOL... Well, I am sure we all wish we could help.  Just try to make sure you can flex and grip. 
1	One word- COLD!!!  I will take the sun!!'.
0	page can not be found.
1	U-S-A ! U-S-A ! U-S-A ! Oh sorry. Got a little RAH RAH-ish there ! RAWRS...
1	When I have a few more characters to work with I'll tell you all about him.
0	lmao. damn chung. I was fooled too
1	I hear ya!!! Nothing wrong with that! Enjoy your time off!! 
1	I thought your blip would be this song...hehe" It IS another of my favorites.  â™« http://blip.fm/~89687
0	do you know when it goes online? i'll be at work til like 930 so i'm going to miss it.
1	out with big sis and friends
0	I can't  I have to work in the morning! Ant there is no cover u just have to have the secret "door code" lol
1	Have an excellent Mighty Wknd! Yr lkng more and more like a vlogger everyday.  The road back!
1	me too  and you are funny, sweet and special and i want to u know it.
1	Long live Winston!
1	Oh, good to hear! I misunderstood as I only skimmed, because I was at work. Glad 2DBoy is ok! 
1	I can't, I'm studying so I don't fail  Come over, I'll make u some tortellini or chicken or a chicken salad.
0	O'Halloran
0	Happy Birthday, babe! (Sorry is belated  Bad friend here.)
0	HAVE LOTS OF FUN....GIVE BIG KISS & HUG TO MY BABY THE_KHLOE....MISSING HER ALREADY..
1	I know - aren't they cute?! I want a pair of them as pets
1	You have the best Twitter bio.  Ever.  Pretty much sums up my feelings on life.
1	I LOVE your background !!!
0	i also wich EMD would have won   i don't like malena :/
0	I would, but I don't have a scanner. Sorry 
1	No wayy! :O whenn?
1	Okay me too  well listening to Hoedown Throwdown
1	thx for the ff on twitter  â™« http://blip.fm/~8blqi
0	i said i was sorry megan.
0	You can buy the Ateneo shirts in the LS bookstore! You want me to buy one for you? I miss you so much,Babygirl! 
0	binary data from a proprietary communication protocol, rather complex. And there are MANY different data structures 
1	Thanks for the real world haskell definition!
1	I'll hold you to that!
0	please don't take it the wrong way.
0	That sounds shitty too.
1	yeahhh I framed it   http://twitpic.com/7ipxo
1	declare this the summer of Vegan Handmade Giveaways! Stay tuned!  YAY!  I love Vegan Handmade Giveaways!!
1	 share your babies with me?
1	much, much love 
1	T.J., thought you might enjoy this...http://bit.ly/ZN2y8  
0	 seriously?!?!?!?! i loved his long hair
1	damn dude, the hotdog video or what? I will keep Subbing you 
1	do you own any cologne? that's for your Q&A.
1	http://twitpic.com/4fgm4 - That's pree kew!
1	http://twitpic.com/7h42s - cutie!
1	i enjoyed itt.
0	I hate this thunderstorm.... I went to bed early before the storm came, my windows were open... All my clothes got wet  
1	i will be there to watch it when you post it, your really funny and i think your cute 
1	Oh my gosh, yes!!!  Have you seen them on the Sweet Brag Tour?  I did on Wednesday, they were AMAZING 
1	OMG JOSH THIS PIC IS SO SEXY!!
1	Well i loved it
0	wow ur so lucky! i have school until wednesday!
0	Wife n' I are driving to Burbank tonight to see you on Monday, but just found out tix are sold in advance!! What can we do!? 
1	you were awesome tonight.
0	feels a little bit like abandonment now that he's all the way in Cali  lol
0	umm so i'm green to twitter and didn't even see you responded until now!! how annoying...  is this still available?
0	Animals have suffocated when putting heads inside that inverted Yoplait cup. Easier to put warning than redesign
0	that would be the perfect snack to go with my movie....but wait...I don't have any! Ha Ha.....bummed
0	if mom gets paid...
0	Ehhh don't. Weather's gonna take a turn for the ugly tomorrow
1	i so feel u!  dont trip off dem! u still got me
0	Worst day to buy a freaking ipod ever
0	Worst dream ever, and not my usual nightmare either. The worst part is its probably gonna come true 
1	Worst exam ever today. & can't concentrate on revision for the next so last Prison Break it is  finally!
0	worst feeling ever   this succcckkksss.
1	Worst fight scene ever  HÄ? hÄ?   http://bit.ly/x8wwp
1	Worst flight ever to Taiwan.  Lots of turbulance, puking people.  Lovely  Photoshoot in progress.  Now awake for 24 hours.
0	Worst game ever..fail cancuks
0	worst headache  lying in bed all day and being lazy
0	Worst headache ever!
0	worst headache in a long time.
0	worst headache right now
0	worst headache today  makes me nauzzzz
0	Worst Invention of the day... Spider Missles
0	Worst lunch ever.    needs to be longer cuz i had NO time for myself.
0	Worst migraine ever
0	Worst night ever... got Dissed n talked shit to
0	Worst night of my life won't end... I can't sleep
0	worst night sleep ever  supprised I didn't sleepwalk, usually do when it's hot.
0	Worst nightmare...I think my ear's infected now . And I thought I did such a good job
0	worst night's sleep.  i hope i'm on my game for work today. right now i'm just grumpy. not a great way to start the day.
1	Worst over for British economy? http://bit.ly/HKRGn let's see what say about this... #qmb
0	worst part about cle/orl series being over is no more nba on tnt this year
0	worst part about this breakup: not being able to talk to someone who has been my friend for over 3 years  I have a funny story, dammit!
0	Worst part is... I LOVE to write, if I'm not TRYING I'll be able to think but my creativity is in an enclosed bubble right now 
0	Worst part of concerts? Trying to get out the parking lot afterwards. Show ended half hour ago and I'm still in line to get out.
0	worst part: get home tired and take off the make up
0	worst pasta ever. never said that before, which is really depressing. couldn't finish it. never said that before either. now I feel sick 
0	Worst road in Chennai is Spur Tank Road......
0	Worst sleep ever. I'm so worried about my sick kitty cat
0	worst stomach ache ever
0	Worst thing about being sick? The body aches...
0	Worst thing about being woken at 430am is falling asleep at 6am then waking up late.
0	Worst thing about big cities is that you can't see the stars  Refinnyj <> Mat1234
0	Worst thing that could happen is orientation + classes. Which means... 7:30 to 1:30. And NO BREAKS?! Please, Lord, don't make it happen 
0	worst toothache ever
0	Worst trip back from san diego ever.. Tried to make sales and ended up having to pay towing: ~$700  this whole week in socal sucked...
0	worst tummmmy acheeee  i eat too much.
0	Worst way to start the weekend - sick with lots of hmwk
0	Worst way to wake up in the morning. Sick to my stomach.
0	Worst Week  is cancelled?!?!?!  http://bit.ly/4kbdIz
1	worst week is freakin' crazy.
0	wanna go to take a bath , but "dadnapped" is playing right now  what can i do ? tralala ~
1	wanna go to the pool tonight
0	Wanna go tomorrow  Instead I shall work and then head home. Fun...
0	Wanna go watch takin of pelham 123
0	wanna have a puppy
0	wanna have sushi..<3 but its to late now
1	Wanna have this bag  http://twitpic.com/61gb6
0	wanna have Who You Callin' Money Grubbin by The Beach Girlz
0	Wanna know how I'm spending the rest of my night? Going through the Nursing Entrance Test review book. The test is on Sunday
1	wanna know who camille and i are texting? hehehe   <3  JK you can't ! haha it's a secret!
0	Wanna know why I miss Roi being on that stage?.. Cuz no one can do this like he could..  http://tinysong.com/4rux
0	wanna lose down 4 kgs but i cant or to say it's impossible for me to weigh under 44 kg
1	Wanna make $40,000  a week.  Don't follow me. I don't give up secrets lol 
1	wanna play a game?   http://bit.ly/btXJ0
0	Wanna play Sims3 but my mom is playing
1	Wanna request  a product for deal of the day ?-- message me here -- offer open to kalahariGames twitter followers only
0	wanna see Angels & Demons...but with whom??? not getting anyone
0	Wanna see m again! Gota wait now, all over again! 
0	wanna see Metro Station at Oslo...! hate that I can go
0	Wanna see 'New Moon' now...have to wait 'til November...such a long time
1	wanna see our commercial  Here you go http://bit.ly/JzXVe
1	Wanna see some highlights from the Louisiana Seafood Festival this wkend...that MY VIDEO COMPANY shot  http://twurl.nl/6o50mn
0	wanna see the hannah montana movie!! and missed the last prison break episode
0	wanna see the MTV awards now!! have to wait untill tomorrow
1	wanna see twilights new film  looks fantastic
0	Wanna see UP
0	Wanna send my friend to airport, shes going back to her country for holiday...we might not see each other anymore 
1	Wanna share birthdays?   (via #zenjar )
0	Wanna sleep but reaching work
1	Wanna spend the night with Tay tonight!  Maybe we'll be allowed! <3 I love slumberrr partaysss!
0	Wanna surprise Carla but!! I don't know  I'm scared. Natalie needs to surprise visit me soon, teehee.
0	Wanna watch #pixar 's #UP . The film releases in DECEMBER in Japan  Over half a year later? Not speed of 21st century.
0	wanna watch gossip girl!!
1	wanna watch the 4th season of i dream of jeannie! but dnt have it!! dammmmmmmmmmmmmmmmmmmmmm, youtube here i come 
0	Wanna write a post for my blog, but I have no idea 
1	wanne look at how my lovely anak cina looks like now? stay tune.. proper update tomorrow night
0	want 2 go play n the Streetz some more - but fell asleep on the couch - LeGz can't move  ...
0	Want 2 transfer my Naini trip pictures 2my comp so I can upload thm on web bt i dnt hv my USB  Snt few via multimedia 5 Rs/pic. Expnsiv!
1	Want A Magic Carpet
1	want a new hair bands, maybe create one for herself 
0	Trying really hard to stay upbeat & positive, but feeling really down tonight. Am exhausted after DS's party & struggling with DH's mood 
0	Trying Resco MobileForms Toolkit and sample. Trial messages ruin everything, the sample has bugs, it's running slow. Poor 1st impression. 
0	Trying so hard
1	Trying that allergen block crap. Work until 8 with my former fav step cousin
0	Trying the latest version Seesmic Desktop; but you still can't resize columns
0	Trying this hair thing. If it doesnt work... well fail.
1	Trying this out for the first time.
0	trying this out...bored and don't want to go to work tommorrow
1	Trying to "cook" my first kebab ever
0	Trying to "take it easy" as i was instructed to do...Not happenin. This i did beyond too much physical work today
0	Trying to adapt to my "real" life again.
0	trying to add a picture but they are all to big
1	Trying to adjust to everyone knowing what Natal is. It was "the word that goes unspoken" up until today, I feel weird saying it in public 
0	Trying to adjust with not having my little girl around
0	Trying to amuse my cousin. It's not working! and he's playing Halo w/o me
0	Trying to avoid #Lost spoilers and still use Twitter is like trying to avoid raindrops in a hurricane. Pointless.  I'm 3 eps behind.
1	Trying to avoid MTV movie awards results! Excited to watch it later
0	trying to avoid twitter jail is like taking candy from a kid, not nice 
0	trying to be an adult is very difficult when u can't find a job
0	Trying to be less unwell...
0	Trying to be okay. All I want to do is sleep tho. Goin crazy in my head missing her. Need to find a second job to fill the time
1	trying to be on time but its just not working
0	trying to be patient with disabled girl next to me. Difficult when she's just pulled a chunk of hair out.
1	Trying to beatbox. Hahahaha!
0	trying to book my flight to go visit Trudy....I miss her
0	Trying to break my new shoes in, and my feet are bleeding... 
0	Trying to catch a tan, weather's right but people keep ringing the landline 
1	trying to catch up on himym. last episode I rem watching was when Ted started dating his ex from college. anyone rem what # that was?
0	Trying to catch up on sleep but the friggin' support phone keeps ringing!
0	trying to catch up two works at the same time...wish its JULY!!! thinking of whats going on in IRAN now
0	Trying to catch up with things on Facebook and sad that one of my good friends dropped her account there and here on twitter.
0	Trying to change my background pic, but it's not working 
1	Trying to change my name from gertlor to Jeannie... my name is Jeannie Can't figure out how to answer a twitter   How do I??
0	trying to change my picture to one from last night... its not working.
0	Trying to change my username and its not werking
0	trying to change my wordpress's layout
0	trying to charge my ipod but its not working  x
0	Worst. Headache. Ever. Eating McD frenchfries. Why does my head hurt so much
0	worst. headache. ever. i want to go swing.
0	worst... case... of... hiccups... ever... damn carrots!
1	Worth at tweet: http://tr.im/lD9W <- 's page "Things I've found that inspire me.".... Me too Trey. Me too
1	Worthington Crew Jr took down Cincinnati united.  4-0... one game down, 2 to go... 
1	wot a beautiful day  i am deffo gonna go out and enjoy it!  i love this weather so much!!
0	wot bout poor hatton this mornin!!! dear oh dear
0	WOT i've loast another follower  lol
0	wotnews is STILL BROKEN  - email alerts are being sent out - but can't access articles
0	Would any of my SF friends like to join me for the Coldplay concert next month?? My original date doesn't think she can go
0	Would anybody out there in Twitter hood like to accompany me to a movie tonight. I'm tryna see "UP". If not I'll be forced to go to LAX.
0	would anybody talk to me, pweeease? 
1	would anyone know who will run for president this coming election??? curious lang ako. i know its not life altering experience
1	Would anyone like a snippet of Epiphany? Would be more than happy to send one.
1	would anyone like to go to cerritos mall today?! around 3ishh, 
0	Would appear not  note to self...change perfume!  What to do now..Hmm do I get the tarot cards out or not??
1	Would be a sweet #tweetdeck easter egg, whenever failwhale kicks in, the keyboard cat video slides into view  http://bit.ly/xXU11
0	would be basking in the sunshine... but its hiding
0	would be more in love with her iPod touch if it just had a camera, sod the iPhone, I just need that image capturing device 
0	Would be nice to have tethering for the iPhone right about now. Sounds like optus is going to be greedy and charge for it
0	would be perfect if it weren't for the fact that im about to fail a science exam. hahahha. pray for me.
0	would be well rested if not for the random thunder last night
0	would believe that no where in bantry sells glow sticks !!!! how depressing
0	would do anything to understand mechanics right now
0	Would give anything for my car to be six inches shorter so the Meter Maids won't ticket me.   Gah, parking in the city is such a bitch.
0	Would give my right arm for some cookies and cream ice cream or a piece of cheesecake, both of which I can't have on my diet 
0	would have been delighted by this snow a few days ago but.. i just sent my winter coat, hat, gloves, uggs, etc. home with the parents  #fb
0	Would have been happy to see Transformers, but IT'S NOT OUT YET! June 24 for us.  My giant transforming robot joy will have to wait.
0	would have finised her music tech coursework today but someone didnt bother to mention that my teacher wouldnt be at school, shes mean 
0	would have liked to have gone to #tastelondon tomorrow, but it's sold out 
0	would have loved to go to mohegan yest and comcast tonight
0	would have to watch the replay of the epic Celtics-Bulls Game 7. I won't be around to watch it in the morning.
0	want a new-in-box dreamcast..
0	want a puppy? does anyone know anyone who would like to adopt a trained lab? bff is moving and can't find a place that allows 2 dogs
0	Want a starbucks frapp
0	WANT COOKIE STAKCHOUSE
0	Want food. Can't eat. Foots asleep. Bored studying. Done with school. Fml.  gonna take another break urgh
1	want FREE Apple products? iPhone 3G S macbook pro air iPod touch nano imac? click here! http://apple.freebiejeebies.co.uk/45615
0	want go out somewhere
0	Want Hanna Pakarinen's CD but can't get it anywhere! If you do want it it's stupidly expensive because it's imported from Finland
0	want his love back
0	want more sleep  bloody exam day. only one more to go after today tho. then NEVER AGAIN
0	Want my bed. So tired. Nigh night. Tomorrow'll be and hard-study day.
0	want my car back
0	Want my headache to go away.
0	want my twitpic back
0	Want nap. Need nap. Can't have nap. No time for nap. Sad napless Drew.
0	Want Palm Pre  but can't  get        x2 waaaaa
0	want rob to twitter me
0	Want some warburtons
0	Want something fun to do  !!!
0	want something more than job but can't fig out what??
0	Want sun ....
1	Want the F-5E please. Anyone willing to donate?  http://www.espguitars.com/basses_f.html
0	want these pics as references  want to do a pretty painting with dragonflies! why are you making this difficult
0	want to be home chillin in bed/watching movies with   but noo instead of work sending me home they feed me algae vitamins FML!
0	want to be a pinup girl...my boobies are to small
1	Want to be able to do a 'photo of the day' but also have the option of having just a text blog entry when the mood suits
0	Want to be back at the beach
0	Want to be home playing with iPhone 3.0
0	want to be out in the sun but i have to get ready for prom! sad if is not going
0	Want to boot into osx and delve into #iPhone dev, but itchy eyes are making it hard to look at any screen. That means no #myst either 
0	Want to build more burning things now rather than be at work
0	want to change my background but twitter won't let me
0	Want to check the status of my Apple order, but the site refuses to cooperate 
1	Want to cut my hair as Lightning
0	want to disappear, stop caring and end this internet addiction. 
1	Want to do something really cool follow me today
0	Want to do something, but I don't remember what it is. 
0	want to do such nice things with my room, want new desk, new chair, new bed...  oh well, first I need to clean it
1	Want to earn some cash owning your own website via the internet, learn to create a website easy and free www.webtips4you.com ENJOY! 
0	want to eat so bad for lunch, but my gum hurts so bad 
0	Want to eat.. craving for famous amos
0	Want to exercise but surgeon says i'll rip the stitches
0	Want to finish bio and health earlyyyy 'cause I got banquets and stuff to do after school this week.
0	would have won third in a golf tournament
1	would http://identi.ca/ be able to handle the load better than twitter? everyone move over there to try please  http://ff.im/-1YoWv
1	Would I rather spend time w/friends or hold open house? Both if YOU come by to visit... please?  http://ping.fm/ZknUF
1	would invest? share you opinions
0	Would it be bad to call out of work?  Especially seeing as I am out Wednesday & possibly the rest of the week because of dental surgery.
0	would like a hug and a kiss from Eric. Long distances really really stink
0	Would like a little reply from one of my followers
0	would like it if The Getaway Plan decided to tell everyone their breakup was just a joke
0	would like it to be better
0	would like my jacket back tonight  i miss it.
0	would like sims3 more if her computer wasn't SO HORRIBLY SLOOOW!!!
0	Would like some Nutella. None to be had
1	would like the thank hon 254 for ruining my straight A streak but its all good still got a B+ and basically had the best weekend ever
0	would like the world to stop talking about IPL already. I'm depressed. Thanks to DVD mixup, no Rosencrantz and Guildenstern. 
1	Would like to be a Lakers fan to buy that tshirt :  http://is.gd/JQbk . Oh well, my sister just got a present 
0	would like to be famous
1	would like to be high her whole plane ride
1	Would like to be in Ohio right now
0	Would like to burn a copy of #Wolvix 2.0.0b1 Cub to CD and take it for a spin, but Xubuntu is not seeing my external burner. 
1	would like to congratulate kimora & djimon on their newborn!
1	would like to give a shout out to all the losers i dated..thanks for the lessons!
0	would like to go back to bed. horrible headache pounding behind my eyes and all over my skull
0	Would like to go fishing tonight, but it's so boring alone 
0	would like to know when my joints are going to stop hurting.  I've been up and moving for 5 hours and I'm still walking like my grandma!
0	would like to know why Coldplaying is so dead tonight.
0	Would like to know why the Internet is failing today  #fb
0	would like to meet Alan Carr!!!   Becky I love you. xxxx
1	would like to meet him, just once  â™¥
0	would like to no why the weather is so shocking! sunday: rain / Mon: rain / Tue: rain / wed: rain!
0	Would like to not be so poor for a while. important things are expensive
1	would like to say big thanx for the b'day wishes to everyone!  MUCH LOVE FROM ME!
1	Would like to say HA! to ...but she gets mad! So HAHAHAH to instead.
1	would like to say that is awesome in a zillion different ways.
0	would like to see her boyufriend now and not have to go to her exam tomorrow
1	would like to soak in this tub   www.missdecor.com
1	Would like to start the day over cuz it's been so swell
0	would like to stay up and watch mamma mia but going to bed as is up at 6am for grand prix no lay in for me
1	Would like to thank and for the nicest Sunday in a long time
0	want to finish that baby hat but my hands hurt.
1	Want to get a party started? Well then you need to search Spotify for 'Party Start Up 2008' and let the fun begin! Schneewalzer is a fave
1	want to get better  loves casssssssh  schmitgirl
0	want to get camera like this  http://bit.ly/F8Vxb but would even settle for this  http://bit.ly/15dcL3 but I can't even afford that one
0	Want to get down to some artwork today but have visitors at lunchtime so my day is already messed up
0	want to get out of this place...dont know what is pulling me back... i wonder...
0	Want to go and enjoy the remainder of sunshine but doing at least 4 people's jobs today due to vacation. Pretty much last in the office
0	Want to go and sit in the park but am dying of hayfever today. Need docs appt to get the real drugs back
0	Want to go back to #zaxbys despite the incredibly bad service I got last time
