1	i try  not really lol yer cause twitter is definitely not a waste of time or anything!
1	Thanks girlie!!! I love ya too!! hehe
0	hey hun missed u  were have u been? did u ava nice wknd? xxx
1	Hmmm.  Food vs. Russell Brand.  Tough decision.
1	sorry twitterberry fails, glad to see you here! 
1	Alex isnt the only one with connections
0	I wonder if its headed this way? Its not like we are going anywhere this weekend  We might go out of town, small chance.
1	You know you will .......    This one is sooo going to be worth the pain tho'!
1	  U look freakin amazing!! Pity Gretel got you in the toilet shot
1	aw I'm gonna subscribe coz you're a hilarious bird
1	congratz Ruby.
1	glad I could help
1	ha! Congrats! Glad all went well!
1	Help us get Ellen to Australia Ruby, pls do a #followfriday  xo
0	Melbourne deserves more of your attention    How about some Katy Perry tix for Melbourne? plzzzzzzzzzzzzzzzzzz  xx
1	that video was so cute from kenya. and the interview with courtney and the dj'ing. naw! and you dont fail  x x
1	whatever you are.. its feirce... keep it up  xx
1	yeh very true but stil why wud u do that makes angry gah but pfft..lest u are happy for who u are whocares wat other ppl think
1	You should ask 'Who inspires you?' or 'If you had one day to live and could do anything you want, what would it be and why?' 
0	you're locked out of your apartment? oh no  my door is always opened for you, ruro! x
0	 I dont want my woman sad!  Well Im going to the shop around 12, so hopefully it will be fixed up enough to go
1	LOL, did you take some pics? 
1	sure, hope to talk more 
1	Your radio promo was so cute! I saw you guys at the HOB w/ Honor Society, and you were SO good  Where can I get your songs?!
1	http://twitpic.com/6bi4w - Your nose has some open pores - I think my mom has some stuff to help with that!  If ur interes ...
1	aye she is like! i hope it rains a glasto it wud be a crease for me!!!  (dont hurt me)
0	I visited few families last fall n was surprised to see a lot of broken heart/families/relationship. it was terrible. can't imagine
1	ki bolchho aapni? aami shobhay ke probashi - to this world, right? 
1	enjoy the lan party
1	haha why yess..
1	happy belated
0	 Why say things that cut so deep on a monday morning? And seriously, you got nothing?
0	and dad mujhe MCA/MBA nahi karne denge.. so i need to get a gud BE college
0	hey,u took hold of me again 
1	kidhar haan? m sorry..had to leave...  did i hurt u by quitting suddenly
0	lunch was ok  and studies.. i dont understand where i mised my efforts.. wen i revise its like ye to aata hai  :S
0	Nothing.. just woke up and looking for some templates
1	are there...not here
0	never made it  maybe matinee before you leave tuesday
1	aw thanks! I love Viigo
0	they work (i presume you're talking about prefs in snow leopard) but no prefs = cant get rid of the dock icon
0	 At least it's over ... ?
1	brilliant going.
1	my fav balamory has to be the one where PC Plum goes off to visit his "Special Friend" in Venice
0	oh no  are you on a slope or anything?
0	She is, 2 legs on! looks like rain tomorrow though 
0	That would normally be a good idea, but the router is at other side of the house plus up 2 flights of stairs... 
1	That's a great song!
0	the terminators scared me
0	yeah....I am torn between the two
0	I am lost. Please help me find a good home.
0	yeah, but we lost in the 2nd round against brazil  xD
1	i sell u mine for cheap and then i'll get the new one!
1	Hahaha  so you were waiting for someone to take the bait, ey?  Good way of practically guaranteeing a response 
0	 ima make u wear a dress when u come to brooklyn lol
1	Check  http://twitpic.com/6gegu
0	massive  how old is he?
0	I'm just SO frustrated. Bein attacked w/ "wheres this going" type shit; I didnt evn kno it was that serious... With any of them.
0	yeah but i took it out n now it's a goner.
0	Thank you for the linkup! I'm always grateful for more canon. I don't think I'm going to finish this damn story on time, though. 
1	I think it helps when you find a good bunch of people to chat too, then the tweets just shoot right up 
1	possum kingdom is my song from last summer.
0	DON'T SPOIL IT!! D:<
1	HAHAHA that's awesome... one fat cat
0	 I think mine have been out all day partying , they just got back so I expect the fireworks will start here soon as well. 
0	It's never me  Perhaps my constant belligerance puts off would be...mashers? crushers? stalkers?
0	I hope dizzee, and you did not take a pic from the sky 
1	well yes ;) everyone apart from me of course ;) i would never dream of these things
1	Golf is not silly. Rugby, now.... [just kidding!] And is there a Hard Rock in Bangalore? 
1	Dude, that's not cool. May your anti-flu-germs be strong and courageous 
0	bummer, it was a good exhibition 
1	 that is good
1	awww u poor thing! It was good, busy tho 
1	Good morning. Have a safe trip to the office
1	heh thanks
1	Hello you!! I'm gr8! Thank you for the tweet, as always. You are such a tweetie-pie to me. 
0	i miss u !!
1	not yet....pretty soon tho
1	shh.. 4 me too,  oh, atleast they r easier to get..Am good today,got good sleep, & have stuffs to do, ur plugin is cool btw..
1	That's right baby... is HOT... steaming hot!
1	sweeeeet!!!  we need some new crazy amazing fun adventures together  i miss those. and also. you need to meet Ali. because..
0	So no I 20 yet..  and can't see any in the next 30 days...
1	hehehe-grown up cartoons - formula 1 racing in the rain
1	ehhehehe thanks
1	pelo followfriday
1	So any product that's not free is automatically "fail?" Remind me not to write software for a living.
1	good morning
0	 TE EXTRAÑAMOS EN TWITTERRRRRRR!!!!
0	like my new pic im feeling a litttle code geass man i miss it so much
1	You still feeling bleh? Feel better soon ya? OH! And if your still free wednesday, I am for sure free now it seems. 
1	It makes tweeting easier. go visit tweetdeck.com!
0	Noooo. It takes forever to talk on here. Sorry.
1	we will talk sometimes... maybe not every day, but sometimes.  kthxbai
1	e a resposta � sim
0	Oh no....Heather, my heart is broken for you.  I can't tell you how sorry I am; I know that pain all too well. Many hugs.
0	I used to be one of those peeps  Say hi to your man for me! lol
0	I don't think ur going to see me this summer  Maybe U should break it to Aunt B..
1	- nice to tweet you! Loving your site (as geek in camping family especially  http://www.outdoorafro.com/ - do Muir Woods trips?
1	awesome, see you there  #140tc
0	man i feel stupid nw  thnks 4 letin me kno tho, u ok? X
1	I just finished reading four pages of your Tweets. Did not realize u are one of the most interesting people I follow
0	Aww  *Kisses and cuddles* miss you too.  Why have you been avoiding them?
0	Oh 'Mandar that is just lame..  They might do a podcast. If you're lucky.
0	My mummy tries to pet the belly-floof once in a while, but I'm afraid I get spikey swipey  It's for lookings not touchings!
0	RUMBLES!!!THOUGHT I heard your rumblessss; cannot be of any help cause my heart feels like its broken~
1	so who's the winner? I'm not participating since I already won  I know answer though #pussycatisland
0	one of my good friends owns a Cobra Jet and was at NMRA, I was at work  #carchat
1	and and Thank you!
1	I'm glad you like it! I just added the source param, so the update tomorrow will include it 
1	it's been a beautiful day in central #Indiana  new post at http://IndySocialMedia.com
0	dam i az go viddqh tova toku 6to    no nz sega pitah dali 6te idavat i kaza "will let you know soon"
0	I only discovered after he finished doing The Show  I live in hope that he'll one day do something similar.
1	Tracky Daks are one of the only good things about the weather getting colder. That and porridge. I just did both
1	Woah - sounds like you should be well into warm-up. Lucky you were prepared.
0	I want to come so badly, but I don't have $65 right now! 
1	Im all for #clothdiapers, Ive just not used them alot, I know people who put them on their children and they said theyre great 
1	they are!!!  #clothdiapers
1	lol, Malaysian license can drive in SIngapore lar.. I've driven here many times 
0	That Uniqlo store, Japanese tidbit store, Rive Gauche Cake store... don't remember le. 
0	Yeah, I think Microsoft may have corrupted his brain somewhat. 
0	oooh that sucks im sorry  like i said hope you feel better. seriously i know how you feel. ugh
0	why do you wanna yack??
1	aren't they the same? Reading by lisning? haven't finished audiobooking middlesex
1	Thanx  icing my knee again. Weird I don't feel the pain during the run but always after.
1	no problem i'm new 2.. lemme know if u need anything  http://tinyurl.com/ctase9
0	I bet my whole family is no longer on skyward
0	i don't wanna be here by june 12.
0	i'm actually thinking or rescheduling my flight on june 12. or just going to hong kong! i have to resched everything.
0	morning lang ako pwede.  i have errands sa hapon.
1	what's the second?
0	sorry... I'm at a loss... I can't think of anything else
1	I've been getting spam in Russian and Greek lately, I could Twitter you the return address 
0	I miss youuuuu.
0	omg me too, bb. Oh and I'm sad your package didn't come 
1	yaaaaaaaaay
1	No fair, I've gotta attend those too!  Maybe we can play meeting bullsh*t, lets make some bingo cards 
0	Asdkfsj;dkf /HUGS Good luck.  Is this about parents...?
0	Not everyone has the ability to indulge in such creative endeavours.  Artistic talent is really valuable.
0	eek that sucks  sorry
0	i have a better chair....but it don't work
0	- sadly aspartame (sweetener) is a neurotoxin, and I have  nerve disease (more on my site). Full sugar or nothing = nothing 
0	me too! The only one I know is you...  check out
1	thankyou, you're a legend 
0	yes,i feel guilt for hurting someone just coz I don't know how to balance my life and study,i think i'm kind of babyish 
1	Hmmm... The power of social media...makes me want to get paid!
1	it's tough and dense and dry stuff... i think we're doing it right though
1	Shhh girl, shut your lips. Do the hellen keller and talk with your hips.... TUNEEE 
0	SHHHH... i need a boo
1	shhhh... Reading Chapter 11 of The Poison Behind The Potion
1	Shhhh...Quite... Come Over Here & See.  ROLLY HOWELL found a HOLE in the FENCE  >  http://budurl.com/tetq
1	Shhhhh. . . Do u hear it? Huh? Huh? Do you? Its the sound of HOOKAH calling my name! Hehehe
1	Shhhhhhhh! I'm watching this! Lmao
0	shhhhooooooot. it's 11 pm and i wanna go to sleep already! prob is i can't. not sleepy yet.
0	Shia Labeouf announces new Indy in the works... NOOOO!!!! Someone must stop them. Indy cant take another pounding like that
0	shia labeouf was on conan tonight and i missed it.
1	SHIA!! SHIA!! ohGosh he is hawt  Transformers rule THE UNIVERSE
0	Shia's a big name, and that would be just another franchise for him and it would make tons of money...please don't do it 
0	Shift change - no drinking tonight
1	Shift the Balance From Control to Participation.  http://bit.ly/5sHsg
0	shiiiiiiiitt  1-1
0	Shiiit, I broke my prettiest nail. 
0	Shin spilts again....my bodies getting old
0	shin splints suck!
1	Shine TONIGHT with and new music! This ain't nothin' you've heard before!
1	SHINee, fighting!!  Congrats to Super Junior for winning on Inkigayo.
1	Shineful morning.
1	Shiney new Chase card arrived - I can has PayPass tag
0	Shin's Sushi. I just want the marble.
1	Shins! Delta Spirit! Terminal 5! Tonight! (I will now do my happy dance   #musicmonday ? http://blip.fm/~6iwsl
0	Shiny shirts everywhere!
0	Shiny test SUN 7410 won't be shipped until 6/16.
0	Shipping for Wine Woot is $7 now
0	Shipping my little one off to 4H camp.
1	Shipping my xbox in for lens repair <_< at least G4 gotz E3 stuffs all this week
0	Shipwrecked all weekend  license wasn't suspended, it got cancelled. Can't take the risk driving and no one lives near me 
0	Shipwrecked best episode so far final next sunday  http://tumblr.com/xne1pah7i
0	shipwrecked tweets are now officially over.  LOVED the series though <3!
1	Shirley is Happy to be part of the tot's  via http://twib.es/CPJ
1	Shirt printers, that is 
0	Shirts are available on sale...website not working yet...bummed      check out MySpace/bringthemhomeinc to check shirt
0	Shit - changes to the marina's terms and conditions may bring boat-life dream to abrupt halt
0	Shit  I've forgot...chemist's close sooner on Wednesdays  The pain is getting more worse
0	Shit  rip monet. Why do our fish keep dying???
0	shit , to com dor de ouvido 
0	Shit also saw noob tube  in demo
0	Shit coffee hates me
0	Shit day  x
0	Shit dead for science exams tomorrow
0	Shit did I miss seeing nekkid?!
0	Shit end to the dayy, forced to get off my laptop, Night 
0	Shit everyone's meeting The Doctor but me  *lame ass pout*
0	Shit feeling sleepy now...something is seriously wrong with my biological clock.
0	Shit forgot some back at the office
0	shit guys, why did the rain stop 
0	shit hapens...but today lots of happend in my life!
0	shit happens... but just never expected it to be that bad....
0	shit i have to go 2 work soon  don't wanna work in this heat. spesh wen its like 80deg in ma work.
0	shit i just cut myself!! stupid papers!!
0	Shit I just ran over a squirrel or rabbit. I feel so bad.
0	Shit i miss my family...Wanna go back to belize!!!!! The states aint too much fun when your by yourself....Im sad..
0	Shit I spend so much money this month  I'm gonna have to work like so much this summer to compensate and save
0	SHIT I wanted to sign up for the gaypride parade in amsterdam but thy reached the maximum boats yesterday... how much bad luck can I have
0	Shit i wish i was black. No one is gonna cheer that loud for me
0	shit im bored
0	SHIT IS REAL
0	shit its cold today
0	shit its ten past one! and i gotta get up early. oh deary me. better going to bed now   Goodnight, sleep tight, Dont let the bedbugs bite!
0	shit ive got to study for the exams math/science/english/social/arabic shit thts alot!!! god some one help me so scared  ill start now
1	shit loads o work to do, fuck fuck fuck! 
0	Shit look at that rain
0	shit looks like my DM wants to talk to my SM lets hope I can get out of here or im looking at hell work till I can do better
0	shit man i had to split my promotape in two to much tracks
1	shit man, work was a bitch. but now its all good coz im at home in my jim jams 
1	shit Maths exam 2mora!!! Oh Well revision on the beach i think
0	shit mis ik wel Milow  #pp09
0	shit mood  i need something to do today
0	Shit my neighbors dog just died.. it was hit by a damn car.. feeling really sad
0	Shit my pants, Cant find my ipod! Im slowly dying. 
0	shit never really responded to the half 8 alarm
0	shit now my room smells like spraypaint
0	shit photographers are ones that are late, camera runs out 2 mins into the ceremony, smell like booze, and gets pissed at your expence  VB
0	Shit pimple. I guess Christmas came to early for me this year  Damn, I need to get rid of youuuu :|
0	Shit Scared   And Worried About Jazza
0	shit scared about tomorrrow lisa
0	shit shit and triple shit. this test matrix just tripled. Is it Sunday yet?
0	Shit shit shit gotta hate the rain on a Saturday! bummer
0	shit shit shit I accidently used $5000 on a jukebox in rc. o well nevermind i'll use it in the future
1	shit shit shit shit! best news i've gotten in so long
0	Shit shit, i didn't mean to dall asleep again, it's 9am, I wanted to be out by 9.30. Don't know why I'm so tired,I wasn't late last night 
1	shit so happy it's it's it's.... just i'm happy
0	Shit this arrogance...I told yall its a weakness...I think I'm starting to feel the Kobe... Oh no
0	shit time to get ready for work
0	Shit weather, not heading for Amsterdam today.. 
0	Shit week all fucking week  off to the gym now with the worst headache.
0	shit why is my life so complicatet? tell me whyyyyyy
0	Shit!  I totally forgot about MEandJOANCOLLINS tonight!    Bad Veronica
0	shit!  i wish there was an option to disable renewals on members. not all .. just 1 .. now i am stuck with her again .... UGH
0	shit! drawer hit my left thumb
0	shit! forgot about britains got talent...!
0	SHIT! forgot to call my mum wishing her a happy mother's day until now. she sounded a bit sad on the phone. I'm a horrible daughter
0	Shit! I left my charger at drews!
1	shit! I made a mistake of sending IM's to a group that I shouldnt have. yikes
0	Shit! I need to study but hey it's sunday
0	shit! i think i am getting sick
0	Shit! It hurts like...way beyond words can describe.  #RhenayaPelagia#
0	Shit! My bro called me 12am, I was up, and didnt even hear the call  Guess he was locked-out.
0	shit! my laptop just broke & now i have to use my slow computer
0	shit! my phone wasnt paid so now i have no phone!
0	shit! salad  #onroad http://twitpic.com/6g9ah
1	SHIT! She is upstairs!!! /me runs away
0	Shit! The damn bad word robot caught me
0	Shit!! INOX is no longer THX certified
0	SHIT!! Just hitting June & this wkend & it's already expected to be in the 100s...i HATE 100s
1	shit*  these niggahs are ridiculous. But yooooour not a lame & I'm mad your dying at work. What time you get off?!
0	shit, Amarok 2 doesn't want to scrobble my music for last.fm 
0	Shit, gotta update my Supercoach and Dream Team sides... Gotta pan Jack Ziebell 
0	shit, I can't even follow my best actor wentworth miller  upset
1	Shit, i had a really good sleep.  felt like air.
0	Shit, I hate it when I'm a jerk for all the wrong reasons and then I just feel bad. Rawr 
0	Shit, I hear clapping from the baby's room. I have to get up in 6 hours. She has to get up but gets to go back to sleep in the car 
0	Shit, I just remembered The Hills & MTV Movie Awards are tonight... hmwrk time 
0	Shit, I think I just accidentally hoovered up a spider  Don't tell PETA.
0	Shit, I'm actually going to have to study.  
0	shit, i'm lonely  blaaah
0	Shit, i'm sick 
0	Shit, looks like my internet's going to be cut off soon because I missed a bill. Fucks sake. I hate being poor 
0	Shit, need milk as well. Do not have. 
0	Shit, no more maths HL this semester!  WTF, we planned cakes, music, and all that..  Why was it cancelled? Why, oh why?!
0	shit, now a 2nd close friend has been sexually assaulted on the paris metro.... stay away from empty carriages, even in day time 
1	SHIT, Politics was hard! But 6 exams down, 4 to go  Time to start cramming Classics for this afternoon I think. The joy.
0	shit, rainyseason is here, and im friggin scared of thunder. guess i wont be able to sleep tonight 
0	shit, the workers are getting more friendly. berat hati plak nak tinggalkan dorang 
0	shit, woke up late for church. guess i'll just have to make it for practice 
0	Shit,i haven't beer in the fridge anymore... 
0	Shit,I lost this bag I was gonna cut up 
0	Shit. Can't believe I forgot I had a driving lesson in an hour .  Am so ill! But I can't cancel or he'll charge me
0	Shit. Hope more people aren't injured in Metro Crash
0	SHIT. I broke my blackberry! It's dead, and the charger broke INTO my phone.   
0	shit. I just searched for Google on Google  Now I've killed the Internet.
0	Shit. I miss my guitar.
0	Shit. I think Taufik won't win
0	Shit. It's a high pollen count day, and it's extra bright. I'm outside with no sunglasses and no hayfever medication. Awesome  #trackle
0	Shit. Meant to delete all READ messages. Deleted entire inbox. No night tweets for me.
0	Shit. My Saturday just got ruined.
0	Shit. Please pull through Robin
0	Shit. Power failure. I miss KSEB.
0	Shit. Prom. Shit. Nerves kicking in. I want to stay at home and watch JR
0	Shit. The gas nozzle slipped and sprayed gas all over my pants, shoes, and ground 
0	shit.. looks like 130$ down the drain
0	Shit.... Ana Ivanovic loss his game in Roland Garros too today.... what a day....
0	Shit.... I WAS sleepy
0	shit...gas cylinder just finished  gonna have to eat outside
0	Shit...just realized tomorrow is Sunday  *fingers crossed for monday*
0	Shit..new Facebook app does not have PUSH
0	Shit: Ladekabel im Hotel vergessen . Noch 35% accu
1	Shite night, tomorow, I get to hang out with my little brother and neice, should be sufficient enough to change my mood 
0	shite today am doing something today but it bloody rain  http://myloc.me/2MAJ
0	Shitin myself for 2moz
0	shits hitting the fann
1	shits like an actual job. hair hair hair allllllllllll ga'damn day. $$$ I love it & I still aint gone to school for this shit
0	Shittiest morning ever - postie wakes me, letter from govt re; student repayments and high court request! Great 
0	shittt janice dickinson is out, the shows going to be boring without her 
