1	dad says hi!
0	He does not high-five  He just plays a character that's Todd-esque
0	yea, i liked $100 ones better 
0	Oh, wine. I miss wine. It makes me sick now.  I know, I tried!
1	uh, thanks cậu , cậu nên gõ #t8m ở cuối tin nhắn cho nó qua saigonica luôn nha cậu 
0	awww my trini no esata bien bendito  too bad i cant fly in and make u feel better
0	crazy huh? i'm guessing muy sabroso means very tasty?thanks again for coming up sunday...you missed the jam sesh late night
1	We find out what part we got after school  Are you excited?
0	...hey there! i'd like to ask the same question coz' i think i can pretty relate to the lines of the song
1	i lub youuuuuuuuuuuuu  is laughter of love.
1	So in other words, this is an invitation to get locked up? Wish I was in Trini. 
1	thank you  have an awesome week.
0	WAS my fav. follower  haha o well
1	G'night.  *hugs*
0	I feel like crap. Hung over  LOL
1	Sweet Dreams!!
1	I started reading from the beginning - the first part was all there was when I read it  I read... way too much fic >.> :x
1	.. Gee hang in there .. But it seems u are .. But glad 2 here ur afternoon days are well.. Myself is doing well thanks ..
1	 what u think, feel, & speak 4 yourself, u make true 4 yourself. it is that simple. becomes effective when u change it.
0	there I was trying to prevent people beating each other... I thought we were gonna win, but we just let it slip away 
0	Maths are now the What's On fellows' strong point. ;) Incidentally, I DID lose 1 kg, and they didn't mention it. 
1	Colorful Cthulhu is fun! I don't know if Sage Green would drive men insane by merely looking at it though...
1	your cloverfield reference makes me smile.
1	website is BIG fam! the beat playing in background is epic. Props to to you my man. Keep it up!!!
0	miss you mooore!
1	How should i talk to you when you are all tired and busy. PLEASE sleep normally at least one night in week
0	well being a studenty type i have to say you get used to it eventually  just gotta enjoy those free pleasures
0	Have just switched to o2 for better service. Vodafone only axed roaming for summer months. Ends in Sept
1	None, sorry. Mam went into hospital on Thursday, so he said he'll give them a ring next week 
0	oh no... oh no no no. i didnt buy the smores, they were given - and they look to be OOD.  the others r still good
0	already starting to stress about exams
0	already sunday.....i hate sundays
0	Already up  have to get to the fields EARLY today
0	already up n getting dress 2 go 2 work (sighs) awwww...it's 5:30 am
1	Already up to the start of Chart B on my first Endpaper Mitt. These things go fast - only started this morning! Looking gorgeous
0	Already up..& outta my house.  Today is mother's day and I won't even see her
1	already.. this is the best day EVER.
1	Already...time for bed! Night-night
1	alright - one meeting cancelled. 30 minutes of my life back. woot, woot! 
1	alright let's do this
1	Alright Enough bass. Let's have some harmony between us  ♫ http://blip.fm/~7gd3j
1	Alright alright I give up. I promise to make tea for the rest of the day Maggie's making it now. I convinced her she needed the exercise
1	alright alright, fuck. Just don't hit the cars while im with ya after that its all you 
1	alright back to study now, just one more exam  bye everyone!
1	Alright enough whining and off to bed. Part of me is hoping we miss them and they reschedule  Job interview tonight
0	Alright everyone! I have to go do my hair  Business meeting tomorrow I usually roll in wearing my pjs lol they let me go since i work hard
1	Alright folks, I am off to do eye exams on solders for a few days with little free time. If you need me, DM me or I won't see it. 
0	Alright friends, must now leave the Twitterverse my alarm clock sounds off in a few hours  *sigh*
0	Alright going to bed now... Hopefully tomorrow will be better, Night 
1	alright going to get some breakfast
1	Alright guys I'm gonna go to eat my breakfast now and I will talk to you later :p peace
1	Alright Helsinki! http://bit.ly/2lXjo3  How about that? Scandinavia did good!
0	alright i need to start studying. shitttttt.
0	Alright i should go to bed... i have cakes to bake in the morning and can't even have any myself  sucks ha ha ... night god bless x x
0	Alright I'm done spamming. Back to work!
1	alright im goingg. remember taylor. shave legs and tan!  DO NOT FORGET
0	Alright i'm heading to bed now i have to be up in less the 4 hours
1	alright I'm out, for real this time, ga-night girls, love ya, sweet dreams and all, and i'll check ya tomorrow night 
1	Alright I'm registered in 25 tables, let's go 
1	Alright I'm up, my first day to sleep in and I can't even make to noon. Lame. I'm hungry, gots a DVD to burn  woot
1	alright it's a Lost Marathon Time
1	Alright just incase neone is still interested[lol] the mr.twitter universe competiton is ending in the next 17hrs,so vote 4 ! 
0	Alright let's get this bullsh*t that people call work out the way. Man I wish I was still at home in the bed!!!
0	Alright let's see what they say about my foot.
1	Alright mark!!! About friggin time!
1	alright much better now american cookie is my weakness got 4 xtra sexy dresses for tonight tho
1	Alright my girl is waiting for me so I'm out. Catch up with everyone later <33 Dm me if you wanna talk
1	Sweet  have a nice weekend, regards to everyone!
1	whats the plan guys?
1	we got a table in 2 minutes. Wasn't crowded at all. very surprised. Baptists must have let out early today  How u doin?
1	- nah, on something handheld, I just don't need HD. And can spend my money on other things 
0	Thanks. Have no idea what's going on
1	Thanks for including me in your #FollowFriday
0	 just saw a trailer for a remake of Fame.  Does not look good
0	Hey Bella, this is my new account. I hope you are feeling better  Sorry you missed Russell Peters.
1	If you don't I will not be happy
0	no MY rat ... have some compassion
0	I'm trying my hardest not to think of Splendour, the thought of it hurts me. Being a poor HSC student is a disadvantage 
0	I'm sure a million people have already told you its Toche not Taachi...
0	me! I'm looking forva flatmate... I don't think Ghostface Killah knows that I am though
0	oh SNAP i thought you said that coz they lost!   Still got 5/8 for my tips tho
1	NOFX  Creeping out Sara?
1	Vampire Weekend - Walcott, should be played next of course! 
1	just great  good to hear from you.
0	You never send me huge messages!
0	aww pookie... It damn sure does though I feel your pain
1	I was just curious  I always wanted to ask Roger Ebert the same question 'cause I would feel overwhelmed after a fashion.
1	the pic of you with your ketchup art is wonderful  It's exactly how I 'imagine' you.
1	someone called me?
0	 really sorry for your news. best wishes to you and yours!
0	Sorry you're having such a bad day.
1	Congrats on getting out of the house.
0	Welcome...have a lil headache
1	yes, yes I am. Are you trying to make fun of me? 
1	Not even close to geezin', T. Trust  Sounds fun. & congrats again - so great! Let's definitely chat/catch up soon
1	They're conspiring against you....
1	 No time for Twitter?  Poor baby.
1	I think everyone's fangirled over something or someone. Even dudes fanboy over stuff. But it's good that you've moved on
1	I'm on my Mac. I don't have MSN. I'll be online when I'm done.
1	xP Have you seen my favourite quote on Facebook?
1	You don't have to feel awful. You're perfect to me the way you are. You look happy and healthy, and that's great.  ILY. 
0	IT DON'T MATTER ANYWAY ALL WANTED FROM ME IS A SCORE  LOL
0	Get better  I have having that feelin'. He said his name was RAaalphhh haha
0	what are you getting done now? Your poor mouth
0	miss you too!!  Love your new hair
1	Glad to see you took made the time and effort to keep us updated though. Good work!
1	now I am older I like the term 'girlfriend' seems so young and carefree
1	tht sounds like a winner!
1	hey thnks!  hope u've a good night!
0	oh nevermind, i thought you were talking about someone else. BAWW 
1	You got the whole day?  I shall make sure I'm free!
1	should be an interesting event...should be a great fight for the 3rd podiumposition
1	 HA!  No.  No no no.    I have an idea for my next book.  I really think it's going to be epic.  sci-fi/the future/superheroes.
1	And how do I do that? A ugly site
1	formloom works great for me and I have a Godaddy account.
1	aha, now I understand what you mean. Today, your adviser said that you need to visit Korea soon. Ok. See you soon. 
0	Sketchers.  They are comfy and will last awhile.  I need new shoes, but am dead broke.  My shoes are falling apart. 
0	soo u left KYS b4 I got the chance to intern wit u  Where u at noww??
1	Hey Honey  wats up
1	Get 100 followers a day using www.tweeterfollow.com Once you add everyone you are on the train or pay vip
0	haha, look at your tracking number now. well, that clears things up 
1	Aww, I call my kitten Cat too  Sometimes, I call him Nocturnal, Pinkg Pong, and many more XD
0	i envy you guys!!!  i cant watch it on tv!! but i miss salam and aamir working together, they are so funny!!
1	It just started working all of a sudden!!!  I swear
1	Weird stuff!!!!!!!  It's a Ghost
1	sounds like fun (except for the grocery shopping). Just chillin, I have stuff to do around the house, you know how that is 
1	something like that..
1	greeeaaat! Dreading work in the am...but what else is new!
1	nothing...nothing at all.
0	 poor you im sure it wont be that bad
1	Good luck!Sounds like you've done tons of preparation so no worries
0	I miss rain so much
1	thanks  need a massage now
1	yes he was 70 2 weeks ago
1	best of luck with that!
1	thanks, dear. Just set up a tweet wall Betty Ford and i will update the tweetup crowd in real time. 
1	thanks, you too 
1	twitter-clients need to support clicking on blip.fm urls and loading the music in the background so i can listen to your urls
1	Oh, thank you so much, you sweetheart you!  Are you looking forward to the weekend too? I think I will go flea marketing...
1	Hello  I'm supposed to be making my dinner right now and you prob just had breakfast.
1	how could it be that we aren't friends on the .com board yet?? Just added you!
1	Nope not yet! Got and amelle's stuff the other day only... I'll keep my eyes open!  Still haven't watched it LOL
0	huhuhuuh. it's my DREAM to go to Paris!!!!  wanna see the people. food. the sights. ohh the EIFFEL tower (
1	 hey.. shepard's pie was fabulous and delicous...next lifetime I'll be a cook
1	[..] audio track were caused by technical limitations and do not represent the conductor's interpretation.
1	just gotta keep going, good luck dude!! & try not to burn out talk t you tmr 
0	how come Allie knows him and I don't?! I feel alienated
1	what's in Cali?  and I never do the D
1	david just needs to sing every song in existant. heh.
1	hahaha I've tweeted myself before by accident too. Then laughed at myself.
0	yay! i've refreshed the page like 50 times and i still can't get in.
1	good morning!  I'd love to have that kind of energy too lol  Have a great day!
0	 i hope they lawyer can help.
1	 lol, you're right, it was in a twisted kind of way. 
0	I remember that movie, the ending was sad 
1	please. just pencil us in where and when it's appropriate & drag me along
1	send me an autographed copy honey! I'll read it !
1	you've seen videos of wrecking balls hitting building and stuff, right? yeah. that's about it 
0	boo country!
0	hey hey trisha!  havent seen ya in a long time!
1	I'd love to. We'll see which way it goes.  Janet is the bizness.
0	but i love adriana
1	No problem.
1	Okay! Say thank you do your dear one for me as well, for making the lovely music! 
1	You don't have to thank me.
1	yup! Right here: http://www.youtube.com/user/aaraddictive Just add me if you have one too
0	The fro-yo store nearest to my place is at Rob pa. I want something cold! Btw, the whole h1n1 incident in dlsu is just 
1	We need to have an AIM party the night the album is released. We'll just open a chat for all our friends!
0	 I forgot to bring the recycling in today
0	all business today and prob tomorrow   Someday I'll break free of the grind.
1	Tbaggerrrr xoxo I miss you!  p.s i love ur background
0	aw, thanks Trish. sorry about your chem grade though.  why does twitter hate you?
1	Thanks! I really really hope there'll still be tickets left for us.
1	haha sorry friend... I'll post some cheerful ones to make up for the past few...
1	It was a great film
1	that's a good thing  You're doing great!
1	Oh that right!!!!
1	ha ha ha funny pants
1	i love when that stuff happens
1	not cool, trish, not cool. 
1	Ok, so where's my hamper? 
1	Alright people going to #xxxsalvation someone better record aclip for that "Mad World" Remix by Adam Lambert! I'm dying to hear it!!!
1	Alright people! Jo Hansen HS-Relay for Life-all day today-I'm playing at 330 with my band-come support me and American Cancer Society!!
0	ALRIGHT PPLZ!!!!!! IZE G2G!!!!    BUT DONT FRET!!!! I'LL BE ON TOMORROW!!!!!!
0	Alright so monster squad movie still rocks! I am sad to leave NC but it's coming up on saturday faster then I thought
0	alright this is getting ridic. I have used 5 of these oil-absorbing sheets from Clean & Clear in ONE HOUR. I hate my oily skin
1	Alright this is my debute twitt  yay lol
0	alright time for bed headed to Oxford tomorrow to pack some and work Saturday...I really do miss that town
1	Alright today is wednesday which means we're over the hump on our last week of school
0	Alright tweeps I'm out. Gotta be up for work in 4 hrs!  goodnight!
1	alright tweeps it is time to call it a night! hope u had a great day, sleep well tonight and i will tweet you later 
1	Alright tweeps, I'm off Twitter. I have to fill my creative well: movie time! 
0	Alright tweethearts Im going to bed! I have LOADS of homework to do and stuff  Tweet ya in the morning! Smooches!
1	Alright Tweets I am off for the night, My husband's on his way home and I am going to go cook him a special dinner  See ya'll tomorrow!
1	alright twitfam i'm calling it a night. 6:30am workout, and then to the office i go! hope everyone has a pleasant evening 
1	ALRIGHT TWITTER LUVS. I'M OFF FOR THE NIGHT! I SHALL CATCH YALL IN THE MORNING.
1	Alright twitterkins on way home to go to bed night all!!! Sweet tweets!
0	alright weekend, feart to check my bank but 
1	alright well...night people...hella tired, had a Erykah Badu concert and they SWARMED the Starbucks 
1	Alright ya'll good nite tweeps    Keep smiling
1	alright yall!!! bak to the front of the tour bus! have fun tonight auntie and at the show!!!
1	Alright y'all, I am out.  Hear you laters. 
0	Alright!  Back on the road with 2 keys for my car!  Set me back £130 quid though...
1	Alright! Going to E3 TODAY!!! WHOOO!!  Leaving soon to be ready.
0	Alright! I'm sooo ready for Wendy & Kenda to get back on town..
1	Alright!!! Backup  Tell these southerners how we do it Headcrash.
1	Alright, A Great Honest Tool That Makes You Twitteriffic!! http://bitly.com/V6EMd  Just Started Using Yesterday  Enjoy
1	alright, did my rewrite of the Frankenstein paper... and now i just have the final for lit and film and computer science.  
0	Alright, fine, I guess I'll just hang out with my family all weekend 
1	Alright, getting ready for the BBQ now. Going to enjoy a day in the sunshine with the Sunriver Firefighters 
0	Alright, gonna play The Sims 2 first.  Tweet ya'll later. Still stoked about getting Sims 3 next week! And my new phone. ;)
1	Alright, good game everyone! Twitter Questions Game officially over - we are calculating answers as we speak.   #wbf
0	Alright, gotta make a quick list of the approved foods I gotta pick up on my way home tonight; e'rything under 200 calories & no bread! 
0	yeah I doubt she'll attempt to go. This diplomatic thing is very complicated.
0	I want to... but I'm so busy!!!  what are you doing over summer anyway?
0	LMAO awwwwww ya my babbbbby lol ima come steal you.I'm havin a bad day  rememba tha shit I was telln you on aim? niggas..
0	My vacations are not until november.These five year olds are kicking the hell out of me. I am sooo tired
1	hop off the dick bitch and put up that fuckin video
0	Frankie V is on crack! (sorry FV) J/K!  CRAZY! :/ Single.......hmmmmm Let him know..he won't listen to me
1	who is your friend and come Tia do as I say.
0	so sorry to hear that
0	 long story
0	I wanna phone call too
0	yea i just got outta one too....i want him back tho  but i feel the same way...i'm cool on dudes for a lil while
1	Arg! Ur always feeling bad. I don't want 2 hear it anymore!! I pray that ur healed in the name of Jesus. Take that!
1	lol..yeah..I teach the children at my church  I love it! I alwaysz get there earlier than them to set up ecverything
1	what u mean I dnt have to?? Yes I do..lol..I got you
1	hey hey! how are you?  im in my hometown now. was supposed to take photos but it rained so hard
1	Twitter swallowed this tweet for awhile ;) Hope your day is going well!
1	thanks mate
0	Turns out tomorrow is Father's Day (who knew?) so my brunch plans are being paternally hijacked
