0	started summer school today  maybe #squarespace can help make my day a little bit better. haha
0	started the day late.. missed out on lunch...
0	Started the day with a PhD related panic attack. Those had subsided for a while
1	Started the day with Russel Peter's show, everyone I meet looks so funny today 
1	started the new week of work and hate it already
0	Started the week with a bad news
1	Started this account to keep up with Christel.
1	Started to drink  in the kitchen with john Greer, my mum and dad.
0	started to fall asleep then GG starts grunting for me
1	Started to gag, spat out my mush-gum. Feeling much better now. 
0	Started to rain here again   We have had a 1 day break after over 5 inches of rain on Monday and Tuesday.
1	Started to re teach myself to play guitar. Learned how to play most of give love a try.
0	started to watch Isolated Incident and I can't stooooppp  lol
1	Started up some d2m ppc stuff about a week ago (used to do alot!) - very happy with the results  think I might blog about my methods
0	started updating my iPHONE but i left my power cord at home  sadly, this is the demise of my phone for the day UNLESS i go get the cord...
1	started using twitterbar... kinda cool  http://is.gd/Npu
0	started washing windows on  my car,  but then it started to rain   wth?
1	Started watching series 3 of 'The It Crowd' tonight. Love that show
1	Started Wintergirls already. Is really good. Go buy, then read, then tell me what you think. 
0	Started work at 5am on a saturday boooo
0	Started work on a new work project today, and hoping I can just nail it through - feels like I'm straight back into full time work again 
0	Started working. Finishing a report.
1	startin a new job today ... hope it's worth the wait
0	Startin next month I'm gonna need a companion....
0	Startin to get a head ache!!!! Uuuggghh!!!
0	startin work today at 3... gonna have to listen to the game
0	Starting a long day and hoping everything turns out alright with my students pony... sigh
0	Starting a new day!.. workflow animation, wizards... forgot my mobile 
1	Starting a new day, a rainy day but inside me the sun allways shines! 
1	starting a new novel...i love Carol Higgins Clark
1	starting a new week!
1	starting a project in NetBeans  .. so far, it's great to use Visual tools .. though plain programming is more fun ;)
0	starting a work day of 14 hours.
1	Starting AFX, need to montage and color correct a video 
1	starting an account here on twitter
0	Starting another week of work
0	starting another work week. no word on the apps I put in last week
0	Starting at homework
1	Starting at the Downtown Toronto office today
0	Starting calorie counting soon, the boy and i are both not hitting our caloric intake for the day. Im barely hitting 1200. 
1	Starting class...
0	Starting in on John's new play room. Hoping to get spackle, sanding, primer, and white paint done today. P.S. - I hate the rain. 
1	Starting intravenous caffeine... realizing I am at work... and that it is Monday... Morning Everyone!!!
1	Starting Monday June 8th check back for min by min twitter updates on the road!!!!!
1	starting my day (much too early for a saturday) with a walk with Tia  - hope she likes it at least
0	starting my day at work and not loving it!
1	Starting my day at work. Highlight is new coupons. Lol. Trish and I will b busy today.
0	Starting my day listening to Tape 101 webcast   So wish I was at the Social Media Marketing Summit in NY, it seems far more interesting
1	starting my day off early.. going to the pool for a little while then working later
1	Starting my day with Coldplay on the radio!!soft, soft, and later than mid morning maybe  something with more power!Molotov, why not?! 
1	Starting my day with some ribs.  Market-bought ribs are never as good as restaurant ribs (I guess that's kind of obvious, though).
1	Starting my ethnographic research today!
0	starting my exams in 4 hours and im on twitter.. not cool
0	Starting my first essay. I dont know what to write about!
1	starting my internship at CBS Sports today!!!
0	Starting my last two weeks of high school!  *TEAR*
0	Starting my last week of 8th grade
1	starting my new job tomorrow morning!!!  have to wake up at 5.30am though. eugh.
1	Starting my workout tomorrow. Have to get hot!
0	starting new job july 8 i am sooooo excirted!!!!!! still no gym though
1	Starting NOW, Saturday Nigh Jazz on 89.1 FM KMHD, streaming live at kmhd.fm! 
1	Starting of the morning right working on contracts...why can't everybody just give me what i want the way i say i wante it
0	Starting on 2 bk-2-bk meetings - Groan!! Will do my scary coff version 3.1 n kill them all
1	Starting out bday bash with a Blue Moon  - Photo: http://bkite.com/07k6X
0	Starting P90X. Goodbye Cheetos, brisket, and Jimmy Dean. Hello carrots, turkey breast, and Morningstar. 
0	starting PN lean coaching next week. can't wait, I'm about 5% compliant right now   #PNLC
1	Starting set-up today! 8.600 m2 venue and 25 meters of screen for roots, yeaahhhhh 
0	starting some history revision.  #621621621
0	starting the converting of NIN SB again.  first time crashed
1	Starting the day - and month - with a smile!!
1	Starting the day off right!
1	starting the day that will be filled with cleaning, laundry and hopefully a movie with the kids 
0	Starting the day with a hot bath, me like  Now all that's missing is a massage 
1	Starting the day.  3 day work week.
1	starting the fast today lol had a nice breakfast...  a banana and for lunch apples w peanut butter
0	Starting the final episode of #TheUnusuals  In download news- ITunes has a behind the scenes video available for free!
0	Starting the gym tomorrow.Or going 2the hairdresser.But if I do that I wont go 2the gym cuz my hair would ruin.It's hard being a girl
0	Starting the journey home now
0	starting the last sookie book. the sadness...
0	Starting the morning routine, get the kids ready, get em to school, the back to work on the website. Morning cup is not kicking in yet 
0	Starting the morning with a boring meeting is not the beginning of a perfect day
1	Starting the new youtube mix! Expect it in three hours or so
1	starting the night at Elephant bar with the bestie
1	Starting Thursday morning off with a little "Surfer Girl" remake... countdown to the weekend  ? http://blip.fm/~6954f
0	Starting to be far too many spamers and bullshit followers on Twitter.. I tweet about moving furniture and 3 furniture companys follow me
0	starting to become friends with biology, tomorrow i have to make friends with chemistry and physics 
0	Starting to break out in hives again...*sigh.
0	Starting to count down to the last exam (23 days to go) and then i'm free to waste 4 whole months  but for now, back to revision 
0	Starting to develop a fear of flying..  Thoughts and prayers go out to Air France victims
1	Starting to do Multitasking now thanks to
0	Starting to draw something for because he sounds really upset
0	Starting to dread graduation Friday...  I don't want to tell you goodbye.
1	starting to feel a bit stressed, but happy with more electricity what makes life easier in Kathmandu 
0	starting to feel a cold coming on  ..hittin the sac
0	starting to feel a little sick.. wtf?
0	Starting to feel blue again... No
0	Starting to feel human again now - feels like a long and problematic day ahead tho  in need of a holiday but not time to have one
0	Starting to feel like I'm boy going to get an apartment
0	starting to feel like I'm not good enough anymore  .....leaves me a little depressed
0	starting to feel not-so-good again... promised to deliver some stuff by COB today
1	Starting to feel pretty good!
1	starting to feel sane again after two days of laptop headaches. I still rocked it with Siren and Mosaic last night and it's sunny today.
0	Starting to feel sick...
0	starting to feel worn out  i think i have the flying pig flu....
0	Starting to feel worse :/ I cannot wait for my doctor's appt... Ugh! I could use some cheering up
0	Starting to flag on train down and haven't even got to London yet
0	starting to get a lil bit sleepy. yay for xanax. <3 stomach still bothering me though, boo to that. 
0	starting to get a sinus head ache
0	Starting to get nervous about leaving Jboy at Preschool
0	Starting to get sad.
0	starting to get sick...who gets a cold/conjestion/sore throat in the summer? I thought that was winter sickness
0	Starting to get that "getting nowhere" feeling again.
0	starting to hate life. ugh! i need a miracle
0	starting to hate school
0	starting to hate Spanish, freaking out about the exam tomorrow 
1	Starting to have more followers, thats cool. Thank-you to every one whos following me  Have a great evening you guyss!!
1	starting to look a bit slimmer thanks to the Atkns Induction  5 days down!
0	starting to miss my daddy. remembering he's no longer here.
0	starting to miss summer already
0	Starting to not feel so great. FBS
1	Starting to organize and pack for Israel. My husband left me home alone tonight with my spreadsheets  brings joy to my heart.
0	starting to overthink everything in my life=  sad kitty
0	starting to pack  5 more weeks and i'm done at Ball State
0	starting to pack stuff up
0	starting to pack up my room  but can't wait to get in the new house & design my new sexy, artistic pad !
1	Starting to pack up. Great day. Made $1600. Met some GREAT people and some...interesting ones.  some tweeters were there too!
0	Starting to pain in Milton!
0	Starting to panic about impending first semester dentistry exams - waaaa!!! And on that note, really wishing I had a photographic memory 
0	Starting to panic because my clothes are shrinking... or is it my ass that's getting bigger? Oh, junk food! I think we need a break. 
0	starting to read twilight again... didnt know how much i'd miss it   but i just love reading about bella& edward they're so cute
0	Starting to taper for Boise 1/2IM on 13th. Early a.m. swim & run done. Great to swim outdoors again. Paperwork, office today  Hate it.
0	starting to think i may want to rewrite this entire manuscript...
1	starting to tweet in 2 languages: Romanian on and English here - don't want to spam my dear followers with noise
1	Starting to twitter.. This is interesting.. Hmmm.. Well, I guess I made it.. This is fun! 
1	Starting to watch lost season finale 5x16, yeeah, i'm slow  
0	Starting to wish I had a talent, I can't sing, I can't dance or draw or paint, shit with computers 
0	starting to wonder if I'm going to get this job... came across as though i'd find work elsewhere if needs must... not intentionally
0	Starting to wonder if my future landlord is crazy or prejudice against americans.. this may not end well
1	starting to wonder if you guys with jobs prioritize tweeting over work
1	Starting to work on my resume. Joy, need some goji berry.  It's great iced!
0	starting to worry about his exam tomorrow...   (also thinks walter is a homos name)...
1	Starting with Ajax!
0	Starting with twiter and hurts me throughout the body,that bad luck 
0	Starting work on a riduculously large document that's due 5pm tomorrow.  Boosh
1	starting work on the 15th!
0	StartN To Feel Sick To My Yummy Tummy  ! ...Pepto Bismo Please...
0	startrek was still awesome the second time, but was not as fun since I had no one to smirk at during the gay parts. no one here gets it. 
1	Starts her 6 month 'Me Me Me' plan tomorrow. Must eat steak first. . .
0	starts his summer astronomy class Today  but 4 days til I see the Boss at the IZOD center :>)))
1	starts learning how to articulate Buddhist teaching in plain Spanish. More projects.
1	starts phlebotomy class tomorrow   also the doctor said I'm doing well
0	starts summer school today
1	starts the day while is sleeping behind me
1	Starts the new job tomorrow, looking forward to thw challenge and learning new stuff, never felt so positive about a job 
0	Starts to get sleepy. Always at this hour
1	starts to love julian kirrin, hehe 
1	StartTrek was/is the shiz i give to a 15 on a 1-10 ...okay time 4 bed sleep tight yall
1	Startup Family Kim: Tight, Bright, Full of Light  #K-Genius #Solid #TechFellow http://yfrog.com/6f3zgzj
0	Starving  and i need cigs !
0	starving work
1	starving artist starving for true art in music just signed up with this twitter sh#$, im a newbie take it easy on me 
0	Starving my mind away  I neeeeed food, but there is none in sight. Shopping = must.
0	Starving! And the only thig to eat in my house is chocolate
0	Starving! Still have an hour to go.  Then Bun Bo Hue, I shall come.
0	STARVING!!! trying to have a healthy day just makes my tummy rumble
0	Starving!!!! Haven't eaten all day.
0	starving, but mum wont let me raid the cupboards cos she's making a roast chicken  and some fuckers eaten all my foxes bisquits :@
0	Starving, but not allowed to eat. 
1	Starving, gunna have some grub  Tonight should be good!
0	Starving. And Alyssa's mom would bring her subway.
0	starving. cant wait for breakfast.. in like 10 hours
0	starving....and can't go outside because the heavy rain
1	State of origin staples = cheapo crazy clarkes QLD jersey, winnie the pooh PJ pants and uggies  http://bit.ly/j3ka8c
1	State track meet prelims this morning! Wish me luck!
0	State wave titles this weekend good forecast and i wont be there
1	Static Estimation of Test Coverage paper accepted at SCAM http://is.gd/M4Aa
1	static time ft. arctic monkeys (LLL) and pansy
0	Station 9 was jumping tonight!  So sad I had to leave!!!
1	station meeting tonight. THEN anyone up for seeing the hangover? probably 10 o'clock showing. cell phone to reach me
0	Stationary motorway traffic  http://twitpic.com/7j3t8
1	stats exam finished, bit of an odd one. Finished in 45 mins, had another 45 minutes to sit and plan my evening...read my book in the sun 
1	Stats is so boring today... I can barely stay awake... I just want my bed, some popcorn & a good movie!!! 
0	Stats self-study! Then writing
1	Stattits was easyyy....
0	Status report done for the week - thats the best part of an hour lost, oh the joys of status reports  glad I don't do timesheets as well!
1	status: BRB. i just want to take a bath while my internet still in mode on like now  lmao =P
1	Statut twitter de leane = so boutch. Jvs aime. Dis salut a ju de ma part
1	Stavros Flately - they were brilliant!
1	Stavros Flately on #bgt = amazing! Such a lovely relationship between father and son and a perfect act!
1	Stavros flatley OR Diversity TO win!!! im going vote for Both
1	stavros flatley to win
1	Stavros Flatley to win.
1	stavros flatley, you were the highlight of this evening 
0	Stay a looonng time on MSN and all 'cause tomorrow ... No computer
0	stay away evil migraine, i can feel you lurking still in the back of my head 
0	Stay gold ponyboy. Aww its so sad.
1	Stay humble. Always answer your phone - no matter who else is in the car. (Jack Lemmon) Good man, gotta remember this one 
0	Stay in camp and hang out with people that are more perverted than me
1	stay positive today guys *peaceee* [:+  i'll Be Back Later  x #/] x
1	stay tuned for the jewelry party invite in ur email  Nite twitts- Thinkin bout my Kira n god kids, luv u guys xoxoxo
0	Stay tuned on DNA and fake heart, etc. I keep talking it up, but it's ~ a week off. Robo-bat is done, but not being released untl July. 
1	Stay tunned for hip hops NEW media source! BEYONCEKNOWZ official website coming soon!
0	Stayed an extra night because of a big storm. No for me today.
0	stayed at home for the whooole day. I am craving for ice cream.
0	Stayed home 2day from work...has a cold.
0	Stayed home again. I hate being sick
0	stayed home from church for a baby with the hershey squirts...
0	Stayed home from school missin a game  ughhh layin back down i feel blahhhh
0	stayed home from school sick again
0	Stayed home from work cause I was sick earlier. Gonna call teachers and ortho and switch stuff around now. I'm tired
0	stayed in and had a nice day wit the fam! Now im pissed cause I have to sleep on this damn couch verses my comfy bed
1	Stayed in bed all day today had big night out it was great
1	Stayed in tonight to recover from last night chillin with alison playing cards and eating soup
0	Stayed in tonight watching "Man Eater" with my man.... Boy I feel old  I have to wait til tomorrow to find out what happens.
1	Stayed In....Ate well....drank well...snuggled up with the hubby.  What a great great day.
0	Stayed on after school for Art club, just catchin up on work :/ I still have alot of catching up on pretty much every subject 
1	Stayed up all night but done tracking 'I want you' !!
0	Stayed up all night catching up on GG. So tired that my eyes are swallowen
0	stayed up all night talking to someone only to basicaly break out connection. I hate myself
0	stayed up all night to FINISH HER WORK!!! but is going to be late for class either way. . . again!! urg...  life of a teenage drama-queen!
0	Stayed up ALL night!... sleep pattern messed up!... so have to stay up all day aswell just so i will sleep tonight at a proper time!
1	Stayed up last night working.  Now, I am going back to bed 
0	stayed up late for Stats!
0	stayed up til 12 and the iPhone update wasn't even let out yet    i guess i'll be tryin again all day until it's let out
1	Stayed up til 2:30AM playing dinglepop with Texas. Haha!
0	Stayed up till 130 last night doing my culture box and as I'm walking out the door, I'm attacked by a scorpion 
0	Stayed up till ater 1 AM with Jessie.  I already need a nap, and I just got up.  I am also already pouting~ Jessie leaves today.  
1	Stayed up till now, which is now 5:43am, out with Selene and friends for her bday  was awesome
0	stayed up to late watching tv. Getting the girls up was hell this morning. I'm letting Dan sleep in today, since work starts up tomorrow 
1	Stayed up to watch Conan's debut on The Tonight Show now I can't sleep! Tomorrow is gonna be a long one (that's what she said  lol) He ...
1	stayed up too late last night but it was worth it  work til 4, Xpose til 6, gym with Jeffrey then pizza night!!
1	Stayed up too late working on a story for my next script. Only to be awakened by my 4yr old saying "time to get up Daddy"
0	stayed up until 2a doing my daily log for class and now the ning is down and I can't post  mildly upset by this...
0	stayed up waayyyyy to late last night.. this morning hit hard
0	Stayed up way too late  gonna pay for this one..
1	STAYG spring retreat '09  <3 be back sunday
1	stayin at kimmi'z tonite  woo! i have mcfly playin full blast the now thoo!!!  best band ever!!!!!!!!!!
1	Stayin FLy!! **** FOLLOW MW AND SEE WHERE YOU END UP********
0	Stayin home from school today, still sick.  but hey, 4 day weekend!
1	stayin home tonight....excited for the laker bbq tomorrow
0	stayin home. not feelin the greatest  hope i get called in early 4 work tomorow. I miss you
0	Stayin in the crib tonight maybe it wasn't meant 2 be
1	Stayin Positive! Imma hve a wonderful work week!
1	stayin up late once again. gotta love summer.
0	stayin up late tonight  my restaurant city's not working  whyyyyyyy
0	staying my grandfather's house again, it's so quiet & sad here  & not to mention extremely hott UGHH no normal air conditioning 
0	Staying after school today
0	Staying at a friends house...house sitting, neighbors are SO loud-having a party 
1	staying at grans  pahahahaha, she is hilarious !!
0	Staying at my brothers for a couple of days so i can relax and revise in peace for my exams starting on friday
0	Staying at staceys (: hope i dont sleepwalk or start snoring  lol
1	staying at the sisters tonightttt. no bebo, twitter, msn or facebook - wish me luck. 
0	Staying at work til 11.
0	staying awake after taking an Ambien can be very productive for chores around the house, shit, Ambien, Aderal got the wrong bottle again 
0	staying away from the macbook for a few days... i got an eye infection
0	staying for duty in the kitchen. all of my non-chinese friends have gone back
1	Staying for the fireworks. Hope they're better than the game
0	staying home and keeping an eye on sick sis  but i did just buy the new Blackberry Curve 8900 online.. thanx Scott!
0	staying home because im sick  but i get to watch hannah montana! woohoo im like a five year old lol
0	staying home doing nothing.. is really a waste of time, i miss notnot 
0	staying home from church when she doea not have a fever....  yet she cannot breathe, so.....  its almost been a week.
0	Staying home is nice - unless you REALLY wanted to go out
1	staying home like a gwamma but its ok cus she's keeping me company  yay! she's the fcuking best<3
0	Staying home on a Saturday night
0	staying home sick thanks to my awesome coworker, so thats awesome, though being sick sucks  think its just a run of the mill cold though
0	staying home to do jh presentation  sis and mom are off to shopping
0	staying home to take care of injured foot  will go thru backlog and try to write couple blog posts but no internet hope it comes back
0	staying home today sick
0	staying home today. my poor baby  i just want him to be okay....
0	Staying home today... sick  I better be all better by this weekend!
0	staying home tonight! Too sick to go out!
0	staying home tonight, too sick to go out! 
0	staying home watching ghost hunters with friends! im getting a little creeped out
0	staying home... decided it's been a lame ass week.
0	staying home...i need to get better for the 7th.... it's no fun when you sick
0	staying in a long line to Consulate  And trying to work
0	staying in and missing the 2nd day of class cos i feel sick.  im nipping it at the bud before it gets worse.... http://plurk.com/p/11fyay
0	Staying in as I feel too ill to head out. A friend once got ill abroad n started crying to go home. I now know what she feels. Miss home!
0	staying in reno for the night.. there isn't anything to do besides gamble and it's 60 degrees out
0	staying in school from 8am to 10pm! BAM! home alone for 2 nights...
1	Staying in the goodwill hunting room. I had nice dreams of Matt Damon
1	staying in today... tv is going to be my best friend tonight
1	Staying in tonight to do absolutely nothing
0	Staying in tonight...really not feeling well
1	Staying in tonight..watching my brother rob roll a blunt..hmm never has he looked so concentrated! Lol
0	staying in-house has its pluses and minuses...especially when they don't put in your washer dryer
1	Staying late til 9 pm at end of month on a Friday to help out with West Coast orders! Hoping to score some brownie pts
0	Staying night in my friends house , plÃµks-plÃµks(we didnÂ´t take photos), im mean in another way. Anyways, night to you, i wont tweet 
1	Staying the night with my best friend friday night.. Gonna REALLY celebrate then, no driving for me! 
1	staying tonight!!!  heading back to s.c. in the a.m.!!!
1	Staying up all night coloring, and watching movies  ...sweet.
1	Staying up all night.
1	staying up for the whole day i guess. TODAY:Watching edward scissor hands, cutting my hair and possibly just maybe dying it 
0	staying up late again to get some more work done   Will I get a break tomorrow...probably not
0	Staying up late from partying and taking in the view from my soon to be old apt. literally the last day i have to move out  bye brickell
1	Staying up late on a Friday. It is the first late Friday in a while... summer has done me good
1	Staying up late, talking to Scott about drugs. Much love. 
1	staying up on this beautiful morning to see the sunrise  then run home lol
0	staying up playing nursemaid to my sick cat, trying to get her to eat and drink. i've had her since i was a little girl, and she is sick 
0	staying up to see on kimmel. jammin to bnew til then. thats bad hahaha shame on me
0	Staying up two hours past my "bedtime" just to talk to you online for 10 minutes before you go to work is totally worth it. I miss you
1	Staying up until midnight for the #LVATT drop on iTunes! Also getting it from borders tomorrow.  Excited.Tired.Just wait.
0	stayn home from school. sick. doc says I have bronchitis
0	Stayn home frm school goin 2 beach dis weekend  no internet connection there
1	stayyyyyyyyyyyyyyying at home today
1	steady lang. Making plans again.  http://plurk.com/p/10zum1
1	Steady steady pom pit pit
1	Steak and Mac&Cheese for breakfast/lunch.  mm mm good
1	steak dinner with and at Bobo's tonight, filet mignon rules! 
1	Steak n shake at 3am bitches... Thats how i roll
1	steak w| alfredo shelled noodle  mmm tv, maybe a movie... sittin back relaxed. 14 more days til im back east for a week... can't wait!!!!
1	Steal This Idea: Google Reader & Twitter Hashtags | Search Engine People http://bit.ly/Sh8F0 <- i do something similar with vienna
1	Stealing my mothers slow cooker was the best idea I've had in ages. Tonight's delicious dish: tomato and herb lamb shanks
1	stealing my neighbor wi-fi and downloading bit torrent at 250kB/s
1	Stealing pictures from Cha.  Haha! Just check my multiply if you wanna see them. ;D
1	Stealing the government van and taking a road trip. We're experts at this now
1	stealth shopping - got wife b-day present while at mall together and she didn't notice - buy, hide it in car, back before she missed me 
0	Steam cake & banana for breakfast 2.0. FY(K)I (k for kind!) tht happens 2 b around 11 am! But heck, no latte    #ammarules!
1	Steam roller time
0	Steaming my hair now, for some reason have early kylie in my head (over dreaming over you) go to play the cd and it's gone!!! Not happy 
1	Steel cut oats consumed: a heart-healthy start to my day.  Now off to Portillo's.
1	steel your girl by Neon Neon... It's good to hear
0	Steelbreaker broke my druid.  Luckily that meant I could run afk to take Rose out.  So it was probably all for the best.
0	steeling ourselves to spend the night in the old house - no mod cons such as internet
0	Steeljaw never wants to play.
1	Steely Dan - "Pretzel Logic" (TURN YOUR SPEAKERS UP!)  â™« http://blip.fm/~7rzm2
1	stef's graduation and dc greek  today is a good day
1	Steinhausen was good        i miss you
