0	OMG! WE DIDN'T GO OUT LAST FRIDAY  WE HAVE TO ... OK? AND MAKE A PHOTO SESSION
0	Sammy Sammy Sammy...I got on facebook to see your sad status THEN get on this sucky Twitter and see the samething!
0	Send the link to the page again, I'll getcha a couple more [votes] if I can..Monday/EOM so busy 
0	and then typically I had an even worse one last night/this morning. Stupid brain!
0	i miss you  i want to hangout tomorrow! you busy?
0	noooo idk, its a hacker 
1	 Hey man no problem  and thank you for the followfriday
1	deliciously--not a word ha haahaa
0	I can't believe they took it w/o a tow sign.  Not cool.  At least it's back.  Chicago = $170 to park
0	Oh no, sorry to hear that  Hope everything is ok!
1	Tornados turn Anti-Cyclonic down there... but it's normal for you guys!
1	I wish there was a recorded version of this! She was so cute rapping   â™« http://blip.fm/~7twym
1	+ the new kiwi company that is hoping to start up too!  Competition is good for us buyers!
1	thats what he usually brings home, have to say laPhoroaig is good in moderation...though I do LOVE Glennmorgangie  pricey tho
1	by Nusrat Fateh Ali......its a must listen but beware..induces heavy addiction
1	heyy girl I was gonna text you the other day...did u get thmdk for the 11th?
0	Feel better! Sorry to hear about your fishie.
0	omg!! that sounds serious!! hope you can get well soon
1	awwww well u got me! lol
0	i guess you don't work around enough nerds, then!  i work at a computer store, so i hope i have some luck with the earrings! 
1	  How nice of you to say that.  Thank you.
1	no sorry for not clarifying, 9pm  it was a late night thing. such a great way to spend a saturday night in my opinion.
1	I would like you to explain me what kind of language you speak...
1	both belgium shows in july and manc  im in serious need of some gig action. aww, get your lady friend to make u feel better x
1	I did sleep well, thank you. I didn't dream of him but I woke up to Austria beating Germany 1-0.  He got an assist!
0	haha whatever u silly silly girl! ugh i'm soooo bored
1	 So I really hope I'll convince my mom to take me to Sho's concert.. then we should make a short vid! 2 7atk's in 1 place!
1	hahaha!!! I'm gonna try!!  yo are you seriously thinking of coming to see my recital???
0	no..  it was SO quick. but while we were walking past her we  smiled at each other for like 15 second. lol
1	yea you do! SO good
0	go ghetto and get it. I want to get my nails did.
1	I am too... They are coming to pic me up. I better hit the shower NOW  BRB tweeps.
0	i miss you
0	its cool if Liza is a no then i will book a flight E is not going I iz sad
1	Nope, I did not forget 
1	YES!! cant wait. hope these vip passes help since people already campin out hahah
0	i have work til 10 tomorrow
0	I havn't even started  how long has it taken you?
1	I know it's fake but it's so good. 
0	I will miss u Sabs
1	 Ashley  (@SwaywithMe1) is an an amazingly multi-talented young woman!
1	Not too much longer girl get those arms ready...lol...
1	What are you filming?
1	good night, have a sweet dreams 
0	alright but she may not be into it  ha
0	oh no im so sorry about that!  i hate sore throats gahh..
1	now to  teach mom and dad to film such things and share them with certain interested parties
0	Doh! I certainly didn't mean to shame you into doing anything.  That said, you did the right thing. Haha.
0	actually, that's an almost 10 year old car that hasn't been kept up in the past 2 years - all my fault 
1	Thanks for the birthday wishes, guys. 
1	this is probably old news but you appear to now have a kite-less pic, but one that actually includes a recognizable you 
1	same here slow and boring =( u should link me on aim doe
0	I haven't played around with previous versions enough to gauge the diff, but I can tell you my gnome shell is a little flaky 
1	haha. Good to know
0	A 15 min. viva and a 15 min. discussion of a prepared topic. My examiner is QuÃ©bÃ©coise which means her accent will be awful
1	lol yeah might have something to do with it
0	so I can have a petition on the site. Seems good plugin but won't install
1	Well I hope not, its Sunday and U need to have some fun 
1	just heard chris & Conrad on the radio!
1	Though it probably depends how much oil is in the PB. I'll have to give it a try. I have some apples waiting to be eaten.
0	 i'm sad i don't have the american tvchannel  i would like to watch it  and to watch E!  and abc  and things like that ...
0	 yes i hate fake tweeters toothey r so stupid
1	hahaha that's a good one
1	am tired again too..couldn't sleep again last night thanks to twat face! Ooh the hills is on in 25 mins
0	Haha...ooh it was gorgeous wasn't it!! And a whole weekend more to follow!! Ouch...i had blisters from my shoes yesterday
1	HEY BABES IM GOOD CHANGING A FEW THINGS WITH KERI ON THE SITES LOOKING 100% BETTER ONLY WAY IS UP
1	Think all your rain has landed over here....we've had flash floods in the South lol - can't wait 2 c ur pics Mrs - X for Joe  x
1	Seriously, though, I hope you feel better soon. 
1	Yeah, totally agree, but I like writing this little util to find out WHY people are following me 
0	If by Park City you mean Tampa, then definitely...I won't be in Utah til June 27 
1	That is the hard part for me  I want to walk in, buy it and be done, not much of a piece together eye
1	hey Sampsa I know what you mean. I have just put for some annual leave. Need to unwind & relax a little as well. Enjoy your time
1	late reply: Twitter = idylli
0	it's been raining out over here for WEEKS! what i'd give just to sit outside and tan again
0	That coffee looks like a work of art.. Impressive and much better than the grime we're drinking in the office today
1	Learn xhtml.  It's the waaaave of the future.  And java. and perl. and python. and blah blah blah
1	Haha. Ok then. If you insist
1	happy birthday my Sam jam  we loooove you
0	I'm gonna miss you sooo much tonight! Happy Birthday won't be the same
1	aww, happy birthday Cassie 
1	your stuff's in my trunk??? sucks for you!!
0	she's not here yet. i'm in spore only w my mom. my sis will arrive here 2morrow. so tired. i woke up at 3.30 am  bluff..
0	i know but i wish i could help more
1	its about Â£1700 over here.
0	man! I swear living here is really beginning to suck. last year it rained. photowalk is the meetup group
1	Vests are perfect for safaris  I posted the link for the girl's version on David's blog, just in case you'll need one...
0	that book is so sad
1	sorry I didn't text back... it's been awesomee! relaxingg and heading to Ohio LOL
0	oh wait u're invisible again
0	 I couldn't find any news on it
0	The thing about it Brina, it's getting them to give you all those days off when you've just been hired 
0	im suffering bad from allergies this morning if that helps  prob not even close though...
1	If they can't be bothered to put a fake logo on a soda can, why should I be bothered to watch? 
1	or, "no one's forcing you to follow me" 
0	 Im sorry, thats 1:45am here... Hopefully I'll be sleeping but that probably wont be the case!
1	btw, I think that your website is really cool  My pleasure to know you
1	If i'm painting a wood mirror frame, do i use a special paint or just regular house paint? Thanks kid! 
1	Yeah, but he's bringing his rope with him, so I'm ever hopeful   I'll pass on your cuddles for his r&r!
1	can u tweet again now
0	urm on the 11th yours? im getting braces tommrow  oh dear
1	yeeh LOADS of pics :p and ill record beat again EEEEE  and keep trying to win them ;)
1	just get it started .. it helps ;) .. btw: thx for following
1	it's called America and marginal cost
1	OR direct messaged him OR showed up at the gym OR stalked him secretly OR drew him little pictures?!  not crazy no.
0	ifyou live in australia.. melb.. then does..
0	Hell yeah.  Missed you the Beach Olys this weekend
1	Must have been harrowing.  Interestingly my 1st reaction is: They had twitter in 2007?
0	ok a hate you
1	good luck  how many do u still have left? Haha same taste in music and profiteroles
1	kewl... hoping to get home for the monsoons
1	rain rain go away , come some other more suitable day 
0	but I only have 3 GIANT containers full  how can I spare any?
1	good good  I will keep a look out for it then
0	I wish i was in paris
0	I KNOW! IM SO SAD I WONT BE ABLE TO SING HOTEL ROOM WITH YOUUU
1	Hey mr! On twitter again!?  How's life on the flipside?
0	me tooo.... i cud nt sleep last night  .... yeh hai meri dilli...sob!!
1	sounds interesting already
0	Thanks Sam. I sometimes don't even recognize Toronto anymore
0	oh that sucks the big fat one
0	I was asleep when you called, sorry that I didn't answer the phone. 
1	 you people crack me up! love you both
1	Ill have the kids with me. My friend Melissa and Saskey too. Should be fun  x
1	Get 100 followers a day using www.tweeteradder.com Once you add everyone you are on the train or pay vip
0	sammmmy I miss u  lol.. The weather looking right ;)
0	 the link isn't working for your ad preview!!
1	 You're having a laugh! Chelsea ain't gonna score tomorrow. We'll shut you out!!
0	DAMN! a mass unfollowing and i didnt get the invite! im bummed now
1	grab a bottle of water and come to the beach.
0	had, but he broke up with his boyfriend & moved away.  I had his boyfriend cut it once, not that great, so I grew it back!
1	thanx sweetie..     glad yall like..
0	i know. i had great convo.. but didnt get you on video
1	thanks for the heads-up sam. t-shirt ordered
0	Wish I could bethere, but have not been able to get my new Enhance Driver's License to get over the border w/ the new rules 
1	22nd June  i was going to  do the giveaway to celebrate 300 followers then realised i had passed 300 lol
1	lol girl that makes me feel special i guess
1	woop! Well done with the comp result, tis a lovely photo. High five to ya 
1	hahaha. bring it when you come and see me again. 12th of June. Gertrudes Brown Couch. Be there or be square.
1	glad to hear Emmett is doing better.  Wish I was taking him home with me! Someday Ill have a corgi
1	hahaha  your not getting anything  hope your okay? x
1	i'll keep you posted
1	doing okay  how you today?
1	Hey there  Doing okay I guess today. Back feel a wee bit wonky, but otherwise good. you alright?
1	lol its ok, jusy woke up so. i have no plans 
1	lol yeah. you might be fascinated to know my dad does most the cooking in our house, too 
1	meh. It was alright lol. I do like sundays
1	no most definatly not hahaha. I'm just about to go out for the night though. Ha, going out on the town (sensibly tho  )
1	thanks guys! they're the first of a bunch we're getting made. going to put the mtogether as little packs
1	might want to rephrase the last tweet
0	I'm actually jealous...  I wanna' come up your house now just to eat cake and then go home.
1	not quite sure in a funny mood haha
1	go and see Romain! grey building near the pub the phoenix
1	mmmmmkay! Haha  My pastor wants to do something fun/guest bands every other week
1	you're reblipin' all my tunes  â™« http://blip.fm/~893qx
1	oh ..missing you & lis too!     lots
1	Maybe one of these days and I can treat you to lunch.
1	Good morning
1	but someone at my Improv workshop in Ottawa said you guys are awesome.  international word of mouth!
1	still here, sorry..somethin' came up. wow, youre from CamSur huh... quite far   
1	I can't wait for this day to come (aa) xD. Haaan tk u so so much :$ <3 I can't wait to read it  It's gonna be awesome
0	I love danny gokey too.. tau ngga sih dia br married sbentar trus istrinya meninggal krn sakit.. huhuhu.. kasian
1	I went to NYU, I've been paying back longer ... LOL 
1	Awesome wEn i go ... wna be my tour guide?
1	That is so cool! I'm gonna find it & retweet.
0	ah wait.. i have a function last minute one  ish... mati i cant go to either outings
0	alolo saja! ALOLO (L) HEEE. im doing so and so. i just miss everyone. my holidays are sucky.
0	then thats a dreamy dream! HAHA. i miss you!
1	hahahaha I'll come.  always down fo shopping holla
1	I think my aunts bday party is today at my crib, ur more than welcome to come by 
0	I hate it when they catch birds  I haven't got a cat now but I did when I was younger. Hope birdie can be saved!
0	NM REALLY... JUST BEEN SICK THESE PAST COUPLE OF DAYS.!@! SUCKS
1	Now you're here! Forever!!  - Kimberly
0	no O has a regular work day
0	: / Damn same here boo..I bought Benadryl, but it knocks me out 4 da ENTIRE day..smh 
1	http://twitpic.com/4f82d - Aww! Cute. In a slightly odd way
1	the only thing I recognise Janice from is celebrity rehab or some mtv locked up in a house... I didn't know her prior to that
0	did you got anything from Kinokuniya? Now, im cravng to read her newest novel of  -being Nikki.  Curious!
0	me  I really really want to go, i thought i RSVP'd today, but apparently not (
0	aren't they adorable!! I miss mine already...
0	I knoooow!! I hate being so far!
0	sorry to hear that!  but a yay to moving back to NJ?
1	...it's a song... I dun gotta agree with it to have it stuck in my head.  least you know me well.
1	it's not mean to wish your boss were sick! I swear! You deserve a break sometimes!
1	Thank you! Appreciate your acknowledgement.
1	don't worry about it ;). I'll have my next address... sometime in the future, will give it to you then 
1	Die mofo! PS: Follow me!
1	man thats the life!
1	haha it was fun! sadly the photo doesn't show the huge pool of mud i'm avoiding by acting like a monkey
0	sorry!!! not trying to rehash.
0	oh i hope you're feeling better too. It's no fun being sick
1	love...love..love gives u bags under ur eyes cause it keeps u up late
1	anytime... Just say "shopping" and I'm there. Rain or shine...I'm there
0	fuck Jacob! They killed my Juliette
0	i also feel the same
1	I was way too busy doing exciting things
1	im doin great! how was school?
0	 it's hard to be asian and not eat salty food!
0	LOL. Yepp. Poor me   LOL, how was your funfair? xD
1	omg yeah the sneak peek is amazing
1	OMG Natalie I'm the same way! LOL your body does get better at it though.
0	to germany as well...
0	no not fun at all
1	I think the owner is wanting to sell it, so I might buy it off them 
1	I actually have one of my many rabid fans who has indicated she wants to draw him.
0	yeah of course i lost my job a month before it so i couldn't afford to go either.
1	Ha, play for fun describes me aptly as well ..and Oh ! Nice to know a fellow Roger-Liverpool FC fan 
1	LOL  Definitely some kinda setter.   Tired but excited. And probably going to be slightly hung over in the AM.
1	if you  cant make it tonight maybe this weekend or sometime when you'll off work
1	THAT'S not the right way. It should be like, "Hi Mr. Gokey, I'll help you find your luggage IF you give me a kiss first" 
1	The animal site is being taken over by cats. (kittytwitter wall)  I'm voting for all dogs & Equine.
0	i usually just trust... it's amazing in this economy how when you check your bill - there's a mistake
0	i am not coming to cbe for now...  will be here in delhi till next year man... will call u definitely if i come to to cbe
0	OH NO NOT THE NEW DRESS !! D: did he give you something for free? I hope it doesn't stain
1	bring back proper flannels and knitted jumpers I say..! at least my college team looked right
0	:O did u watch BGT? im not even gunna talk about the niley thing anymore, sick of all the crap 
1	Haha yup!  Theres a GIANT moth looking at me :l argh save meeee. its soo creepy and..mothy ;)
0	you need a ipod! its 2009! and my aim is messing up
0	Oh yeah! LOVE them. I didn't put them on the compilation  But they're on the cover of every mag and paper here right now
1	yayyyy!!! Have fun
0	i would make u coffee but we dont work 2getha anymore
1	i have Vista on my PC... w ba7lam ageeb Macbook
0	thanks sadek.. i remembere there was something else, bs mesh fakra 
1	ya, its more like said "all about why u r using either and who u want to reach" ..hope you're having a great night  
0	yeah i've done that twice now and nothing happens
0	 im sorry I thought u name was sadie shame on me
0	Sorry about the "beached whale" it was super dark and apparently Ann thought it was a whale instead of a seal lion. My bad
1	about time! Did you get fed up of the nagging?
1	Do you want people to mob you? Strange boy.  Take a nap on the plane!
1	It means you're a popular topic! People are talking about you a lot on Twitter! Congrats! Xoxo
1	Just sent u a friend request on FB.  Not a big fan but some of my friends can only be contacted through it so I have one..xx
1	see? Told ya! Oooh, I is so wise 
0	Still can't believe you went to SATIR without meeee.
0	i live too far away from most of my friends.  *pouts* you can has New Kirk and i can has New Spock, Y/Y?  
0	oh and, in D&G what was with all the half convo's. Really, are they married, engaged, or what? So much unanswered for me 
1	you are strange with your love for TLJ!  hehe
1	haha well, then you got a solid 8 hours, so thats good, right? 
0	baldwin hills! - the weather did really suck today! my umbrella actually broke.
0	I'm so jealous right now! I want to go to London too! T_T why didn't you take me with you?
0	But i doubt it was in the same place as you cause the food was not nearly half as awesome
1	its cuz you got to see me, im sure 
1	Same here, thank God!  
0	Alright, well...I'm worried about you. 
0	good good sam-u-SMELL! ahhaa my resits on wedneday!  to imprve on myE! not going to happen
1	We might do better if we were drunk lmao
0	can i have some???
1	Silenced by truth. (if that doesn't make sense, i mean - i have no reply because you're right!) 
0	I'd like to know
1	i'm bored... Gonna go to a new shopping mall today
1	for sure Bleach is awesome! can't wait to see more of Soi Fon's battle
1	not sure, I think I may have seen your name in my phone. Bump app ftw haha. Lets roll to bfd 
1	sorry, the Twitter spell-checks fault 
0	I told you! Come to the library
1	Oh thank you
1	Hi!^^ no, I didn't see Last friend! if it's good, I'll absolutely see it!  I've seen hana yori dango!! I love it <3
0	Youre sucha bum bum! But who am I to talk really? I pretty much, sleep (maybe not as much as you) & live off my 'rents too! 
1	tessss! did u get my text earlier? got my archupolo na!  eeeep haha adik tlg no?! XD
1	yipee!!! can't wait to see you and kricket  please text me the details of your trip so that we could plan ahead. i have news!!
1	are now authors on http://karachiites.wordpress.com/ WOOOOT   looking forward to blogging with u guys
0	i refuse to sit down - no one gave me any passwords  .. and i don't wink ;)
1	Email  that's worked. Even sms doesn't apply sometimes :p
0	stink! 20% - major fail
0	how cld u get me onto tt site? why u know i hav a prob and he has my dream job bloggin abt HIM  so sad rite now!
0	hey hey hey! How goes it?! Me = Exhaussssted!!  Got cookies and milk?! *Eh, even a massage will do*
0	Well, thanks to  & NOTHING in my house will do now. Mouth is watering over $2k bottle of single malt 
1	sounds like the perfect evening
1	good night
1	don't know if I need the SMS API now that Twitter and Vodafone play so nicely togetherâ€”after all, that's what I was hoping for 
1	Hey there! Yum...sangria! And snorkeling sounds amazing. Glad you're having fun!
1	good morningggggg for you  ? http://blip.fm/~6sz3v
1	Cute.  I remember my first bobbycar... I was PUMPED.
0	   where are  you now....
1	  Haha!  OKay!  U can come back!  lol
0	  sniff sniff you are being mean...sniff sniff
0	they aint caught you, did you finally manage to actually be outside for five secs before being mobbed 
0	no just a very long journey home!  2 mins and I am there! X
1	great   cu  later     bring a smile
0	I was going to go this year but my mates pulled out so I did
1	thats cuz u didnt come to MY bell
1	Tis me SharonP...
0	lol hi emmy, latin would help me study for the aptitude tests to get into grad school ;\ thats why i wanna take it 
0	lol I will blah but I dnt wanna clean
1	I never really watched Gilmore Girls, that's why I never thought of it when writing GG for Gossip Girl. Haha 
0	 heyyyyyyyyyyyy my feeling are hurt..what about us??? you not here for us any more?
0	don't know if I get lunch or not   Stupid clients
0	No real job prospects in SA, so I followed my brother & his wife to London - miss my family, animals and my car though! 
0	Oooooh!  Papa John's sounds wicked!  I miss having one near by!
0	But not as an upgrade presumably? so it'll be a new contract and an end to my loyalty discount.
0	gets nothing is a disgrace! And no more bolt ons either? At the end of this contract bye bye O2 and bye bye iPhone. Such a shame
0	good... but it would have been through the roof if the upgrade package was better
0	Guys, loving my iPhone but have to say the O2 store in Aylesbury was ill-prepared this morning and service very shabby - shame! 
0	I'm still waiting   Will I get a text when it's done?
1	is it true we can't add the unlimited bolt one any more? I want to get 3gs but 500 sms isn't realistic for me?! Advise please
1	what about O2 Surprises for O2 Broadband customers? That'd be nifty
0	Where is my MMS  I am still receiving those messages from you when I get an MMS instead of just the picture...can't send any either
0	Why cant us iPhone users get better deals than the ones we have currently. Â£35/mo for 500&600? O2 Simplicity is unlimited and 800
0	I just clicked that link and you aren't broadcasting!!
1	I'm loving the new default..
1	..barely getting mad, im so glad i found u..  i love that song
0	It's hardly a nap XD When I wake up I have school, I'm dreading it. 
1	the feeling is mutual
0	awwwwwwwwwwww  poor thing! u were alone?
0	Asks good morning sunshine...sounds like had a rough nite...i sorry  u at marina 2day?
1	 it well made me laugh
0	there two other awful ingredients in that too. I hate them.. hate them more after 4 of them...
1	good idea  im waiting at the dr. office.. if u wanna talk tho im a tweet away!
0	I was shocked, too 
1	ummm, I dont remember. If I find out Ill text it to you. 
0	Where are you? I went live at work lmao. I didn't get a missed call from you
1	JIZZED IN MY PANTS
0	i love denver max!  keep two be like "one kitten needs a friend, come on!" and explain how i have two dogs instead of one
0	hopefully i'll feel better by tomorrow  i might have strep
0	i have no idea, i lost it somewhere  And that was really effing weird haha, thank you
0	I don't watch Grey's Anatomy and I haven't seen any of them hooking up with each other- most are already married
0	lonely I guess  too much school
1	thanks for following  nice to meet you.,
0	Continually - two or 3 times a week - very annoying
1	Tell your sister I said hey!
1	why limit your story to 140 ch. Tell all what is annoying you at www.iamsoannoyed.com ,it will help relieve your stress 
0	I was dead ass sleepin all night
0	Okay I officially hate ur JOB! Stole my BFF from me
0	 as my biz takes off and I get more clients, I make more money, but more time away from kids 
0	 naw....you don't  hubs was in Guam.....not really much going on there
1	really??? I love you, have I mentioned that?  I'm in the process of self publishing one, waiting for the proooof!
0	Sometimes here with being right on the lake the humidity goes away after it rains (cools it right down). Not today.
1	I love your Tweets! They make me laugh and smile
0	yea and thanks to procastination, i had like 300 pages to read this weekend... 
0	lol compaq/HP . Its only at 34%  . wait i think it might have just sped upnkk lemme go check
0	wai~ busy ba kasi sa work?
1	I been well.. I been in LA for a year and a half now..I'm graduating the end of this month  yayy! I can't wait
0	I'm gonna get a Blackberry. Turns out, iPhones don't even work well in Barbados 
0	Ah what a shame, I already sold "There's a subprime crisis ... in my pants" to 
0	i have lost all the charms of being on the beach... the dirty beach we have here
1	Okie!  You getting this? WE all want a REAL birthday treat!!!
1	seeing through his site makes me think he is actually a biased journalist
1	I'll see how many packs I can lay my hands on
1	 I saw the link you had on whether Tweets had copyright protection...I was curious about that...nice link
1	Tom Hanks and Greenday are on Conan tonight.
1	orchestra! My sisters poem was set to an orchestral work so I went to watch
1	hehe well let me know what your having! we can share our breakfast via twitter
1	Yes, absolutely! 
0	I was sitting at work, today it is 80 here and I am on the phone taking care of school funding, sucks being poor. I need cash 
1	i'm gonna miss you!
0	not at this hour you don't!!!
1	nope that is the name of the CD...sorry if I am answering someone's question, you were just my latest update 
0	yup, I guess that'll do it. 
0	we are in PHX now. I guess we missed you.
1	Duder, I loves ya but I'm sick =\ Hope you're having a good time with the old timers 
1	How time flies when you're having fun. I've lived in London almost 17 years & you moved there before me! That's a life sentence
1	getting ready to head out soooon!  #hypercube #drunksaturday
1	You're behind the times bb. We're on Dreamwidth now.
0	I'm sorry to hear that. My condolences to you and your family.
1	Definitely. Thanks.
0	thats what i saw
1	Nope just soon enough
1	Probably because domain name tu.com is not available.
1	8th of May 2009 vids: www.bit.ly/YfMnW & www.bit.ly/JlMHs Enjoy the vids
0	the impression is badass. ill get you a link. and OMFGOMFGOMFG
0	Work.   I work Thursday, Friday, and Saturday nights, from 10 PM to 8:30 AM!...why are YOU awake? :p
1	Hi, I got your twitter id from . Would it be possible to chat with you about thsrs? Very interested in the code. 
0	im fallin asleep... this is the only thing keeping me from sleeping
1	 It;s a shame Sandie but ,Such is life. Gotta go, Night 
1	 Nice to have some time to yourself, Can you get a noisy typewriter,so it keeps em awake lol 
1	 Ok Sandie. You are not going through their drawers OMG. Sandie lol
1	 Your not half bad so we will call you 22 then ok lol
