0	The rain as made evident another chore to be done:caulking the cleats on the Florida room.
1	The Rain Gods have finally decided to relieve us.   Its nice to feel the rain AGAIN!!
0	The rain has actually been comforting lately... But there's no stars tonight
0	The rain has arrived
0	The rain has begun to fall at the comcast center just in time for no doubt to begin their set.
1	The rain has cleared and the sun is out - just in time for Folkestone Open Studios
0	The rain has finally come to the lakes
0	The rain has gone away outside...but now there's rain inside   OMG today is already crazy!
0	The rain has stopped here in phoenix.  it was nice while it lasted. It sure cooled things down  JAVI
0	The rain in Spain would appear to be mainly falling in Torrevieja
0	the rain is a party pooper
0	The rain is affecting my tv reception...I swear all technonlgy in my house is like screwing itself
1	the rain is awesome
0	The rain is back and i can't stop coughing.. sigh
0	the rain is blowing me just want to cuddle
0	The rain is coming on Wednesday
1	The rain is fleeing from us tomorrow.  (you are very welcome ha ha
0	The rain is good for my garden, but it also means my sister will chicken out of joining me at the big farmers market 
0	the rain is makin me feel blue
0	The rain is making me sad
0	The rain is not helping me at all.
0	The Rain is on the way!!! looks like a damp evening  Green spots on the Radar...
0	The rain is putting a damper on my preparation for the big yard sale!
0	The rain is really loud and it really doesn't help my head aches  I hate being ill. I can't do anything.
0	The rain is so depressing today
0	The rain is starting
0	The rain is stopping.
1	the rain isn't stopping! good thing am all geared up  for those who don't, well, sorry, next rain perhaps 
0	The rain just broke my phone a little
1	The rain just stopped - It will probably start again soon, hehe 
0	The rain makes drivng to the office on a saturday even more dreary
0	the rain needs to die in a fire
0	The rain right now reminds me that school time is indeed fast approaching... and i don't even have my sched yet
1	the rain smells nice tonight
0	The rain soaked my antique lace collar and cuffs and then they disintegrated into nothingness.
0	The rain sounds nice outside. I'm excites for the next three days. But I feel sick
1	The rain sounds so sweet tonight.
0	The rain today makes me miss the sunshine of Lawrence.  #fb
0	the rain........ oh the rain
0	The Raspberry Ripple ice cream has run out of Raspberry Ripples
1	The ratings for The Game keep going up every week. Great job guys
0	The ratio of strippers to humans could be better.  Like above 5%.
1	The real ? Why would jim low follow you?  probally for the respect of how you handle your rig!
1	The real E3 begins anew today.
1	The real estate market in Tulare county is so awesome right now!  Lots of buyer's & not enough seller's...that is my problem right now!
0	The REAL google killer drives a street view car  http://bit.ly/SFTny (via
1	The Real Housewives of Twitter  http://bit.ly/mFdk7 and they're lonely! get em tiger
0	The real life "Shifty" Powers from Band of Brothers died last week.  http://tr.im/pJ1k
0	The real question is whether you should let anyone follow you or not.  Plenty of spammy crap out there
1	The real Sarah Beeny is now on Twitter  Check her profile and say hello here >
0	the reason i left you tonight was that i thought you left me first all alone. even carlos took off.
1	the reason I say record stores is cause it supports local business. Nothing against iTunes or Zune or other mp3 places. They still cool!
1	The reason i smile  is still sleep!
0	The reason that I'm ill. Guanabana & Fruit Nuggets. More the Guanabana though.  http://tinyurl.com/qg2fxf
0	The reason why I can't find the latest Arena magazine is because it has folded due to the recession. Grrrrr. GQ/FHM survive? No justice.
1	The reason you don't give a 3 year old chocolate!!! Jake my nephew  http://yfrog.com/03wbsj
1	The recital was soo much fun! And then we went to Friendly's  fun times! Can't Wait for dance pictures tomorrow!
0	The red caboose is closed!!!  They used to give me a sucker when i would take the check to the counter
0	The red Christian Louboutins on my feet are gorgeous, but sadly waaay out of my price range 
0	The red light on my BB keeps flashing like I have a message and its sad when I look and I don't.
1	the Red Sox rocked it today!
1	The Red Wings won, I'm going home tomorrow, and I'm getting a shipment of clothes this coming week. Life is good. 
0	The red-line (DC Metro) subway/train cars that crashed--sounds like it was at or around my old stop #TakomaPark
0	The Reds didn't win and Votto came out of the game again.   Feel better Joey. We'll get 'em next time. Go Reds!!!
0	The redsox lost today  sad moment
0	the ref's such at this game st8 up.. Oh well Heat lost
1	The regis girl was very chatty and kept saying cool and cute kinda got on my nerves but she did a good job on my bangs
1	The replacement transfer cable for my mp3 player came today. Uploading boyband music like crazy. Take that haters! LOL  #fb
1	The resoldered Benz lives! That's $890 I get to spend on something else... like a younger Benz
0	The rest of Bree's tournament has been cancelled.. So, no games tomorrow either.. Sucks not to be home now and I have a nasty cold 
0	The rest of Bucket List was soooo great...think I might jus have to cry myself to sleep now
1	The rest of the events team will be practicing their twitter skills for the next two weeks, so be kind 
0	The restraunt I wanted to go to is closed. boo
1	The results of my own quiz: I'm one part Herb, One Part Les Five Parts Johnny Fever... and two part Venus from the waist down. 
0	The results video is uploading. Please try not to leave any horrible comments.
0	the retainer is still in tact (except for the part that is sticking out & poking my tongue).....
0	the retr bar quiz is hilarious. done it twice and come last both times  the guy from behind the bar gave me his number!
0	The reviewers' comments are reasonable, not too negative. There were many submissions apparently. 
0	the ride to see houses yesterday was beautiful but i got a migraine probly cuz i didnt have my sunglasses
0	the riff from 'Day Tripper' is pretty tough to crack!
0	the right click on my mouse is borked
1	the right song to start a day  Cypress Hill � Hits from the bong  ? http://blip.fm/~4oj9k
1	The ringing in my ears is almost gone  I want to go back to last night and live it forever!
1	The river was fun!!!
1	The river was so fun.. Mandy and Jen, do yall still love me for poured very cold water on you? 
0	The river was so much fun... sad the weekend is almost over
1	The Ro and Co Show haha.
0	The road to darkness always has a way of known my name!- pink nobodys knows! <3
1	The roads just got about 3% less safe
1	The roadtrip turned out to be totally diffrent. Yesterday we camped and today we are sleeping in a President svit  going to sleep now!
0	the roaming charges from my european iPhone are enormous so I just switched the whole phone off...
1	The rock band Seether covered WHAMs song careless whisper? Big wtf!cant sleep. Wired.smoothie and almond milkhope hot mate helps w. That.
0	The role of a house wife sucks...  Unappreciated and undesirable
0	The roller coaster is back and it's going down at the moment
0	the romance goes right out of a thing with the 1st truck that sprays you as it passes
0	the roof is off limits because of construction...
1	The roof, the roof is on fire! Well...we have a barbeque and some fruit salads on our roof - awesome if you just have awoken 
1	the rooftop film festival, jive classes, a wedding and more...its been one long weekend 
0	The room is too cold...my toes turn blue
1	the room just got a visit frm Hannah Hardy today. N shes so sweet to leave a bag of snacks. Hannah makes life worth living for sometimes
0	The room looks so bare
1	The roomate moved out, cleaning the house, and now it back to being just the 3 of us. YAY 
1	the roomi-ate is sleeping lk a pigay!!
0	the roots of poison ivy must grow all the way to hell to cause this much swelling and itching
0	the Royals horrible play over recent weeks has had a profoundly negative effect on my summer fun index
1	The Royals won? The Royals won! Party time!
0	The rubber in my iphone earbuds is gone and the buds don't fit as tightly anymore
0	The run is done. The shower is done. Crap. That all means its time to head to work.
0	The rush for 3.x has been a /little/ more than I anticipated. ;P. http://tinyurl.com/3xcybw Please, have patience with site malfunctions. 
1	The Ryman Group job is done... Time to start on the text sections for Lattitude Magazine.
0	The sad thing about my #fatfriday lunch is that i ended up eating 2 toasts with chesse at 4:00 
1	The sad thing is I've been nude this entire time while I've been chatting this morning. I need to at least put on pantiessssss
0	The sad thing is that this was what I was supposed to finish last night - I'm playing catch-up.
0	The saddest cow   http://twitpic.com/856ps
0	The saddest sight I ever did see  http://twitpic.com/7hb2c
0	The same feeling as seeing a sweaty tank top uncle with hairy armpit
1	the same here, so excited to go to gocek we will have an amazing holiday but just a bit drinking 
0	the same way i cringed at my poor little toe...poor toe
0	the saturdays  t-shirt soaking in water which is annoying  coz that means cant have a bath yet  but at least get to enjoy day with fam x x
1	the scale is no longer the enemy  YAY!!! lol
0	the scale still hasnt moved  I soooooooo not happy about that!!!!  I'll have measure my leg, see if any inches are gone.
0	The scary sub is here again!
0	the scenes between daniel and little charlotte on lost are so sad.
0	The school just got locked down. But it wasn't cos of Swine Flu
0	The school system sets out to traumatize me a little more each year. I don't want to see people on fire, thank you very much. Panic - me 
0	The school year flew. I'm starting to get sad about saying goodbye to a lot of them.
0	the scientist song made me cry
1	The score is 3 to 2 im winning again!
0	the screen from my phone doesn't want to turn on
0	The screen on my iphone broke...
1	The script - I'm Yours; Listen to the guitar, it is soooo nice! I want to learn that, and I'm going to learn that! 
1	the script are madd
1	The SEACOM intro website is pretty cool   only 48days away.
0	The search is on
0	The season has found a end for the Cavaliers
0	the season is over  Good luck to the Magic in The Finals
1	The seats in this theater are so comfy and you can actually stretch your feet out in this jawn
0	The second Bendis/Maleev omnibus is coming in September, but no Daredevil 501?  http://bit.ly/BvZeV
0	The Second Chance is always the best. But no one will accept the second asking because of other peoples reactions.
1	The second day is always better than the first!
1	The second draft of chapter 24 has been resent to the betas.  Please continue to be patient as I wait for approval!
0	The second in my sporadic series of (genuine) bad spam email headings: "open it or get constipation" - Is that a threat!?
1	The second sentence of my last tweet was a joke  You're not horrible, honest!
0	the secret life was so good..but a sad ending  going to bed, spanish regents in the morning ughh
1	The secret of a friend should be kept as one's own secret; the fault of a friend one should hide as one's own fault. - Khan  Good morning!
1	the secret to a sexy sticky Souffl�...after the break!
1	The SEDS India elections had low turnout bcos of exams. Ballot extended till May 25. It happens only in student organisations.
0	The seemingly funny outtakes of Judy Garland's variety show are actually one of the most depressing things I've ever seen.
0	The seminar is in Zhong Wen again
1	The seniors came from prom and crashed our first period Sociology. Epic win
0	The septic tank is backed up at our building.  Now our office smells like poo gas
0	The serial number on my Acer Aspire One completely wore off, so now I'm not so sure I can get it fixed under the warranty. 
0	the server is kicking me out
1	The sesion went well.. But boring.. Listening to tokio hotel now..
1	The set list dress u up n my luv
1	the shake up by WO!TG is gonna be my pump up song for sunday
0	The shameful truth....my before pic I just found  http://twitgoo.com/tjrc
0	the sharp pains in my stomach.....put me in a coma please
0	The Shaun is getting old because he thought he knew what "getting it in" but just realize he doesn't.
0	The Shell gas station gave my car an STD !
0	The Sherwood Hotel Taipei ask me to change my dinner reservation b/c a corp. wants to book the whole place that nite, should I give in?  
0	The shirts are for kids only
0	The shit just hit the fan and landed on me......
0	The shitty part about riding the train is no radio...I feel naked   on my ipod oooohhh just shuffled over to Hayden.
1	the shoot is finished and it's a little sad but I'm really enjoying my day off
1	the shoot was so much fun!! some of the picz turn out great  watched the last OTH episode. i really liked it! LOVED IT<3
1	The shoot went great!!!   I need food!!!
1	The short at the begining of up was too cute.
0	The short haired coyote has eluded me once again
0	The Show - Lenka. Not to be shallow but her front teeth disturbs me.
0	The Show is Over  But Auditiong for Army Wives today, TSA Video shoot next two days and Another Audition for Equus on Sunday!!
1	The show is over, and im shutting twitter down for now. Bye. 
1	THE SHOW IS ROCKING! reports that has her "uterus twitching"!  That's my boy
0	The show is so boring
1	The show is this Thursday people! FREE showcase! Bring your arse! And the arses of your friends if possible.  http://bit.ly/1IENl5
0	The show last night - amazing! Now, on my way to work 
0	The Show Of Shows might be Show Of Rain tonight.   http://bit.ly/adRxE  http://bit.ly/10Rf6K
1	The show rad!! Thx all who came
1	the show was amazing i can't wait to see them again <33 / Metro station! J-8
0	The show was great last night bit stressful tho! actually a bit sad it's over tbh
1	the show was KILLER last night. Im so proud of my fellow Sky Recordz Artists- Roc and Fully. Im takin a break from working in the studio
0	The show was pretty awesome.  My camera ran out of batteries right as WPF started though
0	The show went amazing! All the bands did incredible. Can't believe its over
0	the show will definitely never be the same
1	The show wit Supreme Soul was fun, we smaaacked it down 
1	The showed people entering Citi before, and I saw a guy in a Murphy jersey. It made me so happy  The guy with him wore a Pelf jersey 
0	The shower broke. I'd JUST covered myself in soap when it decided it didn't want to work anymore. A sponge a sink of cold water
0	The shuttle bus is late for almost one hour, many of us waited for it like a bird in the heavy shower 
0	The shuttle launch most likely won't happen.
0	the siblings are officially ignoring me today
1	The sick thing is - I'm gonna do it again today
0	The side effects of exercise and allergies combined feel a lot like the flu.  but I know it's not.
0	The side of my neck hurts, wtf? oh and in case anyone cared. Ive now failed 3 outta 6 exams. 
1	'The sign of happiness in your smile brings out the best in you' -Me
1	The signing was smashing, and then we all went out for a drink/food afterwards and everyone was totally lovely. 
1	the silent house; music to my ears  just being tonight
0	The Silva fight was not what I expected. Over all UFC 97 a let down
1	The simpsons, then off to bed methinks. Night tweet peeps  xx
0	the sims 2 > the sims 3, tbh 
0	the sims 3 é on-line q lixo
0	The Sims 3 ain't that good you know. I hate the animation graphic, it's too cartoon for me. The Sims 1 and 2 are still the best. 
0	THE SIMS 3 BUGGED!!!;@?#$%^&* i hadn't saved my game. alskdjklsdf!
1	The Sims 3 is addictive    http://tinyurl.com/d92olLcFMH
0	The Sims 3 is out, you'll never know how terribly excited that makes me.  I'ts sad 
0	The Sims 3 is so much more complicated than I thought it would be. I already miss The Sims 2.
1	The Sims 3 looks good
1	The Sims 3 Lot : Have you downloaded the Sims 3 Website.com office lot yet?  http://is.gd/Rthw
0	the Sims 3 needs to be for ps3.
0	The Sims 3 runs slowly  I guess it's because I have played it allot today :|
0	The Sims 3: I want it so bad.
0	The Sims 3: Order Details - Status: Waiting on stock.(PreOrders)
0	the sims makes me so anti-social!
0	The Sims3 likes to crash a lot & not due to graphic card errors. In other news today's pain is a 20. Vicodin 1/2 day.
0	The singer at the restaurant singing "untitled". Please stop
1	The singer for greenday is smokin as well.
0	the sink hole on my block has re-routed my bus making it even less predictable.
0	The sinus infection I thought I got rid of two weeks ago has returned and my throat is on fire... Not good
1	The sirens r super annoying. I hope it rains 2morrow 2
0	The sis is doing my eyebrows... the nazi has come out to play.
1	The site is set up!! So, start posting!! 
0	The site isn't working for me..  Hard to vote when the site doesn't reload!
0	the situation is so acidic that the world's supply of alkali doesn't neutralise it.
0	The situation remains unresolved, however 
0	the sixth sheik's sheep is sick, just like me 
0	the sj digital library lied to me
0	The skin on my hand is dry! It's not meant to be dry! It's red & flaky
0	The sky has turned ominously grey outside the window, ALOT of rain is coming 
0	the sky is all white and it really hurts to look at it
0	The Sky is Blue, The Sea is calm!,   The Sun is beating down on the Beach! Must be my Weekend to work!!!!!!!!!!   
0	The sky is broken ! It's all gone grey
0	the sky is falling i think ..
0	The sky is gray here in Newport Beach. I feel like I'm in SF
0	The sky plus box crashed yesterday I have no idea what I am going to do today my TV is gone  no 24 tonight and all my saved stuff is gone!
1	The sleep over was great!!!
1	The sleeping pills are starting to kick in  stopped crying too.
0	The slideshow was so sad
0	The slow connection starts again.. Its always at this hour
1	The smell of burgers always makes me hungry
0	The smell of coffee makes me feel so very ill, but it's not exactly an item you can ask other people to avoid for you 
0	the smell of pot and smoke sucks when in concert. my lungs hurt
0	The smell of this hair mask is putting me right off my redbull
0	the smellyvision is broken  I WANTED TO WATCH KIDS SHOWS!
0	The snack machine at work refuses to take any quarters. It happily takes nickels and dimes and dollars, but it hates quarters. 
0	the SNL with Justin Timberlake was much better than this one
1	The snooze button whipped me today! If only I had a pop-tart to get my day started
1	The snorks are on the tv here at the airport. fuck Yesss. flight 774... thats a good number.
0	the snot monster has invaded!  a sick toddler = a fussy toddler who isn't sleeping well
1	The soaker hose has been spoken for.
0	The SoCoLoCos are leaving edmonton  no sightings of but it was an UGMAZING day anyways!!
1	the softest thing in the universe overcomes the hardest. every. single. time. i will post a new video when the time is right
1	the sold out Stone Soul festival on Saturday, June 6th! 
1	The sole purpose of this update is to annoy Goodnight
1	The Somalis are so giving. They apparently hijack ships and then email millions of people saying $20 milion dollars is waiting for them!
0	the son of my caf have a brutal dead today in the morning
0	The song Admiral and Commander from the 3rd season soundtrack of BSG is wicked sad, but so awesome...I miss that show 
0	The song called Hurt makes me sad...
0	The song is on Mamma Mia that usually makes me cry when i hear it
0	The song statistics does not help in the studying of the subject.
0	the song what if by ashley tisdale explains how I feel with my love life right now  <3
0	the songs of let me as well!
1	The sooner we get to relax for a little while!
1	The soreness from Jillian's workout last night is starting to settle in
0	The soreness has come  My jog was delayed...but I plan on going soon lol
0	the sort of nervous that makes you need a poo
0	The sound of kitty indigestion is scary. It sounds like puking up roosters or something. Yes I have a sick kitteh.
0	The sound of the violinists playing their violings until they plummet into eternal darkness in titanic is making me really sad
0	The sound on my bberry has gone idk what to do
0	The sound on the computer is not working.
1	The Sounds . . . .what a band to wake up to. I actually work today! Yessss
1	The sounds of bugs slamming into the window makes me feel a sense of superiority  #swagbucks
1	The soundtrack to the summer has arrived... Cicada 'Roulette' is pure uplifting heaven, minus the fromage.  http://bit.ly/q4Ogr
1	i know, also: go to BED. And that's to YOU, Mister.  and to me: django says bye and so does grapelli. pst which bach, quick
1	my tiny panther
1	ya decided to play basketball at steavens. At spirit rock right now walking home
0	Did I miss anything in the pub? I never make it to the pub!
1	i know one in camden
0	u will have to miss ...
1	it's that time of night...
1	that she is
0	It's *very* difficult to do the due diligence of rolling over each name, seeing if they have a bio, checking their page, etc... 
1	because it looks awesome.
0	I remove CS¤ Master Collection because some stuff didn't work. Will reinstall it. Takes time.  Buhu
0	Yes! Ans what sucks even more is that I've done it now and it still doesn't work!!!! Fuckin shit
0	Hey, sorry I didn't get in touch sooner! We didn't go by Bologna. It was out of our way 
1	Hi there.. thx 4 following ^.^ I'm addicted 2 twitter too, not tweet a day makes my finger numb kekekeke 
0	nothing. Upset you're working a double.
0	 sad thing is, i cant imagine life without my iPod.
1	hehe thanks
1	It looks like we first must be psychiatric then bofh
0	that sucks...
0	effectivement...
0	but I've watched tht a long time ago. Oh God. Means I've watched the season finale and spilled it all to you  forget what I said
1	lol...I've thought about doing something like that, but my wife would probably kick my ass for starting a fight 
0	what do u want to do??? i have to study economics
1	Now you're making hungry with all the talk of fried chicken
0	A draw I cant believe it!  Niko to score at Wembley again pls! Cant believe how much we miss him. Sorry to hear about S.Marino
0	totally, my brother its mean with me. 
0	It isn't on until 1:30 here. It's live to the East - tape delay here
0	I feel sorry for myself   haha nah jkjk. hella sleepy tho
1	are you flipping kidding me?!?!! bella looks stoned jacob is REDICULOUS bur i like the jasper edward thing no offence
1	I know! I manually follow back - so all the porn and MLM stuff makes it more difficult
0	I was expecting her to win..  Oh well, she doesn't need to win to prove she is the best. I love her voice!
1	Thanks for the Dark Hunter info all! Awesome! Everyone said in order.
0	That sucks when they're not.  I feel for you. So much for customer service!
0	I miss talking to youuuu  and yikes! Spilling things and computers do not mix well. :/
1	hello Rubin
1	I think your "nipply" and our summer is pretty much the same  As soon as it hits 18 degrees here people are at the beach
0	yikes is right! I hope you dont rely on that coffee bean that got its window smashed. I'm guessing it will be closed tomm
0	 *sniff sob* No I'm doing Latitude this year and Ed next year. I would like updates so I can be jealous.
1	looking good babe
0	, we needed an agreement in principle before they'd put an offer forward, estate-agents can be rubbish 
1	ta  have been trying out almost everyone I know whilst the techie chat goes on #bcleeds09
1	hehehe pada cuti dgn timing yang tepat: di hari kejepit  hehehe (was: Sendirian di Ruangan)
0	I hate facials. Yet, it's probably more important than buying make ups. 
1	hehe  RUBY!! ;)
1	listening to the sneek peeks ive r& over agn.
0	coconut?! That sounds amazingly delicious! Yes I will bring you some. I might be coming to the show alone now
0	awwww  well ok, i guess, i'll take you off the list for dinner
0	I don't know what it is  Maybe you can enlighten me
0	i still need the original disk.....
0	not since the 2nd viewing about two weeks ago. Cool what does #trackle do? It's not trending anymore
0	sorting out my engagement?? i know im sorry ive been kinda busy, i feel like lately i have no time for fun 
1	 you make me smile!!
1	np, i am on a lot, so feel free to say hi  
1	  I'm so tempted to email the cap I made to bobby right now - that's not completely insane is it?
0	Its oddly tempting. But is it a tad limiting career wise?! If I do it I wont be able to start my psychology degree in sept
1	its really not that nice! lol some dodgy people live there! ha my friend is one of them, thats y i was there! 
1	hi ruby, u said u were painting yesterday (i think, lose track of time) what are you painting? can we know the concept/subject? 
0	yeah it will be funny someday. A large pipe broke on the 3rd floor, ran all night & destroyed our offices and equipment on 2&1 
1	happy twitterringgggggggg  xoxox
1	and a good morning to you ruby
0	 ... oh its over, and no action 
1	well, you guys could come down to Houston, and go shark fishing in Galveston with me.  and inspect my wounds...
1	Oh, sure.  After I buy a copy of both...    xoxo Ruby.
1	maybe it stepped out for some tea or snifilis medicine
0	morning to you. I also got home sick from bloggirls.  Just dosed myself and back in bed with a cuppa. How're you feeling?
0	This is very problematic  But what can you do
1	haha yes you did! Awesome... you been in santa cruz all weekend rite? Aww the beach sounds nice! PATT!!
1	haha fair enuf eat an apple
0	haha no worries, ill prob be up early tomorrow anyway-but no cred til next week though  sounds fun! have a good night babe 
