1	You should give it another shot! Tomorrow everyone is going to be streaming & tweeting about S1, ep 2. Join in if you can! 
1	i'm pretty cool like that. Great minds think alike.  nice to know i'm not the only one suffering in "silence"..
1	night doll
1	are u fan of blink 182? me too
0	haha... I have to wait so LONGEEEEER coz' now im not living in England T_T
1	there is a fix. You may have to hook up to comp to get it.
0	for some reason cant access the knots. No clue why
1	morning hun. i can see ur not in such a good mood. hope u feel better
0	oh okay what's wrong
1	yup  so now ima njoy my beautiful day off !
1	the hangover is a good film aha i can quote..i'm busy next weekend the jonas brothers are coming to town.Rehtard u mean retard.
1	Hi jay looking forward to your hearing your sound
1	oh so you said you good-byes and hugs  my dad left around 4 in the morning so I woke up to an empty house i'm pretty scared.
1	ugh - this is what gives OOH a bad name (maybe will keep him too busy to vandalize our kiosks in NY?
0	Awww I love those... the sweet corn tamale cakes r better tho my #weakness
0	Awwww Blindy  U nearsighted or farsighted?
0	awww, baby, I miss you too. 
1	enjoy your day off
1	its PayDay! Go to bed!
0	wow.. i once saw an Albino deer in Denmark.. Unfortunately the next day in the newspapers they took it down  Evil i tell u
1	- WOW!!!    I still dig pulling out my parents' 8-track player from time to time.
0	What happened to Live free or die? I guess they chose death...
1	Get 100 followers a day using www.tweeteradder.com Once you add everyone you are on the train or pay vip
1	I sincerely hope it is for you! Been wanting to do it for a good long time.
0	they sure did.  essshhhh that was ugly
1	Hey hun, still awake? I'm having a nice and quiet day today 
1	its an 'or' question i asked  . i very well know people will put the 'and', but the question asks an 'or' .
1	about the blakets after traumatic experiences. Common sense screams out "comfort"and "security blanket"  lol just teasing
0	nay, there is a huge one, with about 3 show times for each hour, like 710, 720, 730, for the big ones, but not hangover 
0	o rly? whose ur friend? just june.lol cant believe u dont trust me
1	We call that part of the world Australia
1	Jay!!! Been infected by the Twittermania? Awesome!
1	i'm with ya girl - there's no way i'm studying
1	ya but it's a sports blog so you might not like it, 
0	awww like even DURING the day? -hugggggles- I'll try not leave you!!
0	i know. WHY would somebody use my identity for a NEW PHONE?! I mean... I have other id but nothing "officially" recognised
1	thanks  enjoy your day. lol
0	why? are the storms going to stop
1	i doubt it. hes private. frankly, i realllllly dont care 
1	Oh no! I've been found out! I saw you put Browncoat in your profile and re-followed. It's reflex.  Thanks for lurking (for now!)
1	thank you very much  I really hope you can do it.  You have to show me pics then okay? ^__^
1	i'm glad you went too. i think you'd been very remiss if you had missed her wedding
0	u still aint come u abandoned me  http://myloc.me/3Zhv
0	 http://bit.ly/3oLpY but is a for pay, no trial version, sorry.   UT is my preference anyway. 
0	I wish you were my neighbor right now.
1	 Hey thats good, my Daughter's still asleep and Son is drawing, better feed him v soon 
1	good morning, hows you this fine morning,  
1	heh, sounds like a classic Sunday lunch to me. Very easy to overindulge. But so nice. 
1	Hey Jay-hope the training going GREAT&you had as nice weather as we did here on w/end!Have a fabulous Monday
1	Hey..good morning!
0	Hi, not bad thanks. Spent last two days in London so today is "catch up" time which unfortunately involves paying invoices! 
1	I'm gonna see if I can find it for my blackberry
0	it's raining? not where I am which is good cos I wanna sit outside for lunch & read my book! Today's been manic  need massage!
1	It's totally fab!!!
0	Just tried to add a picture but it isn't working
1	Morning! Have a good day!
1	niiiiice man  have u heard their latest ? http://bit.ly/bjqmO
0	no worries just cant blip u more then 3 times  defo top tunes though !!
0	nope just started like unfollowing ppl every few minutes
0	Oh thats great
1	Sounds good..we need to make the most of this stunninjg weather!  No i had people round - we sat outside drinkin till 3!
0	Aww bb, don't be sad  Eat your FroYo and celebrate that you're on #2. <3
0	I so agree!!!! Ulah!!
0	please visit myrtle beach...   you could be my perfect man. forever and ever!!!
1	23 episodes of what?
0	Sorry for complaining.  I have just been burned too many times!
1	lol...I just posted another one of him as well walking back from the gym. Glad you like it!!
1	now you have ME following YOU!!
1	merry christmas, pappy. now you look even MORE like a gpa...BALD and all 
1	//~~Yes at 11:00 p.m. and now I can't keep my eyes opened.
1	ahh yey! It looks so good
0	greeeeeeat. it took me a long time to think of those
1	  your conversation amuses me. i followed every word..   loved the book.. can the movie live up to it?
0	Guessing you've noticed the - erm - downturn of S/boro... Not good is it??? Neal still doesn't love me, by the way 
0	srry im late but damn! Srry to hear about ur homies house gettn brokn into!  hope that works out tho!
0	22 degrees in Ayr. It's Drogba and co in standard def for me
1	so......"they sayin that i walk like a hustla....talk like a boss b!tch ...and i only puff the best DRO!" - get it BIIIIITCH
0	Its so addicting, but its kind of a curse to do them at night time. Everytime i do one, i feel like making music afterwards 
1	JUST HACKED TWITTER!  <3
0	I do want to go for Peaches... but also Miss Kittin, pendulum, chase&status and the bloody beetroots! its not fair 
1	fashofasho  will be at kimbois cause he's not there .  Gooo! Haha!
0	 should code a right hand...
1	Checking it out now.  Again, thank you. Truly appreciated. 
1	Morning lovely Jayda.Thanks 4 the kisses
1	n that's what makes this fun!
0	morning??? LOL hey twin I missed u yesterday
0	LOL you are tempting me to the states quicker but alas no package
1	 Good Night  Im so tired too,college is driving me crazy :S
1	Aww. .u & Brody make a cute couple
0	Can u please tell me what u think about my pics i wanna be a model too...but i dont have the right agency  lol
1	chicken fried by zac brown
1	follow meeeeeeeee!
1	Freezing our butts off in Toronto.  Its sooo cold.  LOVE U JAYDE
1	haha I'll be sure to tell them! your doing a great job on the hills def keeping the ratings up  can't wait to meet u! xx
0	hahahaha hero! i LOVE nutella  & i wish i could have pinkberry but sadly there is none in ottawa or in canada
1	have a wonderful weekend  follow me ;)
0	house work
0	http://twitpic.com/55209 -  We need to save those sweet lil fuzzy dudes
1	http://twitpic.com/69yjb - Very Cute.
1	http://twitpic.com/6d927 - it's so so so pretty
1	I think I wrote a million msgs to you already hahaha pick me    here in Canada it's 104 am not really a Friday no more LOL
1	I think you should choose to follow me friday! i'm a positive, energetic, young woman from CANADA!! canadian girls kick ass 
0	I would love to go Opera but Im so far from there lol
0	I'm happy to hear that you'll be following me! But I never received email from the twitter team conforming it!  howcome?
0	Is it just the season finale or is the hills over ??  please get back to me
0	It's raining in miami 2
1	Just wanted to say that you are an icon of mine and you are really inspiring to me. I am proud to say you are Canadian  xo
1	ok u're probably annoyed by now, dont be! ;) okay hope to see you following me for real, (why does it matter to me?) xox 
0	omg you follow a new fan  pick me please doll I'm a huge fan and I'm canadian ;)
1	ur super pretty. brody picked a good one!!  follow me!!
0	getting up early sucks dudette. I'm up in the middle of the fOOking night to go to work. Never get used to it I'm afraid
1	 Hey, I have family in the Denver area and Arizona too! 
0	then it would be hard to throw them away
0	-  more talking in 1st weekend than last yr total.   Some people unable to shut up (yes, Anarchist Wife pl I'm talking to you)
1	http://twitpic.com/5ow08 - hahaha your cat is radcore aye lol
1	I like the sound of this  step one: finding money. haha but shopping, YAY!
1	LOL no. but it's funny 'cause her mum is joining us. shall be funeth!
0	no i'm not, sorry. have extension english late class and then a drama assessment to complete. 
0	she wont be at the beach, she'll be IN the beach haha, but nawww what a cute date DD i want dates like that 
0	Sorry... I didn't realize you were in the shower when I walked in.
0	we have the exact opposite here in SA... winter's on it's way  Enjoyt the sunshine.
1	 Great news! congrats on Starbucks! Let me know if they are gonna hire anytime soon? could REALLY use a job right now.
1	haha he's no but he can flip my buger anytime
0	Me never...I'll walk back to my time out corner and continue to eat Elmer's glue and rub it in my hands just to peel it off
1	Peace, folks prefer clean versions of music for the radio show, but accept whatever for the BlackRadioIsBack.com - thanks! 
1	frozen shit all the way dude
1	 ... Was well suprised ... I was like what have I done!!? :s
1	Great! haven't had that much fun in awhile. Spent a lot of bread but I had a blast
0	see i really dont know what to do... !!!  an i been at princeton all my life
0	Oh no!   I was spf-d so I'm still pale as ever...
0	yeah.  i miss my 24 1.4 all the time.
0	in this hot sun  running errands wat u up to?
0	LOL you're crazy! This game is uncomfortably tight though
1	ur rhyme wacky wack. Lol take a shot for me
1	hah! yeah, I was like, "wonder what would happen if I applied, and didn't get the job?" 
1	And great to see a team with McL tech partnership also beating McL... Keep up the good work at FI
0	told them they laughed more and made me talk more to take the mick more
1	I have six so far, and one more waiting to be finished 
0	NOT A DARN MOVIE SIR! LOL...U SHOULD JUST MAKE YOUR OWN...ALL OF THESE REMAKES R GETTING OLD..IM TIRED OF RECYCLED FILMS
0	nope i didnt sadly  i'm also having my damn exams urgh :s and it has been already 3 weeks! one more week till freedom!
1	lol yesss fun!!! Lol ima text u rite now ahhh how I love to smile now lol
1	haha...dude it's not about the battery life, but my productivity! wanna stay away from unproductive diversions...I have an xperia 
1	naaah man no wine / pizza. I'm on a vodka / chocolate diet now  . We'll make plans w/ the gang for next week? You down w/ that?
0	No! That really really sucks especially as you were looking forward to a quiet, do-nothing weekend. 
1	..that is a great line.
0	where's my kidrobot?
1	Hope you feel better soon m'dear
0	i hope so. i really need one! we'll see. unfortunately drama always finds me.
1	hi jay  i may sound too out of place but all 3 companies do their show on day 1? i though it would be d1-xbox, d2-ps so on ?
1	you will hit the 100 followers mark soon
0	me too babe
0	call a joint over pop in it if u don't like it then guess wat. . .do something else.  Lol. Nah its good I wanted to cry
0	goiin driivin wiif my cuzz den mayb moviiess.. no mia shoppiin for meee  noo miiaaaa
1	ohhhhh dats right, ur hardcore elvis!!... totally get it then fasho! 
1	I like the word mungling, no idea what it means, but I'd like to use it more in conversations! 
0	Pooh  I was hoping to do some video work today
0	I know isn't that so sad?  I'm an old hag already :/ haha
1	Sherry Zesiger found me on facebook Polly!  I saw she befriended you too!
1	HAHA! I'll take my portion of the blame for trouble in Our Family.
0	went last year. I gotta go to my friend's party tonight though.  I can never win
0	I'm tempted to! but I'm supposed to go to my parents house in Athens today
1	BTW - thanks for liking the hair, I did it a lot better tonight... 
0	Jess is invited just not me  I feel really unloved by u AND Aj right now hahaha!
1	ok I'll be sure to put a plate aside just for you!!
1	Most of the people I follow are comics related but they are interesting even if you don't care about capes!
0	emmm...as long as thy ovr 5ft 5" lol...c i cnt chat cuz im nt tht tall myslf  ...im 5ft (cough)"...im messin...5ft 3/4"
1	the workouts dont tire ur mind out? mayb chess then?  u like soul/neo? let's swap then...always lookn 4 new artists
0	Well she kept riding past me on her bicycle with her nasty thong hanging out of her fat ass. I was literally dry-heaving.
0	thank you now I feel bad
1	uhhh the next time emilio gets paid  hehehe that way we can go to dinner afterwards...
1	I love this twitter account so much.
1	thanks for following
0	Schools always seem to be behind the times, particularly with technology. 
1	congrats on the house. i'm proud
1	Like RockNROll... Or roll???
0	is NOT following me i am overly OVERLY DISTRAUGHT !!!!
1	& i just took that 'who's your future love' quiz on vfc's myspace, & i got you  ahaha.
1	awesome. I see you! ahah JOKES. Im in a different country. lmao... (Toronto,Canada) Have tons of fun!! 
0	awww,you could of asked me to go with you.! i had nothing else to do today.! 
1	awww... its ok.. sarah will make it better
1	can't wait to hear it!
1	Damn When Youre Sleeping You Look Sooooooo  Damn HOT !! Well You Always Do Look Hot  !!... Love You So !! Liva __X
1	decision made. i think jayk should show off his hair  more often
1	I did  and I think you should take more pictures of yourself and your sexified hair ;)
1	im listenin to it now..its rly good!! vfc shud do a song wit her one day
1	it sure is  see ya there!!!!
1	Moving into the new house today?
1	oh and i said you should come to the Dane County Fair in Madison, WI, cause ill be living there so ill be able to see you guys 
1	Oh cool I love Kristina DeBarge!! But I couldn't find the video..... Can you send me the link
0	OH MY GOSH I TOTOLLY LOVE IT IT LOOKS SO AWESOME!! AND CUTE! i wish i could see u and vfc in real life  STILL LOVE THE HAIR THO
1	Well I didn't spell your name wrong ever...cuz I couldn't remember it  is that worse?
0	What's wrong?
0	when are yall going to come to Florida we feel so unloved  you guys haven't come here yet what's up with that ? Still love yea
1	& 's world  what would I do without u guys. if it wasn't for yall this wouldn't be such a MAGICAL world 4 me.
1	but yes i have long hair straight down hahah. n yeah it was a nice shower with kobe bryant.
1	fuck yeah bro! u knowww it  only fucks wid the REALIST! loveee you!
1	use what works
0	you fail  I bet they are sold out again :/
1	thanks for the follow  look forward to living out loud with you
0	 I guess you are not interested !!
1	  Make it a contest if u want
1	getting a bit safe on the last one... not very far off the floor...
1	Lakers lost and I loved it. By the way the butt plug pic is so hot
0	lol that photo doesnt exist anymore
1	me either, its on my to see list though! Oh & so is Shay: Sexual Freak from which looks like another very hot line up! 
1	oh ok, anal can be a bit weird sometimes well it has been for my girlfriend anyway 
1	Warm greetings from the Canary Islands
1	when can i get that personalized iphone wallpaper?  8o
0	wish you could have shared drinks with me tonight hon.     Long Island iced Teas
1	 no worries my man I'm already following you everything happens 4 a reason. Its all good, I'll rebuild list from scratch 
0	dude u didnt even check on us!!! The demons could have got us and u wouldnt even known.....
1	YESSS.. STEP YA TWITTER GAME UP! lol...i forgot all about MYSPACE and FACEBOOK thanx 2 TWITTER lol ummm now FOLLOW me mister
1	 hi, hon  how's the Norweigan?
1	 just did thanks Jay
1	 weekend is good i was hanging out yesterday wit a friend
1	don't 4get 2 train mate
0	I dont have myspace
0	i think its just a news post-i dont think it is her posting anything
1	is this for pleasure or work..whatever the case have fun for both of us
1	morning mate how did #deathandtaxes #musicmonday go
0	Actually...your older than me.  Now I'm Jealous. 1989. Hmm..21..I'l send you a bottle of something. lol.
1	You know its never sunny here actually 'in' the summer holidays right?? It's how us locals like it  heheh. Only joking...
1	 lol to what... again srry! was it to colorize? lol i have to agree then!
1	whats wrong with you TEAM EDWARD  Lol
1	 u always eat dunkin donuts when u come over here lil girl
1	Sounds amusing.
1	oh hey jay im pretty sure im not a lesbian but thanks anyways
0	hey jay! just preparing for graduation  not ready for it! u?
0	so I got out of bed cause I was hungry. Got a bowl out, poured me some captain crunch. No milk in the fridge 
1	I'm good thanks! Nap away
0	In their heads, I guess, nothing much..... 
1	Like bean sprout types sprouts, yeah I'm gonna eat them, just wondered if people had some good recipe ideas 
1	Well, fog is sort of all-encompassing, isn't it? 
0	i checked and the twittermusical.com domain name is already registered  #twittermusical
1	sounds like a good relaxing evening!!
1	- EXACTLY!
0	I agree: accents are who you are and that is good & Eric's is "wicked strong" ..I don't have an accent
0	Good morning gang, here's to another work Monday 
1	i might get one of them... i would love to know what my dreams mean... usually very odd...
1	yeah love the sing alongs... jay, shave ya legs we are all snuggling!  lol
1	4hours at the gym .. hope that's not all spent in the sauna
1	ah nothing wrong with being a perv ..
1	ah, okay getting out of the loop. Actually thought it was something to do with opera ie singing. Bringing it to the public etc 
1	Another! Do another!  I didn't even cheat, lollol. *proud*
1	anyway ... good afternoon
1	Aw well aint u lovely  how u doin today hun?
1	enjoying some chocolate donuts.  its gonna be a great day
1	Good morning cupcake.
1	ha ha ha... Nice to meet you too!
1	ha! no...grandma paid!
0	Hmmm mayb. Iv got more tests on may 5th  jus means more waiting if view dont find anything. Hows u 2day?
0	I cant go to sleep till I know she is asleep...her dementia is getting worse
1	I'm good, just watching tv 
0	Im ok thanks got a bit of a heavy chest atm, i sense a bitch of a cough makin a recce about my person ready to strike anytime 
1	lol figured that would draw you back in
1	lol, I'm too short! 
1	Morning matey! Welcome to Tuesday
0	not really sure. need to deposit and save some money
1	oh yeah... forgot about them...  Chip Stiks are deffo the Gays of the crisp world...
0	Sorry to hear that buddy.
1	thanks buddy. You too.
1	Top Gear is my fav show!  And fav as well! #twinswholovetopgear
1	Well, that is just lovely my dear. Cleaning the garden and geting ready to plant the seeds of life.  must be proud.
0	yeah im ok...I did the blog to get out of my system but it looks horrible
1	yeah...exciting life I lead
1	yeeks. i have never had a hangover in my life. that must stink on ice. i'm good. just tired as usual.
0	yep, had my 2 days off, now 8-7, 8-6,8-6. yuk, will miss the sun  X
0	aw. you don't like hanging out with moi?  i has a sad now.
1	I'd neverr forget you bbycakes!
1	lol isee you were telling sonya about BND and such.  My dad is going to take me to blink too  i fink so at least
1	Sry I missed your calls. I fell asleep out of boredom. Colorado Sunrise was enjoyable though.  I actually could hear it. xD
0	studying.. That's what I should be doing
0	tear! but you have to comeee!!
0	I didn't get any teeth at all till I was one. I didn't get any cavaties till my mid-20s. Mouth is a mess now.
0	nope  I couldnt take the day.....I'm lacking time off (its really sad). Are you going???
1	C'mon, they didn't bring it personally - or did they - keeps them indisposable.  We used the hashtag to tweet during the show 
1	Nothing quite yet. Just finished painting yesterday. 3 Days after work...!!! Today is building of some Ikea furniture.  and Sunday
0	I don' have Leopard.
1	try standing on your head, then you will see what you will look like when all the muscles start going in the right direction.  
1	jamie bear! I want pics of your goddaughter
1	have a horrifying dreams jmie  lol
0	Naww, i would be angry too!  
1	awwww... Poor babez!! Lol. Nah it is gonna be major! but there's always next year.
1	haha.. i will try to convince them. wish me luck
1	fingers crossed. I'm staying pale and interesting
0	that Voigtlander is a bit pricey!
0	no. none of them could come
1	okk have funnn buy me something
0	oh no they still there, how long does it have to take! I wish you an empty road though - too hot for long drive 
0	thank you, and I agree def some stranger twitterers, can't stand the ones who tweet obscenities constantly 
0	dw my mum wont let me go
0	I can't believe I missed saying 'hello' to you in Glasgow!  Were you 'flipping' in the M&G Room? Omar xxx
0	is there anything left for liverpool ?
0	Nooo, i bet all the signings are while i'm on holiday! 
0	Nooooooooooooo, I'm away  Please do Liverpool either a few days before the 25th or after the 7th (Y)
1	that is awesome!! i cannot wait!! thank you so much
0	you know that comp i spoek to u about the other day? Should we just not expect tickets now as it's getting late
1	haha aw! yes most definitely my mini me
1	  The mess that is joey. Hmmm   OK  That really narrows it down. Joey is a bunch of messes!  You can explain which one later.
0	 Awww to do a mini NKOTB tour! If only   It was great seeing u yesterday.TY for coming! Love ya!
1	Good one I will have my hubby bring me an iced apple chai tea! TY Jaynee
0	I didnt know and was there yet when I twittered that
1	LOL..that's what I just thought..hope it IS him!  Naw..this chick's too far away from Montreal..maybe if they do BC/Alberta
1	If you havent watched movie buzz 137 yet...Do it! It will crack you up
0	wrong! your life is not complete bcuz you no longer are seeing me tomorrow!  im gonna go cry in the corner.
1	Shantaram by Gregory David Roberts. Its excellent. Have a lovely holiday.
1	NOT for a perv, work!  Yummy mummies, who can, of course, also be bloggers (that'd make them Super Mummies for finding time)
1	You only say that because you're probably crap at running
1	YAY Your coming back
1	~Oh my, thank you Jayne. High praise from you, & terrific company. 
1	lol goon. 8:ish? good  still have to talk to dad about it, but either way youre coming tomine :] hhaa
1	Happy Birthday! You are the EXACT same age as my husband - he's 33 today too!  Hope Sophie's party went well!
0	Thanks for your kind words Jayne.  50% on weight loss and 25% on fundraising.  All good here today.  Weather wet
0	it's true, can't believe Jordan is going to be 21 in 7 years 
0	Jayne I feel your pain, know that I am married to a social butterfly!  
1	well done  good luck today  x
0	answer was a big fat no  only got in 345. Shattered man. Good result. U guys getting on it homie?
0	I am so confused...
0	 welcome to twitter! too bad I don't use it much since I get like 200 updates in a day...
1	I got 4 pair n dont rock em' besides u cannot have me  hehe n ps Im telling yo wife!
0	I'm straining to hear but it's very hard from all the way over here.
1	What have u done? o.o Dont say u drunk more than at my home?
0	they take forever
0	oooh! mine just says "thats a nice picture" but wont post it
0	damn wifey got you abandoning me and shit lol ic how it is
1	i love GSP  he's so damn fineeeeee
0	idk  hopefully soon i miss bacolod!! gaarr
1	sorry, but that's one fight you're going to have to accept defeat... 
0	Jay, that says a lot about us as I looked up transformers first.... 
1	HOLY SHIT! I would have killed to be the guy's driver! :O
1	i finished weeds last night  doug rules.  not used to this heat, its only 08:30 and its too hot
0	ugh I know exactly what you mean. I'm sorrryyyy
1	tell you all about it after my exam. i miss you and tinapie. how are you guys? do i hear wedding bells soon??
1	 Jackson I gotta tell you that you are awesome  I love you acting Jasper in Twilight  I can't wait for the other parts
1	hey  didn't really have anything of substance to say...just your great  cant wait till you almost savage bella in new moon
1	hey, when do you come to Berlin next time?? that would be so awesome! 
0	what house warming gift?? man i missed my flight  my kick been dead all day
1	hahaha...easy dude I was just messing u  I know who you are ;)
1	gotta make nice with #89's friends......lol.....im on the grind baby
1	: its a paradise 2 me never known anything else   http://myloc.me/QFA
0	n u can't change your profile backgroud neither
1	u got that one right
1	thnx babe  just call me when u finish it....
1	you rock, bro. thanks. 
1	there's already one that does that, it's called Characters. When you get my iPhone, you can download it 
1	new week ur right, start of my vacation and shrimp, liquor and steaaaaak! Grrrrrr 
1	- I wouldn't mind seeing more work against biphobia in the gay community, either 
1	Not what I meant, but balance is good2.  Room is almost paintd& hit a sore patch so i hv to hold back. Ur tweets a blessing
1	Heyyyyy just wanna say ur awesome  Keep it up!! Luv ya xx
0	 Sum1 disappointed me
1	Good morning,  I'm doing well and I hope you are too!  
1	You're always welcome
0	I think the only place you can find them is eBay
0	aww poor precious
0	I never knew that cuz I never had one w/o the other...this is torture
0	right! I can't sleep.... And soooo much to do tomorrow
1	xactly! She prolly cldn't match u n the freaky department. Lol  lol
1	i stand by that  shes adorable
1	pretty sure we do XD not sure....but im PRETTTTY sure
1	yeah....there's so many things I want from there....like this 80 dollar hat </3 they have some mad sales when they do though
1	heyy jay, wat's going on witcha ? & do you want a twitter background ? you already know i gotcha if you need anything. 
0	I am just trying to watch good news week and BAM I have to see that bloody ad
0	When you get this message can you please send me a text I have lost your details  I don't want to show up unannounced.
