0	I should have called out for sunday
0	I should have checked the Shirt of the day before I left for work!  How great is this? http://shirt.woot.com/  To bad it's sold out.
0	i should have followed her just now..
0	I should have gone to see TBS in Charlotte tonight, except I have no friends to do such things with. 
0	I should have just married a doctor I'm with one all the time anyway  back at the clinic again!
0	I should have known better than to come into the office today, stuck here till probably 4pm   Lame!
0	I should have made some hard boiled eggs for this tuna salad.  I also would have liked sunflower seeds in it but don't have any.
1	I should have posted this for the world Pinhole day   I Love this picture. http://twitpic.com/4jb4d
0	I should have punched the people distributing BNP fliers near the uni.  That would have made me feel better.
0	I should have registered for #wwdc long ago wit   http://myloc.me/2YjR
1	I should have ruined the awards ceromony at school.
1	I should have slept a long time ago.
0	I should have told Jordan to tweet his way onto the plane
0	i should have went to bed early, i have got alot to do tomorrow 
0	i should head downstairs soon and get ready to leave. ughhh. NOOOO!
0	I should just stop going to the mailbox everyday and just accept the fact that no more graduation $ is coming
0	i should just...Let it go. I really should. I know I should...Easier said than done.
0	I should know better than to eat sweets!
1	I should know better then to neglect twitter on Friday because there are like 50 tweets of spamming about her tv show heh
0	i should learn bio - but i'm to lazy
0	I should learn history now. and chemistry. and maths. and I just really really don't wanna do it.
0	I should learn how to twitter from my phone so I can stay occupied at work where it is blocked. Along with FB and gmail
0	I should learn not to walk all day, and then sprint through sprinklers without stretching. 
1	I should leave more often - people keep on paying for my drinks
0	I should lern   but I am to lazy
0	I should make more #mcfly layouts for twitter... but what of? I feel uninspired today
1	i should make that a link. www.omgpop.com/africanshea  ADD ME!
1	i should marry sleeping beauty cause' both of us have the same hobby~
0	I should never have left the house this weekend
0	I should not be allowed to spell whilst drinking.
0	i should NOT be on twitter right now
0	i should not be up this early after only going to bed at 4am  so so tired
1	I should not buy any of it though. I need the money for a possible #mcflyforgermany time. I'm such a teen
0	I should not have stayed up till 4 watching heroes last night
0	I should not have taken that benedryl
0	i should of stayed home an in bed an da house is empty
0	I should prepare a presentation but I don't know how long I'm supposed to give a talk... So, I'm doing nothing for the presentation yet. 
0	I should probablly stop tweeting now and get back to work
0	I should probably go to bed now so I can wake up early tomorrow.
0	I should probably go to bed since the Really Mobile team will be arriving in six hours
0	I should probably go to sleep now. It's so windy and loud outside though   5am wake up call tomorrow. If I haven't tweeter by 6, worry.
0	I should probably haul ass to get the classes I want. Most of them are full.
1	I should probably not be so insanely happy today?! I have no idea why I am but grooving around my room is so fun!
0	I should probably pay more attention to people's profile pics
1	i should probably start packing for camp since i leave tomorrow at 7 in the morning haha im so excited!!!
1	i should probably start packing for nags head since i leave in an hour... so excited!
1	I should probaly leave Twitter now, I dont want to become a Twitter Whore  night.x
1	I should probs be stressed about all the stuff to do in the next two weeks, but I'm in LONDON. In the words of Rihanna, "Live your life" 
1	I should proofread my posts.  So many nows, so few needed. 
1	I should publicly apologise to  (and witnesses for being weird. That is my response to weirdness.
0	i should quit diet coke
1	i should REALLY Be getting ready right now........but i dont feel like it...... dance recital tonight
0	I should REALLY be in bed right now, knowing I gotta be up 4 this meeting & opening the store 2moro 
1	I should really be processing my Rodney Atkins pics from Thurs nite, but my apt is too cold and I'm tired. Thinking nap instead. 
0	i should really be up and ready to get to a surprise party right now....  i hate you sickness. i will beat you uppppp.
0	I should really get a raise seeing as though I have to work on the weekends
0	I should really get out of bed... Not for work reasons, just that there's no coffee here 
0	I should really go and shower. Instead, I am trying to beat the Final Vision. Nahatomb is mean, and Hewpoe is still a dick.  #Klonoa
0	I should really go to sleep now, I have work in the afternoon.  Goodnight
0	I should really have bought a prime instead of a zoom
1	i should really start studying for the benchmark exam thing... but yeah as anyone would say. i dont feel like it...
0	I should really start updating my twitter more often. Just been so bummed these days
1	i should really try to twitter more .. At school doing absolutely nothing. Cant wait for the summer to come. US HIGH SCHOOL HERE I COME
0	i should really win today  #squarespace have had a crappy year/month/day so far.
1	i should sleep
0	I should sleep longer than only this 3 hours last night  So than my only thing to say for now is good night!!
0	i should sleep...zzzz
0	I should so straighten my hair right now, but damnit, I'm feelin lazy!  #BSB
1	I should start charging people for seeking me  LOL
0	I should start doing chores now. ungh.
0	I should start using this thing more. I'm in slug mode right now and my boyfriends birthday is the 9th. He's gonna be out of town
0	I should start working instead of be-jeweling ..
1	I should start working tomorrow!
0	I should stay out of advertising
0	I should still be fast asleep
0	I should stop listening to the new Sounds album...but no, I wont. Reviseeeee Ali 
0	I should stop talking so much at work!!  i'm worried that this will go into my assessment.
0	I should stop trying to reach
0	I should sue DD... they didnt give me my free donut w/ my coffe purchase today
0	I should take a nap now so I don't see anything else.
0	I should take another pill or two,my nerves are out of control 
0	I should try not get get distracted on other websites, or have DestroyTwitter open so I know when people tweet back at me... 
1	I should use the computer at the living room -- it is tempting to drink *cups* of coffee in the kitchen.
1	I should watch something -,- have been chattin' with chrissy about baby names and such haha 
0	i shoulda gone home, my head hurts 
1	i shouldn't be allowed to drive on the freeway. had about 6 near death experiences & at least 8 death stares. way to start my morning off
0	I shouldn't be crying but i am.
0	i shouldn't be looking at merch if i got no money
0	i shouldn't be twittering i should be on eclass
0	I shouldn't be up reading tweets...I have to get up early for #agileroots ... is getting up at 5 am?
0	I shouldn't check things like twitter and facebook, apprentice winner and big brother ruinedd  go yasmina, kate was deffo a robot norassed
0	i shouldn't have cut my beautiful long hair.
0	I shouldn't have cut my hair.  I look like a primary school kid with a bad haircut.
0	I shouldn't have drank that Pepsi.....know I can't have caffeine...feeling crazy already...
0	I shouldn't have eaten all this candy  #fb
0	I shouldn't have kept the electric fan on when I was sleeping . Now get a headache...
0	I shouldn't have looked at the picture Chris just posted.
0	I shouldn't have napped...
0	I shouldn't have opened my big fat mouth. Now he's mad at me
0	I shouldn't have said that about Adam Pascal. It was mean
0	I shouldn't have smiled so hard last week cuz it only makes the inevitable pouting happening this week that much sadder
0	I shouldn't have started so early.. my brain hurts!
0	i shouldn't have trusted my monkeys   the bloons killed me
0	I shouldn't have watched all that porn as a teenager   http://bit.ly/164Bgm #fb
0	I shouldn't of had all those redbullz, now I can't close my eyes 
0	I shouldn't of moved to adjust my bag yesterday
0	i shouldn't still care, but sometimes i do 
0	I should've brought some oil stocks while it was $30. Fuck me for being behind the curve!
0	i should've eaten breakfast. almost 11am and i get really hungry.  how funny next song on my ipod is 11am by incubus. hehe.
0	I should've paid more attention in my anthropology class... I've got a feeling this final tomorrow is going to be no joke!
0	I should've said no to "I have never..." hahaha .. Oh no! I'm gonna miss Miguel so MUCH!!!!!!
0	i shouldve stayed another night in the bay
0	i should've stayed home. locked out of my user account at work. waiting on hold. no hold music.
0	I should've taken cough syrup this morning!! I don't even have it with me. Hacking up a storm.
0	i shouldve took a 4 hour nap! now im not tired & cant fall asleep
0	I showed up to work 3 hours earlier than I had to. FML. I had plans todayyyyy!!!
0	I showered, got dressed, and I'm ready to go, but everyone in my house is snoring. I want pancakes! Someone rescue me please. 
1	I showered, I feel clean!!! now I'm going to sleep, g'night my lovely ppl 
1	i showered.  god blogtv scares me.
0	i shud get ready n hit the gym  i'm fed up with it already!
0	I shud somehow get rid of this habit of coming in late..my PS3 profile name is niTe_Owl..I'm literally becoming a nite owl
0	i shud start getting ready for church...purple dress?
0	i shut my blinds the rain is that bad
1	I shut my eyes to see.
1	I signed my LEASE for another wonderful YEAR !!!
0	i singed my hair while making spagetti....again  remind me to wear a ponytail the next time i'm near a stove
1	I skip Elti (haha) and i don't care bout the result. I think it's not good if we hope too much. Just want this flu goes away.
0	I sleep way too late. Seriously. I need to start getting more sleep or I'll probably die underage
1	I slept 10 and a half hours.
0	I slept absolutely horribly and i am back to feeling not so ok and like im going to be sick
0	awwwwwww man!!!! Heck yea but I'm goin to Essence
0	oh no.  wheres she going?
1	Actually SoS won't be here, VI will be accompanied by Gliss and Make Me. The day after Brandi Carlile, busy month gigwise 
0	i dont know  AE used to be the bestest! and what?? i thought abisha said they were??
1	Oh now how could anyone resist that LOL  xoxo
0	Please don't. I'll miss you.
1	aaahhhh lucky u! Hopefully tomorrow night comes quik  !
0	thanks, I'll let you know 
1	Please say hello to Mickey Bogart, Jan Wissman, Tweed Ross, and Mike Ribble there at KSU-COE. Welcome to Twitter! 
1	http://twitpic.com/66wrp - so cool!  follow me! I already did!
1	ouvindo o cd da trilha sonora, em?  DOASHODISHD to find my way back to tennessee � para :*
1	 well i appreciate the congrats   yeah i had quite a lot on my plate
1	I seem to be awake  hopefully that doesn't diminish throughout the day
1	Wasn't me I promise!  We had it here something fierce early last week but it's been clear all weekend.
1	well you could always just do it for him  thats what i would do
1	Wear a vest tomorrow to keep your chest and neck warm.  It will work wonders to help your breathing.
1	now can't make it tonight. Just got home. Been an effed up day and I'm staying in  I'll wave back lol
0	it's all about vw bettles and classic cars,oh and people with water pistols filled with bleach and bodily fluids 
1	hello. long time no see! am watching inspector george gently (i really am!) catch you soon.
1	Very true...atmosphere was amazing!
0	*gives you aloe vera and my sympathies.*
0	I totally agree with you on that one, sometimes I think life is too short to sit in an office all day 
1	 I hate it too I have to late so much time and I get nerves now I hope everything will be ok
1	 I'm fine thanks  u?
1	 irl who is your favourite? jacob or edward?
0	i wrote to her few minutes ago that she shouldn´t leave us ...
1	im just watchin, its very interesting 
1	irl just ended lo. but it was good
0	But don't you be fooled! They look pretty but dammit they're rubbish! Not tasty
1	Could be a greyhound lover?
0	Don't want to change my name to Horny Kitty though!
0	my content server won't start.
1	Oh, I remember that. Yeah, it was a compelling read. So long ago. 
0	So every time I see hubby tie the canoe on top of the jeep I shld be coming? Hmm..I'm doing it wrong.
0	Tab loves danger. She grew up with no parental figure.  #rrtheatre
1	that would mean chax's tail was in two holes at once  #rrtheatre
1	yeah. MH came out 1st, but Sizzle was contracted 1st IIRC 
0	just the normal washing up liquid, i even re cleaned the sink after it had all that grease in it. 
0	Good! Cause I don't know where my camera charger is... D: We need a picture of us together! And no, I didn't get my phone. 
0	honestly... i'm losing it big time! when i told her about my blog & all she immediately said; stop doing that
0	no other videos at the moment, but i have a few ive started but never finished  about 4 i think, one is a music video
1	omg, wow. that's amazing. did you do that? its beautiful 
1	never mind  Why don't you join us? its gonna be fun!
1	by then we will have some more volturi people...Oh yeah. Bella is gonna get pissed that you are there, just to warn you 
0	I can twitter from work.  Wooo-eeeeee, I can now message you lots x, but I can't see your cool link though 
1	it really did  It's the highlight of my day! \/
1	Thank you!
0	aww thank you, but it doesn't stop my bottom half being at least a size bigger than the top 
1	hey, if I can help, lemme know 
0	Meep!  Did you manage to finish in time? Or do you have to retake a part of it...
1	considerin it.will have to raid freezer though.lol
0	damn inquisitios  I think this calls for a cookie!
1	I am hoping I'll be able to get pictures of someone else - was camera-handicapped but the dress was divine!
1	It was fantastic , visited grave of our relative who died in the Somme, hugged lots of D-Day veterans, cried, drank wine 
1	oooohhh I have done love your tales
1	Rather good thank you  how about you? X
1	thats the sort you want that likes a fuss.lol
1	They're gorgeous  Bear with me!
1	LOL! I'll give you that, yes... you are doing hard time. 
1	That is easily done
1	The stalker coat with nothing underneath   (via LOL
1	bbq food?! did you finally have a bbq then?!  yay.
0	this is interesting, hmmm, o only have one follower (how unpopular am i) 
1	If y'all say so, I trust you on that one 
1	voting already started  go go go vooote
1	good luck! W/the award..not the vodka
0	last day   hope to see the photos of the hip and joint operations and a blow by blow of your recovery and rehab
1	Nice. Keep the schedule; keep the schedule.
1	You know, if you need someone to go with you, I'm always available. 
1	you than meets the eye" wasn't there?? I've got it stuck in my head and I'm trying to find it on Youtube or something...
0	But I'm a poor uni student without foxtel  had to give up that addiction. Hace tix 4 both Cog's melb gigs
0	I am but need to leave sharp to pick up junior so no can do on drinks
0	was closin luv  going to see it 2moro morning at 10 with emma n purv, claire sed she might if she gets up. U wanna join?
1	Have a great evening, happy to do the shout out!  And thanks for the compliment 
0	Preach that shit, Jane and RJA. 
0	Since I'm not on FB does it mean I'll miss all the B&B stuff?
0	also wish I could play more along with you guys but at work again and my Twitter time is limited.
1	heyheyhey! Lovin' the icon! Gosh even his feet are cute...hehe
1	hi, enjoy your time at home, but of course we missed you! though i was kinda w/o twitter myself - not my choise of course 
0	hope the presentation went well today?! tweet me if yr on campus tomorrow - I'll be around from lunch time onwards
1	I've just started using tweetdeck but I'm not using it at the moment & you get the privilage of my 4400 post
1	Oh! Have fun! Stweet you (?) soon.
1	yea! AND and he said he's coming
1	i can't go to TYC because i'm doing work experience at my Godfathers so have to stay the night. sorry
1	I PROMISE I'm emailing you back AS SOON AS I get home. Stay strong  LOVE x x x
1	thanks for link   amazing idea!!
0	  hopefully you'll get the rain we are having
1	 that sounds like a good idea! too bad no1 in my dam would agree to that! that sounds like a good idea ..!
1	yep, I'm staying but I'll be around for rock band fun 
1	I actually just learned about a "shift solenoid" in the transmission; might solve one of my issues; will look into it soon
0	Poor little boy.  Hopefully he'll get better at it as he grows up.
0	yes my emoticon theory states that you are just over 26
1	yeah. Im outtie tonight  haven't been home since like 8 this mornin....lol. been in town running errands n at my boys house.
0	Im sorry my pancakes were that bad
0	WACK lmao i need to do something fun hmm...... PS3 is at home
0	i didnt wake up  i even ate applesauce to stay up!
0	i'm gonna miss the next one  i'm sad. oh, and do you watch hannah montana?
1	just a few more days until it's all over! goodluck w/ exams and schtuff!
0	Oh no. I am disappointed
0	susan boyle lost? That's a shame.
0	must be nice....I was looking forward to do that but it is raining here in Florida..
1	Our health is important too lol
0	I missed it too  I forget to watch sytycd at least once every week..
1	MANY MOONS, love the song and Video! Regards from Sweden 
0	so sad I missed it
0	yea I tried that one and the pr one twice
1	 Did you say you were coming to AK today?
0	 I think it's cool!
0	aww.  when will you see them again?
0	hahaha i only write sad songs...
1	Now I'm super excited!   *tail wags
0	aww  i can respect that...
1	I know what you mean. And just realized I said "train in" not "trade in." Doing nothing all day is exhausting apparently
1	I shared the file with you on dropbox if you wanna check it out (check your school email)
0	Wish we could deliver alcohol, but state law prohibits us. 
1	Use Alcohol. It's 100x more effective.
0	I don't even remember what's on there!!!
1	Hey chica! Nice meeting you over the weekend... we all got go out again sometime. Ttyl!
1	...and it's a great one, just as you are, J-MAC! I am SO psyched for Liberty season 
1	thanks  great tip!
0	at this rate
1	We are equally bizarre.
1	DT is currently filming his version of Hamlet  To air in UK later in year, US next year. Will be on DVD. (Sorry to jump in!)
0	my housemates mum??? wish I could help but english not my strong point no more   but best of luck with it x
1	Hope all is well with you
1	we should go bowling for dohyun, if he wants to 
1	That's grear  So what have you been up to lately?
0	orlando bloom too! his is like fake and not him
0	oh- and you did not take me ....
1	She lives!  You were so Twitter quiet after the race. Recovering or celebrating?  ps. #20 Fem. in your 1st marathon Wow!
0	I have sniffles tonight.  it's terrible!
1	Looking forward to Monday, big time 
0	ginger nut biscuits are the best biscuit ever.. i think arnotts have made them thinner though
0	Yes keep them hungry then pour their food. My cat likes to bite you when shes hungry...worried one day she'll eat me
0	I wish I could be there
0	I always play her lallaby CD on weekends during naps.  But, the washer and dryer set we have is beep happy 
1	concert please explain? im intrigued
0	yeah, I prefer "website" too, and also prefer real twitters: "Cera" doesn't happen to be one: http://bit.ly/Yn7hy 
1	I think it works pretty well  Writing query letters should be a pain. Few things that are easy are worth it.
1	Lol. It was the dissing of the were-octopus that did you in. However, he redeems himself by rescuing you from a were-spider. 
1	no run... i'm doing afc half marathon in august  rnr was this morning!
1	Hooray for easy days. It's almost 9am Monday here. Happily busy working on joint splendidness w/
1	Sounds great. Only a few days and we get to meet. Woohoo!
1	speaking portuguese after watever u had for dinner.Muz be some cooking! Haha...loving Michael Buble huh?
1	I always throw my banana's in the freezer as soon as they start going dark, that way I've always got some when I want to bake 
1	I didn't catch yours? You might be able to tell why we click, I'm an INFP. Saw yur reference 2 someone, 
1	Love your website!Love that you're a writer. Really glad to meet you! I did follow & yes I'll figure it out.
0	I can't find you on Facebook.
1	yes, i have come to the conclusion that sloth is a virtue, not a sin 
1	Hi,laughed at your tweet 2 me earlier...hey theres nothing wrong with single engine a/c,thats what i mainly fly at the moment 
0	http://forums.philosophyforums.com/ the link doesnt work at the moment for some reason  well not for me anyway. how bout you?
0	i know. dont worry. its fine  i wont force u to choose n feel bad. atleast drop in at the start? for like 10mins?
0	That would work, except I don't have the money to go over there. 
1	if it was only that exciting!! Well, sometimes LOL 
0	that sounds horrible. it's nice and sunny down here in florida
0	i do too.  ah well. stole my i am a scorned ho.
1	Is this boy u meet with u know.  Can u not tweet now???
1	U are some craziness.   I can't wait to get home and have a big ol' glass of wine.
1	Not yet...enjoying the last bit of NY/Long Island as much as possible
1	Thanks for the #FollowFriday shout-out!
0	Yes it will. I had to miss KC this year.  I'm sure he'll be back around our part of the world again next year.
1	absoluetly u can! Very achievable w exercise and good eating...everday
1	you too, sweets. A lovely morning to you  ♫ http://blip.fm/~7qnd9
1	If they let you take home a doggy bag, I'd lovvvvvvvve a taste. 
1	Do I detect a theme here?
1	LOL I love my MacBook too. Oh and my iMac. Can't decide which I love more. OK 24" iMac trumps 13" MacBook
1	Thanks!  Hehe yeah, I'm moving again in August tho. Just need to be locked in with the music now so I can be more productive
1	http://twitpic.com/5cdpk - I recognize this lot!  I'm not sure where this particular pic was taken but the guy, Greg Pike ...
1	there's no "s" at the end - is correct
0	I'm at Del Mar, checked in hotel and front desk said David isn't staying here 
0	no i can't vote from my phone.  but when i was home, like 5 hours ago, i got some votes in.
0	oh I'm very rarely sick! Can't remember getting home though
0	ok thanks just getting ready to head off to work  have a gr8 dau x
0	HEROES! she plays Elle. until Sylar cuts her head open
0	I wouldn't worry Alans duties will be over by the time the next series comes round
0	I wish,,, baby been a right shit !!!! Working hard plus bloody hay fever !!!!  I'm a mess  xx
1	ooh shit that's bad LOL  you ok doll face ?? Xxx
0	Howdy, yes big day tomorrow so just getting the essentials sorted..running gear... energy drinks...vaseline...going to be hot 
1	� Obviously not since it fit on a single CD.
0	Aww no hun - you're not having much luck with your sleep either are you  Work's bound to tire you ready for Zzzzs later xxxx
1	LOL, where on earth did you find that?! I wish I were with on the #Nimitz today 
1	awww i can't wait to get one
1	- i got the LEGITIMATE version from datablitz. btw what time are we meeting tom? i will show you #sims3
1	Sweet. We've got Friday as well.
1	good for you
0	Looking forward to the tweetup tonight.  Does it really start at 9 p.m.?  I have to go to work tomorrow.
1	all feedback on wlwbackup welcome
0	Nothing new there then    [sent from my work PC]
1	was watching the mtv awards.
1	hrm... thanks dude. i guess it's back to tmobile for me then
1	You feel old? Who is the one who will be 31 on your 21st Birthday in Vegas?? Lol
1	okay thanks
0	Congratulations on your tt victory, shame about the tdf 
1	lol. thank you! i'd rather be dead than go to school!
1	Hey, how are you? 
1	youre not a stalker janice!  ahaha iya, panik abis gitu tadi masa
0	Oh no. That is such a shame. Hard to reach that decision after just two sessions, tho.  
1	Nice  thanks!
0	ill let you know when my schedule frees up a little, my schedule at work has been unpredictable and its wearing me out 
0	Hip me to WEEDS, I'm not aware 
0	  If it helps, there's a bottle of wine in my desk.. It's Betsy's but I'm sure she would understand if it's an emergency!
1	Thanks for letting me know, everyone! 
1	so how did the dancing on your own turn out??
1	That sounds great. And I hope you have wonderful weather for it.
0	Nope, no passport.  Planning on heading south?
0	Not a lot.  Have to pack, so I'm up.  Also finishing some stuff at work.  
0	i'm good girl. i saw u hit NP yesterday. I was too tired to offer my company.  how've you been?
1	or, you can just marry me instead of being a date!?  
1	Thank you all
0	ooooooowwwwwwwwww who left those pins there?
0	you're not alone, they're back bugging me too 
1	Ooh, I keep meaning to check out battledecks! It sounds like something I want to do! Me=GamingGeek.  #pres4lib
0	it hasnt started here yet. im scared
0	hmm yeah, i think the site is down right now 
0	The epilogue made me kinda hate the whole series. But I still love it. I don't think they're be another Harry Potter book.
0	It's no bueno.  The worst part is not getting any warning and dealing with the withdrawal. Oh well, we shall overcome!
1	sounds good right now
0	HAHAHAHAHA! have you started it?! lmfao yeah i know.. im getting my mom to buy the CD, but i gotta buy the book  tear tear
0	it's so sad! i know that there's probably so much more in edmonton but i neeeeeeeeeed to buy something!  lmao
0	Heh - of course not. The arcade games industry is dead. (Used to work for one of the holdouts, Midway - they're now dead too  )
1	http://twitpic.com/67dl7 - haha, thats funny 
1	I would recommend upside down
