1	i dnt have her CD'S but i have her songs on my phone
0	lol girl down by dayton by my school no where in co  got to finish school lol but its call BrookStone Apartments lol
0	I was about to head there too ((gym))... I don't wanna go
1	i just finishedmineee  FINALLY!
1	it cant be that good if your twittering instead of watching it  xx
0	hahhah omg who said that   not cool
1	sometimes when i see someone who is going though more than what im dealing with
1	 This sounds awesome out of context btw.  Target acquired!
1	Give a yell when you're in town. I'll buy you a drink
1	Loved the new episode! Hilarious!
1	progress slow but steady. Gone from being terrified of 16kg to doing snatch ladders with it. Satisfying
1	yes, I want a sandbag. Right now I make do with bags of mulch. Chores+workout=multitasking 
1	thanks for the connection
1	OMG its your birthday  what an epic gift! #ASOT400
1	Thx for the workout! It's on our homepage for everyone to see
1	thanx again Daniel  will do... i like music si!!! si is italian for YES!!!
1	great job on the new S&S pictures!
0	Seriously?? Thats so sad
0	what do you mean quickpwn tomorrow whatever? Lol and how come I can't update my stupid phone
0	that's well shite, least you can access it 
0	...i'm sorry sweetie  ...i hope he will be all-right.
1	I�m really clever  I saw you at  following
0	#sushiday!! I don't think I will get any today though...   I had some on sunday at least, if only it was #sushiweek....
1	On another note, you're using the Opera widget, yaaay!  Is it good, should I be bothered to get it?
1	did you order the white dress for me?
0	Ye its like the end of the world
0	im gonna be singing , im ok today...really sunburnt tho  not good, u enjoying the sun??
1	sings hoedown throwdown  is so easy! as miley cyrus
0	So sad  life is but a moment or like the life span of a cut flower...rest in peace, my prayers are with her family.
1	you have the most runningest significant other.  I'm sure you can do it!  I believe in you
1	is this a new album?? about bloody time too!!
1	hey Dan, not sure what you mean.  I don't think and Magpie are in competition 
0	that stinketh mightily!
1	album=brill.  Been uni so was missing home but made me  ur pics taken in littlestone/dungeness about 2 mins from my house.
1	break a leg for tonight! wish i could be there, saw you in oxford though, was an amazing night  and ill def be buying the cd!
0	Nice! I think we're going to be able to use a Leaf back on a Sinar 4x5 this year. Though only in studio
1	  THANKS SO MUCH for the re-tweets!
1	But the only way to do that effectively is to genuinely not care.
1	I've been online since 1983. I grew up in online culture, board wars, factioning, and flamewars. The key is to not care. 
1	Sorry it wasn't Wrath of Khan.  But we made do.
0	I don't know
0	yeaah I hate that!
1	Those poor surgeons only make $300,000+ per year.  In truth, malp. insurance is out of control.
1	Pictures.... we wanna see!!  FYI.. one of our mutual friends will be Tweeting very soon!
1	Alexi's first album, "Time Without Consequence" was slightly less on the sad side. But I prefer this 
1	Window cats are a specialty  For cats like these, a window is the Great Outdoors. See also http://is.gd/12pK8
1	 Haha yeah, but you went to the main block for the runaway thing. Different place. & eh, the pretty emcee la.  LOL.
1	hahah ur bg!;;;; what are u up to?/// have a great night::: follow me  GB♥
0	once again : NOT COOL
0	i know. If their denver and salt lake dates would've flip flopped it'd be perfect
0	It's raining?! It's not raining at my house.
1	 I live in the U.S., angel   Sending love and light to you-xoxo
1	I'm quite fond of my sphincter.  He's not worthy of it. Sociopath is close.
1	Glad you are all back I look forward to hearing all the  cruise  fun in the am
1	looks like something I could waste a weekend over
1	I can see should not leave home without you
0	Sorry we missed you.  As touristas we didn't know how to factor traffic into the GPS estimates.
0	i know right?! sad.  lol
0	 whats going on?
1	(; haha that's cause kevin gives them both out for free.
0	thanks for the follow, you rock man! So sad to see you get shot by your own kinda-sorta-not-yet-mom.    #LOST
0	look like i can only quick post from the dashboard that is all
0	aww.. thats bad..  I dont have a headache but Im like in a zombie mode xD haha
1	Awwww! Don't worry about it hun. There are worse things they could say!  x
0	Continue to ignore!! Stick head in sand!!! Poor u
0	He does seem to be shouting lately. Any way shouldn't you be revising and not telly watching
1	Hello  How are you? Looking forward to the last semi final? That little dancer lad must get to the final, surely?
0	Lucky you! And damn, fuck that! No Zac Efron = FAIL! 
1	yes sir! loving every minute of it
1	you can take my 3 exams next week and write my business plan if you'd like  haha
0	I'd take ya in if you were in NYC.  How are you homeless? I've been there. REALLY been there...
0	Wow! I can't wait to see what's going to happen this summer between Lily and Cane....It sure doesn't look good
1	I can lend you my t-shirt!
1	Indeed. What have you been doing with yourself?!?! How'd the dissertation go??
1	Impressive...if they can deliver as the promo stuff shows it'll be amazing. That's a big if though
1	I can almost picture u singing haha
0	your really really gay  id like some though thanks
1	amazing song. can't wait to see him at warped  you too if you're going with millionaires and jeffree! <3
1	I know that's real. My bf fell asleep & I'm editing video...  XO
0	I didn't! I know what happened! Last time I used it I didn't get updates for about 15 minutes.  Help!
1	ohhh... yeah - that's no good then. Eeeps! Anyway, good night and have a wonderful tomorrow 
1	I do have 2 daughters hence the scrunchie and lip balm. Must keep the girls happy - you know that !!
1	finally your dream come true..
1	Ah, but is the comedy intentional? or is it laughing induced by stress and drinking in the shadow of the gallows? 
1	That's good to hear  I take a day off the grid each week Does the being good
1	Just saw the picture!
1	Not sure.. Don't know if it has been announced yet. I listened to the podcast, btw! I enjoyed what I could understand of it 
0	I am so sad to miss FIRST #NMD tweetup today!    Perhaps I'll tweet to ya from the saa Portfolio Show!
1	thanks <3 I just got home now.
1	aw thanks  hope you have a great one too. so far, looks likt it should be fantastic!
1	haha, we did  i hope you had a fabulous weekend!
1	LMAO! you remembered! this might just turn into a running bit afterall
0	Ok sooo I got pics on my last trip they did not compare to yours LoL...not 2 mention NO DumDums
1	maybe not free, but there is an open source beer project too 
1	Someone's been rajin.. Had a 5 mins panic attack last nite when I THOUGHT your pendrive was lost
1	yup  Oli is such a cock. hahaha. but honestly, who would simply sit there and let someone piss on them? wtf?
1	ps. i promised carm id come over once ur finals were over  haha
1	thanks for agreeing with me
1	[we were watching a nature show on discovery] "awww look! panda bears  " ... they were polar bears
0	but u know if u come now yur gonna be waitinq in the rain
1	Exciting week! Newborns and Beer, the stuff we live for ey? 
1	where are you going!?!?!
0	it's all of our phones
1	hey thought you'd wanna know the demi lovato you're following isn't her.  This is her ddlovato. Just so you know
0	 oh dear thats not good  hope your feeling better soon  i.e the morning
0	don't cryyy  just don't speak to him and when they ask why just tell him he's not worth ur breath lmao it's mean but  ...
1	Yes, I agree it's different when it's someone you already know to be a reliable trader. And of course I *heart* Deanna.  
1	Thank you.  We had a great time too
1	I LOVE THAT MOVIIIIIIIE <3 & the fanfic
1	shut your mouth when you're tweeting and cheer up! Im all for a Red Eye flight to Mexico before HOME to LA  Love you to pieces
1	BBC series, of course 
0	no, i didnt. i'm going to the party junina in my school now  night night honey xx
0	yesterday i was writing so much. and i was sad because São Paulo lost the game  bye bye Libertadores. but today i'm here
1	yes! that's it sugah! except, u gave it better diction and grammer. 50 say's i ain't in ta havin sex im in ta makin luv 
0	i need to talk to you tomorrow, i have some bad news 
1	I love you! And I guess that gross picture makes up for the fact of the getting ready picture
1	I agree, I need to start snapping out of my student mode, and into worker mode. 
1	Another sunny morning and can only get worse.
1	awh you're so sweet  love you girl ♥
1	congratulations on the birth of ur niece. I have one she is 7 months she is awesome
0	I'm tired too  and sad, but happier now!
1	Infatuation? I love that song!  I know almost all of the Japanese lyrics...
1	oh so cutee!! <3 everyone loves kevin!!
0	however, they play seattle the day after... that WOULD be easier... LOL i think i have class when they play LA 
0	 forget those fools... keep your eye on the prize... in 6 days that is  TC
1	Awesome  It's because & I are playing at a place called Snooky's on May 2nd and it says its in Clydebank
0	 everyone's seeing star trek but i have too much work, and too little money, and it actually looks really good...
0	pshhhht!!! it tastes like liqud Apple Suace....
1	Yeh, maybe Twilight does take up a little too much of my time when I keep watching it again & again!  haha!  
1	Yay, cool I'm looking forward to getting to know you too. And let's start a #stopautodms trend 
1	there you go, i have started to follow you 
1	Like shots but #2 more. #1 a little too "street basic" for me.
1	 I told her to check out your images. She's studying photography at Raffles, down at Nth Sydney. What camera do you use?
1	I need the original covers. IM me when your online, so I can show u the email I got from createspace, re the cover 
1	ur nocturnal buddys news is if you want ur photographies to be placed in art galleries, ask ur Uni if they can direct u 
0	- hi D - I want 2 get online so bad but the Internet is broken again  Im so over it. They r coming to fix 2morow
0	I thought it was open all the time
1	yeah theres no way i'm befriending her. She can stay friendless
0	i didnt do anything
0	I work until 11  I hope I get off then. I'll text you though!
1	yeah its been a goal to meet her and I finally did
1	Oh it is.....now we just have to recruit!!!
1	Danielle!! how are you?
0	haha my OJD is kinda low right now
0	I know. such a cutie even when crying.
0	OMG such fun! I wanna see the pics! Awwh I miss you guys.  we need to hang out in Chi when I go there for the race
1	thanks for the text
1	that works well if he's applying at king county sanitation district for a software job. otherwise, keep working 
1	Thanks Ps Dan. Best job I've ever had!
1	I'm totally horrible!  I ended up getting The Sims 3 on my phone and for the computer... Love it!!
1	and holly!!  i wish i was on the other side of the bar with u
1	i might be, just let me know when 
0	i'm sure there are tutorials out there.  i'd help but i won't get my new iphone until friday
1	bedtimes stories is cute...I bought it for my kid and we have watched it several times
1	Thanks  How were your finals? All of them done? Or is there still much goin on in school?
0	awww...damn...that sucks
0	i got so fat serioiusly its so bad  too much in n out did that to me  now im like no fast food just salads lol
0	not sure if i'll have money by then
1	It's a Slow Loris.... and I doubt you really want that at home.  http://en.wikipedia.org/wiki/Slow_loris
1	That's great! Go for it!
1	Wow! Yoga classes AT work? We get to walk around the parking lot if we want to.
1	oh same, you're sitting right next too me  I gotta tell you something.
1	get your but to the field 
0	What have you started me on? I've been on this damn site all night. And Ihave an early deadline tomorrow
0	my hottie graduated
0	do you think you could help me w/ solidworks? :] haha im stuck.
0	DUDE! Not fair, I'd just settled into these jeans. 
1	thanks  I shall watch soon with excitment *screams like a girl* lol haha hmm maybe not like a girl.
0	I don't really like it either
0	 you cant buy it, but you can promote it!  lol
1	Thanks for the #followfriday
1	nice avatar!!! Veli the hensem!
0	Nothing for Southampton sorry  keep posted for other Sats stuff
0	can't do it man would miss a week of school!
1	good here   wut time is it over by u? Its 930am by me
0	hey i want to but as you're not following me, i can't send you a direct message  bummer! anyways, good luck today!*
1	naah... its ok dan  just never lose your temper again..  ok?
1	what song that's most playing in your ipod? Do you have a plan or a dream to have a band n have a career in music??
0	yes,.why you not repply my twitter?i wanna chat with you dan 
1	Guitar Hero 5 line up http://bit.ly/wDWNJ
1	guitar hero metallica came out today hopefully getting it this weekend  looking forward to #E3 cant wait to see whats coming up
1	Guitar Hero party wif Caitlyn & her frand.  Wee wii wee wii.
1	Guitar Hero 's Metallica has been out today!!!!  Well i had to get it
0	guitar hero smash hits is awesome  beat the game already though  still can't 5 star play with me cause no hyperspeed
1	guitar jam today!!  hahah i know, i'm like keeping you guys REALLY updated on this stuff, aren't I? ;) i bet you're getting tired of this?
0	guitar lesson were awesome. im pooped. those kids wore me out
0	guitar practice.. ugh! wen't to school lately and very pissed off.. my havaianas broke off! terrible.. I was in the car the whole time!
0	Guitar was .... Painful
0	guitar! <3 ((not mine  ))
1	guitaring  lol I like that^^
0	Guitar-ing it with baby. My stum is hurting at the momentó  blehhh morning twitties! Dream Big
0	Guitar's pickups stopped working. Opened it up to see what's up.. screwed it all up while putting it back together  Need an Ibanez Iceman!
1	Gum wall of Camberwell   http://twitpic.com/6t0yy
1	gumbo will be tomorrow night.  any LA friends hungry for gumbo and company be here by 7PM.  We have extra spoons.
1	GUNA LISTEN 2 MUCH BETTER NEXT C WHAT JOE HAS 2 HIDE
1	gunna be a well shit day, may watch lost hehe, 
0	gunna be really busy today. ily bunny. i sowwy  hes a moron if he dnt like u
1	gunna be up and at em real early tomorow  texas here i come.. youv never seen anything like me.. you CANT get like me
1	Gunna fall asleep watching the ubisoft confrence  #jtv http://justin.tv/g4tv_e3
0	Gunna go try and take an ice cold shower,even tho i hate cold showers. My whole body is on fire 
1	Gunna have a ' breaking dawn- athon
1	gunna have a fun filled daaaay w/ my best frannnnd
1	gunna sleep a little more i am not feeling a 100% today biiiiii my fellow twitter heads  see u all in a hour or less lol
1	Gunna sleep. I wanna hangout with some people I don't usually, so text me!  xoxo
1	gunna watch some tv now then off to bed! xo
0	gunna wear this dress out to this thing on saturday.  but idk, :L    ++ i have no shoes to match it  http://tinyurl.com/mvktc8
1	Gurston june 21st:  Hey guys anyone At gurston for British round on the 24th may or the gurston championship o.. http://tinyurl.com/pdpvwz
0	Gushed at my professional idol backstage at #bgt tonight, only to be underwhelmed 
0	gustav just bite me  little shit!!!
0	Gusto ko bumili ng Big Bang" The Big Show concert DVD.  SANA I-RELEASE NA NILA. Atat na atat akong manood. O_O
0	Gusto ko tres lechessss!!! Masarap tres leches sa Texas
1	Gute Morgen leute! In the series of boring updates: Looking for an MP3 player with Ogg Vorbis support for daughter
1	Gute nacht Twitter-land. Don't let the twitter bugs bite.     <33
1	Guten Morgääähn.  Need a coffee.
1	guten morgen  (Broadcasting live at http://ustre.am/VI0)
1	guten morgen twitters
1	going to play soccer with lil' kj
1	going to play some computer game, then i'm going to bed, 
0	going to play some gears of war 2 now after watching vettel win the british grand prix and button come 6th
1	Going to play some guitar now   It's the little things in life.  Crank it up baby!   (www.LaughNYC.com)
1	going to play some of my favorite video game ever. dead space. I'm gonna have nightmares tonight
0	going to play wow - babying my noodles (his shoulder is all messed up and he came home from work already)
0	Going to potomac mills with sara. I hate shopping
1	going to practice guitar & theres only 14days til kings of leonnn
1	going to practice my lines...wish me luck
0	going to primrose vally today its just ashhame it raining
1	going to program now  haven't programmed for a long time now
1	Going to prom tonight
0	going to provincetown now but weather is crappy
0	going to PTC with should've and with us 
1	Going to pub-on-the-beach party with M tomorrow!
0	going to pull more dandelions...pretty soon i'll have no lawn
1	going to queens pride parade, ill take pics  stay posted
1	Going to Rawon Nguling at Cikajang. Yum!!
1	going to read and wait for a certain fish until lunchtime. Gonna revise after food in the sun, bring on the shorts 
0	going to read huck finnn
1	Going to read some Blood Of The Fold, and if the sun decides to come out I'll go out to swing. 
1	going to read Twilight breaking dawn  Love it
0	going to read with my daughter.  Keep her mind off of feeling so bad
1	going to rearrange makeup into more user friendly storage  might do a video later.
1	Going to recycle can!!   $$$$
1	Going to Red Mill Burger with Dylan. I owe him a bacon cheeseburger.
1	Going to relax and watch a movie.  Love to all.....xoxox  Goodnight
1	Going to Relay for Life around 7 to perform a few songs from Zombie Prom :\ Then KIMS!
0	Going to Relay movie, then drivers ed, damn 
0	Going to REtake my Softball photo because Patrick's Studio is a piece of shit. Back here for chores. Some Friday, huh? 
0	going to return the sims 3 game since i cant play it on my computer
0	going to revise biology
0	Going to revise some more
1	Going to Rite Aid to get some chocolate cherries and other stuff.
1	Going to rite aid to wander aimlessly around for no reason.
1	Going to Roche for a few days, gonna try out the DFA. break in the Cobb some more and tug some gums. 
1	Going to Rochester, very nice weather today 
1	going to ronaaaaaaaaaaaaaaaaaaaaa
1	Going to run some errands with my hubby
1	Going to run, then lift a bit, then shop 
0	Going to Ruth's Diner #SLC for breffus - for the last time  http://www.ruthsdiner.com/
0	Going to RYLA now, well, actually, tomorrow, but still. I'm excited, even though i shall have no contact for approx 5 days 
1	Going to SAC!!
1	Going to sail today with my project team, very nice I think 
0	Feeling really guilty about the cheese sticks i just ate
0	feeling really ill
0	feeling really ill today  Just want to crawl back into bed....not a chance.
1	feeling really jaded, another huge saturday night, need to start drinking sensibly. 
0	Feeling really lousy    off to bed!!  Hopefully this cold will be better by tomorrow!?  Goodnight Twitterland!!  Sweet Dreams!
0	Feeling really low. The lowest I've been in a long time
0	Feeling really miserable, wishing I was at home 
0	Feeling really out of sorts. Hopefully a good night's sleep will help. A phone call from a certain person wouldn't hurt either.
0	Feeling really sad! No MIC Library, no canteen samosa, no article 19 room and no TMJ  But every one has to go and even I shall move on!
0	feeling really sick  watching the fifth element, and about to smoke a cigg. ugh i hate colds!
0	feeling really sick like ugh I feel like im gonna die..  this suxz!!
0	feeling really sick now!! tooo full, my moms roast dinners are killing me 
0	Feeling really sick. Not sure as to why but hopefully I'll feel better when I wake up.
0	Feeling really stuffy + depressed at the moment. Stupid cold  Won't be able to sleep at all.
0	feeling really stupid
0	Feeling really tired
1	Feeling refresh cos I just had a bath!
0	Feeling refresh gonna hit the sack in a bit. But the weather is so HOT! Weekend's over too soon..yes?
1	feeling refreshed after a Hot coffee
0	feeling restless. I want a job.
0	Feeling rough... Hate that its the last day of my holiday
0	Feeling rough... sore throat and a temperature  Watching episodes of the dog whisperer huddled up on the sofa
0	feeling rubbish today
0	Feeling rushed this morning...soooo sadi couldn't make the braid hair do work this morning  ah well! Commuting time. Need some good tunes
0	Feeling sad about my last day in Toronto.
0	Feeling sad and depressed  What a crappy feeling! Its going to be a long night!
0	Feeling sad and lonely since I have not heard from my baby.
0	feeling sad and want to give rachel a hug
0	feeling sad and wishing i was at home instead of work  xx
0	Feeling sad at the moment
0	Feeling sad because Nick has to stay behind though
0	Feeling sad for selling my Corsa  But I think I`ll have the same fun with Punto though...
0	Feeling sad for those who have lost relatives and friends in the missing French plane
0	Feeling sad now
0	Feeling sad right now......
0	Feeling sad that #TCM channel is not available in regular cable package in Chicago. Have to pay additional. I'm gonna miss it badly
0	feeling sad...my 8yr old son just found out 2nite that santa claus, the easter bunny & toothfairy aren't real... 
0	feeling sad/tired. likes I'm too mean  I can't do "nice". ughhhh
0	Feeling sentimental and missing my grandpa.  He'd have loved to see all of the little kids playing together.  Not the same w/out him.
0	Feeling severely under the weather
1	Guten morgen twitters! I've gotta take a shower and do some homework! Egad! Oh, and it's really cold. So I'm gonna chill here a bit. 
1	gutom..  di na!!! so full... lol... good evening everyone!!!
0	Gutted about arsenal result...especially as other half a chelsea fan
0	gutted about no getting a kaysab ticket  ah well!
0	Gutted about not being able to see my baby's at party in the park
0	Gutted about US Open!! I got In frum Golf today, after playin like a legend, ready to watch it and its hammerd it down!!  x
0	Gutted at the weather forecast for seeing Oasis on Sunday, rain & 10 degC 
0	gutted everton lost today
0	gutted hatton lost!!!
0	gutted i cant go out on tuesday nite  sucks....... could have had a right good nite out
1	Gutted I can't make it to #FOWA Bristol today - will be following the hash tag though, so it's like I'm almost there! 
0	gutted i cant manage little italy's tonight  but i fear i would see it again if i went...feeling like shite right now.
0	gutted i missed live on blogtv last night
0	Gutted I missed my dad flying over the hills of Lancaster - I'm there in spirit
0	gutted i need to cancel on my dad tonight  been so long so i saw him.
0	Gutted I was sick last night  I slept like 14 hours!!! So why do I still have huge bags under my eyes eh? That sucks...
0	Gutted I'll have to leave my Wii behind  Only had it four months! Boo hiss *throws rotten tomatoes and cabbage*
0	Gutted I'm not on the way to Glasto. Feel somewhat lost
0	gutted in 2 days the series of supernatural finnishes  gonna cry.
0	gutted Margret is leaving the apprentice
0	gutted not to be at mcfly today. and for not seeing my best friend on her birthday. and to have the biggest amount of coursework to do D:
0	Gutted That ii Can't Go See The Script  Exams Getting In The Way :\
0	Gutted that I'm moving out of service area, crappy resold BT connection here I come 
0	gutted that Nadal pulled out of Wimbledon!   won't be the same without him! hes the best!
0	gutted that our trip to london NEVER happened. maybe another time ...
0	gutted that shipwrecked is finished! aha.  need to do college work  wanna go out instead though! =/
0	Gutted that the bathroom still isn't free- early work isn't going to happen  . And I need the loo!
0	Gutted that we didn't win last week's pitch.
0	Gutted the sims 3 doesnt work on my computer
0	gutted UKTV food is off for the night
0	GUTTED!  Accidentally recycled this month's before I was even halfway done with it
0	gutted! mcfly + jonas on one stage  stupid effing exams.
0	gutted, I've had to remove my eyebrow ring, infection has set in after my unsuccessful attempt to remove it at the hospital 
0	gutted, out on bubble after 10 on river!!! 
0	gutted. I was about to hand 2 assignements to find out my memory stick broke. So here i am starting from scratch!
0	Gutted. The kitchen is empty literally EMPTY. No even kidding. I'm so hungry
0	Gutted... Tess was on at Old Vic but I missed it
1	Going to sake with kels
1	going to sakura-matsuri w/catherine&elizabeth
1	Going to Salford to see SophieSuds and EllaBella
1	Going to salon 808 for my hair consultation.
1	going to salvation army. i heard they sell clothes and accessories there for cheap. gonna check it out.
1	Going to San Antonio for the weekend
1	Going to San Francisco for the fun of it.
1	going to saras house to visit her and the baby!!  yayay
0	Going to Savannah this weekend to pick up my sister! I'm taking suggestions of great driving music - I'm running short these days
0	Going to say bye to Dave he's headed back to New zeland tmw.
0	going to say goodbye to CP
0	going to school  hahaha is soooo damn boring
0	going to school  havent done my homework.
0	going to school  only like 10 more days left!
0	Going to school  the social anxiety is kicking in.
0	going to school  wish i could stay at home today,it's so cold, i'm freezing  xx
1	Going to school ('aa) I have 2 hours and then i go to home again, 
1	Going to school =[ I'm actually not so tired today tho
1	going to school bye
0	Going to school for my french exam... tired, hungry and cold... bad times 
0	going to school in 5 minutes
0	Going to school in 6 mins  double biology lesson today i think id rather die :|  Well anyways See ya laterssss (: xoxo
0	going to school in a few. my elbow still hurts and my mom said i cudda died.  textme?!
1	going to school in pajamassss.   i rreeeaaallyy needa catch up on my sleeeep!
