1	very cool roxanne! thanks for the link
0	I was there for a while.... haha... my fellows left so had to go  and I felt a bit sickies i-D
1	YAY TShirt Hell! I thought they were gone forever.
0	I have to stay up to finish my paper too
0	well maybe if you invited me today i would have
1	great pics you have done for loaded .. sexy but classy , nice one lol 
1	live a little...have a dog and a cold beer
1	ok i feel bad now so im gonna replyy hii ur entertaining meee  lolol
0	IDK!!!!!!!!!!!!!!!!!!! I'm so sad about that!!!! Remember spending our lunches over there!  the only other 1 is in Miami...
0	i'm not sure... if my foot is better by then... I want to go watch though, but idk if i can since it's far from my house  i
0	Cards  .... but we made up for it with some bonus fun!!  goodnight! xoxo
1	Okay, that works.  aaaand, you guys have Skype chats like, every day now. LOL
0	aww, you must be busy today.  I see no tweets from you!  
1	You could try becoming a Trending Topic?
0	aww I'm sorry you're having a bad night
1	why limit your story to 140 ch. Tell all what is annoying you at www.iamsoannoyed.com ,it will help relieve your stress 
1	Me thinks it's more like chicks-en-hammy  but who cares anyways? Lol. How's the job?
0	oh no i'm really sorry to hear that  you aren't going to be at northmont's show tonight are you?
1	you are right. eric is annoying. but your the one who liked him in the first place
0	 damn. Stupid rumours. Would have been amazing :'(
0	error  hopefully be working later :S
1	i know dw i was confused too
0	ohh :/  novembers toooolonggg
1	ok ill go and check them out now!!
1	sist i have to go to the Work, xhez see ya in the nite 
0	tengo beautiful bad girl, different worlds y when the lights go out, quiero i like it like that 
1	oo ill tell you when i see you
1	yall nigkas ALWAYS hungry  Lord getem some prozac
1	there's lots of people in Moncton using Twitter  There's lots going on, and feel free to ask if you have questions!
1	happy birthday! Take plenty of pics/video so you'll remember what you did later on!
0	I'm so sad no more Roxxi at TNA  I will miss you so much!!
1	 Same here, shed a few even now. How can you not? They saved all of mankind, GOD BLESS AMERICA.    ~Dani~
0	awww  I wish so too!!! I don't like your job. Lol.
0	try adding the /c/a/2009/06/24/BAH118D37E.DTL bit to the end of the url - it broked
0	cause i delete some really great pictures
0	ALL BAD!!! for the homiezzz
1	me love you long time cabernet!!! Haha!!
0	 I think we are one of the few not there tonight.
1	Oooh that's fantastic!  Don't make me too jealous though. Haha. Have fun!
1	 Hi, Thanks for following me, and Congrats on your first tweet! 
1	sure...that's what they all say!
0	thanks 4 the reply. ive bin watching the show ever since it came on n this is the 1st time ive ever heard of this #asylm
0	very bummed out/sad. I just can't take the pain anymore. its worse than anyone knows. idk if it'll ever end & that scares me.
1	Sorry dear. Heather enjoyed the free beer too much. Just answered your message
1	get your dad his favorite old records in CD form or maybe some new dvds  I'm getting mine a new drumhead for his old snare lol
1	Cremorne, it's sunny over here right now 
0	Oh no Roxy!  Sorry to hear he is on strike. L did that about 2 wks before we left FL.. She has been off now sence then.
1	yaaay!! I'm a cashier too!  congrats on the new job!! You're gonna be bringing in the moolah! Lol
1	that is a great song!
1	You need a new hobby. Wanna train for a triathlon with me?
0	you don't remember josiah?  and yes. sucks a lot </3 i feel so bad for him and his family *hugs*
1	YES AND WE ARE ALSO LOVELY! *chest bumps you* And we're...what else? Hmmm. JUST A RAY OF SUNSHINE! YES? LOL!
0	I'm working during the day
0	Reviewing - Was posted on the SIG, it's volunteer. Is RF2 on ps2/wii/pc? If not I can't play it  . But I bet it's fun 
1	thanks!  I got my hair done last weekend...still debating indy
1	my parents live by the new walmart lol. yup yup
0	now it is just complete all lit up. Do you know if there is a reset botton the on/off botton isnt working
0	surprisingly yes! lol. the screen is screwed and the buttons dont work
0	Yes I have! And taking the sim out and cleaning it etc etc. Its toast
0	Will do, last attempt failed again   Oh well, and the funny thing is my housemate works at apple, I must tell him off 
1	LAWL. K WHATEVER YOU ATTENTION WHORE.
1	 thats right Me And will be brown bagging it this week #oscarmayer
1	She just super duper willing to help someone out
0	trying to get husband to give me his MacBook pro, so far ain't going great. 
0	No u never  i need to go though, like tuesday??
0	oh no so young  positive thoughts and prayers to you and all of his loved ones.
1	Whats going in L.A. this wkd besides EVERYTHING?
0	no  it won't play on my phone ! I tried to send it to the Sk, but it didn't send
1	hey, dude could you moderate my comment on code2ave? or just make me a moderator 
1	As well you should be
1	 It is! Nice to realise I'm not the only one with a strange sense of humour.
1	it also keeps the fit tight  I can say thats one workout I dont miss out on!!! Lmao. Im doin it as I twit! Hahaha.
1	me too. i came into work early so i won't feel guilty when i leave these suckers at noon!
1	You are welcome
1	LOL. YES! She already thinks she is. She has all the symptoms.
0	LOL WHATEVA! I WAS SLEEPY BUT I CANT SLEEP NO MOE  SO IN ABOUT A HALF HOUR IMMA TAKE A LONG HOT ASS SHOWER ;-)
0	I was in Morehead today but I didn't  aw, hell.
0	do you know anyone who can get me into sway if I don't have I.d?
1	I love your icon. We are truly.. sexy.
1	that twitter movie was pretty funny hahaha
1	XD so you're a dog shooter. omg AWESOME job  photography and dogs in the same job? SCORE \o/
0	u mean u get to go back at sharp 6pm every day? im jealous
0	I thought so too. The buttons still have prices and not 'installed' which has me nervous. I need to remember which apps r gone
0	Enjoy! Eat a lot of popcorn! Minus the ones that get in your teeth!
0	i can really only hope so...
0	We never seem able to get more than 7
1	Very cool animation  I find the ANCYL more worrying than funny though. The future for SA looks bleak.
1	Sounds like a good friday morning
0	wish i could work that out too, but my eye drops don't seem to be making any difference today 
1	Me either- it sucks lol- How are you love
1	you to- its been a movie weekend for me lol
0	 I'll blink in my most innocent manner and wave my notebook and camera around and hope I'm not lucky enough to be arrested!
0	 aww. too bad i've never seen either. don't kill me!
1	Dave and Andy rock
0	do u mind switching your twitter username with mine ?  please...
0	Already did, we had a 3days holiday from Thursday onward. Which is why we have to come back to work on Sunday 
0	It was fabulous! Think I am gonna miss it badly when I come back to sg.
1	It's more impressive to be there  I was in Taiwan when there were protests against then Pres. Chen...
0	nope not me
0	Yeah, it means that I am doing a six days week this week 
1	that was Boomers in Modesto. We had a good time
1	I will post after the event, I'm quite excited 
0	Hmm, that's pricier than I remember seeing. Only they fly direct though, as far as I know  
0	hahaha. yeah. we tried to go but we r a couple hundred miles away. we didnt make it in time
0	 she's so underrated.
0	P450  Not buying it though.
1	please let me know when they arrive and what is the cost.
1	Ed has announced that the Thirty Day Challenge website will be down until 9pm EST next Monday. So you can not access old files
1	- ahhh good work
0	http://bit.ly/e0ahe      - Out of Stock Still !!!!!!
0	Im still awaiting a phone call for rights to some music
1	Same to you old Friend  ( star wars quote)
0	still sold out so once again i miss brekky  Coffee will have to do
0	looks like it maybe noon in New York time. Long wait for me then
1	yes...it's a really nice song...I love it  && yes lol...they sure do!
1	Thanks so much!
0	babes i notice you are not following our pedo friend justin
1	fan of faithless! However I don't mind a bit of Lawrence. Am a fan of classic literature on the quiet
1	keep it up  hard slog but will be worth it in the end
0	me too - dull day today
0	 ,... *hugs*
1	lol. yea  why so long?
1	yuppp  are you?
0	 acts like he invented the photo...geez  hahahaha...he wishes he was that genious!
0	 i thought you were coming todayyy! haha shit. appaz everyone did not that great so meh, over school. will you be coming tomoz?
1	no r�dio agora I knew I loved you before I met you I think I dreamed you into life...
1	feel better doll... 3 days till you touch down in my city... I hope you are ready! 3 olives and all
1	It's close and it's fun to travel just 'cause
0	haha i havnt seen that for ages so i wouldnt know
1	You silly bunny - email/skype me and I'll help you.
1	Thanks for the insight. Sounds kind of fun
1	Sometimes it's better for your texts to get deleted.. It makes room for new memories  Holding onto things can get messy.
0	I am sitting here with the whole world at my finger tips and cant think of anything to do...lol.. thats sad
0	okay..bit bored. everyone is busy!
0	Some get really irate too! But they don't mind do they? I'd hate to think they do.
0	nothing still hurting irl
0	oh no! *i've said the wrong thing and takes it back* i'm so sorry...
0	i want nipple swirls!! i don't even have boobs..i'm a fucking hood..
1	I believe so- but I am just enjoying your special brand of humor this evening!
1	lol it's ok..  I am just getting tired I LOVE YOU HOODIE!
1	Please explain that one to me
1	well...hehe over night!  I feel so much better..thanks for the power of the hood!
1	What happened today?  I`m interested.
1	why am I your friend?
0	.... Yup we slept already ) Haha! We left you!  oh and twitter buddy!!! Suuure! :>
0	Lucky I'm in love with my Best Friend ~Jason Mraz, his fave singer  daang
0	SHAKA :O Are you kidding me?  I pray for you and your dad, don't worry 
0	Yup I'll be responsible! No skipping! :> Nope, no interesting clubs 
1	Hello? What about me? I had pizza night folks. Come on. Who cares what got up to?
1	haha thanks
1	http://moo.com - That's where I got mine, or as they're also called, calling cards. 
1	she's sleeping in!  having milo & sticky rice for brekky
0	fight tonight
0	my spanish aren't that good  I know MGS Rising is probably multiformat but I still haven't found any official confirmation. #e3
1	Thanks!  It's not until Sunday but i'm starting early!
0	agreeeed. Miss you
1	Good luck to all of the RPM drivers tomorrow night!!
0	I am now depressed by your recent tweet
0	"I'm just a big, hard tool" from No Good TV lol I have another one, but it's to long 
1	dont u worry.. working perfectly
1	a dell latitude e6400, c2d 2,4ghz, 4gb ram, 9cell battery 
1	why limit your story to 140 ch. Tell all what is annoying you at www.iamsoannoyed.com
1	i use Nike+ to auto-twitter my runs  yeah, theres *alot* of sites out there to map runs. Will check out mapmyfitness.
0	I clicked on the Check out pictures of Angelina and it went to a spam site about ordering checks .. go figure
0	I clicked on you by accident, I'm so sorry, and embarassed 
0	would love to take my boarders, but have to have one adult per 3 children and CRB checked 
0	Hey I texted you but you never responded. We stopped at a friend's & ended up staying.
1	aww awesome! glad they are going good  woop! its on the 11th right?. yeh Im all good thank you and yourself?
1	Oh yeah....my bad. Like, Massachusetts and Pennsylvania and those states up there 
0	no. hungry for food!!!! lol
0	Man, that sucks, Nizar and I won't be in town.   Do you want to stay at my place?
1	don't worry, I'm coming to bring you home in less than a month 
0	Nah, he died 3 weeks ago today  And again, NKOTB is a great distraction!
0	haha forrest is ragin at me for makin him watch jon n kate,,hes not speakin to me now  (tear)(tear) haha bye bye lady tweet lata
0	LuCky!! I want some chinese food!!
1	Hi! Im a fan of downhere & i c ur name a lot on their page so i presume ure a fan 2!  So what other Christian music do u like?
1	good luck, babe! am i invited? 
1	yeah it was ab too and u popped up  how u doing?
1	Too late, already ate!   Well, there's TONS of leftovers though, a 5lb brisket goes a long way (like 9 more meals!) 
1	riiiiiiiicky i dont want to go to work tomorrow haha see ya
0	I was the only person at Apple WWDC without an iPhone so my only choice is Twibble
0	yeah, mine is caused by bacterium, so it comes back once in a while 
1	go wings   (i'm on the abp train at the moment ;)
1	blame on Holly, little sock-devil 
0	where a my invite to the white party I'm mad at u know
0	the show is all sold out  would you want to go with me to another awesome show on the 12th?
1	cutting back on wine??!!
0	haven't gone yet but I hear it is a blast! Alas, I'm offline for fun this weekend. 
0	tell me about it. landed in flip flops yesterday  guess I forgot I was coming to Germany  sooo cold
1	They didn't like my Benmont necklace that Lesa got me ='( (which broke...) I could handle being Emilu, but I like Em bettah. 
1	Tom Petty and the Heartbreakers have my eternal love. Benjamin.  ????????????????????????????????????????????????????????????
0	that was a good strikeout.  I think I'm letting my international law frustration take over
0	aw im sorry!    wheres he goin?
0	sorry im in same boat but i decided 2 clean bad idea  i got hurt during mrh & i didnt know
1	That is wonderful news!
1	Good morning how are you
0	I SHOULD HAVE BEEN OUT WHERE U AT I DIDNT GO OUT TONIGHT..
1	ROFLMAO!! "friend" huh?? suuuuuure you will.
1	Send me an address and I'll see what I can do about testing that.
1	Oooooh how sweet ... he calls you "sonny" ....  ... you can expect anyone to follow you on twitter ... it happen to me LOOOL
1	found you, think im getting slightly addicted 
1	Ha! Thanks. All facts to help me win a million if I ever get a shot at Jeopardy.
1	of course! enter away
0	Sadly no.  Was at production the whole day.
1	Being in paradise is apparently creating some sort of distorted sense of reality in your brain. Go Magic!!!
1	Hey! I'm good, just woke up. You? 
1	Yes I am.  Too much twitter for me. I'm out.
0	 So sad. We need to have a drink in his honor.
0	When I asked my Mom she started yelling at me  And I'm not even doing anything today, it's fucking gay.
1	I'm just cranky!
0	car woes seem to be a feature of this monday morning - i woke up to a flat tyre
0	I was meaning to ask - what would you say is the best firmware version for the 7970 with asterisk/trixbox? I'm still on 8.0.2
1	I have 2,000 to sort out, if you're bored... 
1	i'd need to know what it does first
1	I dont think I've seen you in like, a week. &Lost is amazing btw. Yeah I wonder what the new powers will be then. I'm excited 
1	I was mostly just interested in what he did, I saw him chanting and holding the lady's hands...just curious that's all 
0	Flat rate is nice...buying individually eats up so much money!
1	Thanks for the warning
0	Yeah, being a cheapo isn't always what its cracked up to be lol I haven't seen Watchmen but I wanted to 
0	I don't think it's the flu, just sinus issues I guess. Ugh. I'm sorry to hear about your co-worker. 
1	You should get one of those cigarette holders and not smoke with *style*.  http://is.gd/N64c
0	what is IR Pete saying about maple syrup in tuesdays comic?  i just can't work it out. 
1	You can also play Tongits on your PC or Mac. Download the game from http://www.tongits.net, enjoy! 
1	take one! Lol drive down to hu next weekend and visit me  I'm going to summer school. we still gota hng out this summer.
0	Google Reader seems to be down too.
0	Thanks! the problem is I checked for the latest version of flash and it was installed...
1	trade ya  I'm running out of Netflix instant watch movies
1	Because you want to be ridiculed and harangued?
0	i can't go to honpa  i think....
0	I was so traumatized after witnessing an almost beheaded girl
0	im not at litle oven tonight
1	retirement in less than 10 years?! Lucky! U deserve it though! Hang in there!
0	Shucks! We'll miss you at the bon dance.   Hope you can attend the ones after that.
1	Sweet Dreams!
1	hahaha  I'm ready for anything! Kobe's the bomb! is just the second.LMAO
1	Vacation Tweet by aseponde: Hi - Thanks for adding me  If you are looking for small biz idea, this blog might interest you - ...
1	that's still really impressive. You could spend a few hours chasing those last few seconds.
1	Thanks man, we'll adjust it to not suck. 
1	This isn't quite the generic ebook reader I imagined from Asus, but it's a start   http://bit.ly/tYKCM
0	My life currently consists of searching for a job with no avail  how about you, how's life?
1	Better than good. You're awesome!
1	Good morning (well.... afternoon here) Ron
1	To which the answer is, apparently, yes  Nicely blipped
0	don't you hate that? My muscles are starting to act up from running I think my diet is a little off
1	happy birthday
0	completely agree! So many great sessions, just can't make it to all of them 
0	I won't make it (even though I paid). Had to go to a bday party.
1	git clone http://twitter.com/rtmfd/rtmfd.git is working for me. Not sure what your problem is.
1	Thanks for the reply (Case 2565). Job done
1	finally enjoying Friday, I hope  Have a happy weekend! 
0	First pizza... and then tacos.. you, have made me jealous 
1	 shhhh...no one has figured it out yet
1	LOL. Dragon*Con folks can definitely be freaky, but they're a good kind of freaky. I might even dress up this year myself. 
0	The photos of cadaverous (http://cli.gs/WqtsX7) people at http://millionsofmouths.com/info.html are heart wrenching.  How can we all help?
0	The photos of my Dream Boy with his ex irritate me, make me jealous, bad mood and it will be "/ Argh, that anger, it does not deserve it 
1	The photoshoot is going very well today
1	the pianist at mayfair is playing augustana
1	the pic can be how ever you want it to be . face n cleavage..just face. whatever you feel comfy with doing ..   i
0	the pic is of me in phily usa last october - going back nxt june  wish it was sooner
0	The picnic is off  my friends cant make it
0	The pics were so clear. Shd have used it on the NZ vs Aus Test Match  Anyways the seats were too far to take upclose shots.
0	the picture thing on here don't be work
0	the picture wont upload  it says it is to big, even though I croped and croped it...help!!
1	The pictures are up from our End of Season party! Well done everyone, what a great night it was. Looking forward to beach training soon 
0	the pied piper is in Africa n the only thing i can do is wish i could go!!!!
0	The pigeon we rescued last week died today
0	The pigeon... didn't make it  RIP pigeon.
1	THE PIGEONS ARE ALIVEEE!!! ...and eating my garden...but at least I don't have two dead birds to deal with! ..I'll let them eat!
0	The pilot light on the right side of our gas oven is off... I don't smell any gas though. WTF do I do?? Do I re-light it?! HELP
1	The pilot said he might come work here for a while  Weeee.
0	The pink didn't take so well...grrr!! I'm going to touch it up with purple.
0	The Pinkpop photos are gone  it was still fun though!
0	The place I wish I was is not the place I need to be but I still wish I was there.. whoz with me ? !! Ughhhhhhh
0	the plan for today: and I are going to see a movie, then have dinner and watch twilight. its our last weekend together!! 
1	The plan was to go to mamitas beach at #playadelcarmen. I just woke up. Yesterday I got drunk (8) tequila tequila (8) and came back 4am
1	The plants & trees speak tome & tell me of their plans. I walk with one foot in both worlds...steady as I can ~ Me
0	the play is over  it was so much fun!!
1	The Play was a Success  YAY!!! Can't wait to start the new project!!
0	The plugins page in WP 2.8 is a bit of a mess compared to the previous versions. The layout in 2.7 was perfect. Strange move backwards
0	the plumber is late
1	the PM has been sent
1	the podcast is on INDEFINATE HIATUS until further notice! Check this entry out to learn more  http://tinyurl.com/pd9l8s
0	the podcasts don't want to go on the cd's  but i AM done with all the cd's! WINNN.
1	the poetry event was a success. I don't think I ever really thought that my poetry could connect with others. heartache is universal
0	the Pokemon items "wide lens" & zoom lens" make me happy  *photography geek*
0	The polar bear exhibit is still closed?   Why do I feel the need to express my every random thought on twitter?Im aware that no one cares.
1	'The police are here' 'How many?' 'All of them'
0	the pollen is getting rediculous; it looks like it is snowing outside and i can't breath. i wish i lived at the beach instead
0	the pollen is not my friend today. sleeves full of tissues and red puffy eyes is NOT a good look
0	The pool heater is broken
0	The pool is much more enjoyable the fewer people are at it
0	The pool was closed
0	the pool was fun, but now its time for more homework 
0	the pool was great, but i can't find my specs...   
0	the poor  spartans
0	The poor boyfriend has Hepatitis A
0	the poor Gosselin kids have to go through all this drama.
0	the poor kinsella family
0	the poreclain princess got too much sun  http://sml.vg/hiQmVm
1	The position of the sun combined with my lounge window being wide open alllows for me getting a tan on my sofa before work
0	the possibility of missing out on blink & weezer is kinda making me blue...
0	The post office people weren't very nice. They weren't mean, they just weren't very nice. 
1	The Potbelleez, Lady GaGa and Blumchen. I approve! 
0	The Power booats are out racing again  Looks like the Year of Damp F1!!!
0	The power just went out!
1	The power just went out! The whole neighborhood is in the dark. It's kinda romantic with candles! Give thanks at all times
1	The power of Twitter - I'd have absolutely no idea it was Mother's Day today (in the States) otherwise  Shall treat mother to lovely meal.
0	the power went out at our campsite. JASON IS GONNA GET US!
0	The power went out! I'm SO SICK of the rain ugh
0	The power will be out til 8:15. And all I wanted to do was come home and watch House.
1	the power's back  - have replied to an email  - will leave for a drop at 2 :00 to reach the destination at around 2:30
1	THE PPL T-MOBiLE ARE ALWAYS SO NiCE && THEY ALWAYS FiX ANY PROBLEMS PROMPTLY.
0	The Pre is finally out!  I wish i could get one
0	the pre really isn't good for podcasts unfortunately, i don't want to start at the beginning each time, and i want aac chapters  ;)
1	The premiere is greeeat it's half break I think everyone likes it  I'm so lucky Yeeeah
0	The presentation theme is taking sooooo long
1	the presets was amazingg
0	THE PRESETS WERE AMAAZING! Definitely a recommendation to see them live! Fucking awesome. Currently deaf in my right ear
0	The president is being tested and he's failing
1	The president's limo just arrived!
1	The previous tweet was courtesy
1	The Princess Bride on right now on ABC Family.  #S7S
0	The prob workin n a studio is if no one 2 shoot, u get sent home early.. Boooo, only an hour but y can't I hang out still!!! Arg 
1	the problem is that I _love_ to do everything myself
0	The problem seems to be fog at Barcelona. But flights are leaving for other destinations with much less delay!
0	The problem with apple juice in a carton is, if you don't mention it's cloudy apple juice and I buy it on false pretenses, I get upset... 
0	the problem with my antiglare glasses is that i can no longer oogle at women behind me
0	The problem with open plan coffee shops and eateries is that none of them have plug sockets
0	the problem with sleeping with the window's open? Something is in the woods alternately screaching and cooing. Woke me up
0	the process of cleaning my rooms.. is taking a lifetimee.. anddd i dont feel well
1	The Prodigy Tonight! Stoked!  Oh, Burnt Bagels Are The Way Forward!
1	The production went into rehearsals last week - the cast enjoyed a sunny start to rehearsing the production here in Dublin
0	The Profile image is NOT tete's birthday cake... sorry
0	The prom at whatever club Ivar is now looks off the hook.
0	the prom wasn't good...
0	the promotion was awesome!!!!!!!!i loved it.but now i hear ringing in my ear.yikes.im gonna miss all my friends not going to rb
0	The Proposal isn't going to be in our theater
0	the prospect of exams and a BGT figure near 20m has worked its magic. Im sufficiently depressed now
0	The PSN is giving me trouble. What happened
0	The PSP lineup for '09 is looking pretty solid, i might have to pick one up... But the Go is too far away 
0	The Pub...prices are high...but it could be worse...i could be working  sorry dad, this ones for you.
0	the puppies are crying and trying to trick me into setting them free!!!
1	The puppies have their eyes open!!!!!
1	The puppy is asking for a nap.  I must obey.
0	The pups are up. Duck goes home with pops today & Denka goes home with Aunt Kristi
0	The pups have finally calmed down -- just in time for Dottie to leave!
0	The Purple Turtle was VERY dark last night. I got some good videos of the bands but they are a bit dingy  Will upload later.
0	The Pursuit of Happyness has to be the saddest movie ever  It's amazing though.
1	The puzzle is nearly complete, all thats left is the real truth 
0	The Pyro and a firefighter are completely not the same thing at all
0	The P'Zone was not as good as I thought it would be, and I had to walk a half a mile to pick it up  Bummer.
0	The queue at the supermarket is huuuuge!
1	the race absolutly sucked - dont bother, michigan! gordon #2 
1	The race is about to start! I'm so excited!
1	The race was awesome!  finally saw jimmie win one in person!
1	the race will start in a few minutes, so I'm off 
1	The Radio 1 Chart Show have done the number one reveal and finished the chart with 15 minutes to spare, mega cringe at the time killing! 
1	The radio can be very, very good 
