0	And if yu call me your friend,wont you always be there for me?? 
1	And Iï¿½m going see  again..I have not anything better to do this evening
0	And I'll feel my world crumbling, I'll feel my life crumbling I'll feel my soul crumbling away And falling away, Falling away with you 
1	And I'm a dork.
0	and i'm a whole hour early..wtf!
1	and Im almost done 8th grade! Just got my math exam tomorrow, and IM FREEEEE. 
0	and I'm also sad as hell that someone's daughter got shot in the face in the parking lot tonight!  damn ppl r ignorant!  tear
1	And i'm an idiot... shocking i know. at least i have homemade brownies to make things better
0	and I'm awake. going to be a little sad saying goodbye to everyone today
1	And I'm doing this all over again tomorrow
0	AND I'm dreading Monday's race... I definitely won't be matching my 1 hour 12 mins record again!!!!
0	and im feeling gooooooooood! muhah cant wait for the Lewis Vs Cuzzy forfeit :') Hahahahhah!! I have a cold  Bad timessss
0	And I'm free!!!!....until tomorrow
1	And im gona upload a new picture. A stamp, my picture in it. 
1	AND im gonna try to see UP tonight because i am a 12 yr old. What, you didnt know? 
1	And I'm in the best mood
0	And I'm kinda over the fact that twitter ate my picture
0	And I'm learning for a test! It's so boring!!
1	And I'm listening to "Wrong" by Depeche Mode.
1	And I'm listening to Happiness.
0	and I'm mad at my man!!  but I'm  a get the liquor flowing 2 wash away the madness well get back later hearts & kisses
1	its funny isn't it
1	Thanks for the feedback
1	another choclate spa??? sounds yummy
1	no - just bored
1	yes that's all well and good but what are you having for your tea?us twits need to know
1	Watching u on This Morning, really amazing what u did 
1	We homeschool and have a variety of activities during the summer.  Camps, fun classes, etc.  Learning doesn't stop for summer 
1	oic   Is nate still there?
1	My Pleasure
1	Ooooooh. I'll sure keep that in mind. Thanks for the offer
1	how great would it be just to not have to go to work and play in the garden?
0	...Good Morning...missed u this weekend
0	Forgot the white part.Was gonna make SS shirts up,IDK .Chicago,Detroit,Cinci aren't looking good mybe just NY/NJ shows 
0	I have failed the challenge  Sorry! How do these other stupid topics get over there? ------------>I have been crazy busy
0	a mis padreeees :@
1	*love love love you all*
1	LUV what U do! Am now following & recommend 2ALL! Hugs back!
1	this is a twit hug back!
1	hey babe! got some info on pride so i'll send you my # on myspace k? hit me up when u can
1	Lol - curry .. cuppa tea ... glass of merlot .... a free doggie ... I'm happy to negotiate
1	hey! what's up?
1	I didn't forget, I remember ur face clearly from last time 
1	Good morning!  And welcome back.
0	ahhh, what is your link? hope i followed you back  yesss we do! do you have any others? i'll try using one of those websites :p
1	http://twitpic.com/6o501 - I would do that to you.  who wouldn't want to do that to you. You're too adorable. Sorry if ...
1	I'd love Yasmina to take it
1	haha, you are funny def big brother (via << we do try 
0	it's been great! you always tweet what I have been thinking, will be sad after sunday when it's finifshed 
1	Kate to win as she prettier than yasmina despite having wonky lips
1	en2jp The "King of Twitterverse" is Would anyone refute on that? hahaha  (via
0	hi guys! just got your awesome background! But can't get my pics to show in whole, just a part  help!
0	my background is not working  I've treide the save changes and only the colors change...
1	lavender and darkness works for me hun, sunglasses worn whilst working at the computer! 
1	 Thank you so very much! Have a great evening and its nice to meet you!
1	 how to go to work happy    http://twitpic.com/7i0v3 - Very funny
0	I still have to get that.  The demo kicks serious ass so I can only imagine how the full version is
0	Critical mass the bike thing? It was quite popular  last yr and is getting to be again, fountains 1730 last Friday. My bike broke 
1	aah i shall direct message you it  i dont think i have yours either
1	serbian zobbo serbian  they are quite larger breed than are ones. U do have too much free time on your hands
1	sure...what's up?
0	Grossss  hes ruining perfectly good pizza roooooolllllss and imma miss you when you is up north fag, hang out in a week?
1	Haha yes I do  it's hard work, too! I didn't get home until 3:00 AM, not like I sleep haha.
0	I'm concerned for that family
1	lol I'm gonna be having sooo many house parties. This house is freakin huge no joke ahahha. Your first on my list!
1	The cast of True Blood was there
0	well the dog attacking me was a little exaggerated, it was more of a tackle and then jumping at me. Bike is gone 
1	I'd buy you scampi when we next have lunch  x
1	yayaya candy! congrats, as a fan that game was AMAZING...and worth staying in on a Friday to watch! 
1	I don't blame you! Your son and his safety, is way more important! Have sun in San Diego! 
1	But first you gotta know what makes you happy!
0	yeaah it was alright, had 2 exams though  you? xxx
1	Oh - I hadn't seen GLBT bookshelf before - looks like a great resource for finding new books to enjoy
0	fields closed too but it sucks cos we have a meeting n i cant get there  argh!
1	I hope your chat went well. You are an amazingly talented and inspiring actress and I can't wait to see more of your work!
1	a good ole irish fry!!  haha
0	my god a full box? where are mine?
0	oh yummmmm! so envious!! i really wanna get some ice cream now!!! only got vanilla no choccy
1	Welcome to Twitter!
0	I had to dash to catch my train the other night  so sorry I could stay and say bye - did anything happen after "guess the phrase"?
0	Ahh, that's good. I'm glad! I'm good. Aside from my iPod broke earlier tonight. 
0	There's been really heavy rain here, had it in my bag. Was out in the rain. Rain soaked through bag, got to iPod. 
1	the one off of bgt  which jackson did you seeeee?! ;o
1	GOT HER BEADS IN THE MAIL!!! THEY ARE SO AWESOME  THANK YOU SO MUCH!!!
1	lol yup  is that a tad weird?
0	omh me 2 D: ill be on later i have to go now
0	i'm sry.  i hate the dentist too.
1	Good morning!  Everything you make sounds so fabulous and looks SO great on your website http://www.zoebakes.com --Henri's cake!
0	In Long Beach from 19th-24th let me know if u want 2 do something. Iz will be staying with her daddy LOl she already told me
0	awww thats no good
1	Love the "cello cave!" I saw you at Convergence 13 and am glad to find you have a Twitter. Keep on being awesome.
1	My friend Adam told me to ask you if you are still enjoying the button bracelet he gave you in Salt Lake!
1	Not the dreaded cat lady...it's AWESOME that you take the time and effort to do that!
0	We will.  I am still trying to talk her into coming down on Thursday to see your show but she likes her sleep to much
1	wow thats amazing!
1	Yay!! You can find Molly at on Twitter if you haven't already
0	I want a Chinese now  Damn my lazyness!
0	 Next time... I'll message you my number bb
0	awww sad face
1	shes all i want, and ive waited so long! 
0	Dali was amazing. 200 works in one place - shame it's not travelling to brisvegas  how was davinci?
1	lucky!!!  haha is that waitor guy there??
1	Morning Sweetheart, how are you today? Crackin weather 
1	it was just true  and you do cause me to having dirty thoughts lol well also some other dude, huh? ;) xoxo
1	he'll love us once he recognizes us  and we'll be best friends : D if we're irresistible to Joey he'll love us even more!!
1	haha, that's exactly how I am feeling too lol I hated her and this made me like her  but I won't forgive her for x factor.
0	haha, well yeah this makes her so much nicer  argh I wish I could vote  lol
0	I want it!!!!  He won't reply to me though I'm in the US.
1	story of my life
1	 Glad you like that? Lol
1	warm soup will make ya feel better.  hope it helps
0	Happy Birthday Zoe!!!  sorry for wishing u this late.. sorry..
0	Oh really? Dang I really want the paper.
1	 I found it  you know when you hear that http://bit.ly/MkDsH
0	$16 delivery fee for George Hincapie DVD? Is he delivering it himself? Was thinking of getting it, but $46, sigh. 
1	So, did those pictures of dirty sexy libraries get you all hot and bothered? 
1	His pill-swallowing technique in The Professional was terrific  Too bad he hasn't done much lately (I don't count Harry Potter)
1	lol yur welcome!
0	I do, but I don't have any of my work available to put online right now as it's all in storage since we're moving soon 
1	Arghhhh fine, after school detentions arnt that appealing to me :p shall start it after shower  god, its gonna take all . ..
1	LOL :p you know me too well, i didnt do it aha  oh well :] need to get some new music for holls  gonna write a list :p xx
0	 hope u r nt so sickly nw. My precious dog is dwn wif demodex  n gotta b on medication for dunno hw long.
1	Oatmeal shampoo is gd for ur coat n skin darling.  *sayang sayang*
0	No kidding. Blood is not thicker than water. Lesson learned, I guess. 
0	 *cuddles*
0	 *huggle* I'm sowwy
0	wut is wrong
1	; the transition was only made because of twitter  opera was good while it lasted.
0	no I couldn't  wasn't allowed, bad times  xx
1	absolutely! the more aware you are the better choices you make
1	Oh what a cute site! Love it! 
1	including mine I hope!
1	Infuckingdeed. And July. And August. And September. Every month until our weather is parallel. How's that?
1	Healthwise better, was bit down earlier as day gone badly. Trying to get myself up for weekend. *here's some coffee & toast* 
1	LOL, as long as you don't get response "Twitter?  Computer? What dat?" -as they wouldn't be very promising at all 
0	Uh-oh, sounds like I opened my mouth re hashtag & stuffed my foot in it... Sorry all.... 
1	Obviously, it's an all-expense-paid invite  That's just a little something called the Aloha Spirit ;)
1	lol i know. I'm jealous his thighs are soooo nice lol
1	I hope your camping gets happier! Er, not what you meant... huh? Sorry to hear that. Take care and rest well though. 
1	I was just saying you're biting off of drakes song bad meanin good that's All
1	 I'll post some more pics on the Ellen forum later today I think..I made like 80 pics yesterday LOL (I won't post em all) ;)
1	 unneeded oil in a cup and it was like 20 cm away...the cover and the alarm saved our lives
0	it's so hard to study thatt!
0	no prob. how was the party? i wish i was there
0	nope, didnt do that. But everybody around me is experiencing the powerdrops in Mac. Think it's update related... 
1	I'm still late for meetings from 2007
1	LOL  Yeah! I did work the weekend afterall!
1	Personal choice. On a health kick
0	Oh no  At least you're a girl now and can do awesome things like have boobs
0	That's sounds like so much fun! Have a smore for me, because I'll be here writing another paper 
1	of course you follow!
1	Yup  I'm working on finishing a blogging system in the meantime  It's 2:30 AM here, and I'm coding!
0	LOL at peers/nin thing and restaurant city  as well lol
0	oo that's whatz up....I'm about start gettin ready for work
0	I can't be the only one though yall
1	lets agress to disagree I Won this!
1	ummm yea hehe
1	Well, do you have a girlfriend?? You can cuddle on the sofa with her 
0	You didn't get it. Hint: Saudi Arabia
0	awe  I'll talk to him if you want?
1	LOVE The Muppet Burlesque Show. Thanks for the link. Gold!
1	aww  what does she do?
0	awwww  even with kristen there?
0	i'm not as husband does not like it
1	 Ah, te good old days when music made sense 
0	eeeiiiiish. greasy breakfast. Ian nearly died last night!massive car accident.his dome is all gashed up.i feel responsible.
1	Aw. You'll get to go sometime. Just remember, it's always going to be on the last Thursday of every month. 
0	Having the links down the side instead of along the top is epic fail IMHO
1	i appoint you my representative
0	I'm going to be in LA on Tuesday
0	this is reddog187 I've been blocked from following  on this account
0	I don't like barely talking to you during the day.
0	no blackberry love?  http://myloc.me/2bxt
0	JERKFACE! She must like you better  I think is cause I don't have a husband and 8 kids yet.
1	lots of shoes is NOT a problem!!
0	I didn't see anything
1	WOOOOO. GO SHELBY! Congratulations
1	sweet dreams to you toooo
0	That seems to be everywhere right now. It's only 34 here. It was 50 last week
0	That sucks. Everyone is effected somehow during these economic times.
0	Hahah, I'm definitely with you there, Adam.  I actually fell asleep watching the first one. Please write hollywood scripts 
0	nope not this time I'm afraid  hope puts have a good time though xx
1	Wish it had a flip out viewfinder but other than that its great thanks
1	haha blue harvest was awesome, and you're insane for beating it again today!  That rules though 
0	 Nick, you're making me hungry   
1	i'm coming with my sister Jess
0	Noooo. Sadly  I've got the cat at the front window keeping an eye out though!
1	I used to sing "Everybody have a weird day, deal with stress in your own weird way" to my infant daughter to get her to sleep 
0	I meant JUST goofin' off... not but. lol! It hurt very badly, though. 
0	It's arrived
0	Oh no, that had better not be making it's way down here. I want to walk into town 
0	yeah dude. seriously. there were like 28 of them. we have a nest in our wall
0	My palate is still bitter, undermining my usual enjoyment of the ol' nourishment. It's starting to really quite upset me 
1	What do you think of Project Natal? Personally I prefer the controller but it could be a novelty for a while
1	!! Haha sounds like something worth looking forward to when school reopens haha
1	and the thunder goes BOOM BOOM BOOOM  ....idk.
0	- looks like i'm not going to Miami.  really hoping for it but, things sort of changed.  come up here and visit! i'll help!
1	nice to see you guys growing
1	thanks  we need more people with some brass
0	  thank you.  he's horrid
0	Finally got iPhone app working &the lovely! But it keeps crashing!  will there be an update soon?
0	sorry man. Forgot about the comp room
0	I know  everytime I see commercials I get sad, but I have no patience for touch screen..I learned. & I'm in love w/my bb 
1	i play at 9 other than that no planz. theres a yard right by hudson you can hit
0	No worries, I have one like that! Slumdog wasn't what I was expecting, but I liked it. Sad kids live like that anywhere 
1	aÅŸa aratÄƒ pimp-bunnies from space
1	Though I guess because Goku burried him it was all for the best... He would of died again in his grave.
1	Get 100 followers a day using www.tweeteradder.com Once you add everyone you are on the train or pay vip
1	seems like it 's back up!
1	Hey you!  So, where are your seats?  How was it?  Did Joe flirt with you again?  Details please!  
0	please bring back the feature where tapping the status bar scrolls to the top. I used it all the time
0	 : having a lot of trouble changing my profile pic
0	 can't remove a person from mij follower list  because strange activity from that person ^^
0	- I can't get my pic to work!  It is making me sad
0	??? couldn't get it
0	_PLEASE_ can you hurry up and fix issue 451
1	heyyyy can yu tell everyone to follow ? it wuld mean ALOT to us! she needs 100k!!!
0	Horny cats and Britney are driving me nuts. Would you pleeease get rid of them already
0	i always get errors because my user name includes "twitter"
1	in either case I appreciate the reduction in spam that I receive. #thumbsup
1	in settings give users a txt input to paste pageviews code; cause like blogging sites let users have stats, microblogging shud 2 
0	Is the acct cleanup what happened 2 me? I was suspended briefly yesterday...
1	is the funniest most entertaining thing I've seen since Pacman
1	love? your website
0	okay, i havn't recieved a text update to my phone in nearly 24 hours. Fix it please 
0	please delete acct they are trying to get passwords. It is NOT me.same pic,not sure how they know my surname 
0	please deploy IPV6 on the twitter API. Multiple computers, iPhones and NAT don't go well with the current API limits  #ipv6
0	please fix this http://sp2.ro/5b7bdb because it brakes all external twitter avatar searches
1	Thank you!  ::gives cookies for your hard work::
0	thanks for kicking some #pornaddict #spammers, they were following me, some still follow me! 
0	Waiting outside the library for it to open... I really have to pee
1	and I'm not here...I don't have time  ((HUG)) for all
1	And I'm off to bed!! Long day tomorrow
1	And I'm off! To the wedding I come! Can't wait to see everyone
0	And im officially depressed.
0	and im on day 13 lol...next day off 30th May!!!
0	AND I'm so aggravated...I left my damn power cord to my laptop.  so I can't work...sux for me...but HOT for twitter. i'll be here all day
0	and i'm sorry i didn't reply, kristin (@titanband2010). my phone was in a drawer. far from me.  #branson09
0	and I'm starting to feel sicky  Nooo Nooo NO BUENO!
0	and i'm still searching with zero result.. meh
0	and i'm still struggling with nos!  this is so not my forte!!  where to spend the monies??!!!!!
1	AND I'm still trying to get through the after-gig-depression. mcfly, why do you do this to me? haha! 
1	and im study english. i wanna learn it
0	and I'm tireeeeeeeeed  and watching bizzare E.R.
0	and im trying to restrain myself from eating nurofen 3 days in a row. meh, i hate minor headaches.  a sign of lack of sleep. boo.
0	And I'm up WAY too early for my personal satisfaction
0	And I'm up!  Again! Weather is poo today.. not even a storm... it's just... blergh... Got some revision to do too  Ah well! xxx
1	And in a couple of minutes i think im gonna play counter-strike:source. Im gonna own some people  I hope
1	And in case anyone is wondering - I tweet about food I love cause I love food.  I am not paid or sponsored.   I'm just pregnant.
0	And in conclusion, extended nausea is not fun 
1	and in financial balance we have this...   http://bit.ly/15uChS    via http://twib.es/1SV
0	and in related news to the age rant i have just calculated my BMI - am 5'8/5'9 & 85kg and result is i am overweight!
1	And In the end it's always me
0	And is everything okay? Still rattled from today? Or have things calmed down..i feel bad, though there wasn't really anything i could do 
0	and is gonna last so many hours
1	and is off to the G.A.M.E. meeting
0	And it all of twistory, twitter has never let me down. But now you won't let me change my picture! 
0	And it begins again. Essay word limit: 3300. Words written so far:...4413? Surely not!  #essaynumbersgame
0	And it doesn't even start till tomorrow
0	and it goes on.
0	and it is actually NEVER my fault. ever. and that makes me sad
0	And it is closed
0	And it is happening again  why?
0	And it is raining, hard. 
0	And it never did get here
1	and it only takes a minute of your precious time..... to turn around. -- singing an old song from Tino's itunes
0	And it stopped raining.  Fuckingtastic! )
0	And it sucks cause I lost all my texts and saved voicemails.  Now that I'm thinking bout it, I may cry.  
0	and it sucks he lost his phone now i cant talk to him when i want to or text him little love notes
1	and it was
0	and it was a great song too
0	And it was REALLY warm today, which I hated 
1	And it was the day it came out. Now I don't have to worry about being stuck in that situation
1	That's good to hear.  I'm still kind of asleep yet.
0	I got it super cheap and I didn't think they'd have a SIGNIFIGANT update to the iPhone this year. I want the new graphics chip
0	I unfortunately have no means at the moment to twitpic
1	I woulda done a #drunktweet but I was semi sober and mostly horny by the time I was able to tweet.. sorry  now my head just hurts
0	You're telling me.  Goodnight, Paul.
0	i totally agree.. its mostly government stuff, which by the way is my weakest part of socials. BOO GOVERNMENT... 
1	YOU GUYS WERE AMAAAAZING ! <3 made me proud
0	I need a phone.
1	oh....no it's not dyed. it's just curly now
0	my text messages aren't getting to you
1	thats what I figured, they both were smirking at each other during the Billy Joel song 
1	Somehow, one has to get it out of nokia somehow when i visit on 19th june 
0	I want to! but me mum said I couldn't
0	some told me a story of seeing a huge one there and now i'm afraid to go back
0	happpppy birthdayyyy because apparently you dont get my text messages.  plz dont think i forgotttt. because i didnt  <3
0	awe  what's wrong?
1	Good thinking. Maybe I'll just let you baby sit Lil Joey. He loves girls
1	Electric Feel was one of the songs that played before the 3EB concert I went to.  It was probably the best part of my night, ha.
0	Que mal lo de Virgin Records...
0	You act like you not my friend anymore.  I don't like it.
1	let me know how this year goes for you. Sounds like it could be fun.
1	Questing will take your mind off everything! Just put Wingnut in the crate like Tinkerballa. He won't even remember it later.
1	: It's very nice to be able following you on Twitter
1	change of scenery always brings new ideas. one good one so far. still getting settled in
1	wow that's incredible. i love that you understand & value the true importance of family LUVbaby & the music is life-giving
0	i'll pay for your ticket, and you can pay me back. i dont wanna go alone 
1	he knows how to type so I'm sure if he got a full keyboarded phn he can do it. He's intelligent
0	all of it starts the same way. until greed for power, lust for position and hatred rules. look at Gujarat riots 
1	our ãƒžãƒ?å¨˜'s are angels XD They take their jobs really seriously!  I was surprised!
0	can't find any!
0	oh that's nice after a long hard day of revision
1	Hi Kathryn, welcome, if you have any questions, stop by the FF Beginners group and we'll try and help: http://bit.ly/4kkeV7 
0	 Need a snack idea?
0	Heeheee!! Hope it's just dryness *hugz* Yea, no news from  Hope they're both ok.
0	when I hit reply, it's bringing up the wrong name and I'm sending tweets to the wrong people! 
0	Why cant I get to twitter via my mobile phone anymore??? I used to be able to now I cant
0	will twitter be down!? noooooo
0	Mine isn't
0	Sorry mate... twitter follow fix still isn't working for me.
0	  how can i htmlencode a query string to a  search for ?  to find musical tweets?,  doesn't seem to work 
0	Testing source parameter for Me thinks something else is up. It doesn't seem to be appearing.  ^EL
0	doesn't like me...i can't anything
1	Best Health tweet ever from you
0	And I *hate* Tweetie. Sorry, but I think I'll keep my Beta Copy of TwitterFon Pro... 
0	is not letting me delete tweets.
1	just had a breaking idea to make twitterfon even better.  please DM me your E-Mail Adresse for more informations.
0	I like the changes in the update, but they seem to have introduced more bugs than it's worth 
0	updated to FF 3.11 & when I sign in it CHUGS the browser while gathering tweets. my HDD lights stays lit. its just not nice.
0	I had to actually beat people who were good to get my achievments
0	I've been trying to get you to play that for weeks
0	my twitterrific is not working yet
1	btw welcome home - we missed you
1	eu voto Fake!
1	follow me here!
1	Hola Twitess! Tiene un buen dï¿½a! Michelle
1	jï¿½ passo o link
1	Thanks for the information on on twitter, I will have to check him out 
1	hahaha....he just came into the booth to ask me about that.sabi nya to tell you, POTAH ka daw 
1	Sige  Hope you, aren't working this weekend.
1	Im getting my drink on
0	k buddy bye
0	what happen? Why you end up staying home
1	Please share some of the replies you get to that question with me  I'm interested to hear the response you get
0	Omg. My heart. Beachh
0	we plan on meeting her we have no 5*  as they sold out too fast, BUT we have 3rd row centre (pit)
1	IT'S ME!!!!! OKAY K K!! IN FULL EFFECT! LOL
1	nice... scares r reminders of fun times
1	Hi Paul, is now at - he's been posting there since having probs with his account. 
1	rele? hahahaha sweetness
0	 2nite leftovers!  yesterdays meal improved w/ age & by not taking 4 hours to prep, 'cept crab cakes & clams r history 
0	Affirmative - looks like stormy weather... keeps on rainin' all the time...
1	Hey! I'm doing alright.
1	awesome to hear.  thx!
0	and it would help a lot if i could spell correctly....doh
1	and it's a long one
0	And it's about now that I wish we didn't have Sky. Why does it stop working when it rains? This is England, it rains ALL THE TIME 
0	And it's all over  BGT
0	And it's all over baggies
1	and it's also the 150th anniversary of the BIG BEN
0	And it's back on again.
0	and it's burning under my skin
0	And its cold now
0	and its early cuz tmr i cant go on the computer.
1	AND IT'S EXACTLY 6 DAYS AFTER THE LAST TIME I MET+SAW THEM!!    :
1	And it's foosball time... time to kick arse
0	and its gone all over my bag!
1	and it's my birthday tomorrow. Everything worked fine w/that in the end Convinced her not 2 invite ppl she didn't know
1	and it's not hard to guess why i get a kick out of burberry.
1	And it's not just any chocolate. It's Belgian chocolate
0	And its raining again today
0	And it's raining again. Will it ever stop? I think not
0	And its really cold
0	And its sold out.  going to next showing in two hours.
1	and its time for my exam . bye for a while , dont miss me , i'll b back 
1	And I've got 100! Woo, is my 100th follower  Thank you to you all!
0	And I've got a driving lesson today
1	And I've hit 600 followers!!
0	and i've just read a few of the comments... angry people are mean
0	and i've only got one day off a week for the next month and a bit
1	and jamie  your "boyfriend" (haha sorry had to do that) told me the hangover is supposed to be really good
0	And Jenny is so gorgeous --' PFFFF i love her style, i want her outfits 
0	and joe...why...why....just TELL ME WHY.... ....Im dying for you...and you changed...Im disappointed...because you're another joe
