0	doesn't want to be disqualified, its just not fair... i wouldn't get into uni  BLAH, hope we don't
0	Doesnt want to be here anymore
0	doesnt want to be homeless  lets hope Tris' landlord says yes to me staying
0	doesn't want to be in work today
0	Doesn't want to be up this early! Work tonight and would rather be somewhere else
0	doesn't want to change departments
0	doesn't want to clean
0	Doesn't want to cover English
0	doesnt want to do homework
0	Doesnt want to do maths homework
0	doesn't want to do revision today either
0	doesn't want to feel like this anymore
0	Doesn't want to get up for work
0	doesn't want to give the puppies away this weekend! I want to keep all of them!
0	doesn't want to go back again
0	doesnt want to go back home
0	Doesn't want to go back home
0	doesn't want to go back to 6th form tomorrow
0	Doesn't want to go back to Anaheim tomorrow
0	doesn't want to go back to Brisbane, doesn't want to leave her family behind 
0	doesnt want to go back to school
0	doesn't want to go back to school
0	Doesn't want to go back to school  AND whats up with this awful weather? Were's the sun gone??
0	doesn't want to go back to school tomorrow
1	Doesnt want to go back to school tomorrow! oh well good half term  Portugal was beaut! and went for the first kayak of the year!
1	doesn't want to go back to school, so close to being done...  bought food for school as well i won't starve lol
0	doesn't want to go back to work tomorrow.
0	doesn't want to go down, 
0	doesn't want to go for a run....  it's cold out there!!!!
0	Doesn't want to go home!
0	doesn't want to go to college today
0	Doesnt Want To Go To College.  Bad Tymes
0	doesn't want to go to school
1	Doesn't want to go to school tommorrow, but I got the daree 
0	doesnt want to go to school tomorrow
0	doesn't want to go to school tomorrow
0	doesnt want to go to work in the morning!!
0	Doesn't want to go to work right now
0	doesn't want to go to work tomorrow, especially knowing its going to be round 3 
0	doesnt want to go to work..oh how the moaning begins
0	doesn't want to go work
0	doesn't want to leave new york
0	doesnt want to leave school  will never put my uniform on ever again
0	doesn't want to leave Star Records yet.
0	doesn't want to leave Sushi alone tonight.
0	doesn't want to leave the lake, is gonna miss Kateland, and sad Kaitlin has to leave Tulsa  Poopy.
0	doesn't want to leave tomorrow because she's going to miss her friends. especially
0	doesnt want to memorize her lines  and study for history final :'(
0	Doesnt want to move
0	doesn't want to pay rent anymore... I'd rather buy Robins's Jeans! or some white Trues
0	Doesn't want to revise for chemistry exam. But she has to, cuz she's so shit at science  Help?
0	doesn't want to revisee
0	doesnt want to say goodbye to my parents.
0	doesn't want to start summer school wednesday
0	Doesnt want to stay home next weekend....i really wana have a date night but i gots me self no date
0	doesn't want to stop playing sims  I'm addicted I know. I just wish my computer was a lot faster and better cos when I try to fast fo ...
0	doesn't want to study.
0	doesnt want to take honors testing tomorrow
0	doesnt want to work and still had a headache
0	doesn't want to work either.
0	Doesn't want to work its been a longggg week
0	doesn't want to work this afternoon/evening
0	doesnt want to work till midnight tonight
0	doesn't want today to end! im going to miss him soo freakin much! 3 months seems like eternity without the person you love!
0	doesn't want tomorrow to come yet
0	doesn't want you to be mad at me  this sucks. please be happy. i am requesting that you do so.
0	Doesn't wish it to be monday again already  I would love it to be friday already!
0	doesntfeelwell
0	Doesnt't want to get up
0	doesny know how to work this
0	doesn'y like twilight that much. ugh.
0	Dog ate my PS3 Wireless controller. TIMEOUT FOR YOU!!!
0	Dog gone it, my spaghetti sauce has gone south. 
1	Dog has arrived and is already relaxing. Ivenhoe, you rock!  Hoping to post some pics soon (tomorow?). Good night all!
0	dog has been walked. washing in the machine. chill time. sore throat though
0	Dog is a pain in the ass this morning
0	Dog just puked up the pepto-bismal I gave her to stop the puking.  Time to call the vet
1	Dog just took me for a walk  makes sense since he's bigger than me
0	dog just woke me up. went pee outside.  feeling down.
1	Dog now allowed back in, got a bit wet while outside. House fragrant with scent of "wet dog"...Pets are great. All homes should have one 
1	Dog now sniffing at a vodka n coke ... That's all i need a pissed puppy and pissed husband!?
0	Dog seems okay so far. Gave her some crackers and green beans (she likes them) so she's got something in her tummy. Poor dog
0	dog sitting great fun lol... i told them a cat would be better but they never listen. i want the nice weather to come back
1	dog the bounty huntaaah
1	Dog Tweets: > lol at the dog duck a Dug perhaps? very well done  http://bit.ly/72Sjn
1	Dog walk and then some more work on a blog site for a client that I really want t get finished in the next day or so
0	Dogealk went ok, but now rain in FLA 
1	Doggie time again !!! Mornings are the best  http://twitpic.com/5f2q1
0	Doggie update, endoscope investigation revealed a ball of grass. Fingers crossed he'll be better now they've removed it 
1	doggy likes to play with the vacuum cleaner, don't know why but apparently it's his favorite toy, he goes completly nuts when it's on 
0	dogs + park = TICKS
0	dogs also like to eat moths.  and spiders.
0	Dogs are on their way home  oh well I will see them again soon hopefully!
1	dogs cuddling and stars and the pools soft waves are putting me into full on fantasy mode. im at my grandmas in the backyard. how nice.
0	Dogs outside my window  well I have to pack, shower, and all-nighter? haha my head hurtsss mmm someone get me food
1	Dog's sick-ish, laying next to my pillow..Guess I'll let him sleep there tonight  Good Night then! Bonne Nuit! Oyasumi! haha.
0	d'oh - hate it when it's a mystery why my feeds won't parse
1	D'oh -- The Herman Miller Embody chair I bought a few months ago now costs 40% less! Yay for my wife, who'll also be getting one now. 
0	Doh and now I'm bidding on a G1 Android phone on eBay, I totally forgot it was #synoiz_haemorrhaging_money day  Excited about London tmrw!
0	D'oh stupid transportation issues mean that my tv interview is postponed
0	doh the shoes i bought were too big. having to send them back and get a size smaller
0	Doh! Can't watch Hulu from here.
0	Doh! Erie Blvd lanes is closed  off to alternate location for bowling.
0	D'oh! I can't believe 7-Eleven is out of hot dogs. That shit is wiggity.
0	doh! I didn't realise US 1 cup measurement doesn't equal 1 aussie cup. I am hoping my red velvet cake still works for dessert tonight
0	D'oh! I left my headphones at home.
1	D'oh! I meant Flying Squirrel. Red Squirrel is Coogee. Where was I ..?
0	DOH! I meant.......... Oh dear! curry was good! beer was good! now I'm not so good!
0	Doh! I was 30 seconds away from an Aion beta key
0	Doh! I was hoping to get a book for the missus but exclusive books are closed
0	Doh! I've been tricked in to watching #bb10
0	doh! just put laser transparency through the inkjet  a wet smudgy mess resulted
0	Doh! Left my MP3 player at the hotel. That's my second one this month.
1	Doh!...I almost forgot: IT�S MY B-DAY,BITCHES!!!!!   
0	Doh, got patch of sunburn on my back - obviously I missed a bit when applying suncream  Next time can apply it!
0	Doh, I forgot what I'm watching is on Skyplus and just sat through the ads - the Togginess is always there 
0	Doh, pulling twitkwik from the app store for now - need to write some serious code to handle the Twitter authentication changes 
0	doh, work today 
0	D'oh. I somehow accidentally started downloading season 2 mid-way through season 1 of Chuck and now I've finished it all.
0	doh. tumblr is down
1	doh... maxed out my DM's inviting spymasters. I joined the british
0	d'oh... up with a poor boy with a sudden outbreak of hives.
1	Dohr�l jsem Brothers in Arms:Hell's Highway. Bomba
1	doiing my online exam for anatomy and physiology man i am learning alot about senses and hormones!
0	doiing project  which is totallly lame.
0	doin 90 in a 65 windows rolled down screamin nahhhhhhww, I'm so paid! I miss Conan  he better not change too much!!
0	doin a system update on my ps3... ugh didnt realize 2.76 was gonna take so long
1	Doin a virtual spinning class at gym - love technology !! As the american in the vid told me "good training"!!
0	doin chemistry project, have to do 5 pages 
0	doin english essay
0	doin french h/w, its pretty easy   but then theres science 
0	Doin homework
0	Doin' homework
0	Doin Homework  & The Weather Is Crap :@  lol Oh Well
0	doin homework ugh
1	doin it big on a Friday night  the only way it should be done!!!!
0	Doin' laundry  i hate the damn washer!!
1	Doin laundry *shudder*...and making banana muffins!! Yum!     #fb
1	Doin laundry on a lazy Sunday
0	doin laundry then going to bed cuz i gotta wake up 8 to roll silverwear
0	doin maths investigation...cant walk wid piepa n david n neema. has 2 catch bus 2 pick stupid sister. english hw due 2moz..life sux
0	doin my coursework  big brother eviction tonight..haha)cant wait
1	Doin my haiirrr
0	Doin my hair for school... Sooo tired
0	Doin my hair..dreading the part where I have to sit under the dryer
1	doin' my homework.
0	doin school, cause i have to 
0	doin some boring coding work
1	Doin' some field work today; should be interesting
0	doin some yard work today  i truly have been putting this off long enough.
0	doin sum work
0	doin the chores. great. gotta be done tho
0	doin these online college classes right now.. WOo hoo
1	Doin' what dixonmd told me to do.
0	doing 2 day fast to shed a few extra pounds before pics on wednesday, still worked out and my butt,legs,core and abs are not happy w/me 
1	Doing a "bead" craft with my girls.  Only thing I can think of making is the Blender3D logo  www.blender.org
0	doing a 700 hundred page history book  (half way through)
1	Doing a bit of editorial work this week; June is going to be a great month to read my material, that's for sure. 
1	doing a book about What's Eating Gilbert Grape and listening to my three bands
0	Doing a bunch of last minute things before I leave for San Francisco tomorrow! Ugh, tomorrow's the b-day too, 23...I feel old 
1	Doing a Cash Cab episode with
1	doing a crossword at work..i love days like this
1	doing a cucumber masque and eating grapes before heading to work
1	doing a drawing for chloe's bday in 5 days
0	Doing a felon search w/ BAM BAM! WOW i hope this guy doesnt have a gun
0	doing a homework!!
0	doing a little better... stomach is still weak  hate this feeling. Sleep is calling me. Hannahs party tomorrow!
0	Doing a little bit of real work/write ups and watching tv! No chat tonight  #busybee
0	Doing a little cleaning before bed. My head hurts
1	Doing a lot of ass kissing to teachers today... It doesn't exactly bother me!
1	Doing a lot of sales today.
0	Doing a mass cleanout of my room before rearranging it. Just sent mother out to buy me a bin and a bookshelf since mine sucks. Bad mood
1	Doing a meet and greet tomorrow, should sleep soon. Living alone doesn't bother me...but sometimes my apartment seems really empty /emo 
1	Doing a photo shoot
1	Doing a photoshoot..good guy!!
1	Doing a project at Jason's house
0	Doing a quick blog post and then taking the kids to the park - watching my neighbor's daughter and think she's already bored.
0	Doing a ridiculous amount of annoying FB apps because it is Friday night and I have nothing better to do!
0	doing a show in the heat!  so hot back stage! Woo
0	doing a small shift at work try to get a cut and Maybe check out Roller Derbie with this chick after that who get
0	Doing a stage check for a kid from Holland, made me miss grandmas cooking 
1	Doing absolutely nothing  til later.
1	Doing absolutely nothing alll weekend. How fun.
0	doing accounting revision and finding it hard
1	doing administration is always boring ... until it's time to create the invoices
0	Doing an awesome job of being unproductive for the day, heck yeah! Chatting with Pete, but he's falling asleep on me that butthole. 
0	Doing an English essay
0	doing an english essay already, has to be done for tomorow! 
1	doing another piece of media homework is that all i get now :/ milkshake diet starts today woop woop
0	doing art  tried to ride earlier but got rained on... stupid weather
1	doing artwork in my garage! havent felt art in a while. feels good  http://sml.vg/x1WLav
0	Doing Assignment
0	doing assignments....... bye bye twitter world
0	Doing better. Went downstairs to engage w/family. Heard "Mom"  looked quickly over rt shoulder BOOM fell. I know better.  Back upstairs
0	doing bio correspondance. sooo bored. michelle's pissed :S. school on SATURDAY in a bit for ms grekul's stupid bio review. kill me now!
0	doing Bio revision, exam on Thurs  xx
1	doing bio work  i love you steven
0	doing boring school work  looking forward to the weekend
1	Doing business with - negotiations and payment done, now awaiting my new business cards  Thanks Jason!
0	Doing chat conference,,ngomongin kerjaan... speaking of having no life 
1	doing chelsea's myspace
0	Doing Chemistry and English Assignment. Block Exam next week. I am NOT looking forward to it...
0	doing chemo
0	Doing chores
0	Doing college work on my saturday night off...oh dear!
0	Doing colllege work and got an exam 2moz
0	doing course work  better than being in work i suppose !!!
1	doing criminal justice statistics with julia
1	Doing da rehearsal. We are not a big part of it so its kinda boring. Still freezing. Feet hurt
1	doing dance ISU! hopefully i'm done my tomorrow and handed in tomorrow too
1	Doing devoz, God really knows how to comfort me. Wow. Have no fear!! 
1	Doing DFO with Natasha. Shop til you drop
1	doing disk cleanup so that i can save a measly blog header
0	doing english
0	doing english cpt
0	doing exams ugh
1	Doing Final stuuf and on the compupu! Then working out later! IM at home all day today
0	Doing follow-backs which I have come to dread. Used to be fun before I started getting 50 spam followers a day
0	doing food tech homework
0	doing french in a classroom thats 32 degrees? not cool
0	Doing french revision  x
1	doing fuck all today, pitz tomorrow night though. 
0	doing geo summative... LAME!!!!!!
0	doing geography homework... yay.
1	doing ginger and zoie facials today not in till 2.30
1	doing girls stuff with my sister
0	Doing graffiti in my closet   Its a pretty flower tho
1	Doing great Danny!! I agree we are all patiently waiting on ur album  So r u doing summerfest in Milwaukee this year?
1	Doing great things with ASP.NET Multiview and exploring the delights of MS Enterprise Library...
0	doing hairdressing homework.. ahh gay. but gotta be don't. I miss dylan
0	doing her english coursework..her fingers ache
0	Doing history coursework
0	Doing history....
0	Doing hmk...........urghh its almost summer and my teacher still gives out an assignment
0	doing homeowrk for the rest of my life
0	doing homework
0	doing homework  !!
0	Doing homework  #squarespace
0	doing homework  BOOO!
1	doing homework  hahaha
0	doing homework !! I have a lot to doo
0	doing homework again...
0	doing homework ALL DAY
1	doing homework and chillin at home  super bored right now...so lonely. lol.
1	Doing homework and listen to the JBs, it's much easier to do homework when you're listen to the JBs  
0	doing homework on saturday, 
0	Doing homework(History n english)
1	doing homework, listening to panic and making vegetable and lentil soup 
1	Doing homework, studying for finals, editing the meetup video, IM'ing people, and twittering the mundane as usual. 
0	Doing homework, urgh 
0	doing homework. -.- arrgh.. it's so annoying
0	doing homework. again
0	doing homework..  i want my bed so badd  grrrr.
0	doing homework...
0	doing homework....      it's a lot   :S
0	Doing homework...summer courses are not very much fun
0	Doing homework..then bed..waking up at 4 is gonna be awful
0	Doing homeworkk
0	doing homeworkkkkk
0	doing homework's no fun when nobody's around to bug and distract you
1	doing hw all day, then working out and watching the VMAs 
0	doing hw while everyone is at the party.. Story of my life..
1	doing ice cream
0	Doing kid drop off and pickup today...DD asked me if I know where to pick them up!
1	Doing last bit of packing for my move to Spain today!
0	Doing laundry  i don't mind it but it's just so annoyin and takes so much time out of the day
0	Doing laundry and cleaning my house today
0	doing laundry and going to see hangover by myself tonite
0	doing laundry on a Nice Sunny day  Anyways waiting for the web cast of the Bradby Shield
0	DOING LAUNDRY, CLEANING AND MOWING THE GRASS 
0	doing laundry, oh the joy 
0	doing laundry...mom n dad gonna arrive today...too bad sis couldnt come
1	doing linprog homework & proving linmode assignment
0	Doing loads of homework
0	doing loads of hw 2dayy
1	Doing lots of research today. I gotta step up my game if I'm gonna have any sales this month.
1	Doing marketing research for my new employers, Greenlight Productions 
0	Doing math homework
1	Doing Math Homework!
0	Doing maths
0	Doing maths in the middle of sunny day. Hope im at the beach....
0	Doing maths tuition work now.  dont think i'll finish. - http://tweet.sg
0	doing media studies coursework
1	Doing Megan's hair for the BALL tonight in VANCOUVER!
1	doing microbio logbook AGAIN. debating with myself whether i should update Our Lifestyle or not.
0	doing more assignments so boring
0	doing more designs
1	Doing more fliming for new WTS episode and starting a new video project tommrow tehe not telling what its about.  tehe
0	Doing more riding today while the weather is still good.  Still gotta head out to the cemetery to pick up the wreaths...do not want
0	Doing my accounts again....
0	doing my assignment,geez..  
0	doing my bank rec. HATE doing my bank stuff with a passion I can't tell you
0	Doing my best to figure out how to Tweet.  Trying to upload my photo.
1	doing my bills, i want to be debt free 
0	doing my cheat sheet for physics tomorrow!! exams suck
0	Doing my checkbook
1	Doing my contest entry for 's make-up contest  woo!
0	Doing my daily house cleaning        don't like it!
0	Doing my english assignment  WHY DID WE SAY WE COULD PERFORM TOMORROW?!
1	Doing my english homework.
1	doing my english presentation.. ugh its hard being german
0	Doing my enigeering Genius!!!!! Ready for a vacation already!!
0	doing my final project
0	doing my french homework
0	Doing my Geography coursework and pe coursework
1	Doing my hair
1	doing my hair  going out with emily..miii college.friend<3
1	Doing my hair & make up and then going out with the family!
1	Doing my hair and then off to shosie's house to drink
1	Doing my hair then mall with Nicole <3
1	doing my hair, going tanning, then going to the mall to get my check and cash it then off to ashleys for the nite 
1	doing my hair. picking up jes. then grand rapids art festival. yayyyy
1	doing my hairr. hope u not madd anymoree
0	Doing my hiar later today, hopefully it goes well... & hopefully i don't get major depressed this morning as i feel a downer coming on 
0	Doing my history common task  i know nothing !
1	doing my homework of accounting :S in university  tijuanaaaa  UABC
0	doing my homework. I hate doing that but i have to
0	Doing my homework.. and wishing I didn't have to..
0	doing my homeworks
1	doing my homeworks, school starts on monday -.-' think someone needs to carry me there I wont go myself  lol.+ looking at nicks pics, wow!
0	doing my intro to business paper!!
0	Doing my Math Jöurnals! :/ I wasn't able to call  She might be sleeping or something..
1	Doing my morning workout before church. It would be nice, Festival-wise, if it doesn't rain. Rain & facepaint don't go well together 
1	doing my nails , which color should i do ? i think i'm going for pink 
0	Doing my nails and revising!! :@ I hate revision!
0	doing my nails and waiting for the plane
1	Doing my nightly ritual, counting my money and sitting in bed.  nighty night.
1	doing my one good deed for the month - jello shot girls are back in action
1	Doing my part to help the economy today.
1	Doing my part today!  I'm here with the girls, getting ready to perform the monologues they've written.
1	doing my pd assignment . i nearly finished
0	Doing my report on media regulators BFFC done next ASA then PCC then the dreaded Ofcom.  on theplus side i'm listening to fatboy slim
0	doing my research paper all day long
0	doing my school's writing, so boring 
1	Doing my site, don't worry guys, it will be open within 4 days!  forever-miley.com
0	doing my srt homework, i have to get 4 pics of bugs and draw them in very good detail, easy but boring 
0	doing my stock take
0	doing my stupid English essay homework...
0	Doing my stupid language arts project.
1	doing my testimonial in the toilet on Mario. I'm bored. I'm very thankful Mario has Microsoft Word  love it!
0	Doing nails. Pack. Then sleep early for busy day 2mrw
0	doing not so good today have some sore throat I guess it's because of  all the immunization which I got within this week
1	doing notes  im soooo smart lol
0	doing nothin
0	doing nothing !!  ..
0	Doing nothing , bored as 
0	doing nothing at the church coffee morning. nobody wants their face painted
0	Doing nothing for hours
1	doing nothing in art. 'cause thats whats up.
1	doing nothing with
1	Doing Nothing! DOMINGO!
1	doing nothing. wanna go out
1	doing nothing... getting my head back together... fun party though
0	doing nothing... just thinking omgosh tomorrow's school... again!
0	doing novel study.. MUST FINISH BY SUNDAY NIGHT! that makes me tired just thinking about it
0	doing nth now at home  cant play yahoo games too. love you maypeng. cant wait to eat durian later. woooooohoooooo.
0	Doing our taxes
0	Doing Overtime at my job today sucks to be working on a  sunday but I need the money so it has to be done
0	doing overtime instead of workout  ...at least I'm not last man standing. #fb
0	doing paper work
1	Doing paperwork all day so the fed govt don't try to cheat me out my mula!!!!
0	doing pre-labs for chem 31.1...
0	Doing presentation work today   Powerpoint is the presentation tool of the devil.
0	doing re. assigment
1	Doing returns is the best part about working at a grocery store.
1	Doing runescape and tribalwars
0	Doing scheduling for RubyRX and AgileRX DC. So many great speakers... only two days.
0	Doing school work. I hate summer classes!
0	doing school work.as always..... i go to school. come home. and do more school work
0	Doing science homework ..
1	doing science homework. i should get it out of the way so i can come home after acro and relax  good plan mikki.
0	Doing Science revision
0	Doing science revision  learning ideas in context
1	Doing several writing assignments when I'm no longer in school, SCOREEEEE 
1	doing sit ups WHILE studying for Algebra. this works  burn calories+pass math+babysitting= toned, no summer school, and cash!  happy!
0	Doing some academic reading... I miss school.
1	Doing some backlink building. What a joy!
1	Doing some book reviews hope to finish it now
0	doing some boring things... yay
1	Doing some chores. hanging out with later.  buahaha.
1	doing some cleaning in my closet. out with the old, in with the new. aha 
0	Doing some design work, battle of the band reunion got cancelled.. hardly any bands turned up 
0	Doing some discovery work on a legacy domain, and just found the thorn in my side 
1	doing some drawings while watchin the omen
1	Doing some fun stuff
0	Doing some homework
1	Doing some homework and doing some other stuff as well. Hehe
1	Doing some homeworks! Hmmm, can you help me come up with a good comic book story? I'm thinking of inanimate objects as my characters 
0	Doing some lame poem in class  can you say school I boring..only few more weeks till me get out
1	Doing some last min stuff before I join my parents again
0	Doing some last minute studying...exam today
0	doing some macro stuff.. and actually bokeh textures but I can't find the shapes I made
1	doing some major rpatz stalking with in the cittyyy
0	Doing some major studying for the Social Studies assessment tmrw morning
1	doing some photoshop digital photo development
1	Doing some prep work for next rehearsal of THE MYSTERIES The Belgrade Theatre - always inspires me....
1	doing some reading on setting up 802.1q trunking on 3com switches for a Job tomorrow, gunna be fun fun fun 
1	Doing some research on schools in L.A.  I'm stoked!
0	doing some revision on last day of easter hols, life sucks 
1	doing some stuff in the garden
1	Doing some test shooting later this afternoon.  Did I mention being in Holland for an indie wine festival this week? My tongue is red.
1	Doing some tests for my movie
1	doing some tidy up at home
1	Doing some trigonometry homework right now  damn I should just go into virtual school because I taught this to myself and it's easy!
1	doing some work yo
0	Doing something over here and something totaly different over there (mind - hands) ..WTF nick jonas! ..   I'm a cougar  ^.^
0	doing spanish hw
1	Doing spellings with my brother. So proud, he's so clever 
0	Doing stuff around the house and catching up on schoolwork! Missed way to much school last week
0	doing stuff....not a nice day
0	doing stupid economics homework
1	doing sudo rm -rf / --no-preserve-root and then ctrl-c is not a good idea. sudo was deleted
1	Doing sum editing. Enjoying a peaceful afternoon at home. Glad 2 be able 2 finally open all the windows & let fresh spring air in...
0	Doing summer cleaning and wishing weather was better!!!
1	doing that double gym thing again today with some yoga too
1	doing the andy dance  the one on fonzie gomez show ;) haha
