0	no! you can't be sick  you're supposed to be at Lollipop in SF on the 26th.. please get well soon <3 <3
0	What happened?
0	yea ...im not happy about it and it seems like they r both willing to give it another try ..
1	 look at you!!! Chatting with the stars!!! WTG
0	 My Myspace is very lonely. It's about to cry  see for yourself...lol
0	Awww. You you listened to the song? Isn't it heart-wrenching? Lol
0	haha yeah? xD can we go somewhere close? i'm low on gas money.
1	Hey Lil J... it's just turned 12.18am
1	hey. i will sleep na. haha. it's nice to meet you.  let's chat next time,k? ;)
1	Hmm. Idk what else you should get. But I'll let you know when I can think of more stuff lol
0	I am not dissin on them
1	I was telling the truth about the vid BTW
1	If I'm going to be famous and marry George Clooney one of these days, I want the kids in Vegas to know about it! LMAO! 
1	It's on the hills
1	Just pick someone who is definitely more mature than yourself J9 - they take longer 2 grow up than us
1	Not yet...coming up
0	You're not staying up with me tonight?
1	You've never had them?? Omg shame on you. They're 's favorite snacks. And they're sooo yummy
1	janine whoa dude hahah u really put the things i sent u sa fb ahhaha!!gee tnx janine
0	oh dear! aww that's so sad! dili ma enjoy ang vacation.  awww... i don't wanna go back to school na pud! this monday na!! (
0	a little after you guys did, we gave up on JK 
0	hopefully they can't tell. It was just the hub cap and they weren't in the car so I rushed in  wah, I'm nervous...
0	i wanted some lol
0	Hi AJnie. How´s it going down under. I¨m getting bitten 2 death here in the Carribean
1	Me too, except I don't thank them. I guess I still need to work on that 
0	omg. tai and anberlin are touring together. but in australia!
1	Goodmorning cutie
1	thanks janith
1	How exciting for you both!!
1	 morning Janis.  Lovely sunny morning here now. Thinking abt yr coming week. BELIEVE!
1	had some bloke join & leave & rejoin me 4 times. I had not followed him. Why would a life ** follow me?  Gt walk today.
1	Hi Janis  I'm good thanks, still trying to wake up lol how are you?
1	my hairs simple to cut   OMG yes I see you have a lot more support on your site too!
1	Not sure how to do photos on here! He was sent from Ireland to a rescue centre in UK poor chap...lucky chap now though
1	thanks Janis
1	Thats good  how is Gary?
1	Thats really good Janis.  It will be good when its all over and done with...will keep praying xxxxx
0	exactly the opposite. i need to eat, but it's almost 5 in the morning and i need my sleep more  ughhh
1	http://twitpic.com/558ee - me wants that hair soon after getting a major!
1	its okay. so, how do you do? 
1	thank you  btw, jgn lupa CROCSnya yaa ? :'( size = 40 hehhee 
1	LOL .  you could say that u have loved him a long time
0	no   i am currently down to just gong.  do you have any room at your place for melb?
0	tried 2 call u yesterday bout 3ish. Was sad u werent home.
0	thank you for the tip...your poor hubbie it must be tough working outside in that heat, i dont envy him 
1	Yeah, there's so much grey. Tough to get that in 140 characters.   Good advice.
0	Awww, that's too bad  Maybe this will show you where to go in this situation - http://yfrog.com/66wowscrnshot050909013450j.
0	im leaving tuesday so i wont even see you  very sad face  lol
1	thank you  ive blocked him from mine now. he's a silly boy
0	Where you have put your account name/password in to needfollowers.. they are using your account to spam
1	i wish i can share your excitement hehehe but the girl is cute
1	You got facebook? http://tinyurl.com/c44c6r Come join up!  x
0	that's too bad   Did you have to stay home from work?
1	i hope you are well. big hugs back
1	G'morning!  I wanted to say last night, I love the idea of "haiku as therapy"... I'm glad we share the same moon. 
1	Thank you...I am really digging your writing  I'm only moved by GREAT writing!
0	Global? haha i am never up for morning news anymore work
0	 I just wanted it to be clear and no confusion.
1	Douglas Coupland. Cdn writer, artist.  Wrote Generation X, Microserfs. Smart guy. But aloof 
0	How long are you staying there? Love the tree picture! Wish I was there
0	http://twitpic.com/7haoh - Yup, that would be mastitis ... brutally painful for both woman and beast 
1	Uhm, yeh, I got my period! You're a riot! 
0	WHAT'S THE URL 2 UR MYSPACE...I HAVE 2 MANY FRIENDS AND THEY DON'T EVEN HAVE THE SEARCH FRIENDS ANYMORE
1	its 12:28 for me
1	lmao i am so stupid, i just read she is your cousin hahaha. *blonde moment* hope you can take pics 
1	HAHA. sure thing
0	 yes and I had to tell the story of what happened countless times *g*  today however i'm ABSOLUTELY shattered
0	haha I didn't eat it yet  "never viet house" hahaha
0	I want too
0	Yeah, I know!  I'm just not comfortable - a songfic challenge? Sounds like she's indulging herself, not helping ppl be creative
0	it was a weak attempt at replicating Sir Waid's hydrocephalic Batman.. I ended up drawing my normal version
1	Yes, the MS E3 parts are great! This new technology Project Natal rocks my socks! 
1	WOW.  Thanks.  I'm gonna post it na. haha.
1	Hahaha Yeah that'll be cool  HAHAHA Still crushing.....
1	Yeah I saw your bottle the other time. Lucky you!!
0	morning love bug. Another sleepless night?
1	the way even tho with out the aid of any M/cs they still built amazing cities!! beautiful structures!!!
1	hey, did you get my message?  We on for this week?  (shall we move to email? 
1	hi Ole?have u received interview ?
1	How about "Dear Sir"
0	I am still using the old 1.20 build of the facebook beta  Where can I get the new build with profile preview too?
0	waiting for facebook
1	lol Which music?  And yes indeed its midnight and tomorrows Monday :| I dislike Monday....
0	dude WHY. I want mp3s.
1	Lunch at Jan Polet is like a box of chocolate, you never know what you gonna get... 
0	I have my colleagues do very advanced air apps.. but they won't be available for freelance works.
0	Yup. You're leaving tomorrow diba?
1	Europe ... supposedly ... we'll see
1	- I have been here - just been quiet lately  Could never keep up with you!
0	absolutely! What a horrid statement to make? He made the rounds insulting minorities and did not spare the children
1	correction were all screwed for 2 years
1	fine thanks! and you, hope is better! 
1	G'morning sweetie  Well UNC completely dismantled MSU last night, huh?
1	I am good my darling Netune is active today Gentle influence of hidden mysteries for all ppl today  Xxx
0	I'm seeing a lot of that too!
1	Much better vote education is much better
1	Not that you asked for my 2 cents, but just sayin 
1	Sorry I never answered, went off early! I will play it later if I can find it! 
1	Thx for including me in your good ppl list. It shows the good person you are, given our dialogue this morning.  #FollowFriday
1	was thinkning same thing - lots of people rooting for him here
1	Wish we had fresh 'maters here
1	You really must take a look at our Doggy friends with muddy Pause http://www.twitpic.com/39nch Look how happy they are
0	trouble is I have no phone  & my hubby is traveling in NZ for next two weeks with kids - so we will both be out of contact
1	id never ever hurt her!  shes to amazing to use to hurt!
1	Yeah! Tell me about it! I migt do it right before school starts!  Im excitedd! I think itd look REALLY awesome and pretty!
1	Haha, my last shoot at a gig, there was one holding his hand before the flash, because it kept on popping out  LOL
1	Get 100 followers a day using www.tweeteradder.com Once you add everyone you are on the train or pay vip
1	Haha, cool. Glad you had a nice time. Only a few days away now 
0	i have done my job at the pool, first round delivered, just one more to go .. but i want to sit in the garden 
1	It's lovely isn't it!  I love days like this
0	no joy!! not even one number!  grrrrrrrrrr
1	Sounds like a better plan
1	Sounds tasty  x
0	-Farmers markets always close around 1 or 2. Early risers...Ours ends at 1pm.  Sorry you missed it.
1	I'm going to throw a fit and hopefully someone will send me to sit on my bed so I can take a nap too.
0	I'm with you on the nap. Spouse up early today and woke me up too.   but kids get out in a few then I'm out on the town 2nite
1	 jejeje Grab the BBT dvd's, get some starbucks and go superHD!
0	You can try! I think he got it going with a hairdrier last time
1	You're just jealous because I'm going to be all rich and famous!
1	DMs are fuckered, but that's great.  She's an awesome person, and so are you 
0	Aww man u a magic fan
1	Thanks~ I think I should give myself more time to adapt and absorb more hehe.
0	Didn't Kayla tell you?  I'm out of texts until Friday.
1	if only we could.... -.- i'm sooo bored... glad we have our break now..  lata... xD
0	Actually, custard :p Scones give me heartburn for some reason - sucks cause I love them 
0	"You couldn't shoot your way out of a paper bag."  One day, you may have to, but plastic.  
0	I'd have to rock w/ Teddy Ruxpin.  That bitch likes shopping.  Gremlin likes top hats & has streaks in his locs.
1	no problem
0	ooops can't repeat everything u read LOL , my fault  ..... *Goes to corner *
0	I really had no idea  we're always last to know ..
1	Congrats!  What phone did you get?
1	Airport? What airport? My butt was in my Dodge for 700+ miles from Indianapolis to Chicago to Madison WI & back. Never again!
1	I had lunch at my office building's cafetaria just downstairs Jon. Simple Indonesian food...yummy
0	I can't dind my picture
0	my god you were not kidding with the change in battery life on iPhone OS 3.0, I lost 80% battery life overnight!!! 
0	thanks for the tips I will try that as far as pen and paper writing for some reason doesnt work for me
1	NO NOT GHETTO UR AWESOME
1	Likewise, Thank you! 
1	and Thank you for spreading the love even more.
1	thanx for the #FF love!
1	Very welcome, Jacqueline! Entirely my pleasure!  #SmileSaturday
0	ah because he believes people don't want to hear him sing   So I'm wishing Walt Disney will sell out but there are still tixs
0	OMG I havent thrown up soo much in my life! Im embarrassed at how loud and stupid I was!
0	It has been a hellish couple of weeks... so besides work and my next cell phone I have nothing.
0	I did?! Apologies if I did
1	sounds more like a land giveaway
1	No I love you  Hell yeah! we're rockin bonnaroo!
0	 Sorry to hear that! At moments like that I don't miss living under the roof. ;)
0	*hugs* I hope your day gets better. Cell phone providers are made of suck
1	left a comment on your blog post
1	legit. Legit cruise.
1	There's nothing good on tonight anyway!!   #Sigjeans
1	Get 100 followers a day using www.tweeterfollow.com Once you add everyone you are on the train or pay vip
0	nvmd lol.. just realised you're in hospo from hayden's tweet.. soz i lonered you
0	yup yup  lammmee
1	& you perform that duty all TOO well, bub  have a few bros like u mysel; lol
0	I haven't been keeping up with your sagas. What's happened?
0	nope....it's open.
1	jared, tweet the photos of the airport. deffo wanna see it too!  xx
0	 that's not nice what if I meet you 1/2 way  http://myloc.me/12Vl
0	that didn't happen for me
0	Oh, and Company was closed  Next time!
1	Oops, I was thinking of the giraffe house in Baltimore...sorry.  
1	Thanks for the stage pic! We're so ready to  be fully serviced in August. Can't wait.
0	you're moving?
1	ah that really bites. night hubz
0	because you won't let me
1	i dropped my touch screen phone & got a big scratch on it. but i just danced.  lol
0	I thought it was a major letdown!  It is really complicating. Ha.
0	I don't have a choice. I need a job and I have to keep checking my applications.
1	you all were amazing tonight!! can't believe you've made it this far
0	could you post something about kristen bell's latest appearance please? i can't find pics anywhere
0	who was it? i would love to know. i did a facial recognition thing and it found no one.
0	i saw that depeche mode clip, but they're lip-syncing 
0	lol I know huh I ran out of papers
1	I've still got 9 laps to go.. multi-tasking with the UK apprentice.  I didn't agree with the medals thing
0	Shame but Murray doesn't do the live stuff
1	You so will get married. The world will catch up, I promise. 
1	i'll let you know how it goes
1	"best band in the world?" oh, i didnt know YOU guys were playing last night! LOL did u wish mr smith a happy bday on advance? 
1	...thinking that I made some amazing tacos
1	At the time, I was enjoying a beautiful warm evening in Studio City. 
1	btw you've really gotten yourself in a bit of a pickle...also, that's gorgeous that you care so much about animals 
1	Hi!  Just got back home from work. I'm about to have lunch. And no, I'm not a vegan... Sleep tight! xxx
1	hmmm, i'm thinking about a Japanese band... Maximum The Hormone, a little bit heavy. You should listen to it if you want! 
1	http://twitpic.com/3jzmw - I think that's your plaid shirt!
0	http://twitpic.com/3l2sb - it's very dark .... but where are you ?
1	http://twitpic.com/3ncr0 - I know now like you are! Wow!
1	I forgot to say...your new pictures are amazing! (GQ Style Magazine ~ Nov.2008) Did the little dog get to sleep on your arms?
1	im thinking you're the most amazing person ever for calling me!
1	Mr. Nobody Trailer looks good!
1	oh my god, i love your music a lot ^^ u are my idol, so...when 30STM will have new songs? or albums? 
0	Someone get to understand what they are writing there? On kyte?
1	thank you for SHaring  the PICS
1	trying to survive this day although Im alone at the office this week. Any suggestions from your side to brighten my day?  Thnx.
0	What's it?
1	 words like that will take you a long way! Now for the website? I'll race ya!
1	 would probably know - he was all over the actual word the other day with Dr. Drew!
0	it would be magic. sheer poetry. aside from medicine, i try either hot or cold compresses. 
1	LOL.. Aww, c'mon!   A hint?  Was I even close? LOL 
1	I LOVE YOU GUYS! get your ass to australia in december for my birthday
1	i think ur thinking
1	it was amazing. its a 'must-see' movie.
1	don't get hurt too bad...
1	yeah you gotta hand it to MLS- 1 fan complaint and BAM! the whole league schedule gets changed around. that's cust. service!
1	oh well... LAKERS ON THE GO!!!
1	Wake up little sis  I AM HUNGRY
1	awww leaves us all warm & toasty, thanks jared 
1	thanks for helping the block go round lol  mad love
1	Thanks for the love Jared! Whichever Jared you are!
1	Wow! Jon isn't very nice! LOL! We have some talented Twitter pages artists...just ask for help and you'll get it!  Andrea
1	ur twts are hardly aa horrible as the mtv movie awards! Keep em coming!
1	I got dirt bikes today
1	yeah it is about that hour, was up till near 5a last night not a good idea.  Take care. and Pleasant dreams.
0	http://twitpic.com/6s8p8 - Aww poor doggy..  looks like the dog is asking for something and no one cares for her/him
0	I went to go look that up, it does look good! but I don't get G4 
0	I'm just starting to feel really panicky and anxious that something bad has happened cos it seems like it's been ages
0	Uggggh it's horrible
0	I am lost. Please help me find a good home.
0	You shouldn't be afraid of mice, they're so cute 
1	hehe  Hiya Jay - Haven't seen you for a looong time - you look like John - you poor guy ;)
1	Happy  Birthday from a total stranger that follows your Tweets. Hope you celebrate all weekend.
1	Happy Birthday Johanna!!!! Would of sent this earlier but I was at work...AND twitter is also in a funk tonight! Hope it ROCKS!
0	Pats, Willies and the Lodge lad lol Nope and nope  hw boring am i! Saw mr kinsella out tho.. he was a tad tipsy!
1	I went fishing today, thought it was an appropriate avatar! 
1	now we just need the iCharger, just place any rechargable Apple item on top, come back in an hour and it's 100%! 
1	Yeah... Guess i'll wait then
1	Oh yeah: Michael Carlisle and Anna Rosalie  lol
1	 Brown beskyttes av Mandelson, som mente B. burde bruke slør: «Gordon looks pretty dreadful without his face covered up»
0	I'm SO TERRIFIED of doing that.
0	ughhh i wish i had a tv
0	 Hope everything ok! Can burr fix this?
1	Certainly if there wasn't a real one before the comic, there'd be a fan one after. Think verified accounts will solve this? 
1	Hey! Yes I love the whole damn playlist! You ROCK.  Now where were you tonight, I even wore my "fuck me" dress.
1	Non. Sympa comme news tiens
0	whattttttttttt next year.. omg i can't wait til next year..
0	I was kind of hoping for an early release.
0	you suck! i wanna feed ducks and walk around culzean  lol
0	I thought you were following Hanna now? I can't remember her username and I can't find her in your following list.
1	of couse haha i don't think apple will sacrafice quality it will b a big step back too much  what mac do you own?
1	i hear ya on that
1	Resn looks like an amazing company to be at. Best of luck!
0	wish I could!! I'll be stuck at the barn all day tho
0	does that mean we're over?
1	but my school to home is so much shorter distance than yours. CRAZY BUT COOL!  btw the mrbrown thing is a joke lah.
1	eh i'll be a bit lateish! can you send our surveys for printing? 300 copies
1	That's what I thought.
1	I was in the bowdoin res life office telling funny stories about you today.  hahaha
1	you always do well
0	so sad.. i really love tiny  she was a great jumper
1	Ah, you're welcome? 
1	Hey jarrod ... I'd love to but it turns out I might have plans that night ... i'll make it if i can
0	uni is tied to certain suppliers, so unfortunately that's not an option  I did suggest some (*50) pro towers #notlikely
0	anymore left, I wanted to buy one, but had wedding expenses 
1	Just opened it up. First reaction: cool... but extremely pink.  Very interested to check out the CD and DVD.
0	Oh no! That's too bad.
1	i smell like your purfume from hugging you  really nice fragrance
1	that's why you get the big bucks
1	Sorry for late reply. Robert's advice kinda far out, but I'm supposed to let you know when it works. Still waiting. 
1	i just saw ur dad walking danedane<3! without a leash hes so goooodddd
1	Cool.  Will keep an eye out. Sooo jealous. Need to think about taking a vacation sometime soon myself. Have fun!!!!
1	I'd like to meet you before the cylons take you
1	aren't you done with the army yet?
0	do you have vista? Mine isn't working eithe  lemme kno if u find a solution
1	so you're comin up here for bike week? make sure you get at me! it would be good to see you
1	Oh, okay, i'll try that  SOS ganun lang pala ) Thanks man 
1	it's a very good film. The book is next on my list to read
1	 I seem to be always thanking you!  Thanks for tweeting about me!!
1	have you come across songs of satinder sartaaj on youtube.. sounds good ...  #sufi
0	but the hawks play tonight!!
1	Are you Zara's boyfriend?
0	I would have come last night too, but I can't even get out of bed  Have a good time!
1	we off to see night at the museum now
1	ok good I was fixin' to start phone harassing you to keep you awake.
1	Good Morning Minion!! I'm still up!
0	No, I'm not. It's not like I imagined. Only 2 more months to go. 
1	Mr. Deity is the bomb
1	kidding man, was talking about your recent bowel movements. 
0	but i need about another 200 pages  and i'm sniggering away, oh how I laugh...ha ha ha! ;)
0	Awwh  where is Alice?
1	well besides god of course. You r the greatest in this world is a better way to say it  haha
1	And stop this 'geek babble'
0	hahaha, of course lol, u better not ask wat happened last night lol  but it all comes to an end with monday 
0	mother wont let me
0	Actually ill. Stomach is doin a stellar impression of an olympic gymnast  i work in an opticians n looks like no1s turnin up 2day
1	mines a pint... be there in 3 hours..
0	 i know.....    thats the view from this side of the road.... from over by the creek.... CRAZY eh?
0	YAEH! THANK GOD IM HOME!...it suekd and we were kicked out of a church.
0	those are sold out too!! subt put them on sale early i checked today
1	Good Morning Jazz!!  4 more dayssss, until ur. Wedding Day  YEA!! YEA!!!
1	i dunno, ive been tweeting about it for 3 months or so 
1	of course tuscany & the amalfi coast r marvels of epic proportions.  don't make me choose. LOL. what about u?
1	Thanks for the Thanks
1	Night at the Museum was cute too
0	OH MANN I WISH I SAW THIS EARLIER!  I stuffed up so badly in my SAC today!
1	btw, youre a ramiele fan? i saw that you were following her hahah 
1	GREAT!  Me either!  got great looks and a great voice! she's <3 And so are you Jasmine! ;)
1	oh cool!  Which one is better?  Bride Wars or The Uninvited? (:
1	Eh, tru tru... i think id rather have Travis  <3
0	welll i woullddda choosen AG but hellur you called dibbs
1	You and Daniel were amazing.. I heard nothing but great things being said about you guys!!   I will refer you any day girl!
0	jazzyyyyyy! i miss you  xox
0	  i have not left my house or my bed in fact for 6 days! is that not punshiment enough
1	i have attempted and it didnt go to well hehe i might have another go soon though
1	hehe, no probs jasmine!  thanks for following me back too
0	aww I hope u are okay..
1	: konnichiWa! im very glad that you guys released Kyou Kara Maoh Season 2! now i can continue! thankS Jasmine-saN!
1	Haha .. Im Waiting for tears to tiara  i wanna join the contest but i dont have the 3rd Week, weekly code ><"
1	lolx r you referring to Air Gear manga recent chapter?! I really don't get that one
1	no prob mama  stay Gorgeous (((and wave at dem haters)) miss america style xo
1	i think im gunna email  xx
1	no, I only just found out about them via my friend tweet 
0	Yuck.  That's the easy way out.  Can't stand it when people don't make an effort to try to understand.
1	I remember taking yoga in a college course holy Wow does it BURN
1	Glad you like  Please leave feedback for me on my website when you can  xx
0	why are yu not on dailybooth  ?
1	definitely one of em
1	yeah sorry about that! we're totally haning out over break though! oh btw, i wore your shirt today. i looove it, thaank yoouu! 
1	REALLY?!?! hehehe
1	I think you should do it. I honestly was thinking the same thing. I want my followers to get a better idea of who I am.
0	why are you annoyed?
0	::pulls you onto my lap:: trying?  darn
0	so he's really not in it no more??
1	 you're the greatest.
1	But hey I'm not 100% sure wether it's coming out or not  Isi?? Let's find together the isi and we can exchange XD
1	HAHAHA,I got also in my iPod  Lame gila laa.Frankly,Jonas Brothers can really make me laugh over the top. ;)
1	I'm pretty sure lots of fans have let them know  This must be such a relief for them...
1	Really?I didn't check my email yet.But,thanks  Sorry for troubling you mak cik Nek loves you <3 ;D
0	i couldn't see you!  did you go just with your mum?
1	good luck with the prom dress shopping!!
0	But my leg is numb  I'm freaking out...
0	I'm going to try and go soon. I just don't want diabetes with needles or to loose a leg
0	I've been having probs with Twitter all day  I'm trying to make a new account (for my cat, ha) and its being STUPID!!!
0	Oh my goodness! That is crazy! Thank god for photoshop though, right? That stinks though! 
1	Thank you, Jaz.  That's good advice...
0	Yo no tengo Photoshop. I wish i did tho ive been wanting to make a banner thing.
1	put some in doggie bag for me LOL  have a great day Jasmine
1	you are NOT alone on that  i just did it.... oops
1	I just read your blog. Thanks for blogging that. I'm sure whoever reads that will show more respect for the JBnoys.
1	glad we can fill that void you've been feeling
1	HI! i hope this works: Im new and im ur #1FAN4EVER&EVER!! I really really wanna talk to u!BAD!Plz tweet me bak!luvya!!<3
0	Can u do me a favour pls, can u look up return prices 4 LDN on 29/6/09 because it doesn't work for me  i can only get singles
1	haha iya. your welcome sist!
1	wanna give up? haha hell yeah  *hugs*
0	Flip's tech support ran me in circles all day - ended up back where I started.  I gave up...product failed
0	sure! we can be friends... what's stupid? Friendster? B'cuz of HCG! My app won't work...
1	FINE. and mkay HAVE FUN  BE SAFE USE CONDOMS :X
0	yes he did.
0	 I knowwwww. grr ! Ill work on it 2night. Honest! lol
0	Tamera's show got cancelled!  it was mad funny
0	babe i tried texting you, no answer yet  
0	why babeee?
0	I jus saw it.. lol.. you know my phone still actin silly.. Sad face
1	how are you?
1	Isn't it!  I hope it made u smile too, it worked for me 
0	what?!?  well there is no accounting for taste...I should go see it again soon, will probably be gone by next week... 
1	What a coincidence... Im trying to figure out what to do w/my life.  Btw, does bathing Bosco make the fire detectors go off? 
1	Oh Minstrels are yummy..im eating Cadburys Chocolate Peanuts at the mo! Moreish!!
1	Evening...im great thanks Jason..hows you? Good day?
1	LOL aw do you love to hear from your bro first thing on a Saturday morning?! 
1	LOL Hey i never feel guilty about drinkin in the garden...you dnt have to dig first man!! lol Have a good afternoon Jason!!
1	lol oh dnt worry u'l be able to squeeze it soon enough!! Hope you have a good day today!
0	Morning!! Looks bright here too..sunny at the mo..dunno for how long though!  Lycra dance sounds good!! lol
1	Nice one..hope you have a good day. Isn't this weather amazing!?! Talk to you later..enjoy your walk.
1	Well, having to revise them!  Was to do some more gardening, now, I guess hoovering and some warcraft  Not played in a week !
1	I think he was talking about what costello did to turnbulls face and bowels (color and movement
1	ignore me looks like 1.0.3 final is out now  http://tinyurl.com/dnf5gl
1	 im in love with your voice. you are so aspiring and your music touches hearts around the world.!!! you are amazing jason!
0	miss you guys
0	i just sent you a direct msg. i don't know how this works.
