1	Still going to get up early every day like I am going to work still.No lost hours.I won't tell a story.probably going to take daily naps
0	still got a driving hang over, accidental phone call from friend worried me and got me out of bed 
1	still got a headache,cant have ibroprofen or codeine as i get stomach pain, grrrrr, kids back to school soon on the up side  
0	Still got a migraine  that a 3 day migraine now I hate it !!
0	still got four days of school this week  watching cops with dad!, bed eventually.
0	Still got sinus probs and my ribs hurt due to me sleeping all contorted
0	still got the lurgy . . . Boooo
0	Still got the rotten cold
0	Still got the sore throat and blocked nose...coming up to 2 weeks now
0	Still got the wicked sunburn  it hurtts. Well im back to school tommorrow. Today was my first day at Sunday school, i was so confused.
0	Still got to wait another week for my iPhone 3GS
0	Still got work to do  #fb
0	Still grading. Reviewing student work for research methods. Then it's time to plan Dr. Ghanem's party.
0	still gutted i never had the balls to go tell how much i love her at rockness  il jst txt the mashup on friday me thimks?xoxo
1	Still had an AWESOME TIME!  : MUAHHHZ GREAT LAUGHHHS!!! CHEESEEEE!
0	Still hadnt time to work on my presentation
0	Still Hangin in there ... Missin my friends
1	Still hanging out at M in a hotel room  Such a great view
0	Still happy me and Johnny worked things out last night.   I'm still worried about my current appetite, or lack thereof. 
1	Still happy over Nadal being kicked out of French Open  .. maybe he'll breakdown like Susan Boyle?
0	Still hard to believe Robert Palmer is gone.
0	still has a killer headache. I thought it would be gone by now.
0	still has a painful ear.
0	still has a really bad sprained ankle and can hardly walk on it
0	still has a sore head
0	still has clogged ears it's fucking horrible
1	Still has dried silly string in her hair and all over her apartment ... sigh ... birthday festivities, here we go! 
0	still has glass in her head. hurts like a bitch!
0	Still has hay fever
0	still has more chores to do.
0	still has no followers
1	Still has no idea how to twitter... How do I get myself involved with these things?
0	Still has no idea on what's going to happen tomorrow :'( And next week. I'm exhausted  On the bright side, had sushi & fro-yo's today. Yum
0	still has sunflowers to be harvested on  FT  http://plurk.com/p/12oo48
1	still has that tingly in-love-with-Jesus feeling from over the weekend.  #fb
0	Still has the duty page on the night of a release
0	still has the Flu, for the past two weeks.. 
0	still has the headache from hell  x
0	still has the post-eurovision blues  but the 8 new songs he's acquired for his eurovision collection are helping him through...
0	still has this cold... and it really sux..   maybe i shulda stayed with my mommy again tonite
0	still has tooth ache
1	still hasn't caught up on the days of sleep i lost in europe....and probably never will! soooo glad to be back!!
0	still hasn't done any revision
0	still hasnt found anything on tv!  My baby should be in Chicago soon! Miss him already!
0	still hasn't got a pony but saw2 little pony's at pinetown fair! didn't ride them  maybe i should ask for a horse ...???
1	Still hasn't got out of bed :s btw people 2 weeks til I see your beautiful faces oh yeahh and 3 other beautiful faces  x
0	still hasnt got the hang of this thing
0	still hasn't recovered from his cough
0	still hasn't recovered from last nights antics and my knee stings
0	Still hasn't seen Star Trek yet!
0	Still hasn't signed Grace's yearbook. . .
0	still hasn't slept, No-doze FTW. Looking foward to happy Trevallyn drinking times. Not looking foward to another 6am start. 
1	still hasnt slept....but has been have an interesting convo wiv a special frend and knows her now better dan he ever did before
0	still hasnt watched star trek
0	Still hating that I missed #mobicamp.
0	Still hating the whole Twitter replies thing. I feel like I'm missing bits.  #fixreplies
0	still hav my cough! now it mite be bronchitis!  bec everytime i cough my chest hurts! so dont lik doctors...
0	Still have 6 days of being shaped
0	still have a bit of hang over ..
0	Still have a few moms in need! Military mommy with 4 little ones in OK needs a TV & another abused mom in UT trying to get out of state
0	still have a frozen timeline... When are you going to fix it Last visible tweet is from the June the 2nd
0	STILL have a slight case of the Mondays...seriously?
0	Still have a sore throat
0	Still have evil cold   very annoying. Tom has given me a haircut to cheer me up though!
1	still have jaw on floor after yesterday
0	Still have Lyrics and Chord Progression Block.
0	Still have no rucksack
0	Still have no voice but now my throat hurts badly...... Maybe I need a tonsillectomy or an adnoidectomy// I hope its neither
0	still have not finished chem assignment. it is taking forever. still have to start biology assignment
0	Still have problems with my backgroud
0	still have some packing to do
0	Still have stiffness from sunday  Maybe i should counter with another workout session.
1	Still have this song in my head ~ Hot Air Balloon by Owl City
0	Still have to unpack  bummer
0	Still have tunnel vision + dizzy. Not sure what it's about, maybe a cold? Was planning on making Cosmos tonight so hope it goes soon 
1	still haven't been to sleep yet.... got some awesome news though. God is making a way!!
1	Still haven't bread, but there's a pan of pilaw 
0	Still haven't cleaned.  I guess I'll go do that now... after I eat a bag of chips!
0	Still haven't finished through all this studying. Go, I look like a panda right now. Even the concealer can't help it. 
0	Still havent found a job
0	Still haven't found a place that replaces Crave
0	still havent found my webcam.  http://dailybooth.com/sarah_gray/434599
0	Still haven't got a clue how I can join the EST challenge
0	Still haven't got my email from ILAA.
0	still haven't got my sims 3. this sucks. what's worse is i have to send my laptop away  stupid thing.
0	still haven't got regular lunch friends
0	still havent had breakfast
0	Still haven't heard anything  Contact me already!
0	Still havent left the house yet. This is rediculous! REALLY!   S*D*P* & T*K*K*
0	Still haven't made it to bed  kids gone with memaw shopping. Finally gonna get some rest!
1	Still haven't made the ginger cookies.  Instead, I'll make a Hamlet necklace   Should be nourishing.
0	Still haven't seen Sim 3 in store, want to play it so badly 
0	still haven't slept , and i'll be going out in a while!  D:
0	Still haven't slept yet, I am utterly exhausted! My engine is out of fuel, I'm running purely on fumes 
0	Still havent slept, if i don't sleep today thats 52~ or so hours without sleep. surely not healthy 
1	Still haven't slept. At Mobile regional airport about 2 board 2 LA. Plan on sleepin in the plane the whole way there 2 make the time fly
0	still haven't started with her translation....
0	still haven't taken a photo
0	Still havin a sore throat
0	Still having engine problems on sailboat   poor hubby
0	Still having issues with this Twitter account.
0	Still having no luck upgrading my iPod Touch to 3.0
0	Still having problems getting a pic on profile!
0	Still having problems uploading a profile picture.  #twitterfail
0	Still having problems with my Internet cable connection.
0	still having probs with profile images on twitter
0	still havn't done my homework it i hate homework
0	stiLL headache!~
0	still heaps sick
0	Still heartbroken I couldn't get that Michael Kors shirt from today   It sold out literally 5 minutes before I could grab it.
1	Still here  with ma baby
1	still here at school...rainy day  http://yfrog.com/15uoiqj
0	Still here. I DON'T WANT TO LEAVE.  You better go on December, corderos!
1	Still holding out for a free ticket to today's Taste of Hawaii.  If not then it's SUP in Hanalei after church.
1	Still Home
0	Still home  Going to see Gordon Peterson At the on Sunday.
1	still hopefull for my Cubbies  Have not missed one game, go Cubs!
1	Still hoping that will update #twitterrific to version 4.0.
0	Still hoping to get a reply to a note I left for someone
0	still hot as ever tweeters  but goodnight...time to sleep uncomfortably cuz the a/c broke
0	Still hot from the hot shower I took
0	Still Hungover from last night
0	Still hungry  waiting for food
0	still hungry after eating a bagel  and yes i do eat a bagel almost every day lol
0	Still hurt my leg
0	Still hv heaps of clearing 2 do 2day! So difficult 2 decide wht 2 put in storage & wht 2 leave out. A lifetime acquiring things now ths
0	still i cant login to tweet deck...it says "unable to connect to twitter,please check your firewall"   i need help......#twitter problem
0	Still ill  xx bed and xbox time
1	Still Ill by the smiths will always be my favourite song
0	still ill, working at home to avoid spreading illness  #fb
0	still ill. HOW LONG MUST THIS GO ON?! meh meh, stuck at home doing history revision til 10.30am 
0	still ill....urrgghh...how am i expected to write an assignment feeling like crap
0	still in a  mood! this job will be the end of me physically and mentally!!
0	still in alot of pain
0	Still in Athens for the time being.....then off to columbus later I think. I can't believe hockey season is over
1	still in awe that my three year old niece got a better bowling score than me last night...must not have had enough to drink
1	Still in bed enjoying the spring  sunshine streaming in the window, woke at 5am rigid, extreme pain and exhausted but i'm positive today 
1	Still in bed enjoying this cloudy morning  need to get up soon and wash, fold and iron clothes. I wonder if i'll get breakfast in bed. Ha
0	still in bed was online to my chunky monkey til 2am, hes in yemin 
0	Still in bed!!! Feeling dead!!!
1	still in bed, craving pancakes  i am not that tired! surprising, huh?
0	Still in bed, missing a history lecture. Seriously am so fucked. 
0	Still in bed. I'm probably going to get blasted by the man sitting in the living room in 2.5 seconds. I sleepy
0	still in bed... so lazy
0	Still in class.
1	still in hollywood fuck gots to work tomore gettin paid! woo  then goin to the observitory and then new waters cd relece party!
0	still in IOWA.. trying to find a way out. but i think i'm stuck until at least sunday
1	Still in Kentucky! Leaving today 12:30pm. Let the Birthday Festivities BEGIN!
0	still in last night's gown
0	Still in Melbourne this coming week. Nina's gone to Croatia and Kristina will be manning the desk alone for a few months
1	STILL IN MIAMI: On My Way 2 Power96 2 Do A Interview All My PPLS IN DA 305 Tune IN  !!!!!!!
0	still in much pain with my neck
0	Still in New Jersey probly be back in Brooklyn Tonight later on.....Follow Please
0	Still in Ofc, waiting for ICICI jerk. Was done with work on time, now I'll get flattened in the train 
1	still in pjs jst back from hazels came home in my pjamas might jst stay in them for the day lol
1	Still in prescot, still doing refit, still really bored. But at least it's sunny. Quiche for lunch with ham and potato salad. 
0	Still in same queue barely 1 metre from where i last twittered. This is insane. And i paid for this
0	Still in shock about Bradley W and Jane K. So sad
0	Still in shock that Jon and Kate r getting a divorce
0	Still in shock...got into my first car accident. It wasn't my fault, but my baby car got hurt.  & even with the ugly cry-i got a #..ha
0	still in so much distress  and LOL
0	Still in so much pain and i don't know why.
0	still in so so much pain
1	Still In tha NO.
1	Still in the car the car... My kids have completely lost their minds! Jerm has decided he's going to ride in the trailer.
0	Still in the car. Still got a long way to go. My back hurts.
0	Still in the center of Lincoln wandering aimlessly round shops, wish I cud think of something to o. iPhone running slow 
1	Still in the Eur/USD bounce trade, didnt we do well 
1	Still in the hair dressers
0	Still in the hospital
0	still in the hospital with my newborn (http://tinyurl.com/kkzpz5) ... probably not out until Saturday.
1	Still in the middle of nowhere, it's still raining outside and i'm still bored as hell.. Hope you guys are having more fun than i am 
0	still in the office
0	Still in the office. No way I'll be getting up to #SMCSYD
0	still in the office......I "love" the first day after holidays
0	Still in the office.working laaahhh...apalagiii  :/
0	Still in the processes of filling out another MAMMOTH application form!!!  I hates it!!!
0	Still in the studio....tears
0	Still in this fucking town!! Diamond City Antwerpen in Belgium!! I swear that's suck like ever!!  nthg to do!!
1	Still in Vegas, fly back to Va. Tonite on the red eye with my kid in tow. She's gonna love her new bedroom and backyard playground 
0	still incredibly sick but another week of school left to go.  summer needs to hurry up and get here
1	still into Josh Golden's music... I fall Down, *hands down*! 
1	Still is going to pursue acting,it is my passion after all. 
0	still isn't a fan of the muggy weather.
0	still isn't done with the banner.  http://plurk.com/p/x8a1r
0	still it is not working I am very very sorry, but I'm trying a new video might be out shortly no promises though 
0	Still itching and ahhh can't get through to ent
0	still jetlagged... missed rock am ring due to shitty weather
0	still kinda bumbed from last nite  then again im also happy... and slightly confused? does that make sense?
0	Still kinda sick, going to be in bed all day again.... 
0	still knackered from Download and the 4hr drive home. Proper misses
1	still know all the words to Like a Virgin.
1	Still laughing about The Hangover
1	Still laying in bed, watching my beautiful wife sleep, I'm so lucky 
0	Still learning arts and of course informatics. Yesterday I learned 'til 12pm and today since, I don't know, 9am. I've got a lot to do. 
1	Still like 3 and 1/2 hours left. I love you so so so much [more] kristen
0	still listening to my teacher lecture online, been an hour and a half now, so bored and ready to eat supper 
1	Still loking for the wonderful patron of the arts   http://winner4all.blogspot.com
0	still lonely
0	Still looking for a moderator for Euro #CollegeJourn tonight 8pmBST. Can you help? Otherwise, it'll not be on 
0	Still looking for finals tickets, no luck yet. 
0	Still looking for her nhs collar
0	still looking for my ipod
1	Still looking for piche monologues...someone wanna help me?
0	still looking for the JacknJill Potato Chips Nori Flavor  cany find one nagccrave ako!
0	still looking for the right music
0	Still looking for work
0	still lost on designing AIR apps. might need to start from scratch..  off to bed for now. need to clear my head.
0	Still lost phone. Really NO idea where it is. Can't be far..
1	still love the idea of sporking out the eyeballs of men, but today is happy day. I get to see some of my best friends graduate!! 
0	Still love this: http://dailybooth.com/Nakedbooth Except the picture that took it REALLY far go deleted
0	still loving heathledger<3
0	Still majorly pissed about the Blues loss  so closeeee. But good to see the Dockers get up today. great game.
0	Still making coffee for two.
0	Still melting. Ice cubes on my face. Will never sleep
0	Still messing around with my blogs... I've always loved to write, but now I can share it with you all... just be patient we me, please.. 
0	Still miserable and i cant even eat my feelings away.
0	still mising newscasts for 3 pm
0	still miss my old timeline.. follow lots of tweeps that reply a lot and now I need to check profiles before I see them..  #twitter
0	still miss you
0	still misses you.
0	still missing cory, just wish I knew everything was ok......and I knew what was really going on. 
0	Still missing Dinky
0	Still missing my Rayban...
0	still missing someone she hasn't met yet
1	still mixing , sounding damn nice 
0	still more english
1	Still mum says we have a working test on Monday and she has entered both Graduate and Open ... hmmm ... could be fun!!!
0	Still mute. Can't take any calls
0	Still n bed and doesn't want to do errands
1	Still n celebration mode!!! Gettn ready 2 hop on this flight!!
0	still need to clean up the crib!  dont feel like it! but I had a effn gud time yesterday!
0	Still need to declare to the tax office, and pay them  This is a bit of a rubbish, but only 14 days left to do it!
1	still need to find a pic  !
1	still need to find out the code to get into the outdoor pool which is finally done! heading to the store to get sandwich stuff 4 lunch
0	Still need to get three reports done before I can leave. 1/2 way done with 1.
0	still need to process this weekend's pics
1	Still needing to find more actors darn it!
0	still needs to do chinese homework.
0	still nervous... n feel tired.  i wanna do but i cant do. cuz im such a chicken... :'( ã?‚ãƒ¼ã‚„ã? ã‚„ã? â€¦><
0	Still no #beejiveim 3.0 in the app store
0	Still no 3.0 in iTunes. Come on Apple .....
0	Still no baby  ok wishing didn't work. Now what? Hey we need the power of 3 lol
1	still no baby yet! longest pregnancy ever
0	still no baby... 36 hours on.
0	still no brother today = me still being bummed out
0	still no call from the body shop  i am getting worried...
0	Still no contact with the Princess. Time to beard the lady in her den! I don't think she will appreciate it much  Will give update later.
0	still no followers
0	still no good news about the jet
0	Still no hair from Tom  http://twitpic.com/8dd4u
0	still no heating in my house   im froze
0	still no inell update  going to bed then.
0	still no internet at home! darn, i don't know how long i'm gonna survive this... 
0	Still no internet on my Blackberry.  Verizon OK'd service before travel, but now says I cannot get internet service in Japan. #p2pgh
0	Still no iPhone 3.0 update
0	still no job ! money wearing out very fast !
0	Still no joy - mustn't have been 1 of first 200 to click the button. I'm watching this space instead
0	Still no keys... About to eat a tartiflette for comfort and warmth. Feeling homeless.
0	still no loving. This is beyond words
0	still no luck
0	Still no luck finding the hat
0	Still no mail. This is hell
0	still no mms for fw3.0 2g  another reason to get 3gs
0	Still no mobile web in B98 7 area. you're crippling me  LOL
0	Still no news 'bout the #Air France case.. sad
0	still no news from NS
0	Still no notifications of being a winner
0	Still no phone call or email. Im gettin sad.
0	still no phoooooonee. noooo
0	Still no pic, very sad 
0	still no picture
0	Still no power. So pissed off
0	Still no rain
0	still no sign fromhttp://twitter.com/Change_for_Iran
0	Still no sign of 1 hour too late and counting  #phpvikinger
0	Still no sign of I don't think she's going anymore. gawww.   D:<
0	Still no sign of quickpwn 3.0  all this excitement just for a long loooooooong wait
0	Still no sign of the #i7500
0	still no success with my restore
0	still no thunder and lightning
0	still no txt from Mys... ahh fuck it, her name is Ann everybody. so im just gunna call her by her name, ok! No txt yet from Ann 
0	still no update on inell's fic.
0	Still no Upward Bound books
0	still no work  this is so not fun being unemployed!! So many resumes and no responses
0	Still no work.
0	Still no xbox live...   *sighs rolls over* Maybe I should just go back to sleep!
0	still nobody in the chan.  (Broadcasting live at http://ustre.am/1sWq)
0	still none of my friends are on twitter.
0	Still not able to update to Facebook from TweetDeck?? Well, from the iPhone app 
0	still not all together. Such a lost :/  Rest In Peace Kittim Sherrod, never forget you 
0	STILL not amazed. Mum's home
1	Still not as good as Beverly Hills Chihauhau, but hey, not much is! 
0	Still not asleep. Ahhh  Wtf?!
0	Still not at home
0	still not done
0	still not done studing, thiz iz soo annoyin...skool iz almost endin for me, y do we have 2 keep takin theze stupid testz  
0	STILL NOT DONE WITH MY HOME WORKS  dude, i`ve got around 5 different home works & tons of things to memorize 
0	Still not feeling 100% but off to work. Poor has a cold
0	Still not feeling good!
0	Still not feeling that shit hot either
0	Still not feeling the new records by Wilco or Grizzy Bear. I feel left out
0	Still not feeling very well  I had big plans for the 5 day weekend which ain't going all that well so far
0	still not feeling well but need to go to bank and pay rent
