1	IT'S FRIDAY!!!!!!!!!!!!!!!!!!!!!!!!!!!!!!!!!!!!!!!!!!!!!!!!!!!!!!!!!!
1	Its Friday, busy but good 
0	It's Friday, but it won't be as good a weekend as I hoped it'd be 
1	Its Friday, its Partay Time 
1	It's friday, I've had lunch, and I'm about ready for a nap.  Shame I've got plenty more to do!  
1	It's Friday... 3 day weekend Yippy - 4 day weekend for me hooray!   Must resist Twit or fb... Must work, before play!  TGIF all
0	Its friday... this is usually my day for going "woohoo" but i am gonna be sitting in tonight  being boring...
1	its friendly friday.
0	it's friggen warm outside, i was gonna stay out there until nikki's but it's just too warm. 
0	it's frkn hot outside!  takin' long time to cool down the house.
0	its from all that anal sex, i forgot the lube. damn  may need to go to the E.R.
0	It's fuckin beautiful out and im working
1	It's fucking bizarre to think I leave tomorrow, for 3 months... CALIFORNIA BABY! 
0	its fucking cold! why is it so cold?
1	its fucking cold!. all i wanna do it stay in bed. munching on stuff  lol
0	its fucking frreeezing
1	It's FUCKING HILARIOUS!
1	its fuckn time
1	its fun here at #ia2009
1	It's fun seeing lovers trying to hide their relationship from the world. 
1	Its fun to randomly text your nephew, without him knowing that you have his phone number 
1	It's fun to see people who God has brought together so obviously...Phil and Katie just work, a perfect match...   now....must practice...
1	It's funny because the guy from India looks like us and many people talk to him in spanish and he doesn't understand
1	its funny how a conversation develops xD one minute you can be complete enemies the next lovers! strange
0	its funny how andy assumes he's not the first to call me. ily him though. i made him feel bad
1	Its funny how baby spit can break up a party
1	It's funny how easily coursework tires me out. I've done about a page and I'm exhausted! Oh my poor grazed ipod... Nan night  x
1	it's funny how everyone's fighting over all time low when they can never REALLY have them. because all four plus crew love me.
1	It's funny how fate plays a very interesting game with you. And the weird thing is that I'm enjoying it
1	Its funny how one memory can make them all just fly back,,, 
1	It's funny how peeps assume I'm actually partying with 'the' cheeky girls and not referring to friends who are cheeky
0	its funny how people dont want me to come town with them
1	It's funny how such simple and small things can make your day
1	It's Funny how the kids go shopping with their mom on Mother's day and the kids all come home with gifts.
1	its funny how things end up
1	It's funny, cause none of my followers know what Coona is. So I'll tell ye  4 days of riding, in Cold as hell Coonabarabran in North West-
0	its funny, even with all this technology, you still die alone 
0	It's funny, sometimes creativity can hit you in a wave of "do it this way dummy" and yet some days it just deserts one completely 
0	It's funny....everyone is saying "be transparent", "be authentic" but all I'm seeing is spam, ads and sales lately! 
0	its fuuckingg freezingg again
1	It's game time shotyy!  Gunna own that test
0	It's gay pride and didnt go
0	Its gettin to be that time again where $20 only gives me a 1/4 tank of gas
0	its getting bright already?
0	it's getting closer to doom time
0	It's getting difficult to type on my blackberry with long fingernails
0	It's getting ghostly in here.  Where did she go?
0	It's getting harder and harder to pee on a stick.. *sighs I can't even see my feet.
0	Its getting late...  my typing skills are getting worse over my past three tweets  ----- signing off in about 5 minutes
1	its getting late...4am, I think its bedtime. night night 
0	it's getting light and I still can't sleep.
1	its getting light outside  so pretty
0	It's getting really dark outside! Where is the sun?
1	Its getting sunny again thank god  Has anyone been up to anything interesting?
0	It's getting very difficult for me to stick to the list. I haven't done anything.
0	its getting worse day by day and im getting lonely ....
0	It's gloomy as hell outside today.
0	It's gloomy outside. I'm afraid my mood might match
1	it's god damn beatiful out. i have to work all god damn day but tomorrow will be nice too.
1	its goin 2 warm up
1	its goin to be a pretty day out in davenport today
1	Its going 2 stay lyk that if yu leave it in there.... We should have waterproof phones
0	Its going away  thank you nature for giving me a lightshow packed with crackling booms! and now... rain.
1	its going down
0	its going slow so slow learning
0	Its going to be 100 degrees today pray I don't pass out at work
1	It's going to be a beautiful day--I am going to have a new granddaughter!
1	Its going to be a beautiful sunset  http://twitpic.com/6tiee
1	it's going to be a beautiful weekend in the river valley. husband is sailing and i have the tuna can to myself...all is right in my world
1	It's going to be a good day   Have fun everyone!
1	It's going to be a good week
1	It's going to be a gorgeous day for a Chicago wedding
0	Its going to be a great day! And I am stuck in work  http://tinyurl.com/cltoof
1	It's going to be a great day!! Getting ready for my princess' Fancy Tea Party for their birthdays.
1	It's going to be a great day.  I just know it! (via
1	It's going to be a great Friday
0	it's going to be a late night sorting through the few thousand photos i shot over the past 3 days.
0	Its going to be a long day.
0	Its going to be a long day... I have to work til close..
0	Its going to be a long night.  we are so short handed.
0	It's going to be a long winter...
0	It's going to be a long, boring night ... 
0	it's going to be a longg day and I don't feel well at all. i wish i could recover
0	It's going to be a loooooong day  I don't see myself eating nething today.. And probably spending a lot of time in bed..
0	It's going to be a mutual feeling
0	It's going to be a uper busy day! Hosting a family event at my house- looks like rain  Afterwards practice set-up for craft show!
0	It's going to be a very hot summer  Anyone want to become my personal chaperone? Will pay for air conditioning.
1	its going to be an exciting weekend but i can't say where... but some of you know
0	it's going to be another long, exhausting week.  And dentist tomorrow! fsck!
0	It's going to be devastatingly hot and I can't wear shorts to work anymore. Running to class is going to suck
0	Its going to be like 30 and sunny today, and I'm stuck inside. Ugh  and of course since I'm off on the weekend its gonna rain!
1	its going to be perfect says he.
0	Its going to be raining all week!
0	its going to be seeeehr hot today  ... ausserdem: I can't handle a german keyboard anymore   ..
0	It's going to be so weird without the seniors in drama next year..  i guess life moves on. i wish i knew them all the way i'd like too.
0	its going to be too hot for clothes today
1	Its going to bed and who knows what my dreams will bring me i know someone i am hoping for
1	its going to feel amazing not going to school tomorrow, maybe for 10 min just to sign out 
1	It's going to pour! HAHAHA
0	It's going to rain today, I am so sure 
0	It's going to rain.... isn't it
0	it's going to storm.
0	It's going to take me forever to catch up on all the missed Bleach and Naruto episodes
0	It's gone!! that blog is gone!!!Dang i was looking forward for more post!!
1	its gonna be a beautiful day!
1	it's gonna be a busy day. I spend the weekend with my boyfriend so I have to beautify myself & pack the whole wardrobe. U know how it is.
1	It's gonna be a good day! My hair looks sweet and I'm going to teach the class about the sharks so that they'll want to save them too!
1	It's gonna be a good Saturday inshAllah
0	it's gonna be a great bbq 2morrow! but i think also kind of sad
1	it's gonna be a great semester. so far, so good. FOCUSED on that one and only ... education. 
1	its gonna be a great week! dallas next weekend!!!
0	it's gonna be a hot one today. it's barely 9 and it feels like it's already 85! wish i wasn't working 'til 7 boo
0	Its gonna be a long day at work  No fun for me today.
1	It's gonna be a long day...en yes they still excist...people who MAKE time for you...  i like.
0	Its gonna be a longggg day today.
0	its gonna be another long, boring day 
0	It's gonna be another wet day!!
0	It's gonna be even hotter today but I've got to be at work at 2...and those wards get soooo hot!
1	its gonna be federer this time! wooooohoooo! win the trophy!
1	It's gonna be like a blog, with photos, and it's gonna show you what University life is all about, and how to get started, and all that. 
0	it's gonna be long rainy night
0	it's gonna be one of the saddest day in my life. </3
0	It's gonna be really hot today and I'm going to be outside...guess me color will change
0	it's gonna be so hard catching up with school work. boo
1	IT'S GONNA ONE HELLUVA FUN TIME. No spoilers pls
0	It's gonna rain rain rain!  hanging out with Elysha today!
1	It's gonna take some getting used to riding a motorcycle all the time, better get used to it before our next riding venture.. 
1	IT'S GOOD NEWS WEEK!
1	Its good night from him (Nick Barker) and good night from me (Nickpoint)  The 2 Ronnies, get it... oh dear ;)
1	It's good that I had clothes on!!  Otherwise that could have been even MORE awkward than it already was!! LOL
1	It's good to back home in Brissy after an awesome, but tiring week in Melbourne. 
1	It's good to back to work.  Now I can get a little rest   I don't know how I managed to find a White Sox bar in Dubuque, but I did... lol
1	It's good to be alive
1	it's good to be back.
1	Its good to be home
1	It's good to be home
1	it's good to be home.
1	it's good to be online after a few days without computer ! everyhting is backed up and reinstalled properly.
1	it's good to have a lie in  cant wait for party tonight
1	Its good to have friends that know more about this stuff than you do.  Thanks Albert
1	its good to have internet back
0	It's GOOGLE AdWords, not Dougal AdWords, ffs I have a cold, give me a break 
1	It's gorgeous out! I'm once again reminded why I love Cali so much
1	its gossip girl time!
0	It's got to be bad that i start yawning immediately after finishing a mocha wake up from wawa.  need more caffeine!
1	It's great to be back,  Thanks for letting me back on the team  ...And a big ol' congrats on getting married!!!!!
1	It's great to be home! Temp is chill, cat is great and I feel awesome 
1	it's great wether !! i love the sun and julia my darling yesterday it was so funny *smile*
0	its grey outside
0	It's gym day but I'm so sleepy  Someone tell me I should go.
0	it's hailing outside! Eeeek
1	It's hailing?! WTF? I hope the plane can still take off with these football sized pellets.  Sydney here I come!
0	It's half 3 in the morning and I'm half packed and the place needs a clean  no sleep for me tonight
0	It's half one in the morning and I'm drunk. Why can't I stop coding? I think there might be something seriously wrong with me
0	Its halftime break here in the office and so far work still leads by a ton..oh boy...
0	its halfway through the file transfer and disk quota is full ...
1	it's hama time!!...gimme 5 dark brown beads 4 the watermelloooon pleaseee!!!
0	It's hammocking weather!  Too bad the hammock is stuck in my storage unit!
0	ITS HAPPY HOUR TONIGHT  BABY!!!!!!! IM STILL MAD THE NUGGETS LOST THO  ... BUT A COLD BEER WILL TAKE MY MIND OF THINGS
0	it's hard 2 get back to "school" after pesach's holiday
1	It's HARD being honest about stuff like this coz media n ppl be criticizing. But I figure if I can help YOU in some way. My <3 is content
0	It's hard for special to become normal
0	Its hard getting up 4 work wen the kids are still in bed! I want 2 stay at home with them
0	It's hard living without my sister. This will be the second night in a row we haven't slept at the same house.
0	its hard not having friends that like jb
0	It's hard not working with your best friend and seeing old emails and things like that. We worked side be side for almost 5 years.
0	its hard respecting other ppls decisions but imma try, even if it kills me inside 
0	it's hard to be a german student
0	it's hard to be all happy and hyper when it's raining outside  i really don't like the weather
0	it's hard to be artistically inspired in ND   my fashion line looks  more like a costume wardrob for little house on the prairie
0	It's hard to be away from the computer
0	it's hard to begin working after Easter holiday
0	It's hard to cry when the tears won't fall down
0	It's hard to fill a whole collection of Wheat Pennies.  Expensive too.
0	It's hard to find THE little black dress
1	Its hard to keep from gettin burned when love is like fire   NemoNemesis
0	it's hard to leave,being far away from you 
0	its hard to sell a car that doesnt start
0	its hard to sleep with you on my mind...cuz when i start thinking, i always start to cry.. I miss my mara    
0	Its hard to tweet when you have to type on yourself
0	It's hard to type when I'm lying on the sofa with Zoe lying asleep on top of me SQUASHING ME
0	it's hard to work with chesty cough. feel weak  i dont want to spread virus here!
0	It's hard when the one person you want to talk to is 400 miles away at basic training
0	it's hard when youre in the middle of depression and excitement right? ...
0	Its has been a bad week !  sad party !
1	It's has been raining here for the last 3 days but ,the way I see it, if you want the rainbow: you gotta put up with the rain. 
0	its hawt... but am pissed off a lil... plans for tonight have gone somewhere..
0	it's heartbreaking when you see someone you haven't seen for over a year and they've deteriorated something awful. made me sad
0	It's hella itchy!  http://twitpic.com/66m7f
1	Its Here  :: Dubfluencial V - An Ego Fantasy - http://tinyurl.com/nrq82m :: Download Now Free Fast Speeds!
0	It's here!  My new precious iphone is here.  It's so pretty.  Unfortunately I can't play with it until I get home and hook it up
0	Its here. Maybe i will read it. I bet that i wont. However. Sleepy. Weather is dreary again.
1	it's higher than cloud nine, boy. 
0	IT'S HORRIBLY COLD.
0	its hot  going to bed now!
0	its hot 2day and i dont want to go and walk all round Stanmore again!
0	Its hot again. Please cool down!
0	It's hot and I don't want to go work on the ole' duplex. But I guess I should.
1	Its hot and i'm antsy  ha it was a message to meg
1	its hot and im excited about no doubt
0	It's hot and mum said my room smells like a brewery
0	Its hot and my feet hurt but i cant sit down
0	It's hot and sunny and I'm in the garden with my laptop. Which, consequently, I think is about to die of heat exhaustion. 
0	Its hot and the cars aircon is screwed.. its gunna be a loooong journey
0	it's hot as hell and our AC decided to take a shit today
0	It's HOT as Hell here in Calcutta
0	It's hot as hell in this store!!
0	Its hot as tits outside, no unicycling today 
1	its hot down here, but love it downtown on sundays! 
0	It's hot in Bali. Stuck in traffic  on the way to lilo
0	It's hot in my room, and I can't sleep. 
0	its hot in this house. and im sad.
1	its HOT today  more vitamin D for me haha
0	It's hot up here
1	It's hot! 2hours and im home yay  time for a little kip.
0	it's hot.  back in oklahoma.
1	Its hot. I like it. Texas has a good sun.
0	Its hot....
0	its hot...cant believe i have to go to delhi tonight
1	it's hott.. Yay john's coming home for today! and lele's sleeping over  now i wont be so bored! now i gotta cook...
1	it's House MD time.... can't wait to see what happens now...
1	It's houseparty tiiiime  Tired. Had to get up at 7:30 am *_*
0	Its humid today. Last night there was lightning. And now its humid
1	It's HurriKen. The best street dancer in the world. Representing the Natural Disasters
0	Its hurting.
0	It's impossible for me to finally realise that my heart'll be broken in two weeks and new start'll begin at Semptember...I just...
0	It's impossible to battle sleep. Why did I not hit the sack early last night!
1	It's impossible to get in work mode when you're moving in 1 week! So excited I can hardly stand it
0	It's impossible to get on a train in town on a friday evening
0	Its impossible to watch these finals games without beer.
1	It's in! Couldn't have seen it though. Reasonable doubt and such.  #facup
0	its incredibly hot out...
1	Its interersting  YOU, DEBBIE and GIO always write together    VERY INTERESTING
1	Its interesting how one person can make me smile so much and not even know it...
1	it's interesting how one phone call can make your day better!
0	It's ironic - I lived in Los Angeles when I didn't eat meat, and now that I do, I've moved away and I'm missing out on all the new grub. 
0	Its its difficult shopping broke.
1	it's japolino's time!!!! Sushi
1	Its jean day on yall fools  good morning peeps
0	it's jeff buckley's deathaversary  if you haven't heard his music, look it up
1	It's JR. FRIDAY everybody!  Get excited  #jrfriday (via HEEEEEEEEELLLLLLLLLLLLLLLSSSSSSSSSSSSS YEEEEEEEEEAAAAAAAAAAHHHHHH!!!!!!!!
1	it's Jum3h. yes, it is. have you recited surah alKahf today? did you send salaam upon our beloved Prophet salalahu alayhi wa salaam? 
1	It's June ! Wow, that was fast eh ? Haha, happy monday folks 
1	Its June 16th! Go buy LVaTT!!
0	It's June 17. Where is my new iPhone OS? I hope we're not waiting for those goddamn west coasters... or worse yet - tomorrow morning
0	Its June 6th 2009, my birthday. Its 2:14 A.M. and I can't even sleep on my own birthday 
1	It's JUNE and I am still wearing a JACKET!?!?!  That'll be okay till it hits 90 degrees.....
1	It's June and I'm already looking at Fantasy Football Stats!!!
1	it's June and it's gloomy ...love this weather
1	Its june baby! I'll be joining in celebrating a 20s birthday  I'm not a little girl anymore.
0	Its june! What does the weather think it is doing! Im gonna get soaked
0	Its just 5th day in Sunnyvale.. Feel like i am here for the last 1 year..
0	it's just a boring evening
0	its just a shame that accoustic means "no harry"
1	it's just about 9:30 am. is it too early to be taking a nap?? oh i think not. haha  good night!!
1	It's just another manic Monday
0	It's just another manic monday.
0	its just another manic monday...why does monday have to be my long day at work  grrrrrrr
1	It's just been pointed out to me that we never work 9-5... it's still a great song
0	Its just easier w|out. Like i loved my env but it kept fuckin up
0	Its just hard to get over someone you've always thought about being with
1	It's just like a crazy puzzle
1	It's just like if some random person never speaks to you!  Don't be hurt by them they love their fans!!!!
0	its just me and my blackberry
0	Its just mean to spike your hair at a concert when your standing infront of somebody  http://short.to/e002
1	it's just my luck  ♥
0	It's just not cool.
0	its just not the same
0	its just one of them days...
0	It's just over a week until this happens http://twi.la/zhvcd and I won't be there. Again.
1	it's just really time for photoshop.. i just really need it
1	it's just so obvious
0	Its just so sad that the people fighting cancer that have hope and drive, can't win. Farrah reminds me of my dad that way. 
0	it's just started to rain, it's close to 3am and i still can't sleep. wai 
0	it's just TOO hot for my coffee this morning  i need ice, how am i going to find room for ice??
0	it's just too hot to sleep here tonight and  i'm *so* tired
0	ITS JUST TOO MUCH RIGHT NOW. I NEED TIME TOO MYSELF. AND IM JUST TIRED OF ALL THIS.
1	Its kaitlyn on sams phone again  in geometry. Correcting tests. Fun fun :/ love you allllllll
0	It's Kelly's last day at the GAP and I don't even get to work with her  bringing bernard to her during her break though lol
0	It's killing me that I can't spoil on what I'm working on
0	its killing me that im promoting my new blog far more than my old blog but the view count is dead in comparison to the last one  what  ...
1	It's kind of greyish brown with little wings on the side and a mishchievious twinkle in it's frontal lobe. It might be a bit skittish
0	it's kind of sad how people who i have added on here move faster than my livejournal friends page.
0	It's kind of weird to listen to "Blame It" without the kid here... he isn't around to sing with it.
0	Its kinda boring on Twitterland today....seems to be losing it steam
0	It's kinda cold. I wish I would have grabbed a jacket
1	its kinda weird how just a few people can change your moood completely.  school today. art. woop woop,
0	It's laaaaaaaaaaaaaate and I stay up too laaaaaaaaaaaaate. wtf
1	It's lakers vs magic!!!!
1	Its late and Im almost sleeping. So I go to bed before I'll sleep on the couch... Good night
1	it's late and im still up
1	It's late here. I am still working on Gilded Hills Book 3 : Hedge Fund Babies.  Yes EVERYONE pays to play.  Instantly International.
0	It's late right now, no one is around, no one is online, I'm alone and I hate it. I am starting to feel like this is going to be routine. 
0	It's late, but I still need to fix the flat tire on my wife's bike. 
1	It's late, I'm on the phone, and I'm watchin TV...who knew? 
1	It's late. About to hit the sheets. But cba
0	its late. i'm having a spend the night session with my buddie.  (: NOT MILEY. i am in SC! <3 i love it here. i wish i had my camera.
1	it's late...i'm tired....goodnight.
1	it's laundry time. I'm hoping today turns out good excited for our play date tomorrow and
1	its less than 24 hrs til im goin to usa
0	It's light out and I'm not home from work yet. Boo.
0	its like 00:05 where i am and im so tired
0	It's like 1 AM and I'm not tired  This sucks.
0	its like 11:40 and im tired as fuck and i might go to sleep just because i have no fuckin phone!! i cant live without texting
0	It's like 2:02 in the morning... I am so hungry  Christian is making Mac N Cheese <3
1	It's like 3:28 and i am not even tired yet. Lol. Kelsey and i are talking about myself and my lil sis chloe! I <3 you chlobear!
0	its like 5.15am and am still awake.! i really need someone to talk to and helo me through this rough time
0	It's like 95 degrees out and I graduate today! Woo! Also who's going to Buffalo tomorrow?! It'll be my second last show ever there.
0	its like 96 degress but in my body i feel like its 20.. fml. this damn fever just wont kick
0	its like a F***ing IGLOO in my room!
1	It's like a lovely package deal, you buy a flight to melbourne and you get 7 days off school on return  courtesy of the swyne.
0	It's like everyone's flying off to somewhere I ALSO WANT
0	It's like forgetting Sarah Marshall all over again  summer 07, promises were made that I would never feel like that again
1	Its like grand central in here!  Oh wait it is!
0	It's like if some people on twitter are eating hot dogs, why should other people announce that they eat gourmet food? 
0	its like im going to burst, my net connection is a bit slow, im having a hard time to fix it... 
1	It's like I'm really using Facebook!
1	its like mt tweet was never there
0	Its like my second one all morning
1	its like one step forward and two steps back. stuck in a confused state. hmm.. need help?! p.s derek your a  loser face  but i love you
1	its like sooo greendayday
1	I'm off 2 dream awhile. Thanks 4 everything tweeple. Many blessings & much joy. peace, love & happiness 2 u all. Hope ur dreams come tru 
1	I'm off 2 get ready for my psychic #RADIO show. Check website for radio instructions. Special offer 2 be announced 2 listeners today.
0	I'm off again. I have to buy new car tires for my Yaris after I've had a flat tire yesterday evening. This sucks
1	i'm off eating! grrrr, i'm hungry! xD c ya maybe later! maybe not... dunno...  <3
0	Im off every weekend next month. Other than that, im working. 
1	Im off for a bit...tweeet yall later
1	I'm off for a drive in a sunshine  happy days
0	i'm off for a while twitterverse-dunno when i'll return. i'm gonna miss everyone  xxx bye for now.
1	I'm off for a while,things to do,people to see. I'll be back later for more FF,f1 news and other ramblings. Enjoy your afternoon! 
1	I'm off for now. going to wake up super early to get my work out on.   I've been craving gym time all weekend. ha!
0	I'm off for the night.
0	I'm off go bed tweeps! This weather is crazy
1	im off IOM TT Preview on ITV 4 (channel 24 on freeview or 28 if you havnt re-tuned recently  )
0	im off now byee lol gotta get ready for school tomorrow (N) i dont wanna go back this week has been amazingg  x
1	I'm off now, G'night Twitterverse!  Time to stack some z's. *snores*
1	im off now, going out in the sunn! yay 
1	I'm off now... see ya later  xxx
0	I'm off now..talk to you all tomorrow..*sigh* It's a sad life.
0	I'm off out for tweeps...won't be back for hours and hours  Try to be good while I'm gone. xxx
1	I'm off out on the shizzle tonight bitches!! Loves it!!
1	I'm off out tonight in chez vegas.
1	I'm off the the fair now. Wish me luck & sunshine! Enjoy your day
1	I'm off this for the nite u twerbs
1	I'm off to #beatthesun
0	I'm off to a party with a load of thespians, which means I'm going to miss the final of  britans got talent 
0	I'm off to an early appointment I've been dreading. 7 is too early in the day to be awake, let alone coherent.  It's just cruel.
1	I'm off to bed for an early night. Goodnight All. Sweet Dreams
1	i'm off to bed good night everyone!
1	im off to bed im tweet buddies ill be on later ,have a good day 
0	Im off to bed now school tomorrow
1	I'm off to bed now. G'night all.
0	im off to bed now...hopefully to sleep away this damn virus...ugh...it hurts  ...nighty night peeps!!! xoxoxo
1	i'm off to bed one last tweet  #mcflyinamerica #mcflyinamerica #mcflyinamerica #mcflyinamerica #mcflyinamerica #mcflyinamerica  Night
1	I'm off to bed Tweeples [love that word!] Speak tomorrow [today] and sleep well!  xx
1	Im off to bed!  byeeeeeee tweeties  nighty night
