0	I noticed most victims so far are women. And they feature Firefox. And they got off the main plot again
0	I noticed xbox.com updated but now you can't compare achievements  i loved that feature.
0	i now  know what its like to lose all your friends..its not very nice
0	i now believe that adam lambert is gay. so sad!  just saw the pics of his 'gay days'. it's all over the internet!
1	I now close on Saturdays and Sundays at the pizza shop. I feel kinda special
1	I now found a perfect dektop background... David Archie's face!!! LOL....
1	i now has plans  im happy
0	i now hate everything about the animation i'm making, and want to get it over with quickly. Next assignment better be better. 
1	I now have 101 updates
1	I now have 14 strips of nine different color families, and I'm about to begin the center star.   
1	I now have a beautiful niece.
0	i now have a headache from that huge lollipop.
0	i now have an appointment at the dentists tomorrow and 3pm! So not looking forward to that!!
1	I now have every single album by The Beatles. mwaha ha
1	i now have facebook! But I think it's way too confusing. LJ, and even twitter ftw! Haha. 
1	I now have GPS on the motorcycle
1	I now have more followers than followees..... sweet
0	i now have sky in my room, i love it!    i really do have the cold now 
1	I now have the Sleepy Hollow soundtrack and I am getting the Finding Neverland Soundtrack. I love my life.
0	I now have undeniable evidence that there is something SERIOUSLY wrong with me
0	I now have vagina on my mind...thanks twitter  bahaha I was sitting at the table at the winery next to my ex when that msg came thru...
1	I now haves a season pass for six flags
1	i now i have a bump on my nose from when i hit myself with my oar. I love dock fights though it is the nasty lagoon im jumping into
0	I now just ralized how out of shape i actually am  so depressing im jogging around the block everynight from now on!!!
1	I now know how to find the Upper and Lower quatile range  Hey check me out eh ;)
1	I now know what all the "Twilight" fuss is all about... WOW!
0	I now know what its like to be an only child. Its the best. But i miss my brother a little bit.
0	I now know why i RARELY come to the mall. I'm going to be SO ridiculously broke after this
1	I now live in Long Beach!!! Thank you for helping me elude the police and move my bed
1	I now own my first pair of TOMS!
0	I now resemble, Helmut Lang. 
1	I now think it's unfortunate that I can't count....11 DAYS til Tinley (not 10)
1	i now update on posterous as well as here on twitter. so do check out both for updates
0	I now weigh under nine stone!!! But that may be because I have gouged a huge chunk out of my ankle scratching my midge bite
1	I now will start the day with cleaning, shopping and preparing for BBQ later. Then men will cook the meat and say they did everything. 
0	I nvr wanted May to come to an end
0	I obstructive bronchitis
0	I obviously didn't want to wear my plugs today. 20mm is gonna be about 10 by the time I get home. Ear looks like a cats bum
0	I od on da whitecastle last nite....my stomache hurtn
1	I off on a day out with Chris to the lakes as a treat for revising so hard! Very excited and can't wait to take lots of pictures
1	I offered my computer a sandwich today. It took a Megabyte.
0	I offered the dev guys some of my guava. Nobody wanted
0	I officially hate accounts... imma fail for it.. for sure..
0	I officially hate JB haters!!!The brothers youtube account just got suspended!!  Why?! haters? probably...
0	I officially hate moving...this is too hard
0	I officially hate my life today and the one person that could cheer my up doesn't seem to care!
0	I officially hate the Da Vinci Code, the end.
0	I officially hate these bangs. I look like a freakin cockatiel
0	I officially have a 1st grader and a Kindergartener.Where does the time go? That first day of school will be a hard one for me
0	I officially have no back yard anymore  DAMN SUBDIVISION!!!
1	i officially have the key to our new house
1	I officially have the worst earache in the world!! & have to go to work!! Roll on college tomorrow - last day hopfully  What to do next??
0	I officially know how it feels to be unwanted by the person u love
0	I officially need a new battery for my blackberry
0	I often feel like I'm going to have a panic attack when I have to register for classes.
0	I often find myself thinking that team sports for kids are a showcase of poor parental sportsmanship & behavior in general.
1	I often reference the page for myself and send to friends often!  http://is.gd/LFT4 (posting for all again!)  Thanks!
0	i often say things just to annoy people. sorry, can't help it. 
0	i once knew a man who lived in a hairspray can, i used him and shook him and them someone took him,god i miss my man in a hairspray can 
0	I once took this sexy pic of me in the shower. LOL I wanna see it again now but I can't
0	I only ask this cause my parents couldn't bring me any when they were here...
1	i only ate dinner for 3 days now. hhaa! about to do homework!
1	i only ever seem to get on here when i'm off to bed. so once again.. night world! don't miss me too much while i'm off in dream world!!
0	I only got 602 fs profile views  haha ^-^
0	I only got about 4 hrs of sleep  I am not a happy lady. I want sleeeeeeeeep!
0	i only got to play half a game of hockey... it started pouring down and the sand turf wasnt playable enough to continue
0	I only got to see the first set  but I'm sooo happy  Roger won!
0	I only had 26 RSS readers to begin with, and now I only have 21.  I'm srsly gonna cry.
0	i only had one piece of cake.
1	I only had two drinks last night and I feel hung over today...  Warrahell man....  Gotta be this GYM thing....
0	I only have $34
0	I only have 10 followers
0	I only have 13 fans of facebook..........http://bit.ly/eyd9n
0	i only have 2  followerss
0	i only have 22 followers
0	I only have 3 followers?????
0	I only have 5 entries!
1	I only have 7 bucks in da bank! Anyone wanna buy me a drink
0	i only have a dollar left  i usewd $2 on massage chairs
0	I only have a few days left in Davao.
0	I only have like 4 oreos left
1	I only have one day left in school  My 16th is approaching
0	i only have one friend on twitter!
0	I only have three more weeks left in New York City  boo!
1	I only have to look at ms elseas face for five more days  woaa two years with that woman was TOO MUCH!
0	I only hve 9followers
0	i only learn this day for school
1	i only leave clues!
1	I only like 2 vampire movies. 30 days of night (go figure, I love Josh!) and Twilight. But mostly 'cuse I'm a sucker for romance  haha
1	i only like getting drunk with danny. it's so fun.
0	I only lost half of a pound...such disappointment
0	i only missed one, and that was the author apperance one 
1	I only need 28 marks over 2 exams to get a C in maths. Sounds reasonable
1	I only need 3 more fans to have 250.  Check out my lens and see if you want to be a fan of mine.    http://www.squidoo.com/teddi #squidoo
1	I only send along things I've bought, or at least verified. I won't send junk (I see too much of it, and won't do it!!) 
0	I only slept 8.5 hours and I feel like I slept 12. Not a good feeling. Gotta go to bed earlier. we'll be slammed tonight for sure.
0	I only slept for like 3 hours...I wish I didn't fall asleep while talking to my boo
1	I only wear my retainer at night when I'm supposed to wear it 24/7...whoopsie daisy
1	i only wish i was like ginny's mommah and go over the twitter limit in one hour
1	I only wish I were kidding so stop laughing!  Oh, okay, go ahead and laugh! Laughter is good for the soul and it is truly hysterical! 
0	I only work 2 times next week
0	I opened a scam today   if you get an email from a site called tagged, do NOT participate in it
0	I opened his fb, Oh God! i really wanna be his friend  Kenapa sih gue gabisa kaya yang lain? Yang bisa deket sama dia. What pity i am!
0	You should've met up with us  it was fun. I didn't drive though! Too many mojitos. Hehe.
1	miss you tooooo!!  lunch asap or else!
1	sorry i didn't mean to confuse you jackie  please accept my apologies jackie G
1	Good choice  It was great to watch live on Ustream! I think I'll watch it again http://bit.ly/ai6Tl
1	hehe it's been a long time snice i've been on twitter. i've been getting twtter withdrawals since my computer broke  lol
1	-- This was so funny!! I am still figuring out how to tweet.
0	Sick kid...oh no    Umm Happy Mother's Day?!
0	Why you harumpfffing me? I didn't do nothin.
1	caught it!!! I'm in a pretty good mood  ima fill ya in tomorrow
0	oh honey I hope everything is okay.
0	feel better hun. Hate to see my always happy ppl down but were human so turn that  into a  xo
1	Email me with details on how to get followers, please. 
1	Helped my sister with her children's book idea and finished a rather nagging scene.  Which is always a good thing.
1	I make a yummy homemade chocolate candy.
0	Sorry to hear about the bad news.
0	  I think the brazilian guy is sooo cute..shame he is bi
0	miss you too
1	many thanx guys
0	this weekend went from  to  with in a matter of hours sorry I was like sat but I'm all Glad ur comin bak sat nite :-D
0	yea its annoying me
0	i am not new, but i will say that it is extremely dissapointing when you can taste that your gum is about to loose it's flavor 
1	god's honest truth! and i'm glad someone got it...
1	Hey  How are you??
1	I'm fine, just gonna start bumping my stories on VIP 
0	she's in Africa - haven't heard from her at all
0	took my burger and the last bun.
1	you are gonna be AMAZIN' jackie.  just wait and see what God's gonna do through you.    thanks for your servant's heart!
0	 I'm not leaving my room until i get a bike.
1	Haha Oh, one of the tumblr peeps I follow posted that link. Never heard the term 'sharted' before now... 
0	it was good. im bummed i wont see you tomorrow!  i have a wedding. kiss jack and sophie a 100 times for me! omg JACK IS 3!!
1	*followed* nice tumblog! Had to reblog the quote!
1	i love cobra starship!!  thanks for the suggestion!
0	Why don't I have you on myspace
0	first of all i love your picture, PICTURE whore. & the boyfriend???  JACKIE. FML. WHY HAVEN'T YOU EMBRACED THE PHONE &
1	I love the arcade fire
1	i said OR... that combination is terrible! and thats the whole entertainment aspect... NO IDEA wtf will happen!
1	i didnt eat the rest of the cupcake, so proud of myself 
0	I didn't even do anything to you and you fucking avoid me?? You fucking ruined my night thanks
0	I didnt even get to get anything fun lol, like eyeshadow or lipglass  oh well haha... I really needed these two.
0	i didn't even get to say goodbye
0	I didn't even get to see u dance
0	I didn't even get to watch wolverine this weekend.. so disappointing.
1	I didn't even go out last night, time to go to work 
1	'i didnt even know i had a cuncusion untill i tried drinking water through my nose' lmao thank you mike
0	I didn't even realize I was singing aloud in my car with the window rolled down until the people walking started looking at me funny
0	I didn't ever really hang out with Erin much, but now that she's leaving I realize I totally should have!  
0	I didn't expect that I would lose my job today!
0	i didnt feel any pain until about 8:30pm when i finally relaxed.  and then it hurt like hell and swelled up. ouch.
1	I didn't feel like going to the movie today.. I'll go tomorrow when it's less crowded
0	I didn't get 1 call or text today from any of my friends or my bros. I don't care about Bday wishes, just a call to see what I was up to. 
0	I didn't get a chance to wear the MacHalo again
0	i didnt get a cookie
0	I didn't get a number so i don't get cupcake
0	I didn't get a piece of cake ..
0	I didn't get a shirt with Ghostbusters.
0	I didn't get any dessert
0	I didnt get any numbers for the mega million....thats why i dont like lottery...i never win anything
0	I didn't get anything at sawgrass.
0	I didn't get anything for my dad today! He doesn't want me to spend $ either.same went for Mother's Day.  I did cycle with him today,
0	I didn't get into the ELDP Program.
0	I didn't get McD's breakfast because I didn't answer my phone
0	I didnt get my season tickets... I'm so sad
1	i didnt get my trophy for the fivek.....the guy said Beth Lowell instead of Meredith Lowe....odd but happy
0	I didn't get ro see emery play today but eating shopow and listening to there CDs I guess that's an ok substitute sorry I couldn't go
0	I didnt get the bootlegs
0	I didn't get the job  but I will keep applying to other school.....I do want to teach!!!
0	i didn't get the job i was interviewed for
0	I didn't get the job. Somehow I am not surprised. I don't know who I was trying to fool.
0	I didn't get to buy the sunglasses
0	I didn't get to even ask for his name and do the pep talk shiz  but I'm positive we're in the same school.
0	i didn't get to finish my coffee before it got cold
1	i didn't get to get my anti histamines coz i spent all my money on other stuff. pretty stuff nonetheless
0	I didn't get to go to the museum. My ankle was sore again. I must have overdone it at the gym - though I didn't notice it at the time
0	I didn't get to go to VBs tonight   Oh well! Stuck hrere doing nothing
0	I didn't get to observe National Doughnut Day today. I feel cheated.
0	too bad they were both preemies!  My son got a lot luckier then she did.
0	done what to you?sorry I can't see what tweet u replied too!
1	hahaha it's all good. hopefully new one soon
0	i love you and miss you
1	I know what you mean... I'll be heading back to Buffalo for a visit / eatfest in July
0	I havent seen you at Gruene Hall for like 5 years  I feel so deprived
1	Whoa, awesome!  You're going to be great!
1	Yes!  LA PRIDE here we come! haha!  If its anything like last year we'll be chuggin bartenders bottles and gettin free shots!
1	cool  beans
1	Home safe and sound
1	Yay!! Glad to hear it
1	 Sun's welcoming you!
1	oh really? just on holidays? or for work? Did you live here? I'm thinking of visiting US if i got work in Canara for a while.
1	laundry day? how fun..  haha
1	ur awsomeee lol  stil havent seen u with ur new haircut though...
0	nope they changed... i used to see every single tweet no matter who it was too... no i cant  lol  i was reading about it 2 lol
1	misread privacy as piracy
1	Oh Jack, I don't remember at this point 
1	that's a pretty neat suit.
1	Congrats on ur weight loss - I did that a few years ago, down 40kg and still a few I'd like to lose  Not easy but worth it
0	Cufon uses html canvas, which can't be inside a button or input 
1	 hey! how are you
0	I'm secretly 80 though. I'm going home now. Ran out of booze.
0	I'm blue.  In other news, you will love tonight's DC!
0	cos of school the next morning? i feel ur pain
0	naw  all i could think when i saw your tweet was that akon song xD
1	oh damnn. i got free chocolate for selling freddos for my friend  lol
0	aww jack that makes me sad  I am only slightly evil and I am taller than you
1	damm man that looks really nice
0	Yeah ... I even rang them up to see if you can change days but you can't  But applied for all the others so might get them
1	Game Gear FTW! xD Though yeah GameBuy Color with Pokemon is complete WIN
1	going to an advertising company - should be ok
1	I'm already picking out the parts  It's going to be a Core i7 machine with the Nehalem architecture.
0	they knocked down my old school years ago  housing development FTL!
0	Mojitos are on the menu this evening, so I will do just that! Wish you could join us, though. 
0	alas, no, Internet is only available on Virgin Smerics routes coast-to-coast and along the west coast. Boo 
1	 yeah... right!
1	see you are evilgirl  im innocent ohh guess what i thought of you today!
1	get him drunk then take him to a video game night. Cheap version of D&B but no doubt just as much fun if he's drunk
1	We. We will find him when they start filming
0	hey, I walked by you last night n didn't realize you said hi till I passed you sorry for being a meanie!  
1	At leaast you look young  Young at heart anyway!
0	 you're the WORST
1	Let me know Jackson...I'll call in security!  Such is the life of a celebrity.
1	- LOL - we have all done it at some point in time  - I reply to myself and make jokes about it
1	 where are you lil buddy? are you not working? BOOOOOO JK
1	I saw the giveaway for As You Wish on Goodreads and entered  I can't wait to read your book!! (Whether from that or not)
1	Yes, and it actually worked when uploading this time 
1	I'm try and remember ,she'll love going to see Grease  xx
1	It's all these people that have been laid off. Nothing better to do besides make up recession related puns and rhymes!
1	love your avatar pick  I'm  not a stalker or a weirdo I grabbed u via  ;)
0	 oh well, i saw it a few days ago....well, last week. next time... i'll need a text alert :p
1	sounds like you are keeping busy Jack
1	I know about other things, don't you worry your silly little head 
1	I'm doin well, just relaxing workin on some classwork. 
0	. thats it.. Just
0	noo you can't go to disneyland w/out me
0	they were both in ojai today!
0	It was amazing! The best one of their's I think I've been to! I'm so sad it's over now though  x
1	ooohhh that is yum! ENJOY IT! There are no kgs on mothers day - its one of the perks! Is GREAT
1	I know right? thankfully it's only API so I can still use non API apps!
1	Politics are so dark and dirty!  Having second thoughts now... LOL
1	thanks for the follow friday mention!
0	ill come in and stalk you...sike I live like 4 hours away
1	Yes, this guy sorted Paul's back, my neck and Daniel's shoulder 
1	 Sweet, bring guitar - I can't wait to hear it!  That's one of my fave songs in the whole world and I love u singing it   xx
1	Haha!  Thanks for this arvo - loved it.  See u soon    Also, keep the 24th free if u can xx
1	I'd feel better if I knew anything about feminist theory! SO much still to do, but I'm sure you're right... 
1	Hahaha D we are going to rock the shit outta her
1	heyy kackityy jackk whatt youdoinn ntcc hey babee pss aquii enn la libraryy off school wooohooo
0	I have to go now  Talk to you later. Bye.
0	oh jesus, thank god im not there to be watching that with you. its only 8 here.. im not used to the differenceee 
0	i didn't get to play wow last night.  maybe today? idk
0	i didnt get to see drag me to hell today
0	i didn't get to see him today  and i won't see him tomorrow. but i'll see him sunday.
0	I didn't get to see the circus or their tricks...
0	i didn't get to see Transformers, it was sold out! 
0	I didn't get to talk to jeremy at all today
0	I didn't get to upload my new music to my dam iPod
0	I didn't get to watch the Giants game today  I had tickets but couldn't go because we had dinner for father's day today
0	I didn't go anywhere today  School starts in two weeks so I guess I'm buying books soon.
1	I didn't go to Mexico btw but if I  could I wouldve.
0	i didn't go to Monterrey because my mom had a headache and she has her allergies
0	i didn't go to school today, i felt sick    it was the first day back haha i didn't get homework yay!
0	I didnt grab the mic.
1	i didnt had enough sleep. *bangag* i hope monday will make me feel happy and kilig again!
0	I didnt had the opportunity to see nick in person  They Havent Come To Colombia Yet Is So Sad.
0	i didnt have a chance to get a ticket for NFG my lazyness has finaly bin my downfall  ebay here i come
0	I didn't have a good day today.
0	i didnt have any   ;-(
0	I didn't have any dreams that I remembered.
0	i didn't have enough sleep
0	i didn't have fun at the club tonight, had a lot on my mind 
0	I didn't have the change to get my book signed by Rana Hussini. There has been a lot of people waiting in the queue and I had to run
1	I didn't have to go to work tonight - I am overjoyed  I’m bad with things like this. I fear them so much... http://tumblr.com/xsp1ylni5
0	I didn't have twitter turned on today but I've had a great day. Stuck in traffic tho
0	I didn't hear the damn yell!! I'm soo pease of righ now
0	I didn't hear the thunder last night!
0	I didn't hear the thunder storm
0	I didn't holla at one girl.  Not one.  I'm too quiet.
0	I didnt know Ballbusting was a fetish?? no....really!! dude like that
0	I didn't know coffee could make me this high
0	i didnt know getting up early felt so ... good! psyching up, then studying for 8h. 
0	I didn't know gibson on ncis had a daughter. That's so sad you guys
1	i didnt know i was getting this with the cd  what cuties  http://twitpic.com/6oq3e
0	I didn't know it was possible to get a sunburn this dumb looking.
1	I didn't know Jake would want to run, but he was trying, so we went for a run and now we are both very tired. 
1	I didn't know Kirk Franklin is usign twitter 
0	i didn't know mission impossible 2 so sucks...
1	I didnt know that!..... Lakers game 2morrow
1	I didn't know the movie "Body of lies" had a part in JORDAN!  I gotta see this movie!!!  http://bit.ly/M0kuf
0	i didn't know u cud actually Lose Sleep over something........until now
1	i didn't know where to turn to.  i haven't been using this in awhile. hiii
1	well I'm a nice guy... wouldn't push you in the water! can't ruin that ipod of yours.
1	I LOVE YOU BEST FRIEND FOR GETTING A TWITTER JUST CAUSE I ASKED YOU TOO!!
1	Weird... Do those dreams happen often? Was it some kind of enrollment office nightmare?
0	wish I was there to hang out with you and take care of you
1	yep yep. GO GATORS  hehehe my neighbors hate me lol.
0	My trip got postponed. My bad.
0	Sorry  I've kind of been thinking of getting an MBA, so I'm with you!
1	Hey jaclyn  Great to see you here on twitter  Let me know if there is anything I can do ........  Shelley
0	most of my cukes are tragic too
1	we should start a club!
1	nice tweet. I love it when people mention me in their tweets.
0	No news of Chuck renewal yet...  I'm getting worried....
0	I think Mr. Simmonds thinks we bring that upon ourselves.
0	awww no I cant believe your new car Im sorry dude that sucks  I might come back once more before school in the fall!!
0	I knowwwww, it was insane. My stomach lurched eep  but he's back to his badass self
0	don't worry  you'll find someone that wants you just as much as you want them.. I'm goin through the same right now :-/
1	  how you been doing Jacob?! Long time no talk bruh...
1	my pleasure
1	click the link in the invite and follow thru
1	Yes. Yes I would. You'd be welcome to stay with us haha. I'll sleep on the couch
0	doesn't like me.
0	Dude, I thought that was real, I shat my pants! 
1	http://twitpic.com/6jt0d - very cool picture
0	im in montreal dummy
0	was fine, need to start flossing though  I hate flossing
1	jonathan and I went and met up with brandon and lindsey. Friends from San Fran area. It was lots of fun!!! And nice weather
0	that's kinds sad that I just said that. I used to listen to them everyday
1	yum! we threw some fajitas on the grill tonight - yeah for grilling season!
0	... in that case I have no other suggestions
0	and, fine. Then u just made me lose. Some friend u r.  oh. And u made half the twitterverse lose, too. R u proud of urself?
0	I have no friends, only 18 messages! 
0	what happened sir?
1	XM / Serius. They merged now. (yay monopolies!) I shall start getting used to the programming so I can be more like u!
0	well to you maybe. Again, i'm really trying not to be an ass hole but she has a point. Sorry dude 
0	Man what an awful job. There were SO many good presentations. I hate to be the bad guy.
0	that sucks
0	aw  haha i got excited at first! .....but jfk? boo. i'm actually wearing an i heart NY shirt right now lol crrazy!
0	I didn't know you could get the fail whale message while using. Twitterberry.  Lol
0	I didnt know you went on an interview.
1	'I didn't know you'd be my everything.' Aww..
1	I DIDNT LIE!! ALL I DID WAS CON YOU IN 2 VOTING FOR EVERYTHING YOU LOVE 2 DO...BEING YOURSELF
1	I didn't like "Casino Caliente". I guess you get used to Las Vegas!!  http://twitpic.com/5efen
1	I didnt like Pineaple Express... and I usually love James Franco... aww Shawn and Mark are in the audience...
0	i didn't make it. she isn't online anymore.
1	I didn't make of to church today guys, LOL but I'll be back next week  I promise!
1	I didn't notice that we're leaving after a couple of days, of to the province! No worries, it's just for a week. 
1	i didn't notice... it was rainin',, aha,, smiLe 
1	I didn't officially say good morning, so good morning!! 
0	I didn't place in Computer Security  lmao
0	I didn't qualifty to be a verified user
0	I didn't realise Channel Five showed the NBA finals! I wish I had the energy to stay up till 4.30am
0	i didnt realise how awesome steel panther are haha i wish they had of been on a different time at download
1	I didn't realise how wet I just got. But oh well, it was fun 
0	I didnt realise i'd be poor.  weep weep
0	i didn't realise my poster was i have had to resort my walls haha off to revise again
1	i didnt realise that i passed a thousand updates. this is number 1011 actually!
0	I didnt realize how much i needed the internet until I lost the ability to have it!! Im sad now
0	I didn't realize how much I'd miss having a dishwasher
0	I didn't realize the title song of "The A-Team" changed to a shitty 80s song at some point. The original song was so good
0	i didn't realize there's 10,000+ plays on my last.fm already 
1	i didnt really do much revision today which prob isnt a good idea seeing as the exmas are tomorrow...ah well ill be fine!
0	i didnt really know i was fightin. im just playin/kiddin round.sorry i'll stop
0	I didn't really need LCD tvs in my bathrooms or waterfalls in the foyer or heated tiles in my bathroom  dam u Cribs
0	i didn't see him at all today..
0	I didn't see him. Haha.
0	I DIDNT SEE JERBY TODAY
0	I didn't see you either
0	I didnt sit on a little strea but by a little stream, btw...writing is not for me today 
0	I didn't sleep a wink last night  I feel dreadful...bleh...
