1	Get 100 followers a day using www.tweeteradder.com Once you add everyone you are on the train or pay vip
1	cool anberlin might see who's supporting and might go too
0	ive been gr8.been partying hard and had a date with a pretty girl today. You been up to much? Its 2 hot to sleep  x
1	sometime this weekend. Evening, 2 hours or so 
1	are not boring. your twits entertain me and get really good songs stuck in my head.
0	I wish I could still drink it but I had two bad nights with white wine in London and then I was sick for almost a week
1	it's same thing when you go to Bali, Indonesia 
1	mmm, flowers like this one?------>http://twitpic.com/6e6z6  a sunny flower 
0	Must be nice I haven't seen the sun in over a week... it has rained non stop in north florida.
0	CMON CHUCK.  If no chuck, ill be a sad panda 
0	btw soph cant make it today. she has a doctor appointment.
0	I feel sorry for him though
1	kaaaaaaty, i love your songs 
0	mr nimoy did not attend the screening AFAIK
1	I'll b up for that also
1	jst caught up on ur blog..laughing hilariously at ur 'singstar' craving lol Kareokee all so?
1	jsut commented on my blog re: piggies linked you to the melbourne shelter
0	perhaps it's the universe's way of testing your patience? People often don't get  "leave me alone" vibes...
1	Yo! Thanks for letting me follow you!
0	having blaise and meg round babe, all going to windsor next day so we've planned for them to stay over for a while  i'm sorry!
0	I kept missing you on Facebook
1	Don't worry. I fully intend to be there.
1	 Dude crazy storm! I just lost power! Where in Oc are you? I'm costa mesa..
1	pleaase dont start dating her, that would suck, then disney kids would listen to ftsk. thanks 
0	ps--my friend ARE DEFINATELY PLANNING to see you guys live..again. last time for me was prbly bamboozle left?
1	shes must be a truly amazing woman for having a phenomenal son..
0	so sad!!!i hate that they lost
1	Sweet tea from Chicken Express and a peanut butter sandwich.
0	texas misses you already  its just not the same without you.
0	that wasn't nice
1	well you know...thats why its called a MIDNIGHT snack jonathan! everyone does it
1	will you guys be doing any shows in la cause i am flying out there july1-8 and i would love to see a show.
1	YAY i love youuuu  http://twitpic.com/6p8wd
1	Your gonna get fat with all that late night snacking! Piggy
1	you're gonna be okay
0	you're making me even more jealous. i wanna go back
0	come back to ny soon 
0	I misss u<3 wish I could be there tonight  I have no ridee 
0	but i rarely win these kinds of things
0	start back to 300.
0	hey real i wont be able to make it sat. due to family coming in town  i was beggin my mom to come, but ugh if i get time ill cum
1	I'm up! And soo bored let's talk
0	iPhone not good for taking concert pix....no Gwen
1	and anyway i'll see you all tmrw
1	 your always welcome darling over half way to 3,000 wooo think its the new pic  looking sexxxxy u suit the shades....
1	awwww. a man that would rather be home with his family. very good quality to have
1	hope your enjoying this game, and they win for you, get some fine chicken wings to eat while you watch.. Perfect 
1	just listened to Crush My Cool tonight for the first time ..
1	when's the next lunch break babe?
0	im a smut i know
1	dats good to hear
0	Hey babez...what's wrong?
1	Yo I heard Webster Hall was crazy and that Strata is even crazier.. LMAO.. Sounds like a great night.. Have fun
0	I don't want it! I want football.
0	Im LiSteNiN tO MuSiCa ahOra....Yo TrAnSfgRmErs CaN b SeEn ToNiTe BuT u GoTTa WoRk ToMOr
0	 OMG! What Happened??...Is Everything Alright? Hope There Aren´t Too Many Damages...
0	i miss our sushi lunches
0	it's nice but everytime u see her she's playing with it
1	lol awww. love (i hate love) but thats cute
1	   what a tune.  Makes me wanna learn French slang.
0	I thought I could squeeze in a hike tomorrow, but the studying stacked up.  Maybe yoga Mon or Tues?
0	I have them all over my hands
1	Any excuse to buy clothes! Woman haha
0	Aww no  I got two bonus tickets for next week hehe! Bring on the 30mil!
0	Yea! I hope I don't get to spend the morning in the airport again! Especially with such an early start
1	LOL we can watch have sex w/monsters and blow sh*t up
1	 sadly ive seen far too many girls like that
1	... genes sure don't though
0	I quite like the purple dress  flaps
0	I should totally go d/l an emulator again and play these, its been ages since I've played them. Cant buy game...lost GBA 
1	lol that is prob one of my most fave vids of your's! i cracked up so much the first time i saw it.
1	totally... Next time we'll have to get together
1	thank you! part 2 should be up in a few days!  -gaby
1	thanks  I'm basically just giving her the cold shoulder right now. I think she's getting that I'm angry at her.
0	grr wat jerks  they need to let u pursue them i mean what do they aspect from u to just stay jobless for the rest of ur life
0	Oh honey, i have no words. i don't think i will love Sarmy as much w/o you there 
1	Good luck with the interview
0	  what are you doing when you get back?
0	I am working honey and a bit broke. woho   when are you leaving?
1	i know right?! I so planned to wake up in OZ today
0	Thanks! Herb butter does amazing things to grilled fish. The coldframe lettuce started to turn bitter after one warm day
1	would like to know about our public spanking, we'll be lost in the ether before anyone notices 
1	i luv this pic you look purdy!
1	oh whoops haha probably should have put a comma there
0	have fun. i'll miss you.
1	U should help me like better
0	ughhhhhhhh.   i miss him. and his hepititis havin self.
1	Did you have withdrawals??
1	i'm really glad you listen to good music like lydia
1	no problemmm  sleeping at rogers tonight then chillin with dylan tomorrow.
0	I sit behind a desk in a cubicle farm pushing papers from one box to another...
1	Hi Kate! Good lick with work. Are you back in Manila?
0	Cheers    Off to take the little guy to the doctors now. Then to dope myself up with vitamins to make sure I don't get it.
0	yes indeed! nothing can wipe the smile off my face!! how did the workshop go Kate? Hope it was a success! Sorry to miss out..
0	hahahah! Snayup! And no i do not, soz 
1	Figured that; it was a late night. I'd DM back to you but you don't follow me.
0	-Don't blame you, I have made myself insanely nauseous 
0	Thank for share your new music video \o/ , but youtube says this video not avalbe in my country  any other place? 
1	that was an amazing concert!!! got some really good video and pictures
0	ok hun, I am 9 hrs ahead. I was up in the night and thinking of you, then couldnt sleep 
0	I can't delete my fails either
1	I should have said "beach in hawaii"
0	I think had a spare - may have gone though.
1	She's entering a competition and needs to come up with typical English menu. We were just throwing ideas around
0	Nope, the earlier showing, I think it's at 3:30? So we'll miss you guys. 
0	 Hi Kate!! Do ya know if the winner was announce?  It's very strange, Jordan don't says nothin' about that 
0	awww I miss my home!
0	No not at all
0	No Way!!!! ahhhh that's not god... poor baby
1	ahhh rob (L) i need to watch that film havent seen it in ages, i might watch it later tbh  and i agree about miley
1	nah its cool. we'll have spring rolls as a late lunch   ughh i hate this stupid english thing.
1	coz i was right in front of him with no barrier or other person between  so he'd just bend down to me
0	haha next week i have assessments on every single day
0	i know aye
0	lol i didn't get one with andy and bradie which sucks, i wish i did  -->
0	i hope so fighting made me sad  and i want us to be awesome
1	Nah it's definitely "Full of Grace" but "Angel" is a good song too
0	We're with you on the math for sure.  Too many days other things came up and math didn't get done
0	;) LMAO. i knew you'd do it! my brothers bin helping me with mine, he's so clever its actually annoying  lmfao xx
1	hahahh  this secret is slightly confusing me though! x
0	Lmfao, I laughed, and cried, and now I'm annoyed coz I can't find my fucking CD!!!  lmfao.
0	LMFAOOOOOOO !! i fail at spelling  but wheyyyyyyyyyyyyy wotsit land ;)
0	I'm sory  rip. She was a great girl
0	my picture is not even here  http://bit.ly/JXMsL
1	receive an exclusive 10% off discount when you pre-order!
0	thats no fun  work on it outside
1	you should be the celebrity consultant for real and fake accounts everywhere
0	Yeah i kno what you mean. i am at school so i will only be able to go on minimally
0	don't do it! its not a cinnamon bun on the inside
1	That's an easy problem to solve! Consider yourself followed
1	Sorry. What I meant is that there seem to be no need to rush. We will get a  break long enough to shop around for decent AC.
1	dunno...twitter is your bitch i suppose. btw i just got a comment notification from happy sperm
1	i see you're an artist can u make a logo for me for Get Known Radio?
1	Okay you helped me make a decision about the two- I will see the Hangover today
1	That's wonderful! Thank u sir!
0	my mom said where is ken? I said workin'....she said man he's ALWAYS working, he can't ever have any fun, and I said I know 
0	aww sweetie I hope you feel better soon, you've been sick for ages now! 
0	Ouch! Hope you're not too sore
1	Haha, i came home from a long night out, and all i saw on Tweetie was Khayyam Wakil. I usually don't announce and shit - LOL 
1	Happy Birthday, buddy! 
1	Is this the race to zero? LOL
1	just teasing - cracking stuff
1	No. south arkansas u.s. Kim in southern dialect sounds more like khayyam.
1	Or may be YES!
0	she ruined my friday night as well
0	 I wish I could!
0	Kid I am in so much pain waking up this early. I only went to bed a few hours ago. I'm getting old yo. Can't rock it no more
0	man I can't see it! I dunno why? Prob because of my phone!  let's try again
1	Good morning   How are you?
1	got sum canjeero nd shaax for u
1	we had the american version for 2 seasons then it just disappeared not even a goodbye. But thank god for Youtube
1	With respect, I am VERY invested in that song, so please choose wisely!!! 
1	I think you should try to do something nice everyday and you can start with me!
0	awww lauraaaaa I miss you too!! Come play wifff me  especially since doesn't like to invite meh to movie dates!
0	goose, lemonade & a slushie that i got on campus lol. that & some long islands. i drove tho so i didnt get to drink them 
0	stuck at work  But im down on other days Im free. I can flounder like no other.
0	Doh, just got home and realized I'd left town just a little while after your message.    Sorry about that.  Have a good WWDC?
1	hey, wow it's been a long time 
1	u don't have school today????
0	wow .) the new one, he bold, is awesome!!!!! 10 minutes and i gotta go 
1	yes maybe  and u?
1	album is going to be great, cant wait 
0	AND it's raining in Surrey! Hmmph
0	it's too far from my house
1	Listening to your Album on Myspace now, It's amazing! Well Done 
0	so envious.. I want to go to Japan / Tokyo too
1	im in san francisco.. Its sunny and warm with a cool breeze
0	that pic gave me nightmares
0	why are you, and everyone else, not in 
1	Those 2 are my fave colors!!!
0	i was on the fone wit working out our pralums lol.. we hadnt spoken for one day it felt like 3 years
0	jealous! I would love to be at the beach.  The weather here in Ottawa is not good
0	i want to come so bad but i'm not 21
1	I hope you got inside! By the way, I might be giving you a phone call tomorrow 
1	there are seats left at the Holmdel show on Sat   I found 2 in row Q in the center section and 2 in row H on the right section
1	Fox 25 finally ran a Morning News tv ad that included You!!!...just saw it this morning
0	Oh I'm fine. Just getting ready for school. That means I won't get to play DotA at all.
1	i follow ceasar millan's exercise discipline and affection... really works for bullies who can be cute stubborn..
1	We're trying to be polite.  Talking about people behind their back is rude!  We are classy ladies.
0	I know they did a release show in Sac and a couple openings at retro, but I couldn't go  I just looked at their myspace and
0	the closest they are coming is in Monterey and some random rivercats game in sac, but nothing after that  Boo!
0	HANAN! what are u talkin bout sad news  direct msg me and tell me! I MISS U SO MUCH. i swear.. pls still b comin home!  <3
0	Naps always sound like a great idea, but they rarely are - such a shame I love them 
0	Ah. Sorry to hear it. Suing is usually only fun for one
1	RE:itunes suggestions michael johns from idol new single heart on my sleeve listen  www.myspace.com/michaeljohnsmusic
0	dude. I never get irritated. :| I take part in it, don't I? 
0	I am with you on the weight gain prayers bro ... Tubs of icecream later I seem to not be able to put on weight too
1	I had seen 99. it was good ... was asking if she liked it aswell. yes 5june is the date i guess
0	nahi  usually prefer strong tea!
0	nope  I am not the owner of a million dollar wall painting industry
1	Thanks a lot  for reco
1	but I will keep that in mind! Thanks!
1	i wanna learn how they make it.
1	it's called the flying pig roadhouse. it's a biker bar right by lake dallas on the way to lewisville..  we need to hang!
0	Yes! I hate it, lol. Do you have a Mac? I do. Apparently it's not working correctly on certain types of Macs 
0	 I hear you, Keegs! and I was sooo looking forward to this one, won't be able to watch the next 2... 
1	all day every day
1	its cool mamas take a nap
1	Haha last one promise!  I think Caleb is interested in coming 2 he has been working 2 much this week he needs a break.
1	WE GETIN THERE!!!!!! ON SUM TREY SONGZ JUS GOTTA MAKE IT SHIT..NO1 STOPS U FROM ACHIEVING UR GOALS BUT U!!!!
0	omg!! thats horrible
0	wat is this! watch the best movies in the world without Blake day!
0	im bored too  I guess everyone else has a life tonight
1	Good luck!  And I'll see you on the 28th, because I'm also going to both voice acting classes that day!
1	hmmm...well, i guess that'll teach me for leaving my guard down! 
0	tough nites blow
0	luca i wasn;t even about for friday i fucked up  r  u still pompey ?
1	mwahahaha thank you
0	hahaha, yeahh. I wish I could be online everyday.  Twitter needs to fix their problems... lol.
1	maybe he likes them both! lol... but didn't he say that cook is his favorite winner? sounds like he's a huge fan!
0	Oh, ok. ughh. it's making me really mad cuz he's sending adorable tweets today too... 
1	your'e a freak
1	hey, just read your interview. Pretty cool - and honest, really enjoyed reading it. 
1	everything you say is interesting /brown nosing.
1	it sounds sweet, might purchase the album myself  p.s. hows rob (robbie williams) doing? any news on his new album? 
1	still readable though
1	Welcome Mark! I'm new to this myself. It took me like 3 hours just to figure out how to follow people. Rocket science!
1	Welcome, Mark! 
1	WOW, ur numbers r jumping! never seen anything like it! Its not far! Its so easy 4 u when lily an ur sister r ur protegees 
1	jep I could use some sleep
0	sorry bud  I'm in Duvall eatin awesome burritos...
0	never text me back  haha.
1	that is seriously the coolest thing ever 
1	& you guys were really good via phone tonight, see you friday!!!! 
1	btw You did a great job at turning Tila's hair black. But it's hard to turn that gray to white huh?
1	I wanna be a fly on the wall too!
1	maybe you could say it in German and I might be able to understand with Google language tools.
1	Me too! That's my favorite cookie, next to nacedonian nut coconut! =D Hi Max. Did you finish your project? 
1	No, I don't know. hehe  The teeth has perhaps the great of your head? Hmmm, can you say it differently. 
1	Nope! Can't see it. Private.
1	OHHHH HERRRR!!! YES I REMEMBER HER WHEN TILA TOLD US ABOUT HER!!! I didn't follow her cuz my twitter was private then.
1	Sure! I'll load it on my background when I finish. Nothing special, just playing around. 
1	That's great!
1	well ofcourse! lol  i'm just not gonna follow ppl cuz some celeb tells me to lol, thats what i meant ;)
1	yeah i hate the time difference too....maybe you can ask her about it
1	Yeah, not very creative. Probably bots. 
1	Thanks for the 'retweet'.  Love your avatar pic!
1	yo i'm finally home,we need to set a time when you can get your special jonas present 
1	thank you for today yahh...we had fun!  aww..sleep tight and wake up earlier tomolo for the fresh new monday! love love love...
1	Unlike you, I'm busy all day being productive! And drinking beer 
0	You're gonna be down here for my birthday?! Hold up.. 21+?
1	 I'm considering it. Not sure yet.
0	 sucky, i gotta get up at like 7 too very annoying
