0	All these awesome concerts I passed on this week because of Camera Obscura, and they cancel.  Still bumming! 
0	All these cookies and cakes and they are all sugar free...
0	all these crazy pollen trees in Washington state are making my sinuses go crazy
1	all these little babies around...i can't wait to be an aunt!  my niece (hopefully macy) will be here in september
0	all these old wrestling vhs'. and i cant find my damn vcr. it probably got thrown out. i also missed J&K8 and Conan. Fuck today
0	All These People Sitting On their Asses, They Cme Up With A Date But What About The Features?? Very Upset Customer 
1	All these people tweeting about rain and thunder is making me cocky...it's been gorgeous here all day!!
0	all these random people are at my house... drinking out of my kegg of beer  sorry beau cant bring it, its nrealy empty
0	All these retweets of my typo.  "Our photo editor"!!! BTW, lots of credit goes to photo stringer Alan Dep, for many a great shot.
0	all these stupid spammers on cp
1	All this Hat talk makes me think tonite might be a Circus Boy nite   mmmm!
0	All this feelings. I hate them so bad
1	All this follow friday love just made my day! You all are so sweet!!!
0	All this high school prom & grad stuff has been making me feel super old  I have no more college 2 look 4ward 2, just adulthood gross
0	All this is stressin me rite out =( i have a bad feelin that im gonna 4gotten about. You'v all annoyed me  i have lyk 2 proper friends x
0	All this kenny rodgers talk on twitter is intimadating to kenny rodger virgins such as myself
0	all this old shit on my blackberry caught me off guard.got rid of calender dates,my call log,hearts off a name & countless cute pics  fml
0	all this ppl talking about "the secret life of the american teenager", ahh I wanna watch it D: it's not aired here in brazil 
0	All this rain is bad for biz
0	All this rain is makin me depressSss  http://myloc.me/4mVo
0	All this rain is putting a serious dent in my tanning
0	all this sitting!  it's hurting my tailbone
0	all this sun and i have a cold
0	All this suncream makes it look like someones jizzed on my face
0	All this talk about the iphone has me kind of jealous
1	all this talk about UP, i really want to see it!!! looking amazing 
1	All this talk from & about taking a nice Saturday nap is making me sleepy. Stop that! lol
1	all this talk of lollies and ice creams..need a ice cream fix
0	All this talk of sourdough makes me mourn for my tossed started.  1 houseplant & 1 starter, call me 007!
0	all this thunder outside makes me want to get a sword and scream 'thunder, thunder, thundercats ho!' but people would look at me funny 
1	all this time how could you not know YOU belong with ME?  <3<3<3
0	All this time i was wasting hope you would come around, i've been giving out chances every time all you do is let me down..  </3
0	All this twittering is making me miss my dad and stepdad wondering who is treating them to a meal over on the west coast  have a good day!
0	all this unrest everywhere makes me want to take my children and hide in the mountains.......i'm sure they would find us though..
0	All this wedding did was make me realize I'm lonely and just want someone to dance with
1	All those Kobe-Lebron commercials have been a total waste.  If u still think the L's rigged, it's probably rigged for the Lakes, 30 times?
0	all those questionings were pointless--simple answer all along--did not like me at all. hard lesson.
1	All three generations of connolly women yelling "GET HIM" at the tv is utterly hilarious! I love state of origin nights
1	all time low
1	all time low and set your goals today
1	all time low in two days
1	all time low is cool
1	All Time Low is playing the detroit warped date.
1	All Time Low is sexyyyy. I'm stoked for the new record!
0	all time low just popped up on MTV. i hate how there so popular now, ugh 
1	All time low on saturday
1	All Time Low pics are up on myspace
0	All Time Low repeat again. RIAN spoke just did not share his song.
0	all time low starts in 7 mintues
0	all time low was awesome, but still 
0	all time low was so fun lastnight. i miss our lines friends
1	all todays plans have been foiled...nothing according to plan. which means I get to drive around with the windows wide open (w/mike
1	All up i had a good day  Miss you, love you xxxx
0	All vacation is over and tomorrow have to go to office
1	All voted!  It was a pretty cool turn out of people queuing at mine, from 18 - 80 by the looks of things!
1	All warm now
1	All watching Intervention while having an intervention!
1	all we are saying is give peace a chance
1	All we ask is that you tweet each other well
1	all we need is dance, nothing more 
0	All we r gettin is 7 days as holidays
0	all we use to do is talk...NO we dont talk at all   *
0	All wet sports Victory Lake wake comp today!!!!   I'm only a spectator...
1	All who are following.....NO SPAM. Thanks. You will be blocked.
1	All will be revealed at SonyÂ´s Press Confrence.
0	all wkend plans cancelled due to rain
0	All work and no play makes jack...really sad
0	all work and no play, makes jenn a sad boy. 
1	All work and some play ;) Is it really possible to miss someone THIS much?!?! I'm really priviliged to love someone, who loves me back! 
0	All work no play at the minute
0	all work no play today.
0	all work, no play for me today. & its such a pretty day outside. 
0	All work, no play. I'm so tired 
1	All you can eat catfish... Om nom nom
1	All you can eat, ma daaaaj 
1	All you care is 7 crystals ?: there you go, thats what I'm talking about when I say help out your friends  http://tinyurl.com/mxkdhc
0	all you do is make me cry and all i do is keep loving you
1	All you need is love.
1	All you need is trust and a little bit of pixie dust!
1	All your twitts will belong to me. Soon, I hope. 
1	All zombie songs are now dedicated to  ? http://blip.fm/~5jbib
1	All7mdollah great exam  !!
1	Allah anal? babal? bï¿½yï¿½tsï¿½n Onur day?  re: http://ff.im/3oRBQ
1	ALLELUIA! finished my exams!! up to the union to celebrate
0	allergic test. ahhhh Iï¿½m scared.
0	Allergies  sun is out, wearing shorts.  Stuck with my advisory the whole day.... This should be boring. Except fun. If people make it fun?
0	allergies = way lame. my eyes won't stop itching
0	allergies are going crazy, woke up at 5:30, ugh!  Ate a banana so I could take my meds early. Trying to fall back to sleep now...
0	allergies are kicking my ass right now.
0	Allergies are kicking my ass right now.  so is studying.
0	allergies are making me drowsy as heck.  eyes keep watering. i feel like shiz. movie in bed day,perhaps? methinks so.
0	allergies are NOT cool
0	allergies are really bad today  for some reason their affecting my eyes today. why do they pick and choose?
0	Allergies are wiping me today.
1	Allergies going nuts! Oh well, I'm in a new office in Dupont 
0	Allergies make me frown.
0	Allergies suck... My eyes r even mor red than they were b4.  I think I'll stay inside 2day
0	Allergies today -  - If I take a Claritin, "Will I be, Claritin Clear to Tweet?  #nascar http://tinyurl.com/qoogmw
0	Allergies today are pounding my face into the ground
0	Allergies!!!... My upper lip is turning red!... been having this problem since 1994  ... Dunno la allergic to what sob sob
0	allergiess are killin meeee  bout to find a outfit for tomorrow!! skool is almost ovaaaa
0	allergy = no fun   i miss my turtles and boys. :'(
1	Allergy eyes suck! Work at 1115 at Fridays.. Come visit
0	Allergy time. Yaaaaaaaaaaaaaaaaaaaaaaaaaaay.
0	alles doof im moment
1	alli and i are singing twist and shout
1	Alli is HALF WAY DONE sewing together her little squares! She'll be done with her quilt in NO time!
1	Alliance board retreat today - planing and creativity with great people
1	Alliance Media legend, Tim Bonner, now on Twitter - Alliancetim. Communications legend, Jilly Grieve, also here.. jillygrieve. Add them 
0	Allianz interview went well, got a rejection from MOD though  .... going to be a long weekend as I hear from Allianz on Monday
0	Allison I miss you and wish you were around to speak to, as I spend another lonely night at work 
1	Allisons. Then outtttt
0	alll study and no play makes me a dull girl  I so want to play, but have to study! Boohoo!
1	allll clean  yaaaaaaaay!
1	Alllllllllllright guess Ill hit the sack!!! Yay home 2maro, Can't wait!!!  Nite big Fxxkin Tweets.... xO
0	Allmost going to school...
0	All-nighter time!  Bleh.
1	'Allo there twitter  how are we today?
0	allow chemistry
1	allow school, im going back to bed 
1	allow this, going to play with my rockband drums 
1	Allready awake  First confirmation "meeting".. Then just "be". Sitting here doing nothing, or something like that.. 
1	All's quiet on the western front - gonna go out now
0	All-time record high temp for the month of June in Houston on Wed...104Â°!  More dangerous heat through the weekend
1	Allure was fukiin fantastic... I had so much fukiin funn n got wasted... I need some sleep now... 2morrow heat game
1	ally is a sad case.     GO THE BLUES   ;not qld! somethings wrong with that girl
0	Ally looked beautiful during graduation! She's growing up to fast
1	almoÃ§o, yey 
1	Almond Sweet and Salty is Heaven's gift to the world.
0	almonds at 4am. i know im gonna pay for this in the morning..  took a 4hr nap and cant sleep.. gotta be up in less than 4 hrs. booooo work
0	Almost $400 short on cc this month. Awesomeness abounds!
0	almost 100 cases of swine in australia. hope may still decides to come visits me
0	almost 11 hours here in the computer. am sooo bored.
1	almost 11:11 and i'm eating special K. i think i'm gonna wish for magic weightloss
0	almost 150 miles of driving and I hit a deer for the first time in my life .6 miles from home  poor deer.
1	Almost 1AM and still working on that rush project. Fun tho
1	Almost 1pm, time for some lunch which was prepared by Burger King today  Only 4 more hours and then I'm ready for the weekend =D!!
0	almost 2 am, damn, dont want to work tomorrow 
0	Almost 2 years of Europa travel. And I didn't put all videos online yet. (someone will kill me)  BTW, youtube removed audio of London 2 
0	almost 20minutes and bb dekstop manager installing process haven't finished yet
0	almost 3 am and i have to b up at 7.  bummer. oh well just push through with lots of coffee and redbull then crash hard around 3 pm.
1	Almost 3 fuck a movie tonight.bout to listen to music and bleep...Gnight twitterers...
0	Almost 3a.m. Must stop trying. Costing, oh costing. I give up on you 
0	almost 3am. cant sleep. i need a job.
0	Almost 4 a.m., still not tired  What's wrong with me?!
0	Almost 4am and I just got home from the hospital.. what a bad day.  and tomorrow (as in Saturday) is going to be just as bad.
0	Almost 4am and I still cant sleep. So lame
1	almost 5..so..here i am sneaking out to twitter..
1	almost 90 followers already...sweet!  - Lydia ?
1	Almost a blackberry owner  lol i'm a Dork
1	Almost a Senior  4 tests and then it's official
1	Almost a success. Final touches, and my first shirt is done 
1	almost a twitter quitter... I'm baaacckk!  things just got a bit crazy!  i know you missed me
1	almost about to leave, waiting on kerri. 
0	Almost adopted him today   http://twitpic.com/6djzz
0	almost all moved out! Sadness
0	Almost all packed up and ready to go for tomorrow! Too bad the friggin rain ruined my last night in Italy
1	almost all the time i see you and in these seconds that i see you i am happy
1	Almost an A is still a B... still, 69 % ain't bad! 
1	almost at 1,000 followers! , here i come! lol 
1	Almost at 100 subscribers
1	almost at 150 followers
0	almost at 500 updates and still no word of any prizes  I want that bronze surrounding. I'm braced for disappointment.
1	Almost at Lake Nagambie
0	Almost at school. More ERBs.  and I have to bring in my back pack, and poster board and cake for a project. This may not turn out well.
0	almost bedtime
0	Almost booked a disney vacation for the summer... now I am really bummed out because our schedule is not going to let us
0	Almost bought LVATT but i realized i spent all my money  fml ... Not really but still
0	almost burned down the house just now. Yay for exploding candles...  <><Beth<><
0	almost caught like ten fouls at the angel came
0	almost caught the 'hood cats eating his plant (again), but it was too late   They literally chewed it off right at the base of the stem!
0	almost cried with Greys Anatomy tonight! soo sad  gosh i get too involved!
0	Almost died just now. Holey moley almost died.
0	almost died while preparing the presentation...
1	Almost done  Woot finally
0	almost done exams .. one more to go ...
0	Almost done laundry, next step - brunch - groceries - off to baptism 5.. Ahhh can't wait for this day to be over.. Too hot for me 
0	Almost done packing! Finishin up to The Zutons' Valerie! Then study
0	Almost done packing. I will never live in 213 again.  ~Kalla~
1	almost done packing. yay, and I can even close my bag without having to jump on it ! .. pretty skilled , eh ? 
1	almost done season one of greys  ..what a fabulous day
1	Almost done still need some help from my mom   http://twitpic.com/6b6i0
1	Almost done Sunday tasks including open sourcing some code, launching the blog & testing, testing, testing. 
1	almost done watching "gremlins", I love 80's movies! 
1	Almost done wit CPR class  then my weekend begins!
0	Almost done with all the futurama episodes.  now I have to wait for the brilliant new season in 2010
1	Almost done with another project
1	Almost done with charging  http://yfrog.com/59yh4fj
1	Almost done with Cory's new niece's baby blanket... six months later
0	Almost done with day 1..easiest shoot day I've ever been a part of..if only I were getting my full rate
1	almost done with homework
1	almost done with mah homeworkk
0	almost done with my 2nd job of the day, of course, almost starting the 3rd 
1	Almost done with my assignment  in computer applications
1	almost done with my cold
1	Almost done with my Harry Potter and the Half Blood Prince
1	Almost done with my night of sitting around and getting paid to read. I love working at mercy behavioral health on the graveyard shift
1	almost done with my paper
1	almost done with my practice assessment
0	Almost done with my take home test and ready for a nap. Too bad I don't have enough TIME for one...
1	almost done with PARA KAY B. Interesting read. Next on the list, Crime and Punishment  http://plurk.com/p/117oha
1	Almost Done With School. I Need To Leave This 8th Grade Hell Hole  Hahahaa! But, Excited For Disneyland With Everyonee
1	Almost done with Stage 1!
1	almost done with the Antarctica project. then I'm off to school, and maybe get a polar bear along the way 
1	almost done with the laundry... dishes... 2nd time around - Yeah CHarlie!  Esther - coming up next I think!
1	Almost done with the science project
1	Almost done with the video!
0	almost done with the worst week of the summer semester...paper due 2nite
0	Almost done with this term! Why does it have to be so nice out today while im stuck in here
0	Almost done working for the day...my feet huuuuuuurt
0	almost done!  thanks for those "smart rays".. chem was easy. ps. beat all the puzzles, mini-games and survival modes..
1	Almost done! Maybe ill hit dq on my way home...  <3 Dom
1	almost easter
0	Almost every darn thing is blocked on the network
0	Almost everyone on swim team does Dynamo now. Swim team is supposed to be for fun, right? I guess I'm the only one who still thinks that. 
0	almost exam time. AHH
0	Almost failed my Russian final...when did I become an A- student
0	almost fainted  i dont feel so good...
0	almost feel like cancelling my trip to wimbledon because sharapova lost yesterday
1	almost fell asleep but blahh
1	Almost finished  pics http://bit.ly/wXTJu  and  http://bit.ly/13TgaS
1	almost finished all my homework  only some english left now, YAY!
0	Almost finished coding my new layout, I just have the css to do. It's not as good as the preview 
0	Almost finished ikea-ing the pool. Also finished -almost- all 6 crates of beer
1	almost finished my new design for Kevin Rommen creÃ«ert Strategie & Concept. Only one little thing which i can't do right now.... soon
1	almost finished my poster  bit sore after the physio elbowed my ass for a good 10 minutes! lmao.
1	Almost finished organizing my bathroom!!
1	Almost finished with Taking Woodstock...can't wait for the movie! Also, listening to ATL and getting pumped for the concert in July 
1	almost finished. ;) Only have to build up some more in my room ( xbox, music .. ) 
1	Almost finnished work  working from home is fun, but very distracting! :O
1	Almost forgot, HELLO MY FRIENDS : Almost forgot to introduce my self   I'm a freelance web designer, I hope .. http://tinyurl.com/kpf8vh
0	Almost forgot. Newborough beach was fantastic but it's left me sunburnt on my feet, hands and neck + a healthy glow in my cheeks.  and 
0	Almost forgot: *pours one out for Duke* Fail to the king
0	almost got arrested  all good but well   i cant wait to go to montreal
1	almost got hit head on by a semi. haha. whoops. i think i can still hear my mother screaming.
0	almost got in a giant car accident on the 101
1	Almost got the launch gig footage sorted, but still a few more hoops to go. Listening to the sublime new Scott Matthews album at work 
0	Almost had a run in with a frienemy.. My ex bff.
0	Almost half way through the week. Found out I can't go see cog Saturday night  anyone want a ticket?
0	almost halfway through twilight now, its like that harry potter feeling when i think of the movie, they left so much out 
1	Almost have my 1st sock of week 3 done.  And it's only the first day of the week.
1	almost have photoshop. also not on twitter alot. So do I
0	Almost having a meltdown.
1	almost heading to a church party. what uuuup with thaat!
0	Almost hit a dog on the highway to Matamoros today.   Typically see at least half a dozen stray dogs everyday here...
1	almost home  long freakin car ride, luckily i slept most of the way.
0	Almost home Bout 2 Smoke... Any1 wanna Join Sry Baby Mama I Know u Would  http://myloc.me/4dAR
1	Almost home from Disneyland!  -Elisa
1	almost home, can't wait to just snuggle up on the couch and relax with my dog and boyfriend 
0	Almost home, more to do than not do. Bummer 
1	Almost home, school's over. Have a lot of things 2 think about, trying 2 be good 
0	almost home, stuck in JFK for a lil..missing the bahamas already 
1	Almost home. Thank goodness
1	almost home... AND IT'S POURING.
1	Almost in New York City
1	Almost in wnchester  so close
0	Almost just died from allergies.
0	Almost killed a squirel on the road  They're  ugly, but not worthy of death
1	almost laker time! i love sundays
1	Almost late to work due to reckless & novice biker with assless chaps....LOL happy Monday
1	Almost like I felt so sorry for the female prof that I would do almost anythin to make her pain go away. Im open 4 interpretations  Any1?
0	Almost lost my phone.
1	Almost lunch time
1	Almost lunch! Very hungry
0	Almost made it out of the Apple Store with my MBP, but they didn't have the replacement fan in-stock. 
0	Almost made it to reading comedy outlet. Headlining all weekend. Only took me 2 extra hours with traffic. Basically doubled my time.
0	Almost missed the whole #nightshift tonight
1	Almost nothing is as soothing to me as an early morning walk in nature; birds chirping, the smell of dewy grass.....it is love 
0	Almost of ICsid changed ... No more simple programmers
1	almost off of work...then headed to Teriyaki Madness <---yummy
1	almost on the Matterhorn and line of craving a turkey leg.
0	Almost out of Jager
1	almost out of school;then off to texas
0	Almost out of wawa lemonade iced tea 
1	almost over...
1	almost packed for the weekend
0	almost put water in her cereal instead of milk :o
1	almost ran home so back with 10 mins to spare
1	Almost ran over my first person today!
0	Almost ready for new Beta.... until we found a showstopping bug   Please standby.
0	Almost ready to go, I usually enjoy driving to my partents, but this time I'm a bit worried that my car may break down on the way 
1	Almost ready to watch the 2nd-to-last ep of Pushing Daisies! Even my deathly illness will not deter me! (Ned'll bring me back to life)
1	Almost ready with the new website for my parents....so excited about  It will be a huge surprise for Them
0	Almost ready...... feeling more awake now which is nice! But it's not nice to think it may be 24hrs before my head hits a pillow again!
1	Almost SCF final time
0	almost soft pouch egg in microwave, reminder aim AWAY from face when get out, it still pops & waves still cook when out, so not soft 
1	almost summer
1	almost summer !! only 4 more days yay!
1	ALMOST talked to on aim. At least he said Happy Birthday lol
0	almost thrown up
1	Almost time for a Corona and NW racing
0	Almost time for my summer chemistry class
0	ALmost time for os 3...not that I have a iPhone
0	almost time for pooey work...
0	almost time for school.... today is my birthday
1	Almost time for the 7th inning stretch And then some good ice cream in a hat
1	almost time for the rockets game
0	Almost time for the stupid doctor again; I guess I should get ready. I am so tired of doctor visits
0	almost time to board the plane for ohio
1	Almost time to escape the office! Must dash to the grocery store & then on to the Picture House to plan the next VIBE event!
0	Almost time to fall unconscious... hopefully.  Tomorrow is my last day here in OKC.
0	Almost time to get on the road toward home.
1	almost time to get ready for work...white tank top and cute orange shorts: who with me?
0	Almost time to go home  Not much left from my Transformers induced good mood.. I'm mostly tired now & cold...it's raining again (still)
0	Almost time to say Good Bye to my twimulations. I'll miss my tweeps
1	Almost to church. Gonna run M til she cries later. Woo!
1	Almost to matts confirmation
1	Almost too excited to go home today. We'll see if I can keep focus.
0	Almost total darkness. Hope I am urinating in the right receptacle
0	Almost turned the gel in the eye mask into blue ice  Hope it works to soothe the eyes.
1	Almost twitpic'd the huge-osity of the mansion..6 car garage, wing after wing.got lost in it. So happy my brother is living the good life 
1	almost vacation.
0	almost vomited as I watched in slow motion the giant, open wound on the man's hand I was about to shake 
0	almost wedding time.  means almost end of vacation.
0	almost wrecked going 80
0	Almost, almost, got tickets to see the Yeah Yeah Yeahs in Cologne Germany. 
1	Almostt outta work. Get at me
0	ALMS race was great. Will never forget the Corvettes!!! One more day to go with Indycar... my Fantasy picks didn't do so well in qauli
1	Aloha blip land. Have a pow wow day  ? http://blip.fm/~5j7en
1	Aloha From Hell ist toll
1	Aloha my happy west coast friends
1	alone home... nice  very nice!!
0	Alone the office! Kerajinan amat yak!
0	Alone again on a Sunday  Bree's job is really getting old, which ward should we go to D?
0	alone again........i still dnt no why he did wot he did ....it hurt....it made even more upset
0	Alone all day....
0	Alone all weekend
0	alone and bored... where's gwen? i want to laugh
0	alone and cold
0	Alone and lonely in this world hope empty.
0	Alone at Spaceships!!
0	Alone at the new apt.. Someone come play a round of the Super Smashing Brothers with me
0	Alone at work today. Internship friend was in a bad car accident on wednesday
1	Alone in my grandma's house. Kinda eerie. At least my grandpa let me have some of his oreo stash.
0	alone in my house! its so bored!
0	alone in nyc..on a friday night..as usual.  excited for steve to come tomorrow!
0	Alone in office so made some microwave popcorn - suddenly everyone's visiting me
0	Alone in the office
0	Alone on a friday night
0	Alone on a Saturday and not being including in anyone's plans = moments when I wish it were summer with the Three Amigos.
0	Alone on a Sunday afternoon staring at my laptop and thinking about my Baby...
1	alone on the schoolbus listening to as usual  failed naplan.
0	alone with two kids...and cold sheets
0	along is going back to nilai
0	alot is on my mind..and when I say ALOT..I mean ALOT!.....
1	alot less pain today..if I can manage to take Willow for her walk without hurting myself, fingers crossed, I may be able to train tonight 
0	alot of bugs to day
0	ALOT of college work needs to get done today..  !
0	Alot of crap to get tru today, a lil behind already.....never slept a wink last nite and all i can think of is jumpn bac in2 bed 
0	alot of ppl forgot ma b-day..i had to tell a family member it was ma bday..how sad
0	Al-Qaeda cod heads murdered that poor dude.
0	Already 26.1c in our office. Can people melt? We're fighting for air con because fans just don't help, but can't find the budget 
1	already 5 votes  maybe i need to post some naked pics :p
1	Already almost it is to me in Guitar The Best Day in Spanish (My Version)  Iï¿½m Happy
0	already at school! Sucks! Dont want an exam and No Doubt not really having the desired effect.
1	Already at the office. 11 minutes since I left home
0	Already at work
1	Already awake. Met ryan, from EOTC. He grabbed my hand during the set. I loved it. 
0	Already back from school  But have to work on that math homework right now in this sunny weather
0	Already back in Orlando...missing the amazing weather in Boston
0	Already been done
0	already been in my class for almost 2.5 hours and im here until 9pm.  this should be interesting.
0	already been there
0	Already been to the post office to collect our vaccum cleaner filter, now at work. This is the life of a Superhero. 
1	Already belongs to Emilio forever.
0	Already bored of summer.
0	already bumming
0	Already dreading being car-less tomorrow!!!  boo hoo
1	already feelin .NICe.. I can give u what u want
1	Already getting my world rocked at fast track workshop. Bring it on!
