1	á Streatham ;) en only for feminine countries, á for cities and places  français, ce n'est pas facile, non!?
1	splendid stuff, safe ride and look forward to your reports 
0	I am lost. Please help me find a good home.
1	Just wait until you have to doing payroll
1	Oh no no no, that's trivial and already decided I want to see it for a third time! 
0	Sounds good. I still like Fridays although it means for me that I have to go to work tomarrow
0	I miss VA Tech
1	yeah there has to be a Ryanair gag in there somewhere.....charging for going to the loo *slapshead*
1	small world! twitter, connecting people, who'da thought 
1	Cool Photo
0	done it! Now want to go blackpool
0	guess its too late then  haha
1	Hey when are you gonna be on that Michael McIntyre roadshow?
0	how caring of him ,whats wrong with some people always thinking of themselves 
1	Jason, are you ready for Sunday?! NEW HOUSE! wooo. 9pm Sky1 
1	Just Being Modest  whos doing it with you? get Jimmy C with you, do something on tennis!? Cant wait for new 8 cats ! 
1	I feel much better Sleep was the charm I have a headache but aspirin with alcohol in my system?Guess not. Going to find something to eat.
0	I feel much better today. I'm still stressed out though; just because of yesterday. I'm so tense. I have to get ready for soccer.
0	I feel much better... still haven't seen yet though!
0	i feel my nose become plugg, noo i dont want to wake up with a stuffy nose 
1	I feel naughty happy & much much muuucccchhh better. I'm soo glad I went out w/my best friend.  I think I needed that ahaa.
0	I feel nauseated  Chantix is brutal !!!!!!!!!
0	I feel nauseous and I don't know why. Ew.
0	I feel nautious!
0	I feel negelected and unwanted. He doesn't even know I exist
0	I FEEL NEGLECTED  SOMEBODY JUST LOVE ME PLEASE
0	I feel nekkid cuz my phone died
0	I feel nervous but have no idea why
1	I feel obligated to tweet b/c of derek and nem....*sigh* yea on to my aunts for some FOOD SHUN
0	I feel old  not yet graduated....
0	I feel old for some reason
0	I feel out of place without playing with my bandmates  http://myloc.me/4Pr5
0	I feel perverted Johanna is making me send her naked pictures
1	i feel popular, over 100mssgs in 2 days! New feeling for me  im testing a theory as well- how long can you listen to the jo bros for?
0	I feel pretty lousy. I may be done for the day already, despite a ridiculously late start. 
1	I feel pretty nice right now.  cool, calm, and collected. hehe
0	I feel quite fat today FFS
0	I feel rather poorly
0	I feel really bad - cause I accidently hit my cat with my flip-flops - I feel so angry with myself - I'm sorry Jess - I didn't mean to
0	i feel really bad ....left my dog outside all night from 1:30 to 5:00 am......shit my bad
0	I feel really bad and i wish i could just make everything better.   watching Benjamin button.
0	I feel really BAD!
0	i feel really bad. i i should have stayed.
0	I feel really bad. Ive spent no time with my family tonight.
0	i feel really bad... turns out that i some how manage to delete all her photos on her camera from when she went ti aussie for her 21st!
0	i feel really blehhhh!
1	I feel really calm now. Going to listen to Lily Allen
0	i feel really guilty
0	I feel really ill all of a sudden!
0	i feel really ill and am not loking forward to going into school at lunch
0	I feel really ill, 
0	i feel really ill..not happy when its so nice outside
0	i feel really paranoid today. about everything. not good
0	i feel really rather ill, shame really i dont have time for a nap 
0	I feel really really sick, out of this world sick! 
0	I feel really shit and old anxieties are reappearing
0	i feel really shitty today
0	I feel really sick  tequila dont like me!
0	I feel really sick and I don't know why
0	I feel really sick but I know that I wont be, not because I dont want to, but the fact my body just wants to screw with me. lol. 
1	i feel really sick ew and school tomorrow even worse noooo anyway got art so thats one + of the day
0	I feel really sick right now....I'm freezing and achey and just don't feel too terribly good
0	i feel really sick, and my teeth still hurt.  fml.
0	I feel really sleepy right now, but I just can't go to sleep cause if I do, I'd be sleeping all the way till 7p.m. 
0	I feel really sorry for Holly Steel...
0	I feel really sorry for that Andy guy that was just on Derren Brown -- Ive lost my sight before, it scared the shit out of me too 
1	I feel really super happy at the moment  And I don't know why. But I'm so freaking bouncy and euphoric.
0	I feel relaxed, for the first time in a long time.  I should do though, chemistry exam on Wednesday 
0	i feel restless and i think i'm going to be sick
0	I feel retarded for getting on a shuttle that doesn't go to simmons only because I wanted to go to simmons
0	i feel ridiculous. and i'm blaming you.  WHY HJSDKFSDHFJSD
0	I feel rubbish but can't tell if it's bad hay fever or a cold  I guess I'll tag team the tablets and see which works.
0	I feel sad about the crashed Air France flight  This is why I HAAAATE to fly!!!
0	I feel sad and i dont no why I just want to go to sleep... wake up happier
0	I FEEL SAD CAUSE I LOVE SOMEONE WHO DON`T LOVE ME..... I SO SAD
0	I feel sad for my mom. Tomorrow is her first mothers day without my nana.
0	i feel sad for some reason.. i can't put my finger on it, but i'm sad and i want someone to talk to 
0	I feel sad just thinking I must wake up at 6am tomorrow
0	I feel sad that we will never see this classic character on television ever again.  http://snipr.com/j8psi
0	I feel sad today... but I don't really know why...
0	i feel sad today...and i don't know why. I just want to feel happy again
0	i feel shit today, i wanna go home! 
0	I feel shitttyyyy. My bestfriend is moving and i'm partially to blame.
0	i feel shitty
0	I feel Shitty  im hot and allergies are the worst. Fml.
0	I feel shitty but not hungover. I fucking hope I'll be able to go to Neptunes tonight. I probably won't be able to, but I'll still try 
0	i feel sick   but there is fun to be had tonite <3
0	I feel sick  and have a 3 hour drive this afternoon!!!! I really hope i fell better by then! ((((
0	I feel sick  and p.e. Sucks.
0	i feel sick  going to walmart tho so should be pretty  okay in a min.
0	I feel sick  i want to barf. Fucking p.e
0	i feel sick  kind of feverish
0	i feel sick  too much icecream
0	i feel sick again
0	I feel sick and fat now.
0	I feel sick and I could do with going back to bed.  #fb
0	I feel sick and I'm very tired
1	I feel sick and lazy. But never too sick to SHOP  Mall with Nishy in about 2 hrs. Haven't seen her in 2 billion years..
0	I feel sick and my entire body just... hurts.
0	I feel sick and tired  All I wanna do is sit outside in the sun all day with my laptop.
0	I feel sick I feel sick I feel sick I'm not ready I'm nervous waaaaaaaaaaaaaaaaaa
0	I feel sick im going to sleep
0	I feel sick my allergies smh who wants to take care of me
0	i feel sick now
0	i feel sick now.
0	I feel sick this morning, may have eaten yesterday wrong 
0	I feel sick to my guts
0	I feel sick to my stomach... and I don't think there's any hope of it being resolved any time soon...
0	i feel sick today
0	I feel sick today.
1	I feel sick! Maybe coz its raining for the last 2 weeks. And i really hate it. Oh well. Have fun people!
0	I feel sick, because I ate too much chocolate.  
0	I feel sick, my throat hurts and Im all by myself  times like this its when I miss sugar in my life
0	I feel sick.  Hopefully I will wake up from a nap and be back to 100%.
0	I feel sick. Fatigued. Chills. Body aches. Headache.  I want a nap...
0	I feel sick. I hope I'm not infected with the A(H1N1) Virus. Oh noes!
0	i feel sick. i think i didn't cook my lunch right :| and i don't wanna go to workkkk. boooo
0	I feel sick. I'm shaky and mildly queasy. Tiny headache. Stuffy nose. Watery eyes. Low fever last night. And here I am, writing an essay. 
0	I feel sick. No reason.
0	I feel sick. Really really sick.......
0	i feel sick..  like dehydrated, light headed, & all.. all bad...
0	I feel sick... And I feel all gross from the hot weather... I need a nice cold shower and sleep. But I have a paper to write
0	i feel sick... not good
0	I Feel sick...idk what's up with my eyes, head and sinuses!!  I hope its not another sinus infection!!!!!!! 
0	i feel sick...that party wasnt very fun...too many hyper 7th graders...ugh i need someone to cheer me up please!!!
0	i feel sick.and dizzy.the road.traffic.cars.people.aahh.headache
0	I feel sickkk  sleepy. Working tomorrow wed and thurs early! Yawn
1	I feel sickkk. Going to go lie down and let God's powerzz move through me.
1	I feel skinny right now, wewo, cant wait for this providence and stero skyline and others 
0	I feel sleeeeepy n find it hard to sit in front of PC screen the whole day in the office...
0	I feel sleepy. But I still need to read  Ohwell, good night for now 
0	i feel so  rough and i have an english GCSE tomoz
0	i feel so accomplished pullin an all-nighter cause i havent since a couple years ago. im lame, i know 
0	I feel so bad 4 my dad...His really good friend died and the worst thing is that he apparently killed himself  My dad is really depressed.
0	i feel so bad about not going.. to the con..
0	I feel so bad Celtics are out
0	i feel so bad for ditching andiee.
0	I feel so bad for him
0	I feel so bad for my cat  She's been waiting at the door for 6 hours for her kitten to come back, but we gave it away...
0	I feel so bad for my kitty  I just want him to feel better
0	I feel so bad for the guy who jumped off the E19 building near school...
0	I feel so bad for toddlers whose ears pop when they fly. Today a little boy was cradling his ears and crying, "Daddy, ouch, ouchie." 
0	I think i am getting sick  tired of all the politics, brutality, lies, hypocrisy. I am signing off for now sorry  #IranElection #Neda
0	I think I am getting sick again
0	I think I am getting sick! could you take me home to rest
0	I think i am getting sick.
0	i think i am giong to die. working two jobs and being sick is hella lame.
0	I think I am going to throw up
0	I think I am gonna go back to bed and try to wake up again..maybe i will feel better
1	I think i am in love all over again...w/ the Backstreet Boys and *Nsync...i love watching/listening to their old music!
0	I think I am like, spamming twitter now? Ahaha my followers will find me annoying and stop following me! and that's sad 
0	I think I am possibly melting.
0	I think I am sad E3's over now, but quite relived, no more assets to come, even though there is still some I need to do 
0	I Think I Am So In Love...<3 If Only Age Was Just A Number Damnit;;;  He Is So Sweet He Makes Me So Happy God WTF?
0	I think I am starting to loose my voice.
0	I think I am the only one here who is a mom? yeah so I can't get to that many shows!  I got both Cooks this month and thats a miracle!
0	i think I am the only one in America not in line for the iPhone today   maybe they will ship me one cause they feel sorry for me? #Apple
0	I think I am the only person who is enjoying today's brain based learning lecture... that is fine.  I'm used to being weird ha! Thirsty
1	I think i am too  Just blip sum mean, mad as hell, I hate everything and its all ur fault kind of stuff LOL
0	I think I ate a little too much. I'm gonna explode.
0	I think I ate half a pizza last night  There goes the jogging i did. A little too tipsy btw.
0	i think i ate more then i should have.. full and sleepy  #fb
1	I think i ate my body weight in popcorn. Yeah im cool
0	I think I ate some bad chips. I KNOW I ate chips but i think they were bad
0	I think I ate some bad sushi
0	I think I ate something yesterday that did not agree with my tummy  Oh well, off to the concert soon...in the rain lol
0	I think I ate too much peanut butter.
0	I think i ate toooo much fod tonight  feel so sick
0	I think I be on twitter at the wrong time lol I swear it be mad people up late when I'm sleep but now that I'm up no1s on  blah
0	I think I broke my Chrome.
0	I think I broke my foot playing soccer last night, then had one too many beers and couldn't tell until right now 
0	i think i broke my heart that bastard drunk my milkshake he drunk it up
0	i think i broke my little toe
0	i think i broke my retainer
0	I think I broke my tow a month again and now it won't bend.. Is that possible?
0	I think I broke my tummy
0	i think i broke my ubertwitter
0	I think i broke the radio in my truck  cds work though. This sucks.
0	I think I broke twitter signing up
0	I think I bruised my feet--both of them--on the side of the heels.  Not sure what talented stunt I did to manage that...
1	I slept almost all day yesterday. felt good!  needed it
1	I slept almost until noon. But it was a very entertaining and good sleep. Tons of interesting dreams.  http://plurk.com/p/yu97y
0	I slept bad now my neck hurts
0	I slept entirely too long on my nap, but not long enough at the same time. 
1	I slept for 11 hours. Seeing Angels and Demons later with my mom
0	I slept for 12 hours last night and im still tired      guess thats life in the big city !
0	i slept for 15 hours :S 3 days till all time low!!! im so excited!!the western bulldogs are owning the swans
0	i slept for almost 12 hours. i still feel like shit
1	i slept for over 12 hrs and i'm still recovering from florida. bbq with the family today
0	i slept for too long last night. my head aches now
0	I slept from 4am until 7pm. I think I'm coming down with something. My throat is clogged and my ears are all gunked up
0	i slept from 9pm-6:20am my body so needed it now rushing to get my photo printed and to get to class at 8am
0	I slept funny  I wonder if I sleep funny again tonight if my neck'll reset itself?  Shout out to my friend Cherese, its her birthday today
0	I slept in and missed my little bro's football game
0	I slept late, being sick is the only reason i ever sleep this late 
0	i slept like 4 hours last night  i need more sleep.
0	I slept like a baby, didn't hear a thing! Storm damages  #AnkenyLife #Storm http://twitpic.com/7panz
0	I slept like a log. Think I'm falling sickkkk
0	I slept pretty heavy last night. Morning all. The weather has taken a turn for the worse .. rain for the first time this week
1	I slept so good
0	I slept the worst EVER last night. iz going to be exaughisted at work today
0	I slept through my alarm.
0	I slept through the DC game last night.
0	I slept too long. My back and neck hurt
0	I slept very very well.this day is gonna be very very...dont have the right word...  only learning learning,learning, when will this end!!
0	i sliced my lito toe
0	I sliced my thumb pretty bad today... but I don't have any spare bandages for work tomorrow
0	I slipped and fell so hard on the tile floor at work, I think I broke my butt. Ouchhhh 
0	I smashed my finger
1	I smell blood.. O.o nose? Bleh. I want more shorts. XD my ears look just peachy
0	i smell dinner .. all ive had today is coco pops
0	I smell food ... It's too late to eat but smells amazing
1	i smell food, it smells lovely  i bet it's not for me tho. i bet i have this frozen thing. grrrreat!
0	I smell like a baby prostitute!  ugh
0	I smell like bonfire which I love minus the marshmellow melted on my boot  suggestions??
1	I smell like bonfire... Combined with axe now... But its all good
0	I smell like gasoline thanks to Irving's faulty shut off switch on their gas pump. My poor Jessica Simpson wedges
1	i smell like outside and hand sanitizer all i need is some cheap cologne and ill smell like a cheap hooker
0	I smell like sex from being in the car all day.
1	listen to nana windows it will cheer u up  http://bit.ly/14OTPE
1	nahh you'd get my vote ha thanks for the reply though
0	Nooooooo!!!  Bring back the goggles! Otherwise the pollen will be after your eyes! ;-)  Besides, they cheered me up. 
1	Oh, and can you go via Whittle Le Woods. I´d love to see our old house 
0	oh, i'm so sorry, i didn't know  hope you're well x
0	Stephen Fry is off to Ballet Russe and I'm off to bed   #Me&Fry
0	thank you!! thought we were going to lose it
1	Yay! Will definitely watch it then!
1	you were brilliant on friday in carlisle!!!  loved every second of it!! and congrats to you and mrs m. x
1	i sent you ulck from my 4leaf clover today.   you;re welcome.
0	with heels. ;) hope I won't have to wait too long
1	Yeah, but from what I hear, moms are allowed to do that 
1	do you know what kishka is?? that's my fave. kishka and gravy all the way
1	Going to see Molly?
1	hi molly's mom!
1	 by the way im listening u and i both and then sleep all day!   sleep all day just make me smile!!!
1	 come to Latvia!  youpidue
1	 I actually took responsibility everywhere this wknd. Blessed to have my friends and music.
1	absolute pleasure to have you here. Thanks for a brilliantly fun evening
1	http://twitpic.com/4iq19 - I loves me some popcorn
1	http://twitpic.com/6fs76 - Now we know why you wear a hat
1	i love the fact that people are essentially good  or i may be wrong haha
1	I'd rather be loving,, but I can't help how I have to be right. It's hard. 
1	JASON,  FREAKIN AMAZING PERFORMANCE IN MADISON!  And i loved ur glasses. Very Lovely Concert 
1	Jason, i completely loved the new post...Going Bananas !! super awesome  thanks for sharing !
0	lyrics are about to help me through another ordeal
0	Ok i think i did it again  Sick stomach. Luv ur music since NY min. Luvr not HATER. Not Stalker. Fan yet not CRAZY FANtype
0	so sad I got to Indie today at 3:00, moments after your secret show ended 
1	was Jason cross with you ?
1	Welcome home, guys. Enjoy your much-deserved break and see you this summer. 
1	will you marry me?!  Jk...I'm old enuf to be your mom but u inspire me to a better life
1	You look cute with this hat
1	is this really you back in 1992 singing shower me with your love? http://bit.ly/aVF8p 
1	for you SUSHI hahahaha but since its still the morning how about pancakes or waffles
1	 I'm glad you meant it in a positive way.  Sometimes it's hard to gauge nuances in short written massages
1	 Welcome back Jason
0	I feel so bad i cant make it to the hookah lounge tonight.
0	I feel so bad that I didn't go to the No Doubt gig tonight  the tickets were WAY too expensive  and my friend calling from there was ugh
0	i feel so bad that i hurt him, but i just can't be with him 
0	I feel so bad today
0	i feel so bad today  going to be ill? wahhh -.-
0	I feel so bad... I'm not guilty
0	I feel so bad.........  Unhappy thing to do soon.........ugh!!! Can someone else do it for me?
0	i feel so bad..i m losing my bestfriend? i hope no
0	I feel so becok today. I don't know why but i pity for entertaining my question the whole day. So sorrry !
1	I feel so blessed to have two of the most amazing guys as my friends  You two are truly amazing!
0	I feel so bloated right now.
0	I feel so bored ! Ooohh give me a wonderful things..
0	i feel so bored, i need a new profilephoto, but i feel sick, my throat hurts, 
1	I feel so complete right now. Heaven.
0	i feel so cut off from the rest of the world. no internet, no leaving the house and now my twitter updates are cut off from my phone 
0	I feel so dead, crappy hayfever. And to top it all off, I have 4 of the biggest bites ever on my legs 
0	I feel so deflated. No more doggy.
0	i feel SO depressed. help
1	I feel so dirty for saying this... But go nsw  actually screw it...smash each other like crazy (except pricey) haha
0	I feel so disappointeddddddddddddddddddddd.
0	I feel so disconected from everybody today!I'm so bored, what is everybody doing with their lives?! 
0	I feel so disgusting
1	I feel so effin gay  and isa call me. . .its importanteh
