1	They're playing here at Magnet Highstreet next I think
0	kicked me out too  #foodchat
0	hurts to be you! Sunshine all weekend and you don't get to play. That's sad.
1	Listening to a live mix from the Hacienda in 1989... Park & Pickering live!
1	Have you not heard of the "Delete" key? - He is my favorite - Makes all the badness go away
1	if the newspapers don't go quietly we can burn them.
1	I've seen ESR's emblem before. I like it a lot. I think it needs a t-shirt. Or in your case, a fashionable cardigan. 
1	that, and it's the CoS's normal first point of call if they can't silence the 'critical' facts 
1	475 followers? you need to aim for 500 now!  LOL
1	Seriously dude, is there any way to get a sneak-peak at the site? I could be "quality assurance guy" 
1	Just seen the Box n Locks vid - DOPE!! And love the song - had to post  (www.sewuese.blogspot.com)
1	that's awesome. I love scores
1	No prob, fantastic song 
1	lots of reasons..  a few people have asked me this one.. I guess I should start a blog when time allows and post my reasons
1	interesting. We were just on sesame's site. No issues. Time for cable modem.
1	oh! That makes sense! And you spelled it right
1	buy the straw hat to go with? oh go on!
0	haha can't see it on demand yet  lots of other tele to catch up with though.. i indend to watch it allll! lazy!
1	Yes, http://www.stonegreasers.com/greaser/. You can read about real gangs instead of wanabees like the Bird Rock Bandits 
0	want that game ! shame i dont have �6 on me
1	indeed that is my dear old dad
0	I got a new credit card, so I need a new sticker. I miss my red pepper already 
1	Great question - I would have to say Haunted Mansion for a half hour - so much to look at and awesome music
0	life dude. my parents are so blinded by alcohol and money it's ridiculous...  i miss you. i need a hug.
1	its depressing. but its still an awesome movie!
1	are you call that winning?
1	FriendFeed did go down for 10 minutes. Thats news
1	oh...well...I need to invite him to lunch then
1	send the link!
1	Yeah I just read it.. haha.. Weird, right? 
0	YES to both!! #worldfail maybe
1	OH my SHIZNIT. He actually replied to you! How sweet haha
0	, niiiice one! It's the same here - no snow 
1	July 12th is the last Plano Centre show, then we are going to be doing Garland Special Event Center shows. 
0	probably a combination of things... I don't believe in any bomb. I knew some people in the plane  a tragedy...
1	thNx 4 following my twitter acc.
1	come see me and I promise you won't be lonely!
1	Thx but already got hooked!
1	is a thief!
0	It is very very very BADDDDDDDD  #PakCricket
0	yeah ... i have similar feelings  #t20
1	Your BG is your "background"
0	Your way to happy about that
1	LOL I thought that was a most excellent movie
0	we can't even get Sky...fecking tree in the way
0	I apologize for the LAME-O meat packing joke from yesterday!  I'll take 20 lashes to the back. (
0	omg I'm giving in too! I'm going to pride.
0	Yes, can you see mine? I have the same problem 
1	hey! nice 2 c u here
1	http://twitpic.com/6cvs0 - Aweee :] He looks so cute! I hope you guys are having funn!!
1	http://twitpic.com/6tlqa - cute ass
0	xbox broke  hope you enjoy playing 1 vs. 100. I was...looking forward to that.
1	 OMG i LOVE "Waiting" its been one of my favorites since it came out!!
0	Also even with insurance I still owe about $1,500 for an emergency room visit. 
1	TY 4 posting this ...Have 2 chk it out!
1	nice! Though I have tested EXTENSIVELY and the skinny cows really are way better than the WW ice cream sandwiches
1	sleep's uber shiok when you're uber tired prior to that right, totally agree 
0	Did you have the sublime sticky toffee? Hope you shared the wine with JT - can he drink and bike? Wish I could go to Smiths
1	seeing you all over papers is odd - v Hollywood! Even my sister mentioned it to me. Could I sell your autograph on ebay now
0	IT WAS  a quick walk.. got dark real fast!  but i will have to get used to short walks this week.. no help tomorrow either..
0	I got it. It looks like it's going to be crowded - I hate crowds, so I think I'll pass 
1	hi anaaaaaaa!
0	yes you said lies! That I said thus making me a liar
1	ive heard the magic has a lot better battery lifetime per load. android itself isa very very good solution and i love it
0	n'dito  I messed up your name, sorry hon ;)
1	hey hows it goin? can u let me no if u get this msg plz coz i think my twitter page is up the duff..
1	Man, do this test  http://bit.ly/z2zOQ
1	thanks for #followfriday - have a  w'end!
0	he's beautiful
0	awww poor 2 she lost.  but awesome u found a home together for the other 2 ;-)
1	that's pretty cool!
1	i just have to wait 12 more days and the excitement will come back into my life
1	Hope so too
1	..just to clarify - I'm not a Talis customer, but I went to the 05 show, and was v. interesting. C'mon Talis, do a 2009 one 
0	Yeah she tells me that too. Still sucks the big one though
1	agreed sicknasty awesomesauce  i hope i'm doing this right.
1	Ahhh, wonderful...PICS!!!!! Thank you, you're awesome 
1	are you alright? and no youre not crazy! You do what you have to do! NKOTB 4ever! They make me happy!
0	i don't have anyone to help with a video either...  & I don't get to go out & do anything for myself  guess im stuck in KY.
0	I have a pair and they hurt my feet  Need them more for walking.
1	It Sucked and then I Cried by Heather Armstrong. It's no Twilight  What book are you on now?
0	i was stuck in watauga with my baby sis
1	Always enjoy your tweets- you pugs are smart, maybe even smarter than my gldn retriever Thai! 
1	 would that be Mac compatibility/ tech support .. oh please?
1	i know! you looked so great! hope all your planning is going well!
1	ask it when preshit was born again tomorrow, out of curiosity 
0	It had slumped to well below 70 earlier this year
0	It’s your second one, not your first. Or are you guys considering all the ones hosted by me as not part of the cool gang? 
1	Makes you need to go to the bathroom.  You're meant to drink lots of it. Trust me, I stayed up all night once 
0	She didn't tell me the name
0	palms come from the coast. dales exist in the south only
1	Ahaha iPhone. For shame, Brady. and I will give you grief for it forever 
1	had the wrong tweet selected, sorry - should have been to I've since deleted and reposted 
1	Hehe, fair call that. 
0	I did not! I've been on the #squarespace wagon of desperation since the other day
1	Nice one - Have a good night
0	Oh that is horrible.   So very sadly for your loss.
0	Oh that's right. No worries, was just getting a bit lonely  lol. Hope you guys had a great time.
0	oh that's so sad.
1	Thank you my dear. I certainly did. Can't wait to see you dudes play on Friday
0	That's terrible
0	Your frenulum has feelings  I'll send it a card and THE WORLDS TINIEST VIOLIN PLAYING THE WORLD'S SADDEST SONG.
1	start using it  im on all the time cuase its an add on for firefox
0	Idk, I put your name into my dictionary so it just knows 
0	yeah i lose 99% of the time too I've only won once
1	Only with u...   Like old times....
1	yes clearly u 4got..I'm gettin in the shower, jus finished workin out wit nuke 
0	Thanks!  I wish I could be at the Yost as well   Love You extra long time!
1	haha I don't actually have toast, JD said it 
1	oh your the best  love lukey
1	TEEHEE, Thank you 
0	Yeah see I have to buy the two together or I can't get free shipping. (But even that isn't enough  )
1	Buckeyes Baby it's nothin but the best
1	You will do fab as always!!!  Your make up artistry is FLAWLESS!! Take pics I wanna see
0	You're lucky your gym has ANY classes on Sunday.  Mine doesn't.
1	You got facebook? http://tinyurl.com/c44c6r Come join up!  x
1	HAhahaha. I freaking love that movie
0	it was an accident !!!
0	well Im actually leaving Miami July 2Nd thru aug 10th
1	cool song. for some reason in my head it was to the tune of 'dance dance' and I was like hey this is familiar
0	Because I'm not going to Bootycon I need to get refunded
0	we go for an mri next week. my vet thinks it is frontal lob related. valium for episodes now, but then we'll look at reg meds 
0	dude..i am having issues in here  its fun though. LMAO yes.fire burning..lol
0	what's wrong bb?
0	Oh, and Watchmen, you're another culprit.  Rorschach's death & the Blaire Roche scene just killed me.  Just made me sob.  
1	I wish I were there hiking with you... take care duay when hiking
0	it has been raining over here to you r not alone
1	- thanks for the follow friday
0	we wanted to give you your present tonight
1	you have a car just come over here with little gotch  and then we have some icecream
1	Happy Sunday to you too! I'm glad to be back in NY. I'm not a fan of the NYC Winter but Spring is so different.
1	now that is a great sig for an email.
1	they demo it running on iPhone an G1 phone.
1	Wow! Sounds way cool.  All the best with the project and your finals.
0	thanks for twitpic-ing the picture of my craft. my arm looks scary
0	ouch! two injures in two races. sorry your manfriend is out  Short and him put in some great battles last year
1	glad to know that you're better  my day is good.. thanks, I'm having some coffee and medialunas and getting some work done
1	natalie i'm a fan of yours. keep it up. so good to know that you like tori amos  i like her music ^^;
1	http://twitpic.com/6aajg - absolutley hot
0	Not Chelsea, Puma? Say it ain't so! Not Chelsea! 
1	You with any kind of balls makes me happy Puma  Be it Swedish, Italian, Hairy, Shaved...
0	dang it  i'll be there the 25-26th. i can't believe we always miss eachother!
1	Good Morning to my new twit fam! Hope you have a wonderful day!
1	weeeell.. maybe the next time Cider comes to visit...
1	Aww Thank u hun i cant believe ah  i will send you when i look pc =D cuz im login from mobile.i will send you,dear friend ^
1	so that means it's a 4 day weekend for you! woo hoo! enjoy!
0	Girl, U and me both!! I can't wait for 5pm EST.. I'm supposed to go home and rearrange the 9 yr olds room - but I'm tired 
0	I'm good, girl!!! I miss you and wish you would come and live in H-town.   I am on phone with Ins co. I hate them.
1	I'm well thanks  Busy busy busy as usual! And yourself?
1	No, I'm on the committee, and secured 3 of our tweeple panelists. 
1	guess I need to move to NYC to become a beanee!
1	No I choose 2 wake up early... I had 7 hours sleep  Im being productive
0	spymaster is fun :'(  I'm sniping at folk and I am saving up to buy a safe house in Brazil.   (damn, it does sound lame) lol
0	womp... A weekend too late, I know 
1	Sounds like an excellent weekend! (except for working later). I'm just bored. One day really!
1	I'm glad u like my topics  I'm just speakin what's on my mind the momment
0	Sigh.  Was I not your first redbubble friend?  Even though you never write to me anymore.
1	I saw it. Am supremely impressed
0	That's the biggest pill with TweetDeck, the API. Just as I get into it...it exceeds limit. 
0	couldn't watch that
0	Haha. As per my other tweet. I noticed my SIM PIN got reset after the update. Had to call Telstra to get me unlocked
0	I know - he then went on to pitch me, something about womans underwear?, and i just logged off.  ARG!
0	i'm just glad i found out now- would hate to have dragged myself around infecting people
0	I've been trying for weeks to update my background   I'll have another go soon then
0	LOL-good luck-only reason I have receptiom at home is that I know guy that used to throw the darts - he's finished now though
0	no idea .. it's not going to be done properly - they wanted me to make it my "baby" .. my baby is going to be premature now
0	no I'm sorry - having a slight Twitter stalker issue  it's always some dick that spoils the fun
0	Nope, unfortunately. I'm talkin about 320GB of data (4 x 80GB). What a crock!   #vistasucks #clusterfuck
0	oh noes. if its the one i have - its a doozy.  i shouldnt have gone to the tweetup, but i didn't feel ill until the day after
0	She is gone to watch TV.  Funny you goes are gone when i get on Tweeter.
0	that's tragic
0	um, no   PLUS i look really weird too now--got some sort of weird eye thing happening now. all i need is a hump and a limp
0	waitin on my ride! Her flight was delayed til 1130
1	Check out the 'Horn in Hand' pub in Nottingham. I love it for the name more than anything else
1	lol.. Good boy
0	Contest is all over..
0	stop the newports
1	and I went on grizzly river run 3 times in a row  twice without getting off xD I lost the dry contest.
1	I have one of those too - my work van!  #hhrs
1	Hehe, true 
0	I need SATA
1	I thought publishing on an article website with backlinks to your own site is the king, according to this SEO expert 
1	so good to see you here, ! Thanks for the link!   ...
0	the links dont work
0	aw no  sorry to hear that my dear. I know how crappy not being able to sleep well is!
1	lol. I am a danger to myself. We'd been chatting in the cab so felt rude not to! My London friends cracked up about it
0	ohhh no reesee cup
0	ok ok!!! no more recession chicken I sowwy
0	its coo your suppost to be my bro and you never talk to me FAKE and I dnt got nobody to talk to  lol
0	ain't that the truth......
1	why limit your story to 140 ch. Tell all what is #annoying you at www.iamsoannoyed.com
0	i just downed a jug of mt dew and work at 9am.
1	what a cute dog
1	Got ya. I read about a Cali peach so soft, sweet & rare they sell only at the farmer's roadside stand. Of course, I want 
0	I haven't even received my author copies of Destruction yet. How sad is that?
1	well, I'm not from Penzance. I'm from NY--we ain't so much swishy as we are cagey 
1	Nope, last comic I read was the Hack / Slash graphic novel. Been a bit busy. Recommend following 
1	Nope, married a good 'ol home grown Belton Boy. 
0	arg! my laptop doesn't have bluetooth! I'll have to wait for a wired tethering solution
0	i think its more than 24. i woke up late yesterday and EVERYONE was sold out  lol
0	Just stopped by local Sprint. They have the accessories but can't sell them yet.
0	Where did they say anything about better battery life with this update? My SpeedBrain maxes 6140 so far...
0	aint making this no easier
0	just woke up
0	o shit!!! Ill be gettin up at that time. To go to work. Ahahah...  awww- so how u like twitter so far?
1	Get 100 followers a day using www.tweeteradder.com Once you add everyone you are on the train or pay vip
1	good timing on the vid  lol okay I'll stop
0	lmoa well to bad. Oh & no movie night at mine next week. Relos comming down & staying at mine
1	i think so? i don't know... i'm getting mine on tuesdays and fridays!
0	it's gross because 16GB is a lot of space, lmao.  the episodes are so big, but that's the price of HD!
1	 what up follow this Young Fellow
1	ok cool.. dont believe everything you hear from tho.. she kinda crazy..  haha j/k
1	its just sum shit i cant take.anything happenin 2 u bein 1 of em.dont scare me like dat again.i love u n im glad ur ok
0	mine too....
0	I miss u too, u wanna see Jr  im trying 2 come home for the 4th airlines tix are $500 gotta put on the puppy eyes
0	... I wana cum..so nice ouT...
0	I like the hair. Where are you going?
1	of course, always 
1	oh boy...hear u go wit the darkskin phobia lol...I'm good, staying out of trouble 
0	Woop!!! yeah, shall come down tmoro...still in a bad mood...  i need cheering up
1	My hornomes went way crazy after it was removed for awhile! (about a week) I'm feeling better now
0	seeee u gassed me  I don't like u!
0	no don't go live cause i'm not using my computer so i can't see it..  i'm on the cell..
1	yeah that's how I felt but u get used to it n this phone just does practically everyhing
0	I'm sorry I can't give you a real hug.
0	hii lol. I would nudge you back, but i'm on my phone, so I can't. 
0	but you can't dm someone unless you have added each other
1	i sent you my email when u messaged me for it,should i resend it  ?
1	welcome back to the t-dot! sounds like you had a blast in the bahamas!
1	haha. He's 6.
0	That I will.
1	Yep! I loved that show. Still do, in fact. Had a sudden urge to watch it yesterday. 
0	I just told them I couldn't afford that and they would have to re-approach the landlord. Can barely afford the rent as it is!
1	lol... i didn't take it as that... but i could've!
1	see the trending topics thing on the side? all you have to do is type #3hotwords or #3turnoffwords then your answers to play!
0	yea... but we dont have a nutha prac session  o wellz
0	i honestly wouldnt mind. i just didnt want to be alone today!
1	you're freakin' amazing. 'learn this, study & check. learn this and you won't get an F'. CLASSIC! 
1	very nice!! yeah i was in Cancun about a month ago! there was so much to do there...I miss it! Hope you had fun!!
0	I saw your mum today. + I saw you the other day at the bus stop and I called out to you but you didn't hear.
1	Fly with Me by the Jonas Brothers  u?
1	So I'm not the only one who feels that way...
0	well i don´t know if free speech ...works here
1	Ahahah tell me about it, sounds like yer having fun though! 
1	I can see if I can stuff a moose in my bag....idk though
0	Not sure...I just feel like I could cry
1	yay All Time Low! love them , have fun 
1	yeah but the name bobby is not a nifty name like tyler.
1	because Robert Pattinson is seksi and he is mine  and because they are nonsense that is why they r on the block list
1	aww thanks - our laughing/singing/wooing did it, right?   I wish you were there!
0	Sorry you're not feeling well.   Get well soon Abz.
1	 lol!! I really really don't have an answer to that!
0	i have my mommy, but life isn't any easier 
0	I want rains mich! It just doesn't rain here  yyyy
1	thats what its made for you fool!
0	my mom refuses to go to see star trek, she wants to wait until it's out on DVD  we're going to see the proposal.
1	what a roadtrip that would be  Humboldt, Sactown, SF/Bay Area then Anaheim - if u did that I wld be soo envious!
1	Security jumped one of our bussers cars on Thursday!
1	yup but if it wasnt for the trailer I never knew the movie existed
1	NO PROBLEM, I'LL GLADLY DO SOME ASSWHOPPING!  Maybe a little too gladly... lol
1	You're already a bomb person, so all you never to do is work on your beatboxing and your break dancing 
0	so i have a feeling the bad news is that you can't go to the beach!  yo if you don't go, im going to be mad. So figur ...
1	when ya comin out this way again? Gotta get tattooed again lol. Its my therapy now  still gotta get your hot indian guy! Lol
1	dream good things
0	Im at the redneck bull riding thing  it's hell
1	awww yea its a wrap west coast here i cooooome
1	I want you on my wall so get it together for your shoot
1	Thank you.  (Enough said)
0	I have a rl? XD Photobucket sucks balls
0	200 dammmmmm gurl they stalk u lyk dat ahhah or u a meany !!  olol
0	iight lol ; I got u when I talk 2 him. im not home
1	cool! i sent a friend request over a year ago and he still hasnt added me! is amazing!
1	No problem at all  That's the only one I can find so far
0	no way we cuda went  i didnt even no bout them bein in manchester
1	Well congrats anyways  Heres hoping I meet that men (all of those men actually) one day. Haha
0	yeah i dont know i f he likes me or not
1	so come bak to the dark side
0	cuz I like cats. It didn't start as 4  only adopted 2 kittens, then they mated now I need to gt em all snipped and clipped.
1	oH! word i feel you .. i wanna go to Cali
0	I'm sorry about you Chi
1	It's okay, your next weekend will come before mine 
0	oh shit!!! Is fathers day tmr n ma moms taking me away. How da heck imma see ma pops. Smh divorces I tell u
0	I'm home... I can't believe its raining...iheard its supposed to rain all week   you didn't do anything tonight?
0	No, ma'am. I've tried it before it was drama at every turn. All bad. 
0	i love you too baby. But im in traffic  im scared its gonna die again.
0	I wish it were easy  everyone tells me something different.
0	you missed it  try calling in five though.
1	you amuse me very much.
0	what?! I wasn't invited
1	babes! Emailed you something do reply as soon as possible
1	how are you and hows life?
1	Same here... Saturday  Check this link and the video at the top: http://bit.ly/NPsLT
1	What can I say.. Am simply too vella for my own good
0	Yo! I miss you!  Buts its soo cool that youre enjoying TAKE MORE PICS YOU, YOU DOLT! =] and mom said the email bounced back.
0	too far  otherwise I would
0	they mock most people though, Taylor for her height etc. probably just to make the show funny for non-Demi fans 
0	yeh ur life does suck. Wish u were in ATL.
1	- Post a complaint about the teacher at www.TeacherComplaints.com  Tell your friends and other students to do the same
1	haha, to be honest I do agree, but I did find some places that offer redemption 
0	thanks so much for linking to my treasury, however your link doesn't seem to be working for me  try http://tinyurl.com/mq9e3x ?
1	Advance happy birthday to you!
1	wow.. the cheesecakes in shotglasses are tempting! yumyum. how much is that?
0	oh no!  sorry to read that, so sad.
1	Already love the snarky tasha
1	 and Im SUPER BADASS so it suits me......
1	wat up beautiful wat have u been doin while i was performin for the past couple of days ..stirring up trouble im sure
0	what studio ugoin to at 6 or 7 and how come idk bout it
1	that nice pic kaa miss you naa grace
1	have fun at the gym.  I think I've gained SO MUCH from this BOSTON trip.  Getting on the treadmill soon myself
1	Agree completely about fit dogs which is why I recommend freestyle: www.worldcaninefreestyle.org  for a fit & well-balanced dog.
0	I do this from hanging out with chris too much. Damn him.
1	Because I'm just a tad bit obsessed...
1	hmm...have you decided yet?  which car will be yours?
1	I'm soo happy for you!  He actually did!
1	maybe the wrong word to say...I'm german, remember  i can't express myself very well in english
1	see now THAT just isn't fair. you should go to work for me
1	well hehe, now that I've finally installed msn on N's computer to be able to talk to you 
1	aha! caravan houses are wonderful because the views from the windows change as you go  Who's peculiar bird?
1	Nah, best that I don't know 
1	So many questions!  What's their mom's name?  What breed are they?  When were they born?
1	Treats good
1	<blushes> aww, thanks! I think Zoe (& my sis Madison) are my all-time favorite diva girls. I guess divas can B cool, too! 
1	Why thank you!  Happy #woofwednesday to you too  http://bit.ly/VfIvC
1	Oh, you are funny! 
1	BTW, I tried your version of Starbucks this morning and it did the job. I'm inspired to play with it. Maybe raspberries?  
0	No no kittens and woofies all good.We did lose a rescue kitten - had him les than 2 weeks and he passed away
0	 Oz sounds like Iowa when it comes to puppet awareness  A bit of a struggle. Other US states MUCH BIGGER aware
1	just started following me - don't have a kitten training sister company do you?! I need it this morning
1	i hear ya get ur prety self to nyc already  aww hows ur dogy?so u moving to nyc so u can stay safe forever n ever
1	I know July 21st right?  LOL
1	i will be im super duper fresh and wide awake lol  tada party time lol
0	well for my littleun it was really quick to work
0	Well, I have 2 kids with eczema, so they have pretty dry skin with that  we have prescription emollients though.
0	i can easily do it with my mind, but my heart hurts when i do try to do it .. me is complicated life at the moment  lmaoo
1	 haha thanks, your not too bad yourself lol ;) x
1	yaaaaayy!!!      you guys are awesome!!
0	why didnt u hit me last night? i was givin them out
1	it looked so nice at the time you were there!  how long were you there for?
0	and ur tweetin....lol i wish i was there!
0	my rink  i dont know how im going to afford ice time now the prices are insane
1	i enjoyed that movie
0	Oh I freaked everyone out  Weird symptoms = me googling = me thinking I have every disease in the world.
1	thank you love!!!
0	Well, masih ada exam dari sekolah 
0	without me
1	thanks...I'm feeling better.
1	I hope so!   #chuck #chuckmemondays
1	did you run out of pasta or need some new shoes?  switzerland is close so drop by for some chocolate ;)
1	lol it wasnt me tho!! Im super careful wit my iphone!!!
0	true...I'll have to look into that
1	You are a JO...you know
1	Join the Peace Corps! I did and I'm from VA too.
1	that's coo, and by kids I meant dogs hehe 
1	i'm doing good. i enjoy the rain  i hope you are well too.
0	http://twitpic.com/6p9xv - What did you do?!   poor Tom *gives chocolate*
0	i'm sorry someone let You down Love  purrs and cuddles up with You to get some rest xox <3
1	Piss heads
0	I know but I want it now  I feel like a kid asking when I'm gonna get that new toy lol
0	curangg! pgen ikut narsisnyaa!
0	I wrote a $700 check just for cheer last week  If I don't sew non-stop I can't pay for it. So tired of cheer draining me!
1	Hey Al, thanks for the followfriday. 
0	URL is no good
0	Aw, I'm sorry. 
0	hope u have a great day! I'm off to bed
0	I cant DM you if you're not following me
1	that's fantastic! Great news! What part will she play in the video? I'm good thanks. You Keep well
1	I knew your name looked familiar  Thanks for reading! Your nickname is now Mr. MANO. Great organization.
0	 i know how to fix it... you, steven and me. pho! things will be all better! yay!
1	your back from Ikea eh. So it will be just you and your alan key for the rest of the weekend
0	nunca mais vc ficou on-line...
0	lol.. it WAS.. now its just getting pathetic the words ppl are coming up with.. smh, it was just a random rant, im so bored! 
1	lmao how  can  you tell ??
1	thank you for the followfriday!!!  checking out the recommendations now
1	    (will be finished film properly this week, hope to get down to you for a visit soon)
1	hmm .. I see my soft differences already registered in ur blog comments
1	this is our JavaOne presentation http://tr.im/nAm5  You may notice eerie similarities
1	Gods? You're pagan too? Nice
