0	Already getting sad as my family is packing up their things to head back to Iowa tomorrow.  Trying not to have any breakdowns on my b-day!
1	Already got a bruise forming from my clumsy bike riding.
1	Already here at the place!... Ate and everything!...  it's gonna be a great night!..
1	already hit up 3 clubs, promoting sunday, almost done 
0	Already home.   wish we wouldve stayed for the band. Boo.
0	Already hungry for lunch and it's not even 11:00 am yet.
0	Already I forgot you but your shadow always distrub me
0	Already in bed! My head hurts!
0	Already know I'm gonna miss josh next week.. My mom needs more surgery.. Work sucks.. Not a good day. Oh and my tum tum hurts
1	Already looking for this weekend's plans? Meet us at Uptown Friday Nights! Fridays in Cedar Rapids' Greene Square Park from 5-8pm
1	Already looking forward to the weekend, happy hump day everyone! 
0	Already losing tweets #tweetie
1	already made $35
0	Already miss my kids.
0	Already missed this.  http://www.howconference.com/freelancesessions/
0	already misses Cara!
0	already misses the boyfriend
0	already missing chelsea, Julie, nick, mikey, and other people i was only friends with, not best friends with. ahh! 
0	Already missing him.
0	already missing my biddy bops  home at mom's for the night watching my little bro and getting some rest for my birthday party tomorrow :-D
0	already missing my lil bro
0	Already missing Nick and Julia
0	already missng their giggles and  hearing their chit chat. My nest is empty once again
1	already notched up 3 and a half hours revision today. oh yessss!
1	already on it!
1	Already ordered some Earthday Birthday Gifts
0	already packing stuff for london, i miss you 
0	Already packing up load one of moving home  The apartment looks so empty already!
1	Already ready for McFLY I think I'm a bit early lol
0	already ready to pass out, and i'm not even done until 1. my bed never looked so comfy, and its not even close to my bed at home! 
0	Already regretting going back to school, and it hasn't even started yet 
0	Already regretting trying to finish school, and it hasn't even started yet 
1	Already roasting in the costa del sol... Might try and go for the burn today...
0	Already sent two or three one-forties without hashtags. I'm failing miserably on today's #140Sunday  Oh, well, oh, well, oh, well. Filler.
0	Already shaking from too much caffeine  at Edmonds beach thinking and reading.
0	already stressing about this
0	already sucks at work. idk if i have a meeting tomorrow.
1	Already talked with papa and great-granddaughter before leaving. Now talking with one of her daughters.
0	Already thinkin bout skippin out on the gym tomorrow
0	Already this is a bad day  i can feel it's only going to get worse :-\
0	Already time to leave the mitten state
0	already tired!  Weather influence?
0	already tons of drama and its only noon
0	Already too much water on the greens   Tiger going for birdie on the 2nd hole.
0	already up
0	ALREADY up  Work in 2 hours D:
1	Already up and in the clouds, cod4 and French toast, best day of my life 
0	Already up and s really dont wanna be
1	Already up and sitting outside, getting down to some well needed writing  hope u all have a lovely day!
0	Already up and very sick. I miss him and think my body is having withdrawls.  hope I get to see him tonight. (@aarong405)
0	Alredy missing my Sis!!   Snif snif
0	alright  #afterhours peeps... have another option for WP podcasts other than Podpress?  can't make it work.
1	alright all,  im heading to bed. i shall be back tomorrow at some point  going to try to get the internet to work at work  ?
0	Alright alright, go wash my hair. Sorry I ruined your life all evening 
1	Alright bought JB new album on Itunes so now thay makes it my 3rd copy  Now I am going to bed night all
1	Alright boys, ladies, boyladies and ladyboys - time to open up. Have a fun Sunday morning. Talk laters! 
1	alright darlings, i'm going to scamper off and get a start on my day  need to grab some gas today lol
0	alright enough freaking out rofl. time to sleep it's going to be 1am and i have to wake up at 4:30 heh
0	Alright Espana here i come. Seven hour flight! Missing you already
1	Alright Everybody who is still following me, Dizzle is calling it a night. Be back nice, bright and early for some F-IT Friday action! 
1	Alright everyone I decided to answer a few more questions
1	Alright gang. Gotta go park with family for an hour. Back then  Mwahs to yu if you head to bed before then
1	alright good night for now :C (LOVE YA) idk Be safe this night dont roll over and break another arm
1	Alright goodnight everyone. Interview at Sony tomorrow. Wish me luck
0	Alright here is another tweet. I'm not leaving for another two and a half hours
1	Alright I also trust for Follow Fridays too since I follow like 3/4 of the people he suggests ;D (via Thank you
1	Alright I am off to bed.. try not to assasinate me in my sleep to much..
0	alright i finally think its time for bed. and dang it i didn't get to read breaking dawn tonight
0	Alright i have double the amount of hmwk i had yesterday with less time to do it  i have to work
0	alright I woo sah for a minute no more twitter beefin..I think I need a drink and sum xxx(damn im a virgin still)  lol
1	Alright I'm off out to dinner with some mates from Uni - You all have fun now
0	alright im outta bed and back on runescape, what now punks!! im gonna get 70 fm from 67 in one sitting 108 combat ftw, i wish i was lvl 3 
1	alright kids! im off for a bit. ill be back soon  xx
0	Alright let's start this adventure again... Had to fix a dead car battery first  there went our fun money!!
1	Alright loser.  Going to bed now eh.  LOVE YOUU!
0	Alright love Im going to sleep... besides you're hurting my feelings by not responding   But enjoy your night... ttys
0	Alright my contacts are getting back to normal but NOT really
1	Alright nah! Got some replies!   Sorry for yellin and wakin yall up
1	Alright nite tweebs... tomorrow is another good day. This weekend was awesome, ima go dream about the bd now 
0	alright so i saw the movie drag me to hell and all i can say was the only part i cried was when the cat died
0	Alright so the whole fising thing didn't happen instead we saw the saddest thing a seal that looked very ill on the beach
0	Alright start the countdown... TIME LEFT: 18 Hours 9 Minutes until summer is over
0	alright there aint shit on the TV! lol...bored
1	alright this is my 700th update...and it's going to my love  love youuuuuu.
1	alright twit luvs...i gotta throw in the towel...good nite 2 u all and if i cld rly get down and pray i wld...but have a safe night
1	Alright Twitter Bugs, I'm transcribin this interview and then callin it a night. Let that Jay-Z D.O.A. simmer in ur brains 
1	alright twitter Im off... be good and prepare yourself for a lakers loss
1	Alright twitter world, I'm off to bed. Sleep well 
1	Alright Twitter-Land off to run some errands before the 6pm Twi-Meet see you all there  Email my yahoo if you get lost or confused
0	Alright twitts I think I need to lay it down I have to start moving in a few hours  don't be late tomorrow! I will need help
0	alright typing all these was really boring  Taryn I hope you enjoyed them
1	Alright we have picked up everyone! Finally about to hit the road
1	ALRIGHT YA'LL . .. I'M 17 MINS BEHIND SCHEDULE! GOTTA GET BACK TO THE BOOKS! ENJOY YOUR AFTERNOON EVERYONE
0	alright! day almost 1/2 way done...NOT! back to work
1	alright! fedex FINALLY won at Roland Garros!! 'tis a great day for history to be made
1	Alright! I made First Star for my WBS team with 1G 1A
1	Alright! It's back to the gym tomorrow and I'd love to have and as gym buddies bc they make me smile.  #followfriday
1	Alright! My favorite time of day, my Dad's leaving for work leaving the house all to myself! 
1	Alright! Party was a success! We all had fun, & now it's over 
1	Alright!!! Back on my island  . Getting some rest so I can have an awesome last day here. Sarasota ROCKED though. Gonna miss it...
1	ALRIGHT!!! I'm ready for some tweets & I rec'd another sign 4 change but 1SY brotha Arsenio!!  http://bit.ly/O3TZo
1	Alright, alright I'll admit it - Star Trek is a great movie. I'm glad we saw it! 
1	Alright, done being a bum for the day. Getting dressed and going over to John's Mum's house! Yaaay! 
1	Alright, exam half-studied for. Next is file system implementations and disks. And then I'm mostly done with this class for the semester. 
0	Alright, fine. Off to work. 
1	Alright, for real now, to bed! Night 
1	Alright, going down to seattle to check out the new studio and see the guys from this providence. Peace 
1	Alright, going to bed earlier than last night;  But first I MUST catch-up on my Bible 
1	Alright, gonna try to get some shut eye. Looks like 5/4 will be the birthday 
0	Alright, had a couple nice long naps and some neat dreams.. But I must have bumped the sleep window closed again 
1	Alright, heading to work to deal with the hour long traffic and the 8 hours of hell. I love it! 
0	alright, how do you get pictures up on this? It won't let me 
1	Alright, I have to do the responsible thing and go to bed. Early morning. Good night! 
0	Alright, I lost my 2 years goodfriend  What's done is done.
1	Alright, I'm feeling like I don't wanna work anymore this week. This being Monday noon, I'm totally screwed. 
1	Alright, I'm just gonna embrace the day 
1	Alright, i'm just testing my phone's twitter 
1	Alright, im off to listen to some music, then its time to read some #otaliafics!! Gotta stay in the mood til' #otalia next week! 
1	alright, i'm off.  34 followers, 210 updates, thanks people! â™¥ xo.
0	Alright, I'm out. my husband has to take his computer to work 
0	alright, ive seen her...she can leave again. 
1	alright, logged off of myspace & facebook..now twitter, lol. goodnight every1 
1	Alright, night Twitties 
1	Alright, now that I finally woke my ass up late as usual....it's coffee and green time! The best part of waking up.  Yeah I'm a dork.
0	alright, post-production 99% complete. Sad part is, I have accidently deleted another project which was a really good track 
1	Alright, so who's doing a #nvfn? I wanna come to one!  gimme info please!
1	Alright, still bored.  Can't wait to hang out with Elizabeth today, it's going to be awesome         
1	alright, stop! it's wawa time. 
1	Alright, time for me to get that snuggle on. Don't be jealous.....much. 
1	alright, time to stop procrastinating, I need to get some work done today. First in line: the apple tree, poor thing needs some staking 
1	Alright, tweeps. Catch ya lata. 
0	alright, tweetie's been moved to the trash. it's clearly not accessible  maybe I'll email 8 bit? maybe they dont know about accessibility?
0	Alright, which one of you stole my copy of DiskWarrior? need to build a copy of 4.1.1 to fix friend's mac & can't from backup copy 
0	Alright, you guys were right...The Hangover was nothing short of hilarious! Watching the Greek Season finale booo  #fb
0	alright. i must sleep now.  this is probably gonna hurt in about three hours.
1	Alright. I'm out of here. Time to hit the hay. I hope you are all well.
1	Alright. Off to navigate rush hour traffic as I head to Malibu Seafood for dinner with
1	Alright. Watching the office that I missed from FOREVER AGO. PAM'S PREGGO!!!!!!!!!!!!!!!!!!!!!!! WHAT!?  haha.
0	alright... nick.... miley.... niley....    D:  :[   this is sooo sad!
0	Alright....tired of reading.    What to do?  Maybe I should work on recording?  Oh wait...that's reading too.....
0	Alright...I already miss Wifi Toggle concerning 3.0
0	Alright...I think this game is over
1	alright...im really going to bed this time. night everyone!!! sleep peacefully!
1	Alright...time to get off my posterior and go take a nice relaxing shower.  Then breakfast
1	Alright..is anyone else all frothy excited about The Sims 3?! I'm a goob. 1st build a house. 2nd make a freaky family. 3rd torture movie!
0	alright..only a week left...so sad
0	Alrightey folks! My internet time is up  Time to hit the beach for one last time before I head home
1	alrightttt twitter. i have netball nowww  this is my 600th twitter haha  byeeeee
1	alrighty imma go eat nowww yummmmm mcspicy meal
1	Alrighty tweeps..headin out for the nite. Get home safely and play nice  Hopefully I'll get up for an early AM surf, but we'll see..
1	alrighty tweetbudz, going to have coffee with mah dear friend  tweetcha when I return Peace out
1	Alrighty, break time for Ashle...might be on later..might now...until then nighty night. 
1	Alrighty, chopped up and prepared the ingredients for dinner tonight. Did all the housework today, and preparing dinner later. 
1	Alrighty, I have a 3 mile run and then I'm heading to for my bowl of latte love. Save my seat at the bar 
0	Alrighty. Workin on a project then going off to work... aren't y'all jealous...x D  Awe, that was super illiterate 
1	alrighty.... im off now peeps.... have a good one... peace out!
1	Alriiiiiiiiiiight Goin to work. Workin til 5 Then maybeh a live show tonight around 7,8,or 9 pm havn't decided yet  TTYL laterz!
0	alrite breakfast and internet searching done. Time to get into the study. Exam is 5.45pm tomoro night  still so much time... sigh
0	Alrite their done now !!! Going to bed I guess.
1	Alrite Twiggaz, I'm callin it a night.. I think..?? LOL, see ya 
1	alrite.. time for bed now.. tired.. goodnite tweeties..
1	alrite.. was a good time with folks... all left now... at home alone...  will prolly browse a bit n then sleep!
1	Alsdkjdkldkf. Semi-great weekend. I got a car!!  Now hopefully, I hope i'll see J today. .:]
1	also -- 45 minutes?  how did that happen?
1	also - counting down the hours until i get to see my lovelies at kimi's house today
1	Also - forgot to mention that we saw the trailer for TOY STORY 3! And I was probably disproportionately excited. Still am  #pixar #dis ...
1	Also - I love when the shoes I order from arrive before I have time to track them.
0	Also - Nobody told me about Asthma Camp.
0	Also , my face is so sunburned 
1	also ... http://www.hawaiiactivities.com/us/hawaii/oahu/sg/1201/ag/6286/    ..
0	also 2007 would have been the perfect history essay paper
0	Also 6 students got more %age than me!
0	Also a spider kicked me out of my room last night  it was fucking huge so i slept in the spare room . damn spider
0	Also about the Miracle Whip. It's impossible to have a good sandwich without it.  A homemade sandwich that is.
1	Also all the Jaspers out there please #FF too....Thanks
1	Also at art of Elysium: Nate lowman, but I couldn't get a picture cause his olsen was in the way. Love you too 
1	Also ate pizza and relaxed in the sun on the beach
1	Also available as "flip book" but the link is too long to fit in here
1	Also Bad Reputation was single strokes which really makes me happy cause not alot of people can do it single stroke and FC it.Later
0	Also boyfriend wants to follow me around at bcon - hopefully it won't be too awkard for people I want to meet
0	also cancelled my Nikon 50mm lens order  needed to buy some struts and tires for my car...
1	also can't wait till november
0	Also cleaning a rotary engine for a rebuild is time consuming and if you fuck up the slightest thing, all can be lost.  lame....
1	also completed stage 4 - Night At The Museum 2... Pretty good film
1	Also cut my hair. Yes, I do my own - if you have seen my head you wouldn't ask! And TCO of clippers < NPV of haircuts; 100% ROI < 6mths  
0	also dreamt of my ex and that he loved me again. now i miss him.
1	also drunk coffee today, 
0	also finally home with no friends or anyone.. kinda nice to sit in a quiet room.. do wish the gf was here tho...
0	Also finally took time to savor Main St. USAï¿½on my way out  The food shoppes smell amazing. There is also a window w/random singing man.
0	Also follow the amazing mitchellgreg Im sorry babe  I try to get everyone
0	Also football camp and practice and combine #2 in July so very busy
1	Also gonna wind up presenting something that's not actually checked in yet...livin' on the edge
0	Also got maths exam back, OMG I did really bad. 78.3% so 78%. if I thought my science was bad i really didn't think. I DID HORRIBLE 
1	Also got my glasses today. I can see perfectly now!!
0	also got my letter from the dvla saying i cant drive for 6 months great
1	also got spongebob smarty pants shirt frm ilford  yay!
0	also gotta say I am 39, I love metal, I don't like metal at 120db.+   wow.
1	Also had a complete cleanup of the editing room. What a complete waste of a day.....but....with HUGE results  So, I'm satisfied.
1	Also had a great time talking loudly and making the neighbors angry.
1	Also had an interesting conv. w/ my mom this AM. Pray that God's loving grace will lead to a change in lifestyles that do not honor Him.
1	Also happy Sunday to everyone of my tweet fam
1	also has encrypted packet fetch for bandwidth stuffing, like an IDoS 
0	Also having the same problem with gmail as mentioned with Gmail putting legit emails in spam folder.
0	also i done the race for life today ;D! i was fine earlier but now im abit tired
0	also i feel bad i didnt get my dad anything today  but hadnt got any money grrrr
0	also i hit my chin on something when i fell down and it hurts  ugh... work is gonna suck
1	ALSO I LUV A MAN IN UNIFORM...POLICE,FIRE FIGHTER, ARMY, MARINE, NAVY, ANYTHING LYK THAT...ITS SOOO SEXY 
0	Also I need to figure out how to get 600 bucks together to buy a new pc as it seems mine is completely fuckered...
0	Also i ran out of #coffee
0	Also I really can't understand why The Ship isn't incredibly popular. It is genius!
1	ALso I think Megan Fox is an alien.... she looks so waxy pretty. Maybe she's a cyborg instead. Maybe I should go to sleep
0	also i was gonna just post the webcam url, but it was way too long arrrfggfds, k i better delete that journal 
0	also im feeling sad tht my favourite celeb couple r spliting i just wish the damn press wud leave them alone!  xxx
0	Also I'm not sure gutting roomba was a good idea, you have... Or had a warranty... 
1	also in said panel, at person who shouts out "PORNOGRAPHY!" at 25min57... yeah, thats me  #asylm
0	also in that meeting i think i might have said 'well yeh you know' a bit too much  why?
1	Also it's fucking wonderful outside today. The weather is perfect
1	also jn does not use electronic feed or a robo program, we do updates naturally. we need some twitter priviledges or some extra perk! 
1	Also just hope Grannys know how to go to the speed limit of Ohio not 20 mph lower.    This is roller coaster state! Be fast!  Zoom! Zoom!
0	Also just realized that my digital voice recorder doesn't have a USB port!?!?! I think I picked the wrong model
0	Also made an especially obvious mistake...which the whole CTK heard o_O  STUPID ME.
1	Also made beach-themed cupcakes. Some guy bought them all for $50! (he just wanted to help the cause)  http://yfrog.com/0qvxttj
1	also make websites for people. If u need one  dir message me and i will get back 2 u. oh yeah it is FREE also   i love free dont u?
0	also- my family sold our swing set. this is very sad.  the first signs of moving on and growing up. (never!)
1	Also need to download new CobraCam.TV
0	also need to update our inventory system if i can .. really sad that my dell !m1330 cd rom seem to have gone bad.. just doesnt work
0	also nervous about the test im about to take ;-; wish me luck, yo. also lol. 
0	also off to fail byeeeeeeeeee
0	Also picked up a nasty bug thingy which has made me feel completely 'orrible
0	also pondering how to trick Nicholas into wearing his new glasses... been crying since i told him he needs to wear them.
1	also quick update on weather for next few days in milan. wed - sun: 31.C and sunny.  off to lidl.
1	also raisins and whole grain cereal   oh and apple sauce ....lol geez i havn't had raisins and apple sauce in YEARS D:!!
0	also realized I microwaved this burger for 3 mins instead of 70 seconds  Forgot it wasn't a micro-pizza - fail!
0	also realizing how I am gonna miss the playoffs tonight
0	Also rip snegerz you well missed  I will never forget and will never forgive
1	Also saw Chris, Kristen and their son Tommy for breakfast, which was very cool. Hadn't seen them in a while... 
1	also skype right now    "djdjago"
0	also somebody just threw his banana peel a random big dude
0	Also still wondering who is going to coach poor old Ajax... with van Basten gone now we need a new good coach...
1	Also thanks very much Gerard!
0	Also that yes I've had it hard but thats no excuess to be so pathetic
1	Also the "Second Attack/Death of Gavroache" I like the men's dynamic voices.
0	Also the getaway plan were amazing lastnight so much fun!! Great send off
0	Also The Gossip Girl Will follow us into College!
0	also the last day of Holidays tomorrow
0	Also there was a cougar in the lobby last night, but she didnt come back like she said she would 
1	Also there was a TESLA COIL   #makerfaire  http://yfrog.com/59w1rj
0	Also think I may need a new ipod. Finally got a charger that also plugs into the computer and only have 2.98gb left.
0	Also thinking I have to look at someplace like Wazzu or CWU or WWU for BSN/pre-med as no real pre-med at UW. 2 years+ away from Charles
0	Also this is day six of no smoking. Is kind of going well, except that I cant stop thinking about how long its been since the last one 
1	Also this song. Yeah I love it.   â™« http://blip.fm/~7tv6z
0	Also tomorrow it the last Friday of the school year.  ?
1	also trying Opera Unite now
1	also waiting for Toy Story 3
0	Also waiting on a reply about a house that we really want to rent......(she says whilst biting her nails impatiently) xxx
0	Also walked on treadmill for first time since surgery, got 15 slow mins before knee done. Couldn't even get heart rate over 105 
0	also wanna see Silversun Pickups this year. too bad no
1	also wanna wish my friend well--she knows who she is--
0	also wants 2 throw a shoe ...
0	Also watched 'Analyze That'... disappointed  I was expecting it would be as good as Ananyze This.
0	also watching trying to upload my photos to her site unsuccessfully  she's so tired.. awww...
0	Also went to the beach, cold and empty when we arrived 
0	also who invented chemistry and why do i HAVE to do it its so hard no 15 yr old girl should have to do it
1	Also wishing et. al. a great #uxlondon
1	Also with Jaslyn + Patrice .
1	ALSO! How can I forget!? Knock You Down is currently #9 on Itunes top songs! Congrats
0	also, #FF 2 the girl that never gave me a chance.. 
1	also, 63 DAYS!!!! 
0	Also, am having a bad day, everythings going wrong, just want to start the day over! Cant be bothered to go to work 
1	Also, check out: http://www.youtube.com/selkefam & http://www.youtube.com/CourtCRAZE 
0	Also, could all the people moaning about iPhone updates spare a though to all those who don't have one 
0	Also, desperately crossing fingers for job prospect. As long as bground check goes through, I'm good. I hate my student loans 
0	also, did #GQMF become a trend at any point while I was gone in the last hour or so? 
0	Also, extrems is unfriendly 
1	Also, for beautiful music, check out 
0	Also, French exam tomorrow, double fuck 
1	also, go sorana! she is so cute  also has a fun to watch game. and go gael and whatever over delpo vs. robredo. #rolandgarros
0	also, good dream last night and good dream when i took a nap yesterday. then i woke up. shitty. 
1	Also, Good Morning Everyone!!! 
1	Also, happy 4th birthday on June 1st to Lola Rose Sheen 
1	Also, hello to new followers.  Drop by and say hi. 
0	Also, I am a hypocrite. 
0	also, i am so sunburnt i'm questioning my ability to wear a bra to work today   or pants for that matter.
1	Also, I designed the banner for http://mudroomboston.com/ - pretty stinkin' cute no? 
0	Also, I do not like broomballin' because my head is too large for the helmets. 
1	Also, i found on twitter, my childhood hero, embassador for many fantastic charities, n extremely understated actress  xx
0	also, I guess my test was flawed. and...i fail at life. especially the part where i have to interact with people. 
0	Also, I have the best sister in law! You'll be missed at the footy mate  but very happy travels to you and Dom! xoxo
