1	Get 100 followers a day using www.tweeteradder.com Once you add everyone you are on the train or pay vip
0	 just found out i have a video to shoot tomorrow night, so i can't. i would have LOVED to though. boo.
0	well then, must be time to say good night!  i'll come see ya spin after i move to socal.  i want a cool dj name too 
0	I can't afford art school
0	Hey Poppy!  it's Mal (malzadoll).  Sorry Twitter is being lame.    Ask if you need help!
0	havent looked yet  Still making the paper the main focus....all over friday! SOON SOON- whats the deal with the Tampa class?
1	Cute! Especially with a bun. I'm really into buns these days.
1	Hey Don...thankz again for followin me....i so love ya mix tape.Looky Lookie, Shes Bad(of course),and I Ain't Trippin go hard 
0	I think ima just go head and turn off my TV my feelings r hurt...& Nike needs a new puppet
0	no, I haven't. 
1	I say "can you print this on laser printer, cheap." They say, "Huh?" I say, "Print!" They say "10 peso" I leave 
0	I "quit" Seroquel after 2 years but now, even though it's hard, I'm admitting I think I do need it  Melatonin sux!
1	It's hard to really voice that I "need" anything.Not sure what I need
0	awww that makes me miss VA  and the simple things ugh!
0	yup.... but the issue is that i still like him soooo much.... even through his crap
0	thanks so much for coming to miami! my camera effed up and my pic with you didnt come out.  hope to see you again soon xoxo
1	:L sorry thought you were
0	bahah. but....nick..
0	yeah.. it keep sticking though.
0	nearest IKEA is in Montreal
0	nope  i wasn't home went it was on but i will soon,
0	Who you telling? And I'm so afraid to die. I know its part of life but damn
1	LOL I tried to include all of my female followers
1	this may sound conceited... but thank you to both of you!!! have fun later at shangri- la!!!
1	and it will be even more senti with the sharpie decor
1	I hope the best bits are not in the advert!! This is my favorite of the books so I have my fingers crossed for a good film
1	hey garth, nice works. 
0	haha silly girl. i'm sorry though
1	 예 안녕하세요 반갑습니다....
0	It's available in iTunes already. I have to wait to start downloading on my lunch break in an hour
1	how fun!  Invite her to the hhs group
1	i hav a nikki? Ah 5* wil b gud im doin 5* for JB&Darien Lake 13th row for Nj
1	responded in dms but if u don't get it send me ur email and I will respond there
1	and they say I'm a need.
1	Thank you babe... perfect timing. Love ya. Need some positive energy right about now. Cheers.  x
1	brightside of living at home - more Twitter time! It's nice to see updates a little more often lately
1	*flicks hair* I prefer to be called a "twenius"
1	if you guys fancy trying the lindt cafe sometime let me know
1	I'm starting an assignment the night before it's due the second time in a week. I need to get out less
1	no worries Kate!
0	Whats the alt text? (Can't get alt on mobile  )
0	damn. Mean!!! I don't even guzzle customers!
0	nobody will take me in
0	sfo  .......back to seattle tomorrow night
1	hahaha, yea that would be nice  but the best things come to those who wait so it'll be worth all the time 
0	WTF ur at U31?!?!?!?!?!?!?! I JUST LEFT!  Kelley I freakin hatechu
0	yeah. oh "elvis"... yeah. Oh Stratford. I wish I could go, but I don't think I'll be able to go any time soon 
1	oooh my God!! I like this version way much better than the original! I LOOOVED it!! geez u made my day already  tnx 4 sharing
1	haha I'm sure I would!!  haha
1	hard for you to wake up, i laid in bed for 30 mins! But i brought that on myself, twas worth it 
1	I have heard it. Kind of crazy, but likeable 
0	nope, found nothing 
0	Oh yeah I read about that.. hitting the jackpot is not even a good thing cuz they wanna keep most of ur money so I heard
0	unfortunetly no  I wish, I mean sometimes like twice a yr they'll have a party, but not always
1	I'mma send a holla out to you Cheeba! the only night show host i listen to!  Hehehehe...
0	 I can't bring myself to watch the last episode again or I'll cry.  I miss Olive and her awesome dresses
0	Hey KC - so sorry to hear you aren't feeling well    Take it easy this weekend and I hope U feel better soon !!! --hugs--
1	Hope you'll have fun...It probably is nice to be around Okies hehe
0	I'm sorry you're still sick babe  hope you feel better very soon!! take a day or 5 and rest ok? you deserve it. love ya.
1	It sounds horrific! Get well soon!!
0	Me too! I'm going to miss it
1	NIce character name "Denny Downs" Did you have something to do with that one??? Too funny! Loved the episode & your song!
1	Thanks so much for today. It was really lovely, poignant and hilarious. Hope to see you soon, Dr. Chenoweth 
0	There's still a hole in my heart.
1	you get to be in the presence of tyler hansbrough. You are one lucky woman!
0	awww shit atlanta, thats my cityyy i miss it  have funnn
1	Thanks KC! we need some west coasters on the site.
0	Stayed in, was stormin!  I was wonderin where you were, babe!  What'd you do last nite?  Missed you 
1	Love you so much Kat! Such an idol!!!!  You were amazing on Good Day NY and remember..Dance Baila La La Lo!  Hahah lol.
1	Haha ya, my friend and I are totally having a kick off party for the occasion!! 
1	Yes. Being a pastor's kid has made me crazy. But loving Jesus makes me crazier.
0	 hehe whenever i get the money to go that is. im terrible with saving! i miss england
1	Ya I'm first generation here in the states so my parents and grandparents mainly speak Greek.  Yiayia's are the best!
0	hookah without meee?
0	oh im sorry  who is going to be president?
1	 im rather excited for these exams to finish!!!!
0	a lace? is that some drug lingo? I'm soo disconnected.  Come visit Greg and me in Davis! Have margaritas on our porch!
1	YOUR NEW PROFILE PICTURE!
0	lol, yeah i dont blame ya, your lucky your not at hockey from 5-9 tho, its going to be extremely cold kate 
1	my dear, come on msn 
0	I was attacked by an epic horde of ants in my kitchen too
0	no please don't go  You'll miss the 604 and you know it!!
1	 Where do you come from?
1	thank you!!
1	it is very! and hot  xxx
1	Congratulations!! If you need advice or have questions, DM me, I just went through it  Yay for you!!!
0	nah, not that I know of anyway... information on the target audience is a bit scarce at the moment 
1	Poo to that. Time to move out perhaps? Back to Melbourne?
0	Oh noes!  What happened?
1	damn I wanted boycottlove69
1	see you tonight
1	You too sweetie
1	haha o know! i didn't realize that!!!  i alwyas make mistakes. i am chatting with tons! LMFAO! haha dumb!
1	haha, yeah i meant mall! -winks back- 
0	hi! again.. LOL can i ask a favor? can u gve me a site where i can watch the MTV movie awards? i cant find it anywhere..
1	oh okay..  nice tweeting with you!  LoL
0	ROFLLL! xD detention?! oh nooooo  but the good thing is... detention room=starbucks! hahaha DD
1	Taylloor is also one of m faves.  no need to compare.  haha
0	tommorow's school  hehe. and wow, what did you do today? 
0	yeah i saw that & i replyied i said what's up? you didn't reply
1	will that fruit iphones
1	The Turner to Cezanne exhibit is only making one stop in the south and its in cola at our art museum. Might be fun!
1	I aint no roonoob
1	your welcome kate
1	can I have one too?
1	ah bless, sorry to hear. (raise you my plaster is harder to type with: http://twitpic.com/55a4h) 
0	cats in Angel, why put them down?!?! why can't they send them to a rehoming place?!?!?!? 
0	wtf happened to you?!?!  today was busy busy busy and i've done more math than anyone should. still unprepared though. oh well
1	Hey thanks.  God we had a blast there.
1	That's what I'm trying to work out! lol.  And start prepping yourself...  http://twurl.nl/iq7qu2
0	I can see maybe hating a person but all women? That's just wrong. I love women. They're sweet! Same here with twitter also
1	yes. Lyrical genius. She takes my breath away. As for the thunder,turn on some loud music, or hide under covers. 
1	oops just saw your other tweet  me as well. ENTIRELY.
1	sounds yummy!!!
1	thank you - I plan to be one of those embarassing crying moms - he is a true gem
1	I'm a fan of alliteration, so of course "ClineVines." 
1	Congratulations  New employer or new position?
0	point ... enuf trouble wid matkas.. now new creatures..
1	my favorite songs were from the AI days
0	why right wen I was gonna retweet mah twitter said I was tweeting 2 often
1	- gorgeous!  He is the greatest Artist.
0	You never tweet
1	I'll take a sausage & cheese please
0	Belated Happy Birthday, Kris! Sorry I missed it - especially since I'd known since Mon that Thurs was your day.  Hope all good!
0	tinaaa.  be cool my sistah. haha.
1	halb so wild.
1	that's amazing. Well, congrats on getting him. 
0	where have you been?? I have been calling you...
1	Okay, whatevz. HAHA. You have new phone nah? 
1	Don't worry, you spelt 'disappoint' correctly! It just looks wrong 
1	Syrah is a wonderful drunk and in the opening lines of one of my fav Radiohead songs  How was DCFC?
0	yes, please do.  
1	that was a gorgeous kitteh! I bet Maui is gorgeous too. It's on my list
0	I was just shown ads about having poor credit.  Fail!
1	Excellent! The plane gods were on your side
1	Hope flight was on time
0	ouch  ... when she's back to you in 3 months saying its still not working ...
0	did you get a reply from Gov Schwarzenegger? I did, not really happy with it 
1	If u work in a cubicle u need one of these trust me  http://icucopyclip.com Rear view mirror & doc holder in one... super handy!
0	the team this morning lost their 1st game, so we were done by 9:30.  Not such a fun tournament when you lose 5 games. 
1	Oh, and so glad you where there this morning and it went well 
1	Yes, Cod is one of my favorite vegetables... Particularly breaded and deep fried, with Tartar sauce. 
1	wish i was playing music with you guys instead of being at work. i just want to play all the time now
0	probably.  He wanted to help families with diagnosed severe defects. One of only 3 clinics in the nation that did late term
0	there's a crack along the upper edge of one frame that I'll likely have to superglue so my lens doesn't fall out
0	To Memphis? Never drove there but according to mapquest its about 12 hs from here!
0	you too huh? I hope we get ours soon
0	I'm jealous every time you mention drinking and Ames.
1	Perfect day for it, no? 
1	 Me too, and i have to be come an athlete again (darn it).   Oh did you send in your question for James Roday yet?
1	Ha so you do eat junk food sometimes phew lol
1	Happy Birthday Queen of Psych the Psychlapedia who lives in Psychadelphia.   Welcome to the "0's"
1	Have the best birthday!! Xx Up to Psych season 3 now
1	I know it was a while ago now but just heard the psych podcast yey you for getting mentioned
1	going to? already has. please don't add to the noise
1	Thanks for all the recommendations.  Will check them out!
0	apparently all the costume stores get there stock from the same place and they're sold out for 6 weeks
1	 **the weekend is always something to look forward too
1	was it expensive or cheap? if it was cheap....make it into a necklace...
1	it is the best thing we ever did!  just make it your own and go with what works for you.  #clothdiapers
0	yeah where is everyone tonight and I was looking for advice and everything   #babywearing
0	omg!! that's horrible!  is she alright??
0	hah yeah, just smashed the bejesus out of my hand moving large rocks, as in, "caused visible bruise on the heel of hand" smashed 
1	Thank you. If you'd like to stop by the 'rack on Friday the 26th, you will find quite a party.  
0	Hope you're feeling better!!  Good news. I have a new hairstyle for us! Show you tomorrow at lunch I'll bring some yummy soup
0	WHAT!? When!? IA is about to get WAY less chirpy.
0	i thought i taught u how 2 reply! go 2 the bottom of the class
1	I love that you admit that cuz we are bitches!!
1	yea it was
0	so it's bad isnt it.
0	y u dnt love me no more???  {tear}
0	yea I'm still heree  unfortunately
1	its tru boi, the only time im on here is when im at wrk! nehu dude ill talk2 u lata i need to go home n eat! 
1	OMG. How funny. That is almost EXACTLY word 4 word what I said this morning. Now, I'm feeling good  & smiling A LOT BIGGER )))
0	the ordered me a new blackberry to arrive TUES! I may die between now and them without phone  I have withdraws already
1	Thanks daddy!! xoxo
1	thx! - glad you like my name
0	haa!  not long till holidays tho!
0	oh that was just a general statement, not really aimed at anyone! well not you...no offence hehe 
1	long time no update sweetheart
0	Hahaha. Next show I go to of theirs I'm sure they'll have a lot of fans now.
0	i was unsuccessful lookin for your website  send me the link pleeeeeaaaasssseee lol
1	hahaha really??? pics or it's not real!!!
1	that's awesome, thanks for voting!!! 
1	yes please! Call me once you get ash and i'll tell you how to get here  thank you best fran
1	hey biotch
1	Get 100 followers a day using www.tweeteradder.com Once you add everyone you are on the train or pay vip
0	yep, probably will be... wish you had let me know you were interested... had extra corporate chalet tix and let them go 
0	Did you end up going to Luckie last night, I heard 3 people got stabbed 
1	you definitely should keep it up..i am listening now
1	iliiiiii! i miss you!
0	That sucks to hear. I hate days like that
0	i know, i feel bad for the leak too..  i cant wait for the other songs and the real release !
0	Lol, congrats. I still have to find a way to get mine 
0	damn  I'm praying you all get better
0	Instinct for the lose
0	bb  you at college or work today?
1	I'll do one tomorrow evening, methinks 
1	lol white&nerdyy.
0	James! I'd love to be there but I'm going to a friend's hookah birthday party!  Maybe I'll stop by a little later if.
1	It's a compliment to have your following!  To your continued WiiFit success!
1	We're classmates!
1	I mean as a wrestler, not as a dad.  
1	Dallas & Boston
1	how about coming back to the uk again, for your fans that love you dearly and weren't able to see you again?  haha. loveyoux
1	I am obsess with it right now too!!!   soooo damn good
0	I AM SO SORRY. my friend stole my phone
0	I searched you but, I cannot find you..  I'm from Aus, so I don't have Aim. I just made one, so i could talk to you.
1	MYSELF AND ARE READY TO MAKE A MESS  WOOT WOOT.
1	You are so tiny and adorable in person! haha. Thank you for wearing my bracelet! It glows in the dark!
1	your future wife? That's easy, i'm right here 
1	YUSSS. That album totally pwns. Favorite track?
1	ok.. so maybe i didn't cook it.. lol
1	ill be there ol stompin grounds dont act hollyhood on me u kno i miss u too
1	careful when talking to hyper stephanie joe... she loves to ell with n reason
1	having fun in dallas? maybe ya'll can go to houston and say hi to my aunt
1	Hey how are you?  I really love youuu!!!! Hahahah lol x]
0	The thing is, when you're online, i'm sleeping..I live in Holland..  Do you have msn for fans, or something??
0	what happend between you and selena i was messaging her and she was so sad
0	Quite - I'm a "senior" next year   I am convinced I'm still 25. (My wife says she has two children a 10yr old and a 49yr old).
1	Get 100 followers a day using www.tweeteradder.com Once you add everyone you are on the train or pay vip
1	have a good time last night?
1	Hello there! Thank you for the recent add!
1	It's 6 am here in Northern Ontario, Canada. Cool outside. Birds twittering along with me 
0	its the Yorkshire/Humber region due in 10-15mins, saying BNP could have the 6th seat 
1	BBC News streaming coverage on laptop, Apprentice on TV. Job done 
0	driving is awful these days, wish i didnt have to so much too - practical alternatives are few and far between tho 
1	it would seem to be super-lucky: 7 and hearts? i am jealous.
0	meanwhile docs charge if *you* cancel your appt on short notice
1	Wow, thanks, you're right 
1	if you're good MAY share her box of wine with you
0	im so jealous i want a touch screen! *stomp, stomp* 
0	what? My camera  okay fine u can get away with it, just be nice!
0	I know! Chris has the verizon Storm and I'm really jealous.
0	Britney spears still is not following me and it makes me sad. 
0	that's makes me sad  I hope one day you're forced to watch it, love it, and thank me. That's how I picture it at least!
1	boring meeting, sounds like a good chance to catch up on sleep to me 
0	Its not on this week because of snooker
1	LMAO, I often wonder what Iv tweeted to spark off some of these spam followers, that's a good one.  
0	oh no, hope the weather sorts itself out and dries out the clothes, looks like the rain is on the way here too 
1	Awesome  u must be excited. What's a conservatory? haha, it has my name! hope ur enjoyin the sun x
1	got it!!! that was one of the first ones!
0	Nothing  Any ideas as to what I could do?
1	mizz you too kate  see you sooooooooon.................
1	Ah bit.ly... [shakes head}... Let's try that again
0	I always think that Glasto coverage is one  of the things BBC does very very well.I don't even need to go.
0	LOL! I want toooo but you know
1	How's the newly arrived furniture?
0	and you didn't get me one.  I'm done wit you.  I woulda paid for it.
1	For four people and six months, that's a great bill. I'd be very happy with a bill that low 
0	Hey dear, where have you been? 
1	hey we all missed you at BTUB last night Kate. You missed free spring rolls
0	I would have been at Creative Drinks if I wasn't a looser  I work with Craig - founder ;-)
0	missed you last night
1	Pleasure  Jealous, to a poit.
0	You're not following me anymore!!
1	i think u should get in a lil trouble then it would inspire u to rap about it
0	Sad to say but where I live a father ate his sons eyes and that just hit a sore spot.
0	 what's wrong jcook?
0	... i'm imsomniac every day  welcome to the club.
1	A slice a pizza, and some oreos.  Oh, and a coke. 
1	ahahaha! what can we say? fatasses band together.
0	aw, what's wrong? 
0	aww that sucks i hope you get them soon! hey what's up?? no orlando on tour?
0	awwh. Im gonn miss blackberry bold.
0	Awww.  G'night! <3333
0	awwww why?
0	bye blackberry!
1	chips and dip for me.  yumm
1	daaa da dooo, cant waittttt 
1	fyi it is cool to call an ipod a pod now.  hahaaha
1	Good! You deserrrrrve it
0	gosh, can you come to mass and take me to nyc with you? my heart calls that place everyday 
1	hahahaha , take a pic 
1	Have a safe trip.
0	Hey, are you guys going to be doing Bamboozle next year? It killed me that I couldn't be there for it this time 
1	http://twitpic.com/6e3s2 - bob
1	http://twitpic.com/6rx16 - you took my advice  i love that place haha i wish i could gooo
0	i bought one in germany but it broke
0	I can't fall asleep! Ahhh. It sucks.
1	i have food for snack time tonight! pop tarts
1	i still want your necklace  that made my day.
1	i was one of those people. haha. i had oreos  and milk!
0	I will MOST DEFINITELY support that! I hate when a twitter gets cut off
0	i'm sorry.
1	im up for a midnight snack (: im eating a green apple with peanut butter
1	is making me insanely jealous. someone must buy me tickets to see no doubt when they come to LA.
0	it's so nice that you reply people's tweets. caleb never do that
1	lets be best friends. k?
1	mmmm...I love bubba gump...haven't been to one in forever though. How are you? Love the music by the way
0	my dog died last year, and it hurt a lot.  prayers for youu!
0	My twitter hates you.  Your tweets don't show up on my...  Twitter thing.  Whatever you call that.
0	Nothing booked for France soon? i wanna see u
0	oh just so you know the link on your official website for the store..doesnt work  i wanted some ftsk swagggg. bummed!
0	ohhh I wish they had strawberry peanut m&m's in England  I want some! Nomnom
1	those are awesome photos btw
0	When you find it let me know, it's not on iTunes yet 
1	no reason just wanted to know  your exam timetable always sucks really badly ....
0	There is no food to be had
0	yep. that is the correct conclusion. we should pulish a study about it and then write a lit review - we both know how
0	i dont either its just all i have left in my kitchen
1	thx for the shout my new #partner in #design ...
1	tomorrow 5k 10:15 am. One more RBV and I win the race!!!
0	what sucks?
0	ME TOO. I need to just buy some new things today for TNNA because seriously, nothing fits and it's stressing me out. 
1	And a hug to Ice too of course although I've never seen her perform, I'm sure she's a v talented doggy! 
1	LOOVEE that commercial!
0	I'm 10 minutes from going to bed. Second shift job = SWEET! I'm sorry you're involuntarily up.   Caffeine or brain twirl?
1	Then I guess that's a good sign that they really need you.
1	Then they obviously need you.
1	hope you have a GREAT workout!  What are you doing?
0	that is pretty interesting, and sad 
1	 pshh. Of course you didnt:p hahaha
0	nope not me
1	I'd love a Mr Whippy right now. I've been 'working' and about to have a BBQ. Full food report later
0	my kidneys are going to fail and I'm going to die a lonely death cause you didn't visit and give me the meds
1	I can hope it didn't happen...it was AWFUL....maybe my mind is playing tricks on me
1	flickr-ing and facebook-ing  how's your cam?
1	i like the sound of that
1	It's life changing, in more ways then one. Once you go Mac... 
1	like the exclamation mark - my first PR agency taught me there is no room in business comms for ! or  or worse, x
1	girlllll I will  let's chill when I get back
0	 Yup. and my now my gums are sore
1	anything you want to do! Its Sat.
0	Ohhh you re sick ??? NOOOOO  haha i miss you !! so much !!!
0	nothing better than the feel of new pjs! Too bad on the sore throat
0	your nintendo stuf  trauma centre? i couldnt even be annoyed about staying back late at work cos i was devo for you <3
0	Why are you hurt?
1	girl, nothing but Carne asada , rice ,beans , beers & tequila!!! We GOOD!!! Gotta come thru nxt time!!! 
0	I think they will like Candice said if the tour ends well but even if they part  I hope they still do. I lub DDUB!!
0	bfif? Shawn? Not officially but I stay there lots.  I've brought it up a few times but he does not seem enthused by the idea
0	thanks lady. If Hell had an address, it would be Riverbend. There is no band on Earth that would entice me to step foot there 
0	Mine is four days after Christmas. I've heard of shows happening on my birthday but none around me...
0	That's a shame.  Next time have them block their number and call me on their phone. Haha. JK. That's stalkerish, kinda?
0	They don't start till May 14th.  Sorry bby.
1	ahaha! that's great!!!  When i was little i'd write stories and design clothes...for my barbies. LOL. They'd wear the clothes
1	its ok dunkalunks I love you and am totes here for u always  you don't try to hurt me <3333
1	So far it's just us humans and a couple of vocal learning species, like cockatoos. See Snowball in YouTube... 
1	Do you have a ladder? If so, rather do it yourself 
1	That sucks.  I know the feeling.
0	oh, take care cutie 
0	heartache? oh no!!! what happened?
0	i want you to sleep over, but my room's a mess 
1	 It has to be an interbatch Mixed Martial Arts competition
1	im using UberTwitter so your now alone
0	 i  want to go to VA beach
1	hahah aww  I don't think heels are the right type of shoe for you lol
1	Yeeesss  Omg really?! Awesome ;D oh and my new fav song is I'm Yours sooooooo beautiful!!!!!!!!!  the script is AMAZING!
0	your blog doesn't like me either   But I like it and am glad you're writing again.
1	Yup, I do. So does my mom. It'll likely be her nickname for life. 
0	haha, assignment boredom has clearly set in  not inspectors yet, Ryan's mum has been here..... again....
0	 ..... lolz i don't even use myspace and ya accepted me there..boo..k i'll add u deal?
1	Specially the angel in JONAS.
1	 Oh my bad... i was like way down on the replies I thought you just wrote that  LOL
1	Definitely cool re-meeting you last night as well, man! 
1	Didn't like that censorship, I take it  Also, WOKKA WOKKA WOKKA. Pac-Man rocks...
0	Unfortunately, they don't support RSS 
1	Let me know what you think about the Arduino
0	awwwww im so sorry for you.. D: thats not awesome sauce.
0	Its okay. It seems like I can nver write.  I'm still here, hanging with the cute kid. :p
1	My pleasure
0	Clicking on the button and adding a URL in Compatibility View Settings adds the TLD not just the subdomain
0	i knw how you feel  when ithought it was broken i couldnt use for 2 years it sucked ass :| xD
1	I need to be apart of this.
1	That's when you know it's a real storm up there, when the sat. goes out! Feel better. 
0	june 15, 1995, chino hills, CA. The 1 day it rained n june in SoCal...we had an outside grad; had 2 move it 2 the gym 
0	we didddd lmao ya'll need to be here isn't the same!!
1	thank you so much  it's definitely nice to hear since things are different....we all really dug the vibe&sound with the four of us
1	 well I dno!  but people laigh at me because it's heapssss girly or something aha
1	where is that? And oh my lanta!
0	yeah I called to let you know my journey turned out sad. I don't know if I'll have a chance again this trip
0	Bad. I think.
1	Happy 17th! I hope that you have an amazing day. Do you feel any different?!
1	i LOOOOOOOVE your duet with mitchel! sooo good! i've been a fan ever since american juniors
1	i used to love putting my socks under the couch cushion & my mom would get pissed. but how old is now? hahaha.
0	i'm home bbygrl! hanging out tomorrow before you leave me all summer???
1	 Good 2 hear u had afun Theater night ... it sure is fun to c a live performance
1	doesn't look gorgeous!
1	I'll definitely keep an eye out! Sounds like a great show!
0	nah, they spotted that i would be a potential hazard and put me in the back seat. 
1	 If it was girlfriend's doing that following-of-you with a recent skull fracture. So ... extra props. 
