0	better head off to work I guess.  Hope everyone has a good day.  Toodles! x
1	Better Health got exclusive interview with Vivek Kundra, "America's First CIO." Full blog post to follow.  #MOC
0	Better make a scarecrow. Those crows are destroying our garden. No more corn plants.
0	Better odds than the powerball, though I intend to try for that as well. #squarespace.  Sorry, Karen, I'm reducing your odds.  
1	Better pic! Southsea styleeee   http://yfrog.com/0bdbtj
0	better roll to work, even though its my day off 
0	better start heading off for programming exam..... fuuucccckkkkk not going to go well
1	BETTER THAN MYSPACE
1	better together, bb 
1	better together.
1	better? dang.  Soooooo, I think Andrea will want a ride to the transit center. I wanted to do everything myself today but maybe ... damnit
0	bettina confined in the hospital  hoping she feels better soon.
0	betty is here, why must she live to ruin my nights at work? 
1	Betty Page + Lords of Acid = http://smutandsparkle.tumblr.com/post/109419633
0	Betty Sue has gone blind
1	Betty White says she's 87...and A HALF! I love it! I was saying just a few weeks ago we should bring the 1/2 back.
1	bettys not a retard
1	Bettys w the besties!  got lots of new movies today
1	Between 1999 & 2001 two companies I worked with tried to get that contract and they said they'd never get a website   10 YEARS resistance
1	between 4 people last night we polished off 3.5 bottles of wine & 46 beers.  and the party continues thru today.  happy birthday, Husband 
1	between 4.9 and 6.9 , I'm really happy right now 
0	Between bad heartburn, the storm, and a 4 pound baby....sleep wasn't an option last night   I MISS THE SUN!!
1	Between Birthday Sex and Boyfriend #2 I'm getting the best workout ever listening to music. Don't believe me? Touch me
1	between gym and rain a wet start to the day. business as usual then communion service at 6 followed by madama butterfly
1	Between Tweetdeck and Facebook, feels like I am back to computer speed of the 90s.  
0	Disappointed with the crew at AngleTV
0	Disappointed with the EU Playstation Store update today  looks like I'll have to play some Killzone 2 instead. Single player today I think
0	Disappointed with the poached eggs this morning
0	Disappointed, ignored what ELSE!!! mejor  me acuesto Today was not a good day!!!! SAD 
0	disappointed, i'm not at all interested in the Trending Topics 
0	Disappointed. I guess no moi dix mois concert 4 me
0	Disappointed.. 2 eng flicks out and both have shit-laden reviews
0	Disappointing day. Attended a car boot sale to raise some funds for the sanctuary, made a total of 88p after the entry fee - sigh 
0	disappointing lack of def leppard on spotify
0	Disappointing tech day, downloaded RayV & then spent day in Apple store restoring my system, missed out on #140conf & #IMU w/@chrisbrogan 
0	Disappointing that few 4iP Ed Fest ideas use FB Connect to GATHER data. It's all about "we get users to do this and THEN feed TO FB".
0	disappointing to be in line prior to 11:00 bfast cutoff but still cant get bfast
0	Disappointment never hit so hard
1	disappointment was lifted, so that's okay  However, I am chronically tired, and carpet man is late.
0	Disaster - can't book badminton court for Thursday lunch time. Even the other venue is fully booked
0	Disaster ! I need to go to CA on business next week. Will cut right across the final build-up for the Dartmoor Classic evt. I'm riding
0	Disaster just struck, I just failed 2 assassinations and 4 tasks in a row in #spymaster  
0	Disaster! I left my Bible at my babysitting job last night.
0	Disaster! Oh how horrible. Knew I was onto a bad start. First biscuit of the day collapses into the cup during dunking
0	disaster! seminar in 6 hours and my laptop has crashed.  anybody out there to help me?  i have a beautiful PPoint and no computer.
0	Disaster, my iPhones home key now seemsto have a mind of it's own. 
0	Disaster. Hopefully last one of the night. Just get me there safe!
1	Disciple was awesome last night!  http://twitpic.com/7iu9x
1	Disclaimer: dun worry ppl. We r still much together. I juz want to noe how many frens I hv in fb  - http://tweet.sg #fb
1	Disclaimer: I would apologise about all the counselling related tweets, but I am doing assignment pile of doom and need a sound board 
0	Disco disco boi won't come back anymore  see ya nxt year or NEBER!! lol just kiddin'
0	disco nap so far has been a failure
1	Discovered sock monkeys... via amazing... I feel inspired! Screw revising 4exams - let's make sock monkeys!  x
0	Discovered a dessert place called Little Oven on FB. Want to go there NOW, but only open Wed-Sat nights.   U know where I'll be Wed nite!
1	Discovered a nice outfit and is now taking pictures in it
0	discovered Estonia is pretty geeky/connected. Hopefully connected enough: MyNetFone charge a crazy amount to VoIP, gonna have to use TPG 
0	Discovered my house was on Google Street View. Was garbage day and neighbor and I have piles of yard waste at curb.
1	BETwitter world in action! Seems there's a petition to get Day 26 on the BET Awards! You know I'm listening. Y'all got Soulja on already!
0	beware: an innocent looking coding update can drag you into the middle of the night.
0	bewteen you and i,  i still keep your pictures underneath my bed. such a good song. 
0	Beyonce - irreplaceable makes me cry
0	Beyonce concert 2nite! and im not going
0	Beyonce helps me through the day, I'm starting to get sick 
0	Beyonce is in MYC this weekend and I have no tickets     pulls some strings !!!
1	BEYONCE was amazin!!!! super talented n super hot
0	beyonce was greatt.... <3 i wish i could go again tonight
1	Beyonce was much better than Britney. She can sing, for starters! 
1	beyonce wow wow wow... she sang to me and touched my hand
0	Beyond bored
0	Beyond peeved right now. Missed a call from Brittne because I'm at work. She had 15 minutes to talk too!  Super bummed right now
1	Beyond RWA Nationals  October romance writing conferences http://bit.ly/KkIgE
0	beyond stressed.
1	beyond the blue in nagoya
1	Beyond the Da Vinci Code is a beautiful tome -- unauthorized, of course -- that deals with the novel and what inspired it.
1	Beyond The Secret Law of Attraction | A MILLION DIFFERENT THINGS  http://bit.ly/Ll8R6
1	Bf bought me taco shack for breakfast everyday this week (today too). Girls at work got me taco shack for my last day. aw  also, flowers
0	Bf dropped his camera in the stingray pool. He is very upset. I feel sad for him
1	bf fighting tonight!! can't wait!
1	BF knows me well. Made me a gin martini while I baked  banana bread turned out lovely.
1	bf making brunch, i get to tweet. life's good 
0	bf moves to the city tomorrow. Currently he lives down the st.  Sadness.  He will be far away  (not TOO far, but not down the street )
1	bf parents bought c lo pack of 234 diapers.  what more can a girl ask for?
0	bf says what I have written so far is not total crap.well,that's something,right?only that he doesn't know much about academic standards 
0	BFC! Gunners game at one tomoro. Yeah? missin him like cuuhraaazy...
0	bff had a baby boy yesterday!!! welcome baby "Cougar!" i wish we were so far apart
0	bff had a baby boy yesterday!!! welcome baby "Cougar!" i wish we weren't so far apart
0	bff had to go away so I suppose I'll talk to her again some other day.
0	Bff I need a web cam I wanna talk to the guys too
0	Bff just left  really wishing i could stay home...blowfish and I'm not even there yet! Ughh
1	BFFL BFFL BFFL YEAH YEAH! Lyrics to the best song ever, produced by Sam, Janu, George and Paul. 
1	Bfflbwash made my day better.
0	BFFrach&&BFFabby&&jane&&kristel..missin out on the best getaway
0	bfjejbgrtbgrbgkjhrtgk, having the worst friday night EVER 
0	BGT - everything to play for!  How sad though when Aidan Davis cried   Not the busiest night for gay dating sites!
0	BGT (and specifically stavros flatley) has saved me from the between-F1-race boredom, and now it's all over. 
0	Discovered that riding a road bike finds a completely new set of muscles to ache  from a mountain bike
0	Discovered the van had a dead battery after we loaded everyone up for our Father's Day adventures
1	Discovered this amaasing ! lonely book tapri on this noisy unpopular lane near churchgate and picked a handful of awesome books!  Happyme
1	Discovered Twitpic and knows how to use it now
0	Discovered we have no food in the house  x
1	Discovered: A teensy beach in Dubai where one can consume um.. beverages.
0	Discovering good music is harder than what people think. So many false starts
1	Discovering how to deepen meditation with the use of metronomes with Stuart Wilde's audiobook "The Art of Meditation" - amazing
1	discovering kindred spirits on and off line, here and there. 
1	Discovering my new BB Bold
1	discovering new words on urban dictionary  funfun
1	Discovering the world of Multimedia Communications! Yay
1	Discovering The Yeah Yeah Yeahs and The Ting Tings. Love love loving it
0	Discovery is hosting a great show called "Natures Most Amazing Events" one event that isn't amazing? NO CLOSED CAPTIONS for this ad
1	Discovery of the day: Aspirin (acetylsalicylic acid) doesn't only cure headaches, but also provides pain relief from a small burn 
0	discussing marks
1	Discussing music with someone and playing Broken Strings on guitar
1	Discussing stockings with via email. Kinda hoping noone reads them
0	Discussing*
0	Disecting baby pigs. They're too cute to cut up
1	Disguise Mask released
0	Disgusted and sick!!! Disgusted at Hughes Net still no modem! Sick with stomach flu or something was up all night last night
0	Disgusted that I won't be in Dublin for his gig after seeing 's setlist for Bochum.
0	disgusting out again
0	Disgusting, disgusting bitch - http://bit.ly/ZNZw7   She'll burn soon enough
0	Disgusting. CBS4 news says that cat serial killer was interviewed early in investigation, and he had scratches as from struggling cats. 
0	Dishes!!!  Why doesn't housework NEVER end!!!!!  I haven't smoked in 3 days and I'm having one of those w/drawl headaches
1	Dishwalla "Opaline"  not knowed in Portugal, I just listened to their music in The Charmed Ones series lol
0	dishwasher broken...guess i have to do the dishes by hand
1	dishwasher going, laundry in, hubs lunch made, little guy up and dressed, breakfast in process, then art class 
1	disigning my album cover
1	dislikes being left out but eh.. I should get used to it. Bedtime.
0	dislikes IDL for being so early in the morning.
0	dismayed that Tiananmen Square isn't a trend but Susan Boyle and E3 still are
0	Dismayed to switch on news and learn a 14yr old has stabbed a 15yr old just at the end of my road. Scared kids knifing scared kids
1	disney later
1	Disney movie marathon night.! Night two. Lilo and stich.nemo both toystorys. And monsters inc. i feel like a kid again!
1	BGT : I still say Diversity are better
0	BGT- arrgghhhh! I hate Susan Boyle :@ grrrrrr she'll win and I won't be happy  xxxxxxx
1	BGT didn't finish til 10pm, so I was able to catch the ending while dad taped the performances. CONGRATS DIVERSITY!! Wanted you to win!! 
1	BGT final. Only watching it cos my mum said she'd give me my Jack Daniels back
0	BGT made me cry tonight
0	bgt or miley cyrus? stil dont no if demis comin ireland or taylor! duno hu 2 chose
1	BGT Susan Boyle Diversity Julian Smith!! all outstanding tonight!! check this out http://tinyurl.com/qeze3d ... its free!!!
0	BGT the media still only cares about susan. Even tho she lost their still making it about her. Susan Boyle lost! not Diversity WON!
1	BGT tonight, should be good 
1	BGT TOURRR 18THH JUNEE  <3 2ND ROWWW  GEORGE SAMPSONN!! <3<3
0	BGT was just amazing tonight, and threee amazing acts got sent home 
1	BGT was pretty bad last night. Not the best auditions. There were some good though  HM:The Movie today at 1.30pm
1	BGT, shaun smith or Stavros Flatley to win! 
1	BGT......Stavros Flatley.......sheer brilliance! Love 'em!
1	bhaha , at viru's bus terminal , there was one old lady yelling at her small grandkid and it wasn't pleasant 
0	B'ham folks - if u need a passport photo don't use Quicksilver (Cornwall Ave). Too light/washed out.   I then went to Costco, way better!
1	bhua left... ofcource they need rest .. + cleaning the house  .. i had a grt tym talking to bhua and tuiya di.. now m bored
0	BhutWholeMagik: but not I have poop on my pee
0	bia lượng mình ngày càng jảm sút, uống chưa đc 1 lon mà đã ngất ngây rồi  chắc phải luyện mới đc
1	Bia's sleeping right beside me  so cute! hehe... off to bed; church in the morning! goodnight )
1	Bible Marathon in Flagstaff, it's early but I am glad I did it. 
0	Bible study cancelled   Study partner started new job with horrible hrs - Pls pray for her that hrs improve and she knows God's  provision
0	bible study over.  Now, time for laundry  Laundry is no fun.
0	Bicycle pump doesn't work, CRAP! Guess I'm walking the entire shift. 
1	bicycling against the wind wasn't that bad but I hated every second
1	Bidding all a good night, and a happy Sunday 
1	bidding on my booties!! idc how much they go up to cause josh said he'd pay half  aweh <33333333333333333
0	Big  today. Core router transit issue Telehouse, London which means that DailyDOOH is off the air atm. How will folks get their Sat fix?
0	Big $$$$$$$$$$ fell through!!!!!!!!!!!!!!
1	Big "flea bomb" event is postponed a day... but still leaving to work from a friend's house because she cooks for me and has broadband.
0	Big baby....really
0	Big Bad Bang it out BBQ at the Messing's tonight...summer is over for Steffy   http://twitpic.com/6c8m5
1	Big Bang Theory in half an hour.
1	Big Bang Theory is my new favourite show. I haven't laughed so much and so hard in a LONG time.
0	Big black guys on harley davidson motorcycles scare me
0	Big boys don't take things from their mommies.
1	Big Brother 09 !  BB10, cant wait.. tonight xD
0	Big brother is leaving tommorow for good!
0	Big brother is so shit this year
0	Big brother is staring soon. I don't want to watch, because I'll find someone to hate and then I wont be able to stop until they're gone 
1	Big brother looks kinda boring this year! I want a lot of fights to happen lol, is that bad? 
0	Big brother talking to you: Now we have audio advertisement in the Mexico-City subway
0	big brother!! haha. i told myself i wouldn't watch it but i know i'll end up addicted xD there's no hot ones in there tho
1	big brothers coming up for dinner...yay
0	big brothers sucks this year  not impressed at all!
1	big cleaning
1	Big congrats to Al Brownlee winning out in Spain! Nailed some big names on the run
1	big congrats to Antonio to reach the quarters!!! keep going buddy!!!
1	'Big cook little cook' I love this programme.
0	Big cup of coffee then back into garden. Lots to do, and it's raining 
1	Big cup of coffee... and girlmore girls with my roomie... whoo to days off FINALLY
0	Big dancehall concert in NY this weekend  wish I could go
0	big day 2day the xt launch was amazing! so much free stuff thanx 2 the edge and telecom! found the phone i want...cnt afford it yet tho
1	Big day ahead of us! Vocal coaching at 11 ! Then after that, is takin me to get pretty for my photoshoot! 
1	Big day ahead, totally zombied by noisy neighbours... But meeting up with an old friend from St. Martins tonight 
0	Big day for Yanks and Mets, today. Too bad about the Nuggets: was hoping for a Game 7... 
0	Big day out today - Amber's party  - cinema then pizza express yum!!!
1	Big day today  hope no one ruins it!
1	Big day today! Im excited!
1	big day tomorrow, gotta crash goodnight 
1	Big day tomorrow. Hope I don't make a fool of myself. It's been two years. Good luck to me.
1	Big day tomorrow... Starting my bedroom makeover yay! Being an interior designer is funnn
1	big day with my love!!  then a wedding tonight
1	Big day! Grad dinner dance banquet! Time to get prettied up.
0	Big day. Tec exam today then end on parents evening - better stuck in school than out in Rain
0	BIG DILEMMA!!!! got 3 jobs now! the schedules are CRAZZYYYY!!!! any help?!?!?!?!
1	big drivers ed test tomorrow, hopefully will pass, still not agreeing with fathers plan on things, and most def feeling like a cougar 
0	Big exam today. Bleh.
1	big festival wave to now following our every Tweet, hold on tight Science is in town 
1	big Festival wave to now following our little tweets here on flickr, hold on tight Science is in town 
0	big french exam tomorow  3 hrs :S
1	Big giant book I found lying around the house, doesn't it look like it contains cool secret stuff?  http://bit.ly/s8HQb
0	big girl jobs stink...even if they are just for the summer
1	Big girls don't cry,they just say whats bothering them and move on 
1	disney nite it is! Hercules again
1	Disney Pixar's #up is so cute! Go watch it
1	Disney pixar's UP.  midnight showing.  http://twitpic.com/664p3
1	Disney radio heads what are some songs that lil kids love I'm spinnin elementary school and need some help
1	Disney was right about some things
0	DisneyChannel Mode! Watching Stuff on Disney! Too bad J.O.N.A.S isn't aired in Ireland
1	Disneyland  with laura-anne d
0	DISNEYLAND DISNEYLAND. I am having a love affair with my annual pass. Except not my picture. I look like a hot mess
1	Disneyland is sooo fun., were eatin dindin(: FISH&CHIPS 
0	Disneyland today with the cousins!! Missing
1	DISNEYLAND TODAY!!!
1	Disneyland tomorrow  goodnight babes
1	Disneyland was amazing, but I can't stand the sun. I'm so fucking red. :\ But, the bus ride home was pretty funnnnn, 
1	Disneyland was awesome today!  But I'm exhausted!  Doing it all again tomorrow!
0	Disneyland was fun! On the bus back to school!
0	Disneyland yesterday...so fun..but now im tired
0	Disneyland! Actually....ca adventures right now.. Im so hungry though
0	Disneyland, I love you. Too bad my body doesn't... Going home 
0	disneyland??!! yes?! no.  oh yeah and uhh chris pine is my husband # 3
1	Disney-Pixar producers made Venezuela a great tribute.. magnificent work! loved it! so proud!  GB!
1	Disney's "The Princess and The Frog"  makes me happy! bringin back that oldschool Disney! and introducing the first Black Disney Princess!
1	Disnleyland ISN'T tha happiest place in tha world! Grad trip can suck my cock, well maybe not magic mountain & its a small world ride 
0	disputing service orbitz charge for tkt that nvr went thru. 2 emails 15min on phone. v nervous abt amt of info they need to reverse $13.
0	DISREGARD THAT LAST POST OF STATING THAT 3.0 IS AVAIL. That is the 3G S Version.
1	Disregard the last post. Much love, ya'll. 
0	disregard those last updates, my account was hacked into 
0	dissapointed
1	dissapointed in new Enemey CD but can't wait to dance on their old tracks this Monday
0	dissapointed. not gettin a job after all
0	dissapointed...fuck life
0	dissappointed i cant go 2 sydney's....  tear
0	disslikes a certain somebody who is stealing my friend (via my bad
0	distance really is a trouble. i hate it! you dont know how bad i miss you. God please  #fb
0	dist-upgrade of UML debian etch to lenny fails. Something goes wrong when dpkg is trying to upgrade libc6. Seems to be UML related..
0	Disturbing to see babies at this incredibly loud event. Will their hearing be damaged? Things will have to get even louder to compensate.
0	DISv.4 is down  What will I do with myself? Hang out with Mom apparently.
0	dit not buy the dog...
0	Dita Von Teese was amazing on Eurovision! I know this all kinda late but I forgot my password! lol what a dumbass!  xoxo
0	Dita was the best!!! And our pants were really disgusting!!!  #eurovision
0	Crappy weather outside. And I was gonna go out today. Typical.
0	crappy weather, it's raining like crazy! - wish i didn't have to go outside... 
0	Craptacular weather..what a poor excuse for a Friday
0	Craptacular... Got straight B's for the first time ever
1	crasen has quite a temper. but i absolutely adore my bubba!
0	Crash has shut sh1, have to go back way via mangawhai 
0	CRASH! Not ready for 10KM run
0	Crash. Half the field landed on top of me. Need new front wheel
0	Crashed and burned uk latte art  great day tho! Nu-track synthiamusic.com" gravity drive" and demo of "suppertime"
0	Crashed my bike this afternoon. My shoulder hurts
1	crashin....so I can edit and do inventory tomorrow...oh yea and watch 4-5 yr olds play football!
1	Crashing 4 the night, GN all. Dream away!   
1	Crashing after an awesome day and night w/ the best family and friends!!
1	crashing at Briar's cribwith Georgia
1	Crashing for the nite, more WYD tomorrow 
0	crashing from my WI high...missing mayfield
0	crashing in the basement tonight. No finals tomorrow which means no school. I have to go back on Thursday and Friday though
1	Crashing out! Goodnight tweeps
0	Crashing, finally. 420 ftw! But on a serious note my thoughts are all with the people from columbine high  can't believe its been 10 yrs.
0	crashing.  night everyone!
1	Crass I know, but don't feel shy about voting for 2020science in the 3QD science blog contest:  http://bit.ly/sVYdn 
1	Cravin for some french fries ughhh ... Feet R killin me but pain is pleasure  enjoyd myself in the 401 they showd madd love!  eat time!!
0	Craving ,  no DEMANDING a starbucks lol..y do they not have any near my house  or at all anymore 
0	Craving a Clover ,  when are they coming to Canada? 
0	Craving a steak... and of course, we don't have any... 
0	craving a toasted plain bagel with cream cheese, tomatoes, and lox from the jewish deli on the upper west side. i miss new york. 
0	Craving Applebee's Shrimp and Parmesan Sirloin, but remembering that Florida is only two months away 
0	craving baskin robbins
0	Craving brownies
0	craving chocolate
1	craving doublemint gum & mentos
0	craving dr pepper  where can i get one?
0	craving ekta indian but puts me into a slumber
0	Craving for airsoft guns
0	Craving for Angus beef.
1	Craving for chocolate  and maybe some Taylor lautner :p
0	craving for chocolates
1	craving for ice cream right now
1	craving for mac and cheese
1	Craving for more ONE TREE HILL! I miss it so much! && Burning a cd for tomorrow's music class
1	craving for porterhouse steak.  double size!
0	Craving for radish kimchi  Wish I lived in Korea so I can eat Korean food every day!
0	Craving for tauco. I miss your cooking mak saleh
0	Craving ice cream
0	craving iced tea.. but all we have is orange juice
0	Big girls don't cry... until they reach the safety of their office
0	Big grey clouds are gathering outside  what a shame. I actually saw the sun for a moment today and my washing dried on the line!
