1	ooh thats good! im gonna get it later on  xx
1	Shoulders shoulders shoulders shoulders! Ahh cool  Hiii
0	Where are you? I need someone to tweet with.
0	Have to work sat night....
0	 I wish i had someeee
1	Thanks Ali - thought you might like that one
1	thank you thank you thank you!
0	Doing good...excited to go to Cali! Missing all my friends from Iowa...  I am gonna try to get back there for my bday...
0	awww, my poor little baby 
1	Good luck, sweetheart! I'm sure you can do it and do it well at that 
0	ah I always had trouble with people living below. Klipsch makes some kick ass subwoofers! Had to leave them behind
0	doing a crossword is like a game with all winners ... all done except for 24 Down    (http://is.gd/16F9Q)
1	Wow.  Thanks. I came across your live journal too.
0	Yep  First of all you only get it in a can here and not from the tap and they dont even carry that!
1	I dont like your blog.  I LOVE your blog
0	I tried to sign up last night, but Ning wont let me 
0	awwww that sucks...
0	not enough  I need more! MORRREEEEEE!
1	and what does ok really mean
1	hi, I'm good, how about you, had a nice day up in chester, seeing my son and daughter 
0	yeah it's rained here all day on and off
1	Of course i'm coming! I got a suprise for you
1	That's good.  I saw the blog & looks like you have a cute one.     How is the weekend?
1	hello, wow! lots of interesting #ASEAN tweeps ;) Twitter #ASEAN group? 
1	Naw, let's just pay 'em $1 Million to stay home, that way we can use the other $1 Million to deport all the illegals. 
0	 i tried responding to you but you signed off too fast.. but i'm going to lay down and i love you/i'm sorry
0	giiiiirl, go ahead and get started with yo' bad self! Hahaha. I'm sorry that it happened though. That totally sucks. 
1	oh my goodness that sounds devine
1	Super congrats on a great run!  You deserve that ice-cream and definitely earned it!
1	I'm hoping for a repeat at best by Boston - if not ABL (anyone but Lakers)
0	YES!! I call a repeat!! I miss
1	LOL cant show her my secrets
0	you know better. i love you beyond all that. your always gonna be boyfriend #1 lol i made corn bread today and missed u
1	yeah no relation to chris although I get that all the time  I should start claiming him as blood.There is a sex dr with my n ...
1	FO SHOW LOL MONEY MAKES THE WORLD GO ROUND
0	you still on? If you were here,,, i really need a hugg 
1	maybe it could be dealing with music
1	thank you very much
0	They are so annoying! I keep getting more followers and im like 'oooh!' but they always turn out to be those Briney bots
1	now now, idk who you two are talkin about BUT be niiiice! love ya'll 
1	I didnt see u! Jukin in the parking lot and ish. Somebody had fun lol
0	I ended up not going out at all  but my back feels better for some reason
0	waa. maybe you've eaten ur lunch by then. i don't know where i'll eat lunch and who'll eat with me. I'M SO ALONE.
1	I'm indoors and still freezing.
1	bbc volume works fine for me. Seen this family guy last sunday, but its still funny 
0	LOL yea both wisdoms on the right side coming in at once, feels like they are pushing the others one out of place, the pressure 
0	totally agree, FF was my savior from IE for so long.. now it's just as trippy.    Wishing for old school netscape.
1	Touche! That's a fantasically made point, right there.  Superfragilisticespialidocious, even. 
1	Yeh ... it's a good stream
1	Good morning to you too! Or good night depending where you are and how late/early it is
0	Did you eat chicken sticks? Don't make me sad
0	I read that sooooo wrong
0	LOL! I've never heard of that word before. Shows how immigranty i am.  SO SOOO WHERE'D YOU MEET HER!? WHATS HER NAME!?!?
1	yes  I finally had the money, so I sprung for the biggest bottle
1	I'm on my back to Cali  gotta take the bus to the airport.
1	Oh, oh yes, good man. Despite the laughter at #SOTR09 yesterday, that playlist is a timeless classic 
0	toys r us? Only place i can think. Or *maybe* that camping/outdoors place opposite grainger market. No alt sports shops in Ncl
1	Cool, yes might be worth looking in to. But there's a lot of good tattoo books out there 
1	 present and accounted for!
1	heyyyyy boo
0	hmmm anyone in the world? I'd have to say my husband. I rarely get to see him.
0	I know  its stupid swollen.. I'm abt to go do that... lol
0	Man this Strep Throat got the best of me.. Sucks Cause I'm out of town too !! Had mad Plans Today.Wish i could bbq
0	nooo babe i WAS watchin family guy until it went off at 2:30
1	oh yes I have done like 2 other songs...  and more songs to come!
0	shitty  still hurts like a bitch
0	yeah but u won't be here before I'm off to Alaska  lol damnnn
1	yes the Melo man will be there too  i lovee my team so i always stick by them ya kno but im great how bout you??
1	haha yep thanks will remember that
1	can't txt back but ditto biff  need txt/email regarding ipod asap, going out in 30 mins. xxx
1	??? ? ?????? ?? ???? ???.  ??? ? ???? ???? ???? ????????? ???? ?????????!
1	и мне пришло
0	ooh 12hr shifts
1	Fui fan de ese tweet. Te amé
1	Have a great Sunday!
1	i'm off to mohawk tonight, will probably be drunk  hopefully the crowd will SHUT UP in the speeches this year!
1	Awesome!! I've been waiting for something new from her for so long!
1	Thanks for the heads-up. You're an hour ahead of me here.
0	stop talking about the new iPhone!
0	I find that the IRL RPG seems to lack cool looking glowing weapons too
1	I wanna see a bitch fight!
0	I want to come
0	you're going home? btw we nvr went apt hunting
0	I'm gonna be Tehran still tomorrow
0	Sorry to hear that. Best wishes
1	well whatever fills ur meter dude  lol
1	you're supposed to clean them?! I was hoping all the grass in mine would start to regrow so i could have a turfed boot
1	so i can drunk twitter/facebook/myspace away and entertain you  lol
0	sorry didnt get to post drunk twitter updates! I dont have net on my phone  well i do..but not the credit to allow it!
1	It's all good  The next 6 months are going to be awesome.
0	me senti vieja eso si
0	...i know. . . the worst part is he wasn't alone. I just had my back turned for one second.
1	twenty-sixer'd
1	Le bon nombre
1	I got a sigma 10-20mm lens.. I hope it's fun
1	nup, final destination 2 is far better than the others. 
1	what up mister what u up to?
1	thanks for the love ! I'm following you! Now follow me
1	maybe I can have one room with 3 walking closet and they are connected  with a studio ;)
1	Ramada Renaissance Hotel opposite Harvey Nicholls (Deansgate/Blackfriars Street) should be up there.
1	Budget from now! Hope she's done well...make sure you let me know
1	Have been inspired to make a start. A couple of things to be done by the end of the year
1	Very good,thanks! How's the band? And dream job prospects? 
0	it sucks.. mad slow  i need a new job
0	http://twitpic.com/6gpvh - yes this is a cute pic..poor girl  haha
1	No thanks  They do have good products though, used to get some evry now & then frm friend.
0	i made my page on heree,,it sucks thoo 
1	its called beauty, I thought you'd be used to it by now? 
0	wt feelin? I can't grrl my face
1	love yall ...my 2 homiessss
0	You're so lucky! I used to have access to wild yabbies (shrimp?), but never fish or game (roos were protected). Now nuffin' 
1	will keep her in my prayers for sure. Hope she'll be ok.
0	very much so. Gonna have to stay indoors today
0	yeah load of crap. Never finished it
1	heres your hockey nightsift , briefly checking in for #nightshift 
1	My parents n bro are here. The rest of my fam is in Union City. If I didn't hav a bebe I'd make u take me out to a cool SF bar
1	You took that Iranian election in full force!
0	am in same dilemma job, mba or sth. on my own....nd am confused like hell 
0	I'd refrain from expressing my thoughts. Sometimes I'm a bit too controversial for my own good
1	I just ordered a red and brown variety.  I'll update as soon as they sprout
1	thanks so much!!  i was really excited by this one.
0	 My back hurts a lot too, but that was because I was hit by a bus... What's up with your back? 
0	no fuck that don't like lesbians
0	No mmm at breaking your laptop
1	That pretty much answers my question! Astras are great drifting cars since they're FWD.  3 doors or 5 doors is yours?
1	lol im quite happy with my men thanks very much  russell brand is much better looking, for example. I WENT THEREEEE
0	I will just dream about coming over
0	I cannot believe it has been cancelled, no more Jason/Danny 
0	Anytime! I haven't done a frenzy for over a week, 2 time consuming no sales, too many jewelry people now 
0	Back to work now...making up for the many kid breaks throughout the day
1	haha yes I am watching it now
1	3g yes. That's all that's available at the moment. Rumour has it there may be another one announced at Apple's WWDC next week.
0	im good ty got to go to work 2day  and someone has stole the sun!!
0	Just been told by it's not gonna last
1	thank you, be gentle 
0	Doing good mami. Well, not too good cuz I am at work   Sucks to work on Weekends!!!
0	I never got any of the dolls either  I don't know where my books are. Maybe we sold em...
0	It's sad how we always have to join the party after everyone has seen something.
1	waah get well soon yah lexx  emang uas mpe kpann?
1	love life is a career in itself. hahaha
1	follow me chris!!
1	... and they say men can't multitask!! Pretty sure netbooks don't like water but sure there's an accessory to help u out....
0	forgot to check on Keith
1	switch it off and switch it back on again. If no better send them to the Dell site from your affiliate link
1	a couple of years  I knew you had one but I couldn't find you for awhile..here you are!
1	chippendale! Suits me rather well  and i don't spend what feels like half my life on the Bus anymore! Yourself?
0	don't geeks love stephen fry too?
0	ang cute kaya! kaso kawawa yung shrimp!
0	either Up or The Hangover... probably The Hangover though LOL... Jewelz isn't up yet
0	oh purplebear!  I hope you are feeling much, much better   *hugs!!*
1	tnx purple... you are as well very cute. and lovely too.
0	i dislike black backgrounds  makes so much difficult to read
1	thanks a ton!!
1	would like to know more about that guy making a fool of himself  what was your result?
0	No, I don't  And nobody will be at his workplace at this time of a Friday night. He is shit at feeling the phone vibrate tho.
1	 I saw. WANTTTTT!
1	hahaha funn. you should come to the parkkk  btw will you slap your brother in theeee face for me when you see him next? ...
1	- okey! good luck on that too!
1	- We sure will! wiihiii!!
0	- yeah, but, ..  it means that I'm not going to the stable tomorrow. I'll have to go on monday.
1	- yeah..  internet sometimes is good, but sometimes a bit annoying, lol
0	I don't know whether to make a pr0nz joke or a Mario joke.
1	new piercing hey? may i ask where? tragus? belly?
1	okay  yeah i still dont know how to use mine rofl >.<
1	so what's this assessment...ducks...
0	What a shithead.
0	 I understand.  Sometimes people have to do what they have to do.  Stay strong!!!
0	 no one will make one with me though
1	good idea. Ill look into it.
1	http://twitpic.com/6adph - Pleeeeeeeease please please please give me morrisey  mean keeping all the good things in the w ...
0	i bet i cant watch it  have work anyway sooo early oh shit wait i dont know if i start at 9 or half past
0	u lost loads already... awe  a baby tiger cub just died... his mom accidentally rolled on it in the night and it died
0	I know.   I think natan and I are going to go get food, wanna come?
0	Oh poo. Not good being poorly
1	I see, thanks for enlightening me  should help me with future design changes!
0	I'm jealous!  I wish its raining here too.  Its so hot and humid here.
0	still waiting to taste!
1	pharmaceutical sales so I'm really that Prtty Pusha
0	But you get to read about his country enough to get a taste in the Dawn Treader...
1	I don't bother asking myself that. I'll just love them always and forever, lol 
1	thanks for the follow bro!
1	philly phil WHATSUP?! hows my brother from another doin lol...FOLLOW FRIDAYS if u dont follow him ill unfollow YOU
1	get up lazy bones
1	yeap! Which salon are you visiting?  have fun!
1	grinding man...styling is going great..truly Blessed
1	ii L0Ve y0U 2 THe HiiGhesT P0wEr...
1	hey baby am i crazy or was u giving me the eye, u said maybe well u crazy 
1	c'mon Reggie.  You can beat that bully of a skunk.  He needs encouragement Robert.  You should go hug Reggie right now.
1	No, I'm waiting for it to come to DVD. (I'm frugal.)  You saw it?
1	I'm doing ok. Just sitting at home watching things on YouTube.
1	Amen!! I love your religious tweets!!
0	Hell No!! Don't Release No Sex Tape It'll Be Bad 4 Ur Image
0	I CNT Remember Wat Da whole DReaM WaZ BT Tha EnD oF iT u were CRyiN
1	I kno u have faith hun but I got faith in my magic so hmmmm lol  I remember meetin u texas southern university awhile back
0	im so mad i couldnt see u  mtl rocks, just like u !
1	LOVE! love/hate sex....your voice is sooooo sexy
0	man cant yall n gucci get out here to AZ
1	mexican food is awsome
0	ugh someone LEFT me hanging
1	YAY! Glad your here
1	yeah, i can see u learned some french lol, i'm from PAris, so if u want a class, hit me up!! lol 
0	i just joined I like that website. Couldnt find you to add you as a friend
0	I know! I was totally off my game. I think it's because I tried to do beer and vodka as opposed to my normal tequila
0	 I drove past your house today!  I didn't see you  - guess I'm not much of a stalker.
0	It was sad.  But the ending was nice. I love how the pictures were placed.
0	i got so sunburnt today, i cant lie down in my bed  im stuck sat up lol xx
1	S runs a club where you can buy that months specially designed fibre. Good job she does not do a yarn one
0	ticker went ballistic
0	 *sends you painkillers of the non-tablet kind*
0	ugh I can hear your frustration, I'm sorry you're going thru this 
1	You are not elderly. You are an elite athlete. There. You're welcome. (via Another reason I love Laura Smith!
0	i know, its a crime 
1	go to town, bb 
0	I'm dreading that  don't want to leeeeeave
0	normally i would be happy to see your tweets this morning, but since i found this isnt really you, not so much. 
1	u definitely should star in twilight! Hehehehehehe.. Keeps it interestinggg
1	yes you can!  You already are!
1	You're an AMAZING role model! You aren't afraid to be who you are...we need more fearless & fabulous people like you!
1	everywhere!!! but I'll be spending most of my time at the Hague.
1	good 2 have u on board wooley head!!
0	THANKS SO MUCH, I was sad they took it down. 
0	yeah  it reminds me of how grateful we should be of our lives and be thankful such tragedies have not happened to our loved ones
0	nope none at all i didnt feel like going to the parties tonight   and i have nobody to talk to right now
0	o ok man im bored i want to talk to someone
0	aww my boo is sleepin too instead of helpin me with this biz class he told me to take  ooh powdered toast man!!
1	hey good mornin bro....now that one is my favorite pic...lol morning wishes for a wonderful day
0	 thanks yo....i'll try lol  i'm so confused, so i'm not getting cake  lol
1	be there with bells on  just let me know when
1	oh man, wish you guys were here. I have an extra ticket! 
1	wait I am getting confused again between my life and an Enid Blyton story. but parks are good nonetheless
0	no  we're in huntington for jess' bros grad party tonight...have fun though!
1	Good evening to you, welcome to my brain. 
0	hey there. Drivin north. I guess we will miss u tonite?   http://myloc.me/2NIn
0	not a thing now...itz raining like crazy
0	shit suck! i need it to dry up man...i was suppose to start partying for my birthday month this weekend
0	wish i was watching it right now  cant even watch the repeat cos the tv is being hogged D:
0	My mom sent in the form and crap. But she works so....no ride
1	you can do it  podcasting can be your new addiction (hopefully... hint hint ;p)
0	it's based on a true story, anyway. so i guess if you were to wiki it you would have found that out yourself 
1	BTW... I'm reading... Please try to tweet quietly... Thank you!
1	Hahaha! ....So true! I'm glad it's not lupus or piggy pox...I hope you feel better...
0	only works on 10.5 tho  I need an upgrade
1	LOL Big Black in coach! OMG they are gonna regret.
0	Awww me too! I'm on the roof instead! And no vodka for me...
0	i am never revealing what i saw  . will come out in therapy years from now.
1	I'm trying to not have coffee in the weekend... but I can't two cups today
0	so its tr wat they say...ur gone
1	Sure thing Mr. B!  Pack your bags!    Re: T/ Office - baby storyline = sci fi's time travel. Both t/ kiss of death for shows.
1	really not bothered, drove well considering brain condition. Am now at windermere. 
1	lol yes and in middle of moving house too, all go go go  u ok? x
0	- she got into a scooter accident on Friday, she hung on for 2 more days and died on Sunday 
0	 I wish I was there right now  for  the  storm and rain
1	Haha, he is absolutely adorable 
0	enaknyaaaa
1	and illegal  haha
0	  this season will be very very strange...
0	Im actually depresssed that yasmina won the apprentice! Kate so should of won
0	Ohhhh what? Whyyyyy? Confuseedddd
0	I hear you. I can't think of a layout either.  lol I've been trying for i dont know how long.
0	I feel you  I don't want to move.
1	It would be great if we went on a date
1	Where are you?!!?
1	I SO wanna see that movie!!!
1	cuz the address on my license is my old house, not my gmas And Im actually lucky cuz i got reallyyy good hookups at the DMV 
0	ya, I've been chillin at home a lot too... finally started feeling better today... almost went to emergency room yesterday 
1	Haha, awesome.  I'd much rather have a happy ass rubbed on me than some of the alternatives.  
0	hahaha seriously!!!! I've been okay though. exhausted most of the time  plus the weather isnt helping. today's hot. tmrw
0	my treadmil doesnt work  it goes about 2 kms per hour & stops .. i have to buy a new 1 wen i have money.. which is never
1	Remember to put your phone on silent! lol  Night loveees
0	I've got a little burning hatred for you...I'm not getting mine til 3 and I won't get to play w/it til after 11
1	They have pool tables, shuffle board & a bar. It's pretty big & open. Perfect for a chill Sat. night with friends. 
0	u dont call or text or cone see me or nothing
1	I thought you were going to say waiting outside a pub for it to open hehe - enjoy - sounds lovely
1	haha yeah it is much Easyer on the iPhone  haha good old IT people eh.. Well u seem to be using it fine now jus keep goin
1	just imagine every man you meet today is Enrique - should make the day more interesting
1	are you back from a vacation?
1	just kidddingg  wish i was thereeee
0	...freezing is no fun  http://myloc.me/2khb
1	I think would like a good smack
0	ouch, how did that happen?  That does indeed suck.
0	nah.  i'll wait.
1	Fave song? Simple Plan - Welcome to my life
0	I'll look for it but I really doubt it  He was really emotional, said he was so close to the title & that DelPo was sad.
1	Two cinnamon coffees w/ hot milk for my two friends!
1	Good Luck!
0	but its too hard and too fast for me  i cant think of good ideas quick enough.
0	make me feel like an idiot why dont you? Nah jks. People dont even have to tru these days to make me feel dumb  oh well
1	sweet I shall go dl it right now! gotta love installous.
1	yeah? awesome  I've been working on a few but nothings finished.
0	you got your lion hoodie!! mines still a week or so away  what number is yours?
0	oh no.. If they lose imma be very saddened  but I'm sure u will be happy!
0	Yeah, that's the problem - it's also a Friday night.  Our best chance is somewhere that sucks.
1	Get 100 followers a day using www.tweeteradder.com Once you add everyone you are on the train or pay vip
0	Weekend LOL. I did 16 days, have a day off tomorrow, then back to it on Saturday. 
1	Yeah I know! I'm from Bedfordshire so I def count Leeds as the North
0	damn u I love tom!!! But your BF is working
0	your bf was not thrilled that they wouldnt let him in to see you
0	Excuse me LoL I wish sum1 culd make me sum food right now i wanna get bck in my bed
0	How come I can't hear you on the internet or the web cam? Is it just me
1	morning bbs! i knew u guys would still have a job...b/c yall r that gr8 of a morning show
0	saw the ntt video, im hurt you thought the morning show got a bad draw  i think i  was fair enough since i was rusty*
1	Then walk ya to the kitchen and cook somethin!...lol nah j/k...what u want bae?
1	yay!!!! Well done! You're gonna be a superstar director in no time
0	I was then Justin woke me up crying he was hungry..again! Now I have to stay up for him
1	i have a mac book pro  you can buy it from me and i'll get a new one lol
0	make sure to tweet on how awesome it is!! Havent seen it yet
1	best part of the vid-  "the gayest man on earth would call this over the top"   Thanks for making my night!
0	Mishing you
1	 def lookin forward to it ;)
0	sorry it is absolutely refusing to DM you even though we are following each other
1	i <3 the quality! 1280x760 h264 + Eclipse
1	haha lol okay thanks
1	Super, hope you'll like it! 
0	 They planned to just slap him on the hands, but you know...he has those good hands and all! 
1	yay! I got a new toy! Her name is Epiphane.
1	I hope you have a beer to keep you cool too
1	getting some work done
0	Stop braggin! This is y we can't get along
1	 congratulations for your mom for tomorrow ! buenas noches
0	We're painting again today ... I've got silver sage spots!  Mom may go in hospital soon so she hurrying to get stuff done
1	you have to wait like everyone else.
1	alright bb i'll do that now
0	i only saw a feel heels there & couldn't find any rings. SOO angry. maybe i'll just get online
0	I wouldn't doubt it lol. That is why one of us needs to go visit the other.  right now.
1	like the silver shirt!
1	okaaay good
1	that's why you're so dazzling
0	Awww  I'm sorry
1	can I have sign so I can hang it up in my room ??  Lol. I would have to ask if its ok though.
1	hahaha afterparty at my house
0	i don't know  & she probably does, meaning that my dad & i probably have it & i might have given it to people at school -_-
1	hey thanks for following me
0	Yeah I guess. Just stressed out to the max! The babies haven't been sleeping.  How are you guys?
1	You don't need luck, it's easy.    Hope you enjoy it.  I'll email you my cell # in case you get stuck! LOL
1	ur romeo is perfectly capable of taking care of himself  he's a good uncle... taking care of us kids haha
0	welcome to my world huni! I'm nearly 21! Gota be a grown up  yuk!
1	eeeee  what r u up to tonight then?
1	your tweet was just included in The Longest Poem in the World www.longestpoemintheworld.com/tweet/14278/
0	XD....I died laugh when I saw that...so sad that the guy is serious
1	Get well soon
0	You're the second person who said that. Sadly Neal declines this reason
0	can you talk on the phone right now?
1	We saw that in none 3D - the baddie's the best
1	Have a good day!!
1	ZAC BROWN BAND TONIGHT!!
1	no wayyy ur baby won't be ugly at all ! so i guess we can't really trust the result rite ? hahaha
0	nooooo dont qo  are u takinqq da husbay
1	hope you get a job soon. Where you planning on working here or abroad? Somewhere nice and hot will be cool
0	"and it remains unreleased in the rest of the world."
1	over 4 years and counting of awesomeness
1	great!, now we can still talking 
1	Thanks for telling people about the http://tweetva.com directory! Hope you're enjoying your day
1	because you wont  be smiling when a cop pulls you over
0	I was like awwwhhh...
0	They both betta try me!!!!! The One time we r home...
1	Thanks! I'm done, yay!  Nice pic 
1	 good luck chica!
1	 :in sing-songy voice: You're the cookie monster of the dark side...!
1	Aw, thanks for the Follow Friday...and the kind words! 
0	guitar? I do! So badly! Cause i write songs but i don't know how to play..
1	ha! the one i just sent to you was actually meant for - sorry guys! got my lines crossed
1	i know! Gah!
1	I watch it every chance I get.  Bill Giest is the best, but I listen to Charles Osgoods Podcasts daily as well! 
1	thanks! Yea, I'm quite happy about it. Hoping Hubby enjoys it too 
0	Yes, this Winter we had no rain hardly, a couple days.  I love it  Now superduper Gloom and a VERY HOT SUMMER I think. Hugs.
1	i feel u lol i know this reply is freaking old gurr lol but d u go out 2day beutiful day out uujoo is banging wether
1	cause i talked to blake yesterday
1	ummmm...... not spoiled - extra loved
0	~ cant you go?
1	uh huh   we are fucking awesome.
0	he looked all deflated LOL. He's already pissing me off though
0	Sorry you've not been great  hope I can help cheer you up *shrug*. British GP this weekend! JB to win? My money's on Rubens tbh
1	ya mine too but for very different reason
0	I want a kitten
1	I should be the one saying THANK YOU!
0	yeah me too...Im totally pissed...Everyones giving up
0	And to cats ...
1	hello  how are you today? btw did you get your major at uni changed?
1	none of thos movies are in my Likes list
0	Poor cat. You are cruel. And he looks now like a little lady. OMG. What a monster u r
0	 Hi LOVE, Bloody rain I am so lonely, playing games just took a break to eat,3 numbers on lotto no supplement  LOVE U & MISS U
1	i am loosing about 5 a week through a dr. modified fast  congrats on the pound, it is a start
0	Dunno really, cant put my finger on the reason..just one of those days I guess 
1	That's what they all say, then they aren't seen again all sum,emerging all white and pasty!   xx
1	Yes, Knight Rider was great 
1	teehee i would so share if there was but sadly no it's really just holiday brain
1	good good!!!
0	i just went to the bathroom..i had too many close calls lmao...depends mayhem? (kimo dont like piss play in the bedroom)
