0	oooooh, taking a gap year? You should sooo go to Australia and New Zealand! I'm shattered and sick of marking coursework! 
1	lol yeah it'll be funny, have to keep an eye for it! 
1	Copy/paste the URL for a link.
0	 Hope you feel better.
0	i haven't seen Control yet
0	I'll continue not smoking if you'll refrain from insulting my home  ... Read More: http://is.gd/JBPs
0	Oooh sammiches... I wish I could partake in them with you guys
0	hahahahaha omg!!! I wanna be with you guys!
1	I would let Take That in!! It would creep them out but they would never escape anyway so it doesn't really matter lol
0	Thanks hun!!  Lack of sleep and stress finally caught up with me
1	Love London and know it well as I have family in Essex. I have a busy day too, lots of running around. Have a lovely time 
1	Thank U all for being so sweet - U know how to make a girl feel better
1	Gooottttcccchhhaaaa - well, that sucks! Do you need any books? I have some books from last year that I could sell you 
1	congratulations my friend  FSU
1	I saw that on jonas too  But where is that line from cos I've heard of it my I can't remember where?
1	definitely
1	aw. but i think it would be better if David himself helped you, so you will have a chance to hold him 
0	ohhhh noez  that suckssss im sorry!
1	My thoughts EXACTLY on the article, thanks for articulating so I don't have to 
1	she's cool...thanks for askin
1	thats not true at all!!
1	HEELSANDHIGHTOPS baybee! Whoop Whoop! lol Preciate ya!
0	haven't been following it cause i'm not happy with him & Vikings combo  ... probably upset a lot of fans no doubt.
1	I have the sony e-reader and have not bought a paper book for 3 years now
1	yeah, I'm looking forward to seeing my nervous ass boyfriend and my wicked ass freestyle  I wanna post it to my blog
1	It was fun. Too many people, but good. We liked the HSM3 show 
0	They put House of the Dead 2 & 3 in the box of Overkill
0	I dunno man. How bout some wendy's?? mmmmmm we dont gots that in H-town
1	"Evie the Evil Evelyn From Tarpon Springs Florida" Must be quite hard to say quickly after a jug of Margarita?
1	That is so Stylish! Let your wife know how talented she is. Vader would kill me if I dressed him in anything. He is a Boxer-Pit
0	And you didn't invite me? No fair!  lol
1	Jack said to tell you hi back  Some photos of him: http://bit.ly/2Czjt & http://bit.ly/YkfxG
1	Sunny and war here today  Wohoo
1	don't do that.... caps? don't do that either...lol
0	U COULD B, BUT U OVA DERE N I'M HERE 
1	Holy smokes.... L4D 2 was indeed epic. "And if we run out of bullets." AH!!!
1	hey jack. It's cindy I'm one of the #Biztechday staff. We met before at your office during an meetup organizer meetup
1	YEAH I FEEL U HAHAH REAL NIGGAS DO REAL THINGS
1	Get 100 followers a day using www.tweeteradder.com Once you add everyone you are on the train or pay vip
0	but we went to hookah last thursday. guess we're not gonna be seeing you much anymore
0	today (fri) was so bad, the weekend is probably ruined too 
1	- something about a stripper? huh?
1	*hugs* to you.  We're watching cartoons on PBS right now.
1	good morning my love
0	That's not good! Need to get something in there for *YOU* so that you can get off that wheel!!!
1	So I was way overdressed tonight... Should've realized what you said: It's Danbury! Oh well... At least I looked nice.
1	Thanks for that!
0	that's nasty :| i wont be able to sneak anything in
1	tyvm  sorry they're blocking blip ... would say something about SSH tunneling to proxies here, but I won't ;)
0	cramps  but im good
0	LOST LIKE HELL!!! THAT WAS SAD!
0	 Maher on the other hand, is kinda doushe, good points, but quite the doushe. he was mean to that  hot muslim guy.. 
0	 i miss my employer he hasn't been on for a while
1	couldnt be better  are you having a great day?
0	did you even listen to the blip i sent you
1	hello - how are you?
1	I told ya about him the other day! He sucks, makes good sushi tho 
1	While I do not know you very well, one can usually tell when there is an intent...you are very fascinating though 
1	That's awesome
0	awww, i do too 
1	i just realised it may not have registered that i put Australia.. haha I hope its just $5! I don't have too much $ anymore YAY
1	my friend who has camera obsession will come so be sure you'll get some  even some taken especially for you
0	ohhh.. milky will get no car
0	I know right
1	 I'm taking a million songs from your blip.fm station thing. Sorry
1	i am great very blessed
1	who would've thought you would care
0	I saw #squirrel some months ago on your twitter. I'm sorry it's for Mac only
1	that's all good, but it's just "factories" 
1	Yep, I think it's totally awesome. 
1	well are you going to Paramore concert? or Short Stack?
0	I just saw the Hamlet update too - excellent news... Never so good as live though
0	Im watching Shakespeare In Love. Also loving the breeches and silk! Was craving Joseph after not seeing him in Chi
1	dude let's see Up in 3D and sneek into Drag Me To Hell! I'm reading on twitter that it's pretty good 
1	I haven't eaten breakfast yet, but I did find a kitten! 
0	 No  i have too many things to do due to a stupidly busy few weeks. Like clean and tidy and do stuff in the house
0	That sucks.
1	I am very proud
0	omg!!! Thats awful!
0	Mowing down of pedestrians & crashing is not to be recommended. I fear you will have to stick to silence
0	Now you have lost me on that comment
0	thanks - not that bad, more just a really bad cold, but with hayfever to make it worse 
0	 What kind of work do you do that let's you still be in bed at 10:20 in the morning?!  I've been on the go since 07:30
1	hehe not too bad. Spent a lot of it typing. My fingers are hurting now lol gonna have some peanut crisps to cheer me up
1	I was talking about blokes!!!  LOL
1	Isn't that a double negative?!
1	no its not! it's lully!
0	i have my first one at 8am and the second at like 10am...
0	i wanna snuggle you tonight.
1	Yes, I saw your lovely Dr Martens on your blog! I have the black version on my list 
1	Oh no ... what happened?!    Shopping overload?
1	Sorry, meant the former. I get those 2 mixed up all the time. 
0	Thanks so much! I was trying to twitpic  my expanding un flat ironed hair yesterday but couldn't
1	oh! thank you!...off to take a look!
0	are you okay, bb? 
0	dunno... just don't feel well today  but I HAVE to go to school 'cause of the test :/
1	eeew... I had someone like this, too. blocked he/she/it 
1	germany is ok, the weather also... but i still loove rain 
1	going to bed already? aaww. goodnight
1	hahaha what..? i wanna dance with you, if you mean that 
0	i can't!  i'm just a 13-year old girl who's just in the 1st grade :') aight dude, your grammar is good (: learn it school!
0	my life is okay.. schools almost over but I miss you and yas  whaa life is HORRIBLE!!!
1	nothiing muuch  youu?
1	youre not ugly at all
1	I will go for sure next time 100 percent, so my game can rub off on you guys so you can get some 
0	no chance of rajasthan in finals? I kinda liked them though!
0	He departs  but match is well in control now.
1	hey hey have some respect - i'm joined the spy network of my motherland - England ..
1	coincidentally, we caught star trek today as well. Loved it 
0	read for some breakfast...
1	Well, I am sincere! Glad I could help! My pickem-up skills are available anytime! 
1	Get 100 followers a day using www.tweeterfollow.com Once you add everyone you are on the train or pay vip
1	nothin!!  haha. about to leavee. youu?
1	whooo! haha. that's awesome!
0	bc I got finals 2 study for
0	aw.. that bites.
0	i think i was using sony vegas or something like that. pinnacle? lol i dont remember, thats how long it has been 
1	oh, well maybe you should. 
0	tell me about it
1	ooooooo thanks for linking me that  it was interesting.
0	That reminds me, too. Snape made fun of me for using that cane to walk around earlier. He said I was falling apart. 
1	wowwws thankuuu
1	???? ?? ?????
1	ìš°ì™€ ì§„ì‹¬ìœ¼ë¡œ ì¶•í•˜ë“œë¦½ë‹ˆë‹¤.  FÃ©licitations!
1	ìž˜ ë‹¤ë…€ ì˜¤ì„¸ìš”~
0	 This is sad
0	   It's in the mail.  I can't believe it.  The NBA's own personal Black Swan event.
0	sorry for being random  lol
1	Phew ! That was close.
1	we all care about you, and we are always right......possibly.....well most of the time  x
1	You'll have to sweet talk her  make sure she knows you are a hard worker.
0	I'm so tired but not home
1	because I'm hot and he's hot.
0	What's the matter? Anything we can do to help???
0	YES!!!!! I wish I could watch the awards  Anybody streaming it?
1	 AHHHHHHHH! IT'S THALIA! AHHHHH! OMG OMG! I MISS YOU SOOOO SOOO SOOO MUCH!
0	  I don't like this game.
0	if u had asked i would of gone
1	Thanks! I'll check it out.
0	I wanna cry
0	congrats!!! I still don't know what I got
0	I miss you tooooo  maybe a NY trip next month?..we'll need to plannn. haha :]
1	because ur phone is just as special as you
1	I've been very busy with work.  How are things with you?
1	and then id use my magical powers and steal him from his gurlfriend  hahahah.
0	my reply was lost? heh  okay, in the summer  x
1	I guess they're busy at the moment
1	 bunch of moms  lol....gonna write that to Yu  Hope Vanessa sees it xD
0	Oh...so sorry to hear that...so sorry
0	And now I find out not being released until next month
1	Haha, small world isn't it? I live in Shillington.... nr Hitchin! But yes, quite spooky 
0	but but but he shoulda gone instead of allison
1	I appreciate your attempts to make me accept that ticket but I'll keep on refusing it until my death  with love vicki?
1	LMAO. i like that answer. but please upgrade!  hoodrats = for the loss!
0	pleasee tell not to judgee meee  before i kick her!
1	(Thanks!  *leaves some for you*)
1	I'm sorry sweetie. Just stay positive. It will work out
0	i'm great and the sun is shining outside too and me, i'm in the box with the neon light 
1	LOL   i didnt know it was there yesterday aha!  so do you like it ?
1	http://bit.ly/I2GZJ  watch this!! the violinist with the ponytail is Harry's GF
1	 ping me if you need a place for your blob, it is down since weeks now 
1	OOC:  IC: *blushes slightly* Be careful, Harry... don't want starting to get jealous.  *grins*
1	Mmmm. My favorite cake would be white/yellow cake with strawberries in the middle, white frosting and strawberries on top 
0	 Hi hun!!! Yeah still nice not for much longer though apparantley  hows U ?xxxx
0	Hey hun .. Played 23 and 13 all night long but nothing
1	Hey sweetheart, aw thank you!  how're you? I'm just out the shower, dripping wet hair Haha, Xxxx
1	LOL haha yep that's the stuff
0	omg it is pissin it down here and freezin  xxx (via Same here LOL x
0	we ate it all.  lol
1	I'll check that one out!
0	 I thought it was friday for the NAA tweet up... Sad   I wont be there thursday
1	*Waits patiently for news* Ok so maybe not so patient... but I'm a woman dammit...
1	: you guys are on a roll!!!! I hope you are getting some sleep in between
0	::waiting for the competitiion:: heh, guys the last few Kytemovies have no sound.  Can't wait to hear new music! xxx
1	I wanna ask the same
0	awww I was working this whole time when you finally had it
1	cant wait for your new album! love doing acoustic versions of your songs! especially the kill!!
0	good question! it's a pity  that i wasn't there   i live in germany...............but the life must go on XD but i'm sad,
1	Guys, we are waiting for the announcement! 
1	HAPPY ECHELON DAY!!  I'm so proud to be ECHELON and I'll be an echelon for ever and ever!! I promise you guys!!
1	Have a good afternoon/evening, Marsguys. I'm off, it is past 2 AM here. Bye, love ya   
1	Hello Steve
1	http://twitpic.com/2xfyp - awwwwwwww, cool!!!!!!!!!!!! no comments 
1	http://twitpic.com/6q0d4 - Hi
1	Hurry up with the new album already!
1	I AM TRENDING - YOU ARE TRENDING - WE ARE TRENDING !!!!!   Thanks guys!!!!!!! ;)
0	I have no money to go to the London summit... so bummed.
1	I would say that sounds pretty damn wonderful
0	ï¿½ï¿½ why not today, huh? huh? Huh? 
0	I'd like to chat, but I can't! 
0	I'm not going but my best friend is and it really sucks, I'm working but shes agreed to rub it in when she gets back 
0	It's a wonderful sky...it's ok  to go to the sea...but I'm at my office!
0	It's not fair!
1	Love the inspiration WORD wall
1	Night you guys. Sweet dreams  Reanna
0	OK, wait, what? O_O about what? details, people, details 
0	please help me I wanna come to summit but only iv recieved an invite none of my 3 friends  cant we just show up  xx
0	ready for the French Summit. but so sad you won't be there  love you xx
0	some good suggestions about heavy heartache ?
1	sounds exactly like something I need to hear...now
1	sounds really good!! much better then Kanye West!! I can't wait to hear your new songs
1	sure 30stm does it MUCH better! love Jared's voice, gives me goosebumps  ...so I must go give my vote again hehe xxx
1	Sweet dreams!
0	That the general public wants to kill me with their stupidity!  Customer service is going to be the death of me.
1	will do hun even though i will still be finishing off uni work lol, nighty night  x
1	yay how funny wud that b lol thats ok i have thurs n fri off so mega votin  xxx
1	Yer we do-there were only 2 copies of tht book instore and I got the second last copy hehehe-yay!!!
0	yup sure did. i wish sumone would buy it for me  lol
0	nice tip about the technet sub, won't work properly in Firefox 3.5b on Ubuntu tho', it doesn't even like IE6 thru WINE  #WINE #Ubuntu
1	i knew that there was a reason to sit at the computer whilst nursing the baby!  yay for blogiversaries and giveaways!!!
0	So strange... I haven't received it.  Can you resend? Checked spam folder and could not find it.
1	Story of my life.
1	you're soooo welcome! thanks 4 always inspiring me...and above all else, thank u 4    loooooove them!!
1	shall we make friends lol
0	Still got a machine with PCI gfx card. Just PCI, no additional "e". My VLB machine fubar'd, though 
1	i hope you're prepared to help kara & i in the fall so we can pass anatomy this time  oh andddddd i miss you!
1	you guys are cool. 
1	I know!!! Now prepared to get addicted to Twitter!!  Ha!
1	enter the zoom lens
0	i even tried to get on my phone but it wouldnt post
1	I slept right through that. I had the margarita of life and passed out. Ha. But AR has always been one of my fave thick snacks
0	YOU'RE MEAN
1	yup, one on Wednesday, then I get to go back to trying to diet myself 
1	Coolness!  Have Fun. =D
1	I fell in love with one!  This one.. when he was little. AMAZING! http://bit.ly/17ifJI  "Tell me Why"
0	I love the meaning of Finals. Because it's the honest truth lol. This week has been crazy Finals all effin week WTF!?
1	ur so incomprehensible sometimes.
0	well yes lol ..  i had a chat with them earlier , there just not willing to learn anything else 
1	wimbledon got a new "roof" today for their tennis court and its freakin awesome!
0	Exams suck  I handed 1st piece of MRes work in on Fri. Not got anything to hand in until Sept now, then diss Sept after that!
1	I've been working on a few screenplays. Very weird shit. Well, to most people that is. And pain = inspiration. 
0	oh mama  soon darling! Were changing that! And terminator from what I hear aint all that
1	I prefer this one-however I'd change the color (IMO, a dark blue/black is prettier/better than the red) 
0	I am lost. Please help me find a good home.
0	just chilling out i got my toncils out and that sucked
1	I'm English, I guess I better watch my self 
1	not my chocolatey ones, nope 
1	u can eat a lot of GUACAMOL hahahahahahaha xD love u guys!!! so come to guatemala!!! xD
0	ugh y do u guyz go 2 like all these diff countries but don't come to DC!?  sad sad
1	What's on my mind? The Jungian Alchemy formula - Purgation, Illumination, Union. I know, I'm odd, but it's true. 
1	WHOOOHOOO! We are so going to be there.
0	wish I could be there
0	your board that doesn't fucking work!
1	Just at home with my puppy watching happy gilmore haha. He just got headbutted by bob barker. THE PRICE IS WRONG, BITCH 
1	hehe yeah I totally agree
1	Yeah! very amazing, i love the part when they switch bodies 
0	 lol that make the mass less boring...i dont like 2 go but i dont have any choice so i have to get bored 4 an hour  xD
1	haha good for you!
0	Hi sweetie! I hope you're doing fine ;) I'm sorry, I have so little spare time to tweet lately..  Take care! XO
0	it's bonkers by dizzy rascal i think
0	it's so sick, I'm fed up of them... 
1	maybe it's one of the reasons why we all love him  (but if you someday find that vid,show me ;) )
0	on july i have 2 weeks of holidays and then i have to wait till december!
1	who doesn't ))) ok,now i go ,sweet dreams 
0	yeah i knw..but i dont think they'll come here
0	yeah me too and i though i could not  see him in that way in real life ...i couldnt handle that
1	you're on summer holidays? cool  and how is spanish for you?
0	I'm so depressed cuz today was the last day of school! This sucks soo much!
1	hehe well.. bonne nuit for me, good morning for you  kisses!
0	i wish i could hun! but i can't
0	HMM.... well thinking like sherlock would..... in new york
1	Uplifter is AMAZING! You guys have really outdone yourselves! It's gonna be on a continuous loop all summer and beyond!
0	Carsten your injured! not cool  you didn't catch it from one of those X's or a Nissian driving past?
1	haha that is what twitter does!!  i bet by now its on though!
1	seriously. I can't remember life pre-dvr and xm radio!
0	Skype is amazing...and no I didn't get the call   Somedays are easier than others!
1	So raining give you spare time
1	just cuz um I wanna clarify. I did know there were elections today  just being a smartass.
0	Thinking about the 70s makes me sad right now.
0	I just got the most depressing text message, im actually buying a pair of shoes b/c of it.   WooooooooW!
1	Thanks for the recommendation!
1	re hellbilies... easy woman... take a chill pill  yuk? ngerokok maksudnya
0	 looks like we are gonna have to trade back  kidtokid wont let me trade the system bc im not the  original owner...
1	or was that too serious an answer?
1	followers come and go, freinds stick around no matter what 
1	excellent stuff! well done!
1	thank you! much apprc.
1	That's true, though is giving it a shot now. 
1	well and I are on our firsts.... so get on board
0	I just wish u would say it once
0	lol, there's so much thunder and lightning and storms outside, I'm SCARED!  (Seriously)
1	 so i know by now what a mask is  but, these lil flying hairs, thats sooo difficult
1	cool i will maybe  thank you ;) at teh first i though at something like this: tinyurl.com/nu6qrs but its to expensive^^
1	hmm i reaed your tweeets, i dont understand xD but i am awake for 10 minutes, soon i will rread it again with concentrate 
0	hmmmm but lately there were so much: playboy, blender, penthouse now i dont here from such things 
0	i loooove subway its soooo goood :-P but i live in a huckville i only get when i am in a city
1	its okay ;) like ya  ;)
1	LOL  _M_I_A_ Dont tell me u havent heard her "Paper Planes"!
1	no just someone being creative about ot
1	Freakin Teach Me How To Play Guitar.  mills = ]]
0	I KNOW! i scream fell of my bed then hurt my ankle  BRING THEM OUT, BRING THEM OUT! X
0	i really am! Oh harsh  xo
0	my dad is listening to sum weird man and wont let me switch it off
1	What Happened To Their Account On Youtube? And Hey!
1	let me be your first!!!
1	ur welcome  im ok..can be better thnx...well hope you get more followers now..and good luck with your exams!
0	i want a trampoline
0	- I asked Rob (@robluketic) to marry me and he did not even reply. Me a very sad kitten now...
0	never,,,,,I didn't get the joy of having children of my own. 
0	but it's kinky  ! LOL ! i know i amm sooon.
1	i miss you making me LOL, i'm getting you a scarf this weekend & then we can play in the cold 
0	No worries, it didn't! Gutted though, it won't be the same 
0	ouch, I hate it when favourite items of clothing get ruined. 
0	poor kids not even finished for summer yet.  How depressing.
1	Yes! Do it and then show me some piccies!
1	howdy  nice to see ya.
0	Wish I was there
0	Some things... they just never get old. http://tinyurl.com/holdisgiantcherry I miss Maya.
1	are you looking for a home-based job? would you like to offer your services? please or DM me; I'll try to help you find work
0	babe..  i cant wait ! .. cutie!
0	i'm on the fence. it's more like a help family out trip vs a have fun trip.
1	Why not moving the formatting guide (expndable section) in Writeboard to the sidebar?
1	Very sexy pictures indeed! Thanks for sharing
0	Yikes Stripes!!!
0	me too want lunch  9a7teen
1	The khedra is the piece of fabric u use on top of the bride while in jalwa...  wanasa shitsawoon b3d?!
1	What a convenient word to know!
1	oh my...I couldn't imagine high school these days... And think how trendy it will be by the time your little ones get there
0	  I'm not performing anymore, last minute drama!!! So sorry.
1	circustances demand i be up and about!loads of water after nite out before sleepin and i wake up fresh
1	Haiya...I might have a friend who can help you  A psychosocial scientist she's on twitter too(how's that for irony!)
1	Have I? Maybe I just need company..
1	sato is great! work went  relatively well in the morning n i spent my afternoon curled up with a good book  yours? hows princess?
1	you good miss. Bubbly? Haha makes you sound like a nice bottle of champagne
1	probably hissing at the sun like vampires with dilated pupils
0	n im tryna go hoop.....wish i had a boyfriend who would buy me a basketball...
0	nothing just inside b/c its raining  yup lol I decided to get my own and try it out
1	 Umm Opera is  on hollywood and schrader....it usually be poppin on sundays
1	every little thing  just trynna keep these niggas and my business n line
1	LOL.. i KNOW... BEEN BUSY!  iM BACK THOUGH
1	am glad u doing good
1	I'm working on my blog...willing to launch it soon
0	and within a short time of the last clue all of them
0	yeah I know of the indiagames thing. He has also started investing. I so wanted to meet him, but I guess next time 
0	i dont need congrats, I need halps! 3 different client's work due today 
1	BlackBerry Storm 2... Sicuro!!!!
1	Get 100 followers a day using www.tweeteradder.com Once you add everyone you are on the train or pay vip
1	Up until recently just been a hobby. Love landscape/wildlife but learning portraits.  Thx for following also.
0	Haha, it's okay. Everyone probs thinks it was me. It's always my fault when Dan feels hurt, now 
0	i am so jealous of you! you have no idea. i can't go to the cab's concert in dc though because i'll be at camp
0	thanks.  i have a feeling i might need it!
0	i will have to wait till later to see the trailer too   gotta get kiddos ready to leave and get outta here!
1	Aw, thanks! I need to hear that this time of year.  How's the new job?
0	by yourself?  how long will we be there for? cos i don't think dad wants me going out, but i shall ask..
0	haha didn't get UTS scholarship  . but whatevsz
1	haha lawl. i let them get my unpornrelated tweets
1	why not? 'cause of the girls?
1	ahahaha I totally saw that place before a show  is it as amazing as it sounds? bhaha
0	hellz yea u look like u had a blast...that dress - certified...but no jumping in the pool??  lol
1	thanks hun  ill put pics up on flickr from the show soon.
1	 I've got some things to do before I can get on with any fun work :p but we can soon if you're up for it!
1	are you there? im about to upload a prom dress design i put together for the fun of it, on twitpic.. 
0	and im really sorry you have to go through such a hard time and deal with other ppls trivial issues at the same time
1	yeah not only that one theyre going to go talk to different ones too
0	Why are you ignoring me?
0	its hot  lol hows Kansas ??
0	Would have loved to but going to Taico Club 27hrs party and heading 2 Canada on Tuesday
1	If you're interested in watching Wimbledon the next couple of weeks, it'll be on NBC. 
0	office... 10:00 am... long day, you know 
0	*hugs* sorry you didn't win
1	Your Van Gogh thumbnail, it is my favorite painting. 
1	"I'm looking for men is black suits, they killed my father, have you seen them?" one of the best and expensive games made! 
1	KANYE!!! did you tell him he's got nothing on stevie and her twirls?
1	Nice review. Your turning into a pretty good movie critic.
0	lol I said the exact same thing. Missed Conan though.  Tuned in for the last 2 minutes lol.
1	you are so cute omg i love you x) it'd be awesome if you replied   x
0	everything on my itunes is gone
1	awww. Thanks    x
0	lol yeah, sorry  i don't really know how to explain it
0	lol nada I'm working and noww I have no life lol
1	oh, ok  now, about that Susan Boyle issue, can't really help u. but regarding the capital of Assyria...http://tiny.cc/hU2pO
0	nah, not yet 
0	life's looking up! can you send me some of your good luck?
1	Hi  I've no idea  Lazily, I tend to wait for them to get named, I'll look later though (ton of work this morning). Tell me more
0	u free this weekend? i wanna do sumthing fun. havent had fun in a very long time
0	nope. i think you'll find that life doesn't have a meaning either  [/emo off]
0	Yeah it is hahaha the picture is really dark though so it WOULD have been nice if the flash was on.
0	I wanted to meet the infamous mama gordon.  tell her hi
0	it's still dead here
1	lol amazing show  show me how to work thissss
0	Hahahah!! i hate school seriously.. its so rubbish all this week were been doing tests its like ahhh
0	I am bored because I am doing homework and that is no fun.
1	 you're as delicious as sweet sun tea on a tybee island sundeck in august. i know...i been there
0	it was the best day! idunno where it is tho  i must find it.
0	nothing. i just wrote it, cos i was hoping someone would be like "oh you excited about....." but no   nothing
