1	Good weather... good times... twitter out for a little..
1	Good week last week, got plenty of work done and achieved some new goals. Business Development was great 
0	good weekeeeeend. work tomorrow
0	Good Weekend trend continues, won some gen contest  USD 50$, which sadly gets converted to 500 INR 
1	Good weekend!
0	Good weekend, but actually knackered now : i need another day to sleep 
0	good weekend. sun really makes everything look better. back to work today tho
0	Good weekend.Shame  it's over and back to work!  My turn to cook tonight so might have to have a day off tomorrow with food poisoning!!
1	good weekend; 11pm maccas runs with cousins, leather jackets are legendary, figured my birthday weekend out, 12 days! YAYY! cant wait. 
0	good win for liverpool shame it couldnt be the league
0	good work..i love u..never forget it..please..tc..i hope to see u later. Bye
0	good workout , steaaam room broke 
0	good workout but that chlorine was so strong I think I'm going blind
1	Good workout!!
1	good!!! estee just texted me... that she is now at her cousin's house ..
1	Good, beautiful, sunny morning! God I love summer  Nike seems to be wheezing less, so yay! It's awesome to go to work in flip flops.
0	Good, cause when i sent it, it was 11:11 but it took to long to send  haha.
1	good. nite. all.
1	Good... Morning Tweetie birds. I'm off to bed.
0	Good...afternoon? Why didn't I wake up today?! My mind playing tricks on me
1	Good...they are not so idiots after all..
1	Good.Afternoon.
1	Good.Morning. everyone have a great dayy!
0	Good: Starbucks chick gave me an extra shot of espresso for free. Bad: The sausage muffin I bought there made me way nauseas
1	Goodafternoon all.  Time for week reflection now, meaning I have to iron. Happily not  the whole summer collection like  last week 
1	goodafternoon twitters ! happy birthday Juneaaan Pech and Michael Williams !
1	Goodafternoon.  http://plurk.com/p/ui7br
0	Goodbye #Windies was great while it lasted...
0	Goodbye absinthe glass  http://twitpic.com/7vld1
1	Goodbye America. Hello Philippines.
0	Goodbye Angel! We'll miss you  #FarrahFawcettRIP
0	Goodbye apartment..
0	Goodbye arizona I shall miss you!
0	Goodbye athens
0	Goodbye Baby Albert!  You are an angel now.
0	goodbye Bangkok, am very sad to be leaving 
0	Goodbye Blackberry!!
1	Goodbye Boy-see... It's been fun!  Let's hope we all don't get too cranky on the drive today
0	Goodbye Carrots  godspeed...
0	Goodbye Danny Gokey  I still think you're the best. http://plurk.com/p/tt320
0	Goodbye dinner with the Lavarras.
0	Goodbye Dubai and my family  Hello Philippines and College!
0	Goodbye for the next like month
1	Goodbye Jay...Hello Conan
1	Goodbye KC. Thx for all the BBQ. I feel fat.
0	Goodbye LA!! I will miss you  New York here I come!!!
0	goodbye lauren conrad  the hills will miss you !
0	Goodbye liam for 5 weeks  Leaving storthes tomorrow !!!!
0	Goodbye life.. Bye Shane and brad and Katelyn's life
0	Goodbye Los Angeles...see you soon.  http://twitpic.com/6efxz
1	Goodbye Mary Lou
0	Goodbye MIA! I'll miss you  #fb
1	Goodbye Michigan, Hello Chicago tomorrow mornin' 
0	Goodbye misty morning, hello sunny day. Shame it's too late to skive off work, I'm already in Ruddington 
0	goodbye monday. hello early morning track practice
0	Goodbye mountains.  #fb
1	Goodbye Mr.A - The Hoosiers
0	goodbye my almost lover, goodbye my hopeless dream, i gotta go to school now. 
0	goodbye new york city  only one week left :'[
0	Goodbye New York City!   http://twitpic.com/6ffux
0	Goodbye North Hampton
0	Goodbye ohio! You will be missed...
0	Goodbye old office   http://yfrog.com/6hmy3j
1	Goodbye oppressed town of Colorado, Hello HAPPY town!  Not going to let it bring me down!
0	Goodbye party at the Sea Dog! I'll miss everyone whos leaving
0	Goodbye people ,Thank y for answering me ¬¬| ok awww.. 12.05 A.M. :| It is late !  I LOVE JONAS Though they do not answer me  . Gianni !
0	goodbye pink hair
0	Goodbye Pontiac, Saturn, Hummer and Saab. 
0	goodbye record stores.  http://bit.ly/nKxt9
0	Goodbye revA and sure press...I truly will miss you both. Only one day. Before the official upgrade
1	Goodbye Rome, hello Sienna. Thank you Audrey LeDoux 
1	Goodbye Rose. Jack will be seeing you soon, I'm sure 
0	Goodbye seattle! Time to start heading home
0	goodbye shorts  its been a good 5 years
0	goodbye straight hair.. goodbye childhood.. goodbye pajamas.  showertimee! ahaha. ;)
0	goodbye Texas
0	goodbye Thomas  XDDDDDDDDDDDD
1	goodbye to all I want god bless .xox0
0	goodbye twitter  i have used 2 much internet download ooopppsisess :O have u used a lot of urs yet?
1	goodbye twitter see yah later.  BTW: who wants to come with me to watch HANNAH MONTANA THE MOVIE AT JULY 8? )TAGAL pa nun )
1	goodbye twitter..  see you when i get to hk  haha!
0	Goodbye Twitterland. Going to revise
0	Goodbye world, good bye family, goodbye for good. 
1	Goodbye! Early night for me! You have fun without me
1	Goodbye, Champaign-Urbana! Hope you have a great summer! I'll be by from time to time to check up on you 
0	Goodbye, Farrah 
0	Goodbye, Muricy Ramalho 
0	Goodbye, RCBC building. Thnks fr th mmrs! 
0	goodbye.  i loved u and u was someone special. but sth changed. maybe it'll be alright one day but it was ur decision & idk ._. </3
0	Goodbyes ... Hurt
0	goodd nightt  sweet dreams to everyonee   jared neveerr chat on kyte   lol
1	Goodday so far  everything is going good
0	good-fucking-night. I miss my spanish book and a boy
1	Goodknight Twitterland! Happy Mother's Day to all you blockhead mommas! Have a wonderful day!
0	goodluck I wish I could watch your show in here in Sydney
1	goodluck and for CMT awards.....hope you guys win
1	goodluck today baby boy! you'll do fine
0	goodmoooooorning  exams are getting closer and closer
1	Goodmoring  I still can't stop listening to "before the storm" by and the  it's so awsome!
1	Goodmoring  i'm getting my lip periced today
1	Good'Moring To you all going out with mom will be back ina bit Thanks  xoxo
1	Goodmoring!
1	Goodmorining america  rise and shine
1	Goodmorn Babes loving that pic! 80degrees Today here in NY! Ha u missing it
0	Goodmorn! I just realized I missed the MTV Movie Awards!!Aaaaarrrrggghhh, it was my 3rd year anniversary yesterday,I didnt know it was on 
1	Goodmornign twitterland  I am busy right from the begining.
1	goodmornin  no more rain! clean the house, then back to work!
0	Goodmornin it is the last week of filming hannah montana season 3  I will miss you miley
1	goodmornin ninjas!!! omg luved the movie UP!!! soooo cute......okaeeee so its time to fix da lashes...ttyl
0	Goodmornin twitterbugs! Im on my way to work my honey boo is on his way home to see da fam n etc
1	Goodmornin Y�ll,Heading 2 da filmset with da productioncomp.den gon visite Nike headquartaz 2 shop 4 da project,might cop a shoe or 2 
1	Goodmorning   gonna climb the roof n clean the AC coils. . . roar  eather that or fall
1	Goodmorning   I believe as long as i keep this schedule, waking at 4am everyday, i will not sleep past 6:30ish or7ish on my days off!!!
0	goodmorning   i hate mondayzzz T_T
1	GOODMORNING  .... MY PICTURE DOESNT SHOW -__-
1	goodmorning  eating breakfast
1	Goodmorning  feeling crappy this morning how's everyones morning
0	Goodmorning  gettin ready for work.... What's up for today?
1	goodmorning  having a protein shake then starting chores.. then hopefully outt?  textt mee
1	Goodmorning  If any of u lacks wisdom, he should ask God, who gives generously to all without finding fault, and it will be given to him
1	Goodmorning  twitters
1	goodmorning  urgh stuipd thunder last night -_-
1	Goodmorning  waiting for Kristina to wake up.
1	Goodmorning !!
1	Goodmorning !!  Eatingg Cereal Nd Getingg Readyy Forr Sckhool )
1	goodmorning ,the week starts now 
0	goodmorning ..., school  but it's fridaaay!
1	goodmorning ! and thanks haha  <3
1	goodmorning
1	Goodmorning cali  hi to my vegas family
1	goodmorning everybody!
1	GoodMorning Everyone  Feeling back to normal. Trying to get back into my exercise routine- those pounds creep up on ya. Have kids out too
0	Goodmorning everyone hope you will have a great day weather here sucks big time  pout pout lol  Xx
1	goodmorning everyone! if you aren't following please do He is this amazing guy that doesn't really talk just blips music
1	Goodmorning everyone!!!!
1	goodmorning everyone, off to flippin work!!! its alright mooshoe i think ur day will stay positive, cheer up lady!!! 
0	Goodmorning Everyone,gotta take care of my sick little girl 
1	goodmorning everyone... Have a great day
0	GoodMorning Everyone...*grabs ANY caffine drink* I'm good...not I dno't have one yet  give me hot teacher lmao
1	Goodmorning followers, nice day 
1	Goodmorning friends and pornstars. i know your asking...which one did i put bekki under?
1	Goodmorning guys!!!  -Philippine Time-
0	Goodmorning it sucks having a cold when its 78 degrees outside
1	Goodmorning lonely friends
1	Goodmorning loves  how is everyone??
0	Goodmorning loves! Ready for a long day at the bank! Counting money that isn't mine!  http://myloc.me/2m4J
1	goodmorning Manila ...still got the cramps bt a bit better now...Pussycat Dolls will dominate Manila with a concert this Thurs...woooT
1	goodmorning my loves
1	Goodmorning my twiggas and twiglets
0	goodmorning now ... pfffff friday ...Weekend another day at school   i don't like school ...who does ?
0	Goodmorning people
0	goodmorning people ._. I'm not happy, no no 
1	Goodmorning people lovely day
1	Goodmorning rise & shine it's coffee time only 4 1/2 days left of school for Tiffany then the Summer fun begins I love having her home
1	goodmorning sunshine!!!!  oow what a lovely day
1	Goodmorning sunshines
1	Goodmorning sunshines!
1	Goodmorning tweedles  very happy mood, i think i will always be after this past weekend. lol vids of the 'BEYONCE WEEKND' coming soon. 
0	GoodMorning Tweeple! I missed u so much. My new place doesnt have wireless.  I shld be getting some this week. No twitter rehab was .
1	Goodmorning Tweeter Peepz  its a chilly sat morning; im off to the shopz xx FLYYYY HIGHHHH
1	Goodmorning tweeters
0	Goodmorning tweeters.early morning! Out to breakfast w/my boys,then the mall w/the mercedes  but its a good day!
1	Goodmorning tweethearts! Besides Covina High School's graduation tonight, give me plans for the day/night! Today's my last day school! 
1	Goodmorning tweets! Putting on my eyelashes
1	Goodmorning tweets!! Off to the gym after school  Hopefully I'm not too sleepy XD
0	goodmorning tweets.. i dont feel so good :-/ .. couldn't drive to see Jen
1	Goodmorning tweets...getting ready for church  ttytweets later
1	Goodmorning tweetypies! Thank the man above for the blessing of waking up this morning! He loves us all! Have a blessed and heavenly day!
1	Goodmorning twits abt to pull up at work 5 min late! Hope I have an awesome day... No I'm gonna have an awesome day!!! Let's Go!!!
0	Goodmorning twits I'm overly tired Off to dance class Ughh I'm late
1	goodmorning twitter
1	goodmorning twitter !! it's cold in argentina
1	Goodmorning twitter fam! Doin Inventory checks for TUHT official clothing... Hope everyones feeling great this beautiful morning
1	Goodmorning twitter people! Watching Goodmorning America and wouldn't you know FallOut Boy Is performing lol
1	Goodmorning twitter world  ...busy day today. I'm excited to start it ;)
1	Goodmorning TWITTER WORLD!! hope errbody has a beautiful day!!
0	goodmorning twitter world. still sick  i probably won't tweet that much today...
1	Goodmorning Twitter! My first of 4 days off!  Relax take it easssss-heee-syyyyy!!  Surfing the web atm..
1	Goodmorning Twitter!!! I hope everyone had a great night and sweet dreams..have a great beginning of the day!
1	GoodMorning Twitter...ahhh nice morning stairwell SPRINT! woot! Breakfast now!
1	Goodmorning twitterers! It's mondaymorning wait the LAST Monday morning of the school year and i'm not tired!!
1	Goodmorning twitters
1	Goodmorning twitters of all countries
1	GOODMORNING TWITTERS!  getting ready, ihop, avanti, home. text. <3
0	Goodmorning twitters! This is my last day of vacation so i'm sad
1	Goodmorning twitters... I've got some things to do this morning! Writing session this evening! Im so ready for that
0	goodmorning twitters...im at dmv and the line is round the building and they dont open until 9
1	goodmorning twitterverse
1	Goodmorning Twitterville!!!
1	Goodmorning twitterville!!! What oh what to do today?!  I'm thinkin it's the day I make an official life plan... So many goals!!!!
1	Goodmorning twitterworld from the same time zone where I am ! i know it's late but it's SUNDAY ! yay  i dreamed with Joe !
1	goodmorning world
1	goodmorning world and all who inhabit it
0	Goodmorning world its Monday and the Magics lost  two bad things
1	goodmorning world!
1	Goodmorning world! what a wondeful day its going to be!
1	goodmorning world!! long day of work ahead, but grateful to have a job! 
0	goodmorning world. Up at 7 o'clock, went to bed at 1:30 my body needs more sleep than that. Daughter decided differently 
1	Goodmorning!  Blaah, today i need to do some homework to school. where is the sunshining waether there was yesterday?!
1	Goodmorning! Getting ready too go too the doctor 4 my appoiment :l then 's house later
1	GoodMorning! Hitting the gym, what about u ? Make it for your work out? Let's Gooo 
1	goodmorning! hope everyone has a terrific tuesday!
0	Goodmorning! Hope this will be a good day for me.  http://plurk.com/p/13cqp1
0	Goodmorning! Hope u slept well, I didn't. Had a nightmare 
0	GOODMORNING! I am fucking tired after only 5 hours of sleep. Also i miss Dan!
1	Goodmorning! I'm always the first one up at sleepovers
0	Goodmorning! I'm here getting some work done. No WiiFit for me this morning!  I wanted my relaxing Yoga time!!
1	Goodmorning! It is the 17th of May, the Norwegian Independence Day 
1	Goodmorning! Ready to begin a new and beautiful day  kisses
1	goodmorning!! Last high school cheerleading camp of my life..ha FINALLY!  ...i'm off to camp. byeeee
1	Goodmorning!! Two more days till the weekend.  hopefully I can get thru this dayyyy
0	Goodmorning!! Wet day in KW today
0	goodmorning!!!  grandma just left      don't know what to do today, ill probably film something, expect a new vid on my side account
0	goodmorning, at work!! 
1	GoodMorning, Hope Everyone Has A Beautiful Day Today  x
0	goodmorning, i feel a bit hungover. plus there's no food left in the house 
1	goodmorning, i have no plans for today and it feels wonderful, this is gonna be one of those lazy days 
0	goodmorning, my hay fever is acting up again.. bluhhh 
0	Goodmorning, starting a new fun day at work. Can't find anything fun to read  Tips anybody ?
1	Goodmorning, think I got back in my natural sleeping rhythm now 
1	goodmorning, up early, eating cereal with a banana 
1	goodmorning.
1	Goodmorning.  Gonna read Twilight.
1	Goodmorning. At matts. Watching degrassi, you know whats up 
0	goodmorning. i need to study.
1	goodmorning. i want to go lingerie shopping with today (via <= Definitely post pics
0	goodmorning. only not so. I am sick
1	goodmorning. work 9 to 1
1	goodmorning..
1	goodmorning..  have a nice day guys!! dont forget to go to church.. <3
0	GoodMorning... Argg too early for me
0	Goodmorning... I have a sore neck  but I'm going to watch movies all day and put back all the posters I had on the wall.
0	goodmorning...twitter twatter. haha dry. I THINK IM SIICK
1	Goodmorning/Goodafternoon guys!
1	Goodmorning--just woke up...i hope i get good news today
1	Goodmornjng
1	Goodmornorninggg my darlings, littlemissSunshine is up bright n early, I just don't understand- but getting better slowly n smiling 
0	Goodness gracious the rain woke me up... now I can't fall back asleep
0	Goodness I am tired... Ugh lack of sleep is so bad for me..
0	goodness I didn't have dinner and I had cheese on my pizza for lunch.  I need food  I'm getting some serious cramps from the dairy
0	goodness i fall asleep immediately again..i need a lot of coffee today  how I can keep myself fit in the office ??
0	Goodness i just got a scare. Brandon eating for the first time today and his burp didn't sound right. Already had his vomiting today
0	Goodness i really want to go ride bikes or run but there is no way my mother would let me
1	Goodness I'm sooooo tired. But from tomorrow through the weekend it'll be funn!
1	Goodness! a tiring day again. Just played the piano. Really soothes me.
1	Goodness! Front rowww!!!  yayy!!!!!!
1	Goodness! Where did the sun go? It was out for a little while & now it's gray again... hmm -- ah well. Back to picture editing for me
0	Goodness, why does it have to be at least one typo in ever tweet I made? *facepalm* I need food. Lunch!! 
0	Goodness. I just crashed into the tyres during go kart.My breaks didn't work  vibrates like mad!
1	Goodness. I love aunt barbs. HILARIOUS!  hehehe
0	Goodnessss. Why do I have so much trouble falling asleep before work now??
1	goodnight  ..............i really need 2 sleep
1	goodnight  haha gonna try to fall asleep cuz myspace wasn't entertaining me. lol.
1	GOODNIGHT  I should be off to bed. Love you all♥ or Good Morning, It's 4:o3.. ALSO, 2 DAYS!! til Hey Monday!!
1	goodnight  im still lol from the hangover
0	goodnight  my phone gets taken away. Sad life.
1	Goodnight  Someone's on a little bit of temper. XD See yah!
1	goodnight  text me.
1	Goodnight !!
1	Goodnight & Sweet Dreams!! XOXO
1	Goodnight / day tweeple.  I'm off to enjoy some tweet dreams
1	Goodnight and  (Go to bed, it's late =P)
1	Goodnight hope you feel better! Love you
0	goodnight no chance of staying up for your tweets 2knight!!  xo
1	goodnight get some good rest
1	goodnight all - found out the rustling that was keeping me up was a bloody huge spider in a paper bag  x
0	Goodnight all 9 followers.
1	Goodnight all see you in 6hrs! Just finished my last set of eco questions for this semester ...
1	Goodnight all!
1	Goodnight all!  ^^
0	Goodnight all! hoping for a better day tomorrow. Customer's were ruthless! tomorrow show be better. Gotta go in early
1	Goodnight all, I'm going to apply for the position of sound engineer later as the current one should be unemployed by now 
0	Goodnight all. Dentist in the morning...
1	Goodnight all. Gonna relax in bed and fall asleep listening to some podcasts
0	Goodnight all. Had fun at the horse races tonight...although didn't win anything!
0	Goodnight all.. will sleep on it tonight.. I really look too small I guess..
1	Goodnight all... my youngest son gets baptized tomorrow. For those who believe prayers welcome, all others, positive thoughts 
0	goodnight all...must try to sleep for work awaits me in the morning.
1	Goodnight America
1	GOODNIGHT AMERICA...bRIGITTE IN aUSTRALIA    X
1	goodnight and godbless my 3 followers!  xx
1	goodnight and good bye to all of you, hope you have the best of dreams 
1	Goodnight and good day everyone
1	Goodnight and Goodbye
1	Goodnight and Goodbye ?
1	Goodnight and goodbye twitterband !  See you tomorrow !
1	Goodnight and sweet dreams. Be safe, blessings! 
1	Goodnight anyone who cares  lovee youu xo.
1	Goodnight at this side of the world.
1	goodnight baby  ily a lot!
1	goodnight cyber world  bringing my a game this week yess  xx
1	goodnight dear twitter world.   the sex god or lurvee god? who will she choose? sex god please
1	Goodnight everybody
1	Goodnight everybody  x
1	Goodnight everybody! Thanks for making 1st June a day to remember
1	goodnight everybody!!! tomorrow school (I won't go)  love you all, God bless you <333
1	goodnight everybody, sleep tight and have a nice dream 
1	Goodnight everyone  .. better be ready for church tomorrow
1	Goodnight everyone  http://tinyurl.com/d3u8w6
1	Goodnight everyone  tweet you later!!!
1	Goodnight everyone about to knock out on my big bed big week ahead starting tomorrow  EXCITED !!!!!!
1	Goodnight everyone here  -xoxox-
1	Goodnight everyone!      Hopefully, this week will be epic. 
0	Goodnight everyone! Have good sleeps!  School tomorrow... AGAIN!
1	Goodnight everyone! sweet archudreams! God Bless! Take care!
0	Goodnight everyone!!!  Must go to bed, we have a 12hr sale at work tomorrow, it's going to be brutal!!   
1	Goodnight everyone, love and light to you 
1	goodnight everyone, say your prayers! 
0	Goodnight everyone, so upset about the dog, animals are not toys & need to be loved ! i miss you 
1	Goodnight everyone, sweet dreams. 
1	Goodnight everyone.  x
1	Goodnight everyone. Dodgers won. Great night. I love my girlfriend Its our NINE MONTH today. 09.03.08-forever!
0	Goodnight everyone. I hope you go to bed feeling healthier than I do. *cough* *hack*
1	goodnight everyone. top ramen before bed isnt the best idea. someone help me find a job please!
1	goodnight everyone. two more days at sea, dover, london, chicago, and home 
1	Goodnight everyone..
1	Goodnight everyone...
1	Goodnight everyone.... You too !!     See you tomorrow
1	goodnight everyonee
1	Goodnight everyoneeee  Love yall
1	goodnight everyone--wishing I was sitting back listening to this on a dock by the bay under the moon!   ? http://blip.fm/~5efsj
1	Goodnight fellow tweeters ..chat soon
0	goodnight fenway, goodnight boston. rain sucks. 
1	Goodnight friends  Ethos in the morning! Can't wait!
1	Goodnight friends!! Kisses all around
1	Goodnight from me. I hope your day is tops, and not bottoms 
1	Goodnight girls
1	goodnight goonight
1	Goodnight guys! Sweet dreams, see ya on the flip flop laaaater!  xx
0	goodnight guys.   http://plurk.com/p/11ofbr
1	goodnight guys... have a safe flight Cha and ur family too. Take some gooooood rest 
1	goodnight hon. sleep well. miss ya too
1	goodnight i say, i think i say. 
0	goodnight i will be gone for a week  (tear)
1	Goodnight ily drew and thomas! Ahh I love VFC generally!!
1	goodnight im sleepy. i had a good day  nighty hught twitterians  sweet dreams !
1	Goodnight kids! Good luck to my SD thoners tomorrow. Tear it up!
0	goodnight kisses
1	goodnight loves
1	GOODNIGHT MAGIC AND PRETTY WORLD
0	goodnight moon.. breakfast in the am at my mom's house and then work from 2 to 10
0	goodnight my cyber family.
1	goodnight my dear peeps. i will be on tomorrow. got a day off...GO ME!!! much love tweet peeps
1	Goodnight my dear twetters
1	Goodnight my fellow Blockhead friends! Tweet with ya tomorrow! Sleep well!
1	Goodnight my human friends   Go Buy the new Cash Cash Album
1	goodnight my tweeps talk to you tomorrow
0	Goodnight my tweets gotta wake up in a couple of hours for work
1	Goodnight my twiggas  Make sure say your prayers before u close your eyes and drift off into wonderland. Bless
0	Goodnight my twiggaz. Gotta hit the sack, so that I'm prepared for another work filled day...fun 
0	Goodnight New York! thanks for being so lovely. Tomorrow I head home
0	Goodnight night my tweethearts! It's well passed my bedtime. I hate Sad Sunday   Hope you sleep well. Tweetcha tomorrow
0	Goodnight ocean city maryland, ive enjoyed my stay here. Im gonna miss this place so much. 
1	GOODNIGHT OFF FOR SOME HARPERS ISLAND
1	Goodnight peeps of the internet
1	Goodnight people!
1	Goodnight people!!!! I'm going to bed...I have a HUGE Headache!!!! Hasta Luego!!!!
1	Goodnight peoples!
1	goodnight pips. sweetdreams everybody!
1	GOODNIGHT PPL
1	goodnight ppl  i'm tired. today i went at the school to do a test of math, i was amazing at the test. thanks God haha
0	Goodnight ppl i have work at 8  only a coupl hours of sleep though i'm off at one
0	Goodnight ppl i have work at 8  only a coupl hours of sleep though i'm off at one omg
0	Goodnight ppl i have work at 8  only a coupl hours of sleep though i'm off at one omg http://tinyurl.com/nytsnu
1	Goodnight ppl!! Long day tomorrow: work + studio! Have a great night
1	goodnight red balloon.  falling asleep to sugarland once again... cherry bombs and cherry wine...
1	goodnight strangers. thanks for letting me go to bed in a fabulous mood <3 oh how my hearts swells
1	Goodnight sun
1	Goodnight sweets. text me pwease  xo.
1	GoodNight Texuss.
0	Goodnight the liquor is starting to mutate into sluggishness which will most likely end in a KO. liquor and weed always win im no match
1	goodnight they didnt answer so i got to sleep now
1	Goodnight to all  gotta be at the airport way 2 damn early tomorrow
1	Goodnight to all Tweeple  Dream Big and Succeed!
1	Goodnight to all!  Tomorrow will be a great day. Always is. What's wrong? Text me. I love my new shoes, too. <3 Fly with me!
1	Goodnight to all! I an so sleepy...no more unpacking boxes tonight. Nightie night, dont let the bed bugs bite! 
1	goodnight to all.
0	goodnight to all.  i honestly don't want this day to end and begin the day tom., why? coz my mom's gonna leave and school starts again. 
1	Goodnight to you all!  xoxo.
0	Goodnight tweeperzz haha ;) Time to study
1	Goodnight Tweeple
0	Goodnight Tweeple, tomorrow is promising to be a day to remember, march 3rd-June 3rd... aaah I want to live that night again  ... see ya!
1	goodnight tweeps
1	Goodnight tweeps - I'm tired. Catch ya later
1	Goodnight tweeps!  I'm going to close the laptop & fall asleep to Roseanne.
1	Goodnight tweeps.
1	goodnight tweeps... practice was gr8 tonight... we beat the guys in every scrimmage... LL's husband was ballin tho...
1	Goodnight tweet world. goals for tomorrow: be less of a consumer and to be more happy with who and what I have now
0	Goodnight tweeters! The A has been great. Sad that I'm leaving
1	goodnight tweeterssss
1	goodnight tweethearts! lol dreaminggg.
1	Goodnight tweetplys  I'll be dreaming to hopefully to get the job at taco bells
1	Goodnight tweets... Awesome day
1	Goodnight tweets; remember life is good
1	goodnight tweetweemates
1	goodnight tweety off to real world
1	Goodnight twiggas! Haven't updated this thing but I'm tiired!! Welcome Young Beast again
1	Goodnight twit babe..and TWEET dreams
1	Goodnight twit fam!!!!
1	Goodnight Twitland!
0	goodnight twits.     Tomorrow is another day.
1	goodnight twitt fam be good C&C Stand up  and 2 every1 check them out...
