1	All a person ever needs when they're sad is friends to get drunk with. <3 Michelle, Samantha, and Antonio. 
1	All about tofu . ! Hehehehehehe .  Tofu and tofu .... Yummy . !
1	All achievements, all earned riches, have their beginning in an idea 
1	All airline tickets are finally booked and now on to wrapping up the program handbook... and enjoying my Saturday off
0	All alone  Thank god for hedgehogs.
0	all alone work
0	all alone and soooooo bored
0	all alone but not lonely, about to get movin' feel like a bum being that its nearly 1. have to do some cleaning   no fun
1	All alone in the office today. You bet your ASS I'm blasting some tunes!!  TGIF!
0	all alone lonely, I'm so lonely 
0	all alone now, 
0	all alone on a friday night
0	all alone.  still watching TWW, eating Italian chocolate and solving logic puzzles.
1	All american rejects
1	All around great effing night tonight. Looking forward to the rest of the weekend.  http://bit.ly/272RG
0	All around the world, you gotta spread the word. Thanks ATT for abusing this song  â™« http://blip.fm/~8gl9a
0	All bad All bad. I hate when nights end badly. I'm sad now
0	all been booted  Any takers for #5 LOL?
0	All Blacks Won! Yayyayaaaaaa wooooooooooooo! GaaaAAaaaaaa woohoooo i hAd too much coffee today and i cant sleeepppp!
0	all blakcs are trending.  but we need richie and dan back
0	all boys are the same.. even the nice christian ones  oh well.
0	All braced for the storm now its evening but it seems to have passed us by, not even a whiff of rain 
0	All bunged up
1	All buses need to have some sort of wi-fi , wouldn't it be so much more convinient , just got a trim for those who care 
0	all business plan, all the time... 
0	All by myself
0	All by myself now
0	all cash  and looking for trades...can't find any
0	All caught up going to town in an hour,Daughter called she's bk YAYYYYYY!!!! won't actually c her til i get bk from town tho   c ya l8r xx
0	All change here, now raining hard. Great! 
0	A''ll' change mahmind. i dont want the school ends!im so gonna miss my bestfriends/Zach and Emma!!Huhuhuh:s sad sad sad
1	All clean now  http://twitpic.com/5fc0v
0	All comfy in my bed....however feels like someone is missing
1	all crap i have to get up to 702 to bet him jezz looks liek im weatching a movie and yourhearing about tit
0	all cuddly wuddly with my brother. i was lonely today
0	All cyrillic letters disappeared from my keyboard except Ñ?, Ñ‡, Ñ…, ÑŠ, Ñ‘ 
1	all da ladiiezzz follow if you want your PuSsy Filet mijnoned!
0	All day == communication FAIL
1	all day i dream about cusa
0	all day it has smelled like rain, and looked like rain, but it has yet to *actually rain*. 
0	all day long home..wanna go out, but don't know where..and with whoo 
0	All day meeting makes me sleepy
0	All day on the VFR. RRdeva as my wing woman? Star trek movie, uncle fatti's N now, locked out. 
1	All done playing babysitter...now maybe I can get some sleep  night yall
1	all done up...gonna head down to meet my lovelies now!  ciao guys!
1	All done with packing for tomorrow!
0	all done with this day.. its only 2pm
1	All done, now im awaiting for Apprentice & Then BB to come on. Evenings all lined up  x
1	All done.  I've done all the damage I can do   Headin' home
0	All done. No more internship.
0	All done....  away to college.
1	All done...woo hoo, going home now then for a nice swim  #fb
1	All done:case, rucksack, large carrier. God knows how it will come back!  voddy and ciggy in the garden cos I've earnt it!
1	all doors and windows opened...I love openness
1	all dressed in the doggy scrubs! haha first day at my internship
1	All dressed now everything
0	all dressed up and no where to go.....
1	All dressed up and ready to get this shit over with. I'm feel pretty! oh so pretty! Yes I'm pretty and witty and GAAAAY!! Kill me
0	All dressed up with nowhere 2 go!  bf lost his id so Im stuck home. Have a headache either way so...Good night guys... & Hello advil pm.
0	All dressed up with nowhere to go and noone to go with.My bff decided to call it a night without telling me.LAME LAME LAME ;(
0	All dressed up, and no where to go  bored out of my mind!
1	All driving down to hurricane harbor
0	All DSs in bed since 9. DS4 temp 100.4 & he did not look well, hoping he does ok through the night. I don't think he smiled once today 
1	All entries are due today! We will look at them all and post the winner TOMORROW!!  www.sillygoosedesigns.blogspot.com  Good Night
1	All exams finished - nice to end on such a good psy paper  depression and free will (Y)
0	all excited at prospect of shooting large format courtesy of but sunday chores beckon  and then editing posed shoot *gulp*
1	All first name with separation in it
0	all fixed, I am now following 667 people!  but still cannot get on etsy 
1	all fixed.
0	All folk are speaking about is theman found dead on highstreet
1	All follow please! Ambition is 10k followers! C'mon people!!!
1	all functions finished ... smoothen out the edges, integrate index page, integrate templates and were done ... 1 year of work 
0	All funerals upset me...I feel for all those grieving...hes arrived, bless him,  I hope they all get through it as well as they can 
1	All going according to plan. ...Oh, joy 
0	all goldfishes died  RIP
1	all good now
1	All good things come to those who wait.even if its a long ass time.  yes I meant ass.
0	All good things must come to an edn, even a fun-filled year!!  -Still we're gna srsly make nxt yr the MOST memorable EVAH!!! *hopefully?!*
0	all good things must come to an end...
1	All gothied up and ready to go to Bar Sinister. I accented with pink.  And ouija board necklace.
1	all homework is done! hope i can go out tomoro! lol
0	All hopes crushed, no bookout. National Service ruins relationship 
1	All i am doing this summer is singing, dancing,acting,camping,and more dancing....  
0	all i ate today was some twix!   feeed feeed meeeee (weezy voice) lol
1	All I can drink from 11-1 I am gonna be an Alcoholic again!   Lol
0	all i can eat is ice cream and yogurt and drink! im bummed!
0	all I can hear in my head are the screams from the CPR call I got this morning? Maybe that's why I have this headache! Time to clean up
1	all i can hear is frankie singing  !
1	all I can hear is the rain
1	All I can say is
1	all I Can say is WOW
0	All I can taste is Mexican Spice Mix!  Ew.
0	All I can think about is that I have to be at work at 9am and I drank too much. Fun night. Taking audrey back to her hotel
0	all i cant do is connect to internet....  trip to o2 shop after college today i think
0	All I could eat ;( My tummy hurts when I eat   http://twitpic.com/6szt7
0	all I did tday was wathchin' videos n now I'm getting a headache
0	All I did was give sugars (kisses) to  Now she's thinks we're an item or something.
0	all i ever wanted
1	all i got to say is... 'battlefield! battlefield! you better get yourself an armor.' pretty good song. stuck on my head.
0	All I gotta say is "fat jesus". lool thx now I wanna head to vegas!  http://myloc.me/2ZRK
0	All I gotto say is, it ain't over till it's over. Someday I'll get my daily quota of 6 hrs of sleep back 
0	all I had to do was click it back in. I couldn't see that little sliver of a sim card   oh well! Least I'm back working now! Tweet Tweet!
1	all i have to say #mmot  !!!
1	All i have to say about the doll Domination tour is. WOw. Amazing
0	All I hear is Ghostbusters now lol. The song is stuck in my head/the game is stuck home/and I'm stuck work
0	All I hear is howling on Level 10
1	All I hear people talking about is Fuzzball and Adam Lambert  http://fuzz-ball.com/twitter
1	All I hear people talking about is Fuzzball and Cavs  http://fuzz-ball.com/twitter
1	All I hear people talking about is Fuzzball and Paris  http://fuzz-ball.com/twitter
1	All I hear people talking about is Fuzzball and Sims 3  http://tinyurl.com/dhpol7
1	All I know is that I'm still No. 32 In Australia's Top 100 Influential Twitterers and that's good enough for me!  http://snurl.com/fv9rl
0	all i need is the bride's approval and this program is good to go. in other news i have killllller heartburn and no tums
1	All I need to be happy is sun and 'good' music
0	all i really wanna do is just sleep but damn i have to prepare for physics exam tomorrow geez poor me
0	All I really wanted to do was Sleep in
1	all i say is rocks!!!
1	All I say is my lvatt better come today or hmv should look out for *ww3*lmao thank goodness iTunes are reliable
1	all i wanna do is *bang *bang* *bang* and a *boom* *kaching* and a take ya moneyyy
0	All I wanna do is dance and chill ..is that too much to ask for ??
0	All I wanna do is eat man
0	all i wanna do is play plants vs. zombies  i'm soooo bored
0	All I wanna do is watch xfiles  goodfellas will have to do I guess.
0	All I wanna do is zoom-a-zoom, zoom-zoom & a boom-boom! I wish you were here for by bday bukas 
0	all I wanna know is if I unplug my DVR if it will erase all my recorded shows!
1	All I want for my bday is a ceiling fan, It's so hot in my room. So if any1 is intreseted my bday is in 13 days. Please n thank u 
0	all i want is a pb n j sandwich and we aint got no pb
0	all i want is fic where calvin meets pete wentz.
0	All I want is to wake up somewhat healthy again.
0	all i want is to watch aquamarine, is it that difficult? 
1	All I want is you, will you stay with me? Hold me in your arms and sway me like a sea... 
1	All I want right now is Bed, Clarity and you! 
0	all i want to do i curl up and go to sleep after that exam! but i've to study for the one tomorrow
0	All i want to do is go home, drink lots of coffee, read, listen to T&S, New Pornographers and An Horse and watch friends. 
0	All I want to do is sit back & relax for a little while. How can that be this difficult?!
0	all i wanted to do todayy was tan, and of course it was cloudy out all day.  gonna go bowling tonighht though.
0	all i wanted was a pool day  where's the sunshine??
0	all ill and alone  ah well i get to listen to wicked why fellow school people listen to a 'motivational' speaker haha
1	all im sayin is imma b da 1 2 bring fubu back and make it hot again just u w8 & see ppl gone start wearin fubu again cuz of me
1	all in a days' nasism
1	All in all, a great day 
1	All in all, something like 10,000,000 g protein.  Tomorrow will probably be a good day for a fast. Oh yeah, &.. http://tinyurl.com/mjh8g2
1	All in due time  all in due time
0	All ironed out, its my own fault i should get them out of the drier when its done not 4 hours later, they'd take less ironing that way 
0	All is good. Sun's being kinda unsocial
1	all is right in the world
0	all is very far from being well in the life of kassandra  grrr
1	All is well at the midwife and mum (to be) and I are getting on well again
1	All is well here, finally got the referral to have prenatal care, still needed a follow up after the ER visit, still cramping, rest helps 
1	All is well here, just taking a break 
1	all it takes is one great shot.
1	all i've eatten today was, one pancake this morning, a sonic drink in the afternoon, and a frosty at night. pfft, 
0	all i've got to say is, urgh! Soup, hot bath and early night. boo hoo 
1	All I've hearing about is this twitters thing so I had to see what it's ab out, lol...  
0	all joking and chest puffing aside... its my loss too
0	All landings cancelled for the day due to bad weather! Poor Atlantis
1	all links should be killed in the next hour or so  bloggers have been notified...good night all
0	all live, time - work, when time for love, friends meeting party or great hardcore concerts 
1	all mom's in the world congratulations
1	All moved in and the kids LOVE the new place....
1	All moved into the new apt...pics to come soon  I love love love it!
0	All moved out of the place
0	All my best friends are in another state.  Brian is in NV, Lindsay in NJ, and Kristi in FL
1	All my blonde is gone! All brown now
0	All my clothes are super wrinkly!
0	All my clothes are too big.
0	All my crops are dead  yes im networking. . . what about it
0	all my exams are finished !! They could have gone better..  http://tinyurl.com/qpr6bd
0	all my files got deleted
0	All my fish died..    Now I only got snails. Pest snails, and 2 killer/hunter snails..   But I need to check the water before I continue..
0	All my florida ppl. Hurricane season is coooommmiiinnnngggg!
0	all my followers are spam bots  lol
0	all my freckles have come out
0	All my friends are getting wittle kittens and I want one sooo bad but they make my eyes so itchy
0	All my friends are having boyfriend issues
0	All my friends are in New York so I've just been playing Legend of Zelda for the past 5 day. Wow I have no life
0	All my friends are leaving!  13 days...
0	All my friends disappeared in TweetDeck! Coommmme baaaaaaack!  :::::
0	All my friends have plans this summer.. Guess it'll be another lonley one  FML.
0	all my friends have received their pamper hampers......but not me yet  bloody hate living out bush
1	All my go HAM Fans lets Go HAM & get 105.1 and Hot 97.1 to play TreySongz ft Gucci mane & soulja boy LOL  on NY Air plays
0	All my good feeling are crushed. Kyrstie moved. She was like my big sister. Now she's  gone.  I can't make it with out her
0	all my hangover have come at ones
0	All my hopes smashed...So it turns out they haven't started filming Arrested Development: The Movie, but instead it was a Twitter rumor 
1	All my iPhone and iPod Touch peeps that Sims 3 is out in the app store!!
1	All My Loving
0	all my music is gone.  argh, what happened?
0	All my music was erased and while I was adding them again, the computer messed up. 
0	all my neighbors feel the urge to move in/out saturdays early in the morning
1	All my old friends and new friends are here! Plus people i don't know!  Hahahaha
0	all my pancakes always end up soggy.
1	All my school is paid for.  still in shock.
0	all my shit got erased againnnn
0	all my sims keep dying. i don't think i'm playing right. idgi.
0	All my songs in my ipod got deleted. BV
0	All my tomato and dill seedlings are dying
0	All my tweets are dissapearing.   I was talking about Aunt's new kitten Simba. SO small. <3
1	all my twitters say from web when its from my phone how weird.. work 4-10 come see meeeeee
0	All my V-necks are ruined!  The collars are all messed up, too much washing?  I guess so.  They're more like U-necks now 
0	all my west coast friends that I want to sms to stave off boredom at the airport r asleep  someone im me!
0	ALL MYSPACE PROFILE VIEWS ARE LOST AND GONE FOREVER !!!  :@ :'(  , IM IN THE SHITTEST MOOD RIGHT BOUT NOW !!
1	all new idberry.com is ready to launch.. powered with the same engine from i-berry.mobi
1	ALL NIGHT ALL MORNING UNTIL I WAKE UP AND I FINISH IT UP IIGHT LOL STAY BLESS
0	All night outing... work from 12am to 6am...
0	All Nighter Again Tonight  Only 6 Days To Go and Then I Can Snooze!!
0	all nighter is never a pleasant thing.
0	All nighter leads to sending 85% of my project off to my committee with an upbeat, optimistic email. Sometimes the bear gets you, etc. 
0	all nighter. lyk majide. no kidding this time. needs more time.
1	all nighterr? I think yesss
0	all nighters aren't whatsupp
0	all of a sudden i feel like watching lymelife, i'm dying to buy it 
0	All of a sudden my #ubuntu partition stopped working. Need to fix it. Oh joy, another 3-4 hours well spent this week on fixing computer. 
1	All of a sudden my hands seem to have forgotten how to type. Wake up, hands! Maybe I need to dip them in coffee? 
0	All of a sudden we're having grey and dull weather here. SUN, COME BACK!!! 
0	all of a sudden, im feeling lethargic, sad, and irritated all of a sudden. i'm feeling some kind of way and that way isn't good at all. 
0	All of amys stuff is at her moms now
0	All of kim's nerdy weather alarms are going off and she isn't home to turn them off
0	All of my buddy lists seem so emo
0	All of my friends will be back at Flagler next semester! Except Annika, she is back in Michigan. 
0	all of my Horny Kitty's have left me
1	all of my poetry; - rieno2: coolnessâ€¦a poet  si. =] check it out, tell me watcha think. [por favor] they... http://tumblr.com/xfp21p414
0	all of my twitter friends are traveling this weekend!  wish i could leave nyc too
0	All of the ap english teachers just walked into panera. That was exciting! Lol. I'm going to miss them.
1	all of the boys & all of the girls are begging to what if you seek amy??  ;)  lol jk i get it
0	All of the debauchery I planned on having this weekend is giving me an ulcer.   #JUNEDON
1	All of the people I know (at least those who are voting) are voting for #piratpartiet. I know a lot of nice people obviously!
1	all of the people who went to my show, even for 5 minutes, you're all a  bunch of giant lovelies <3 
1	All of the sudden I got real excited about applying to Vet school
0	all of the sudden i just feel very empty, as if food couldnt fill me up 
0	All of these public figures are trying & succeeding in breaking the 1 million follower mark! I just wanna break 100!!! This is depressing
1	All of this E3 talk has me excited in gaming again. Getting that ol' giddy feeling I miss so much. Keeping my eye out for 360 & PC news
0	all of those ones were from txt  why doesn't it say so?
0	All ok now am in and working but aircon isn't
1	All orders are out the door   Anything else that comes in is going to have to wait until Monday ^.~
0	All our fish are dead!
0	All out of fish oil
1	All packed - pretty much. Think for the first time, I'm not actually thinking, 'Get me out of this city!' Progress, I know those to blame 
1	all packed and ready for Christchurch! NZ here we come!
0	All packed and ready to head out in the morning. So sad about missing my man preach the walls down in the morning
0	All packed and then realised I've not packed the macbook away....and then case is already full!!
0	All packed but not ready to go
1	All packed for #140Conf. Really looking fwd to meeting my PeopleBrowsr mates today, esp. Couple errands to do, then I'm out. 
1	All packed up and ready 2 go 2 school
1	all packed, suitcase finally closing and not at risk of bursting open on the train 
0	all papers for this semester DONE! now time to study for the tests
0	All passengers aboard the AirFrance plane have been killed......soo sad!
0	all people should be free...but there are many types of government around the world that promote freedom. Iran's isn't one of them
1	All people smile in the same language  Good Morning â˜¼
1	all photos from friday night are up on my myspace  im uploading videos now
0	All pics taken. Finally. Gotta admit that the giant oak was awesome. Forgot to take a pic on the phone though
0	all plans canceled
1	All play and no work
1	All points west...who is going?
1	All power to the Bears for saying 'can we do it again' during the Ferrero Roche challenge  I'm sure the falsetto guy wanted to say it...
1	All praise be to the "beta" label
1	all psyched up for a wintery night. hope it snows
1	All quite here so far today - Good sign, everything must be working fine  Dont you love support contracts ! !
1	all ready for a lovely day i the sun
1	All ready for my shoot in the morning! So excited! Pictures to come soon
1	All ready for tuition
0	All ready to go to the premier and just realized how under dressed I am
1	All ready to hit the park   http://twitpic.com/6bo7h
0	All repair people=the cable guy. They make you wait all day for them, making it impossible to get anything else done. so frustrating 
0	all right im done with basking in the sun....  looks like its gonna rain again
1	All right tweeples I'm calling it a night. Didnt feel well today, so I'm hoping I feel better after some sleep. Night all. Sweet dreams 
1	All right, enough of the social networking sites for the evening. It's the gaming PC I switched on after all! 
1	All right, tweeps, I'm out for a spell. Good morning, afternoon, evening to all. Have fun discussing some heavy Sunday topics.  
0	All right... looks like the iPhone just got higher on my list of stuff to get... iPod + metal water bottle in gym bag = death to iPod
1	All right...time to call it an early day. In a few minutes.  Later, Tweeps! Happy Saturday, everyone!
1	All roller coastered out, windswept, sun burnt, exhausted and happy 
1	all school work done  hopefully getting my phone back soon! xo
1	All set for Get Diverted this Saturday at Plan B in Brixton, always a great crowd 
1	All set for www.IMCTOKYO.jp   Not looking forward to the long flight though.
1	All set to go on a jungle vacation.. the adventure starts from Saturday ..hope I see the big cat
0	All settled down at work, about to cook me something to eat then call my friend to talk to him. Got homework 
1	all settled in OC
1	all shiny and clean now
0	all shops are closed tomorrow  so go shop!@
0	all shows were sold out tonight for transformers  well at least i got dennys instead with the homies. now it's time for sleep!
0	All sickly with a cold on the sofa.
1	All signed up for the gym which includes use of pool and classes! Aqua aerobics and pilates tomorrow!!
1	aLL smiLes - have a GREAT Saturday tweets
1	ALL SMILES..........................!!  SUP TWITTERVILLE!!!!!!!???
1	All 'sorted' and clean now. The landlord will never know  #House Fire
1	All sorted for wati recalls in Paris next month  now to finalise locations for 'finger'
0	All state is almost over.
0	all sun burned & sore  wishing i didnt lie out in the sun so long.
1	All That Remains is such an awesome band. Lucky for me they're on stage Metaltown
0	all thats stapling chipped my nails
1	All the aisle / window seat comments just reminded me how short I am
1	All the babies are tucked in for the night and now Joshua and I are cuddled up to watch an old school flick
0	All The Beating Drums, The Celebration Guns:  http://bit.ly/16PNeS  Another notice from Iraq     via http://twib.es/98M
1	all the best to Indian T20 team!!
1	All the bike chat, makes me think we should sign up to this http://www.bigbikeride.co.uk anyonewithbike 
1	All the clowns and free food and alcohol  heaven. Where be britneh?
0	All the color management on all my screens has decided to have a hissy fit  ...... not handy when you touching up photos !!!!
0	All the Cookies and Milk one could eat.  And I just don't like cookies
0	All the cool people are on Twitter when it's bedtime.
0	All the dancers were good at the recital had dun untill the end!  oh well!
0	All the diplomats from the G-20 conference are staying at Nemacolin! Too bad I'll be back at school by then!
0	All the Edinburgh Stafford Street markets have been cancelled
0	All the equitment is covered so its gonna be awhile lol I am gettin sleepy
0	All the fightin and name callin, i can still run 2 my sister!  nite...
0	all the girls flown away again?...alone again...
0	All the good lessons have been made crap. Supply teacher for art
0	all the good shoppings in america  going to bed
0	all the grumpy people at work are going to make me grumpy too
0	all the guitarists r out come find me
0	All the guys have gone to lunch. i'm sleepy, and tired of work  i'm gonna study math instead.
0	All the hot guys in florida are so shallow..
1	All the kids are sleeping.  Going 2 watch a movie with my hubby!
0	All the King's Men We Rule \/ Pray just PRAY
0	All the kitty cuddles don't match up to cuddles though
1	All the ladies should watch out! All the ladies of the world
1	All the little birdies go tweet tweet tweet.  
0	all the managers are gone today!!! YaY! i think i kind of miss them all
1	All the money in the world could never make me as happy as being a stay-at-home mom with my son
0	All the oil couldnt completely save the kozha kozha sepankizhangu Shyam brought  Bad Buy!!!
0	All the people I talk to are GONE
0	All the people who would actually understand why i just died a little are out of the country or in the middle of nowhere
0	All the photography classes are filled for next semester  I just decided today that i'd rather take that than scientific reasoning!
1	All the puppies are gone now  gonna get sonic and go home to our baby. I need to think of a name for her!
1	all the Rolls-Royce people are now gone, off to drive the new car around the track...all they have left behind is uneaten pastries, sweet 
1	All the rush of wedding preparation is about to begin. Quiet before the storm. I can't wait!
0	All the self proclaimed geeks following me, pls tell me how to tackle this - "Oops! This link appears to be broken." 
0	all the seniors are graduated
1	All the silly things of our society seem irrelevant. And yet, Mall of Emirates is not so far away 
0	All the snows gone
0	all the software i use for web developing doesn't have a mac version  oh no!
0	All the 'sparkle' has left my sparkling water. I feel unfizzy now
0	All the streets of Hollyweird are being blocked off due to a march. What kind of march, I'm not sure of, but I couldn't get to my apt 
0	all the teams i cheer for are last place in their div.  and now Grady's on the DL, i'm supporting the Rangers here on out (go Ian K!)
1	All the tests are OVER! Its the best feeling!
0	all the time i thought "is it faked,or is it real?"  i thought it was just a fake,a game... and  that what i thought was real.... 
1	ALL THE TIME, claaaaaaaaaaaro 
0	All the touristy eating places in London have closed.  cheers, planet hollywood, both gone.
1	all the trending topics are actual gayness. none of them are cool. apart from pens, i like to write with them.. they make me feel happy 
0	All the TV's in my house don't have any channels!    Damn those workmen down the road!  >
0	All the twits are mixed up again
1	all the update stuff makes me hungry...time for KFC!!
1	All the vers plz press 1........all the tops press 2...all the bttms press 3.....
1	All the wine is packed...need to remember to buy a bigger wine rack for the next place!
1	All the world's a stage, And all the men and women merely players..Damn straight I'm playing the lead, baby!                              
