0	Going to school in twenty minutes. I have a head-ache T_T. I'm not looking forward to meeting my angry teacher
0	going to school india is leaving
0	Going to school its all rainy and dark outside it scares me
1	Going to school musical 2day! once today&tomoros over with, it's kickback time!  ps I'm pretty damn sleepy. Its hard to keep eyes open!
1	Going to school now for my contempt fash exams. I'm going to conquer the paper! Haha! Today is going to be a great day!
1	going to school now grrrrrrrr lol coming home at dinner tho  xx
0	going to school now with my completed homework. AA after school, TFBC after that. Period finally came! so no gym today 
1	Going to school now. Ta'ra.  x
1	going to school now. will take pictures
1	Going to school on Monday. I'll represent the girls of 2nd year high school. Maybe my nose bleed 'cuz of English. haha.
0	Going to school only 9 days left  them exams
0	Going to school soon  I want it to be 4pm.. and I hope my stuff come today to make me happy !
0	going to school than soccer
1	going to school to decide which song we are going to dance  REHEARSAL!
0	Going to school tomorrow  Dang..school on a saturday..just dang. Haha. Well, Upcat review 
0	going to school tomorrow just to sew my skirt for my assignment because le teacher has to watch me do it. 2 hours on my own, at school 
1	going to school with new hair cut and color.
0	Going to school!   Well it's not that bad, at least Finals are over!  
0	Feeling shi**y...
0	feeling shite  just wanted a nice day.
0	feeling shitty and alone... i hate when people leave... I have daddy issues & I need a hug  happy? i admitted it: I'm not so perfect
0	feeling sick    watching elizabethtown
0	feeling sick  bad bad. Nighty Night buddys and followers! xX
0	Feeling sick  Going home...
0	feeling sick  i hate it!
0	feeling sick  sore throat and bad cough
0	feeling sick .... everything i touch is cold WHYYYY!!!! im coming down with a fever again its like every two weeks i get sick again.....
0	feeling sick :p not liking it, at all. my tummy hates me 
0	Feeling sick after lunch.  Tuna is clearly not agreeing with me any more.
0	Feeling sick and nauseated
0	feeling sick and overwhelmed. hay.  http://plurk.com/p/11mryj
0	Feeling sick and sorry for myself
0	feeling sick and wishing I could go home today.  But alas, it is payroll day so I may not leave.  
0	feeling sick blaaaaaaaa *be sick*of school  people would be jolly but iwont get the 100% attendce award it so cool and i wont get one
0	Feeling sick from dinner..food wasn't that great.
0	Feeling sick on my stomach
0	feeling sick today
0	Feeling sick, not so happy been crying all day feel like shyt! 
0	Feeling sick. I want eat but I can't. I wish I was home
0	feeling sick. stupid headache.
1	feeling sick. What is this, swine flu? Oh wait... that's just a myth.  :\
0	Feeling sick.. i wanna get in bed now, but i can't 
0	feeling sick....stomach hurts sooo much  prom tomorrow
0	Feeling sickish and bummed
0	Feeling sickly today! Boo  but on a positive note, only 8 days of school left!
0	FEEliNG SiCkY iCkY  PluS maDE sHiT oN mY miND !!
0	feeling siiick an im tired an my hairs driving me crazy
0	Feeling sleepy .. but got to work....
1	Feeling sleepy already - it's only 0:40. Gotta finish here and go to bed. Tomorrow is a busy day and I need to be fresh
0	feeling sleepy this theatre really sucks
0	Feeling sleepy.  May have something to do with 180 mile round trip the last two days
1	Feeling sleepy. Another late night. Good night twitter. The bed bugs have bitten me.
0	Feeling sleepy. I wish my grapes were frozen already.
0	Feeling sleepy. Loads of work to do. 20 page case to read.
0	Feeling slightly poorly, I seem to have somehow inherited s inflammatory tonsils, gah.... 
0	Feeling slightly worried! I think I may have said something bad unintentionally!
1	feeling small and insignificant..... kinda nice. peaceful
1	Feeling smooth like chrome
0	Feeling so alone.  no1 called me or a text even. I'm so sad! M so unlove..  Wish someone would give me some "HUGS"
0	Feeling so anxious right now. gtfo anxiety
0	feeling so bad and fever because of the teeth  hiks ...
0	Feeling so bad for my baby girl today. Seeing her cry just breaks my heart!
0	Feeling so blah/down about my life today. I'm blaming it on the weather.
0	gutterdom...I have lost my favourite sock
0	gutting  will max back down tomorrow? If he does would the teams care or is it really too late?
0	Gutting, and the reason I'm so against 'alternative medicine' - don't read if you have a weak stomach.  http://tinyurl.com/27q84y 
0	Guy beside me in bus needs a bath. Smelly!
1	guy beside me using sony vaio, pretty but i do love my mbp 
0	guy cried and cried and there was nothing we could do.
1	Guy I provide transport for to work treated me to breakfast as thanks. Yay golden corral!
0	Guy in India I work with delivered their baby today but he was stillborn. Sad times
0	Guy just walked into Starbucks with "Skinny" dress pants.  cringed.  He saw it. I laughed.  Now we can't tell him about Jesus
1	Guyabano shake.
0	guys - i think im going to bake some cream puffs ;) anyone up for some ?  aye aye !? ...yeah didn't think so. im not as bad as i look..
1	guys  playing cevaz on saturday 13th.. Algo Mas !!!! ... ma band
1	Guys all i did was eat & sleep all day long ! Right now just walking towards a friends place ! Windy evening
1	Guys any points / suggestions on "Why NOT to blog with a Partner?"  don't reply like "revenue sharing " but do reply something !
1	Guys are BITCHES
0	Guys are confusing.
1	Guys are jerks, I was one but caught up and found myself and checked myself, the result, better stronger faster Speed2007 
0	Guys are such players....what to do
1	guys click here to get your own free website and money to join  www.MoneyGettinMobsta.info
1	Guys eeeeeee! I don't even care what the result is, I'm free, I have been given the gift of free time! 
0	guys I think my a/c needs 2 b serviced it doesn't thro show balls anymore  don't get me wrong its cold just not freezing
1	Guys I will be attending Digital Lifestyle Apple Event here in Warsaw on 23 June - maybe I will be able to take my camera with me
0	guys i will gonna be a busy girl ( tomorrow and the next next next next day i will gonna be unactive bec. of my school
1	Guys in England bought fake viagra for 25p then sold it for �20, amazing what you learn from mock the week 
1	guys just add me up
1	guys meh follow
1	Guys please welcome fellow #twitterican #graphicartist #freelancer Spread the word and love people. Make him feel welcome
1	guys pls vote for archie here! he has to be #1!  http://bit.ly/tUOXB
1	guys puple tights are sexy
1	Guys Richard fleeshman got twitter, FOLLOW HIM 
1	guys shouldn't txt me when they r drunk :< im just confused and argg. plz someone, help me ! 
1	Guys show the video to ur wife fiance or gf and tell her to practice everyday ... after 3 weeks u will SEE and FELL the difference.
0	Guys today starts the official first day of my spending freeze this is gonna be harrrrrdddddddd  maybe that's why I woke up grumpy
1	Guys Tonight's House of Worship was the BEST 1 of all the ones this yr. I could feel God's presence.
0	Guys we need to vote! David is on the 2nd spot again!
1	going to school! yay! almost a juni, the year has gone by fast! 
0	Going to school, i feel pretty sick  
1	going to school, then working out, calendario for italiano, then uconn gamee  good luckk girliiies !
0	Going to school. AP Gov exam today.
1	going to school. bah, only a week left, not even. leave at 10 on friday, go in at 10 next monday, out at 12, THEN FREEDOMMMMMMMMMMMMMMMM. 
1	Going to school. Can't wait to watch BOF later.  bye. :-h
0	going to school. i really don't want to go and look at how much makeup work i have to do
0	Going to school. Man it's gonna be hot today. High of 90!
0	Going to school..late it seems....mann
0	going to schoool i miss my boyfrann so fucking much he needs to come over!
1	going to schoool.  already there. haha
0	going to search my cat again. I really hope that she comes back
0	Going to sedona with Tamara, her husband and his friend. Should be fun. Except my voice is gone 
1	Going to see either October 12th in Tulsa or October 24th in Little Rock. Happy birthday to me!!!!!
1	going to see tonight! wicked excited
1	going to see in White Plains  who's going?
1	Going to see 17 Again
1	Going to see 17 Again again with then tasty BWW. MTV Movie Awards tonite
1	Going to see 17 Again later and so excited!
1	Going to see 17 again. Again, with Nikki   mmmmm Zefron
1	going to see 5 concerts today. i´m looking more foward to the support bands than to the real show  going to leave at 2:30 i guess
1	Going to see a movie with my Daddy!
1	Going to see a show at a nearby festival with Denise at 6! Some group called 16 candles - should be interesting
1	going to see angels and deamons  best day with millie & rajeena
1	Going to see Bailey soonnnn I can't wait
1	going to see boss' dance recital with v
1	Going to see cousinssss
1	going to see drag me to hell with my brudder
1	Going to see Dylan Moran live
1	Going to see Ellen at the skyshow  May do some tweeting from her place, seeing I've got too much other stuff to do when I'm here.
1	Going to see Fighting today
1	Going to see Ghosts of Girlfriends Past with
1	Going to see Hangover
1	going to see hangover again with colby
1	Going to see Hangover...after drinks, obviously 
1	Going to see hannah montana the movie tonight with my sister
1	Going to see Hey Monday  omg MIKE GENTILE ftww
1	going to see Hinder and Theory of a Deadman with Matt and Kitty before going back to EC
1	Going to see JB 3D Movie today with my friend i hope its good
1	going to see land of the lost today!!!
1	going to see land of the lost with the fam <3 so happy it's the weekend!!  lovin' the summer life
1	going to see lauren soon
0	Going to see Mary and Laura for the first time in over a month! I missed them so much
1	Going to see movie Hangover
1	going to see my 7 year old cousin for the first time in 6 months!!!!!!!!!! listening to Born For This by Paramore!!!!
0	Guys who came with me to US are buying hell a lot of things irrespective of whether they need it or not
0	Guys you didnt tell me Marty assigned summer readings
0	Guys, Carlin is scared of storms to. 
0	Guys, does anyone know a place to fix iPhones in Al-Khobar or near? The power button is stuck inside since its fall yesterday. 
0	GUYS, farrah fawcett, ed mcmahon, and david carradine died within the same month.  this is making me emo right now.
1	Guys, For those who wanted to see more of the "PANTASYA series", I'm going to create a website for it, and y'all can simply bookmark it. 
0	Guys, I feel so lame with this bag of Funyuns in my bag and no one's picking up their phones 
0	Guys, i have to pack. What do i pack?! I hate packing. 
0	Guys, I really want Sims 3. 
0	guys, i wouldn't spend so much attention to t-mobile austria...these guys often make false promises 
1	guys, �liver is OFF this twittworld. waiting a fuckin call  time to act, don't you think? haha. GOTTA SLEEP WEEEEEL, i hope so!
0	Guys, im bored and im craving chocolate helllaaa bad. 
0	guys, i'm trying to get  i really am.  it's just not clicking for me.  i just don't get the big d.  i'm sorry, world.  
0	guys, my media card reader isnt working  so no more with voice videos! :'(
0	guys, please HELP me 
1	Guys, thank you! You rock! Toni is okay - she knew she'd say something ugly on air so I'm taking it for awhile.  (Jaime)
1	guys, watch this Eugene Domingo's interview with David A. and David C. ROFLOL. this is really hilarious! laughtrip 
0	Guys, you shouldn't get TS3 illegaly  (Any Version) Its not right. Buy it to support hard work! I'm ashamed 
0	Guys. I just saw a woman carelessly walking an emaciated, limping mother dog into the res. bldg next door. What should I have done? 
0	Guys. This REALLY upsets me right now.  especially, check it out please. http://digg.com/d1uDpF
1	Guys.. Follow RevRunWisdom.. Bagus2 deh wisdom wordsnya..  made my day!
0	guys.. please keep updating info about the swine'd... my tv's are not working  ty
1	Guys....for the ultimate secrets on blogging & money making online, Jason is the go to guy! Follow him n do visit his site 
0	Guys...nothing
0	guys..my sunburn is peeling and it looks like i have dry skin. WHY!?!? that's soooo embarrassing. it's not dry skin. it's my sunburn.
1	Guyz I'm gonna start saying "howdy" from now on  cause I'm a Texan girl who lives out it the country, it's just feels right ))))
1	Guyz! Follow Please?! tnx 
0	Gvu changed bus times without this guy being aware. Now I don't have my good connection in cs anymore
1	GW later anyone?  sat in the sun with bubbly and revision notes. this is nice
1	Gwan 2 Grand
0	gwanin' for a hair cut...sad times
1	Gwen Stefani � Wind It Up Another one I can't help but sing to  ? http://blip.fm/~7b21s
1	GWS PRESELY! come on people, we have to get gi number one again 
0	Gym attire today was: Puma singlet, Adidas shorts.......and black business socks and leather shoes  Lucky did not run into any cute girls.
1	going to see my cousins
1	Going to see my cuz run at central with my buddy clark!
0	going to see my dad and sick doggie  looking forward to Dollywood with Will tomorrow!
0	Going to see my dad today! his might be his last Father's day
0	Going to see my doctor tonight.  hopefully we find out whatès going on now...
1	Going to see my famiry with ash
1	Going to see my mommy tomorrow!!! I miss her
1	Going to see my new cousin for the first time!
0	Going to see my sons summer concert then back to the hospital... I hope the take my mom out of the ICU today
0	Going to see New Kids on the Block tonight, hope the weather cooperates. It's supposed to thunderstorm. 
1	Going to see Night At The Museum 2 tomorrow work  I love my job!
1	going to see night at the museum 2 with my brotha and his friend. Oh and a toy story 3 is coming out next year?!? I'M SO EXCITED FOR THAT
1	Going to see No Doubt and Paramore tonight with my sister  hope that it does not rain!
1	going to see Oliver at the Muni tonight with the girls!
1	Going to see Rubylux in brighton gig. Should be good
1	going to see SNS! then the boys are driving me home and comming over for pizza and hanging out at my house
1	going to see star trak expecting noting but amazing
1	Going to see star treck the movie i dont no what to exspect oh and mac donalds WOOP
0	Going to see Star Trek (again) tomorrow night but this time in full IMAX glory!  I hope my motion sickness doesn't get the better of me!
1	Going to see Star Trek again.
1	going to see star trek in IMAX. i'm mostly excited for seeing the Half Blood Prince trailer, not gonna lie. 
1	Going to see Star Trek with tonight! I'm excited!
1	Going to see Star Trek....
1	Going to see the 9:15pm screening of Adventureland tonight.
0	Going to see the boy soon, hope mr busman doesn't look at my pass! Rain upsets my soul greatly 
1	Going to see the Cezanne and Beyond exhibit today at the Philadelphia Art Museum! Loving the sunshine today
1	Going to see the cousins
1	going to see The Hangover today.. excited
1	Going to see The Hangover with friends
1	Going to see the hangover with lindsey
1	going to see the movie Up
1	going to see the nephew
1	Going to see the new Hannah Montana the movie, with some friends  And then we are going to get some Pizza  But now a bath 
1	Going to see the new varsity today
1	going to see the young americans perform
0	going to see top twins/thrifting/shocking pinks tomorrow *hopefully*  also think i'm iron deprived...sooo tired all the time
1	Going to see UP and im really excited about it! haha yes. im a huge nerd
1	Going to see Up at the Silver Moon Drive In!
1	Going to see UP later with my mom
0	Going to see Up today, without my Jasmine  She's too busy commuting to the desert lands.
1	Going to see Up tomorrow! I'm excited
1	Going to see up tonight.  woot
1	going to see UP with  then maggie's graduation tomorrow! so proud of my sister!
0	feeling so bloody tired plus foot is aching too  I think imma get some painkillers.
0	feeling so down right now .. i hate you DAMN HUMPREY
0	feeling so down today .. tying not to cry and feel so guilty
0	feeling so f*cking bad  my bro had a car accident (N
1	feeling so happy right now !!
0	feeling so incomplete.how i wish i could find my happiness right now
0	Feeling so lazy yet contented. I dun want classes to start.  not yet.
1	Feeling so much better today.. I think the McFly DVD cured me last night
0	Feeling so pants!! Need to sleep but in a lot of pain  miss my baby when I'm like this...x
0	feeling so restless today. Nothing exciting going on.
0	Feeling so sad for Lisa Ling's sister and friend  We should all pray for them
0	feeling so sad right now, really don't know what to do anymore 
0	Feeling so sick right now & trying to work.. This sucks! However I just bought 2 domains.. I wanted to go out so bad tonight & boy scout
0	feeling so sleepy already.  Trying to stay up to watch Bleach.  Have to work about half day tomorrow.
0	Feeling so unusefull.... Everybody is studing and I don't know anything...
0	Feeling so very unhappy. Maybe it's the estrogen deficiency in me.
0	feeling so weak and sentimental whoa
0	FEELiNG SO WORSE !! hope my colds will be gone when june starts...
0	Feeling soar today cant make it to the gym. Sorry
1	Feeling some butterflies today   Study study study contracts; gonna ace this, then on to the write-on competition for the journals.
1	Feeling some closure, and also thinks her Ativan is amazing 
0	Feeling some sort of way right now. A feeling I'm not sure I can identify...
0	feeling soo bumbed out  no #OS 3 for me yet ..noooooooooooooooo
1	Feeling soo emotional..but ain't Emo!
0	feeling sooooo gross  but ready to party on down tonight!
0	feeling sooooo sick coz i ate waaay too much sweet and sour pork and coconut rice
0	feeling sori 4maself n my sore throat!
0	Feeling sorry for all the chaps and chappettes unable to race in TT09 Superbike & Sidecars races today
0	feeling sorry for kevin  im crying right now
0	feeling sorry for my boyfriend who is in iphone tech support today.  poor fella.
0	Feeling sorry for myself co's i'v hurt my foot and i so wanna go out and can't
0	Feeling sorry for myself this morning. Had  a blast last night though - Thanks Rowan and Duncan - going to miss you
0	Feeling sorry for myself.  Have a rotten cold in the first week of my holiday from work... *sniffs and sulks*
0	feeling sorry for myself... i have to walk 2 dogs in the heat by myself  cpa's work = ruins my life for the next hour.
0	Feeling sorry for Short Boy today...both & I are heads down working...has to be by himself. At least he can do that well
0	feeling sorry for that lady with the $2million playlist
0	feeling sort of down for no apparent reason  :
1	Feeling strangely energetic and positive today. Wow.
0	Feeling stress - feels like so much need to do and not being done.
1	Gym bcus its almost summer
1	Gym class! Not doing shit, as usual. 
0	Gym closed  GRR!! Never mind, will go tomorrow  Am re-doing my roots and continuing my play-writing instead :"> x
1	Gym cross trainer 1 hour, sunday papers, Coffeeeeeeeee 
1	Gym in about 30 min, so that let's me nap for 15 minutes  woohoo
0	gym in about 40 minutes. As if I can even be bothered to go, painful feets 
