0	good luck w/job hunt! working but barely getting by myself; started new biz right b4 economy crashed. savings funds evaporated
1	MUHAZ! Smutty!  I love being a smutty, don't you?
1	yay!! Anything for you m'dear! And me and do what we can
0	On Tuesday, ate. Our classes are not suspended.  I heard UST suspended theirs. 
1	What's your PE??
0	lol all oveer the net you mean all over atlanta you havnt even seen my new place yet
1	Nope I don't  You seem pretty interesting so I added you back! Nice to meet ya!
1	haha yep ^^ hope you finish yours so you can sleep
0	 so is your face
1	 Hmmmm, then what is the correct word? 
1	awesome ... hows you
0	That's the whole hassle. I have been trying to get the Presario F700 compatible with XP. But there are always driver conflicts.
0	'cause it's Rachel's. I dont have one of my own.
1	Favorited! Thank you! I'm feeling hungry now... Aiyaya. Had fruits for dinner. And some cookies. Hahaha.
0	another bz day college, gotta mk a presntn on gibson guitar robot now   as a part of microcontrollers course
0	how have you been...it has been much too long, we used to be such good friends 
0	yaaaay Kyle!! I miss you
1	That's right about the temp here
0	oh no I'm sorry!  warning:  I'm going to wec tonight and will prob be tweeting...
1	have fun being pampered
1	it's sunny and warmish....18 C. Perfect for a day in the park listening to live Blues & Jazz
0	hahahahaha!!! I never thought of that!!!! She's not great infront of a crowd though  xx
1	Totally agree
1	Class I forgot about that. That's going on the site!
1	Which brings us back to Cage..ah now it makes sense
0	I want to come and play
1	it's an iPhone app that uses the on board GPS. I'll take some photos next time I'm out and upload them with the route
0	Can't.  My aunt will forever hold my internet hostage. She tells me to play DS instead. I'm using my dad's comp.
1	what spam are you getting?? from me?? let me know, the account was hacked into a month ago so yeah. or is it spam from me! 
0	I had to shake my head at that tomfoolery!!! I'm hungry
0	LOL mentally yes but physically no cause my tummy aches  thanks buddy
1	haha, nah, just wanted try out an idea I had for my drink. This stuff is good though!   Just gave out the recipe in my thread ;P
0	im not at home and have a stone age phone without interweb capabilities.
1	Well thats always good!
1	Good idea, but I grabbed the cheapest bottle I had! Too late! 
1	I am... butterflies in my stomach hahaha I'll call you tomorrow morning so we can meet up!  xxx
0	I know.  That's what my peeps are as well.  Unfort, I have to let my peeps go soon. 
1	thank you! check out the site, I am sure you will love it 
0	b/c i'm an idiot and didn't look at my phone til right now.
0	It doesn't help, the truth hurts. 
1	Oh yes! I had to wait an hour just to pee and I can't get my invites to work
1	Too much really slow an bad, too. 
1	y'all all are badasses & part of the tribe, Sarahs & non-Sarahs! 
0	I guess u have 2 go 2 twitter.com and look 's feed there since pics/tweets off radar in TD.
0	i knows  ...but it's more like I need to "stop not having a car, so I can drive and we can hangout"
1	well after watching that I can now say I'll certainly never buy a PS3 now... I'll stick with the 360
0	Ew! As disgusting as that sounds, someone probably shot you in the back of the head like George did to Lenny 
1	u have done a top job matelook forward 2 finished photos thanks
0	Hats, hats, hats! I miss that train station so much. Who knew you could miss a train station like that. 
0	haha really? dang..ya you should go and just not tell him lol. i went into white lime the other day but no mini ivan  lol
1	lmao! its a lot of fun.. really worth it
1	http://co0kiemallows.deviantart.com ooh.. ok...  btw, i love the pic you took of ur sis. what was ur settings?
0	 I'm still here tho! Soo it's alllll better
1	thinking? Don't hurt yourself
1	It's gonna be a suuuurpriiiiise
1	it's always nice to be around ur peeps . Wow u do have a big family  Are u going it up big for the holiday ?
1	that's what's up
1	Wow, that was a very practical lesson pal!  Thanks!
1	Cool  Ill check it out again
0	I am not sure actually, why do you have to do it? Also I cant browse the web because my Internet bill wasn't payed 
0	cheer up mamacita  ps imma reply when i wake up or rn since sleep = not on my agenda
0	dont. worry. its just supposed to scare em and brace them
0	i actually love it when its so hot i feel like im melting
0	ITLL BE OKAY noodys gonna get hurt
0	SIGHS they would be the most perfect ever
0	sniffling  blergh!! it's quite grim!
1	you're forgiven  i sent you a link about the bike run. did you get it?
1	 I should organize my flickr as well *sigh*
1	Reante is a clever girl, she can still remember life outside the screen 
1	Good morning, and welcome back 
1	Hehe...I know you like wearing your PJ  When I get up,I have to dress up straight away. Otherway I fall asleep 
1	time to work
0	I used to be a big Xara Xtreme fan, unfortunately there's nothing really like it on the Mac 
0	there are a few in Halifax... Ex-nay on the Newfies though.
1	and Freakssssssss!!!lol any room for some chocolate
0	Damn. But ok Kris if you say so.
0	We ain't even listed so that's fucked for us!
0	I knooow. Smh
1	will we be able to see 'em? The non-crap ones of course
1	I heard you got a Weiner WHistle  You should plug your new movie review site
0	furril? It's my new avatar.
1	man with a lady's voice? I missed it last night and today. And the night before.
1	I might try out for the bounce showdown   (nothing to do with cucumbers haha)
1	That was great! Absolutely beautiful. Thanks for sharing that.
0	why is she mad?! If I were you I'd be very scared
1	Thank you for the suggestion! I will be doing that tomorrow then
1	You will do great, brother. God has gifted you in such a way to bless and encourage others in worship. No worries! 
1	magtwitter y nmn pla i kc concepcion ne...  ifollow ke pa!"... Hehe
0	I didn't even feel like crying.. But reading that just made me weep like a baby.
1	hey dude, how did you like it? 
1	oooh look slike this glass trend is spreading
1	yay new show new music
1	 ok  ok ... *heads off to copy the cake pictures to do the blog post*
1	Love yours as well  Thanks
1	Life is like that Sir
1	Since they cannot find any fault with government, these issues come up. Poor Northie Medias. WHat can they do   
0	oh man i know things have to be hard on the oldest 2 they are old enough to kinda understand but be confused at the same time
1	You are so cute, Kristin. Just enjoy it! Get some extra signatures from Mr.Ford. 
1	you're welcome
1	 Thanks!!!  We are shooting another wedding with April this weekend.  Are you shooting with her?
1	awwwwww!!! ok, now i really wanna eat chocolate (*opens up the fridge*) yummM!! 
1	haha  yup. but still have a terrible headache and super swollen and puffy eyes! i dont think im going out today.ugh!
1	I want the black, the white, the blue and the grey hahha  but it's too expensive! wahah
0	kreng, i thought everyone knew what time D was leaving.my batt was dead too the whole day yday so i cudnt text. 
1	translation please.
0	 i got so teary eyed.
0	That's messed up!  It's a stupid title!
0	Cool. I took a bunch of pics during our kitchen remodel 2 years ago, but I am so lame, I haven't posted them yet. 
1	oh I think we share that feeling (you and your US conferences!
1	nope, haven't forgot. I'm just super busy this month. We will go.. I just don't know when 
0	a few people saw it played on the box and smash hits!
1	lmao....going to a friends house to revise innit
0	Hey now...I want one too
0	sure sure.. but sadly todays the last episode
0	I Thought I Had It Bad,,. 10 Assignments For Tha 15th June,. : | Ain' Started 2 Though,. : | This Shit Sucks,. 
1	dude, she is knocking Pearl Jam. There is nothing funny about that 
0	I'm moving. Today's gonna suck.
0	You can bother me. I am falling asleep
0	bad changes for me  that i don't know how i will cope with *sigh*
1	breaaaaathe. good luck  you will be fine!
1	Happy birthday to Mr. Passons
1	thank you  I'm pretty stoked!!! And congrats to you, eric, and meshak on the house!
0	Sorry about that
1	buy my book instead  hdr workshop. Available on amazon. By Pete Carr and Robert Correll. It's less tech more real world.
0	I thought you went to your friends house. Oh no...you lost Maggie!!  I'm soooo sorry
0	i freaking love and all songs of them.
1	haha. Realized that when a friend said that too... But he's just looking down cuz he's heading down the steps
1	Hey Kristen! I was wondering where you got your prom dress at the first prom on OLTL - the pink one. Thanks
1	hey whats up? oltl was so good today i am so glad that you are keepin hope! your a really good actor!!!
0	i know what you mean. i will be praying for the families
1	Is there a chance we will see your name in there???? Hope so
1	LOL! Sounds like my Hubby when it comes 2 my shows too. Hello 2 u both! Have a great night!
1	 congratulations Kris!! You did really great during the finale.
1	 Congratulations to you!!!!
1	 oh kris!kris!kris!!!!!...hope you'll visit Philippines!!!!!..please!!!!..oh btw what's your favorite color???
1	Congratulations Kris, you deserve it!! Can't wait for your album! 
1	congratulations, Kris! i love you so much. and good luck. 
1	do you want to be the Mr. Twitter Universe? we could vote for you!
1	goodluck this week! you're my favorite and i vote every week
1	http://twitpic.com/68e67 - This picture is just perfect. You're amazing Kris!
1	http://twitpic.com/68g4z - Awe all bb's are cute!  especially you!
1	http://twitpic.com/68g4z - awww  you were adorable then and you STILL are adorable know!!  luv ya!
1	http://twitpic.com/68g4z - hee hee wat a chub!  so cute
1	I believe you'll have your name on that star soon!
1	I LOVE NO BOUNDARIES... will u sing it in front of me? as in live!  *laughs*
1	i think im having a last song syndrome with your song "no boundaries". your version is so good..
1	I'm gonna post an article in our school about you!
1	me too me tooo!!!
1	Oh and don't forget to view : http://www.krisallensingapore.blogspot.com
1	What's happening in the life of the Season 8 American Idol?  Still reeling?
1	Wow! Hi Kris!Hope you get to tour in the Phils!
1	wow.. congratulations! you won!. you deserve it..
1	Yay! You made it! I'm going to vote a bazillion times next week for you! Just have fun up there
0	yeah! New Moon is gonna be good, and awww, i got unfollowed 
1	you should check out when Eugene Domingo interviewed David Archuleta and David Cook. That was so hilarious!
0	need to add a trends column in tweetdeck
1	Good Luck w/ everything! about auditioning, im sure you'll do well!! 
1	I was about to wish you a Happy one. I'm sure your son appreciates and loves you very much  it's nice out, enjoy the day
1	hey kris! just saw you in startalk!  take care.. good luck in your career!
0	hey why didnt you win, u knew what TINK was., thats not fair 
0	that sounds yummy, i'm having a salad too... If i knew all the ingredients in english i'd tell you about it, but i don't.. 
1	and I was referring to my chicken wing weakness
1	Cup o Noodles? work?
1	Havn't tried Powerpoint yet! Hopefully, I have to do tht soon considering tht I may hv to work on presentations! 
0	yea i think that may be him for real now i just looked but uh...he follows a lot of people so i'm not special
0	wow. thats highly [depressing]  i will keep you posted on both games.
1	oh.  well i <3 you too
0	I'm totally jealous. I want to see that so much
1	Black pomme t-shirts are a must. I am tempted to create one in cafepress just because!
1	I would never add the #evilduo to my follower list for fear of pollution! Of course had to follow LC.
1	There is a story behind that pic, ya know.  I'll tell you tonight. 
0	Lol, I tried but it's too dark!   I'll send you one tomorrow.
0	The relatives you live with won't share their food with you?  ... im having pizza right now!
0	no just sick!
1	http://twitpic.com/6b4v8 - Nice friends!
1	You guys and gals are awesome!!!! When can we expect a new album? How 'bout a new single (and what song)?
1	 Got TweetDeck now! Very cool and works on my mac!
1	by the way, saying yes to 2 girls while you are on the flight to visit your gf would be kinda wrong don't you think 
1	this one.  cool. http://twitpic.com/2ygpo
0	You're not on IM as much anymore! I miss u
1	I LOVE YOUUUUU RIGHT BACKKKKKK
0	btw i tried responding back a direct message but for some reason wouldnt let me.
1	Ha ha ha LOL please keep posting those - fantastic mate! Not for you though - but SO makes me giggle
1	Love this security stuff!
0	Hell yeah, I wish I was Greek now 
1	thank you for doing it
1	yes i had a wonderful day  but i can't help but wish that our prom was tonight instead of our mothers lol
0	because you are distributing the content by seeding. I have also noticed a drop in seeders.
1	No, i dont think its bad. And its very well edited, too. 
0	lol i had salad for dinner. it gave me badbad onion breath for choir  no onion for next time.
1	jogging while talking about ruby... the new frontier of fitness for the ruby hacker?  seems cool anyway
1	so far so good. still watching it
1	Hopefully I Will...Thnx
1	well if ur sellin the bb I think I should have first dibs!
1	can't wait either! It'll be awesome
1	Can't wait to see it tonite!! should be hilarious
0	it looks like the OP turned comments completely off! LAME. I was only on like, page 9. 
1	and did you get an M in before?
1	ooooo yes!  how do you get the smilies?
1	A 24 incher? I am so jealous. Mine is only a 17 incher.
1	No problem.  KC SM folks have to stay together.
1	oh yes, totally collegiate there. unfortunately I wasn't in college anymore when I discovered jello-o shots in a DC gay bar. 
1	ok... I promise to get 'some' done! lol
1	try difft church  Good % tweeple our #church, more than at tech confs i've been to. Tweets cross boundaries & draw 2gether
1	would like a mask
1	Check out their website  http://www.thewhitehat.com.ph/
0	ur just mean, very mean  LOL
0	bawww I want to see
0	cause people pee on the handles
0	I know! When I met them... I felt so huge next to them.. Towered over everyone in the pic! Sometimes I really hate that!!!
1	Yep Joe is on now too  Are you ready for tonight?
0	I've been at work since 5 this morning.
0	 That's sad....And I'll be on the Normandy beaches then!
1	http://bit.ly/3hCrKR  sounds like soo much fun - how can you possibly resist??
0	Once had to watch 'documentary' for film degree with bodies being cut up for post mortem 1st thing in the am, hungover 
0	dude steve is not giving the keynote this time  he is not well
0	well my results shud b out soon bt aint updated yet
0	there r few Dubai bashings in the documentary, maybe that's why.. 
1	was right. Kakus is where Sindhis meet Mallus. well, in terms of vocabulary 
0	Really annoying old crotchety people, I'm sure.  
1	again... For your sake... Go ole miss.
1	I am making serious efforts to go rafting w/a ols h.s. friend in Asheville NC in Aug/Sept, will look into Memphis/Miss, too 
1	stop off in atl for the cubbies!
0	I doubt I will be going to the Tweetup. I have an insanely busy week ahead of me.
0	I know I'm going next year . Sux that u work
1	it was funny
0	 I hate those days too. Hope yours gets better!
1	It's a different time zone where you are. Do you know where YOUR timezone is? Mine is in the bedtime zone
0	I got stood up, I'm bored as well 
1	haha.. I've already been back to bed once this morning myself - nothing wrong with that
0	oops you're right, I was looking at the mansfield date! I wouldn't be able to take off work either 
0	updates killing me too! Will try to bring back sun but kinds missing from here too. It must be on the Bahamas!  xoxo ttysoon!
0	Awwwww   not unusual in AR thats for sure
1	hey hey! How r ya? Woohoo to joining  I seriously get 95% of my news on here! thx on the background!
1	 Hahaha, how was it? 
0	LOL Cant  ... i was there last weekend lol...
1	LOL best idea ever. Do they have the same with Redbull instead of coffee? I'll take both
0	we all fine- ish! Bingo doing some agility & cani-x. Did back in so not much running for a year. Sorry knee still creaking
0	oh no i dont think i am. im still sick too.
0	 Lovely, I wish I have a wii .. 
0	 my awesome parade has been stormed on.
0	I so wish i cn see the boys nowww omggg  *cries*
1	are you all ready for the show to start my #BB10 tarts :p Get your #CakeInAMug
0	its boiling hot! but in the evening it gets a bit dodgey round these parts. trying to burn off belly fat & get 6pac  it too hard!
0	Is it bad that I am being a nerd fail on this one? I cant even find the calendar
0	Tweetie doesn't work? I couldn't use tiwtter without it.  Sorry
1	Dude, I was wondering if you were down with Bamboozle.  I heard you were going.  
0	Don't think i have the time, or the finances for that matter... 
1	I hadn't noticed so don't u worry about it!
0	Poor you.    Yeah I'm good thanks. Had quite a relaxing week.
1	lol, it was random. but I now have so many new McFly songs!   x
0	You just want me to be a bad person!
1	 Aw, yay.    And hey, just make it up as you go along.  Not like any of us know them anyway, right?   It's what I did.
1	I missed you too!!!!!! TTYL!!!!And thanks!
0	OMG, I did and I could feel my entire esophagus and stomach and then it gave me heart burn for a minute, that part sucked. 
1	hi. we're in a science lesson and just decided to message you to see if you reply  x
0	I had to look up mobo  *revokes own geek cred*
0	I WANNA GO.
0	i think i am talking to a sex godess only 5
1	Your pic is gorgeous
1	ditto.  love the friggin song!
0	he tweeted in the early hours, technically "tomorrow" meant Saturday 
1	I'm beginning to find that out
1	Ive got a new number too. I'll DM it to you. Give me a call. I should be down there this weekend.
0	how about I loved that life before...I loooove that show 2!!!! I'm so sad it cancelled
1	Well tell your boss I said you can go home too! Paid for!!  LOL
0	i agree with that choice. it's not possible to get YES at my house.
1	I love that song from them! I cannot wait until June 16th now after hearing the album preview!
1	good morning/evening to you   so glad to hear you're getting some nice weather.  it was gorgeous at the beach yesterday
1	Oh, don't spoil my fun, lol 
0	I m pretty much stuck at 978
1	hey lauren you are my idol i <3 u
0	Have you checked out Saraghina yet?  If so, how was it?  We went last night but they were closed at 9:30PM. 
1	cool  How many companies do you plan to control next month?
0	 I doubt it! Boo! You always leave me behind on your awesome roadtrips!
1	hahaha ok so order me some wings chopped up..
0	not the swine flu if dats wat u thinkin my tummy hurts
1	Nice to find you on here.
0	i hate work
0	really unintentional. Only meant for chago and whitney
1	Good Morning Dear
1	I completely agree about the revenge! My personal vendetta!
0	I got buuuuuurned by the ebil sun! *sniffles*
0	im sorry wifey! mostly for the cake! i would have been disappointed too!  i love cakes
1	morning wifeyy!  what u doin?
1	Rocks are always appreciated
0	Yeah me too. Celebrated by having a few peeps over (had to get rid of the j shots somehow) & got hammed passed out & now up
1	you can use twitterfox! but yeah twitter integration is becoming more widespread
1	The study is being remodelled - this is me wiring it up in preparation for that
1	deciding what to wear? it's already 2pm!
0	i know..i tried to study today but my brain said "girl, go head with all that learning.."lol..it won't work 
1	Dave, you want to see what I dish out hahaha  
1	You jerk! Hahaha, I haven't felt frustrated like that in years! Lots of good laughs today tho...  You guys come back sooooon! 
0	haha i remember when that happened to Tuck on his 1st check up it left his butt swollen for like a week cuz he was tiny  lol
1	shalom shalom!
0	i meeeeean, i already know what you look like, but can i still come to your ny twitter party? lol <3, the roomie u left behind 
1	Yay Lucas!  Congradulations
0	 im sorry i txt stuff weird. I just cant be perfect for u. :'(
1	tell liz I passed an off ramp to los banos!! Ps I miss you
0	Dammit! I missed out then
1	hello, I loved the footage of old london.. amazing to think it was mad busy, even back then! 
1	Thanks for the follow, used to live in London for 5yrs  so let me know if can be of any help 
0	what? why?
1	right now,  total jetlag. Need to get on UK time quick before week begins  How about you?
1	Thanx! and greate video founded on your blog  http://www.youtube.com/watch?v=ivjybzdXVmI&feature=player_embedded
1	still haven't seen you.
0	I'm sorry   You have to get better before Dallas!
1	cretin doesn't get used enough either.
1	does that mean it's quittin time for the natives if the chief wants to go?
1	Bizarre! Did u put the bowl right in the centre of the micro or slightly off-centre. Off-centre heats the whole dish evenly
0	coz.. arr.. Fuggeddit.. Kamplecks shtuff ittiz
1	haha...keep 'em coming...just gimme 15 mins & i'll answer all ur questions...i got nuthin' to hide!
0	i didnt want today to end at all dang it...oh well what can i do abt that now
1	LOL  playing Led zeppelin - Stairway to heaven as I reach the gates :p
0	one button refuses to stop getting clicked. self surgery didnt help either  also other parts are getting slow/dying
0	w00t! Congrats man. Wait, when did you buy Xperia X1? :-O My bad for not keeping track of it. 
1	yeah,i shud be hitting the sack within...ummm 30 mins! 
1	you must be having your wallet there i guess...  lol
0	Yeah I may as well. Sigh.
1	 only heard 4thq and OT,  right abt the time the kid w/piercing scream started up. You and JR handled that brilliantly well 
1	I haven't achieved much AAAAND i went to work, now THATS work twittering haha, I got paid to be useless yataaa  xxx
0	kriiiiista, please say ur alive, not seen u in almost a week! I'm going to be shit at coping when u go to Uni  xxx
1	well you just better make sure you are. No excuses.
1	 *Postal Procrastination*...that's a mouthful  The largest nation in the world is PROCRASTINATION, I fly there often!
1	MY FAVOURITE LETTER IS YOUR FACE
1	ohhh gooood.  in the mean time, enjoy and fap while you think of me, dahhhling. xoxo
1	those pictures may or may not be the reason you were forgiven so easy.
0	I tried clicking through to your site but the homepage isn't working properly for me under FF3/Flash 10
1	im praying baby girl  ill be there soon
1	And it'll remain a secret which of these is mine!
0	i dont care. im lonely cause my moms not here.
1	A girls gotta do what a girls gotta do . . To look purdy
1	Thanks Shelly Trish & Kristal for the nice complements! <3  It's fierce, right? haha
1	I have been smiling all morning, I think it's freaking a lot of people out. 
1	You're welcome!
0	I wish I was going to Internet Week
1	but that 9yr old and I share a bond of a great band.
1	If you're flying to NZ www.hot.co.nz is a great way to get results in aggregate.
1	Smultron? Hmmm, gonna have to go look for that. Love new goodies! 
1	yeah-which is pretty damn neat-you've been a great help  Im struggling to decide if i should start from scratch or use thesis
0	I love you, I'm going to go eat and shower and stuff. And that sucks about your internet  Ohwell, you'll be home tomorrow!
0	loserrrr  drive safe!  why did u leave me here with these weirdos
0	I'd def. agree with that analysis. Sorry that hoodrats stole your bros friends $  that's just fucked up.
1	Are you coming with us?  Call me guuuurl.
0	foreal! summer is always fucked
1	you actually have to tweet for Twitter to work for ya.
1	I loved Schoolhouse Rock when I was younger.Can't wait to see your link
1	psh you make him happy
0	hwy you my phone wont lemme do it!! >
0	 Please tweet at least once more, Ms. Bell. Although you do seem very busy. Caught you on Party Down last week!
1	if its the ruffle tank, old navy 
1	oooh...well I hope your flight is okay
0	I can't tonight  I promised Nikki I would go to the gym with her for a seriously intense session.
1	awesome! I'll check with hubby on a good day for him to keep kiddos & DM you
1	thanks! hope you have a good day  eee can't wait for sunday!!!!
1	Hrm. Okay. I'll stake claim then.
1	Hahahhaha yeah, wow. Didn't mean for it to come out that dirty. 
1	Hmm those are right haha. and hmm.. Joey, Hugh Jackman 
0	I do NOT like the looks of those ones.  PLEASE stay safe and keep us posted.
0	Now I'm scared to tweet his a$$.
1	it's easy to forget that technically-aware people are a vast minority.
1	Thannnnnk you!
1	ill chill with the twittering
0	I have a pile of books to give you to help distract you next time I'm at home. I'm sorry about this weekend
1	lol vampiiiiires!  It's sooo good. The new season starts next Sunday. It's actually like Twilight (book) but 10 Xs better
0	I take prescription sleeping pills and tranqs, I still can't sleep. I am getting a little tired. been up for 22 hours 
0	i'm not gonna lie, it was awesome, but now i can't get all the way awake  
1	Hey, I heard it was your birthday!   Hope it's a happy and creative one!  Happy, Happy Bday to you!
1	I was going to ask when you were headed to Kentucky, I thought soon.  Did you have any birthday fun this weekend?
1	zamoonda tricked by scaring her with a scary phone message  and Des can't be trusted with printing duties
0	I told u I wasn't going to tell Daniel lol he almost had his hopes up. Good thing I had enuff beers to keep him distracted
1	*is jealous* of course! haha
0	rob y kris! i just wanna say that youre the most important to me in the world. i love you so much!!!
0	hahahaa i wish i got that many
0	hey chilling on the sofa is great, i must sit in the classroom, because in austria it is 8:11 am  
1	Hey Kristen how are you? how's filming? the trailer was awesome well done  xox
0	wow. I'm upset. I loved eddings w/I was a kid. Wish there were decent authors now to replace the gems we are/will be losing
