0	Am in a foul mood after crappy morning during which all my tech has decided to wage a war against me, even my mac's not playing ball 
1	Am in a high tech bunker underneath court 14 at Wimbledon. I heart my job
0	am in da computer lab in hpt all bored
1	Am in Mid Valley now. What's nice and cheap here for lunch? Give me a buzz if you're around!
0	am in mourning
0	am in much pain from digging today. think i have to give up my lovely allotment. or swap to a smaller one. makes me cry thinking about it
1	Am in the black until my landlord cashes the rent cheque, ï¿½80 pay cheque cleared in a single day 
0	Am inceput ziua cu o briosa si cafea... still hurting because of the cold
0	Am Kelly Clarkson fan & defend her when called fat (ridic), but... oh HONEY, NO. Her dress was SO unflattering. Wow. Baby bump-esque. 
0	am kinda in a mood to write, but don't have the get-up-and-go. besides, my dr freaked me out today and now i'm depressed.  DNW
1	am kinda tired of stumbling... will stumble one moren time before i do my cross stitch...
0	am lazy coz workink hard
1	AM likin Letoya Lucketts songs
0	Am liking new twitterific iPhone app. Very sleek. & I bought Twitterfon
1	Am liking the sunnny weather
1	Am listen teh nu  "Mustard Pimp - Cherry & Kiwi EP" really amazing... Merci Baron... LOVE LOVE LOVE these French guys
1	Am locked out of my bedroom! wtf! Lucky housewifey is home to save the day!
0	am looking at the melbourne water website & our current reservoir levels.. so depressing    I think i'll go & bury my head in the sand.
0	Am looking forward to ANOTHER doctors appointment tomorrow...When i find out what's wrong with me  I bet it's nothing. Stupid blood tests.
1	am loving living back at the coast
0	Am loving loving loving the gorgeous weather, but not at the expense of my Lupins and Wisteria which seem to be wilting somewhat 
1	am loving the sunny weather a hope thats the start of the summer
0	am loving these tan lines, about to eat some tuna/ wasabi mayo wraps made by my sweetie!!! wish he was here to hang with us 
1	Am loving this song - http://bit.ly/K9Uzj  It's a cover of The Show by Lenka.
1	Am making grown men sit a test  feel the power!
1	Am new here!  - http://tweet.sg
0	am not a gd lover
1	Am not crying AT ALL  http://bit.ly/nXpnH
0	am not doing the srp/shp/whatever you call it  )))))))
0	Am not feeling that great
0	Am not having the best start to the day... going to bed late and waking up early will do that to you, sigh...  Is it bedtime yet?
0	am not in the communitychannel video YET
0	Am now a member of International Thespian Society Troupe #6492!! Now if I can only make my family stop fighting....sigh
1	Am now caught up on reading Twitter after about nine hours of World of Warcraft. (!) Helped a bunch of folks, lots of quests for me. 
0	Am now getting spam followers on twitter!
0	Am now officially sick  hope I feel better, busy week this week...
1	am off back to Prestonia tonight  then off out for birthday drinkies tomorrow night w00t ;P
0	am off bus, miss and muchly... 
1	am off on another family adventure today
1	am off to bed as I have an early start in the morening-nite
1	am off to bed now all shall twit tomorrow
1	Am off to bed now sweet dreams everyone  xxx
1	Am off to bed nw,will tweet in the morning.night 
0	Am off to have haircut! Still no chicken eggs this morning
1	Am off to the beach today for sun sea and beerio
0	am off to the playmill. It will probably be hell on earth but we need to escape! So much for my lovely day out
0	Am off. To bed  gnat bite rapidly taking over body , size of small mammal now ouch ..... It hurts ;( night all x x
1	Am officially an MBA now .....
0	Am on diet   ... after a cuppa and a small slice of cake. I'm actually contemplating going for a run !?!?!?!
1	am on msn!!
0	Am on the slow train from Fukaya to Tokyo  Ah well should be ready for a beer when I get back to the hotel
1	Am on this Sunday's episode of Ang Pinaka, 6pm QTV Channel 11. We do food!  http://plurk.com/p/vewv5
1	Am open for Cosplay commissions  http://tartan-faerie.deviantart.com/ my account there has more details! DBZ ftw!
0	Am packing up to get ready to go home. I have a horrible headache.
1	am picking my jac vanek braclet!!  But can't decide which one to pick !! :S Love or dreamer hmmmmm
1	am playing pet society
1	am plecat la "la comedie"...v-asteptam! dati un semn cand sunteti ready
1	Am plecat spre Craiova. Diseara live blogging pe Monden.info de la premii, of course  de la 8. Maine detalii  din culise si after party
1	Am proud of the Lakers, they 'earned' their win CONGRATS Fisher, Pau, Kobe n team...Coach Phil...always admired you  Good Job!!!
1	am reading a book to the kids be right back
1	Am realizing that my iced tea with Lemonade Kool Aid tastes just like the Starbucks green tea lemonade iced tea. Now I can save 2 bucks!
0	am really glad that twitter doesn't have a voice option... even my laugh sounds hoarse today
0	Am really hungry but my mouth still hurts too much to eat easily  can't wait to get these stitches out! Still all worth it though
0	am really tired of doing stuff by myself!
0	am sad  i hate that
0	Am sending good thoughts to my friend Carmi. Her s amazing doggie Shamus passed away today
0	Am seriously considering going back to bed. I think I am broken
0	Am sick  I don't like being sick. I need a holiday. let me go instead of you. I get all the mails from great escape anyway!
0	am sick and so don't want to go to work. But I have to...
1	Mornt-ing!!!! Where Have you beeen Man?  You have been missed!!!
0	cuz you ain't take me  lol
0	YOUNGEY --> what you hating??
1	I'm glad we are in the network  Pandora is amazing!
1	Hi Nick, check out latest tweet 
0	pools are closed homie..
1	Mcluvinnnnnn  wtf you doing up lol
0	Lil Girls running around people shoot'n 6 dice for no money ... jus anotha night wit dat nigga j5. if ur n pittsburg save me
1	I can't tell you that
0	I didn't see u there homes! But its all good. I missed the after party
1	thank you,  && my goodness yes! i can't wait til the summer, even tho i'm going to summer school but it'll be less stress
1	Yea. But still. I can't allow that to fuck with my success which is invitable. Did you hear that i have assembled a team?
0	Ooo, I love Tsingtao! My fave chinese restaurant served it, but they have closed now 
1	You've still left me with access - I'll pop it on there for you.
1	I have just per-ordered the EP!
0	no i'm taking it at a community college...10 weeks...today was my first day
1	lol. we going up to all HU games flow... courtside  u rollin?
1	Yess... It was actually a GREATDAY!
1	muy interesante!! I didnt know that  thought you were German or somethin lol Just Kiddin  haaa what are you up to chico?
0	That's twice this week you've got my name wrong  x
1	Well what does it take?
1	I like this dude  FOLLOW HIM PEOPLE :-D
0	Ooohhh  well you could always borrow and burn buddy. Lol
1	Heh thank you  It will be my morning work tunes at the office.
1	oops I meant LOVE...  ....... ..... Ummmm another GOOD QUESTION
1	okay, I hear ya. feelin da beat. I could see my self cuttin a rug to dis in da club 
0	USA only  lamesauce, I agree
1	i know me too. But that means school is almost done  Oh btw there isn't a meeting this friday.  Love Moni
0	Yes u do. he looks so sweet. I want2 bite his cheeks off & give him hugs and kisses. My son is not having that these days
0	awwh  well I hope you feel better soon! Get lots of rest
0	Hubs is great, youngest didn't move home for the summer   and oldest is traveling like crazy.  How are you and fam?
1	Thanks for the #followfriday luv!
0	hey love! hope yu not mad me still..
0	aww  well which came first? the alchie, partying too hardy, or the broken heart? (no, u rly dont hav to answer that, haha)
1	..Because Im so cute, I am always able to get myself out of difficult situations 
1	aww. they'll always be ppl who care abt you  just hang in there
0	and added it to his collection. i was too much of a punk bitch to ask for it back.
1	 how u doin
0	awwww  sorry. Keep ur head up Hun!
1	sometimes u need to fall hard cuz u learn from it. and u also needa hit me up
1	  MyThoughts and prayers are already with their Family and Friends...Thanks for Noticing!  x
1	 a nice quality in a man
0	 can't get in...did I miss the access code?
0	 Hey Rob, The girls who took our pics and my pics with Ethan in Pittsburgh never emailed them   Can I have a redo and more hugs?
1	 HEY! DID YOU LIKE OR BUY THE NEW EMINEM ALBUM???
0	 oh no. that sucks!!
0	 Please pass onto the New Kids how devastated we are that arent giving us Full Service .. we not worthy of Facetime so it seems
1	 Shout out to ''The F.A.F GIRLS'' in the UK baby!!!!!  xxxx
0	 Wish I could chat right now.  It's blocked on my work computer    Will you be chattin later on tonight?
1	*MORE MY SPEED THO* http://bit.ly/adsQB
1	... Shady's back...   Sorry, couldn't resist...
1	....but you have so many rewards with your life.....right?  So it is worth it?!  Have a safe trip
1	..and thanks for all the videos you post for us! You're too kind (and awesoooome
1	hope u boys get some rest tonight!! tweet dreams
1	a little late, I am in Belleville, MI - Just got home from my son's best friend Anthony's birthday party! June 25th MI  Woo-HOO
1	Ahhhh, and look at you NOW!!!! We all love you 
1	And Arizona gives LOVE to you!!
1	and so is everyone else!
1	anyone that helps put on an amazing NKOTB show, has got the full support of blockheads. 
0	aww man im not home yet just got on the train, 
1	Awww I'm sorry Rob. If I was there, I'd give them a piece of my mind for ya. 
0	awww... i'm one of the people at work.    tell the guys i said hi!
0	Awww....honey, I'm sorry....If I was in NYC I'd paint for ya for free..... 
1	awwww thanks for thinking of the allergies.....one of my 3 year old twin boys is allergic....SORBET it is
1	Be joining u in 10 then
1	Can't wait to see it, 3 days...3 shows...it's gona be a KICK A$$ weekend!! 
1	Catch some sleep youll need it
1	CLOSE ENOUGH TO CHITOWN ..TO BE CHITOWN GRL  GOING TO 60TH AND HALSTED TODAY =0
1	congrats! It is indeed a milestone  and following you is way to fun to be a waste of time. Nothin but love!
1	delayed reply but yes the guys should sing "Put It On My Tab" esp on June20th in Montreal,QC since AKON is going to be there too 
1	Glad you made it safely. Have a good one
1	glad you made your flight!  We know Davy is gonna bring it tonight!!
1	Good Knight Rob!
1	good morning hun, I'll keep my fingers crossed for you, I hate those days where ur there, but not there mentally. Good Luck! 
1	Goodnight! Hope u get the well deserved sleep/rest u need on that moving bus.
1	goodnight! I will catch you on a chat one of these days.  looking forward to it. You will be in Detroit right?
1	google the locations
1	had ICE CREAM yesterday! It was tasty   What's your fav?  I'm partial to pralines and cream... have a good one!
1	Have a safe flight.  Trick is to sleep only for a short time, this way your body won't hate u too much but u still rest  Be Safe
1	Have fun moving   Thanks for yet another addiction... LOL
1	He has landed
1	headed up to Camden from DC  went to college in Philly
0	help those out who Arent near their computer!
1	Here in Boston!
1	hey ...FROM one Sasha to another Sasha...LOVE the name  kisses....
0	Holla from CJ in Minnesota!  Can't wait for the Irvine show!  Gotta travel since you left MN out this tour!
1	hope I can catch ya when u come back.  But u know how y'all roll...late! LOL. This girl gotta be up early for work
0	Hope u have a great Father's Day...my dad isn't doing to well today, so its a rough one for me 
1	Hope you enjoy your time in LA  Have a great trip!
1	Hope you get the rest of your stuff back soon. That has to suck. Least you got your sneaks
0	I am not feeling any love from you man.......
0	I feel cheated.  I though this pic was an exclusive for me.
0	I had a great time talking w/u last nt.  Hopefully we will get our pic 2gether the Detroit show since our camera bat went out
0	i have diabetes educational class tomorrow   newly diagnosed
0	i hope so cos cant chat til i get home from work   im blocked here work
1	I hope you'll be able to grab a quick breakfast - it's the most important meal of the day!
1	I love it how you call us 'Dreamers'  But it's true, where would I be without my dreams ... grtz from Belgium
0	i missed the chat
0	I saw the archive  ...not the live though, even though I was there and refreshing 
1	I think u should follow me
1	I think we have similar tastes musically! My ipod is very eclectic...though seem 2 b mostly listening to NKOTB related these days
1	I will watch it But I need to ask u something can I dm u for a sec pleasee
1	Ice cream...yum...but I won't see my babies until 2morrow...15 hour ride home now...I'll twitpic our pic later
0	if only my phone was able too.
1	if u wanna work for The Boss, you wonÂ´t sleep. Ever. He doesnÂ´t therefore you donÂ´t 
1	If you haven't become addicted YET, trust that you will...very soon... 
1	I'm a southern girl, hon.....I'll go redneck on him for ya.   We know how to kick ass down south. 
1	im not really cooking today cause im working the evening shift ill have something microwaved
0	im on a cell phone and don't think I can go to a chat room yall all gonna leave me
1	I'm on vacation too (from teaching middle school). I know how you feel.  Isn't it great!
1	i'm tryin to send you a pic of something i made for you but can't. Get me plz.
0	I'm VERY glad you had a day off to rest, recouperate and relax (I hope) but I must say, I do miss your tweets! 
1	In Cherry Hill....in the hotel!!! I wanna see u tonite
1	In the hotel in Fairfax ready to see you guys tomorrow! You have a GREAT day? We did! Met Naughty by Nature in the LOBBY!
1	Isnt that everyday?
1	It looked delicious...maybe I will have to go get some ice cream today!
1	It wasn't Tweedeck sweetie..LMAO....The Army crashed twitter again  Aren't you proud of us??? Thank Jon for saying "naked"! LOL
1	just left my second job of the day. Hi Sasha!!
1	Let me tell you..FLORIDA would be hotter!! Just give us a chance- we want full service too!! Tell the guys!!! PLEASE!
0	like the idea of the tshirts, shame, i am not going to the full service tour!  unless i win jordans competition!  
1	Mexico is in da House!!
1	more like a secret nickname "U" .....smiles
1	n the fact thar u take the time to correct spelling errors, its like whoa! Ur melting my heart here 
1	nah...i'm good!! don't have to be to work until tuesday...whoohooo  lol
1	Nice  Thanks for that
1	nite nite Rob!! thanks for join the army  you rock!
0	no chat for me  im on my mobile
0	no me  u got a link yall rehersing tommorow??
0	NO! Im not home
1	No... I would hunt you down if the show wasn't KILLER!  GET IT?? HA! HA! I know...I'm sorry! It's late!
1	not enough lol, us UK Ladies are loving it 
0	oh snap! I have to go get ready for work!
1	Ohhh and Close to You, please 
0	omg don't let me miss this...got get son from school n will be back 3:45...I missed Donnie talkin bout his sweaty balls
1	oooh Yes please!!
1	Pineapple and ham pizza....yummo!  My hubby thought I was pregnant the 1st time I asked for that! LOL
1	Preach it, Brother 
1	remember your ROAR (@janet_j) and your butt (me) girls are here to show you a good time!
1	Rob and the Blockheads... sounds like the name of a music group
1	Rob, i know you had a stressful day, on a day thats suppose to be a resting day. but come Thursday! you'll be on TOUR!! 
1	So are u gonna be mingling at the Memphis show with these dreamers?? Cause i wanna get a pic with u!
1	Sounds easy enough doesn't it? But I can't seem to  pull myself away! I gotta leave for work in 7 hours.
1	Sounds good! I'll be letting u know 2morrow!
1	Thank GOD!!!! I was starting to panic!
0	thank you for all the pics and vids today!!  much appreciated; ur a sweetheart!  <3 <3 gotta get to bed have to be up in 4 hours
1	thanks clicking the followbutton.i won't stop working on the numbers though  ur great.glad u have your 2 foot on the ground again
1	Thanks! I am a survivor...I've totally turned my life around, and now I have NKOTB back in it...2 great kids, life is great 
1	Thanks...nice to get a personal reply
1	thanx Rob. we all give eachother the strenght we need to go on. bless you
1	That is so great!! And this Westie doesn't care - I have digital cable so I watch the East Coast feed lol
1	that's a life of an artist that's all you need. Gotta stay in touch with those contacts by any means right.
1	That's so great he's coming with you!  I'll be seeing you in Saratoga tonight.
1	tweet all u want!! who cares what some people think....we like getting your tweets
1	Ubertwitter rocks
0	ugh, I'm in the car! 
1	wasssup  how is your day going...Im wrestling the kids to finish dinner.those lil punks.
1	We love that you try so hard....and glad you're part of the Army now!!!
1	Well I could say it for a few dudes
1	What did u think about the cruise? Did u survive? You looked like ya had fun on the Lido aka Labido Deck!
1	What up ROB!! I think that is so AWESOME that u guys blew the power out!!!
0	YEA I hate that its silly 140 leters
1	Yes he is....He helped me through a lot of things and still does!!! That's why I feel peace at heart....
1	yes tell Jon that his Jongirls say hi!!!
1	You can always call me.
1	you can. it's called bubble twitter or some shit like that.
0	you won't be in dc??  I haven't slept yet. Hotels aren't home. I'm flying out in four hours too! Safe flight! ;)
1	You`re very welcome
1	your the greatest thanks
1	you're keeping me smiling while I'm doing chores
1	YUMMO  Thanks Rob!!!! You never cease to amaze me
1	Good Evening Rob! What's the email address for the blockdreamers...I got some ideas for the movement
1	Have nice day! And can't wait to see more videos  your amazing!  http://myloc.me/25e3
1	LOL THESe WEAK ASS NObOdYZ`
1	Easy...it's Twitter   Love your disc!  Makes me feel good.  Others should buy it as well...it will make them feel good!
0	So... Ummm... when can I get my shirt!? I want one!
0	I just have a lot of feelings  LoL
1	- I produce/direct/film/edit... I write... I coordinate events... I manage Don Fetti... there ain't much I don't do!
0	LOL I ate it at this place in my hometown! Sorry!
0	cause i don't like how it looks like but i heard it got everything on it even flash cause the O8 don't have flash. that sucks
1	check yo dm 2
0	Mikey  I'm sorry the pause police gettin' to u...as a blogger u shld know better babe...ignore it and keep on truckin!
1	Your in dallas, its okay go there, dont come to irving!! after four! 
0	Yeah, its all cloudy and crappy here now 
0	have fun without me
0	Who being mean to you???
0	Thiiiiiiiick! Hahhaha what u up to today! It looks wack owtside
0	damn sry I left u hanging lastnight LOL I tried to stay up with u but I  couldn't hang
1	lol... Most of the time I'm sane though... Oh well.. My friends love me
0	a lot it's her whole mixtape at least 13 songs enough to make a mixtape  she's heated too! I know her song Amazin was leaked
0	I didn't get it  I thought u didn't get mine!
1	i had soo much fun too !  i tried some of sushi..it was actually alright ! nice seeing you again tho
0	someone stole my laptop... Don't even ask... Lol
0	I feel left out because you didn't include me in the light skinned clique
1	yeah dude !
1	Thanks for fallowing me  DamnGirl - http://is.gd/AhA0 | ?http://is.gd/xUki | ?http://is.gd/xUku |
1	 Already called mine (that's pretty much it for me)
1	awesome, ^5! i got my macbook last year for my graduation 
0	Bah, it sucks. 
