1	http://twitpic.com/6u29j Its my "good friend" Wil deVry, man I miss him. He is a good friend of mine on Myspace 
1	http://twitpic.com/6u2l3 - i freakin love these ppl!  ice cream and mayonaiselol!
1	http://twitpic.com/6u3go - look, im not SO tall 
1	http://twitpic.com/6u3u6 - aha rugby game with - year 6. Great memories
1	http://twitpic.com/6u3zy - I'm here! Yay!!
1	http://twitpic.com/6u450 - LOL! I'll take that as a "no" vote to me shaving. Thanks bro.
1	http://twitpic.com/6u4lx - ...the-eiffel-tower-paris-france *EUROPA*  z.
1	http://twitpic.com/6u4om - I just passed the Prudential Center in Newark, where I met David for the first time.  http://bit.ly/9Dhtu
1	got my beef patties & kettle cooked chips
1	Got my bike working again. Cleaned and oiled it. Runs like a dream! Pity I could barely keep balance after so long!
1	got my birthday prezzie finally. its only been since February... worth the wait tho
1	got my blackberry back. Phrase of the day: It's a Jungle Out There  and we mean it.
0	Got my blood drawn. Im at school now but this shit sucks
1	got my braces off, not going to school  muahaha. studyiiing texttt??
0	got my braces off... now i get to die wearing a retainer  x a bazillion
1	Got my braces tightened today. Then I got McDonalds! HAHA  Sport tomorrow yay yay yay! Netball tryouts.. wish me luck to make the team! :l
1	Got my bro to join and Facebook. Bringing him into the social media age at 35
0	got my cable set up! WIN!  got my lock put on my door! WIN! feeling a tad neglected... FAIL.
1	Got my camera back from Canon Center // Clean Sensor at last
1	got my cap & gownnn
1	Got my car back =O everythings starting to look better
0	got my car back and excited/sad for the going away party I'm attending tonight. Dani is going back to Brazil...
0	got my car back!!! although i need to learn how to drive without power steering now
0	Got my car back, Yay. Now to find the problem, 
1	Got my car covered today and nicely washed.... happy!!  Now to figure out when to improve the sound system and get the brakes checked...
1	Got my car fixed  6 minutes later car dies....again D:
1	GOT MY CAST OFF !!!!!!!!! WOOOOOOOOOOOOO !!!!!!! I AM NO LONGER A CRIPPLE !!!!!!!!!!!!!!! YALDI !!!!!!!! :L
1	Got my coffee and I am going to start working on my family tree again!!! FUN!
1	Got my coffee and on my way back to bg
1	got my coffee. everythings good. now im waiting for 10 o'clock to roll around so i can buy some denver blink tickets!!
1	got my copy of twilight today
1	Got my counter Strike SOurce Running on ubuntu with steam
1	Got my creative juices flowing x10
0	Got my credit now. Now got to go back to college.
0	Got my cupcake upgrade for my phone this morning! But sad the Cavs where eliminated
0	Got my dad a big box of celebrations, Evan Almighty and In Bruge on DVD, can't wait to see them. So hard to buy presents for my family 
0	Got my daily votes in for the CUBIES & realized tomorrow is my FINAL vote day   http://tinyurl.com/VOTE4maria (via
1	Got my David Cook tickets in the mail today ... Getting some Rio for dinner
1	got my day off planned out: workout, library and possibly visit my mother 
0	got my days that i need off from work for concerts..boss seemed cool about it..wish i could see boys to men tho but dont want 2 push it
0	got my dog at the vet for heart surgery.
1	got my drank on tnite... semi buzzed  yay
0	got my dress for graduation yesterday. it's cute. I don't wanna leave high school. last day = tomorrow
1	Got my ears pierced today, had an eye test and got some socks  Going to wii fit, tidy up, and veg for the rest of evening  Good Times
0	Hmmm I am very stuck, I have uploaded a picture but it doesn't show up :S I urgently need serious Twitter help  lol
0	hmmm i can tell people never buy a car in the dark
1	Hmmm I guess I'll watch the third season of supernatural. On sept. first I'll finally be able to finish watching the 4th season!
0	hmmm i hate the rain
1	Hmmm I know I'm not perfect but I'm so close its scary!...Nah, I can't say that with a straight face! 
0	Hmmm i love my hair! but i am really bored! empty house tonight?  kmgnbwvngmpjcdvd
0	hmmm i miss my baby...  off to take a long bath and read.... i'll talk to you later baby
0	Hmmm I need to review my previous 3500 words, and aim to write another 4000 by the end of the day. 
1	Hmmm I think I'll play some Saturdays !!  Xxxx
1	Hmmm I think the Timezone card should go to coz she picked Eskies
1	Hmmm I want Lisa to come over...I hope she can
1	hmmm i want some cacti
0	Hmmm I want to find my Tyler this summer...but I have no idea where he'd be  a baseball game? Haha
0	hmmm idk i havent tried im guessing i could if i had to man my blue never goes all the way
0	hmmm i'm gonna look for a fuckin job! i'm sick of bein poor
1	Hmmm Jennifer Weiner has a new book coming out...curious...need Meg Cabot & Sophie Kinsella to pen something new too!
0	Hmmm just leaving work, no lunch break and no time for gym tonight 
0	Hmmm maybe it's just when one uses it in Ubuntu
0	hmmm midnight youth were just on juice.
0	hmmm might not be able to visit my dad on fathers day because they moved him to isolation
0	Hmmm my girl wont be home tonight..
1	Hmmm my tea is really hot so ima go shower, then drink me tea 
1	hmmm new moon trailer  yum. and i realised today i am actually REALLY scared of aliens.
1	hmmm new search bar on #twitter
1	hmmm new soccer boots perhaps?? i think so!! gettin them tomorrow  http://bit.ly/P8nAT
1	Hmmm nice cool rain. is not going to know what's he's missing
1	hmmm nice new song from Jason Mraz "Try Try Try"
0	hmmm not reli feeling good today.. don't know.. maybe i miss home
0	hmmm note to self... keep a closer eye on phone bills :s new phone = data = money
0	Hmmm now my tweets are  appearing twice, how nice. 
0	hmmm on mobile i have no blue who is following me . Or indeed IF anyone IS following me.
1	Hmmm Paddington Station monday morning... Oh the joy of living in London  http://mypict.me/3Txt
0	hmmm saturday night with and emmanakayama it will be a freaky girls night out i think, so regret can join us 
1	hmmm saw this thing on a commericial for sprint...seeing what its about help me if you can please
0	Hmmm shopping was fun ... It's nasty out  no clubbing 2nite ... soooooo it's dinner time (APPLEBEE'S) yummm 
1	hmmm sleep time! turtle shopping in 2 min
1	hmmm some people use strange argumentations... #nietopingaanmodus -  on
0	hmmm still can't upload a picture
0	hmmm still raining so that i means i wont be going for a run this afternoon
1	Got my ears repierced and shopping done with mama and sis
1	Got my Ebay winnings today
0	Got my EMPTY PC back.   Gotta start from the beginning.
1	got my fb user name...facebook.com/hasitha
1	Got my final grades at this school, and I'm so happy! 
0	got my first C in my college career...it is a sad day
0	got my first final tomorrow
0	Got my first job offer. It starts on Tuesday. Damn! Can't start till July 1st therefore, I have to call and see if it's still open then. 
1	got my first pledge on the phones tonight. doesn't super make the job that much more interesting, but i do feel better about it. so yay 
0	Got my first ticket last night. For parking in the wrong spot. Arghhh!
1	got my first tweet today, yeah, I'm in business 
1	Got my free Microsoft DreamSpark activation code. Now let's see what exactly is this thing!
1	Got my french listening exam today! It is at 13.30
0	Got my frst speeding ticket
1	Got my Gaga tickets today! WAHEYY! 14th July
1	Got my glasses again! My vision is better..
1	Got my grades in damnnnn I'm very proud to say I got an A n B+
1	got my groove on 2nd Sunday...good friends, good grooves and good booze. what could be better?? 
1	Got my groove on for sure!  so much fun. I love dianne
0	Got my guitar .. I got the small one, i wanted the big one  k now i have my tuner how do you tune a guitar with a tuner? o___o
1	Got my hair cut 2day, getting ready to go to a party 2nite should be good 
0	got my hair cut!!! now i'm bored stiff!
1	Got my hair cut. more revision time
1	got my hair did  i'm so excited for the beautiful wedding today!
1	got my hair done...looks good got a fringe and some purple to go with the blonde...looks good i think
1	got my hair to look kinda like taylor swift , going to ohio, happy mothers day 
1	Got my hand on "Code Complete" by Steve Mcconnell . and got an idea on how to spend the weekend
1	Got my hat
0	got my home boy back from portugal at 03:30 am teaparty to celebrate my sister's 18th b-day, saddens me she's not up to much these days 
1	got my iMac
0	Got my intell Q6700 5.2ghz last light and still didn't die.  Soo much for that i7 upgrade anytime soon
0	Got my internet connection going but still a little bit slow. Sigh
1	Got my iPhone working again. Xcode restore didn't work, but option-click and selecting the beta image in iTunes fixed everything 
1	Got my last class, then nipping into town to exchange a top 
0	got my last college show tomorrow  then the day i have been waiting for...SATURDAY
1	got my leather jacket  sooo tired. work tomorrow 12 30 to 4 30. come visit!
1	Got my license yesterday
1	Got my lines, vines and trying times album 
1	Got my MacBook back!
1	Got my mad dog face on. WHAT WHAT WHAT WHAT WHAT WHAT. (Seriously though, going walking in the park!  And then laundry? D
1	got my mcfly tickets today cant wait
1	Got my messenger buddy back, thank goodness. Was feeling a lil lost there for a bit. :/ backs to normal. 
1	http://twitpic.com/6u4p7 - Hazel safely enjoying the outdoors on her harness & leash
1	http://twitpic.com/6u4qc - me and
1	http://twitpic.com/6u5jp The real reason I don't sleep - no room for me in the bed
1	http://twitpic.com/6u5qr - the cutest twins mowing the mushrooms
0	http://twitpic.com/6u5xh - Llandudno weekend Mum and Dad used to bring us here on the way home from our hols feels sad
1	http://twitpic.com/6u8ij - so happy i got to see my old friend Katrina
1	http://twitpic.com/6u8ne Love this pic taken with  dunno why just love it haha
1	http://twitpic.com/6u8ob - Oh clean pool how i've missed you. I'm goin' in!
1	http://twitpic.com/6u8u6 - My current plumming project. Replacing whole sink. Fun huh
1	http://twitpic.com/6u901 - Finished the EDT multiply layout. Yey!
1	http://twitpic.com/6u9rm - Graduation time
1	http://twitpic.com/6uako - my nephew  a sunny day in town
1	http://twitpic.com/6ubqh - OMG THE BEST BAND EVER & YOU CANT DENY IT  MCFLY  i love you guys
1	http://twitpic.com/6ubyh - for our enviroment
1	http://twitpic.com/6uej7 - Lol just thought i needed an updated pic of me
0	http://twitpic.com/6uexx - i miss the mcfly tour
0	http://twitpic.com/6ui4j -  im missing it looks good loads of celebs there
0	http://twitpic.com/6ujqv - view from the bar...nice right? But I wanna go home!
1	http://twitpic.com/6uktj - Remember me??  Favourite night :')
1	http://twitpic.com/6uktr - This is my company for the ride home
1	http://twitpic.com/6ul1g - im in love with this guy
1	http://twitpic.com/6ul2m - we found this kitten in my backyard! jordie was holding it,look at how cute this pic is 
1	http://twitpic.com/6ulb6 - Thank you for giving us Niley fans hope!  Please don't crush it again!  I looo ...
1	http://twitpic.com/6umwn - that's me! - a photo to win a violet guitar signed by had to take a rock pic!  Not the best!
0	http://twitpic.com/6un2s - linus wants to come to ny.
1	http://twitpic.com/6une1 - tooooooooooooom  i don't know about you guys, but i loved it. *-*
0	http://twitpic.com/6unmp Bran lives in Japan now  miss her sooooo much! We'll both be Navy wives someday! *soon*
1	http://twitpic.com/6uoic - just founf this pic me and abbie in NYC!
1	http://twitpic.com/6upsz - My boyfriend won all these tickets to buy me a peegie bank  hehehheeeeep
0	http://twitpic.com/6upxr - The road to Miami..make the rain go away...
1	http://twitpic.com/6uq14 Hanging with my lil sis Lucy, her future looks bright 
1	http://twitpic.com/6uqao - Im getting one of these in a few months
1	http://twitpic.com/6uqw6 - Thanks   I am amazed everytime I look at them.  Maybe just cuz I am their Mom, but they take my breath away!
1	http://twitpic.com/6urun Introducing the all new Wat A Melon hat. Its yours for only 5 easy payments of $1.99. Reply for more details!!!
1	http://twitpic.com/6utms - i have too much energy... hmmm...
1	http://twitpic.com/6uttn - ain't she just the cutest chinese superman ice-cream lady you ever see?  no. well i love her s ...
1	hmmm strawbeery with pancakes and vanilla ice cream & fresh orange juice mmm yummy come and test it
0	hmmm that's me in a right pisser off a mood now. Foolishly booked time off to make a wee break of it too. Grrr
0	Hmmm thinking about taking back that I feel better this morning - I think I spoke to early
0	hmmm this honeymoon option i'm looking in to seems a bit impossible with all the flights
1	Hmmm this is why i moved to florida  away from all the douche bags that keep running their mouths.
0	hmmm time for a little ch131.com.. wonder if the hills is online yet!  bye bye LC.
0	hmmm Time Machine is yelling at me to back up - last time I had to close, well everything 
0	hmmm todays been a gud day 6 exams in 1 lesson  got cdb got the last 3 too do
0	hmmm very boreed  nice day might go get a tan
1	hmmm what can ferrari do umm go away and let the big boys play  lol
1	hmmm what shall i do today
1	hmmm what shall i do today its nice again but i think il read Breaking Dawn coz im in love its the best  go bk 2 skool on mon for 2 weeks!
0	hmmm what should I eat when I get off work....really wanting some harolds chickin! wish I was back home
1	Hmmm what to do today... supposed to play some Star Wars with the guys, hope that happens 
1	Hmmm what to do today...so many possibilities!
1	hmmm what to do today? oh and since twitter didnt post it, I got my ear re-peirced yesturday  why? cuz im 18 lol im so hardcore
0	Hmmm which wich is yummy! Not as good as my sushi
1	hmmm who will winn in the game of titans...The King or Superman!! i know the answer...GO MAGIC!!
0	hmmm would rather be sunbathing than stuck in here!
1	hmmm wow so me and jazz are gonna get some???
1	Hmmm"/.......Dunno what to do this week end,, think a shopping trip is in order  cant wait to go see Hairspray in London is ganna be good.
1	Hmmm, seems to have a far dapper cap than I do - wonder where I can get one? Tony? 
0	hmmm, best think about a Father's Day something-or-other for Dad... men are so difficult to buy for   it'll probably be fudge, whoop-di-do
0	hmmm, diagnosis on left computer speaker suggests blown tweeter 
1	Hmmm, didn't know our food was that bad.   (Troops aghast at Dutch food:  http://twurl.nl/gbns1g )
1	hmmm, downloading some tracks  love hello seattle
0	hmmm, getting put on the hitlist and slaughtered in mobwars on facebook... only have 1 person in my mob, maybe thats why?? 
0	hmmm, go for a jog in the middle of the day or after dr.'s later, I'm getting a shot today  nooooo Noho lesbian doctors leave me alone!
0	Hmmm, I must be busy because I did not race tonight 
1	hmmm, I need a shower to get all the mud off... best day ever 
1	hmmm, i'm boredd. tell everybody to add mee on twitter pleasee?  i will return the loveee! 
1	Hmmm, im ready for a midnight snack! 
1	Hmmm, it is time for my son to go to sleep. 
0	hmmm, looks like iPhone/iPod Touch 3.0 will be available around 11am MDT.  Too bad I won't be home till after 8pm tonight 
1	Got my mom a waffle maker (sorry A9) a couch and a disneyland pin. Job well done
0	Got my Moo MiniCards (no holder) the image is not how I set it on the website no tel number on website, contact form 404's  #moo #mincards
1	Got my mountian dew, got my big chocolate chip muffin, got not sleep ... Yup deff. Ready for churchhh  time for the flow.
0	Got my Multimedia Collage printed out today it went pixelated  I called it, My collage of photos of when we grew an extra head =D
1	got my nails did today!  they look hella cute!
0	Got my nails done..y did electric pink turn into electric peach?! Ewwwww
1	got my new camera yay  fkn awesome
1	got my new car .. ! ... 2 minutes later? my phone breaks... oh well ill DRIVE and get another tomorrow
1	Got my new cell
1	Got my new computer yesterday
1	Got my new iPhone 3G today... Christmas for techies
1	Got my new ipod touch
1	Got my new lenses....just had'em on!! yiiihaaa
1	Got my new moniter
0	Got my new phone, but it doesn't work. Sadness 
1	Got my new phone.It's the new Samsung Alias
1	got my new room  its nice
1	Got my new toy...  http://twitpic.com/69yhd
1	Got my new work shoes and bag!  Outlets are amazing haha now onto Square One...
0	got my Nick magazine today (I know my age, sod off) Harry Potter is on the cover, my poor broken heart. I can't see that movie! I'll die 
0	Got my nose pierced, what a painfull 2 minutes 
0	Got my old phone working. I miss my iPhone.
1	got my on-call arse successfully covered for star trek
1	got my outdoor backpack back from repair. Instead of going out to trash I now have it back like brand new, and all for free! pleasure 
1	got my package  finally.
1	Got my Palm Pre, first one out the Sprint store door in Des Moines! Got some envious looks from the crowd!  LOL http://tinyurl.com/qmqddo
1	got my passport back
0	got my passport picture taken. I'm SO pale
1	Got my paycheck! Yay
0	Got my pc back--everything is gone   Gonna be busy reloading it--ughh!!
1	got my permit  bonfire tonighht
1	Got my permit today so EXCITED  i want to go out driving. missing KALIB we really do connect. I'M SO HAPPY!!!
1	Got my phone back
1	got my phone back  yayy!
1	GOT MY PHONE BACK MOTHER TRUCKERS!!!!
1	Got My phone fixed. . . Yay!!!
0	Got my phone! But i got no numbers.  text me guys!
1	got my prepaid smartbro loaded for plurking..  http://plurk.com/p/1189a9
0	Got my present today! WOO! A Garmin! Too bad the bluetooth doesn't work with our phones
1	Got my prom dress! Yay! Its yellow!
1	Got my prom outfit sorted  I Can't wait
1	Got my prospectus for Anniesland will scan the dance pages for after i get back from my ballet class
1	got my puppy
1	got my report card today.  All As
0	got my results 446/600 totals to 77.66%  .....second rank...   (@ManjiriBahadur)
1	Got my rook pierced
1	http://twitpic.com/6uu2c - airplaneeee. This whole thing is gonna be soooo fun
0	http://twitpic.com/6uulw - on our way to chuck e. cheese...still feverish
1	http://twitpic.com/6uuyc - my cat
1	http://twitpic.com/6uuyj -  the baby way 2 grind
0	http://twitpic.com/6uvfc - pic of the day: I spilled hot sauce on my sweater
1	http://twitpic.com/6uwcz - Leona Valley Organics- no website info...  Great place to take kids. We had a blast.
0	http://twitpic.com/6ux7w this was last night b4 we bcame a mess! I threw up wen i got home is wat my mom said. I slept on pussy  last nite
1	http://twitpic.com/6uxcj - yellow hibiscus - for u dear nacturnal
0	http://twitpic.com/6uxcp - found this on my brothers computer...bummed me out.
1	http://twitpic.com/6uypc - Yesterday whit my old friend Johi  love u girl ♥
0	http://twitpic.com/6uyu8 - Amazing light driving home this evening, but not able to stop - passenger dissent 
1	http://twitpic.com/6uz8n - still...absolutly no idea
1	http://twitpic.com/6uz9m - Happy birthday to me!  It's over midnight here so it's my bday today.. *claps hands together*
0	http://twitpic.com/6uzds - R.I.P. Spencer - Found suctioned to the side of the filter.
1	http://twitpic.com/6uzga - me chillin
1	http://twitpic.com/6uzux - Daily dose of Alyxx Dione
1	http://twitpic.com/6v01y - road for now
1	http://twitpic.com/6v1jd - i love evening walks with rocky
0	http://twitpic.com/6v1mj - Wife's hair. She didn't want to take a pic
1	http://twitpic.com/6v1pn - aurora and i on an adventure through the woods
1	http://twitpic.com/6v2ij - pinappleness...i pulled a face so it wouldn't look as bad
1	http://twitpic.com/6v4gq - Time to leave
1	http://twitpic.com/6v5ew - these arnt even half of the books I have-didn't read em 4 nothing  jokes aside I do have strict ...
1	http://twitpic.com/6v5u0 - a guys just got a hair cut
1	http://twitpic.com/6v60w - Good, Good Music 
1	http://twitpic.com/6v6ei - ok, no foundation yet but at least it's a start. 
0	http://twitpic.com/6v6vp - I thought it was BBF
1	http://twitpic.com/6v6y1 - Ta-da!  (lol my DARE shirt still fits)
0	http://twitpic.com/6v9uw - My baby... he no feel good
1	http://twitpic.com/6va5t - This is me  Ugly me hahaha....
1	http://twitpic.com/6va63 - Do you guys agree or disagree??  I def agree!
1	http://twitpic.com/6vc2f - my sweet boy
1	http://twitpic.com/6vcdr - look what i spotted in the coldstone parking lot in San Antonio Texas last night.  gk is taking over
1	http://twitpic.com/6vckt - AliUF owning Mom at Scrabble  fun!
1	http://twitpic.com/6vdnm - and again. w| a smile
0	http://twitpic.com/6vecn - exposed film
1	http://twitpic.com/6vew9 - My new puppy, Cake ! 
1	http://twitpic.com/6vf26 - look at my niece and my cuz.
1	http://twitpic.com/6vgw5 - Last one is for
0	http://twitpic.com/6vgz7 - R.I.P Jade Ray Walker..  I'll always love you..
0	Hmmm, my half broken nail broke off completely. Looks fugly 
0	hmmm, no beach today  going out to lunch though. text me if you wants.
0	Hmmm, no more volleyball practice for me this season.....  
1	Hmmm, oh yeah, the "Jonas Brothers look-a-likes"?  .♥.belle.
1	hmmm, photoshoot day? whaddya say? 
1	Hmmm, random thoughts in my head...  spooky... 
0	Hmmm, seems this wknd has had a theme of death. Whales and family 
1	Hmmm, so it seems someone did a service using #Yamli to offer voters an easy way to locate electoral location through SMS, So Cool 
0	Hmmm. Alcohol isn't going down as well as I'd hoped
1	Hmmm. Do I respond to that email from Shintaro Kago? In Japanese?  And what do I say to him.... ?
0	hmmm. found out I can only spend the money in a certain store if I'm not mistaken...and they dunt have much.  wtb'd new compie!
0	hmmm. gee. thanks
0	hmmm. i seem to have lost my CoD 5 disc  i wanna kill nazi zombies!
1	hmmm. not soo fun anymore. check out joe jonas dancing to single ladies on youtube!!! HEELARIOUSSS  (and thats from me by the way)
0	Hmmm. Power's out... Guess I'm going to bed early!
1	Hmmm. Security and checks every 4 meters. Will be nice to leave these loud and unpleasant froggies!     on airport bus now.
0	hmmm. Seem to have lost my knitting confidence somewhat  now that I'm not #knitting blankets or scarves anymore I'm lost... Sigh.
0	Hmmm. That was unexpected. Bad news in the apple store. Can only use my developer discount online.
0	hmmm.. guess lied to twitter..No Lamar...Sorry
0	Hmmm.. Look's like everyone is off to the party
0	hmmm.. miss my mommy
0	hmmm.. not getting updates on my phone.. Sad
0	hmmm.. so bored LOL wana go shopping but have no way there nawww
1	hmmm.. text me??? 740-412-3166   sound good??
1	Hmmm.. toast or danish first??   Could be a tough day if it carries on like this...
1	HMMM... CANT REALLY EXPLAIN THE WAY I'M FEELIN RIGHT NOW, BUT ONE THINGS 4SURE, I'M  GETTIN AT LEAST 6 HOURS OF SLEEP! GNITE TWITT 
0	Hmmm... day of COD4 has developed into a day of washing and unpacking a 2 year accumulation of crap from uni
0	Hmmm... had a busy evening away from computer. Now iTunes store giving error when I try to upgrade Touch.
1	hmmm... I forget, did we JUST have a three day weekend.... cause I can't remember what a day off looks like again. We need another one. 
0	hmmm... I want 2 go 2 cali now  but im skared lol
0	hmmm... is it possible to watch Hammond AND work on my assessment?.... I'd like to say yes, but I thinkthe correct answer is No 
0	Hmmm... Maybe #Boschfail was actually #UnderwiredBraFail ... £85 call-out fee plus parts.  Why do women need bras anyway eh?!
0	hmmm... upgrade 80 songs to DRM Free for $74? I think not
1	Hmmm... Was a great day with Ivana...  I met a girl who was so handsome~~ *melting*
1	hmmm... what to do for dinner? i'm thinking some cheap and easy: frozen pizza. *sigh* at least in two weeks i'll have time to cook some
0	Hmmm.... I guess it didn't work
1	http://twitpic.com/6vh2f - I FOUND IT
1	http://twitpic.com/6vi5g - it's at hersheypark in hershey, pa 
0	http://twitpic.com/6vjht - time for a new one
0	http://twitpic.com/6vkc8 - I like ronnie second. i miss ronnie a lot though
1	http://twitpic.com/6vkye - Hangin w/ my boy Nathan at his surprise birthday party... I'm not convinced he was surprised.
1	http://twitpic.com/6vm1o - UP in 3D with such a cute movie
1	http://twitpic.com/6vmui - very pretty
1	http://twitpic.com/6vnxx - we ditched sam and eric at bowling and walked to mcdonald's.
0	http://twitpic.com/6vovs - Motown is too cute. I feel bad getting up
1	http://twitpic.com/6vqc1 - CLASSMATES! Yay, my classmates are fine. Teehee. and Monmon!! 
1	http://twitpic.com/6vqoq - morgan's hair after i made a disaster of it  haha
1	http://twitpic.com/6vqty - The answer to a crappy day
1	http://twitpic.com/6vrfa - Proudly rockin that logo with messy late night hair
1	http://twitpic.com/6vu09 - Me with my graduation cap
1	http://twitpic.com/6vua2 - Out by the pool
1	http://twitpic.com/6vupt - Me & my baby bunny..billy.
0	http://twitpic.com/6vuvf - do you have any idea how much i miss my old hair?
0	http://twitpic.com/6vvb8 i miss my cat a lot right now. she was my study buddy.
1	http://twitpic.com/6vw8p - woow all my fav artists together! i can't ask for more!
1	http://twitpic.com/6vx1k - One of the many views from my table at the Sundial...I went for the Scottish Salmon, it was amazing 
0	http://twitpic.com/6wh3a - Its worse than this now
1	http://twitpic.com/71jdi - Kumi666@patty7999 http://twitpic.com/71jjm - hahahaha  It's soooooo funny  Love it!!!
1	http://twitpic.com/73edm - You know i luv u right?  and I brought u something!  warm  hugs Mazey
1	http://twitpic.com/74pc0 - green grass, plants.. lol & the man made lake 
0	http://twitpic.com/7b735 ah fuck! ahah wow so i think we just need to give up
1	http://twitpic.com/7dipq - lol, yeah bella loves her coat  it keeps her warm and toastie.
