1	good morning tina!  did you already get some nice presents etc?  weather is quite okay here today
0	But... but... I like being mean to Caitlin. It makes me happy.
0	 in charity's arms Christina.
0	HAHAH! i got irritated last night
0	the universe doesn't want us to be together
1	hey u did the right thing if she didnt want ur honest advie then y ask u to begin with,,, GOOD ON YA GIRL 
1	 awww thank you
1	have fun  i have skool in lyk 3-4 hrs  finals wahhh
0	i can't either  i would cry. but i wont haha.
1	I shall be there  if I don't get arrested for screaming at someone. Hahaha
1	yeah but I'm not telling people to add me they're doing it themselves
1	sorrry girll ! <3  you skeeeeeet  love yaa betch .
1	starting my job tomorrow!! Keep me in ur prayers! Decided not to be afraid to succeed anymore!!  imma go & show em!
0	are you playing cooking mama I or II?? cause in the first one, there's this one recipe i can never get perfect  
1	as long as it makes you smile i am happy
0	Bad food & a bug = misery   Glad you're feeling better!
1	Good morning sunshine! How's it happening out there?
1	Just saw your "Spot the Fascist" comment...too funny!
1	They were crashing
1	I really appreciate it  I'll make sure to have all tim's videos on the site as well as any other interesting vids...
0	LOL not my leg, but my pockets are. $40 to play + $25 per bag of paint balls 
1	Hi.  I sent you an e-mail about the prefect blazer - I hope it helps...
1	  Thanks for the follow  looking forward to your words of wisdom!
0	And in my nautical pashmina afghan. My tummy was not pleased.
1	 thank you
1	awww the last few weeks of school are soo stressful But hang in there. It will be worth it in the end
0	I have to stay in and study!
0	You know the world is in lousy shape when even the burger jockeys are too dumb to do their jobs correctly.
0	okay. i just get worried a lot.  panic anxiety.
1	Keep reminding me, sweets, I'll do all I can to help you  PS if u win, will u come Swiffer my house??
0	Can we leave tonight???
1	Dude no worries , we hav higher things to look n terms of Champions league & EPL 
1	i cant begin to tell you how much i hate IE
1	most welcome
1	OMG! OMG! OMG! Now we go back! Waaaaaaay back!  hope all is well
1	Perhaps I could be of assistance  We have 2 Chocolate Bars on the Gold Coast, 1 Marina Mirage & the other Robina Town Centre
1	ps download the updated twittelator..its awesome
1	 It term seemed to fit  Besides you also like Chuck, so there you go 
1	A chocolate milkshake would have been delightful!
0	very cold here too - even poppy slept in later then usual! just gave in and cranked up the heat. I had to
1	I'm 17  you?
1	umh hard to pick but I would have to say fifteen, White horse and teardrops on my guitar  what about you?
1	you lie like a rug shut up
1	Hi, are you Jason Black from Forum Nokia? I am Sittiphol Phanvilai. 
1	If I was there... I would irrigate it for you  did that on the ambulance a lot... of course with a bag of saline
0	RE just got a ticket for talking to me in her cell. - Officer didn't demand a BJ? No hope for any of us
0	lucky. Haven't even ran all week
1	record it for your new podcast, "Days of Our Fairmount Lives" 
1	cool cool. Well I hope this one shows up and doesn't waste ur time.
0	send me one please they only have moonshine and beer here.
0	Lol. I love dogs too. I like them more than cats. I want another dog now. My last one died.
0	wish I could go to the water slide
1	yesss gui!!! see u thur gurl
1	I think I would prefer Scent & Sensibility  http://bit.ly/3wybhf
0	No one's is working! I'm gonna fail tech because of this!
1	I know..I was lazy! Thanx!
1	she come in a honda! not a nissan, but a honda! (online tongues)  Glad you enjoyed them! lol
0	that's good. Med told me nothing today.  waste of time/gas.
1	Check what out?
1	I've got it now. Thanks for leaving it out for me  How'd you end up going with it?
1	Go to gym? Not saying you need to..  Invite some friends over. Rent a DVD, play a game, clean under your bed 
1	THANK YOU!!
1	me too. i just hope i make it to wednesday!
0	awe no!!! sorry to hear that
1	be surprised   NO VIDEOS... #FULLSERVICE
1	i am in a happy place now   HOW ARE YOU???
1	ON MY WAY.
0	Story of my life, always being hungy! 
0	yes  they started the proceedings today. So sad.
1	http://twitpic.com/6f0os - thanks! that was brave ;-) nice to have a face to the words  u look great
1	Ok, this 1 is hillarious. If you're looking for a 'Jesus freak boyfr.', he may be the 1 for u  http://tinyurl.com/c85ffw
1	ohh kool ! Well next time ! Its nice out
1	My list is short; so does that mean the my God is huge too?  LoL
1	I ? this shot (and do this too) the "creative mess"   http://www.flickr.com/photos/graphiccoach/3570762682/
0	i kinda sorta bawled
0	I wish they showed my solo
1	Lol  It's like you have a cult.. haha
0	i know gurll /I did too
1	Haha read my comment loool  x on ur new vid x
1	Now I'm lost!
1	hey ssup???? howz ya???? sry about ystrdy....
1	Nice to meet you too
1	well i feel dat if he was fighting wid u its bad... but if he is ur true frnd he'll come back to u..... dats frndship....
1	will do but d person shuld satisfy d 4 S's dat i want.....
0	hope your doing okay!  love you!
0	I was looking around and there's a facebook group about Tori's boyfriend Alex, who died a few days before her. It's so sad 
1	cool, bring my grandbaby bk 4 me...   jk
0	I'm like a few blocks from you right now and I want to com say hi  this weekend was epic as usual. Miss you tons
0	Is SH working for you? For me, It says that the website is down? 
0	 Hahaha That's funny. How are ya these days? Coloring still is looking fantastic. I think Dre's in Colorado now!
0	Place called DROP in Osaka somewhere, so unfortunately will miss the LBT. gutted man. really wanted to go. 
0	I just did a search on that hashtag and it's coming up with no results!
0	it's not delusional to at least hope it goes to 7 and is really, really close 
0	two of my close guy friends both blocked me today. one said because he likes me, the other because i'm selfish.  lmao
1	Glad to be listed in anything about Jesus! Thanks for the props
1	I made the rule and broke it. LOL!! Follow no rules but mine (sometimes) is what I'm talking about.
0	u know what they are right? ahh this is so weird! she ain' t gonna remain a virgin for too long...
1	Heyyyy, I'm a....... Twitterer now     you okay?x
0	in Calgary,Alberta. At least its not a lot of snow..i guess 
0	OOC| Too bad he's not that active.
1	aww, Baby Bayani 
0	can a sista get a hand massage?  sheesh lol
0	I have something diff on my history channel
1	ha! can't wait til they get here. you took a decent pic considering the low lights. thanks for sharing!
1	Do you think so? hehehehe!
0	I am also good! Thanks. I didnt eat dinner yet!  I have to wait until 08:30pm
0	ok  i guess that you hate me a lot, but it's ok i can understand that you don't consider me as a friend i thought we were friends
1	Thats nice. My cousin just left my house. He has daughter's their all daddy's girls. So sweet
0	 I wish I was thereee
1	that sounds like a great idea. I'll keep it in mind when I finally get to go to Europe
1	nah im a simpleton, dont nobody fck wit me 
1	I love reading your tweets but it would be nice to see your lovely mug when I read them. Where's your picture?
1	Sorry man.  That's one of the few things I don't give out....yet.
1	will let you know how it works will tweet all the time btw TWEED is sweet
1	-- lol, that's cool. 
0	I think I need a shower too. Super humid here though, so the minute you step out, you need another one - vicious cycle 
1	PS It's actually hard working.. ya know if someone is a hard worker we'd say "he's a grafter...."
0	no hello kitty for mr lee?
1	Congrats!!!!    I <3 my house.
1	Hey Cookie! Congrats now that we graduated. I knew it! That you had a twitter page.Anyways please keep in touch.
0	Lucky! There is no sign of the sun here.
0	 awish reallly hope you get better  me i just woke up really gonna have breaks fast than studyyyyyyyyy
1	everythings been awesome - been really hyper , how about you sweetie?  hows life (: ilusfdmmm+missedyoumoree x
0	Hey...Sorry.... I have to go...  Talk to you tomorrow ok?
0	I know!  Maybe I was born with a little of self-confidence. Oh yeah, I didn't know you knew Sasha. I just knew both..
1	Thu you fell for that it seems. You sir, are far dirtier than I. 
0	i think it'll be a lonely few hours  hopefully plenty of nerds to keep me entertained aha
0	I was in hollywood on Mon morning n wanted 2 hit u up 4 an aroma cafe pigout but had 2 head back 2 OC for work ish  ugh..
0	back 2 vegas thurs  man..well..soon as i spend some time in LA for more than 72 hours...we r raiding the dessert bin
1	yeah I like seeing pictures
1	now I wouldn't get THAT crazy.
1	Gosh, yes!  Haha. I love them. Their sound is so distinct, or rather, the voice. I can recognize it anywhere. Hee.
1	haha well he's or now better to say they are trying lol  Alexa is fun though - ha gives false hope I see
1	Praying for new card releases at the weekend  #packrat
1	I asked Kristian to take home your books since he lives near the school
1	mum told me "never say never" but I do not think I'll buy N97. Too weak hardware and unsexy UI - Plus, OVEEERRR PRICED  IMHO
0	*bangs head on desk*
0	*sigh* knew it was too good to be true.
1	 lol he does love spahkly gold things....
0	i didnt get no comment on skylars pic
1	i sent them 1 pic per email  so that way you will get it ..
1	LOL yeah he fills in for Rob on keyboards and was on chat earlier in Blockdreamers   Oh is this THE Davy?!?!
1	OMJ BB!!!!!!! Love ur new pic
1	OMJ... BB thought u were avoiding twitter so u dont' get any spoilers
0	I'm alive almost but live hahah xD i let U a gift in my fotolog  (hope you like it) i miss U too!!
0	i don't think it has  sorry we tried but the girl runs that page doesn't really care i guess
1	 i love ur advice! i never leave home without some good tunes.  ...and the curls, well...  i tied em back. Lol.
1	Enjoy your nap.
1	Good morning
1	Yes VERY long! I gave it up to God, so if its meant to be, it will be 
1	definitely fosho! have fun working out, and always.....LET'S GO LAKERS! *clap*clap*clap*clap*clap!  
0	thats wussup girl,how long did ya live there for? i neva been down there sadly  i wanna go tho i hear its nice.. and warm lol
1	sweet. tysm - now if only I could pop over for a personal shopping trip and abuse your discount
1	I've seen every episode so man times that its the perfect background noise for falling asleep...and a funny one as well
0	cool! why didnt ya follow me!
1	you will be fine  have faith and pray on it, and I am sure you will survive
1	Get 100 followers a day using www.tweeterfollow.com Once you add everyone you are on the train or pay vip
0	 sad day. I was lucky enough to realize it before I got out of the parking lot.
1	I am doing regular tix and I think judith may meet us there since she will be in NY for work alrdy this week
1	I'll give a kiss on the cheek and a big bear hug for you !!! I'm hoping to get some facetime before the show
1	Jon put it out there, so let him tell us   So I wonder who it would be.. My money is on Jon, it's always the quiet ones!!
1	Hi, I'm sorry for not following before.. As I said, it won't happen again 
0	thinking of you...  I miss you .. I need you but your not talking with  me anymore.. so im sad
1	Haha, the majority of these things are better left secret! 
1	They need an additional document! Start looking
1	george joshb and joshh at mah house  allll nighter comin our way
1	LOL It is hard for me 2 choose but Shit on the radio and Tear it up stand out a little more.
0	- Advil PM?? Hope you feel better
0	http://twitpic.com/53ul1 - me too, but I live in Hungary! 
1	Happy Birthday you
0	my car has black leather interior too  i hope its not like this for prom lol
1	no my dear, it is totally ubderstandable. U have new loves in your life! 
1	hey! I loved Stat Trek too! It was great!! Now I'm reading the book!  I'll follow you too!
0	You'll always have me, my friend 
1	Oh thats Ok, I will still go with that option...lol 
1	ah you're just reading them all again? i read them all twice too
0	 Clean Me!
1	no problem
0	now im just sad
1	FAMILY GUY
1	Such is the reason I am very very happy I don't have a credit card
1	I love Skittles - the ones in the red bag. Chex Mix is good, too. 
0	you must be exhausted  i make really stupid mistakes when im tired too..
0	I am lost. Please help me find a good home.
1	Thanks   If you're ever really looking for a pup, I know some great groups in town that have LOTS to choose from..
1	you're a natural!
1	great pic. Late night tweeting and Larry David will make u do strange things.
0	i cant believe our hotel is booked man
0	OK, thanks. Have to keep looking, very tedious and almost all of Norfolk places on Holiday Rentals are via Hoseasons 
1	I'm a real person
0	we keep getting pet days  but i heard the weekend is to be fab !!! wedding how soon again ?
0	YA I KNOW AND WE HAD NO CLASSES  DEPRESSING
1	awee no way you got tss to play at your party?  luckyyy i want them to play at my debutante eww i dont like dinuguan! lol
1	Hahaha, you all are hilarious.  I'm going to bed now, so nighty night!  
0	i miss you so so much way more and awish  its okay me to you know studying xp ilusdfm
0	i miss you way more  we have not talked in ages how are you?
1	I'm doing great!
1	lmao okay then xD hahaa big stupiid ? well i agree xD aww yaay  iluu <3
1	pshhtt im not giviingg upp.&arent you supposed to be sleeping?  mee <3's you moreee
1	pshhtt whateverr xD ahah okii.  i dont want you getting busted xD iluu
0	i'm with you - i finally get a break from this conf. call!!  only to start up again at 1..
0	Me too  It's no fun. Plus, we need more money for future tour.
1	your email or my email must have problems coz ive still not got that mail haha bless twitter tho for good communication
0	wow, that's too bad  I was thinking maybe you could taste-test cookies or something like that ;) Hope you find work/job!
0	Sorry to hear about your Grandma  sending you hugs!
1	hahaha oh you..
1	Couldn't agree more
0	Crazy man! If its proper rain then yes, I agree with you - its that 'orrible fine stuff here   Happy shopping!!!!
1	Good morning to you, kind sir 
0	I must admit I miss the seaside, used to live 10 mins walk from Eastbourne seafront, childhood home was on Sussex Downs 
1	lol thanks  what will I drink then?:p
1	one can love if the love is materialised and not a thought in the air
0	sounds good! I'm like 1st 3 overweight whatever that works out as  had to buy new trousers today. Got 2fat lol
1	We will see!
1	doh! Butt tap iz little scary
1	rise and shine
1	The chocolate spread sounds delicious
1	Yeah, it'll be a blast.  It's inside an actual theater, I don't even attend class on campus.  
0	I know what you mean about wanting to stay in bed in this grey weather.
0	Thu instead? 4 is too late
1	he was kinda busy yesterday. Hi there cutie cookiezmama
1	ok, how sweet was that????  thank youuuuuuuuu
1	I'm good thanks
1	it blocks me, when I do like 50 tweets per hour, i guess... 
1	same here, hun, still feeling dumb, as if smbd hit my head with smth heavy, lol but I'm ok  lol
1	 Good afternoon and its lovely here as well hunny
0	She hasn't been on all day  xxxxxxx
1	the pepsi was fantastic just as I remember     You won't convert me baby ... sorry to say !!!
1	Its private to keep out lurkers and encourage a sense of community. I'd love it if you became a member too
0	Will do. I LOVE Penzey's - sad the mag is gone.  Hopefully, someday then will be able to bring it back.
0	I am sorry for your loss.  My thoughts & prayers are with you and your family. ♥
1	You can do it!!!  Have a fun time golfing
0	 Agreed as well! It's still a treat to listen to. Sad they disbanded afterwards
0	the next day?! i dun think the doctor gave me enough pills to last the entire holiday  they run out on the last day
1	lol i feel like a nerd reminiscing.  i know it was just so real and fun to see. i should get to work.
1	lol i loved the eric jessica random love.  oh i felt bad for ed.  if you want to get into love we'll go onto 'til death.
0	i am really sorry  but dont worry i dont think he meant it in an mean way.
1	Aww..thanks! && ur even cool-ERRR!
1	morning dream bugg  whatsup?
1	Our exam was on tv dramas and we had to write about how doctor who represents gender.
0	so sad people are dying  http://bit.ly/11ehfT
1	Why thank you. I just speak my mind
1	Have fun at the BAFTAS!
1	Stephie I miss you.
1	i knew about but he needs a personal twitter  god, i'd love that.
1	i miss you too.  ill be back in a couple months.
0	strange definition of out and about though - central London only.   Why no proms activity in Devon? Or Cornwall?
0	I miss you by the way.
1	I think you put the message in the subject line of the MMS
0	I wont sing anymore
0	you think that now....give it 2 weeks! i agree working in manhattan is amazing but the commute SUCKS!!!!
0	yeah I know! He was nervous! Poor baby   get well soon
0	that twitterific tweet was not from me
0	 my arm hurts. hit me 4 times in the arm for no reason!
1	dead right. Have a great evening
0	lol, seriously any watch at cost price, except SS Daytona which cost me full pop 
1	they were probably all bots, upset you didn't follow them. LOL. Don't worry about it. You rock. 
0	Wondering why everything always has to revolve around sex... *I thought I was the only one missing the romantic courtship
1	Now that you mention it ...
1	pulling my mom's battery did the trick. Her phone was having the problem not mine  thanks for ur help
0	yeesh! sorry. but i can't do it. i don't have the option to PIN group
1	Awh wow,well best of luck  What are you studying? [:
0	no way!! So jealous. They never perform at the six flags here
0	ill try realllyyy hard but i probably wont be leaving SD til about 6  whats going on at church?
1	i can't wait to talk
0	i found your myspace today, but i cant add you because i dont know your email. 
1	we always have a good time
1	omg helllllllllllllllla late, but thanksssssssssss!  yay for us high school graduates<3
0	are you feeling any better? Hope so cos it's horrid to be I'll in summer
1	Thank you, Christine: Going outdoors with such weather is never regrettable, as there are always chances for nice photos 
1	Im struggling listening to a very smart presenter wearing a dress and tennis shoes--CREDIBILITY IS SHOT!!
1	hey thanks for following me  wasup?
1	Chris you've gotta get a FLIP Video Ultra HD Best Buy $199 .. honey if you don't love it .. I'll buy it from ya  Get One
0	nope, still looking. 
1	Sounds like nice colors!
1	Thank you, thank you, thank you! 
0	Poor love  Hope you get to relax somehow on the weekend.
1	you don't look dorky. but it does seem like karim is pointing to his family jewels, and you are looking obligingly.  haha
1	but eugene's a lot cuter haha
1	HA HA HA Im stalking you right back mofo love you
0	yea it is past 5. And I can't sleep for the life of me!
0	Me too but I have no idea if the Kindle works in Korea
1	my bio and I are blushing
1	LOL I had the same thought
1	glad to see you and Elle here, but no one else much around. 
1	Welcome to Twitter, babe! 
0	errrmm do i know you?? sorry
1	your tweet was just included in The Longest Poem in the World www.longestpoemintheworld.com/tweet/14284/
0	omg! thats a bummer!  and i'm sure they are nice! also, me you and hollie don't dance anyway cos we arn't in it. ;)
1	Too funny! My sons think I'm bonkers, but I get happy and kick up my heels. They really are use to my  painting antics! 
1	haha i approve your listening choice. tell those boys i said yo and to behave
1	i would have accidentally pushed u off the balcony lmao..jk... and ur right we r living the life!! VIP guestlist only!
1	oh no! thank goodness it's Saturday!
1	thank you so much Christine!  I appreciate your comment!
0	Hi Christine. How kind of you! I've missed you too. i have not been tweeting much lately  Very busy with our biz howru
0	 They aren't on the Kindle.  They finally released LotR on the Kindle (plus other Tolkien works)
0	me too! I'm behind this season - I think the new season is over already.  have you seen any of the new season?
0	Only kindle users? Shame. Live in the UK
0	wish we'd been able to make it but car broke down on the way
0	i hope everything works out.  dumb people suck.
0	that's a nasty one...
1	HOLY CRAP. JACKPOT. hah these are ones i haven't seen. thanks, love! 
0	http://bit.ly/3lUnn1 Call of the Honeybees. Unable to watch as Hulu only available to US!
1	Chipotle spiked brisket: one of my favorite recipes!
1	San Fran weather annoys me. I go there 3 weekends a month - I don't think I could ever live there! 81 in Davis right now
1	Please let us know when u do. Good info is always welcome
0	I have sprint and a palm centro  not too many tricks lol
1	whoooo! and yes friend you can come with me since you were the first to ask
1	 Hey david just wanted to congratulate you and david archuleta for the successful concert last saturday.. God Bless
1	okay guys i'm off..i gotta go lend in a hand to my chef  c talk to u soon byee
0	and my room anyone can find me there
1	good  and nervous...its our last match today...even tho i'm not playing i so wish i was! anyway i just am VERY NERVOUS! :p
1	he's a gr8 guy jake is
1	lol no....i'm so exited to c my friends after a long long time
0	the balcony.....i'm allergic to the flowers there
1	thnxxx u r sweet enuf 2 say tht
1	umm okayyyy    is this enuf ahha
1	Sounds amazing!  Anyway to get a free pass?
1	cant you help me out? im hella cool and am willing to pay you with cookies... o.e you know you want to...
1	hahaha. happy birthday for the other day btw  have fun? x
1	yea! ;-) whoa thats alot of votin lol i may do that too since i have nothing to do all day!
0	it will, it just doesnt update real time  #spymaster
1	lol I am glad I'm not the only one. I can't promise they will be good. hehe
1	Ohh thank you so much! I wonder if I should watch it next week.
0	  Awwwww poor thing..how can you NOT have a girlfriend
0	I just barely got out of bed its sooo yucky  no wakeboarding grrrrrrrrrr
0	Its pretty sad  I can't seem to get anything done during the day no matter how hard I try... It'll get done tonight tho
0	agreed on the least favorite status...I'm only down to 3,000. 
0	good morning tbff! I keep missing your calls. Boo me.
0	Same here  #facebook #fail
0	Twitter servers swamped
1	Depends on how close it is. A couple days then hell naw, I'll wait. I's so sweet! 
1	your tweet was just included in The Longest Poem in the World www.longestpoemintheworld.com/tweet/14191/
1	Agree,though I'm torn as it makes sense but tweets may be cut short and may lack clarity.. I for one will remove autos 
1	Little tick box on the right of the place where you write your tweet (on tweetdeck).
0	Love sketchup in classroom...pretty big download tho.
1	my district is using #bing and every search is blocked! Head IT guy is sending memo on how to get around it. Good Luck!
1	Sam, it's the best book ever   but i like the fact, that EVERYBODY from the band is introduced..not only Janis.
1	thanks for sharing them!
0	u would schedule for the day I'm supposed to be in Chicago for my cousin's graduation!
1	ROFL - I was not confusing you with the father! But I hope he is proud of himself, and the other 2 
1	can't wait for the show to come back in July
0	I know I don't care about the mother skit.. I miss the boxes
0	idk probably not  Ive been thinkin bout writin a note wit this joke like hed gt the point or steal his number from mi friend lol
1	 i built it myself, but swapped processors at one point and forgot. husband knew tho  64bit
1	no clue! Here's to hoping tho!
0	I'm totally hatttttiiinnggggg  I wanna cry I sooo wanna be theree better be taking pictures
1	    thought you might be!  nice way to start the day!
1	yep, doing pretty well. A bit tuckered out from a busy weekend, but I'll be ok. 
0	all of em! Hahahahaha sry
0	 & ))) I'm so serious got my list open already. yea I need to see that.
0	 wtf that sucks
0	lmaoooo heeeey...but I stepped away from the computer and when I came back it was frozen  I can just imagine those questions :-"
0	and I are dying from boredom in NC... DC lifestyle and NC are polar opposites! Back to studying...
1	yiiiiis, its a cruiser  i wanted a red one, but its like $160 online, &this one was only $80. wtvs haha http://twitpic.com/7icc1
1	not sure if I can make it.. but would love to go.  I know some photographers. I will pass it on
1	morning mission finished ..  - Now what?
0	sorry I wasn't of much help to you  Did you fix your problem yet?
0	naw  are you!?
1	yea. woaaa. he heard me say 'shit' LOL. ) i dont have requirements pa tlga. all i have is my notebook and pen.  LOL.
1	We always welcome the straying back.
1	been working on a plan for a few weeks and beginning to feeling like a marketing zombie! But has to be delivered tomorrow!
1	nice to meet you as well
1	i have so many things planned , its on going and its happenng, living life yo 
0	I smashed amandas by accident and had to donate mine to make up for it
1	thats right unc!!!  what a game...
0	I'm going to live in Beverly Hills when I become 18 years old. No I Don't but I wish I had
0	what time yuu done . work =eww
1	I'm and good and glad you are too!   Don't you think we should get the new twitter, Oprah to share in twitter causes? 
0	hahhah! I tried making my tweets public and running my feed through there, but it can't pick up *any* tags or make a cloud. 
0	I won't be performing that magic trick at CotF after all. It arrived with a piece missing & the replacement they sent was broken!
0	uh ya, illustrator ALWAYS crashes!! you have to get into the habit of saving after every step..sucks you lost your designs 
0	thanks mama. I'm sure things will? I'm terrified of option 2 though. that's gonna suck so hard.
1	 i'll never give his nudes up
