0	want to go back to bed
0	want to go home to the burgh
0	Want to go home, but have to wait for everyone to be ready. Ugh. I'm gonna miss the hills 
0	want to go home, but i can't,, 
0	Want to go home....sun is shining  But I have to work  Lovely kisses to my girlz Kyra & Alex
0	Want to go on a space-trip, away from this maddening chaos that the Earth has become  !!!
0	want to go out, but got to make blooming maps and write about them 
0	Want to go play in the rain but i've only just washed my hair  boooooooo
0	Want to go swimming
0	want to go thrifting. watching sense & sensibility and will probs take a nap. need to get perscription filled. hate not having a car
0	Want to go to Baguio tomorrow but have a week full of appointments.  http://plurk.com/p/uc1ps
0	Want to go to bed, but its to hot. I cant sleep without air conditioning and a fan in my face. This sucks 
1	want to go to bed....so exhausted yet full of energy
0	Want to go to California NOW! ;) /
0	want to go to Macau
0	want to go to school tomorrow. i know , its a first. ;p but i really dont feel well. 
0	want to go to SemTech. But no money. bah
0	Want to go to target! Don't want to drive 90min to get there
0	want to go to the park again, everyone's working! 
0	Want to join gym but has no money, wants Aaron to be here so I can look after him but he's 6 hours away  
1	Want to know a bit more about this Save Our Sounds thing I keep banging on about?  Looky here: http://tr.im/m7tF (Like my pretty logo?)
1	want to know how to stay motivated over winter? sign up to the Mama Moves newsletter at www.mamamoves.com to find the answers!
1	Want to know what comes out 9-9-09 other than 's book Bran Hambric? Beatles Rockband!
0	Want to listen to The Point
0	want to make more jewellery but not sure where to begin today!
0	want to make the most of the sun today! but have lots of revision to do
0	Want to meet JLS! grr  (L) <3 xxx
1	want to party. have to work. doing none
1	want to play a game
0	Want to play Crackddown, but I'm too tired...  
0	Would like to thank Jack and Chris for 1 of my favourite Bayside shows ever! The last 2 days went too quick 
0	Would like to thank a smoked salmon bagel and a can of red bull for keeping me alive this morning. Today is going to be a very long day.
0	Would like to thank my dream hero and my mobile for saving me last night. It got scary for a while
0	would like to thank the gobshites upstairs for finally going to sleep!!! most annoying night here ever!!!!
0	would like to use GitHub to host his personal projects but refuses to pay with a credit card. Waiting for UK debit card or PayPal support
1	Would like to welcome to Twitter! Woooord.
1	Would like to wish my gorgeous man a happy 30th birthday  x x x
0	would like winter to be how it used to be, with lots and lots of rain. I'm bored of this 'winter'. Global warming FTL 
0	would like work to stop sucking for the rest of the week please.
0	Would Love 2 see Trey Live but only have a BlackBerry& a Pearl@ that, they  dont do iphone stuff 
1	would love an update about the bi-cranial territory trip please
1	Would love to be in Berlin tonighet to see #Royksopp. Sold out http://bit.ly/iWgQ0. If you have a spare ticket, Iï¿½ll jump on a flight 
0	Would love to drop in to #flashcamp_uk birmingham for Flash Builder 4 Catalyst stuff.. But work commitments in Notts sat NO WAY SUCKAH!
0	would love to fall asleep with him <3 right knw
0	would love to go outside but stuck doing homework  cant wait for tomorrow night!
0	would love to go see again, in glasgow in august.. but its the day i come back from portugal so it's not happening 
0	Would love to go see Away We Go, but i can't find a place it's playing around here!  sadness 
1	would love to go to Dubai one day
0	Would love to go to L.A film school in 2011.. they sent me the most awesome brochure. But I need a scholarship to be able to afford it
1	Would love to go to NO DOUBT's concert after watching them on E news! Razman pliz bring them in!!pliz pass the message to Razman
0	Would love to have all her children around her - but honestly - I dont think it will ever happen. Life is what you make of it I guess
0	would love to have more energy! Dreary rainy days don't help
1	would love to meet ellen
0	would love to see Andy Samberg host and Kings Of Leon perform though
0	would love to stay home today.
0	Would love to use #RubyMine, but for a startup the price for a license is too high. Just missed the beta discount... 
0	Would midweek be an option? Otherwise Dan says first gathering will be going over this stuff. What's the conflict for Sat?
0	would much rather b organic, but those grasshoppers r as a plague - & they aren't even hungry yet hard choice, dust r lose it  afik 
0	Would of been better if the band could make it to the summits  but they must be busy!
0	Would of really really of loved to have gone for a run today! But my ankle is bung as  Alas...
0	would people be gutted if i didnt get a bouncy castle?
1	Would persian be the pc term? Or not
0	want to play in the sun
1	want to read about native american references in athletics? check out my essay at jasmindalton.com
0	Want to rec my mixes but can't figure it out for some reason - having a really dumb day  Bah!
1	want to ride with the bike in the city
1	Want to run faster, get leaner, leap small objects in a single bound  ? Order advocare! https://www.advocare.com/0904625 get 25% off now!
1	Want to run with me on Wednesday?  Check this out:  http://tinyurl.com/netwe4 and comment if you want to join me!  Virtually, of course!  
1	Want to say happy b'day for chaboooo..  http://myloc.me/2Lhs
1	Want to say thank you and welcome to the many great people now in my stream.  Need to update my Tweetdeck now to get conversing with you.
1	want to see billy talent.
0	want to see britney at o2 this but cant didnt get tickets   she is my role model http://www.bebo.com/xxBritneyJeanSpearsx
0	want to see britney this summer but didnt get tickets   she is my role model  http://www.bebo.com/xxBritneyJeanSpearsx
0	Want to see cin' before august 7th.  hope to see her in the end of june... ?
0	Want to see NFG again!
0	Want to see transformers! So so so bad! And want to see him so so so bad! Ugh this day is going by so slow!
1	Want to see what I had found using Pounce Undiscovered??? Check my blog!  http://iheart-retronana.blogspot.com/
1	Want to shop at http://www.onlyoz.com.au/ but after they where mentioned on telly the site is dead
1	Want to sign my life away to AI and its crew and whatever... I just wanna see what Simon will say  hahaha
0	want to skype with my nephew but my sister isn't around and he isn't old enough to do it on his own
0	Want to sleep but an upsdt stomach is getting the better of me.
0	Want to sleep. Foot hurts  ice isn't helping. Stinging foot does not make for a nice comfy relaxing sleep. This is so fricken annoying.
0	want to STOP playing with my hair but I don't know how
1	want to sun bathe again
1	want to thanks all my listeners for supporting my song "je t'aime", one of many on my upcoming album! lookout this summer 
0	Want to update iPhone but fear difficulties like I have had in the past.
0	want to watch ... but can't!
0	want to watch again Drag me to Hell  and listen to the Christopher Young's Music !
1	want to watch all of harry potter  i like this
0	Want to watch Big Bang Theory, but I have seen it all. 
0	Want to watch Kiki's Delivery Service!!  Damn revision. Like I care about the quantifying benefits of location management schemes.
1	want to watch little miss sunshine
0	Want to watch the cricket
1	Want to watch X-men Origin badly! Now finally multiplexes' strike is over, its going to release soon 
0	Want very bad to be able to go to  a McFly Concert
1	WANT WANT WANT! best iPhone app for photographers? I'd say  [Crunch Gear] - http://bit.ly/Jl2ii
1	Want your genome sequenced? Now for under $50,000...   http://bit.ly/XqHcP
1	Want Your House to be on HGTV? Contact me to find out HOW
0	Would quite like to be in my wedding dress, shame I can't wear it for another month and a half 
0	would rather be in a pub in the sun.
0	would rather be romping around with wllm
0	would rather be watching deborah 13: servant of god than watching physics podcasts
0	would rather stay at home and do the washing than go to work
0	would rather the first party send bad messages than the 3rd party send mixed ones  Sophmore year all over again?
1	Would really appreciate replying to me about how excited she is for UK tour in 11 days  I'm bringing snacks hahaha.
1	would really appreciate if mileycyrus would just say hi or something.. i know shes extremely busy but it would be nice
1	would really appreciate it if someone special would reply 2 her
0	would really like a Galaxy Caramel right now.....must resist temptation as I have a killer run planned for this eve
0	Would really like some alcohol right now!
0	would really like to be asleep. my leg feels like it is being chopped off :| i think i might cry of tiredness tomorrow.  owww.
0	would really love to know why there is never anything decent on the tv anymore
0	would some one plese suggest me a great thriller movie
0	Would someone be kind enough to employ me please? I'm poor and starving.
0	would someone care to explain what konran wallenrod is about...because wikipedia sucks
0	Would someone send me the Mr Twitter Universe link...my computer crashed last night.
0	Would take over Rockfish any day, but free wi-fi is the deciding factor when Mac is with me 
1	Would Tha Damn Annoying Ass Person With Tha Videos Of Whatever Get Ya Ass ========>> Thanks!! Bye, Bitch!!! 
0	would tweet more if my uber snazzy phone hadnt got stolen and i now have this crappy one  in other news, glasto in 2 days! 
1	would u like my address hannah.
0	would very much like to be outside but instead im inside doing smelling college work
0	Would very much prefer to be back in Crete. Back to work tomorrow
1	Would you all believe that I (once again) have a Blackberry!? Don't fear though, it's only temporary until the shiny new iPhone comes out 
0	Would you come back with an ex-love? Please, everyone Re-Twit me!  I need your help 
1	Would you like to join me?   http://twitpic.com/6de14
0	Would you rather be heathly & broke OR sick & financially healthy?  I'll take healthy and broke any day. Hate being sick!
0	Would you rather...i love this game! Heheh. Rain has stopped now
1	would you whisper in my ear, the things you wanna hear 
1	Wouldn't have a clue ma'am I'm having fun in savannah
1	wouldnt it be great to travel all the time? not job-related but just for fun! i'd drag all my friends along to all sorts of great places!
1	Wouldn't it be pleasant if upload speeds kept up with the online video explosion?
1	wouldn't say the breakfast burrito I ate was hot, but I did just remove my head from the freezer... 
0	Wouldn't you know it - dedicated back-up drive has bitten the dust. Thought a LaCie would last longer...
0	Want: To play Sacred 2... Reality: Spend all day at the hosp...
0	Wanted 2 go see passion pit  I didn't get 2 go... it was sold out... oh well
0	Wanted a midnight stroll but after the catch of fish no one was up for it and I wasn't allowed to go alone
0	Wanted Dolly to win  #tonys
0	Wanted Kate to win the Aprentice
0	Wanted Lebron to win...  ok I'm leaving for work now! Good night everyone.
0	wanted red wine only got white in, don't like white, have a glass of white, struggling to drink it, all I wanted was a nice glass of wine 
0	Wanted Seith Rogan and James Franco to win best fight  Rob Pattinson looks good thought.
0	Wanted to back to BarCamp today, but just hot out of my "lunch" meeting. 
0	Wanted to bake strawberry muffins, but oven was dirty. So now I need to sit at home for the next three hours while it cleans. 
0	wanted to be in adams morgan tonight  I already know that whole strip was jumpin
0	Wanted to buy those at 29p but they say I'm too far away from UK
0	Wanted to buy tickets for lowlands just now, but they're sold out since yesterday... And I was so much looking forward to it 
0	wanted to curl up in bed and watch 'the tudors' but the disc seems to be scratched and won't play!
0	wanted to do some many things
0	wanted to eat and eat. Can anyone just bring me out?
0	wanted to eat brunch with my pops but the company my house is still sleep;iM So disappointed that im not doin my summerworkout plan
0	Wanted to get a pool for the boys...everyone was sold out
0	wanted to get her new phone today but couldnt  bad times
0	Wanted to get to 68 this weekend but it's not going to happen
0	Wanted to go bowlin tonight, nobody is around 
0	wanted to go eaton centre, but  dont hve the mood anymore
0	wanted to go gym today but sadly its too late and its shut
0	wanted to go hear led kaapana tonight (best ki hoalu player ever) but BCD friday and zenshu saturday means i gotta watch my spending.
0	Wanted to go home after the conference but pretty sur have go back office
0	Wanted to go out but looks like im not. Im gonna drink alone tonight.
1	Wanted to go out to breakfast this morning...then thought better of it - Mother's Day crowds.  Making omelets instead.  Happy Mom Day!
0	Wanted to go see and Jay Z tonight after hearing about it from No passes this time
0	Wanted to go see transformers 2 tonight but it's selling out everywhere!
0	wanted to go to Keenan's graduation
0	Wanted to go to the beach today but it's so cloudy and rainy here.
0	wanted to go to the blood bank but apparently has to few red blood cells  now i have to eat (more) meat ... kinda sucks
0	Wanted to go to the driving range tonight, but it's raining 
0	Wanted to have finished this wee app in 12 hours. Twitter was down for 2-3 of those, and wasted an hour chasing a nonexistent OAuth bug 
0	Wanted to like 'The Proposal' more than I did. Many entertaining bits, and I laughed a lot, but not much better than C+ or B- overall. 
1	wouldnt you like to know !
0	Wouldve had a show today but i fucked up on blogtv  dont worry folks ill be back live soon
0	Woulnd'tcha know? I have to work the day of the Astros Stitch n Pitch game. It's too dang hot anyway...
0	Wound up staying up for tonight's X-Files eppy on Sci-Fi.  Season 9, Jump the Shark--so sad.  I loved the Lone Gunmen   Night all!
0	wound up that people mess with my plans all the time. you know what they are so stick to them  grr
0	WOW   Jeffersonville City Council Attorney Larry Wilder was found by a neighbor who called 911 Wednesday morning.
0	wow  An Air France plane carrying at least 228 people from Brazil to France has gone missing over the Atlantic.
1	Wow  i have twitter on my iPod ;)
0	WOW  Jeffersonville City Council Attorney Larry Wilder was found  in the TRASH CAN by a neighbor who called 911 Wednesday morning
0	Wow - last.fm is down. Just when I'm trying to stalk people.
1	WOW  LISTEN ... http://bit.ly/10uAH0
1	Wow - only been on #Zazzle for a blink and they've already given me a "Today's Best" Award for this design: http://tinyurl.com/laeazb
0	Wow - what a finish to the Eastern Conference Finals. Who'd a thunk the Cavs would choke like that? So disappointing
1	wow - who pulled my string tonight?
0	Wow  wonders wat he did to piss woo off
0	wow !  So  get timed to be on the computer  What kind of shit is that !
1	Wow ! 8 days of school + 5 exams = Summer dude !
1	Wow ! really quite  on twitter today.
1	wow ! What a good movie !
1	Wow #Greentherestaurant is sooo nice
0	Wow #optus way to go delivering me a voicemail message 30 days late.  FFS. Upset at a missed opportunity
0	wow ( LOL kiki moment) those real house wives spend money like crazy !! I felt sad for Lindsay
1	wow , 3 pages ... must be real special 
0	Wow , 4 lambos in a row . Baby , i'm having a bad flu  - http://tweet.sg
0	Wow .. last night was a bust for me
0	Wow ... It would been 10 mouths today ...
1	wow bing.com, exciting 
1	Wow Thank you for being a part of the restaurant walk... we really appreciate your dedication and service! See you next year
1	wow that's brilliant  sounds like he's also gone from 30-36 so trying to get back down.
1	Wow and still going at it? lol...I wanna kno how many txts u spent when ur bill comes lol
1	WOW and liam hemsworth kiss on "Last Song" is pretty damn hot. I wouldn't mind    x
1	Wow is my hero!
1	Wow I was unaware how popular u were/are 292,018 followers! 
1	Wow Must have been a fun wedding.
0	wow aint tell me night... n he the only jmac i follow *smh* good lookin out fam  lol
0	Wow being the cover 2 magazine.If dad were alive he wud b amazed the emergence of technology & how its evolved.RIP daddy
1	Wow 117 new followers! TY ALL for the follow  THIS is for you ;) http://twitsay.com/77u91j
0	wanted to make chocolate covered bananas, but had to settle for a banana split instead. 
0	Wanted to run, but creepy guy has been out there all night tonight  Guess I get tonight off.
0	Wanted to see DMC Cornerstone Calif. but was not able to make it    Was stoked when we heard about & attended the Carlsbad show!!!
0	Wanted to start clinical paeds in the evening ! I waste somuch time over phone and music
0	wanted to Sunbathe but the Sun went in  x
1	Wanted to thank you all for making The Sims 3 #1 in the App Store. U guys are the best
0	Wanted to try and sew one more bag before bed, but am too sleepy. Sleepy sewing results in upside-down pannels n such which are no good  
0	Wanted to use but realized that it's broken under AIR 1.1  #fail #snitter
0	wanted to wash his clothes and bed sheet but the outdoor rack is full...
0	wanted to watch a movie but my hubby ditched me...ASS!
0	wanted to watch transformers today.bt bb didnt want to catch de midnight session
1	WANTED. . It's been so long . . I'm still not over this film. Flying bullets on an amazingly curved trajectory still flashes in my mind.
0	Wanted: Someone to snuggle with! See how lonely that side of my bed looks.  Lol! (I love being cheesy and lame!) <3 http://mypict.me/2Xda
0	Wanting a new phone
1	wanting a new phone!
1	wanting for more TH
0	wanting julian to come home right now.
0	wanting my coffee that is on the other side of the room.... trying to use mind powers to make it come to me.... it's not working
0	wanting my laptop so bad , it's it's only been like a couple of hours withouth it 
0	Wanting on Yolanda and Madison to call to confirm Practice. Texts and calls, after calls and texts. 
0	wanting some sunshine so we can lay in the pool
0	wanting someone to cuddle with... I left cooper (aka my longhorn boyfran) back in atx.  sweet dreams my loves.
0	wanting the laundry to finish washing so I can go to bed!  A girl needs her rest for the party tomorrow!!!
0	wanting this rain to stop
0	wanting to back to the beach...missing california...
0	Wanting to be back in inverloch........................... missing someone
0	Wanting to be home in Texas to see my family and friends..  I need school to be over now!
1	Wanting to be lazy today but excited about work tomorrow
0	Wanting to be more productive on my Saturday off, but it's too wet for yard work today. 
0	WANTING TO BE WITH HIS GIRLFRIEND TOGETHER AGAIN!
0	Wanting to be with my man but can't
0	Wanting to buy a new betsey necklace on fri pay day. My other fav necklace broke
0	Wanting to do something because my bestie isn't coming home this weekend  I am crushed. I'm still pissed at&t for my phone not working!
1	wanting to finish so that i can watch conan  yay!!
0	Wanting to get out in the garden and the sunshine, I wish it wasn't so windy out there though 
0	wanting to go back to orlando
0	Wanting to go out... apparently no ones available!
0	wanting to go to craven but its sold out
0	wanting to go to cultive. but it is to late
1	wanting to go to Germany.........and less missing...
0	wanting to go to movies but no money
0	wanting to go to the city but its raining  gotta do homework 2
0	Wanting to go with Brian  but going to get Timmy Ian Hunter Stickneyy instead. bss <3
1	wanting to have some fun
0	Wanting to just be lazy... But I don't think that would blow over well with Mom. Also, It's looking like a no-go for lunch. 
0	wanting to just hang out with my girl... But she is ignoring me...
0	Wanting to mix pixie stix and mountain dew..but I don't have any...
1	Wanting to move to Nashville!!! Who's coming with me?
0	wanting to relive the best thing ever in seattle today but can't  oh well. yesterday was good enough for me  <3 relient k
0	wanting to see the dinosaurs at the TU Center. No time, though 
0	Wanting to sleep after a long day working
0	wanting to sleep byt can't
0	Wanting to spend time with friend but obviously they dont have the time!!!
0	wanting to start a running program tomorrow but looks like it's going to storm
0	wanting to stretch this weekend a little long dont feel like i rested at all
0	Wanting twitter to work on my phone again. Grr
1	Wanting work to be over soon then seeing my baby who i love soooo much yay
0	wants  Andy or Shaun or Bradie to give her a ring...
0	wants to get on ym/msn
1	wants to come back online so that he can talk about all the gossip and horrible things which transpired today.
1	wants to take her philosophy exam for her? Pretty please??
0	Wants to reply to me!
0	wants and jessika to smileeee again (: i dont like them sadd  iloveyous! all yous <3
1	wants 2 b a transformer......vich von?????
0	wants 2 be in cork now
0	wants 2 know when she can have her 2 week break to do whatever, whenever and has to answer to no one!!!& can sleep! must be flippen nice 
0	wants 2 record myself singing but its 2 late  my mama sleep and i dont wanna wake her up...
0	wants a BBQ
1	wants a bomb breakfast &some cookies with milk
0	wants a chihuahua but can't have one
1	wants a doggy to be my best friend ever  http://plurk.com/p/z2a4p
1	wants a fan page.  But I would feel silly.  Still...FUN.    <3 <3 <3 YOU this morning!
0	wants a fire with toasted marshmellows.
0	wants a fremantle scarf  for
0	Wants a graduation!!!!
0	wants a iPhone 3GS, but only got his 3G 2 months ago  
0	wants a leather jacket so badly  an wants to go blow all her money on clothes  even just two hundred would be good
0	wants a lighting tattoo.  BUT! I'm scared that when I get 60 or so, it's gon' sag. ) EWW!
1	wants a MFMJ tote bag
0	Wants a motorcycle.... really bad
1	wants a muffin
0	wants a mustard colour trenchcoat! Ques is, where to find? 
1	wow 12 am and i don't want to sleep :S the best day of my life
1	Wow 12 followers in less than 30 mins! twittergetter rocks!  You should try it! --> http://tweetergetter.com/mac2x
0	wow 15 min with no one tweeting. I am the only one boring and at home.
1	wow 21 followers thank u very much who ever followed me...
0	Wow 3 tables in 3 hours  shoot me
1	wow 359 views on my I Dare You 2 Move Video On Utube
0	Wow 4 slices of stuffed crust pizza, wings and now chocolate slice things from Pizza Hut ugh Sopranooo I can't breathe n ima shit myself 
0	wow 4:37 in the morning daddy just left for mephis, crying again.  hope u have a good night with having ur daddy there. lucky! love bRIT!!
0	Wow 6 cars crashed that was crazy  [Bree.Dee]
1	wow 6 followers in like 2 seconds
1	Wow 85 followers!
0	Wow a lot of stores in ktown are closed today. Boo must kill time...oh & i got a txt saying my txt to p's landline went through  FO SHAME!
1	Wow a Snicker bar & some Pringles! Something bout that salty sweet thing goin on! I had 2 have it. Now I can go night night
0	wow am hungry
1	WOW am I tired ...... I'll only get up to watch The Ellen Sow   ....
1	Wow am I tired... LOL  Must of filled too many prescriptions today... At least it gives me good job security
0	wOw an hour without twitter    hahaha like i tweet much...but i do like to read what others tweet haha ;- )
1	Wow angry yellow sports car, fuckyofacemothafucka hahaha 
0	Wow Another cloudy, rainy, slightly cold day. Luckily for us, we've got plenty of wood bricks for the stove! And alas, Felix's funnel on 
0	wow another follower. if only it were this easy to get folowers for religous cults
0	wow another freaky ass dream
0	wow are there any videos on utube apart from new iPhone
1	Wow beautiful sunrise in Henderson
0	Wow breakthrough disney star more like it.
1	Wow bro. The water was good to me today
0	wow Call of Duty: World At War was very short O_O can you believe 60 million people died in WWII?  SIXTY MILLION.
0	Wow can't believe Hatton got KO'd & only in the 2nd round!!
0	wow chelsea, your obsessed...just got back from the car wash..i feel so bad for what happend 
1	WOW Comp dies and when I come back WAM! haha. Hi lovelies. I adore you all so much
1	Wow cops at a donut shop. Don't see that everyday
1	Wow corey... Thats nice... Noah still has to go though another year of getting watched by james  +Junoir D+
0	Wow crazy we have not eat dinner yet and where is chris
0	Wow did I reallllly go see transformers on a work night?! Now I'm tired as hell n the frickin movie BLEW big fat elephant BALLS  CoffEE
0	Wow did not no i am that insecure that i needed attention ALL of the time?!?! Bad revalation
0	Wow didn't mow the lawn cuz I thought the mower was broke mom comes home the mower isn't broken I get in trouble for not mowing the lawn
0	Wow didn't think I'd have to go to workk tonight
0	Wow do I hate finding jeans that fit correctly. If only I was skinner
1	Wants a necklace made from barbie heads
0	wants a new car..... badly.
1	want's a new job as PA to someone famous! I would be sick that job! I can do it!  xx
0	wants a new job! E-mailed Heart/Star and check BBC no jobs  so moved on to second choice and got interview with Police
0	Wants a new phone
0	wants a nice dinner. im starving!!
0	wants a night out with friends to party
1	wants a picture, but doesnt feel like taking one  all my pics were deleted off my old computer when it crashed. sad times.
1	Wants a plaid shirt
0	wants a raspado with fruta
0	wants a redo on mother's day  The flu was NOT on my wishlist
0	wants a reply from !
0	wants a response from all of you!!! (tears)  (unsure) (annoyed) http://plurk.com/p/vgj5a
