1	Thanx Yogi for rockin shows in Milwaukee & Chicago. Thanx for the set list in Milwaukee!!!  Until next time. Regards, Es
0	I bought a puppy mill people and didn't know it years ago and he as so sick and died at 7 yrs old
0	the more experienced you are from my own experience the more dangerous the path gets, does not get easier 
1	Make it Happen!  I was raw all morning because my guest was Ani Phyo and we interviewed her for the documentary.   Yeah Buddy!
1	no problem  always here to help.
1	 #flickr is awesome! i can spend waay too much time just browsing peoples pictures
0	ahh so you need someone to print and ship your prints. i don't know anywhere for that  but why dont you get them printed...
1	not yet. Only when you leave home and move into a  warehouse with other artists and live by your wits will you have hobo cred.
0	very much so  Rub better?
1	Yes I got prayer for my lower back to be healed  Haven't been able to test it yet - but will let you know!
0	at this point, just about anything would rock. 
0	yes, i'm clueless too.   who is bal thackeray? (ducking shoes)
1	Hey, congrats on 2nd place last night, it was superb! I voted for ya. Virtual high-fives from England, rock on! 
1	You were amazing last night! I was quite sad you didnt win, but #2 was really good  Congrats! You're the best 
0	my stupid machine has only 512mbram
0	but then when they ask, ppl wanna start trippen 
1	Them was the good ol' days.
1	http://twitpic.com/6ouah - Much better
1	he's following me. but he might. he's the lead singer of slow motion red lights.  tell him you're a dj haha
1	hahah yay im in ur update!!  im crashing ur softball party k?!
0	Awwww, why did ya lose? 
0	) NICE. I want it. I'll get the pirated. ) I MISS YOU
0	okay  night ttyl, promise? Lol
0	And web-less starting the day after that  #homeless
0	I hadn't cried in five years  I'm still at the airport waiting for bus. Cops stopped me. Musn't wear tshirts w/ bombs on em.
1	duuuude i got my parents to see them (earth wind & fire) this july  night before my bday actually!!
0	i know. bad day  injured pa ako. hehe. i can't even touch my back coz of the burn, iniisip ko panu ako mgshower neto. 
1	YOU SHOULD  RJ!!!! gigil!!
1	If you are working in an existing installation your  are of course right
1	Not yet  Will let you know when I have one.
0	it's been like this for several days now in the bra.  makes me saaaad.
0	YOSHI I LEFT MY PHONE IN YOUR ROOM
1	 I have my ways... *giggle* LOL
0	hi there yoko! wow, a listening party! wish i could join u guys 
0	I didn't send one in time
1	Nevermind, I made it bigger and it works now 
1	okay i will...
0	yeah I'm surprised too  I would love to have the punishment. Ok, back to rehab. My neck hurts so bad 
1	Yoko I miss you too
1	Yoko!!!  Good Morning
1	yup! there are  will post it today, i'll go with the mellow ballad title since nene and kary already cover the R&B one, hehe
0	 I so would love to go...but i dont live in the U.S.
1	And TRUE love casts out all fear and negativity!
1	hey dearest yokoono, congratulations on Golden Lion for Lifetime Achievement 
1	lol, I think your dreams can compete with mine 
0	dmn sorry to hear that.. nothing cool to say just srry to hear that
0	had a monique moment celebrated too early couldn't drag widgets onto page with itouch or iphone  . Time to put away the pepsi lol
0	can't see the pic
1	i reckon you should come with me to MAC next Friday and spend it there, and get a free makeover with me 
0	Im had insomina since I was 6   it can strike at any age...
1	it is you'll find your best years are ahead of you babe
1	so cool to have you in the twibe Y' u rock, we're gonna have some fun making a difference   http://twibes.com/GreenTeam4Change
1	What about XXX chromosomes?
0	oh, this is probably gonna cost me an unfollow, but I've never read #Neuromancer,  should i run to barnes and noble tomorrow?
1	oohhh thanks honey
0	you're telling me! no, i'm an old geezer. 
0	I go into the room for the first time in weeks and you're off cleaning
0	 what happened
0	 I HATE THIS FEELING!
1	cheers man.
1	I've got the LRR thing on my blog to not auto buffer now. autobuffer='false' is nice
1	mmmm.... i like that stuff.
1	It was so hilarious! I hope you don't have any bruises. Such a good sport
1	i can do that
0	i didn't forget  i just didn't know what time it was
0	didn't pick up for me either  Happy birthdays all around!
0	Awww, I'm sorry. Motion sickness is one of the worst feelings in the world. Sometimes, I gotta take medicine for it. I h8 ittt 
1	no problemo!!! Family Guy is on there too
0	shit for real?? it was "Me N My Sammich"...it made me smile, thought it would help you...sorry... 
1	Yes ..I want my own WORLD tooo ...following your status I agree lol ...also please NO men Bad enough they are on earth too  !!!
0	ada di PIM1 tapi cuma quick grab and go trip, can't make it to the #coffeeTU  say hi to everyone!
1	gila jelek banget tuh website. And about all those icons, bisa kena HAKI tuh  Icon Liver sama USG aja recycle bin-nya Windows.
1	oh damn! gue salah motong biji org. my bad...
1	It's instead of my 'what I'm up to' or 'boring Japanese language learning stuff' posts  I meant a fun blog post, not a whole blog
1	hey glad to see your profile pic is back.. it went walkabout for a wee while
0	Me too! I want to see you already!
1	Of course there is plenty of good things  We recently updated a number of plans so its probably worth a look.
1	sweeeeet!! am currently begging to bake  altho i've lost that important piece of cardboard...
1	What's great about fucking 28 year olds? There's 20 of them
1	u kno wat Fri means to me! Thts y I lost contact with the world every weekend
1	 ack ~ of course i'm a person! but i think knows that
1	Thanks on his behalf  Anything special planned?
1	thanks, but hold your ocngrats till, say, after the 4th date. 
1	Will you think less of me if I told you I missed the 70s.
1	 yo ass was flying!..cruise control a 100 n shit...- did that before and got my ass pulled over..
0	yea bad game  wait til the next one ; )
0	unfortunately not  its a sad thing to come to terms with
0	Great, it's gonna be showering on Sat 
1	so which Beatle is it?
1	LOLL sounds gangpeh to me ;) HOPE YOU WINN
0	OMG cheryl leaves larry?!?!  i bet it's for ted danson!!
0	no iphone icons in browser
1	bring me somee
1	Ruby seems to take "There is more then one way to do it" philosophy a bit too far  #geekcamp
1	 If u're referring to d intestines dish,honestly,it looks delicious - with tht thick curry laksa soup. I dun mind if its chicken
1	Yeah, I know where it it is now, it's hidden under the Firefox Bookmarks menu. As told me.  LOL!
1	- Ah, brilliant! Congrats. 
1	Comment and debate on other blogs. Update often, post interesting updates, etc. I think you're well on your way to doing that. 
1	What's your email? I can send you an invite right now.
0	me too... but i dun know how.
0	why does your perfect day have to be the one day we haven't hung out
0	my siblings and cousin just left after a week of visiting. Its too quiet now and I miss them so much
1	Why thank you.
1	thank you  its just something that's been buggin me lately every time i see it!
0	lol. poor you   my man lives 100 miles away so don't see him all the time either. crapola innit?
1	6 mile walk and that's about it  Thankyou too,so kind!!  What about you?
0	haha takes cheeky to know cheeky :-p x yep im afraid diet tomorrow  xx
1	he is looking after me he's made me tea  very weak from late nights etc....Thanks for the hugs!;0) so what u doin 2nitexx
1	hiya - yes it is rather warm even at this time of the day, fan is whirring already lol - i am fine thanks! 
1	yeah i have a habit of changing my pic this is my fave...im feeling a bit weak...need tlc tonight  xx
0	I want a garden to sit in today
0	Web link got cut
0	did buy a video off a guy ,but lost it,  years ago,lent it to someone who didnt return it  
1	I just vommed a little
0	I'm good thanks.  Sorry to hear you've sick child   Hope they feel better soon x
1	maybe it is allied to the limp?
1	Everyone I've spoken to seemed to love it, apart from me. Oh well. I'll just stay in and keep watching Stargate instead! 
1	Me too  it was almost worth getting ill for!
0	pants to drama  I *think* I have finally settled on my left arm design. Not telling though ;D
1	Btw, I smile everytime I see ur smiling face on ur profile here. "Grins"  Damn ur cute.
1	*nod* I guess I've gotten used to devastating crown fires. I know "normal" fires are healthy for the forest.
0	Yay let's!!! And I totally turned my TV off  Boo on missing NPH's finale!
1	why thank you for buying fiksi.'s dvd  hope you enjoyed the film
0	dude the Sookie v. Bella poll on my facebook is pretty sad. Not one vote for Bella
1	i won round one with the shout out
0	I'm busy as busy gets... I'm trying to get Twitter on my iPhone... it's having issues.  Suggestions?
1	a god damn super-duper chronic insomniac
0	noooo i didnt get ur text
0	so sad  don't think I can find that album here. Which is your fav ryuichi album?
1	I too can touch my nose with my tongue. I can also type faster than you, 101 WPM. Cracker! Tonight is useless info night. 
1	hehe yea i do i got 503..ur great
1	?? ??? ???!
1	??? ?????? ?? ????? ????? ?? ??? ????, ???? ?????? 
1	×?× ×™ ×ž×©×’×™×—  30 ×“×§×•×ª ×–×•×–
1	HBO on DEMAND!!  come on over.. just bring some food and/or beers
1	goooodmorning
1	??? ????? ??? ???? ????????
1	Got it, thanks 
1	I just saw that, thanks 
0	I leave NYC august 8th  so I wouldn't even be here.
1	GOod night to you!
0	I can't wait to be back, babe. Not many good stories, though 
1	I did that... well, I'm still stupid in the morning, but it's not that bad.. I'm just overreacting I guess. thanks anyway 
0	checking e-mail b4 going to church. Checked space A flights.There r none up to Tuesday
0	 It's only 9 here..    I wanna go home already and only been here for 45 minutes. How is u?
0	awwww... so it's sad
1	??????? ??? ?? ???
0	twitter's comment: "We have corrected a fatal software error. The site is back up."  ...  http://bit.ly/dDVb7  not much info
0	I know!! I cant sleep!!
1	I often go back to this post to eat my words  Hope you get some rest! http://tinyurl.com/ca44gh
1	not to start a twitter war but is wrong about the book.
1	mine is nearly done... and the fact mcfly appeared in two mags just made my day hahaha!  xxxx
1	Ñ…Ð¾Ñ€Ð¾ÑˆÐ¾Ñ‚ÑŒ ÑƒÑ‡ÐµÐ±Ð½Ð¸ÐºÐ¸ Ñ? Ð¿ÐµÑ€ÐµÑ?Ñ‚Ð°Ð» Ð¿ÐµÑ‡Ð°Ñ‚ÑŒ  Ñ? Ð¼Ð¾Ð½Ð¸Ñ‚Ð¾Ñ€Ð° ÐºÐ°Ðº-Ñ‚Ð¾ Ð¿Ñ€Ð¸Ð²Ñ‹Ðº
0	 I  was going to mention that you probably forgot  but the msg was just too long. I'm jealous you dreamt something wonderful
1	hope you had fun in San Fran  yeap miss you too, especially our trippy taco trips!
1	http://bornarebours.tumblr.com i'm going to make a new one though, what's yours? 
1	I'm a cereal girl     http://tinyurl.com/3ayzrs
0	i know right? i want The Sims 3 so bad but do i have money? heelll no.
1	Hey there...hadn't seen you online lately!
1	oh no! you weren't the only one, I don't know what was w/ that. I'm sorry, though! thx for the note re:your well-adj kids 
1	congrats. Don't forget to live dangerously
1	I know!! I'm really excited!! I'm sad i'm not moving in right away but will be down a couple times
1	Not a poll, just one of those 'survey' things. trivia and the bit of deeper/revealing stuff - l like filling those in 
0	Congrats! Not everyone got one.
1	Did you get to see my new tattoo??  I did a twitpic of it a few days ago.
1	hello to you too!  thanks for helping me out!
1	I am too, she got our tix on Sunday, and we are on the left side of the stage like 20 rows back. 
0	Am bk in Uni 2mora  deadline rs arriving n times flying by i wish everything wud slow down so i can enjoy the time lft xxx
0	AM BORED AND HUNGRY AND BLAZ AND SCH IS REOPENING, HORROR. 
0	Am bored anyone want to talk to me???
0	Am bored on my lunch break! Only get 30mins aswell  http://myloc.me/2506
0	Am bored.... Just got home from work and nothing to do
0	Am crying my eyes out at 60 minute makeover. Poor woman is so touched.
1	Am curled up on the sofa enjoying my last day off, and looking forward to experimenting with the REAL WORLD tomorrow. 
1	am currently sat in the opticians waiting for my new specs
1	Am designing my own twitter background now
0	Am devastated the weekend is over its gone soooo fast!!!  bt Ibiza in 2 weeks!!!  x x
0	Am doing legal stuff in preparation for Monday's court hearing against a horrible builder  With that and a sick cat, it's stress city!
1	Am done with Awareness2! Shall type tomorrow  Now, to read.
0	Am dropping out of love i dint sign up 4this pain so am out of love i cant take feelin this way ...think its best u go ur way...
0	Am enjoying Cali but wish I was celebrating a Flag Football championship with my team
1	am facut in mai 3 ani de blogging
0	Am farking cold and some biatch spilled her drink all over my coat
0	am feeling a little bit shit as my dog is dead. also have the gym tomorrow
0	Am feeling horrid. Nose is burning, eyes watering, body sore. Am already in bed 
0	Am feeling so Sad .. I need to have a job urgent ...
0	Am feeling so tired these days. I end up sleeping like a log! And time keeps speeding past me.
1	Am finally giving up and going to try to get some sleep. Good night/morning!
1	Am finally going to settle down tonight with a beer and create the Duct Tape Wallett I've had since Christmas. Fitting end to week
1	am fost la Obosession....a fost cam trist, ca am fost singurul treaz... 
0	Am frantic. have 8am flight to Brisbane tomorrow, havent packed, have 3 loads of washing and work to do. Son sick with 39 degree temp now 
0	am from rgypt and missed aly&fila shittttttt   #asot400
0	Am fuming!!! Am logging off now before I Tweet something venomous which I later regret.  Grrrrrrrr.
0	Am gearing up for a 0-day weekend.
0	Am getting incredibly depressed over all these poor animals
1	am getting more hungover as the day goes on. that shouldn't be possible. but at least i don't have to get up for work tomorrow
0	am getting myself to concoct  long paper proposals
0	Am getting some kind of sore throat thing.  Considering not going to knitting tomorrow. Don't know if I'm sick, and I'd hate to spread it.
0	Am giving up on day 2 presentation - not downloading or playing for me...
1	Am glad tennis tournaments have planned themselves around my exams. RG ends before exams and Wimbledon starts the day after I get home!
0	am glad there are COOKIES!! for me to munch after everything. but SNACKING? O__O BAD.
1	am going 2 c a girl 4 my elder bro...he he! Hoping 2 get a positive behavior from them
1	lol...alcohol and the high seas. Hmmm...hope the guys have adequate security.  http://myloc.me/12W3
0	Me neither TOO Much for me
0	Oh.    Oh, oh, oh.  Bummer.
1	I LOVE the color of these photos! You are so talented... you captured their personalities perfectly!
1	Well not the ONLY way, but its the most fasho way.. das y u gota stay focused! 
1	  , the test was awesome  . By the way,you're Algerian right ?
1	 Thanks, actually I like your blog posts 
0	Me 2.  wat we goin 2 do?
1	don't worry most of us r coming back 2moro
0	y'all are too cute!! tell daniel i miss him!!
1	To be fair, it was pretty clear that canyon was man-made. 
0	no. Because we need to talk.
0	I know. Bijou is constipated and hasn't gone in 4 days.
1	aint it awesome!!! cant stop listening to her... and i working on a drawing of her for school
1	i only trink Red Bull with Wodka  And only maximum one every year. ItÂ´s nothing more than Austrian Sugar Water LOL
0	aw yay thanks for replying. are they coming to New Zealand tooo?
1	AWESOME album!   Where are you from? Sorry if im being stupid! haha  XXxx
1	version ofm Poker face its fucking fantastic
1	you really should, i mean belfast love you!! >< your version of poker face is AWESOME!  xx
0	Welcome to my world.
1	a broad living is mine as well
1	cheer up good sir.  and never quit.  Goonies never say die.
1	you can HAVE my chain.
1	I know ima see dat ass today!  "sour power??? lmao
1	that's what she get!! lmao get her!!! lol but still be nice
1	that is awesome! can't wait!
1	they're fierce as dancers.  I want to try bust out some moves lol.  congrats on exams
1	you shop at #digitalplanetSA..  Thanks so much for the tweet! hope to hear from you soon!
0	good lookin .... It always picks the worst time to do it
1	Have a safe trip, y'all!   
1	Hey stranger! I sooo wasn't invited to this event
1	How ya doin', homie?    
0	I hope so too.
1	lol good morning ceo.... For the second time
1	Get 100 followers a day using www.tweeterfollow.com Once you add everyone you are on the train or pay vip
1	why thank you for the compliment...its actually not mine,its a quote from Kahlil Gibran,an amazing poet 
1	holllaaaa!! do ya thang!!!
1	and you too, darlin! 
0	Oh noes. She deleted her app!  This is what I get for going shopping rather than staying home and seeing the dramarama.
0	WHERE ARE YOU??
0	ALEEE I DONT WANT THE MOCKS TO BEGIN!...
0	but i like button keyboards
0	ok band name, really bad club name 
0	NUTHIN IM SAD CUZ I LOST MY ATM CARD AND SUMBODY TOOK MY MONEY
1	And Leb's got a Davecrush....supercool
0	so mad i missed you today on my dad's show  i was just watching rush hr 3 the other night and thought of u! miss u lots!
1	tylerrr!  wuts up? how was your day
0	no I didn't  got caught up in the office  damn this sucks
1	o o o hold up! havent seen it, u kno I am a HUGE fan...searching now! 
0	OMG I dnt know how I didnt faint coming into this world...ugh stomach is turning now
1	would be a nice way to kick off the summer
1	no its not! Some of the contestants had to legally change their names by deed poll to gain housemate status! That is very funny.
0	I got arrested for swinging my sword around on top a school.there is not innuendo there. it was a real sword and a long story
1	 how are u??
0	Tim But on Twitterfon you cannot be able to go directly to a user
1	Yes, it would have not been a party or event without the wine 
1	then you can drive me around and be my chauffeur right?
0	Ooh! Not you! Venting about customers and other random nimrods. You're awesome. I'm sorry things stink for you right now.  *HUG!*
1	Welcome! Twitter is great and actually a lot less pointless than it may seem at first  BTW only 3 months to go now, right?
1	we were at the Jaze Sky Office - 11 floors above Oxford st, in the "Brainstorm Room"  You can see the 50" LCD off to the right...
1	hi! just wrote a post bout you at my wordpress  ?  http://newnatol.wordpress.com/
1	size does not matter, if it doesnt fit, sell, and get one size smaller 
0	http://bit.ly/187Lcn is not worth it..sorry for the spam
1	In case no one gave you a heads up, AT&T just put out an iPhone app for account management (MyWireless) I'd love to see a review 
0	It'd be great if us Brits had the kind of coverage where we could possibly not know what that symbol means
0	Can we all hang out tomorrow? I miss you guys.
1	Hi there  I can get you setup for a VPS starting $6.95/mo http://neosurge.com/vps_hosting.php
0	You'd have to cook the fuckers for three hours to get them cooked. Imagine how grim the outsides would be by then - shudder
1	that sounds a little more legal. I suppose I'll try that first. thanks for the ideas
0	we're in Modesto this weekend. ninety-seven fucking degrees. no place for a Canadian
0	you sound exactly like me with Stanford's cash.  I chose Holy Names because I got a free ride. I can't be mad at you.
0	I'm cleanin my bass and listening to 'have faith in me' on repeat. i want to go out now.
1	Am going back to purple later!  woop
1	am going over to my secret little spot and chill
1	Am going to house today.  With no ;|
1	am going to a b-day party peace out
0	am going to return the car today am now without any transport and am very sad
1	am going to see 17 Again with Zac "6 pack" Ephron.  Taking Quinn so I don't look so obvious    I'll do a critique after....
1	am going to stop moaning and do some more work
1	am going to vote for for mtv movie awards>>>!!!! you are my idol whoop whoop lol
0	Am gonna be apart from my Big Love for an uncertain amount of time soon... I know we'll survive but it will SUCK being without him.
0	Am gonna finish assigs today... finally... not all though..
1	Am gonna go and eat some burny chicken for lunch now
1	am gonna take the Circle Line today!!!  http://plurk.com/p/xzst2
0	Am googling Airborne side effects.  Alas, it seems my symptoms are attributable to the virus I'm fighting, not the medicine 
1	Am grateful for the things I do have in my life - good friends, family, two adorable toddler neighbours & my adorable budgie, lol!!  
1	Am happily full of chinese food and loaded down with Lush goodies.  Plus I found the new yarn shop and bought some rare breed wool
1	am happy with making.
0	am hating doing the housework
0	Am having a break, hot tea that does not taste like tea!!! 
1	Am having a delightful morning so far...
1	Am having a great time in my life ,i feel bless..God  has gave me more that i deserve..Am  with all am living!! Definily a great time..
1	Am having a picnic in the park & just lost a game of frisbee. Hope everyone else is having such a delightful day
1	am having a quick break between social engagements - LOL what a hoot - great day with sun out  xc http://plurk.com/p/x4tr7
0	am having such a blue Monday at work today.
1	Am heading off with my girlies, feel happy but extremely knackered 
1	Am helping with dinner and practising Japanese!!
1	Am home with the family, wet cos of the rain, got a call from dad on the bus cos my mum got worried that i wasnt home yet isnt she sweet 
0	Am home... full of stew and enjoying the greenness of countryside. Cat is looking shabby and very old
0	Am hot, sweaty, exhausted, hungry, soaking wet and muddy. Oh, and I've got a blister. Would've expected more from Hunter wellies. 
0	am hungry agaaaaaaiiiin maaaam
0	Am hungry when I shouldn't be ... my rice krispies should have kept me going for at least another hour and a half
0	am hungry, had decided want i wanted to eat but ive forgotton lol 
1	am hungry.. going to eat... catch up with you guys later & 4 people who are hurt by my sardonic quotes - why are you waiting, hit me back 
0	Am i a bad person if I do not respond to causes, n other stuff like that on FB? Sorry, it feels the same as receiving 'junk mail' 
0	am i a bad person?  i really hope this doesnt elevate to something worse...
0	am i a bitch? latley i feel like one
1	am i a hit maker? ×™×© ×ž×¦×‘
0	Am I a terrible person for wanting winter back? It's really hot
0	Am I A twitter whore
1	am i addicted to spanish and latin music nowadays ?,twittering with google chrome for linux it's fast i love it, let ff crash alone 
0	Am I alone in this? Exited the stock mkt at a big loss, planned to reinvest at a deeper low, and woke up to find the mkts have doubled! 
0	Am I at the hot mess parade for slop in a fitted tee and beauty supply store slip in jellies ?
0	am i da only 1 who saw da forecast 4 isolated thundastorms 2day?! cause im like da only person carrying an umbrella! i feel singled out!
0	am i dead or alive? feeling really sick...
1	Am I following real Leona Lewis... check it out 4 me
1	Am i hipster now?
1	am i hungover, or am i lazy? quite a common predicament as of late. looking forward to recording some tunes later  then studio in 20 days!
1	am i just good at getting replies from famous people? lol. 6 different famous people have replied to me.
0	am i living in Seattle with all this rain? Soggyboggyfoggy
1	Am I meant to feel happy and hyperactive in less than 24 hours after finding out my bf cheated on me?
0	Am I really that bad of a person??? Why do all people eventually hurt me?
0	Am I really too old for DM boots?
1	Am I really up this early? The thunder & lightning provide a nice background to the dog snoring...wheezing...snoring? Not sure
1	am I seriously up at this hour? Yes..thanks "B"
0	Am I shallow if I say that I wish I could find nail polish in the shades of green on all your icons? yeah I know- that's why ppl hate us
0	am i such a jerk?
0	am i THAT disgusting??? stupid husband wont even make love to me!!!
1	Am I the next Blumenthal?!
0	Am I the only one doing #whatareyoulisteningto ??
1	am i the only one excited for tmr? hahaha
1	Am I the only one that likes Jeff's hair without the color? Color is nice but natural is beautiful
0	Am I the only one Twitter is working for????  I feel so alone...
0	Am I the only one where Twitter is being really lame?? Maybe it's my Comp...
1	am I the only one who can't stand people who don't know how to act civilized out of their homes?
0	Am I the only one who has OCD about reading every single Twitter update from friends?
0	Am I the only one who is not excited about New Moon! I really dont see the fanscination with it!!
1	Am I the only one who likes Mondays?
0	am i the only one who thinks its weird,not seeing and together on tour,i miss the burning up tour 
1	Am I the only person that does not like Twilight or Robert Pattison??? .... TEAM CEDRIC!!!!!  <3
0	Am I the only person who has to work tomorrow?! Still on New York time
0	Am I the only persons in the UK that upgraded to OS 3.0 and didn't get some of the features? No MMS etc...
0	Am I the only Scifi fan around here? You know, Farscape, Stargate, Battlestar Galactica, Firefly Stuff like that. I'm the only stargazer? 
1	Am I the only with one a little crush on Vincent D'Onofrio?    He seems like he could be tough and strong, yet he's like a teddy bear. 
0	Am I too fat ewww gross I'm ugly and fat help help I need a new body  I feel bad cuz I'm the only one of my friends that don't got a bf!!!
0	am i ugly??i can't choose what will be my primary photo..gosh!!
0	am ill,exhausted,sore,at work and keep losing my temper 
