0	Cardiff Uni staff reprimanded student after finding offensive remarks on FB http://tinyurl.com/ad3vr8 (from
0	Cardio or Yoga? I should have done my cardio this morning..but I did not, I lifted.  So I think yoga will have to be tomorrow  Boo.
0	Cards down 6-5 bottom of 8th.
0	back in the dale-eo, still feeling kinda icky though 
0	back in the desert  missing
0	Back in the ER again.  Think it may be stones part 5
0	back in the hot seat! watching The Proposal tonight... i'm not excited... really I'm not.
0	Back in the land of Notts and up to our ears in solicitor's forms
0	Back in the lib. Reclaimed my Big dog title by finishing my Cottage Pie first tonight. Sneaky Sound System cancelled
0	Back in the offic.. Bleh. So did not want to get out of the sun  hopefully it will still be nice out at 4:30!
0	Back in the office after 2 weeks in Italy.
0	back in the office after a long weekend in texas - sometimes i feel like i need a vacation after a vacation
0	Back in the office after a week in Vancouver.
0	back in the office now
0	back in the office staring wistfully out the window at the sunshine
0	back in the office today. kettle doesn't work and quite frankly, microwave coffee just doesn't taste the same 
1	Back in the office, waiting on a couple of casting calls this morning 
1	Back in the office. Actually very ready to be here and start earning that next vacation  SO MUCH TO DO!
1	Back in the office.....
1	Back in the Palace of Arts to rehearse. Everyone was a bit more chirpy this morning  Sounding good!
0	back in the phil. so hot. missin new york
0	back in the place I don't want to be at
1	Back in the practice room today! New tunes on their way!
1	Back in the rockies ready for mountain air
0	Back in the salt mine   Hoping for a better day than Friday.
0	Back in the sandpit - not loves it
0	back in the southern hemisphere and feeling deflated. I miss my friends
0	Back in the States after an incredible week in Cabo!! I'm really going to miss seeing the beautiful ocean every morning when I wake up
0	Back in the states.
0	Back in the streets, my Bestfriend last day here 
0	Back in the studio today. Gimme something ya'll want to hear a song about. I'm lonely right now  need a pick-me-up!
1	Back in the studio tonight. 3 tracks in on the next album so far
0	back in the UK - bad times
1	Back in the uk and off to meet with the client's programme managers complete with walking stick for sympathy  It does seem to help a bit
0	Back in the uk and stuck in mega traffic jam
0	Back in the UK at St Pancras. 40 min tube to Ickenham to pick up the car then 2h drive home. Tired already
0	Back in the UK in 24 hours. Didn't manage to set up a 4iP Venice Beach office unfortunately
1	Back in the USA. Korea was outstanding.  Wish I could have stayed much longer, but duty calls 
0	back in the yucky city  pretty sure my voice is angry with me. Yet, I'm rejoicing.
1	Back in time to see with Love it! <3
0	Back in Tokyo! Unfortunately only briefly.  Time to roam my old haunts and catch up with old friends. Wish the NEX doors would open now!
0	back in Toronto, im so sad about it  my team and i really LOVE Kenora, ON.
1	haha well thats good
0	NY is poppin. That's y lol. And ima miss it when I move
0	I am lost. Please help me find a good home.
1	Judgement day or not? It's a perfect combination. Fast and furious
0	i got placea to go people to do gotta be there early sorry babe
0	i missed the ones you posted on nt
1	Hi brandon, so what does "@o lakers" stand for? 
0	lmfao.. Lucky girl ta! (B! I really really need toothpaste lmfao... When u coming back?
1	amen to that!!!
1	  Thanks for the nomination   So silly!
0	OMG fucking awesome! I'm so tired cuz I didn't go to sleep after it, but oh wow! Amazing! I'm so bummed you missed it 
0	oooh it doesn't like that one hun....
0	what's wrong?
0	Yes I'm fine, thanks. I'm just not very well at the minute, and very sleepy! 
1	It would be great if it weren't for all the dang boxes
1	  You're doing awesome... I'm doing the same thing... Keep fighting the good fight #iranelection #iran9
1	was it the advocate dates i changed on the lemont & south downers plans? blame not me 
1	come stay with me one night and hit the town
1	i will come see you today
0	 awe man. I got so excited.
1	 yup! but when u find some1 who hits u out of the blue & u grow & develop somethin 2gether it's beautiful, I now know better ;)
1	crazy me? i prefer goofy
0	my cell phone? What the heck can I do on here except Twitter  when I'm sad "internet window shopping" soothes me. Lol
1	haha I feel like I've been sitting in this new york traffic for 22 hours. Glad you guys had such a huge turn-out today.
1	LOL I will. Thanks
1	i just finished my PCW visual aid.
1	ha ha very funny, I am just as plain and normal [possibly boring even] as the rest of the world 
1	u know it! There r 3 of us
1	re: paris: hoping to go in december, need to buy a louis duffel and complete an acrylic triptic.  wanna come? 
1	Yeah, the month-old sushi just doesn't sound so appealing!  
1	fly safely please  and tweet of your safe arrival in germania!
0	Are you going to WWDC?  I will miss you if you are - going to talk at a KDD conference in Poland
1	without snow... leopard?  Excited for WWDC!!
0	Aaaaww do u really???  i hate being confused!
0	haha im struggling to get an extra digit on the end of my score
1	Lucky you guys Hope you have a great night
1	you're just stressed out. take it easy bey whatever it is!
0	eh..not sure daw guesting ni cha on monday
0	Ah...  What's wrong? To be honest, I can sympathize. I was listening to the radio and it made me somewhat depressed. 
0	Darn, gotta go wash the dishes. B-but I was enjoying looking up Twitter Trends 
0	darn, i missed my 250th tweet 
0	darn, our last sleepover before school starts 
0	Darn, speakers was hospitalized just before he had to take off to Seoul 
0	Darn, that big KSwiss advertisement with Ed W  on 31st and Broadway has been replaced 
0	Darn, third week of summer, and i haven't done anything exciting yet 
0	Darn, twitter shrunk the link  There's a functionality in wikipedia that randomly send you to a page. It's called 'Random Article'
0	Darn, was hoping the new Adium for Mac supported Skype chat, but it seems it doesn't 
0	darn, wife been in car accident 
0	Darn.  I have to wake up at 5:30 tomorrow, thus I have to sleep now. Highly upset that I'm mising Buck and KJ. D:
0	Darn. I used to be smart.
1	darn. it's sooo hot in here. can't wait until tomorrow.
0	Darn. Just found out The Hangover isn't released until 11 June! Damn you film previews for getting me over excited!! DVD again tonight
0	darn. my #unity3d trial install keeps crashing  can't force quit either
0	Darn. Well that didn't last long. Better luck next year.    http://bit.ly/15JeuP
0	Darn. Why do this little Swiney flu have to reach the Philippines. I'm feeling sorry for that ten year old girl
0	darn.. my cellphone is my alarm clock and I'm phoneless until wednesday..  Crap.
0	darn...u let me down FACE!!!
0	Darned #Twitterfon on #iPhone keeps crashing out of web browser - probably 1/3 of the time  Other than that LOVE it!
0	Darned netflix shoulda been here by now.
0	Darng My Shyness, I Cant Get The Guts To Talk To This Girl 
0	darnit now I can't stop coughing
0	Darnit, ramen has milk in it! Gonna look for something else to eat. 
1	Darren the waving goat  http://bit.ly/UyyWF
0	das handy ist tot   i'll be done with work soon. 20 minutes at most.
0	dash!...forgot my headphones 2day  I cant get 'in the zone' without them anymore. Any techniques out there for blocking out the noise?
1	Dashboard confessional reminds me of summer
1	dat new new background
1	Data.gov comes to life! (even in the form of a jpeg image - all great things start like that  ) http://data.gov/
0	Database column spelling bee: Amount - A, R, M, O, U, N, T - Amount 
0	Database design  .. but worth it (better be!)
0	Database error with my site?
0	Database Replication RnD
1	Database upgrade is complete.  Looks like it worked!
0	Datacard not working.. browsing frm office..
0	datavase BBS is again down  Wondering if it is like yesterday; my ISP changed my IP again?!
1	Date 2.. Take 2!  She got off early (no comments from the peanut gallery) so we have decided to have a part 2. New dating energy ROCKS!
1	Date day!!! First a movie, then massages, followed by dinner and a walk. 
1	Date Like A Man So You Dont Get Played Like A Bitch
1	Date Night  then racing the Nike Women's 5k in the morning...
0	date night canceled... he's not feeling good....
1	Care Free. lets just have fun, get past the tears. cant wait till The Last Song 
0	carelessness, carelessness. again and again and again and again. 
1	Car-free Sunday at Hannover City ;)   We will walk, use a bicycle or use the inline skates  only no car ;)
0	Cari is out in that storm.
0	Caring for xavier!!! My baby is covered in hives!!!
1	Carinos with mom and sis
0	Carl Edwards out. Hopefully Jimmie will hold on. Sorry Bro in law.
1	Carl Williams = best ambassador  for Reachout  Goooo team
0	Carlenn Smith withdrawls
0	Carless till 5ish
0	Carlita needs to be put on Life support.  .. But I'm not home ; so i can't. Guess she just gonna have to die. Oh well.
1	Carlo got me all set up on Twitter so y'all look out.
0	Carlos Tevez is leaving Manchester United!!   Even though we agreed to pay 25.5m and raise his pay! - http://bit.ly/Iavc1
0	carls jr is full  at kim gary instead. so many ppl here! lucky got place to sit, hehe.
0	carly needs to call me back   I hate waiting on people
0	Carly Smithson = Knock Off Amy Lee Now.  Why?????????
0	carmen, you stand alone. everyone loves zoey 101.   michael&chase are the cutest best friends in da world 
1	Carmines/walking around the city with tay for birthday dinner number three
0	Carnival food isn't the greatest, sore tummy 
0	carnival was fun! scratched up knees isn't
1	Carnival!!!!  Party and Party and candys.!!!  And of course fun, fun and fun with friends!!!  ne,  love ya :-*
1	Carnt wait for 3.0 update tomorrow now the dev team have an unlock  no more rebelsim, thankyou dev team!
1	Carolina Timm in Brasil-HI! your Twitter automatically updates MY facebook! Can you please disable that in your account settings? thanks!
0	Caroline Flint's gone. Terrible minister, but she was kind of fuckable 
0	Caroline was too cool to do bumper cars wif me
0	carolyne: think I caught something on the plane home from #SLA2009 Let's hope it is not H1N1, but it feels like it 
0	Carphone Warehouse can't sell the iPhone 3G S 32GB on PAYG.
1	Carpooling to work! Swinming and biking today...and some work to do
0	Carradine and Han from Enter The Dragon on the same day  . The nine year old me is throwing hard mud at the petrol station to stop crying
0	Carradine's unfortunate demise has reminded me of a similar loss of a fantastic musician.  R.I.P. Kevin Gilbert.  Auto-ero Asphyx sucks.
1	Carrie had her baby last night!!  Congrats everyone! So happy to hear that things went well. Can't wait to visit.    #fb
0	Carrie is fantastically beautiful! i wouldn't know what to do with her
1	Carro left again, she was too tired to stay x) I'll be heading toward dreamland soon as well  xx
1	carrot sticks and hommus
1	Carrot, Apple, Ginger. mmmmmmmm 
1	Carrot-pineapple smoothie, anyone? 
1	carry on gaming or watching tv .... can't decide
0	carryin weight of 13kg for nearly a km is tough job. ah! my hands
1	Carrying my baby cousin
0	Back in toronto...yeah!! Craving pinkberry...boo
1	back in Torrance for the summer!
1	Back in town tomorrow! Or is that Sunday, anyway leaving London tomorrow. Tres excited 
1	Back in town!
1	back in town...... had to 'force' the frontdoor as there were 21 days time 3 dailynewspapers waiting for us, not 2 mention regular mail 
0	Back in UK. Can't believe I've managed to pull a muscle in my neck. Yes in my neck people. When I lie down I can't breath too well
0	back in uni for another day...
1	Back in Vegas. Flew in from Vancouver. What a beautiul city! - Now getting ready to be at Mike Filsaime's event  for Marshall's stageshow
1	back in wayland  its good to be home
0	back in wilkes-barre. plus lots of flowers. minus boyfriend
0	back in work after hiking up some very tough mountains in the blistering heat over the weekend  still de-hydrated!
0	Back in work after week off... Feeling a little groggy at the moment and a few aches and pains
0	Back in work,, at least it's not raining.  Upgraded the software on my iPhone, but the mms doesn't work & it should  not happy
1	back in zurich, beautiful new shoos give me an "everything-is-possible"-feeling 
1	Back indoors after a nice few minutes at the terrace with the birds. lied down on top of the water tank looking at the sky
1	back inside, too hot 
0	back inside. I think i should start some revision      n'awwhhhh
0	Back into dreary today.  Oh, and for the next five days! 
1	Back into the rat race! No more swimming for this chica....for now
1	back into wow after my 2 month break, my guild just killed yogg and now I show up, looks bad I guess  lol
0	Back is agony this morning, don't know what I've gone and done to it. Trouble even getting my shoes on! 
0	back is gettin better still need a walker, no good for softball wednesday and im prolly out for the tourney saturday 
0	Back is hurting.  x
0	Back is in pain.    2 days in a row now.
0	Back is killing me
0	Back is killing me, wish the pain would go away 
0	back is killing me. I hope that the other guy is in pain too. :/ This sucks.
0	Back is sore from sitting on chair for two and a half hours gettin tatted up!  never again..
0	Back is spazzin out ..i hate this pain already
0	Back just in time for work
1	Back later folks - feel free to follow - will always follow right back!!!
1	back later obviously
1	back later tweets - enjoy every moment of your day!
1	Back now...just had tea  Bloody parents giving me a lil lecture...apparently i'm absolutely antisocial. Fine by me
0	back of phone fell in a lake.
1	Back on board. bub to be has taken my tweetstream by storm this evening! Reading back through the tweets!
0	Back on Firefox... my online courses weren't displaying correctly in Chrome...
1	back on here later tonight. SO bye for now my beautful friends. Keep sending the love  xoxo
1	Back on Irish soil
0	back on it got caught and came back off  im a bloody mess!
0	Cars been dropped off for service and mot  getting the train home! Hate public transport!!
0	cars clean-check, Dogs Boarded-check, House Clean-check, Pack...  in progress
0	Cars cost too much.
0	cars costs a lot of money to run
0	Cars fixed! But no aircon  so still in garage. 2 busy 2 notice its gone! http://www.worklifebalancecentre.org/  fancy a whole centre 4 it
0	cars in the shop  but im driving a Charger as a rental
0	Cars is so cool. Awww maaaaan the storms gone  gonna have a lovely relaxed evening!
0	cars pack. now to take my final and bounce to cali
0	carsiiiiiiccccckkkkk  ugh reason #52 on why i hate the backseat.
0	Carson and lauren just showed up
1	cartoon: Making A Career In A Post-2.0-World http://bit.ly/tKBhu  LOL
1	Cartoons and packing
1	Cartoons etc soon to be atavistic avatars? http://bit.ly/16mrEL (yes I've always wanted to use those 2 words in 1 sentence
0	Car-warmed Sprite tastes like sore throat
1	Casablanca is waiting for me... tomorrow leaving Quebec city for Montreal by bus then fly to Morocco !!!  Isn't exciting ??? Life is good
0	case of the mundays. fixed a _simple_ bug but testing it lead me down a rabbit hole
0	Case studies are evil.   If only we could write them on Korean boybands.
0	case study isn't being very good at the moment  sneeze multiple times XP
1	Casey and I are getting pizza and watching Lifetime movies!
0	casey cant go  no stalks tonight. i wanted to bring something up with kim too..haha
0	Casey has spent the majority of this day at the dentist  yeah i miss him
0	Casey is 8th... but hasn't pitted yet  #nascar
1	casey is a doodle
0	Casey is coming over. Hills finale tonight with the usual! I'm sad
1	Casey surprised me by showing up at my house tonight! i was so happy
1	cash money still the company and weezy boss
0	CASH RULES EVERYTHING AROUND ME
0	Cashflow forecasts are fun but big red numbers aren't
0	Casino not hittin' lost my $ going home now  money
