0	Doing the ballot thing at the party. In the technical awards, I'm sucking...4 out of 8 right  ah well, we'll wait for the rest of the show
0	Doing the best I can to help my friend but it doesn't seem to work  Don't know what else I can do...
1	Doing the Control Hw, wow how much fun  loool.
1	Doing the deeds with the friends and watching people going through so much is hard.  Must guide, help and get them through.  
1	doing the dinner, today kebab 
0	Doing the english homework.
1	doing the hairrrrrrrrr
1	Doing the hoedown!!!
0	Doing the homework _before_ my mental peak passes.  Had problems spelling peak.  Ir might not be good.
1	doing the last bit of my eng assesment!!
1	doing the Monday thing again
0	Doing the most EMBARRASSING thing I have ever done in my life...don't ask because I can't promise I'll tell
1	doing the national academic challenge with my friends
1	Doing the newton thing. These people are SLOW!! WTFIGO!!
1	Doing the opposite of and using http://friendorfollow.com/ to follow people I forgot to follow back
1	doing the same thing chantal is  and francesca is still freaking out
0	Doing the tourist thing around Townsville. Still feel knackered from flu tho   http://twitpic.com/7s5z9
0	doing the usual with breakie in starbucks before heading out for the morning with cameras, but weather looking shite at this stage 
1	Doing the weekly drive by thru Mandarin soon.
0	Doing things around the house...long night at work last night.
1	doing this final .  then sleeping for a little while longer
1	Doing this from Windows 2000 from KVM!!!  This is good...
0	Doing this report on legalities and ethics is dryyyyyyyyy
1	Doing this, with her, by them  http://twitpic.com/6fmyv
0	Doing TT today  cant wait for monday! Nice relaxing day off!
0	Doing uni work ohh the joy
1	doing was,than cheacking my mail...than practice till like 11 
0	Doing website shenanigans. Slimming down CSS is fun. I had an idea a day ago and now I forgot it though
1	Doing what a girls gotta do and its painting toenails
1	Doing what I do best...procrastinating everything!!!  Giving myself....just a bit more quiet time before getting started!
1	doing what i do every monday, watch wizards of waverly place until 6 
0	DOING WHAT IVE BEEN PUTTING OFF DOING SINCE I GOT HOME FROM VEGAS....ERRINS
1	Doing what my hand's finding 2 do... And loving it  Also looking back a great wknd filled w/ faith, family & friends &building the house
1	doing work  almost done schooooool finally!
1	Doing Work As Always
0	Doing work so I can have time to chill, but ever time i finish it. a new load of bs gets piled up  fuckin school aka Plan B
0	Doing yard work ... still have to wait to put my flowers in the ground  damn Ct. weather
1	Doing yardwork
1	doing yet more college work, not alot left to do now actually 
0	Doingg revisionn
0	doingg work.  ughh! need inspiration.!
1	Doinng haiiir, then out with tom sierra & erik 
0	doinnnn' some hmwk, projects, studying, what a nice way to end this long weekend 
1	doinq the same thing buh watchn enough with jennifer lopez my cuzin
1	Doinqq a Fuckinq Essay -_- actually qotta do 2 .& iLoveYouBabe
1	Dollar beer night with the girls
1	Dollhouse - Ooops. Wrong.
1	dollhouse was AMAZING tonight can't wait for the season finale next week its getting intense
0	DOLLHOUSE, HOLY SHIT !!!. i will personally set fox on fire if they don't renew this show.  BEST EPISODE EVER!
1	Dolly Parton Delivers Commencement Address at the University of Tennessee 2009 http://bit.ly/DUFUn   hahaha cute
1	Dolly Parton has such an amazing voice.  It's musical all on its own.  <-- little thing that makes me happy today
0	Dollzone orders for the LAST half of March should be here about June 17th. Still so delayed!
1	dolphin today+ CRAP  it was so boring anyways talk to me aim: amandadropdead01
1	Dolphins  lots of them bow-riding us
0	Dom deluise is in oliver and company
1	Dom! Ahhhhh  GB! Miss them so much!!!
0	domain controller is screwed up. no idea what's wrong. had a very productive morning debugging infrastructure problems
0	DOMAIN SQUATTING SHOULD BE ILLEGAL!
1	Dome update: as an engineer and not a project manager, I should quadruple my time estimates for building this dome. 
1	dominated fuge rec today. well... sort of. won "pulse", but got ratted out by  he should watch band of brothers... 
1	dominating at guitar hero
1	Dominican Republic : tomorrow mother's day!!  happy mother's day mom! <3
0	domino's doesn't deliver to my house  no bread bowl pasta. weep.
0	DON' DO THIS TO ME JEFFERYYYY
0	don dropped 5 grand like G...in 1960!  wow..baller status
1	Don' know why but mowing the lawn first thing in the morning feels good!   I need a house....
0	Don went to fill my scrips.  Back to eating toast.  Got sick before leaving the qwk care. Yuk.
0	Don`t kno if Ester is gonna make it home
0	don´t wanna go  i love it here!!
1	don’t be pushed by your problems... be led by your dreams!
0	Donald Trump is now the new owner of WWE Monday Night Raw.... YEP! I think I'm gonna stop watching wrestling soon...
1	Donate to the Hawaii Food Bank TODAY!!
0	Donated my dive slate to the Fishes and Ghosts of the exHMAS Brisbane Wreck..
1	donavan is going to sing
1	Done  al kuliab weddings and more to come ))))
1	Done  only tomorrow night left.
0	Done  so sad  goin out 2 eat
1	Done  still talking to him
0	Done 2 hours at KX now off to to meet friends for lunch. Sticking to my 2 coffees per day...Its raining
0	done 4 today.... i smell a bad day for tomorrow...hope not !
1	Done a cover of our lady j for youtube  http://bit.ly/jX5oh
1	Done a new flatpack, the tile man is half way there, he also talks to him self  Think I can start the floor tomorrow evening......
0	Done a quiz called Micheal Jackson Loves You! Jacko tied me to a tree
1	Done all my web browsing, time for breakfast 
1	DONE and DUSTED. Have a good life everyone, i'm off to watch Mr Bean 
0	Done at body english already..lame...my feet hurt...now at dinos looking way too hott for this place
0	Done at the spa   now meeting vic for some late lunch!
1	Done at the store! I got all I wanted
0	done at work but got more hair to do after... sooo exhausted
1	Done canoeing and what not. suprisingly im hardly burnt at all
1	Done cleaning house & doing laundry for the 2nd time in 4 days. It's got a sparkle to it. Gonna take a break for a couple of days
1	Done cleaning the apartment for the first time as a BSc  Didn't feel any difference, though...
0	done cloud hoppin' until dec. thank goodness. i felt sick by the last flight.
1	done dancing... sleep! then apt hunting in the morning
1	done differential's review w/ substitute teacher Mr. Joko, thank youu PaJok, 
1	done dloading John Mayer songs. "Free Fallin'" is nice.
1	done doing my assignments for tomorrow!.heh  need to rest now.. ciao!     ~~no boundaries~~
1	DONE DONE DONE... tomorrow i start the maths assignment/researching for my sociology assignment!
1	done downloading Jack
1	DONE dun dun.  I guess we're getting off the computadora. Night.
1	done eating choco mucho.. yum yum.. LOVE IT!!
1	done eating dinner  currently 6:36 here at the Philippines  watching mysterious play OVA 3.
1	Done eating dinner! I'm so tired! I really love the shirt that my mom bought to meee!
0	Done eating now my tummy hurts bad
1	Done eating, now playing with the dsi, hanging cousin, and katrina(: damn, why are the waitors so damn fine?! 
1	Done eating. 'Twas kindda fast. Enjoyed the food. Yummy chicken.
0	done eating.I didn't like my dinner that much.
1	done editing a pic!  Imonna read newmoon now.
0	DONE EXAMS !  now i'm sitting at Keelie's place; going to get some groceries and then watch a mooovie, Yk weather is crap today, 
0	done feeding horses this snowy, windy April morning 
1	done folding shirts! i get off at 2 and it's off to Lace's baby shower!
1	Done for day. Sendin my sweetie home before I head out to my crib..tiring but fun day  - http://tweet.sg
1	done for my lectures tomorrow at PAS monthly meeting!
1	Done for the day  now to make an awesome sandwich
1	done for the day ... now like 5-6 hours of sleep and then back to my normal day job  still, being an independent game developer is fun!
0	Done for the day today. Now eating at the world's worst Wendy's ever. How does a Wendy's run out of crispy chicken sandwiches?
1	done for the day.
0	Done for the day. Busy day tomorrow filling orders, fixing a friends mistakes  and working on some special orders. Woot! G'nite!
1	Done for the day. Long day but good. Still in pain but 3rd place it's not bad for the handicap guy
1	Done for the evening. Sold so many drink tix to so many alums! They're a rowdy bunch - I LOVE THEM
0	done for tonight. educated myself quite a bit on restful interop but not a lot of progress
1	Done gig 1...otw to brad's...sending ? so called birthday present for ? ....wish i can go there along with d package..hehehe
1	Done in school. Now home and put a face on and then off to a casting  I don't do very well on castings so keep a finger crossed ;)
0	Done lifeguard training till tomorrow. CPR Pro training now till 10
1	Done making personalized papers.
0	done maths exam , now home , with nothing to do 
1	Done my 6km run, situps, planks... now making coffee and getting ready to go to Quebec City for the day! 
1	Done my biology and chemistry  Might start on maths ina sec, x
1	Done my book finally. All my little stories became into one thick book. Its great  gunna put it into the none of ur buisness box!!
1	done my make up for the youtube comp
0	done night shift,hit the gym on way home...wishing it was an O'Darby wkend....too bad about someone being on call in ER all wkend 
1	Done packin finally shesh.......Veeeeggggggaasss!!!!
0	Done packing! Ready to go...but not
0	done painting 6 of 12 windows and the shed - soon to paint the whole house 1 more time
0	done painting, gotta prepare for another shoot tomorrow morning, then next stop is more painting lol...what a life 
0	Done practicing. Still missing camp.
1	Done prefunkin with ciroc & lemonade. Heading to XS? Where the hell YOU at?!
0	done preparing the coffee shipment for tomorrow morning...  time to go to bed... gotta be up at 4am
1	Done producing "Setiapku Denganmu" for Phalique Verbalize Flo. Nice song look out for it! Now doing my song "Satu Dalam Sejuta"
1	done ranting for now. thanks for the vent space, Twitter ! 
1	done reading for now, computer here i come 
1	Done setting this up, now CHARLES MERCURY IS ON TWITTER! Hell yea! 
1	Done shopping at the mall. Now at home
1	Done shopping in Rue 21 ;) fly ass boyshorts plural(s) meaning many
0	Done sicene test, complete crap  but oh well, finished EC Ch 4 so will upload that soon and now about to tidy :S
1	done straightening my hair and i look emo-mazing lol twilight sleepover with tomorrow  cant wait!
1	done studying for finals for the day. time for the mtv movie awards! i've been looking forward to this all day
1	Done studying for finals.  Watching bones now.
0	Done studying for the night. But kinda too tired to actually do anything
0	done studying, waiting for the last episode of the hills with .... gonna be a sad moment to see her last episode 
1	done swimming for a week
0	Done swimming nose Is burnt  watching tv I love these people
0	done swimming. checking out later
1	done tanning; on my way home now..! lol.
1	Done- that didn't take too long  Thankfully Italian isn't too hard, and the words I didn't know were the name of a footballer.
1	done that with the Audi. And I'm barely 30 ... so please be nice... 
1	Done touring Solvang today. Not much to do there, Paul and i just strolled the quiet streets & got some Danish cookies. Gotta sleep now. 
0	done translating for today. Getting ready for a rainy weekend
1	done tweeting..... til tomorrow..
1	done two washings, got more shopping in, cleaned the kitchen.. NOW! I get to shop for pretty things for France and go to the park 
1	Done volunteer work at the cat adoption center with the girls, getting ready to go to the movies 
1	Done voting for the EU parliament and the city parliament. Now seeking beer to celebrate the failure of HFC
1	Done w gp essay thingy, and yea he came across my mind and suddenly I wrote a paragraph about him. Yea, you're my insipiration for today 
0	Done walking my mother gets tired fast  had to turn around
1	Done watching At Musings' End. It was a great short.
0	done watching gossip girl :| now what?
1	Done watching some MCFLY FUNNY VIDS! HAHA. I Laugh Out Loud because of `em! I love DANNY'S LAUGH!
1	Done wid exam! 6 more left! Weekend!
1	done wit final
1	Done with 1st day! Saya!! Kasya pa uniform kahit tumaba. ;p If God wills, last year na ito!  (or not? MED SCHOOL! pleaaaaaasee!)
0	done with AMCAS. paid the expensive bill. broke
1	Done with briefing too. Looking forward to a fruitful learning journey with LTC
1	Done with cheer camp!!! YAY!!!!!
1	done with chili, saw wolverine, and now is eating at IHOP !  
0	Done with class, then work at 2  i hope its slow today, im soo tired.
0	done with college ?!
0	Done with color guard try outs! The sky cleared up except for that one side with the ugly gray clouds
1	done with dance pics  last night was epic
1	Done with drunken Tao. Done with Dan Marinos, 100 wings! Heading home with Rolanda. Beating the sun! 
1	Done with english exams for the close time
1	Done with finals for the day
1	Done with finals!!!!
0	done with first exam... the next one is anatomy and i have to memorize those
0	Done with french for now learning economics
0	done with FYP for today.. there's more to come tmr and wednesday and thursday..
1	Done with haircuts... Home to kiss the boif and take a nap... Work at the 2nd job in about 45 til close. But life really is too good
0	Done with high school
1	done with homework.... its gonna be quite warm today!
0	done with interview..who knows how that will go..gotta go to wrk
1	Done with Legend of the Seeker .... awaiting suggestions :p   Help
1	done with lesson plans . . . yay ! going to hit some golfballs
0	done with lp meeting, off for the rest of the day! recoup for an hour then to the moore's for kristen's moving away lunch.......  
0	Done with marathon Saturday meeting - missed being outside on a beautiful day.
0	Done with MOMA, off to go shopping in the rain. UCB tonight, then off tomorrow. I don't want to leave! 
0	done with most, but didn't do a couple of things.  I shall wake up in 4 hours. *cries* 1st week of school and i'm already losing sleep.
0	done with my classes till tuesday..heading to Miami to move my boo in
0	done with my coffee, and the skating and twitting... gone to zara  Bye! 
0	Done with my homework...summer school is already kicking my butt
1	Done with my last class of my first year of college! Only 4 finals away from summer
0	DONE with my last spring semester of college! only one more semester left
1	Done with my medical check up!!! Hoho I lost weight!!!
1	Done with my movie marathon...going to bed now.
1	done with my power pont!
1	Done with my semi night cap, Im getting alil tired. Got stuff 2 do N the a.m... Time 2 private myself buh-bye 2 all the nosy-heads 
0	Done with my Sophomore year.  Only two more yeeaaarsss. Meh!
1	Done with my threesome  going to victorias )
0	Done with my Week Four!  3:23-5:10
1	Done with one...three more to go.
1	Done with open house!
1	Done with party, cake was a hit!  Everyone loved the rainbow/tie dye effect and was surprised when we cut into it.  There was none left! 
1	done with PEC. officially on holiday now!! can't wait to go home
1	Done with Prom Night.   Watching videos on Youtube.
0	Done with SAT II. Errggg, not enough time. Didn't finish 6 questions 
1	done with senior interview! got my yearbook  APES project due tomorrow for extra credit!
1	Done with shopping in Colorado Springs, almost home. 
1	done with Shugo Chara
1	done with spanish  and kadys coming today!
0	done with studying... for tonight. last day of classes tomorrow! but then finals  booo
1	done with sunday school.  had a lot of fun
1	Done with TEIT Semester -2 examz....Software Engg. was bad.. rest were quite bearable
0	done with term A.. now onto term B
0	done with the cruise
1	done with the database crap. getting ready to write some blog posts
1	Done with the e-mail catch-up game, finally!  Time to get some sleep and do some real work tomorrow.  
0	Done with the funeral  off to camp again/// I can feel that God is going to show up in a big way tonight!
1	done with the gardening today, good job done.... 
0	Done with the glitter. Sad face.
0	Done with the house cleaning  The reward; a yummy meat sandwitch!!! Warm thing up b4 2day's workout
1	done with the packing and everything else ... leaving in 3 hours ...
1	done with the pouring! no more rain for the day i hope!!!
1	Done with the presentation - doneeeeeeeeeeeee
0	done with the task. continue studying
1	done with the video convert . Now for the editing
0	Done with today and it's just starting.
0	Done With Win A Date With Tad Hamilton. What Next? Can't Find A Good Version Of I Love You Man  N
1	Done with work today and I don't think I have to come tomorrow    Me and my bicycle are heading home now.
1	Done with work today!
0	Done with work. Just copped 4 new pairs of swimming trunks..heading to the pool at the cove..not like wolf creek though
0	Done with work. No $$  but I'm showered and ready to crash. Clean and tired is a great feeling. Don't know why.
1	done with work. off to church, then meeting up with old friends.  cant wait to see everyone...then work tomorrow, golf, bbq, and party!
1	Done with work. Riding my bike home on a good day!
1	Done with work. Yay!  I like how the mall closes early on sundays
1	Done with X-Men: Legacy #226. Check it out next month!
1	Done with Xxit & Danielle's shoot! Rotating now
1	Done without any problems! Now we'll see how it works! Lookin forward to my third coffee (i love Nespresso
1	Done work and relaxing
1	Done work till Wednesday.. lot's of new arty things starting tommorrow today a day to be with the one I like a lot...
1	Done work. Going to the pool tomorrow then Colin is picking me up
1	Done workin'!
1	Done working on the vid for tonight lots of work still ahead but i love how its turning out! Can't wait to post it on youtube! Night
0	Done working! It's time for some singing music! :-D I love the Twilight Score, I play it at work and at night, but you can't sing it! 
0	done working. 24 hours are never enough... oh boy...  6h45 up again. heheheeh. hasta!
0	Done wt i had to with the �150... Back to 50p in my pocket
1	DONE! 837 words will do.  Happy. Now I can relax.
1	Done! And as an extra I just saw a beautiful rainbow
0	DONE! but i would  be way happier if i hadn't eaten so much wheat yesterday
0	Done! Goin home to eat dindin and contemplate what the night holds for me
1	Done! I feel like it went well! Hopefully I'll know within a week!
1	done! me and Maja have just had something pierced  hopefully, this time it will heal... touring from tomorrow 
0	Done! Now i have to wait 2 weeks
1	Done!!! 3 sessions in 10 hours (w/driving), need a massage, but got awesome shots, lots to post, now food AND dessert. 
1	DONE!!!!  so tired.  and my body aches.
1	done, all my family has their own domain name 
1	done, done...and done. Later, out to meet and + the dereks to see UP. 
0	Done. *visitis javascriptkit's word count* Arse, I think I overdid it. 
0	Done. Cleaned out my locker  now its feelin real
1	DONE. had a good night.. made some new friends.. i have to forget about the past and just move on.. no more dwelling. goodnight.
0	Done. I screamed at the end   Ashley laughed at me. go play! http://www.hotel626.com
1	Done... with the #run : 14.5km / 1h33mn / 153bpm . Feeling great, no fatigue... and no speed 
1	done__need a rest for a while__sleeping
1	Donee My Ict Testtt Bitchesss, Tani TUT TUT Tut  x
1	doneeeeeee!  wuah mau dong put pinjem the sims 3nya hehehhehe
1	Donegan's pub was good for afternoon drinkies!
1	dong d-dong dong dong  the thhhhoooonggg sooooonggg
1	Don�t need a joint to be happy, and don�t need any fucking idiot to destroy my night. Good motherfucking night! 
0	don�t want my BF to leave me this evening for another week...
0	doning history revision  i am one unhappy chappie atm
0	donna what to do.  does anybody have any ideas?
1	Donna, thank you for the wonderful mention! Have an awesome day. 
0	Donnie must be cold out there in the garage....
0	Donnie schläft mit Sonnenbrille und Cap? CRAZY GUY! Have to go now!
0	donno how thye make them so big in Hyd... the blasted lizard is twice the size of my palm
1	Donno what that was but whatever I randomly cameout and said it to ones mother...want to speak olde today!
0	Dont  ever drink  its not a good feeling in the morning
1	Don't accept your dog's admiration as conclusive evidence that you are wonderful. ~Ann Landers
1	Don't act that rigid
1	Don't approach a goat from the front, a horse from the back or a fool from anyside 
0	Don't ask me how but I think I've pulled a butt muscle. Can't even walk...this ish sucks
1	don't ask why i was yelling. i honestly couldn't tell you
1	Dont be a hard rock when youre really a gem
1	don't be a slabber. u come down to my house right now
0	Don't be bummed!  we can make up for it.
0	Don't be emotional Leah, you hate the douche nozzles smart one!!!!! Rose is so stubborn!!!!!!!! God, Help us!!!!!!!!!!! 
0	dont be sad friend  ill keep you company
0	Don't be sad Luongo!!! :'( Not completely your fault.  You're still the best <3!!
0	Don't believe it. Overflow pipe from flat upstairs is pouring out above my front door again
0	Don't blame, it wasn't my fault. What do you get for telling me those? Pissed. 
1	dont bother answering that or it will ruin the whole point of the zoning which will make the spelling irrelevant
1	Don't bother, I'll be fine. But she's waiting, the ring you gave to her will lose it's shine. So don't bother, be unkind.  
1	Don't care  Wish it was Thursday, I miss kole.
1	Dont care enough to write you a letter now that im doing better alone
1	Don't Catch a Brick -With The Punches is currently my favorite song.
1	Don't Charge Me For The Crime- Jonas Brothers.....it's different, but cool.  Ok, now it's Turn Right. Ahhh, beautiful. 
1	Don't click this link  http://tinyurl.com/pbj7rb
1	Don't come back, go live that so la dream you want, show people u can. Becuase we all wanna be proven right. 
1	Don't cry over spilled wine
0	Don't cry over spilt milk.. cry over falling face first infront of 15679 Tafe kidds
0	dont cry plz dont i will cry if u cry
1	dont disturb me for 3 years. okaaay  until i'm finish my study
0	don't eat sugary cookies before swim practice.
0	Don't even bother!
0	Don't even have to know the score. A Twitter search for Denver tells me all I need to know.   oh well, we got -some- excitement this  ...
1	DON'T EVEN THINK ABOUT POSTING ANYTHING ABOUT THE FRENCH OPEN TODAY!!! please
1	Don't ever call me pretty; I'll just make a reaaaally ugly face at you.
0	Don't EVER stick tape to your face.. I JUST learnt that the hard way!
0	dont feel bad  danny my picture wont up load  either
0	dont feel good  waiting for alan to get off work.
0	dont feel good / tired and mom want let me stay home!!
0	Don't feel good at all. Worst migraine i've had in the past couple months
0	dont feel good right now  cant sleep my stomach hurts to bad!!
1	don't feel good, helping with the poool again, then prob swimming  ilovejoseph<3
0	dont feel good, laying down. 
0	Don't feel good, throat hurts along with my WHOLE body ughhh!!! 
0	don't feel good... don't wanna work later
0	Don't feel like doin shit, but already promised my homegirl id help her move.   wtf.
0	dont feel like getting ready ughhhhh
0	dont feel like gg to sch.
1	Don't feel like going to school...............but I have too! Thank God I start at 13:00 so I have to leave around 12:00
0	Don't feel like working
1	Dont feel like working much today
1	don't feel like working out yet again...but I know when I do it I will feel way better.
0	don't feel safe this cab driver keeps reading the newspaper while driving  Not to mention he asked ME for directions & smells like butt
0	dont feel so good & cant sleep
0	Don't feel so hot. I have a headache and my tummy feels naucious. Correct me if I spelled that wrong.
0	Don't feel to good...my body is no longer immuned to grease. Back to the good ol diet tomorrow! Blah blah blah
0	don't feel to well today
0	Don't feel very well  Going to have a brief nap before heading out this arvo. xx
0	Dont Feel Very Well  xx
0	Don't feel well  http://tinyurl.com/lhyk9m
0	don't feel well at all, may need to phone in sick to work 
0	dont feel well enough to go to beach party  puppet fun moblie...yuckkk
0	dont feel well sooooo no ROCCO for me tonight!!!! ;-(  !!!
0	dont feel well...
0	Don't find the solution for the "jumping" div with jQuery slideToggle... Have to bookmark more sites when I needed them the first time
0	dont fink my chalazion surgery has helped....  #bsb
1	Don't forget about Daniel! Just ate a whole pizza. Mmmm good.
0	Don't forget about me  just click http://twitpic.com/ro0cksy
1	Don't forget all your clothes
1	Don't forget boys and girls Acting class tonight 7:30-9 and Hip-hop 6:30-7:30 get your butts there!! For more info DM me
0	dont forget by is the best song right now
0	don't forget everyone tonight is Leno's lastnight on The Tonight Show
0	don't forget http://bit.ly/HAR5W 150 Seat Guarantee. $12K Packages incl $2k spending money. THIS SUNDAY!! Sats on now - will be on plane
1	Don't forget it's Mothers Day today, guys  But a smile on your moms face by giving her a call.
1	Don't forget Lincoln tweeps, open mic night tonight, Cafe portico at the Terrace, doors open free admission! 
1	Don't forget that 'Rivals' is now on i-tunes and in all good record shops.  x
1	Dont forget that Saturday is #underapound day  http://140characters.co.uk/
1	don't forget the alcohol, oooh baby, oooh baby! Poor old Milez... 
1	dont forget the toothbrush
1	don't forget to call (your) Mom tomorrow
