1	well I prefer to Love, Laugh, Live... 
1	Happy Wednesday Lisa!!
1	I want that in writing - like maybe a personalized signature in your new book...
1	MORNING! lol shhhhhh
0	Yes I did. I missed the first few minutes though.  Maryann is really making me scratch my head. Eric in foils!?! LMAO!
0	 Aw, hon, I am so sorry.    We've lost two dogs since January, but not that close together. I feel your sadness...*hugs*
0	I nearly fell out of my chair.  *clings* my life sucks, dude 
1	ist doch nice
0	Are you going to USA's?  B/c I can't
0	OHHH so you're saying my face is fugly.
0	This person is a full time maverick. I only noticed it today. I don't know her name though
1	they send it to you separately
1	Wanky name is wan- oh, you beat me to it. Bienvenue, noob. 
1	Thanks for the #followfriday mention
1	You're over the age of 6 and you still don't know that men are ALWAYS wrong?
1	Just wanted to randomly say I hope the Rumble Girls launch is going great  ! ! !
0	 I'm sorry
1	nothing big, I had an AMAZING DREAM! which included you &andy 
1	  thank ya girl....im bout  5 or 6 hrs till i go to sleep  but thank ya!
1	 did u see on mr twitterverse? i cant get it to work...will u vote for him for me ? he has the #eric banner
0	 sorry to hear that Bella.  Let's prepare for a different tomorrow using what we learned today?  hugs,
1	 there is alot of into out there... and  hopefully tomorrow we'll have even more!
0	 Yes, we live only about 10 minutes from each other. Sorry to hear about Pepper 
1	 Yes.  Is that okay?     Wouldn't want to be politically INcorrect.    Hugs, Angel
1	g'nite U... and thank u .... really!  way above and beyond!
1	have a peaceful nap and i will tweet to you later!
1	Sweet signoff...Rest Well!
1	Welcome, anytime!  I do what I can!  
0	it cut my bloody head off  this is seriously bad leaaaa xxx
1	I'd hand you a tissue, but my box ran out. 
1	What dyu mean by 'something great'? I've done lots of cool, great things that may qualify 
0	Aww sucky...
1	Nope. That just shows how much I love you.
1	 Thanks for the advice. Will do.
1	Lol... almost took you a lifetime, I see  What country is he from?
1	May be he makes up for talking by walking around
1	Oh haha thanks! How sweet of you!
1	Say something like... ask him why he's so quiet.. obvious questions make great Ice breakers
1	hi, how's you doin? 
1	It happened because everyone freakin' loves the shit out of you! Get used to it  Hope you have a good week!
1	It's Twilight, isn't it? 
0	LOL at people harassing you for Rob's twitter
1	lol i hear u...im red bulling in right now
0	thinks twitter will turn into a huge competition between "celebrities" to see who can get the most followers...
0	I don't get off in time
1	yes camping! let's go to Tillamook!!
1	Australia IS pretty good! Richard took me to Ettalong Beach for the weekend, was lovely  You & Dave should totally visit.
1	PHEW  hope you have  great Monday!
0	Oh, I'm so sorry!...my kitty is there right now being checked...losing lots of weight over last 3 wks. Not good 
0	all true. Only problem, gotta find a job there 
0	yep.. sometimes it work and sometimes it dont..  .. it happen sometimes..
1	yup well about to 2 my time  what's up?
1	cold case soon. def. it's such a good episode. and yes, i think we should watch that too 
1	I'm not afraid of a disagreement. Simply my opinion.  Honestly, Dalton and Moore are *both* painful to watch as Bond.
1	pink fun in Cleveland they brought them for me from their travels
1	LOL OK thanks for your feedback. I appreciate it.
1	u got it bad!  had it, too, when was going 2 makg & sell gluten-free cookies. but that didn't last. t-shirts: fewer calories.
1	   sorry.  It did seem pretty ominous though... and those goddamn tabloids get in your head sometimes.
0	 chucks related injury...great outfit last night
1	 Good luck tomorrow....remember to picture everyone naked   Hope you guys win big
1	 Wouldn't worry about it. Could have happened to anyone.  Congrats on the awards!
1	 you may have dropped the award, but you did it very gracefully. viewers appreciate not perfection 
1	add me plzz      thankxx.
0	Ahhhhh Kristen! Where are you?? I wanna chat toooo!
1	awww you did awesomee at the awards  you rockk.
1	cant wait to see you guys tonight and the new moon stuff!!!!!! <3 have a blast lady
1	Can't wait to see you, rob and taylor on Sunday...anxious to see the trailer 
1	Can't wait to see you, Rob, and Taylor at the Awards. Good luck! 
1	cause you were surrounded by fans that love you so much  and i kinda thought you shoulda been used to it lol but you're
1	Did you hit your ankle with the award? hahaha just kidding. Hello
0	do u get 2 go cite cing often? love the pics, wish i was there 
0	does it show on tv tonight in Britain too? i can't find it  good luck though xx
0	What footwear is responsible? Converse All Stars shred my poor feet
1	Yes, Wendy and I did.  He looked. As usual.
1	==" Life's tough.
1	Ahahahahs!! Don't worry. I get distracted REALLY easily. Even by the radio.
0	Awww. Ok.   I just finisehd watching all the opening credits of the seasons.. they grow so .... OLD!!
1	hey!just got home  did i miss anything?? ;)
0	i'm scared about tomorrow. i have a troung test.
1	LOOL! I can agree with that  Btw. ANITA MADE TWITTER! She's following me. You can follow her from there Instead of searching
0	Oww, my hand hurts.  But i haven't finished yet. :/
0	Yea i reckon! I tipped for them.
1	oh wow ! those are good  !! && it's a SONG ! you should play it one day and put it up on youtube or something ? haha.
0	and that's half of what i have saved for the trip. Sorry
1	Aww did Sam go afterall? That cake is mega, shame to eat it! I love dolly mixtures!  Glad you enjoyed your day.
0	Awww, Trace, why aren't you at the Summit? What happened? 
1	I like Andy Samberg though do you know him? and does anyone else think hes funny
1	I will ... give me a second!
1	thanks  good afternoon have a nice sunday big kiss  #marsiscoming #30SECONDSTOMARS
1	thanks have a great day  #marsiscoming #30SECONDSTOMARS
1	yay! Would be great if you could  less than 3 weeks to go! x x
0	It's raining here because you've left
1	aha! thx. btw, how do you dance for a record deal? 
1	loved the podcast, thank you 
1	ooo ooo can i play too?  #spymaster
1	um it's not thanks though
1	One of my friends says that: "Don't do anything I wouldn't do; that leaves your options open."
1	Your articles at Guardian tech are amazing  keep writing such good stuff
0	Waterfront Place has been doing that for a while.
0	I dnt have my cell right now, what does he want, i'm having some personal issues with that right now 
1	Lol, yes its Smitchie I've done 4 and a half pages 
0	chelsea  they were the better team tbh though  and I hope this Fuga De Cerebros isn't taking over from CR haha
0	yeah me too, there's just so much to learn 
0	i feel your pain i hate thunder storms
0	LOL no the shower is in their ensuite. And it's a power shower so it's loud.
0	That happens to me EVERY time. I always feel so ready to do it but in there just feel it would be too cheeky. Hence i'm on buttons
1	Best way to work! Save time on commute and dressing up
1	don't forget .NET 4.0 (well implied through VS2010), Hyper-V 2.0, SharePoint 2010, Exchange 2010.. so much goodness coming 
1	Good lucky ! mtv movie awards!
0	good, in mexico we will see the mtv until Thursday 4 ,,   so bad 
1	haha! you dropping your award was the coolest thing! Congrats! Cant Wait 4 Twilight 2!
1	Hello Kristen love your work
1	hey kristen. im such a big fan of you. is this your official twitter?
1	Hi!good luck for the mtvawards, Im sure you're going to win!I hope so!I Love your work! ha you speak spanish? take care 
1	http://twitpic.com/3maaq - Haha i love this pic
1	http://twitpic.com/4yaiu - OMFG! I Have thoseee shoess! I feel so famous now.
1	http://twitpic.com/56a96 - aww how cute  nice to see all the cast are good mates
1	http://twitpic.com/5xo1m - awesome!  I can't wait for New Moon!  I'd be happy if you write me a message.
1	http://twitpic.com/6dty8 - Awesome picture!! Congrats on your awards! oh and ps loved the shoes
1	http://twitpic.com/6dty8 - He is such a little cutey pie!
1	http://twitpic.com/6dty8 - wow you have such an amazing eyes, i love u 
1	http://twitpic.com/6dty8 - Wow, you two looked really great! Hope you had fun 
1	I hope you have a great time.
1	i just watched the cake eaters... YOU ARE AMAZING!
0	I kinda feel bad for you guys...that you have absolutely no privacy! I didn't know til now   You should escape for a few
1	I know! You and Rob can twitter info to kill rumors!
1	I LOVE YOU !! YOU ARE AWESOME!! CAN'T WAIT FOR NEW MOON, IT'S GOING TO BE AMAZING 
1	I thought it was great when you dropped your popcorn!  Congrats on the wins tonight!
1	it's just **another** plane ride
1	Kristen! I love you  Youre the coolest girl, because you wore Converse under your dress! That was so awesome! LOVE YOU!xo
1	literaly can't wait for new moon ... LOVE YOU!! You're gorgeous!!! I'm so excited
1	my gosh you are AMAZING!!
1	Off to the MTV Awards???  Oh an Hello!!
1	The blog doesn't work. You looked very beautiful at the mtv awards
0	The link says invalid ID & user cancelled or acct has been deleted
1	we all do crazy things sometimes
0	what happened?
1	Would love to chat with you but i can't find you yet. Maybe you have to verify the username first. You're so sweet.
1	Would you like to share details of the script on here?  Kidding, of course! 
0	Yeah tell me about it
1	Yes, tonight it´s the night!! I´ll watch it!! You´ll be great!! 
1	your layout is totally amazing my eyes were going all wierd ;) i saw adventureland and i LOVED IT  your a great actress!!
1	give it a shot  Download 10 - supports SVG fonts now!
0	i only went to seattle. im back already. im soooooooooooo tired
1	im seeing them on tuesday in croydon!  cant wait! did you go to hammersmith? write back
1	good morning !
1	friends want to climb Baker & Rainier this summer.
1	I finally get to *meet* you.
0	i heard that was really funny  tho
1	I play the Mermaid
1	cool.. look forward for frequent tweets
0	well today is my last day
0	I know what you mean  and I can't even go watch, heu heu Spanish oral I'm barely prepared for
0	Hey!  Great to see you!  My TMMO subscription has lapsed   Will probably renew again later this year!
1	Gday mate how is life in Sydders? Need to get em n Vic on this - I've no idea whats going on!
0	nice, I've only got 1 left again. We had to resort to buying them at home depot.    Let me know when and I'll come get them.
0	Sounds like you got the raw end of the deal. Moms usually do.
0	Oh, no!   I feel ya - usually see that mid-print 
1	I'm headed to bed soon. Maybe.  I miss my west coast time zone days.
0	I did, until my parents got all f'd up and I started comfort-eating 
0	I dunno yet. I was just looking the performance lists & it looks like my two faves from last year aren't gonna be back  Any recs?
1	I've been working on the roll in my FED-4 (USSR Leica clone) for almost a year.
1	Presumably, one would need a Sherpa with each lens to carry it. 
1	Yeah, I like 3:15 and 3:29 too  I wanna watch the movies but I missed the first one OTL
1	Just hand me a knife...to poke the eye out of the weatherman so he won't tell me that.
1	ah I was just there!
0	Kodos lives with Marc.  Lorne is a better guard, though. Kodos would just lick a burglar's hand. ;)
0	Fri & Sat beautiful! Now rain Sun - Thurs
1	Particularly when #markmartin is on the Chase bubble!  #clap
1	Ya, you wouldn't  want them seeing what you have done to DIGGER........  
1	Jen! It's everywhere! ~.^ But all's good kung may music naman. Nakakapagod lang.
1	it's great! horses! fields of grass! music! heaven!  -Nico
1	hiya hiya! What's up? I just got back from a dinner auction and then ANOTHER dinner at a restaurant! But I ate in moderation.
0	I hear u! Woke up not long ago & cannot get back
1	I took my kids to Toys R Us every Saturday .. it was next to a Home Depot!
0	This my last night to stay up I start my job monday
0	I wondered why we didn't talk! sorry about your long day love
0	I love your picture.  Sorry about the meetings   When I had meetings all the time we didn't have social networking, blah blah blah
0	I don't feel so alone now! I still wish I had good sleep last night  Gonna be a busy day here...
1	You're so cute!
1	if you close your eyes really tight, and wish for new york, you'll get there faster. 
1	hi kristen. just saw a clip of your speech on MTV. funny.
0	I got a litttlee bit tann! My shoulders got worse so my back tan is hideousss
0	I too dislike the drama of my school. Its all peoples egos and pride getting in the way
1	yes!! lol! i' was just watching random movies on cable, then i saw your post. this is much more interesting to watch.  
0	How are you by the way, missing you over here! 
1	 epic indeed.
0	No idea! I only accepted Exeter as my firm because it had a slightly higher offer than UEA. I'm really torn between the two...
0	Nope, my mum hid them 
0	rude people
1	thats so fucking cool haha! nice one
0	Very wet  Not happy i can't go out.
1	Hey love!! whats up!! thanks for the follow
1	- Thanks for following!  miss you!
1	 YAY I have one more term Congrats!! Way to go!!  Hi Im Angie
1	pls rt if gets a shout out from wahlberg by 5 today her BF will nkotb tshirt to concert
0	Thanks girl i did over just a little with some High cal drinks
0	So sad  http://bit.ly/zK7Bb
1	good thing you aren't staying there
0	so jealous... we're out!
1	cant u guys just flirt on the phone lol you dont have to share it with everyone  -Nick
0	It's gonna get worse. Did I mention that I had the most HORRID sunburn on the boat?? OMG..Worst ever. I feel your pain.
0	I heard about that man! Now you need to Twitter #squarespace and hope you get the new iPhone!
0	you can have the rain! its day 6, i think, of rain! 
1	I will gladly give you some of mine to sort if you'd like to feel included
1	Haha yes we were! He loved us
1	he did a good job
0	MAN!  I wish I could!  I have to work in the morning!!    Or I totally would!  I'm hoping to get off and go right there!
1	I just did this!  Wooooooot.  Good luck with yours.
1	Sounds like a perfect day to me.
0	 why are u having lots of needles stuck in u? Allergy poke test?
1	no, it was a steak that won the other night. Looking forward to thai at least once this week again though 
1	Loved your race report.  I got a pink otter pop   Congrats on the sub 4 hour finish time.
1	 how was your day Leah?!
0	aww i'm sorry about that
1	Good morning! Don't worry, I have not forgotten! Coming up very, very soon! 
0	Never been to LA so I can't help you on that
0	She did. Then he went and married Scarlet instead of me. That sucks   LOL
1	Thanks for the luck! The Adopt-A-Garden meeting went well!  Got a few families signed up! #Gardening
0	awww, don't need to worry! Just having a rough day... everything keeps comming back negative 
0	I'll only be available for the Pens-Caps game.  The rest I'll be at work for, and no Versus out there.  
0	how can that be alot? It's one dollar per litter here!! Argghhh lol  Car is ok, wiper is fixed FINALY!
1	Really? That's awesome, hahahaha... we were up in section 524. Right behind home plate 
0	Wish I could make the trip to centresports, very sorry Monika! Very sad! 
0	bless you, thanks. Even more difficult because their Dad passed away a fortnight later, this year falls on Fathers' Day 
0	heading up to The City from the South Coast gone from sun to cloud at Basingstoke northwards  Hope it gets to London later
1	Morning, pretty quiet this morning, most sensible people are still in bed 
1	physical of course.
1	Thank you, hope you have a great day! 
0	lol, it's true. I do wonder why he was vomiting though.  And why he was wearing a tshirt. Worries me.
1	bahaha - exactly - baby steps - I'm commitment phobic when it comes to anything that pulls me away from the computer or books
1	We should start a campaign to bring back rutabagas!!
1	yay books!  I've been wanting to read The Tin Drum for awhile. And the Metamorphosis is excellent! Have you read Paradise Lost?
1	 i would second leah's suggestion.
1	yes i took it for a day out... Sorry, will drop it home to u soon 
0	I don't know why I didn't get your tweet!  On Emily's ballet recital they spelled it 'bannana'. He said it's spelled right. ;)
1	i really like your picture! you so purty! hope you had a good 1st day of class
0	Hahaha yes! We had to get new carpet and everything. and it bit me once.
1	Ill have to tell you sometime.
0	oh wow! I'd be like 'Damn! Family time!'  you are very excited! Good for you! ;)
0	that really sucks  sad day
0	I was a little  to see no Pop on the rehearsal list
1	"Yeah Eric" is an inside joke that only 1 percent of the listeners get (and none in syndication) but it always cracks us up!
0	we will cry with you  lol hahahaha
1	it's the guy from dancing w/ the stars. Should I tell you who wins? I watched last night
1	wanna come stain some trim! Now THIS is fun!
1	I would be happy to help you find one.  Reply with desired budget/features or visit http://tr.im/kHHI and I can help
0	  not the pretty new nails
1	YEEEEEEEEEEEEY  I know this is kinda crazy, but lets make a duet? I can wright it and than we record it 
1	just relax and have a good time  it will be much more enjoyable that way
0	I can't believe shes going to be gone in less than 24 hours. I'm going to miss her so much.
0	I can't believe she's going to be gone in less than 24 hours. I'm going to miss her.
1	place = plane
1	check this out: http://tweeternet.com/. Might help explain it. Or might not.
0	I havent been there in quite some time and its been even longer since I hit Firestone
0	have one in London and I will come! You should do a parselmouths gig we English are deprived from them!
0	NP - Felt bad I cut off your comments - 140 characters just wasn't enough. Sorry 'bout that.
1	yeah those skanky danky followers are no good. They are all pretty much viruses cause the computer says not to click them
0	well I hope u think he's hott!! Lol I'm laying in bed alone  find me a guy out there!! Lol
