0	Wants a robo.to invitation.  Desperately.
1	wants a Sigg Hello Kitty water bottle...meow...
0	wants a slurpee. but dunt have no money  pooooooo. anywho HOW IS EVERYONE?!
1	Wants a smoothie
0	Wants a unibody 17inch MacBook Pro, but can't really justify it considering my current one is no slouch 
0	wants all this drama to just be over.  why can't it all just be done with?  ughh..
0	Wants an album of The Plastiscines.
1	wants an Eight to play with. Please?
0	Wants an iphone
0	wants an N97
0	wants an SA account, no credit card 
0	wants and needs some sleep, but instead sitting in pain in type class!! 
0	wants another drink. but is not allowed. fail
0	wants another party, but would have nothing to wear  xxxxx
0	wants another pug  xx
0	Wants another strawberry dacquiri but no refills tho
0	wants austin here with me already
0	Wants baby orajel
1	wants britney to come back to tacoma
1	Wants britney to text her
0	Wants casey & cappie to be together
0	wants chocolate
0	wants chocolate.
0	Wants coffee with in the morning but instead isn't going to school. Sorry!
0	wants company!!!!   (cozy) http://plurk.com/p/115osq
0	wants cookie dough
0	wants coolwhip
0	wants cuddles
0	wants Dairy Queen Oreo Ice Cream large size soooooooo bad  http://plurk.com/p/1106wz
0	wants Danger Radio's new album.  http://plurk.com/p/y27v0
0	wants demi lovato to be the opening act for jo bros world tour- 20th nov
1	wants Dug. Or just a collar so her dog can talk
0	Wants everyone in her form to go on twitter but they are being sad x !!
0	Wants Everyone To Be Okay;
1	wants everyone to read Secret Sacrifices by Cynthia L. Hall!
1	wants Faye to know he is ALWAYS working it.
0	wants firewood.  NOW NOW NOW NOW i'm freezing
0	wants go Ibeefa
0	wants Hair muskkkk , rambut rontok bgt  http://plurk.com/p/z10xe
0	wants her boo  btw love fhnixon's posts hilarious!!!!
0	wants her boyfriend
0	Wow do I have a bad head cold...didn't even make it to the barn this weekend...looks nice out   #myfoxny
0	Wow do i have bed hair, i look like a rooster. I also have a splitting headache!  Did i snore 2 loud?! Blueberry muffin & then excedrin.
0	Wow dodged another bullet. Pop up thunder storms hammered the surrounding area. About 8 miles from here they said a twister touched down!
0	wow does Monday morning come way to fast when your enjoying the weekend
1	Wow does she make me happy  love that girl
0	wow don't take life for granted ppl... pls think twice b4 takin drastic measures
0	wow drake and melissa are over  hey thats life somethings just dont work out the way u want them to,but i cant help but be a little happy
1	Wow early! Off in an hour an a half
0	wow earthquake in ca? hope everyone is okay!!! spanish exam today
1	WOW ellie got exited.
0	Wow every 1 is gonna b skinny but not fatty sambo  !! Grrrrrrr
0	wow everybody goes up and i go deep down till the very bottom and nothing but someone can get up !!!
1	Wow exam kan great
0	wow expedia.com is kind of broken, can't book my trip.  Never had this problem with travelocity.  too bad its cheaper on expedia 
0	Wow extremly sick!
0	wow family guy has gone downhill.
0	Wow feel surprisingly ok. Except my throat is killing me
0	Wow fighting really really let me down. Major fail  everyone fell asleep!
0	Wow fights, really?! Cmon! 
1	WOW finally figured out how to get a picture  woop im finally getting to grips with technology
0	Wow finals are going to be killer. I'm not looking forward to it.
1	wow finaly done with this week of to the crib rest 4 a bit and out to party
0	Wow first 3 kids all sick now me. What a vacation. At least were sick together and we will all get better together.
1	wow found new anime " K-On " kawaii~
0	Wow french is boring  CANT WAIT TO SEE again!
0	Wow frustrated and im coming down with a cold
1	Wow fun times Lol...now i need to go home and go to bed
0	Wow ghost of girlfriends past did noothing for me!!!
1	Wow gin and tonic is good again
0	wow gooo diversity... but all of the other acts were amazing too! right bed time now!!! n revision tomorrow!  xx
0	wow got a price quote on a kit and its gonna be almost 3k for it inlcuding shipping :S thats too much for a kit
1	Wow got off phone like ages ago and half fell asleep on couch wit milo
1	Wow graffitti life was SOO FUN! I cant wait to do it all over again tmrw!
1	Wow Green Day' 21st Century Breakdown was released 17 May... Buying it  (Sembawang has 50% discount storewide now)
0	Wow had a great weekend! I'm sooooooo tired now!! Time to go nite nite
0	Wow had a horrible dream that I was in the middle of a set at a major club & I'd forgotten how 2 mix.....What a nightmare
1	Wow had so much work to do today. But the rain made me sleepy  in Miami, FL http://loopt.us/K2S-jw.t
1	wow Hannah Montana the movie was amazing  D
0	Wants her camera back!
0	wants her car back
0	wants her dog back
0	wants her dress to arrive before the wedding
0	wants her friend back
0	wants her hug
0	wants her laptop back  poor thing all lonely being repaired in the apple store
0	Wants her legs to realize that they are supposed to walk. Yet another wheelchair day.
0	wants her lip peirced again, or maybe a monroe...UGH, depressed  and a fat ass
0	wants her old buddies back
0	wants her step brother home  im so worried, you dont even know. i hope he knows how much i care for him...
0	wants her tongue pierce since last year but is scared of the pain....  http://plurk.com/p/z00nj
0	wants him so much it's not funny!!
1	Wants him to wake up please. With sugar and a cherry on top!
0	Wants his chihuahua already so he can stay in at night, watch movies, & cuddle with him!  I wanna give him some puppy kisses already.  
0	wants his hair back!
0	wants his little girl to stop being sick and go to sleep
0	wants his parents to make a cuppa tea but they wont
0	wants ice creammmm!
0	Wants it to be 2 weeks ago. Brit and beyonce. Goddam broken time machine!!!
1	wants it to be 6 o'clock alreadyy. tonight = taylorswift + the hills + mtv movie awardss.
0	Wants it to be Friday
0	wants it to be friday night !
1	Wants it to be Summer Already!
0	wants it to be summer for ever.
0	wants it to be sunny!!
0	wants it to STOP RAINING...i dont do walking in the rain....wheres the sun gone
0	Wants jimmy johns....
0	Wants kisses!
0	Wants less of the Sun... too Hot & Humid for outdoor stuff
1	wants little Leah Gosselins lol (asian babies are SOOO CUTE!)
0	wants loads of followers
0	Wants long hair
0	wants lost to never end....  but it does
1	wants Malin and Sean to come over with take out breakfast.
1	wants mami with egg  (hungry) sarap kumain pag umuulan..  http://plurk.com/p/pbzz4
0	wants mango ice cream but doesnt get it because its cold
0	wants Matt back
1	Wants milk tea...hold the boba please
1	wants Mitchel Musso to be on the phone again!
0	wants more choco banana peanut shakes from Jonas.
0	wants more friends from germany
0	wants more people to join!!!!!!!!! i only have 1 follower
0	wants more sun
0	wants my baby to text or call me  ugh he sleeps too much .. but i go to chicago tomorrow !!! yes !
0	Wants my bloudy exams to be over!!
0	wants my bunny bear
0	wants my car back from the mechanics
0	wants my past-face  http://plurk.com/p/111hzd
0	wants my T here, watch some movie at my living room, eat whatever, and snuggle  I miss you...
0	wants new clothes already...
0	wants new ink really bad.
0	wants New Moon.  AHH Im going crazy.
0	Wants NOFX/Bad Religion tickets. No hope in getting any though.
0	wow has the day started shitty! Behind at work, manager a no show, tired, and got some sad news 
1	wow havent been on in ages
0	WOW having an iPhone is like my goal in life! But i'll never be able to afford  Gotta get a job 1st. It probably helps out in the long run
0	wow how borin work ex..   think id rather be at skool..
1	Wow i aint been on twitter for a while
0	Wow i am actually really pissed the fuck off. This always fucking happens. Brought up then slammed down.
1	Wow i am actutlly still drunk
0	Wow i am NEVER using that arthritis medication shot thing again...my leg hurts sooo bad
0	Wow I am seriously stupid!!! I would rather be anywhere else but here! Ugh
0	Wow I am so tired I just can't seem to shake it. And on top of that I don't feel well.
0	wow i am tired...its going to be a long day tomorrow at the show.
0	WOW i can't believe candice got released  Her fans are going to miss her!
0	Wow I can't believe Farrah Fawcett died  another one of my blonde icons has passed  Pammy Anderson u better take care of yourself!
0	wow I cant believe i'm actually going to say this...I miss high school, tear 
1	wow I can't believe Im already at 525 updates plus this one!
1	Wow i can't get over this. I think i can actually call myself a dancer now
0	wow i can't remember the last time i got up at 10am on a sunday out of choice. work to fo. no-one else is awake
0	Wow i completely missed it! It's now 3-3....
0	Wow I could really go for some Friday morning breakfast at Darci's
1	Wow i did that with no characters to spare. Skills or What peoples
1	wow I feel dumb, was waiting to hear from but my phone was on silent! agh sorry amigos..im goin to bed but we must talk tomorrow 
0	wow i feel like crap
0	wow I feel like ish  and I really feel bad because those ignorent aholes wont overturn prop 8
0	Wow I Feel OLD  ... Congrates Class Of 2009!
0	Wow i feel so lazy.. Why am i this way?
0	Wow i get on and like my 14 followers cut me off and went back to 12  sucks
0	Wow i hardly twitter 2day....  once againg going to become busy...its not that i dont like wat im doing but its just annoying cuz i dont
0	Wow i Hate my life used eardrops to fix left ear now right ear is trippin out I feel so light headed
0	wow i have alot of im behind on sry bout that! phone internet doesnt offer that box.. only 140 characters on phone
0	wow i have got tons of homework and tests tomorrow
0	Wow i have no life, wake up to 0 messages 
0	Wow I have to wake up hella early tomorrow.
0	WOW I havent been on all day! I got my Dolce purse I wanted! SOO cute! Tomorrow is our last day on vaca then we drive back saturday
1	wow i havent been on twitter in ages cause i was away, it feels all new again 
0	Wow I haven't had motion sickness in since I was little...argh don't feel good
1	wow i haven't tweet in a looooong time  right now i'm kinda studying for french:p and i still have a loooooot to do :s
0	wow i havent updated this in a while lol   waay disappointed w/ my shows finales  i hate cliffhangers
0	wow i havvent bin tweeting much.. well today 5 perverted guys hit on me.. YAY!
1	Wow I just bowled my pr. 139
0	Wow I just found these sunglasses I wanted at target but no money!  they r pink n amazing!
0	Wow I just got done watching making the bad...very dramatic! I shed a tear
0	wow i just made a budget...someone has to hold me to this though
1	Wow i just noticed the buds on the bush in my front yard just sprouted in to pretty allergenic flowers covered with bees
1	Wow I just realized what I said last night made no sense ha! was really tired...I swear!  Just got back from spending the day with my bff
0	Wow I just saw my dog sniff my trash. What's wrong with her?!?!! I gave her some of my spam sandwhich. She shouldn't be hungry.  aw angi.
0	wow i just saw the sorry
1	Wow- I just slept in till 9
1	Wow i just voted for the MTV movie awards! i voted for miley in her 2 categories 30 times each!!! i hope she wins!
0	Wow I look upset! Still sitting on the damn plane. My chest hurts, I need fresh air  - Photo: http://bkite.com/08JZu
0	Wow I love how it just turned black outside out of nowhere. And the sad thing is imm on the bus  imma get soaked!!
0	wow i love how we have no headache medicine in this house.
1	Wow I love this weather! It's to tweet for!
0	Wow I made a huge mistake today
0	wow i miss my bestfriend soooo much. you dont even kno. thank god only a couple more days. a year is to long
1	wow i miss you too just got our CPU back  hey get on on skype
0	Wow I missed a lot on twitter last night  3 more days... -_-
0	Wow i must be really bummed to compare my life to new moon  (200th post)
0	wow i must have been tired. i fell asleep exactly the start of the 10pm news & now up as if its 8am.
1	Wow I never saw any of the flavor of loves!!! FOL3 is kewl!! Marathon bby!!
1	wow i procrastinate with EVERYTHING, i have a problem 
1	wow i realized all i eve do on here is reply 2 celebs! im soo lame lol anyways, its abt 2:15 am, looks like i should get sum sleep  night!
0	Wow i really do not feel like working today  but it has to get done. Work Fail.
0	Wow I really don't feel well today
0	wow I REALLY need payday to come, I just found out my checking account has been empty all week and i've been overdrawing from savings 
0	Wow I really need to have fun tonight now
1	Wow I really read too much.... LOL double digit reviews, a quote being pub and several PR books too..... not to bad for a newbie LOL 
0	Wow i really suck at bowling  im kinda sad now.
0	Wow I Really Wish I Had A Job
1	wow I slept almost 12 hours  not only 3 hours like yesterday from 8 am till 11 am  I feel good and fresh!
0	Wow I slept late  poopers
0	Wow I slept like shit last night, really hot 
0	wow i so dumb.
1	wow I think I should help a little bit with the "european tour spamming" right? and rock!!! haha
0	wow i think i'm going to cry. not only did one of the suggestions fail, i can't get real time help from anyone cos msn keeps d/cing 
1	Wants Paul To Get Better Soon  <3
0	wants photoshop back
1	wants PIZZA!
0	wants raw oysters
0	wants season 2 of Army Wives
0	wants seventeen forever metro station on my phone i am just not allowd to download it and i dont hav any money either to buy the cd
0	wants shouting aaaaaaaaaaaaaaaaaahhhhhhhhhhhh  http://plurk.com/p/11pe4n
1	Wan'ts so go back =/  But weather is fiiiine so I'll be outside all day
0	Wants some Chinese but no one to go with.  I'll think of something.
1	wants some coffee. ummm, yes. but add hashbrowns, grits, and chocolate pie and I'll be good to go!! 
0	wants some goldfish  not the kind that are actually alive though lol.
1	wants some good late night eats.. If only there was a Popeyes in Australia.. How I could go for some nice crispy wings and biscuits
0	wants some of the lemonade at Jamaican resturant  but they were closed today...  No fair so ready to get back home and make some $$$
1	wants some peace and time
1	wants some popcorn.  http://plurk.com/p/z2j2p
1	Wants some red beans and catfish. I need to take a trip to the Big D so mom can hook me up!
0	wants some saltwater taffy  http://plurk.com/p/rolv0
0	wants some soup 'coz it won't make my teeth hurt....  #BSB
1	wants some sunshine in her heart
0	Wants someone to play nintendo 64 with her
1	wants someone to reply to my msg one day  (even if it does momentarily make me feel special) lol.
0	wants someone to text with but she doesn't know anyone who's awake
0	wants something BOMB.COM to drink right now but I have nothing  http://plurk.com/p/123mhr
0	wants something hot n spicy! *kebayang tom yam di mangkok putih  http://plurk.com/p/11c6bm
0	wants something to do other than revisee
0	Wants spicy buffalo wings!!!!!!!!!!!!!!!!!!!! Dipped in blue cheese dressing!!!!!
0	wants Starbucks
1	wants stavros flatley or shaun smith to win BGT!
0	wants studio now!
0	wants summer already! bike rides 2 in the morning, please 
1	wants summer now. i feels great outside.
1	wants that dress i saw the other day! and im gonna get it tom! yay!!!!
0	wants the Arctic sea ice news & analysis satellite back up and operational
0	Wants the Big man Tevez 2 stay at United!!!!!!!, seein him get subbed yesterday makes me feel upset   
0	wants the complete first, second, and third season of Supernatural. 
0	Wants the ellie badge
0	wants the iphone udpate...but most likely will be at work away from my computer
0	wants the meds to kick in, knock me out and stop crying 
0	wants the new iPhone!
0	wants the new macbook pro, but would have to sell her imac and alienware to do so. and her heart breaks thinking about selling the imac 
1	wants the new psp. It's SOOOOO COOL!!
0	wants the new sidekick 3G.
0	wants the Nikon D5000 So frakin bad!
0	wants the rain to stop
0	wants the rain to stop before 6
0	wants the rain to stop!!
0	Wow I think I'm going to get sick! I woke up throwing up
0	wow i want my page to look like looks a bit more cooler then mine  ha ha! go brit!
0	Wow I was forced to go a whole hour with out twitter
0	Wow i was right . 19 days of school . I wanna go to asls' graduation tomarrow
0	Wow i will be away and my "expecting" wife is going to be here in India, thats gonna suck since I have made her so dependent on myself 
0	wow i woke up a little late today, its 2:30pm. i hate sleeping my day away 
1	Wow ice cream at 7 in the morning? haha. Oh yeeaah.
1	Wow I'd forgotten how easy it is to just follow a few people!
0	Wow I'm a dork - tears occurred today
1	wow I'm addicted to this after only one day...what's the first thing I do when I get home? Go on twitter
0	Wow im already awake and about to leave its way to early  its my day off and im up i aint likin this.
1	wow im already feeling lazy and sunday just began! I'm gonna brush my teeth, then go off to bed! 
0	Wow i'm Bores
1	WOW im done! Only one more to go
0	Wow I'm feeling sick
0	wow im glad im going to sit in the car for 12 hours to go to a place i dont even wanna go!!!  fml
0	Wow I'm not tired at all but I knw I'll pay 4 it in the morning!  I tried pullin out some demon bamboo things outside but it dint wrk out
0	WOW i'm now a Twitter chatterer ha ha ...  I'm getting a headache searching for houses to live
1	wow im so bored i dont even know what to do with myself
0	Wow Im so sunburnt it aint funny, I hardly slept last night. Gonna get to bed asap 2nite, catch up before the school run in the morning 
1	Wow I'm soo in the mood for a bonfire.. Smores.. Catching lightning bigs
0	wow Im sooo hungry! I didnt have my protein powder shake that I have every morning .. im starving..
1	wow I'm soooo hooked on facebook its unreal lol   If ya like to add me on facebook my e-mail on their is  yhtak@yahoo.com
1	Wow im still at this party. Its dumb ass cool. Feelin like a celebrity son lol
1	Wow im such a fat ass  sitting in a car eating fast food but hey im with my besties so its all good
1	Wow I'm tiered, also working 12-6 ugh anyone wanna chill after? Txt 
1	wow i'm tired... going to bed, GOOD NIGHT 
1	Wow I'm up Early today it's #beach time
0	Wow I'm watching the best short films on logo right now, some are making me sad 
0	Wow instead of sesame chicken the Chinese place gave me shrimp and broccoli.  Yucky fail.
1	Wow is all i can say
0	WoW is broken, and thus so is my heart.  
0	wow it feels weird speaking to people from my first school years.. they have all changed so much!! I miss you guys lots
1	Wow it is odd to see everything so green... guess this is what happens when you get rain...my trumpet vine even has buds
0	wow it sucks when you realize people are growing up
0	Wow its 3 in the morning and i still want to text someone! Too bad everyones asleep
1	Wow it's actually sunny today
0	wow its been a while, it wont let me use twitter on my phone 
0	Wants the Sims 3 to be in my hands  5 days to go grrr....Loving the sunshine, but not the heat does that make sense? lol
0	wants the sims3 really really badly...REALLY REALLY BADLY!
0	wants the summer to be bright not grey
0	wants the sun back
0	Wants the sun to come back...
0	wants the sun to come outt
1	wants the sun to shine so that she can go out
0	wants the weekend to be here already....even though it's Monday!
0	Wants them pichas
0	wants things back to normal now please
0	Wants things with Panini to be okay 
0	wants this adorably cute dress so badly, but is extremely broke  what should i do?
0	wants this before coming to NUQ's campus  http://is.gd/16lr2 sad i sold my A200 SLR camera
