0	lol really?? My bro has xbox360 but he don't let me play
0	 Very nice mines the 2.1ghz but no the latest gen  Do yah no whats wrong with it?
0	yeah apparently my phone jpgs are somehow defective.
0	uh huh. Jayson, you'll understand when I say tonight made me ANGRY. I can't take anymore...well, I CAN take it, I don't WANT TO 
0	oh. i didnt hear you say that....I recend all my flames...sorry
1	 can i ask who made them, and what it cost you? I'm curious to see where PV prices are going 
1	Yeah, 3 was the toughest year. Four, she can be reasoned with and is developing an awesome sense of humor. Fun stuff. 
0	Lol its 9.24pm, i should be in bed  got school tomorrow... NOOOO!
0	hey! I should jus use u as one of my sources! Lol thanks I got it jus gotta put it all on paper...
1	lol oh ok..well n that case..thank u
0	 yes it is. Sucks don't it
1	Thanks dear
0	that sucks.
0	I have never even been there ,,, 
1	I think ya have to suck some twitdick to get it to twitwork
0	life has been pretty hectic since we got back, with sick mothers, and shitty jobs! feels like I was never away 
1	was that me who helped? If so I'm honored!
1	No, no, sir; thank YOU! I think these columns are the most exciting thing to happen to the site in YEARS! 
1	oh how wonderful! congratulations. ain't nothing wrong w/ the grind. thats how we make it happen.
1	ahhh, those fucking assholes! I hate working for people, much prefer to be self employed 
0	lol. Well, I've seen really really good Weird Al videos. This just isn't what I expected 
0	not a sausage
1	yummy have fun!
1	I'm really good! Soo i'm curious..are you really part of SODMG or is it just a catchy twitter name?
0	cool, w/e too short as usual unf. And way too busy at work  v little time to tweet.
1	yup that's cool with me
0	i have been naked all day lol, no ac in my room. 
0	Thanks! Unfortunately it's really hard to tell how you did b/c everyone walks out feeling really stupid
1	You could have asked me before and I would have answered over a relaxed cup of coffee in Jumeira
0	OFCOURSE!!!! Sorry TJ_Wins...   [lol]
1	Haha yeah that's a highlight for me at the moment too. I'm enjoying taking my time reading it, making sure I take it all in... 
0	awready! U kno itz all luv! U should come out n kic it 2nite!
0	I knoooo I was working tho  sucks ballllllls dude http://myloc.me/3ZjZ
1	don't hate...appreciate  so when's the asian sensation gonna be back in rare form!?
1	spank you when? now? bend over
0	 we'll be seeing each other soon ... Hakuna matata. Btw, play thurs/fri this restaurant. We should ALL go.
0	hmmm, i hope so. and i hope they are okay.  they SEEM REALLY PISSED OFF!
1	It is decidedly so
1	YOU ARENT DEAD!
0	LMAO you having your own partay there (: enrique got a gril up onstage
1	btw, im going to study at UST.. 
1	it's okay for me for saturday
1	Hmm... sux. Well, I have a Spymaster sticker for you if you're going to be at tonight's tweetup. 
0	omgg yess(: im gonna miss jason wimp and all the other seniors to dance with tho
1	puppies rock!
1	 enjoy your #elevenses
0	do you love me enough to bring me some suncream... i dont want to be a lobster anymore
1	or else yo uwill have to become a dirty hippy and quit work and live in the woods, 
1	LMFAO For a second there I thought you got a dog and I almost cried out loud with envy  Can't wait to see you in LA!! *smootch*
1	had a good time at swimming jaz  hope everythings sorted out now. loveuee. best friends always x
0	why didn't you tell me?!
0	 don't know how 2 find u...went 2 the site, also went 2 the forum on ning..I must be stupid or something..shuks..now I'm curious!
1	pq tu te poses tjs la question ?
1	GOOD NIGHT!  <3 I WUVVV YOU MOREEE!
0	Fuck up lol. Just went up to three hours now  Should be deffo finished for me getting up in the morning.
0	awwww I really wish I was there instead of going to work  have fun!!!
1	im very excited haha my first timee to deary nh
0	I NEED MORE FOLLOWERS PERIOD!!  20 IS SO LAME!
0	unfortunately i do miss my ex  wtf happened with you today?
0	Do you know how to turn off TWITTASCOPE? Please someone help !!!!
1	that's koo! Yall having lots of fun enjoy those moments they don't come around to often. Huh I think?
1	  I know...misspell it on purpose...one of the saints Ive studied quite a bit...*shrug*  far more interesting than my own name
1	ha you very busy huh? schedule blocked up till sat night
1	1/2 done!!!! Woo! Yey her account is bak! But shes blocked me for asking her a question! Can u ask her to unblock me?
0	they are m HEROES♥ i wish i could go to a concert but i cant
0	you are avoiding me and crapsticks
1	lol - Good evening/morning/day (just to catch everything!) to you too!
0	i doubt that the am pm will have some
0	i'm sad i won't see you for another couple months
1	See you there in about 15.
0	what is dannielle talking about? I think she's gone now
0	Jazzy my best fob pren, I read the 14th birthday I wrote to you. I am sad   ! I love you!! <3 check your email!
0	Do you remember in year 8 when we were in science and i stabbed my eye with my pen? Fudge monkey that hurt
0	hehe i just recored me and natalie going over the play, grr i sopund like a spastic i need a new voice  .lol
1	YAY!!! Thanks babe... God willin' it's the beginning of HUGE things for us. Keep us in ya prayers.
1	 ...could be better, but can't complain! "cuz' no one will listen anyway!!  
0	cos u saying its my fault and I was trying to be nice.
0	lmao..thanks but i dont have one
0	Looks like it wants to rain about here but I know that aint gonna happen. Guess you will be staying inside
1	sounds good  lemme know what you wanna do.
1	Yes, 11 pages is good.  3.0 Rox, especially when you have it early. 
0	 i am right there with u
1	were leaving to go to my aunts so ill call you later when we get out there
0	me too  where are you? I'm here too!!!
0	Zoetermeer did the exact same thing. my vote didn't make any difference
1	sounds good
0	 oh my god I am so jelous aghh it was ehhh 6 /7hour drive from my house.
1	naaah... I don't think so... It's just mysterious...
1	Still have all week to edit videos " NOT THAT  " Orchestra music vids.UGH!!!
1	lol you too  we just do boring stuff like shopping, cinema, go to the beach etc lol.  do you like Twilight? 
0	haha you would do that =P that's cute. nobody ever comes to visit me  god damn lake geneva and how far it is from civilizati ...
1	I am not!  hehe thanks again though I'm already done.
1	LOL! me too! XD it also helped that he was the mac guy in mac vs pc commercials
0	grrr theres these guys from spanish who i think wanna kick us out!!  !
1	Doubtful! It's going to be on 24/2!
0	whaaaat!   This is why next time I have to be there too so you both will be forced to take crazy pics.
0	Yeah I understand that  Dice-K is depressing me after Lester's awesome game yesterday.
0	she def isnt  maybe with time. FOLLOW ME BRIT damnit. hahaha
1	...music series. My response was: "That's like asking me to pick a favorite piece of chocolate from a lifetime of delights."
0	i can't see ur pic lol
1	Hey! Everything is. Things got a little crazy yesterday but thank God for favor! Hope all is well on your side of the world?!
0	haha i would..except i have no hours anymore  ..that's the economy for y'all
0	OMG!!  I HATE  you!!!!  I wanted to go see her but the recession had my pockets in a chokehold
1	no worries!  I don't really feel up to it, anyway.  I'm not doing too well these days.  Let's do it another time.  
1	I guess it's a good thing I enjoy being a geek then
1	yes! i got it! I can read it! Can you read this? Haha
0	I agree, but fear many are not feeding their flock and their sheep are scattered  Ezekiel 34
0	.....i feel ur pain homey
0	ohhh you're killing me..sounds so good! I just had...a salad
0	miss you too.
0	tried to get the mouse last night but failed also  How is NYC? We miss you!!
1	I am not absolutely sure how we became "followers" to be honest! These things tend to cascade v quickly on Twitter.
0	"rhythm of the night" , "who's Johnny" and "Stay with me" were my joints. Too bad about the drugs and prison time  smh
0	4 versions...ahhh. sounds like heaven. he was here in boston a few months back but i had a gig and couldnt go  hes a must see!
1	hey! just read your comment about my BG. thank u so much.
1	you got it  want etsy or just a paypal invoice
1	 Oh! No wonder.. O well, i will get to see you on sunday!! 
0	what did he wreck???
0	Your off the chain.... and Where were you last night? I asked Smooth about you.....? And Sorry I missed you BDay party
1	 if you like 2 laugh..follow me..its just that simple
1	yeaa Defo  sounds lyk a plan x
1	I will decide how i play it day by day  Margarita and Mavs tickets anyone?! Learning to tweet 101...
0	YES I am already craving shocktop... or a glass of wine... or a kamikaze... longest 3 day weeks ever
0	the life of property management jobs  what time do u work and til what time
1	but girlllllll at least it's legal  lol ps: fucks with me! i havent touched nething more than a cooler in so long
0	your drinky WAAAAAAAY too much, dearie 
1	Yeah & my Brackokitty lol Im da first head u know wat in charge...  meow lol
1	awwww thank you!!! that just made my day!
0	yeah, no fun 
0	But, I live in Dallas.  
0	I think its stomach virus  I really feel like dying
1	you should come out to the office in a week or two and we'll do HT sushi..
1	good morning to you! Oh no, you've been mutilated!! Don't worry, they'll grow back... 
1	Is Trea your mom?  I bet she takes good care of you!   Good morning & Have a great day today!
1	Lol, my dog thinks the same of the cold tiled floor 
1	lol.any plans apart from lazyin in sun?lol
1	It was hella fun. It was funny that I recognized more player names of the A's than the Mariners. I'm pretty sure you know why
0	yes I'm postive my mom jus called  I'm very upset I wanna tear
0	I never got the mansion and the porsche
0	Because the lady from kiss told me that the person you bring with you to the soundcheck has to be over 18 and my friend is 16
0	 I try pretty hard to engage everyone I follow! Some of them lack interesting shit to say so they end up unfollowed
1	Thank youi for the kind words. ... Just little petite woman trying to get to heaven. Far jump from earth!
1	loll my dad leavingg and moving to las vegas and myy now ex boyfrienndd is FINALLLY done talking to me and has left me alone
1	yes haha. I love when dougie says that it wasn't him. too cute
1	but you're still a winner so it's ok if you lose every once and awhile.
0	SHYYYYYYT WISH I WAS UP IN THAT MUG
1	Hey sis hope to see you this weekend
0	MINE IS ON A WEDS.  AND I HAVE A CLASS TOO..but afterwards i probally go out to eat, thursday CLUB SEVEN..ATL FOR THE WEKKEND
0	yayy! i wish you could go to tattoo zone with me.
0	Oh man, I forgot about the pazooki's  Dammit man! why u gotta be like 6 hours away? lol
0	yes..yes they are. I saw a chick the other day with an outtie belly button and a belly button ring. it made me sad.
1	Hey! Thanks, for the recipe! I miss eating home cooked Indian food 
1	I need to learn how to make Indian chicken curry. I wonder if they sell a curry paste, as well? I'm glad you liked the advice 
0	 Ellie went through that for a few weeks.
1	not bad.  where people saw it could be miley?
1	yes, and we would be quality control. we'd have to taste everything before it goes on sale... including them 
1	: I highly recommends you join www.m2e.asia You can earn money from free shareholder by dividends. Even you do NOTHING!
1	I can't wait!
1	Randomness!! Mostly Drake thou..
0	stupid FIT text books
0	I woke him up a while ago and he wasn't a happy chappy  I found it hilarious, him.... Not so much.
0	I'm a dark horse what can I say!!! To be fair I never met the guy which is gutting
0	mine wont update, gets to the end and says I have an error 
1	"She was Amorous"
0	haha. im sorry  you should make me one.
0	I want a bracelet
1	I used to have severe nightmares when i was your age, of course i , also, read alot of stephen king at bedtime 
0	alright! 3am and i barelyyy started the redhill booklet. all nighter i suppose  then i gotta do another booklet tmrw!
1	LOL I know how u feel bit I'm the same 4 JB ill help u but seriosly iv never seen a bigger fan of her than u lol
1	Hey joshua, we'll be emailing you directly  Thanks!
0	 no. I can't start that package until middle of June ((((
1	thanks lovie!! how is your weekend!? miss you much!  xoxo!
0	email those pics on ur labtop to me...  I wana put one of them as my background!  http://myloc.me/21DS
0	Me too - too bad I don't have time to get up there today
1	Just a non-random Princess Bride quote, pay no attention 
0	really? I never saw it, that makes me so sad.... 
1	atta boy. welcome back.
0	Facebook is blocked
1	Sounds very challenging! Congrats for taking it on, though. Must have been beautiful! 
0	Mega par man, you should go fart in their face. Welcome to Grime though mate, unfortunately 
0	_i JUS WENT AWAY FOR THE SUMMER AND i CAN'T FiND LMN ON THiS FREAKiN TV. BUMMER
1	http://twitpic.com/6g19f - Those earrings r cute
1	naw jst truthfulll
0	oooh *heads high killin 'em wit da no* lol didn't think so..  but u don't really know me yet I'm a good tucker inner haha
1	good good!  did you sleep?
0	I am never singing along with your tweets ever again!
1	happy birthday
1	drive safe man! Hope the trip is fun....bring me back a T-shirt!!
0	How far did you in that Cargo game... I got as far as the level the chest drops... I spent 3 hours no success
0	 I was hoping for a trip to the beach!
0	Sweet niblets! I tought he looks like Joe
1	i'll follow you
1	it's awesome, ae?? btw...check out homeparty-germany.webs.com  #homepartyger
1	me neither  yeah sure! I've even listened the new album will come out here on June 12th but i dont know if its true
0	My mom said I'd have to wait until morning. She doesn't want to be out driving at midnight.  Getting it 1st thing 2morrow!
1	np~!  i will try again latter..i have to go to sleep..lol! goodnight~! x]]
1	yeah i no i love it  X
1	I don't judge  hahaha Midwest strong. It sounds like a chevy commercial
1	Ahh I totally loved busted, but I guess it was the right thing for you three to do. I'll be your fan, no matter what you do 
0	Come back to the UK and play a gig! We miss you LOADS!  Much love xoxo
0	I missed it  busted need to do a reunion tour. That would make my year. No joke.
0	I'm late  I was practicing with the choir !!
0	James...it's the 19th...Where is that song?
0	lucky kid...i so wanna see loserville  pity im in oz....
0	no new tune up on Myspace yet?
1	would you say hi to a friend of mine? she'll turn 18 soon, so i thought of you cause of call me when im 18! 
0	Yeah :] Ah i dont watch that  i used to watch americas next top model though
1	Im from Israel  And you ?
1	yeh  A little.. How are you ?
1	Just seemed like a lot of waiting in the cold
1	dern it! rosner's coming over at two for a little sun, cocktails and yellow packet 
1	... i like yours though  ...it's a nice picture ;)
0	ah i cant deal witht that lag
0	birds are chasing the shizzz outta me!
1	are you have tweeting issues? What's your last text from last night?
1	awwww thx Biz. Ppl always tellin other ppl to follow me, I feel MEGA special. 
1	heyyyy  im cool, whats up with you?? =p
1	Congratulations! Hope the big day goes well.
1	Congratulations!!!! A nice sunny day to get married.
1	HA! totally know what you mean. The kids room is usually a mess again by the tie I'm done w/ the kitchen...vicious cycle
1	ha, love it! 
1	that's an amazing photograph man!
0	Damn! At least u got a vacay  but sounds like u have everything figured out! http://myloc.me/4O77
0	lol awwww well good....i hope u enjoy...ive been wanting to see it...no1 will take me  lol
0	sounds like you had a great time! i set my alarm to watch it, but fell back asleep 
0	No they didn't
1	Yes!!!I know sometimes Italy seems boring to me too!!!But i'm proud to live in it  I love America!!!!
0	jojiiiii i hate studing! i am going to fail everything!  but i doesn't mater... i saw joe jonas XD
1	Hehe  Me too!! I'm so excited to hear her "new" sound.
0	Okay, it's already past 1pm here. I miss you. 
0	no, I didnt make it to that one   & thanks so much!
0	nope..i got a B though! i really hope i can get my grades up before the school year ends! otherwise no JB
1	   but im even more jelous of my freinds jess said she wants to marry them aha
0	bk over for the concert the next week, i wish i could of flown out for that on the friday, but couldnt cause of work 
1	haha thankss  im loosing buuuuuuut its oaky :d
1	LMAO! I was like :O its better than y fronts wen i found out! Lmao. xD  ps: check ur direct messages!
1	OMG, I KNOW  remember the place they ate "Village Idiot"? My best friends sister works their but was away in NYC at the time!!!!
0	ooh I know about the politics of the job and its some major bitchassness  it sucks but we cant ever escape it
1	Come, come - surely you're not repeating the canard that "indie" and "cheap" are synonymous? 
1	cool! send me news to sarah.stuartt@gmail.com if you can. if not i will try to reach you if i don't see the twits about it
1	Going to watch it again by myself. Still, not late at night. 
0	I checked this morning at 7 am and it said that!
1	and to poison ivy i love that song aaaaaa  and i love others songs ...i don't know why jb was laughing for every songs ??? haha
1	ohhhh! Just ignore what I wrote then ;)  I'm listening to Paranoid atm
0	Aww, I feel like punching David  is your mom alright? I hope so!
1	*tosses cyber sandwich* there
0	during the live chat...a fan has written "nick and joe are cute, kev is in the the corner" and kev is gone in the corner 
0	family is crazyyyy!! lol grr ima go and wait until like an hour or get on tommorow cause i dont like using this twitter
0	i doubt my parents will buy me any vfc merch or adisson stuff for my bday
1	now they have 27 i think....
1	oh okay good night and goo luck
1	oh, okay. i'll just wait for it 
1	yeahh just because your not in VFC doesnt mean your not outta our hearts
0	now am not looking forward to updating mine
1	wow, you got a real picture 
1	awww  ur making me blush
1	http://twitpic.com/6v0vw - It is GORGEOUS
1	good, I'm all about the Lake show 
0	where are you?
1	partay on saturday! woot woot!
1	proper use of caffeine will allow both
1	OMG fuzzymonkey is this really you? LOL Hi.
0	- new comp set-up, files! changes! a whole mess of stuff!!  Has to be done & today's the day...will check in when I can. And U?
0	I planted my tomatoes in my container garden. I may have to get some flowers, my seeds don't seem to have sprouted 
0	Here, here! But reality intervenes during the process of developing the data model.  My data models != complete. #calicon09
0	me too  come back! lol
0	I know bad language
1	great! Now follow meeee!!!
0	lol that's sucks   we r heading to the city now to c wats going down
1	Man... I am surprised that I didn't get any at my session. It was definitely not my best performance.  Could feel eye daggers.
1	Gotta love it. Can't beat Vancouver in the sun
0	lol, my bad, i just can't help it though... btw, i think my phone's broken, it won't let me get other people's updates 
0	Not available in my area
1	IT WORKED!!!!!! Thank you
1	I avoided Norbit like corduroy pants in the Summer. The Happening is one of the greatest bad movies of all time.  So cold.
1	you go girl! Hook me up with something, I need a J-O-B we need to catch up soon! Miss you 
1	lol esp when your updates hit my phone...
0	the reason I like the CapsuleRebel is the extra protection of two layers. Also means more bulk.
1	To help ensure you do not do this again, I voiunteer to check the severity of it  (it's not early here lol)
1	thank you!  i figured i'm like the only one w/o a jonas related username, so i needed to change that! lol
