1	So nice to wake up to sunshine this morning  Now listening to the joyful sound of DH & DD rolling out dough for bread together.
1	So nice. I has ous cream
0	so Nix and I can't go to Fashion Week tonight  Bummer! So here we are bidding Angge a happy Fashion Week trip haha!:-*
0	So no brunch  and no crab for dinner  I sure hope that mimosa happens tomorrow. Will make my own if I gotta
0	So no lady gogo tonight  I'm kinda sad about it ... I got dressed up and looked pretty awesome to go to the local watering hole (boring)
0	So no take home food. That's to bad.
1	So not a thong girl.  Wind up picking my butt all day. But YEA! to won them!   #mmwanted
0	So not awake, I keep making cups of tea and forgetting about them! 
0	So not excited about being up this early, not being at the beach and having to go back to work. 
0	So not excited for Transformers 2 now. WTF all the "blockbusters" I was looking forward 2 suck.  Except Star Trek & Up.
0	SO NOT FAIR! Everyone from the view gets L.A Candy by LC
0	So not feelin this rain
0	So not feeling well at all...this is the second time in the 10 days
0	So not impressed with the new season of jon and kate plus 8. It makes me so sad
0	so not in the mood for gym class. still ache from dance audition yesterday
0	so not in the mood to go to school tom
0	So not looking forward to flying from Brisbane via Singapur and Abu Dhabi to Munich all by myself on Monday!!
0	So not looking forward to four classes for summer
0	So not looking forward to having MRIs done. I can think of a million other things I'd rather do on a day off  Frustrating!
0	So not looking forward to hurricane season. 3 days until...
0	So not looking forward to the next three days  Boo for work...
0	So not looking forward to this week.  Maybe I'll get more in-depth later, but probably not. 
1	so not looking forward to working in the rain tomorrow.. but hey japan in 2 days
0	So not looking fwd for Tued  if I receive that news about my health - it changes my whole life around. Fingers cross Ive just migraines
0	SO not motivated to go to work!
0	So not motivated to work. Ugh. An all day conference should count for something. Too bad I actually have stuff due.
0	so not one of you can recommend me a DS game? disappointing
0	So not only is my finger swollen, my hips and both hands and fingers are. Yah so this thing, called arthritis really takes over my life. 
0	So not ready for a day of studying pharm  good thing i have some little pink friends to help meee
0	so not the day to wear black
0	So now again im back on the road and gainesville bound...woop woop??? So sleepy
1	so now checking out the band http://www.myspace.com/theb... - nice summer music to chill out to
1	so now chefcking out the band http://www.myspace.com/thebirdandthebee - nice summer music to chill out to
0	so now everyone is sad.
0	So now i am on staff duty. A 12 hour shift. Yippee... Last night i couldnt talk to Fe Fe..  I couldnt sleep well..seriously
1	So now I get every Thursday privat lessons in German and English.
0	So NOW I gotta walk back ANOTHER 10 country miles in HEELS to my car :-/ eewww i think this guy was jus pee'n in the  corner nex to me
0	So now I have a hurt wrist AND I'm wicked sick
0	so now I have to wait until June 13th to get my Tool tickets  why'd they have to move the sale date.
0	so now I know whats going on next school year  it could be better
0	so now I wonder where haie is, he's totally annoys me today. i miss you, really 
0	So now I'm blocking some spammers. I don't like to follow interesting twitters anmore  Maybe later
0	so now im not goin 2 download n goin 2 sonisphere instead. i may not go n see killing joke tho cuz i dont like them. sorry dude
1	so now i'm texting my updates.is it working? &&ily
0	so now I've caught some sort of awful fluey thing, feeling less than good. 
1	So now Jay-Z has declared "Death Of Autotune"- http://tinyurl.com/ljr3tp does that mean people are going to have to sing properly?
0	So now not only is my laptop fecked seems pc is pretty much shagged too
1	so now that I have a whole 20 followers, 5 of them actual people, I don't know what to write in here anymore 
1	so now that i know that twitter is still alive.. how are you?
1	So now that I've made my mess, I can go to bed. 
0	so NOW the internet speeds up  :S
1	So now to try to search for fix to make it work because is a music genius and needs an outlet for his creativity
0	So now we'll pay more in sales tax...great.  Even worse Mom and Pop businesses have to double what they pay in business licenses.
0	so now we're stuck here for the night in a motel that looks like it came straight out of a horror movie #pleasesendhelp
0	So now, I have conjunctivitis in my left eye. Is this a sign of something? What did I do wrong to deserve this?LOL I'm dying people! 
0	so now, I only have 30 rb in my wallet 
0	So now, I'm going to watch some tv, then bullshit a I fucking hate Harry Potter costume for the monthly meeting tonight.
0	so number 100 is horny hottie.
0	So off to Tesco instead to be treated as an inconvenience.
0	So off work about to do what I don't know I'm exhausted
1	So on Facebook, I took the "How Gay Are You?" quiz, and I got 100%! Facebook knows me so well! 
0	So on top of already being in a foul mood, I woke up with a huge headache (or shud I say, it woke ME up)! I want 2 call in sick to work! 
1	So one down and one repair to go on my car! Thank the Lord I am good friends with mechanics
0	So one of my idiot family members blew out the electricity in the crib... I can't live like this... No Game For Me
1	so ordering for Lush UK is cheaper than going to the store here and they have different things to try! Yee
0	So our band broke up this week. Very depressing
1	so out of curiosity, why dont' you guys shoot me a list of Celebrities you guys Follow here on Twitter?  I'll start. 
1	Twitter Break I Tweet Way ToMuch Lol I Dont No How Log This break Will BeFor WhatEvers Byez MyMood..Hereing.MyIpod.Thinking!
0	Twitter break is over but i'm again very sad ...I just hate my life ...
0	twitter break later.  another reason for sadness.
0	Twitter broke for me again.  But I'm back...for now.
1	TWITTER CAME BACK, AT LAST! 
1	twitter cant be doing that to me . ugh i had to resort to facebook !
0	Twitter confuses me sometimes ugh
0	twitter confuses me...
0	twitter deck nt working on my laptop..
1	Twitter didn't start the fire....no, Curt did   I hadn't seen this before, but it's a riot.  Hey that's my kitchen! http://bit.ly/UofOO
0	Twitter direct messages broken?  Spent a lot of time choosing the words, & they didn't even save.
1	Twitter does not play nicely with my line breaks.  ^like that one
0	Twitter does not support Telstra SMS yet
0	twitter doesn't amuse me one bit
0	Twitter doesn't seem to want to update my new oAuth application settings
1	twitter doesn't understand vertico
0	twitter doesnt want  me to talk to michael
0	twitter doesnt work on my mobile web anymore!!!
1	twitter en mi facebook
0	twitter esquecido, dó 
1	twitter EVER for the next two weeks! i'll only update my thoughts. i'm taking a Maymester course so i have to focus!
0	Twitter fail
0	twitter fail.  Craisins are oily. does this make sense?
0	TWITTER FAM IM  SOO SICK  UGHH HO WANTS TO BE SICK WHEN ITS GETTIN NICE OUTSIDE... HORRIBLE!
1	Twitter Fam wat up,  had a great time shoppin i tried on this beautiful dress 
1	Twitter fam, I am back! 
0	twitter feo no funcionabas  xd
1	Twitter followers: please help spread the word about my blog and give me more of a reason to update regularly lol - id love u forever
1	twitter followinq;needs friends.make me famous
0	Twitter for Facebook is not working today
1	Twitter for god sakes wth is your damn problem. Change my name already. Good morning everyone  teehee Goin to get puppy! hot as hell!!
0	twitter fox no me va
0	Twitter fucking hates me. I get maybe half the tweets people send
0	Twitter giveth & Twitter taketh away! My 40 NEW followers is in fact 4. They fixed my page   Not that I am not grateful. Thank U guys 2
1	Twitter gods/CEOs  must assume folks have actual lives to set their down time to 8pm on Friday nite. They are wrong.  how will we get by??
0	twitter going crazy here... so won't be using it today  (except I manage to fix it - but I doubt it)
0	Twitter going down for 1 hour  see you all soon
0	Twitter got tired.
1	Twitter had their picture setting down for a while. Finally able to access it.
0	Twitter has a new bug? I can not follow/remove/block somebody
0	twitter has been reduced to 'iphone 3gs blah blah blah'...i'm just jealous, i can only samsung camera-flip blah blah blah. 
0	Twitter has def. dropped some of the ppl I follow. Wonder how many ppl I was dropped from. I'm also following ppl I DIDN'T follow.
0	Stopped taking Propecia because it's a banned drug and now my hair is falling out.  Great.
1	Stopped to have lunch at McDonalds. Chicken Nuggetssss! :) yummmmmy.
1	stopped working on the image database awhile ago to help Greg with his term paper. Now chit chatting with Greg.
1	stoppin by to say goodnight.rough day n now its time to call it a night..Goodnight everyone n stay blessed, thank u god for another day 
0	Stoppin in riverside for the night. My ass hurts so bad from walking up and down hills in san fran today...and then drivin all day.
0	Stopping traffic with this Huge red pimple on my cheek!!  red light go away!
1	Storage on the webs domain just got doubled to 80MB
1	STORES FINALLY CLOSED YAY LAST MINUTE CLEANING THEN IM OUT OFF SO WASHUP UGLIES?
1	storm  off to see texas in july.
0	Storm chase & streaming ops are a no-go today.  Tomorrow looks iffy.  Next week hot and dry.  The heart of the chase season appears over
0	Storm clouds are back today in central Oklahoma  in Oklahoma City, OK http://loopt.us/Vhqktg.t
0	Storm clouds have cleard (at least temporarily) albeit the humidity remains to keep us wet in sweat!
1	Storm from OCC (Orange Country Choppers) posting about his modded MS3 on the forums...Have a look!  http://is.gd/CmhV
0	Storm gone  the lightening was Kewl.... But i think they said there is more coming later tonight...
1	Storm is over, maybe I'll go for a walk on the beach at 3 am  soooo relaxing!
0	Storm kept me up. Alllll night.
1	Storm seems to have fizzled, and with it goes my only excuse for not going outside! Off to walk the dog before dinner 
1	Storm was pretty big last night.  Don't forget to tune in 106.9 throughout your work day. You know what to do.
0	storm woke me up this morning and cant get back to sleep
0	Storm woke me up, i hope it wont be like this all day 
0	storm! you don't know how bad i feel right now. this was supposed to be our last year together but were not even classmates.  --sky.
0	stormin again... no walkin today...
1	Storming like crazy...I looovee it
0	Storming out pretty bad. Which is highly inconvenient since my phone bill is due today and the power is out
0	Storms popping along I-70, mainly west of STL. Main Threat: Heavy rain.  I need to mow 
1	Storms rule.
0	Storms, Storms and more Storms!! My grass will be 4 ft tall before I get a chance to mow it! UGH! 
0	storms? NO! I don't like storms...
0	Stormtroopers were waking up babies.  boba fett and sand people are also out and about.
0	Stormwind is painful
0	Stormy skies on motorway just south of bristol  http://twitpic.com/6rdtk
1	stormy tonight, wasn't suppose to be, but I guess the whether man doesn't know everything !!  hahahaha  
0	stormy weather but busy day ahead.wish it was weekend to sleep in a bit
0	Stormy weather! No motorcycle for today
1	Story of my life: on vacation and planning another trip for the end of June... cruise, baby!  (BFF's bachelorette party)
0	twitter has gone silent on me
0	Twitter has overtaken my life  I feel so behind.
0	Twitter has said i have reached my maximum for searches for now.
0	twitter has spam!!?? oh no
0	Twitter has stolen my face
0	twitter hates me again and again and again..
0	twitter hates me it wont let me have a display pic.  aww
0	twitter hates me. for some odd reason it won't allow me to upload a decent picture. i may bite you and broke up with you twitty!
0	twitter hates me. it won't let me do anything!!
0	twitter iko down!!!
0	Twitter is .... somehow borring...
0	Twitter is a bit quiet today  suppose everyone's still asleep :s
0	Twitter is a microblog therefore not a proper place to mock people around. Geez, Indonesians and tech don't belong together 
0	Twitter is about to have down time
0	Twitter is acting funny again
0	twitter is acting so stupid. makes me not want to talk anymore
0	Twitter is acting up. I'm not seeing all my responses
0	Twitter is acting up...
1	Twitter is an amazing thing.
1	Twitter is back!
0	Twitter is being a pain the butt right now
0	Twitter is being absolutely horrible to me today.
0	Twitter is being an ass again
0	twitter is being dumb, and not letting me change my photo 
0	twitter is being really slow and I have Sims 3 is installed, but can not play because I am at work  #fb
0	twitter is being slow and messing up on me
0	twitter is beng gay! it won't let me change mt pic!
1	twitter is better than myspace!
0	twitter is blocked by GFW. I just use it through a proxy..
0	Twitter is Boring ... there should be more options ...
0	twitter is boring tonight
0	Twitter is boring.
0	Twitter is broke I think! I'm not getting my new followers on my Blackberry.  Anyone else having issues getting new follower notices now?
0	Twitter is broken, and I miss it. 
0	twitter is brokens for my mobile  i don't know why!
0	Twitter is confusing
0	Twitter is confusing now. I don't get the whole #word thing or Trending Topics
1	twitter is cool, 
0	Twitter is dead again  everyone must be in bed, where I should be..
0	TWITTER IS DOWN TWITTER IS DOWN! getting ready/going out (wish i could tweet this)
0	Twitter is down!!  noooo! It's a sign of the apocalypse :o
0	Twitter is frustrating me. I'm only getting updates from certain people and I have more than just their updates turned on.
0	twitter is fucked it wont let me change my pic
0	twitter is gay
1	twitter is GAY !
0	twitter is gay...it needs a school section to find people easier
0	Twitter is getting boring. i dont know they hype is dying
0	twitter is giving me such a hard time uploading my photo
0	Twitter is going crazy with #e3 tweets I love social networking, but its overshadowing the awesomeness that is jolicloud and my shit isp! 
1	Twitter is great, but there's nothing better than a VIDEOMAIL  http://tinyurl.com/o6wy3a
1	Storytelling is the most important thing because it forces you to do and learn  (@torres21) #qsite
0	Str8 Rippin wins MLG Columbus!!! Woot woot. Too bad instinct got taken out early  GG str8
0	Straight back into it at work, no mucking around 
0	straight boys for me to look at
1	straight opponent rivers a full house
0	Straight up missing Nicholas.
1	Straight up, best day ever. Happy birthday perfect.  You're incredibly perfect. ;) <jay h>
0	straightener burns are horrible
1	straightening hair tomm.
1	straightening mon hairrrrrrrr. just bought some new hair stuff protector shine stuff. lets see if it works!
0	straightening my hair, and cleaning my room 
1	straightening my hair. going out tonight.
0	Straightening my hair. have to go to orthodontist.
1	Straightening my hair. Ugh. Its hot. Haha.
1	Straightening my hair... I look pretty.
1	Straightening my hair; its really long and really red, which makes me incredibly happy. 
1	straightening my hair;; then getting ready for cuhtinas  http://twurl.nl/ioazz0
0	straighting my hair  skool tomz
0	stranded at dans apartment
0	Stranded at Southern Lanes. Boo busted hose.
0	stranded at the Kangaroo - pumped gas and now car won't start
0	Stranded at the Lab
0	stranded at work
0	Stranded here in Batangas port
1	Stranded in the New LIfe parking lot with no car keys and a dead phone. Left the keys on the other side of the state. I love my brother
0	Stranded on my balcony.. I've locked myself out of my own home someone come help me
1	strange combination: coffee, elections and pensions... 
1	Strange Q, but what was the hardest chapter of your life? childhood ect. 
1	Strange sent a text and it didnt go through. 163lbs right now. Fights at 160.
0	Strange sound from under the hood...  http://tr.im/mKMa
0	Strange. When we were 2gether (ahem) Pritam+Mohit came up with 'Tum se hi'. Now we've broken up, they've got 'Yeh Dooriyaan' !! 
0	Strange... and probably sick.
1	Strange... Because we are switching Phone and ISP companies Verizon has turned off the landline but not DSl.... ok
0	strangely spotted and aching in all my joints... inch long gash down my arm from broken glass.
1	Stranger: Where are you from? You: Moscow, Russia. Stranger: Hello comrade Stranger: Give my regards to Putin  ? ??? ????? Omegle 
0	Strangers in the flat. Not impressed. Hiding under my bed til they leave. Is an hour or so of sleep too much to ask for?
0	Strangers scare me.
0	Strap broke on my skates. Looks like I'll need new ones after like, 6 years. Bye bye, skates 
1	Strawberr Icee FTW! Got off of work early. Epic win!  going home to sleeeeep. Cleaning house tomorrow and Moms is coming over. MO show tom
1	strawberries and sugarr  SUGARR HIGGGGGGGGGGGGGHHH wayyyyyyyyyyyyyyyyyyyyyy AwoopWooppp PMSL !!
1	strawberries ♥ yummy! grandma has brought them 4 me ♥ i have the best grandma ever ! ^^ love her
0	twitter is hard to use  ...... i think lol
0	Twitter is interesting, but I wish my friends had it 
0	Twitter is just no doing it for me any more sorry to  all my twiggas
0	Twitter is just such a less exciting place since I can't see other's  It was such a great way to be .. http://twurl.nl/8jsqo7
0	twitter is killing me due to its buggy API :S **no "in reply to"** from no-web-clients
0	Twitter is kinda silly with the way that people can DM you but you can't DM them back.
1	TWITTER IS LAME TODAY goodbye
0	twitter is like dead 2nite perhaps im the only one not going out  oh well, im sat on the sofa with a nice can of larger. ahhhhhhh
0	twitter is like my new xanga... but fast and easy? and cuter?! I miss my cat
1	Twitter is much more awesome than plurk  Plurk is for losers. Agree?
1	Twitter is my homeboy  fuckyeah, texxt? Pe is boring..
0	twitter is no fun
0	Twitter is no more safe for children ..especially when such account names are appearing on timeline.. Some plz report abuse
0	Twitter is not letting me change my profile pic and I'm mad
0	Twitter is not letting me upload a new photo...  Boo.
0	Twitter is not letting me upload my photo.
0	Twitter is not sending any tweets to my phone.  wtf.
0	Twitter is not sending me my twitter text right Ahh and then I don't even get them all  WTF! Twitter needs an upgrade & its not my iberry
0	Twitter is now going to be on xbox live ...
0	Twitter is OUT!! I cant change mi profile colors
0	twitter is pissing me off completly!! apparently my phone no longer works for tweets.
0	Twitter is pissing me off. Maintenance is 'posed to make things BETTER! Not eff it all up! GRRR.
0	Twitter is really quiet tonight
1	Twitter is replacing everything, businesses using #jobs & #hiring to find employees  Hope this doesn't turn into another dating service..
0	Twitter is so boring  why am I here again??
0	twitter is so boring today
0	twitter is so boring.
1	twitter is so gay!
0	Twitter is so much funner with TweetDeck...i almost gave up on this site and now it has me missing meals
1	Twitter is so much more fun with new tweeters! It's gonna be a great weekend!
0	Twitter is so quiet lately
0	Twitter is so quiet.
0	Twitter is so soooo slow
0	Twitter is solo slow
0	twitter is soo... messyy
0	Twitter is sooo quiet today
0	Twitter is srtaight trippin!
0	Twitter is starting to depress me now. People aren't replying back to me like they usually do.
0	TWITTER IS STILL FUCKING DEAD!
0	twitter is still not working on my phone  what will entertain me at work? jasooon fix it pleassssse
0	Twitter is teasing me with non-existent direct messages
1	twitter is the best people watching ever!  so much entertainment, I love to twitter watch  FYI
0	twitter is the only website I can get open
0	twitter is very slow tonight.
0	So out of it, had to check the washer to make sure I put detergent in it. Feelin' blue sucks! 
0	So over fighting with friends  I thought 18 meant you were an adult? As in, more mature.
0	so over this day
0	So over tutoring.
1	So over work. Can't believe I have to do this for another 30 odd years. Roll on Logan's Run
1	so people are following me...nice to know
0	so pissed i couldnt get tickets to coldplay. their playing tonight too
0	So pissed I missed the Peggle sale on iTunes a few days ago. Went down to $.99 now it's back up to $4.99.
0	So pissed off at Walmart... Cutting my hours again.
0	So pissed off I can't go to movie nite tomrrow  Misses her babes
