1	You'll get there!  x
1	 ah, that's ok, I am doing stuff like that all the time, my kids are used to it 
0	my tivo didnt record my weeds
1	I bet. I've heard she's pretty funny anyway in real life.
1	Games? You can have some of my work - will gladly share
1	LOL  yeah I think so - have fun for me as well!!
1	I guess this is good topic, that complements with talk about 'herding cats' 
0	 when I was 11 all I was doing was playing double Dutch.
0	lol yes we did. Though I'm quite intrigued about the shrimp by the sugar mill. Sadly we did not have a lot of time today
1	I am!! I might have something else online too cross your fingers for that...big things are about to happen
0	yeaaah I hope does too he need love and lovin
0	I wish I could go out, I don't got any friends here  Sucks! I'd go shaking my booty if I was in Okinawa, Japan tho.
0	 i'll try to make you feel better <3
1	hey there thanks for noticin'   you've been very kind for a while & it's appreciated a lot  - good company
1	thank for making me smile.
1	LOL!!! i don't see it as "addiction" any longer..more like a "way of life"
1	Ohhh nevermind, I see what you're saying - via Explorer, not via Hyper-V console, duh. 
1	pÄƒi pentru muzicÄƒ m-am dus. ÅŸi nu e vina mea cÄƒ aratÄƒ cum aratÄƒ pe scenÄƒ
1	haha well thank you in advance
1	awww  happy bday grandma! Hehe http://myloc.me/2Zm8
1	It sure is! And private universities host much better graduations than the UC's! I guess you do get what you pay for.
0	yeah last day of school was pretty bad!  hope you enjoyed the "pranks" and yeah...how are you?
1	oartv was amazing last night.  thanks for answering questions   can't wait to hear the recording!!!
0	yea but u know every1s just waitin4 u lot!! im bk at work n bk 2 fukin reality
1	You guys we're awesome on Thursday nite, I won't be askin for my money back!  
1	SO jealous! And so aware that this is NOT really hot. It just feels that way. He stopped screaming and went to sleep  YAY!
1	THANK YOU AGAIN, I'M READING THE POST 
0	ur gonna delete ur account afterwards??? oO what a shame...
0	thats cool. yeahh i had a really bad day and i feel pretty shit.  xx
1	well you're followed now, so I'll peg 2c at you whenever I have a chance 
1	Heheh A REAL french one.  I like that.
1	portion and GÃ¶teborgs RapÃ© White portion. The Swedish are not keen on Stronger snus with exception to Skruf Stark.
0	Awww man that's no fun cause that's just what I was gonna do
1	Thanks a lot!
1	thanks luv  and same goes for you- have an enjoyable wednesday.
1	i kno it sounds naive 2 say,plant/water trees when there's barely enuff clean water for humans-but IF u have the capacity,do it! 
1	 <---- here is another green project inventor! everyone congratulate him on his invention idea
0	ah so it's in the blood. haha it's kinda only 12mn.  i'll wait till internship + NS to normalise my bio clock haha
1	hahaha HBIC ftw <3 btw get Tweetsg. You can twitted thru SMS anytime
0	Wow, didn't realize the healing process would be so long. Me sorry. 
0	my string broke  the day before mt hermon...
1	yeah I'll be gg. Of coz I'll acc suping! have not seen her for quite some time. Yup I'm fine.
1	Yeah there very good i love them
1	I was told to go out and buy TF2. I saw a friend playing it, and it looked awesome! It's on my to-do list. 
1	Cause they stay in dark and eat fertilizer
1	I love that movie.  I saw it in the theatre. And own it.  I'm a Firefly fan.
1	only number four? ill have to try harder
0	okok. Surt
1	wow.. you're like two days behind.. haha. And yes. All Time Low is awesome.
1	wax discs mate... it's the future
0	 I H8 U EVEN MORE NOW
1	Oh yes, I'm completely behind that. Hel's bells, I'd even do that WITHOUT a feasibility study! 
0	you called me a whore.
0	the iPhone's gotta wait until I use up my Koodo tab. *shakes fist* Got another year or two at least.
0	no dogs.  Plus can't walk, squished my foot at work and am on docs orders to rest 
1	Rescue Me  (via
1	Thank you for following me. I consider all elements including the weather when I give my tasks. The weather facilitate tasks
1	yeahhh it's a great weather to roam around!
1	Oh, Canada! Have a great time 
1	 SHALL YOU BE IN BRISSY FOR TF MOVIE? *Is getting tickets for the premier if she can.  *
1	aw happy bday for yesterday  its anoyin tho sumtyms wen he dusnt reply to ppl. u gt any1 else famous to say hapy bday to u? x
1	I suppose if they are getting paid, guilt shouldn't come into it. Wow, that guilt trip passed quick. What's their number? 
1	just being honest you
0	just thinking that I am am probably further north than you are ;) lol I am craving the sunshine from back home!!
0	Only when in working days, but lately always rains in weekends 
1	great pictures for your upcoming winter collection
0	My followers are disappearing weirdly...from 187 down to 178 in a few hours
1	Yes! Sorry...ok holidays are in 3 wks! We can chat for hours  how does that sound?
1	gagaga you're welcome sissy in law
1	oh no Safka .... please get well soon ... I will be happy to review it when its complete if you like
1	I knew you'd come back.
1	at least you'll be sure it doesn't exist, right? 
0	Oh.....  ... Me wants to see it!
1	It was creepy, but I liked it.   Great talk BTWâ€”I really like  talks about deep topics rather than some library or another.
0	 ... thought about packing a hip flask in your lunch box?
1	 I second that
0	weird how just being able to go out and get lunch is a thing of envy when you're quarantined
1	good good  had a busy but fairly unproductive day, though. How about you?
0	oh no - croup is the worst .. Thomas gets it all the time
0	oh no ..  ... no dreadmill for you this week.  Keep warm ..
0	yer, working for others too  try another browser maybe?
0	 *Hug* I hope/pray everything will be okay or something will be figured out to help him. Hang in there.
1	Bright and beautiful here too!
1	my blog is http://fayero.blogspot.com. Surely you can share your thoughts with the world.
1	I know Isolated Incident is great!!  Im happy u had a great time!!
1	Thank you very much!
0	Lucky! I want one so bad! I just can't see myself spending that much for just speakers... I wanna work for Apple!
1	Nice.  Lmao I went to dinner with my friend and helped her do her registry at Ikea because her fiancee is lazy. Twas fun tho. =P
0	Spontaneous baking never appears in my fridge.
1	god bless them
0	thats cute but im switchin cos my lil bro had his too n i wasnt der   haha aren't i the self involved bitch lol
1	Ù?Ø¸ÙŠØ¹Ù‡
1	how many books did u buy from the fair? I went crazyy!!
1	hha yeah she told me that too  i wonder what her name is !
1	Thanks, Sandor. I think the DC revision just came out a few months back though. 
0	The companies that work with recruiters are a-holes like that sometimes. They'll say they need one NOW, not hire for weeks 
0	awwww  this too shall pass
1	sorry, I had a lot of change from chloe's piggy bank 
0	YAY, can i have them? if you dont want them... i dont have a single one in my room 
0	I am...found out my hubby opened the cookies (thats cool)...but he didn't eat my food
1	 Got to get when you can here!
0	I wanna come! I wanna come! LOL! too bad I'm a zillion miles away!
0	its windy out here
1	Sun, vitamin D AND William Baker? You're spoilt!! Have a great day 
1	cmon it wasn't that bad
1	nice one!!!!!! Milan for a whole month GREAT NEWS def need to skype chat soooooon
1	Yep...goood point   Night to Dan also ....
1	LOL. we shall go together this time
1	follow and you will be followed  I'm definitely a beginner myself
1	u must know where to park! if ure there for a quick shopping, park in one world hotel! 
1	You mean Peach?
0	I keep telling my parents to get MTV.. but they wont  DAMNIT. ps.. rumers are JB are going to be there.. hummm
0	we didnt have our phone date
1	: sounds great...just what I need!
0	 but while using proxy (ultra) it works fine. I have been earning ther and the moment i was about to cashout it hungup
1	is a fan of transmission , and a new version 1.70 is out  #Transmission
1	"Autofollow".... I can feel my scales crawling!!!!!
1	Good morning  How are you ?Thank you for the #followfriday !
1	I telecommute.  Though I suppose there is the potential to stub my toe as I leave my home office....
1	there is notthing tosay R* can't release extra content, just can't make it downloadable ;) and there is some rumoured 
1	 Did Carl Jr. already open? Would be great, walking distance from my office 
1	uuuuuuuuggghhhhhh. Was that Chinese or English?
1	Glad we could help
1	some people join facebook groups. serious people come and cheer
1	we need to win more often
1	we'll all support you from the tweetup  good luck #RADVISION #3 #fb
1	you say the nicest things.
0	oh thats so disappointed  lol
0	My public talk in July got canceled and I don't know why.
1	Currently I wait until the torrent finishes >_> Getting more hyped by the minute, though. 
1	I use Things. I love it. I'll show it to you next meeting.
1	...oops. hit send too early.  Taylor isn't the biggest man on campus.
1	???  Got anything left to share?
1	i think this solves so many things. you are set now. lucky  bitch
0	We stocked up a week or so back, too. Sad to hear it's gone. 
1	 placebo effect should never be underestimated. Good night, sleep well?
1	thank you.   the breed is a cornish rex.  i was showing and breeding them for over 16 years.  finally got to be too much.   h ...
0	that scared me
1	3 opening nights were my limit.Had this dim memory of opening being fun in 00 & 02,wasn't sure if my memory was playing tricks 
1	Never underestimate the power of pie!
1	umm. phonetically spelt, eye-eee 
0	we ended up not going  did you guys win your game? those sound scumptious.
1	yes.  took a while, but I think it will turn out okay!  
0	couldn't face burn intervals, so did elliptical instead 
0	ok, here's a half assed shot by the pool just now. iPhone not too forgiving   http://yfrog.com/12hrbdj
0	I cringed when I read this.    Ouch!
1	in the silence is the best place to start. The silence holds the truth
1	nothin, eating my chinese food  what u doing?
0	did u save the cute cartoon-ey versions of the My Favorite Barbie banners they had bc.com? Can't find 'em anymore!
1	 back at you, sweetness.
1	thanks! lijk wel 40!
1	New app idea....spell checker for texting
1	Sandra, please follow me to make communication easier 
1	Like it tooooo, and also "Wonderful" by Gary Go!! Best summer-song ever 
1	tonight ? I'm going to a birthday party at 3:00 pm I don't know when it's over but I really want to go so yeah I'll call you
1	it was great meeting you girl!! You rock
0	I'm so sorry for your loss
0	Have fun! You are not the witch of the east, so you will not melt. Its raining in Jersey 
1	haha ok ill let you know when we head over
0	i move into school that day
0	awww Sandi, i'm sorry u'r not well, sore underarm glands doesn't sound good at all, i'd go to the doc if that keeps up 
1	have a great flight!
1	So excited for you!!  See you at the weekend
1	Yay for sleep!!!  Cures everything...well, almost everything 
0	yeah i sure do! I know this rain wont STOP! How depressing
1	 Hi Sandra! Yes, I have a dog named Obi. He is a white chihuahua mix. How about yours? 
0	Me either! It's not showing up tonight!
1	aw thanks!! you would love her. she's so mellow and lets anyone pet her
0	oops.. should b painful.. it happens many times with me, i know how it feels 
0	yap. lol hahahah. i really wanna watch sherlock holmes, iron man 2, public enterprise. hiks 
0	I miss you.
1	I'm exhausted....but having a good time w/ my Seattle tweople
1	Thanks for the FollowFriday suggestion!
0	I give a test in using Flux a few days ago  deleted right away, so confusing.
1	Mine used to attack them. Now, two kids later (and, I think, old age), he pretty much leaves them be 
1	and Angels On The Moon is simply awesome  thanks so muchh. hee hee. i've never heard it before this.
1	Yeah. It's so addicting like the JB. haha
1	Aww...hope it's off to a great start!!
0	Sorry to hear that.   I was cheering you on! (in spirit anyway)
1	That's me set up for an exciting Sunday lol
1	Yay... congratulations, Sandy!  Have fun with your friend as well! 
0	thanks sandy for rubbing it in. . . I miss del taco!
1	Mmm!  I love pasta, garlic and oil with some crushed red pepper! My main staple is chicken though.  
1	have a good brunch
1	: awwww i yes you do  dont stress it mama
1	Wouldn't be M the perfectionist if he didn't have at least one delay...
0	i havent watched that one
1	ohh we getting a trainwreck update anytime sooooon???
1	tomorrow having art show u should cum  www.creaturefeature.blogspot.com
0	 thats really sad!!
1	Welcome back  USGS loves you!
1	if you get that google wave account, could you please share stories so i can live vicariously through you? heh 
0	#pt2 Good Initiativeï¿½ I m a bit busy in the coming 2 weeks. Sorry for not being a part
1	and Thanks for organising such an awesome Tweetup. Can't wait for the next one.  #ptu2
1	I just bought a smasung tocco yes'day--so thrilled with it
1	Raja's not a 'friend' but I love his work - I don't love the work of many Indian designers
1	too picky . Lemme know when the restaurant opens. U owe me a free lunch  http://is.gd/AWfO
1	was trying some more WP hacksactually  adding more fields to comment forms.. and more info to the notification emails.
0	<3 We shall continue following each other. Jorge and Joyce gave up on me
0	But you spam me too, and I continue following because I like to know what my friends are up to. 
1	was just there last week. Had so much fun! Can't wait for the resort world to be done.
0	I know what you mean, what am I going to do next week when its over  #vfth
1	That's a pretty nice way to spend a weekend!
1	whats up? I saw your video about ur cats. Glad Purple is doing good! Whats up with you.. update!
0	I can't dm you my #
0	I wish I could attend that
1	show it to me ?
1	you know your letter is wonderful )) and i hope that some of 100 ways will come true
1	curve without a doubt
1	...Oh really? Because that'd be amazing.
0	 I can use blip.tv, but i don't know how to get the link that they have their for iTunes on my site. 
1	As my chief Marketer your hired! LOL but u gotta lose the language of marketing in my world
0	I can in that I know that it is 'Out for delivery' and has been since 0615 this morning. Not that helpful sadly
1	Get 100 followers a day using www.tweeteradder.com Once you add everyone you are on the train or pay vip
1	I wont, cuz i love you more. Full Stop, End of Story 
0	opps  traditionally it has been on Wed  Can you play truant?
0	Yes. I kept saying to my mom, a plane can't just disappear. How could that happen? Sounds like sci-fi...   
0	You're alive!!  We've missed you
1	I miss you!
0	hate proprietary hardware
1	yea.. some articles on that..
1	Exactly, and the weather is caused by... So he will reimburse you for the pringles etc. Do try to keep up. 
1	 sure tell me about the project that you received funding for! thats great news
0	Your pages are being redirected to nowhere.
1	Try your Google Calendar. It's got tasks now.
0	 5555555 thanks obbie. poor you a
1	i've been great  i hope to see you some time this year..or this holiday. i'm about to head out now, catch u soon? x
0	Of course you don't call people fat in their faces, unless you're Hazmey HAHA. It's been soooo long since we hang 
1	nice to tweet you, do you miss Ealing? I've lived hear my whole life 
0	i hope you're still playing this summer despite what happened to jay bennett
0	i didnt get to say goodbye
0	Im so sorry about your dog  I am keeping you in my thoughts. I really hope they return her safe asap <3
0	god dammit
0	Aww man. I'll be up there the week before that.
1	o diddy my brother miss ya
1	good luck at E3 don't get too sucked in by the pre and post parties
1	A bunch of different things. Not enough space here.  As to Crisis...nothing can top the original.
1	yea highschool. buts okei I guess.. almost vacation xD woot! and fershurrnesss DD I'll message you if I go there
0	yeah it decent in NE!!! applying for jobs right now though
1	darn. sleep mister, you gotta sleep!  anyway, gotta go. bro's needing the laptop now. hmpf.
1	hello. what's up?
0	I don't understand why everyone in aus hates them. I kno they do harm in farm areas but pet ones are ok
1	that's really cool! 
0	Poor your Mum.    But it's best for Sooty.
1	It's at 8pm CST.
1	I do  sort of.
0	I won't b gettin mine 2day  they say in a week! Lame
0	Really? That sucks, I was really hoping you did sleep. 
1	Thanks for following! You're very sexy, in a scornful kind of way! 
0	that's ok  I was sad but i'll get over it
1	looking forward to it.  Also, I'll be posting up my 1st official vlog in a few minutes.
1	Nice! Keep at it bro, I am just cranking away on some client work, keep up the good work on FtC 
1	Only the truth. Keep up the great work with "From The Couch" and all ur other projects. I am closely following you guys.  Inspiring!
