1	And Jon... You're too damn tall to be discreet enough to jump movies.
0	And just accept everything thats thrown at me. Something i would liek to change really...
0	And just as quickly and unexpectedly as the sun came out, away it goes 
1	and just don't care about the people who talk stupid things about u!! i lov u miley!! here you have a friend
0	and just existing." --Michael E. Gerber. G'nite! Nobody loves me. No one ever tweets me back  Sweet Dreams! Esp 2 Kirstie, Demi & Susan P
1	and just like my sims I think I should head to bed
0	And just like that outmania is over
1	And just now i finished Resident Evil 5 \o/ Really good game, only the controls were a bit annoying, but I got used to that 
1	And just so you all know, i really a this strange and scatter-brained in person. My my personality makes it fun 
0	And just yawned and glicked on my arm
0	and Karol dropped off Luke for his first day of daycare.
1	and Laela are cleaning the house and doing laundry. Days off are no fun when Josh has to work. Can't wait til next Saturday!
1	And last but not least; Happy b-day Norway! Its our national day 2day
1	and lastly,this how sure is lonely when Felicia,Justin,Gar,Jazz and D leave ..but atleast I finished a song..! 
1	Great idea, guys. 
0	Thanks bb. I'm back in Portland now.
1	it's cool. I knew it was a long shot asking. So don't feel bad if it doesn't work out and all
1	You're probably right. But sometimes it's more fun just complaining about it
1	- thank you again for the favorites button!  I figued I should thank you as often as I complanied
1	haha that'd be fun  what's nightcrawling tbc btw?
1	OH U KNOW WHAT IMA TAKING ABOUT
1	good night
1	no problem
0	Oh wow! That's crazy. I hope it all works out.
1	I'm starting to have fun with this
0	 That horse finally killed him
0	 my brother did the swelling thing and no it's not nice
0	let me guess - bills
1	Yes, The Last Lecture is a fantastic gift to give as well! 
1	I'm going to go home!
1	http://twitpic.com/3gkqd - i really like it.
1	http://twitpic.com/5l8qo - BLUE!!    More universal . . . altho my daughters would go for the pink! lol  Still voting for blue!
0	<3 listening to her bootlegs on Spotify,diff. versions of the same songs, prefer the old T tho. worried that this will disappoint 
0	Um our guy is no longer on Twitter
0	i got a really bad case of man flu it crossed the gender line
0	ok i wont bother you until 10pm then
1	i like tegan and sara a lot too! follow them
0	I'm sorry we never met up, we were go go go from the second Dirk got home 
1	did you have your coffee today? and are you already dancing??
1	Thanks for the #tweetsista luv.   Needed it today!    Blessings to you!
0	Really! When directed to NYArts site via link in email update, there you were. Deleted email after, so can't retrace the link 
1	Hey William  I didn't know you had a Twitter. So, what's up?
0	 I'm still drenched from all that rain.
1	:: Did you knock out the electricity while tunnelling?
1	 Lots of cute dogs - 1 thing that makes for a really good farmer's mkt. Doxies - even better. Yay!!    Thanks!
1	uuuuh should that be read you have a girlfriend? Little rusty in my programming
0	awww.. sorry to hear that   *MUAH*
1	The idea is hers to run with, formal story prompt or not. Ideas are cheap! 
0	I'm a complete jackass for spoiling the SYTYCD results. It was completely accidental and I obviously wasn't thinking clearly!
0	Aww, nuts! 
0	http://twitpic.com/7knc7 -
0	im awaaake! but a wee teensy bit tipsy so idk if i can converste about prostates very well.  alcohol should be PRO PROSTATE
0	lol. i decided to try it out for the rest of the namecheap contest. been answering since june 5th and haven't won yet.
0	Mine too. Where are Jared and Jensen when you need them?
0	That's absolutely horrible. That poor boy
1	Two all beef patties, special sauce, lettuce, cheese, pickles, onions, on a sesame seed bun.  
0	I had to unchecked all apps - Sync- then recheck- and sync again. Warning - all data & prefs will go poof.
0	grrr i think im getting your tweets really late! gahh  oh well at least im getting some! (thats what she said)
1	yes the book is defnitley better, per usual. but i liked the movie b/c of the casting- not so much cinematography 
0	Damn, wish I was staying in CA a little longer! 
1	Get 100 followers a day using www.tweeteradder.com Once you add everyone you are on the train or pay vip
0	The second-half was simply heartbreaking, wasn't it? I've watched it three times already and I still cried 
1	 UM yes. let me know next time you go there. i live close by...
1	A piece of your cake would make my Monday that much sweeter!
1	Go back to bed, missy. 
0	Hubs is gone for the week & kiddo is home.  No gym for me.  Maybe I'll run while he rides bike? The cement kills my knees
1	I wish I had a piece of that cake right now.
1	We enjoyed "Benjamin Button."  Took us two days to watch it   Next up... Gran Torino!
0	I well miss you  xxx
1	*smiles* Thanks! It's always been one of my most popular. Afraid to list with better pictures
1	Happy anniversary!
0	*sob* can u see my reply to fucking update
0	I didn't get the link
1	Oh calm down!  It is a game!  A GAME!  Lol.  hence someone wins and someone loses.
1	  Hope you're having a good night...
0	 I LOVE that 4 U....... Who's your date?  I have 2 tkts N1 - solo N2 and solo N3
0	so it sounds like the dvd with the box set is a consolation prize
0	i love it way more than "scenes". it would be sad to have it lost to the annals of a TV station.
0	I still cant convert.  tried the link you sent.  I think I need to visit the mac store and meet with a specialist this pt
1	you are the best! and thank you for the tunes in my inbox!!!
1	I quote "My Vulcan logic has determined that you are a moron"  And that's what that guy is.
0	 I had to go buy some chips after I heard that!!   Miss you
0	asi asi, got a cold 
1	thanks for posting all the videos  GO MAGIC!!!
0	 i wish i could come guys!
1	hope you guys come to singapore one day  you all are awesome !
0	And let the week begin
1	And like that, she was gone! (But at least her hair is natural brown again) 
0	and living room only have table before some people can get there
1	and long live Gopher, while I'm at it 
0	And lost my next tennis round
1	and love story by is the only song i can listen to, and sing on the top of my lungs, on repeat (@jslaw knows whats up  )
0	and man my followers are droppin like flies. yesterday i swear i had 30, and now i only have 26. sad day 
0	And many tests to study for  didnt even start (of course.) lol
0	And Marc!/Tommy lose to the Bryans in three.  Fena and Muzzah on court. I am off to have my hair cut and get ingredients for cake baking,
1	and MARIEL BORJA btw, it was nice catching up with her and her hunks. hahaha! ) she looks hotter ngayon infairness! 
0	And Martin appears to have jinxed us. He told me it's raining there. Within half hour, it's started here 
1	and maybe baby you could rise above the rest to meet me..
1	and maybe i'm a ghost and i'm wondering . . .  i <3 SIL, and i will marry pat brown  hahaha.
1	And maybe we can get them tweeting too!  But seriously, if anyone is interested, let me know.
1	and meet my classmates and classmates last school year.  and, its voting for class officers!! i just need to pack properly. i forgot some.
0	and missin you my dear prince, is incredible the lack of you in my heart â™¥  hope to see you tomorrow so I can kiss you again... *.* L've u
1	and mission impossible orig tv shows are really awesome.......
0	And Molly has to stay at Corey's mom's house even longer now until we can find another apartment if we dont get this one.
0	And Monday just got better...FLAT TIRE!
0	And Monday. Trying to find a polite way to tell a client we are removing our logo from their site, and their site from our portfolio 
0	And more great news my Uncle Vincent passed away today...my moms oldest brother.   I can't take much more.
0	And more personal info - I now have a purple toe nail and it looks like it's going to fall off, no sandals for me this summer 
1	and more shouts for #followfriday
0	And more... now perhaps an ear infection? KILL ME PLZ. I can't take this anymore.
1	And morning to all.  Make it a great one
1	And most pointless Tweet of the day goes too..
0	and msn is being an ahole today toooo...
0	and my ass still hurts
0	and my babies
1	and my bag is well heavy so if u see me struggeling on the northern line later...a helping hand wud b much appreciated!!
0	And my butt is getting bigger my thighs are huge
0	and my Cameron
0	AND my car died...  again :-S
0	And my day was going so good too
1	and my father made pizzas for lunch  it's been a while since I last ate REALLY what-you-can-call good food
0	and my finger still hurts...
0	And my hair got messed up
1	and my half heart is what i only adore night and day.  | | good night everyone, sleep tight! http://plurk.com/p/xxbx2
1	Can, but not too much *lol* From Ribena's ad in the 70s 
1	wow pics finished fast! All done
0	i noticed too  it's probably a combination of the two. whatever, more tickets for the people who actually believe in our team!
0	sometimes i wish i could go back to march
0	Sometimes, turning the other cheek doesn't cut it, and the best you can do for Jesus is get it over with quick. 
1	take some pics pls
1	I KNOW! I'm dying to see how well he does
0	yikes, i'm glad to know it's not just my AC then! was really starting to worry  ugh
1	I am yes but have easiest job in world and get payed to stand around
0	Yes. Fortunately I'd finished them. Should have disposed of the wrappers
0	i was stuck waiting outside so didn't get to see  we did vanilla. awesome! also has hotdogs!!
1	couple  but issue is on Archlinux.. On Debian AIR is OK
0	true true >_< ahhh im so over school, im in the deciding mode of leaving or not, im so unsuure 
1	good stuff, Z! the cappy tarotscope resonates with the star card i pulled today... 
1	1 housemate total, and yes I'm moving in there too 
0	- Doc Z, where's Jedi master  I hardly see him these days.  Any news? 
0	been a while since i had the charsiew there  its damn good
1	LOL! I love this phrase. It's very useful to keep one sane.
1	yes m'aam. i want the stouffers veggie lasagna
0	it's a good idea!! & i should stay awake all night. but tomorrow i have to wake up very early!
0	No fruit here..  I need to go grocery shopping!
0	my little sis  the bb. And I know right?! Her hair isn't even curly!
0	Drink came out of my nose at that scene
1	I heart you!  we're in Stillwater right now. Totally worth the drive.
1	Awww, the shimmery memories  
1	Yeah! Nice.
1	  City Lights, Trattorias & Coffee shops in North Beach, What could be better?  Sounds like the most romantic day! 
0	That's awesome,  give me one ;)  That thing has more memory on it than my desktop has total 
1	not sure if u have been told already bit of a typo  A hidden gem in the middle of the CDB... thanks for the list anyway
0	He's on Twitter! But yes. He's awesome, and has an AWESOME! name. And sadly, I know not of the commercial you speak of. 
0	ka son! aku disuruh tidur kmrn. i was waiting for ur reply for several minutes but theres no answer  HAHA bikin rendang susah!
1	Same for your toys!!
1	true it did. Still liked the idea of a spaceship better than a spacestation
1	i loved it
1	Zovs, you got any amazing promotion/deals for people in Irvine? 
0	I'm doing well! Its beautiful here and im stuck in class  but going out tonight shall be fun! How are you??
0	and my hand is bruised from trying to catch that jug!  lots of little swollen bits
0	and my head is still hurting
0	And my heart just broke a wee bit for him
0	And my heart just broke....he is married.....to Scarlett Johansson.....
0	And my internet has failed me.  i guess its just time to go to bed. Nite yall.
0	and my knee is killing me. "/ doctors here i come.
0	And my laptop still has no internet.
0	And my modem cut out again.  I can't even get the page for the modem to stay up on the screen. This is too weird!
0	And my mom just scratched it.... anyone know how to get rid of it? It's on the screen!
0	And my old faithful copy of "The Colour of Magic" has bought the farm due to water damage
0	And my pants make me feel like a cholo.
0	And my photos seem to get stuck at the very end of sending
0	and my piercing is no more..
0	And my room is a mess and i try to pretend it's my binder and take care of it but it's just not working
1	And my sim will be a rockstar.
0	and my sisters gone back to merimblah
0	And my skin is kinda red now. I swear I used my sun lotion but it never helps
1	And my switchblade is going to love u
0	And my tongue is burnt too, and my lips  use sunscreen guys!
0	and my tweetdeck stopped working
0	And my web address still doesn't forward to my Etsy shop.
0	And my xbox dies on NXE yet again....it's not been the same since last week's downtime
1	and next time Roddick better make some breakpoints he gets
1	AND NICE TOSHOP STUDDED SANDALS  Thanks Ayah !
0	And no ... I'm not jealous .. Have you seen the person in question ? Yuk!
1	and no I haven't gotten GoW: Chains yet. But I do have Sims 3!
0	And no I'm not mad over that just mad period!!! Good bye
0	and no one wanted to pee on me  haha. Ouchhh feeling the sting :s
0	and no, you cant buy a gorgeous poster (http://is.gd/1aP53) from NYIBC this year, their 25th Anni. They cut costs and didnt print any. 
0	And no. Greensboro men are not as hot as Durham guys. Or maybe you all just didn't show up tonight.
1	and no...none of us in the restaurant felt the trembler...a 4.7 is not even on the charts if you're a local to CA....especially LA.
0	and nobody is responding to my text messages.
1	and not 6:45 yet Shaun hehe  only 6:43 lol
0	And not in a good way ..
1	AND not only did i get a handmade linen from switzerland with lotus flowers on it, i got two of the most beautiful pictures of lotus ever 
1	and not too much romatnic couse i dont like it when it too much  and later we went to a great resturant to other city that i love
0	and now another friend's mum has taken a turn for the worse  life is so cruel, especially cancer 
1	And now Cheryl seeing if Cyan has a hope  http://twitpic.com/7hilb
1	and now for dexter then chem I'm thinking
1	and now for my scheduled eye brow pluck break from study
0	and now for something completely different. math.
1	Oh I am so excited about these.. it's going to be so unique
1	yeah i know...but man...they take it to a whole new lvl...they all look sic with those beards...haha
1	LOL by mistake I sent the same msg to eonline..thank god for deleting
0	dudie. definitely responding! that video ... breaks my heart
1	I'll think about you when I'm scribbling away about Parnell and Ireland  whats your topic?
0	never ever heard of it! oh  maybe i shall try some one day...
1	yes they're obv aware. i wouldn't be able to go tho, but still  im off for a tanning seeeeeeesh again! bbb lataah
0	zozo. those pictures make me want to cry a bit
0	I know they drive people to extremes with their actions, but some things he said were too much. I used to respect him. 
1	glad that your on twitter!  best abercrombiemodel fan friend forever!
0	girls did to rob.. thats just out of line
1	I have three and only the last one died on me so far, but was fixed really easy. I've had them since around 2005 
0	mowed weeds....no grass   How the heck are ya?
0	I'm working on it.
1	OMG! So it looks like they're really going to fuck that movie up  Where's all the cool music, misery and drugs!!!!!
0	I don't have an Accessibilty option
0	everybody knows something i dont! i'm curious. i forget it's some kind of crime.
0	I'm trying lol - just frustrated
1	means you're what? nothing...just cheerful absurdity.
1	nope i am from germany haha but i lived in london for 4 months  und mir gehts gut danke und dir? hab dir ne msg geschrieben ;)
0	Ouch. Poor employees
0	creation? Its just a picture right now. Man Idk how to do my page
0	HaaHaa its finished now  lol
1	Heyy im fyne tah wt out u
1	im good thanks
0	Just had tea and tht was a bad  pickie lol i misspellt Bad as big lol wuu2 im bored
1	ooh, what might that be? 
0	What have Brawn done by changing his strategy mid way through
0	wont work!  and it keeps disconecting my pod.. :@ I officially hate it now.
0	Yeah and yeah. But i cant go on it atm cause the xbox is in my brothers room and hes locked his door cause hes out
1	Have a nifty night!  Get that full 5 hours worth of sleep!
1	Well, as long as you make those 2 days count, it really helps!  I took the weekend off, I'm gonna suck tomorrow. haha Sleepy yet?
0	cute yes... But some sad parts too
1	don't worry. it just ran over a bad carpet and is static now
0	no not really I'm jus bored as hell
1	i like how ur freakin amazingly awesome !
0	I love that show too! I think its cancelled though
0	Cool! I can't  My legs are to short. Or to fat!
0	How will Europe manage with so many extreme right parties you mean ?
0	I have a BlackBerry and G1.  #twtrcon
0	well, i wish he's let us in on it...so we know when our man is on....i'm missing him lately 
0	me too...but i dont see them having babies anytime soon
1	thank you!!!
1	You don't want to say that too loudly...the Internet will hear you.
0	now that i think about it, i'm over my minutes this month... can u get on aim? or we can pm? or i can call you after 9...sowwy! 
1	again I ask, what was the naughty part? Seems like he is doing his job as a young boy very well 
0	i wish you could chase with me in July in VEGAS --   met a guy last night who owns his own island, gonna try to hook us all up
0	awe I'm sorry its causing you so much trouble
0	I need Coffee, lol, I saw you tweet this on McInTEC Net lol  it comes up before Mibbit, Mibbit is so slow on Twitter, it sucks 
0	it works for other videos and has been doing  it for a few days
0	Sorry, Wont add you becuase I dont have Facebook  becuase I think its crap #facebookiscrap
1	 http://www.zazzle.com/  http://www.tomatocage.com/ just trying to remember these links.... I'm not on my pc. ignore me
0	I just got an email from my Aussie pal. I dont think she has a clue about it cause she just told me all about her plans..
0	I agree! Walking out your door at 7am to hot humid weather isn't pleasant  via http://twib.es/CKJ
1	Thanks for the #followfriday luv
1	all of u guys! Lol...
0	sorry honey
1	I'm open to any and all suggestions of people that I can befriend before I get there, Twitter or not!  
1	No worries Speeezzz it just means you will be smarter than all of us
0	I took the actual one about a week ago.  waiting to get my scores back for another week or two though, which is killing me 
0	Oh yes I did. I guess the shots were just for them then  but I will try and watch anyway.
1	yeah, don't forget me 
0	Ugh!  I hope it gets better soon!
1	fone for a delivery? then u dont even have 2 move lol....im starving 2 mine dont open till 4pm only 20mins 2 goooo
1	thank you sweety
1	Awww your welcome! You have to stay positive  ! You too have a great saturday!
1	sounds like a good time! This weekend I am going to catch up on some sleep&get organized...keeping it mellow
1	The trip is ending today. Waiting 4 my flight back home. Conference was awesome! Glad ur getting back out + enjoying life
1	Gooooo Rangers! They are playing awesome latel!!!
1	o lol hahaha I'll check it out when I get to a comp
1	Let me know what you might need, I could prolly help you out. 
1	lol Thank you.  It has been a very full, but very amazing weekend. 
1	Happy Monday shar!! Good to see ya!  Hugs to JW & Adam
1	I would love to test.  I will need help configuring it though 
0	I think it's about to rain! I see lightning in the parking lot...and it's drizzling. No park 2nite
1	ma Ã©s holnap mÃ©g Ã©l a low price
1	I have to agree - a big button would be nice.  Took me a while to find it the first time.
1	Don't give up! You'll Get it
1	It's truly impressive what you've accomplished & I'm certain you'll knock out the swimming too
1	aww i miss u too  how r ur papers coming?
0	I wish I had anything gigabit  All I have left is a 2948 and two 831 and my handy 5-port Netgear 10/100 switch
0	previews look like the 1st edited down, the Ocean No one would find my body, and make me look stupid for drowning in my pool. 
1	http://www.myspace.com/barelyblind i'm a couple days late, ohwell. these guys are amazing, awesome guys, great musicians 
1	hha yeah  like they have your heart too but weve met shaun and bradie... it seems more real ;)
1	it's okay,  i wont tell you what part. continue eating them!   they taste nice, like shaun ;D
1	Did that - it was great
1	happy birthday!!!!!! <3  I LOVE YOU!
1	Get 100 followers a day using www.tweeterfollow.com Once you add everyone you are on the train or pay vip
1	hey thanks!!!
1	im good thanks  you?
0	yup, thts the problem! im still on bloody xp 
0	Actually it was not so bad  - conductor at least starred at my mobile since I was the only guy in the Volvo at the end.
1	suck my dick B*TCH...i just read your response to my tweets. ill burn you up, nigglet lol PS-GUESS WHOS BACK HOMMME!!! 
1	Hey. If ya got it, flaunt it. 
0	awww...do i have to?
1	hey there, thanks so much 
0	people have been saying anytime now for the past 24 hours
0	No problem mate.! Thanks for the dvd. But there is no lightroom in it.!
1	Thanks zuhiboy.
1	what's wrong with mozart?
1	HOI! im serious. haha hey 
1	goodluck for your exam..
1	happy belated birthday for your brother..
1	You're welcome
1	  -btw i can't figure out this... i think it will have to wait til morn.
1	I'll have a twitter war with you, baby!  Um...  you're a poo-poo-head!  
0	I know  Im sorry, I wanted to stay longer. I just told Noelle and Chelsea "good luck in College" and left. had 2 go
0	Yeah, I had second thoughts about #1 the moment I sent you his profile.  Too bad about #2.  
0	sa fiu al dracu daca stiam ca poza mea poate fi marita. fuck ce urat sunt!
1	Not sure yet. If i find a couch or someones spare bed probs august...but more likely mid september once i have hotel money
1	you should come over before friday and teach me how
0	omaigod i JUST realised wat u guys wrote abt my u-knw-wat. n no. it DIDNT come today.
1	When in KL, drop by Gloria Jeans in Mont Kiara! My brother in law is is a partner  They're having open mic on wed nites!
1	zura knows how to do a topspin, i cant even do one shit. there 
0	cant tests tmw  direct message me here
0	Well DAMN was the dinner good least?? lol
1	So what's your webcomic going to be about?
0	 I'm sorry.....deep breaths, I started a program called panicaway...it has worked wonders.
1	2 cheeseburgers and a shisk ka bob ketchup on the burgeer pleaasee  thanks o yeaa and mayb some potato salad
1	Good morning. On a tear again I see. It's good to know some things don't change. Have a great day
0	No I am not
0	I don't know haha, it's boring  do you have a myspace? www.myspace.com/emalvsptwntz nice to meet you too (:
1	I didn't get a lot of sleep myself last night. And it is a good thing, reading 
1	hi zuzu, I'm enjoyin this wonderful sunday afternoon..  listening to unreleased b tracks
0	Sorry  I'm making puppy dog eyes! What about Friday after 1:00pm as I'm taking Bobby Kitten to the vets! Love yoooous
0	wow Venus lost? dang who did she play?
0	that sucks pretty badly. same thing happened to us earlier in the year.
1	yeah it was fkin good  like, GOOD!! And yeah i read that one, it made me bawl i kept tearing up in public spaces coz of it!!
1	You shouldn't bother with HBO True Blood. Definitely censored. How's the quality for your DVD set?Surely original right?
1	and by the way congrats
1	could you make yourself look like any more of a stoner punk?! sheesh.. let me remind u: 4/20- not a real holiday
0	....the Cat not  was time to say goodbye.
0	wats wrong? People still ignoring you?
1	 YAY im on your background  ty
1	Yesh i should! Thanks b.t.w.!
1	Don't forget to print out your resume and put it in the look-book!
1	why would you dye the hair you cut off? Seems a bit silly
1	I was thinking you look too healthy to be Nicole
0	arcanine scratched her.
0	I just like her music....you know?
0	yeah.  He almost tore her back apart. It was so scary..but a little funny.
1	Aww, you missed me 
1	REASON NO.1 why ncd better! With the presence of me
1	and Glad you like it!
1	I Have it, but have no idea wtf it does. 
0	Sorry, darlin'. 
0	Ugh!  So sorry, bebe...  <3 *hugs!*
1	And Im super excited to record it for you
0	And now he answers my BBM  be strong denise be very strong iono care how adorable he is... Blahh
0	And now her pager's going off
0	and now he's left me. 4:15AM and i'm chatting with someone back home. i miss hk so so so much. take me back
1	and now I am following her on twitter 
0	and now I am sad
0	And now i cant even type a tweet without embarrassing myself. I'm shutting up for the rest of the evening now.
0	And now I have an entire folder of pictures missing! What is up with my computer?!?!
1	and now I have to go pack and we'll be off.  yaaaay 'we're all going on a summer holiday..'
1	And now I lay me down to sleep. May everyone dream of sugar plums and cotton candy  praying my wounds heal before thursday! Night night xo
0	and now i might have to make some comfort soup
0	and now i missed on Q102 because my facebook wouldnt load .. stupid laptop
1	And now I will finally add to the three hours of sleep I got last night.  Goodnight, all.
0	And now I'm at work
1	and now im awake for school...oh...and happy 420 stoners  hahaha
1	And now I'm going to go watch the Tonys, instead of Tweeting them.  You should, too. 
1	and now i'm going to read twilight
1	and now i'm going to watch Idle Hands, it's free On Demand right now 
0	And now I'm home. This is nice...aww jeez, now I'm missing America. 
0	and now i'm hungry
0	and now I'm just wondering why we didn't try to just avoid this huge mess, but then maybe it all happens for reasons! I'M CONFUSED. 
0	And now I'm out of the game
0	and now i'm sooooo missed my dad ! wanna have much time with u
