0	Vacation ended early. Will have a news story posted soon. Will send the link asap. Fla. Turnpike was a mess today.
1	Vacation hurry! No school! yea
0	vacation is almost over, how sad 
0	vacation is coming to an end.  i have to face reality way too soon.
0	vacation is O V E R  Had a great time!!! Now back to work!!!
0	Vacation is officially over. BOO!
0	Vacation is officically over
0	Vacation is over!!    Now I'm at school!! :/
1	Vacation is over. Back at work. Need to get used to all this stuff again
0	Vacation makes me sad. I miss real life
0	vacation off to a bad start
0	vacation officially ova!  red eye HNL-ORD. goodnight tweeples! zzzzzzzz
0	vacation over  drove straight through from hot springs....17 & 1/2 hours!
0	Traders village was fun. Currently in line for Up. wywh
1	Tradespacers - Have you added yourself to the TwitterLeague? http://twitterleague.com/view_league/301 (Via ) Thanks Sarah
1	trading can be addictive... enjoyed the first day with limited amount...
1	Trading tea for coffee has really made me feel more energetic... don't know why or how.. but I like it
0	Traffic  I'd like to get to my apt in time to catch at least *some* of the blckhwks game...
0	Traffic as always...
0	Traffic congestion...IN MY HEAD!!!!  I need to go back to the beach
0	Traffic in chi-town blows
0	Traffic is backed up on the way to the gardens
0	Traffic is horrible. What is the deal? I am sitting still on the highway
0	Traffic is horrific on 695..I jus wanna gt my dog
0	Traffic is moving at snail's pace on Queen Street East. Streetcar moved one block in 10 minutes from University to York.
0	Traffic is not as merciful as expected. May be late for celup-day  oh nooo...
0	Traffic is on an entirely new level this morning headed to the base.
0	Traffic is SO horrendous. Gutom na ko.
0	traffic jam in buahbatu bandung
0	traffic jam like hell...
0	Traffic jam!!!!! Maybe I won't be home by 8  haha
0	Traffic Jam.
0	Traffic jams are rubbish. Anyone know what's going on on the A48 between Cowbridge and Cardiff? We're stuck both directions
0	Traffic on 128S =
0	traffic on 26 & i-5 already look bad. might not make it over to this time
0	Traffic on a beautiful day  where the hell is everyone going
0	Traffic on the 5 freeway!
0	traffic ruined my hiking trip    now im back on the  couch
0	Traffic to coachella is a biatch. Think we'll miss joss stone
0	traffic was a lil heay ...everyone is going to the parade....im not
0	Traffic was terrible this morning...
0	TRAGEDY!!!! My company just made a forbidden site!! Guess I need to subscribe by email... can you comment from email???
0	Tragic news about the AF plane that went down
0	Tragic news. My neighbor lost her home  this morning was like a movie. I can't believe the way things happened.
0	Trail of terrors page on facebook now has 173 fans.  The group still has more
1	Trail ride! Horses and cowboys for miles. Happy I wore my boots.
1	Trailer park boys- Watch it
0	Trailler de New Moon: http://bit.ly/W8wtn  Achei fraquinho
1	Train again, no electricity again, battery full this time 
0	TrAiN AlOnE ThIs MoRnIn
0	Train delays and a USB stick full of evening work . Will be a fun night
1	Train finally movin at normal speed and my iPod is playing The Yardbirds "Train Kept A-Rolling...".
0	train is 30 minutes late going home this afternoon.    Reading 'Double Cross' by James Patterson to pass the time.
0	Train just set off, then stopped. Signalling problem, no trains can go forward this way  supposed to be 6 min journey! Gonna be late f ...
1	wooo hooo one of my teams made it GOOOO MAGIC
1	wooo hooo! on break  sipping on some cherry-coke!
0	wooo how fun sitting outside waitin around until my presentation
1	Wooo hunter the reckoning
1	wooo i got 500th love from robbie haha
0	Wooo I picked my sister and I miss the empty house.
0	wooo must study SocialStudies x.x shiat it's wednesday already.  prelims prelims prelims
1	wooo off work.. leaving Armo Land.. lmao!
1	Wooo sister passed her driving test today  McDonalds is in order lolol. I want to study outsideeeee! Hate being stuck in
1	wooo such a good day  party later 2nite!! think just gonna chill in the garden all day
1	Wooo thanks and I think theyre ok
1	wooo! best birthday ever! sexy teachers, scooby doo & spin the bottle with my girls. AWESOME!  ily life. ahahaha.
1	Wooo! Diversity won!
1	Wooo! I'm bored. Right when I got home, I'm wide awake. Sober and lovin' it! 
1	WOOO! well, like magic my picture appeared..   its rather warrrrm....
1	Wooo!!!! E3 awesome, new PSP Go! leak, finally some news 
1	Wooo, atlas creator is working.  Just need to output a struct w/ the UV coordinates as the final delivery, and I can get back to gamedev. 
0	Wooo, heading down to crescent beach with to spend a lovely sunny afternoon down there. Wish I had shorts 
1	wooo, i'm going to London! 
0	Wooo, no more lectures! Boo, exams 
1	Wooo,I've some great ideas for my new book! I already decide the name of it...but for now all is a segret ahaha  xoxoxo
1	WOOO. i have the same number of tweets as posts on the boards right now!
1	WOOO. JOHN TAYLOR IS ON JONAS I <3 JT!
0	Woooa, early bird wtf! Bnc is getting up with me! More people in the train than expected. But forgot my lunch at home  naw!  http://yf ...
1	woooahh! so tired
0	Woooahh. Headache. Think I've learnt too much. Why does it always rain on me?
1	woooh I'm going to Paris in august!
1	woooh waking up in vegas #1 on y100
1	woooho going to my teachers wedding at 2  I think it'll be great ^^ can't wait ;D
1	Wooohoo Goin into Town today with Megs Its soooo nice out I LOVE Bein off schol sooo much !!!!!!!!!!
1	Wooohoo!! The MTV MOVIE AWARDS are today!!!!!!! Can't wait
1	Wooohooo - wonderful new clothes for tower defense addicts on Free Realms. There goes my Sunday
1	Wooohooo 69 followers, 
1	wooohooo boyfriend time! after a loooong week at school this is just what i needed
1	Wooohooo for change !!!!!!
1	wooohooo go twilight  - man i feel sick really :/ - oh i can feel im giving up trying to hear from him
1	wooohooo new chickenfoot video!
1	wooohooo, i sure had my share of fun at Brewerkz and PHOTO talk! 
1	WOOOHOOO.....another upgrade pass, looks like i aint that thick after all! 
1	WOOOHOOOO I HAVE A NEW HOME ON SATURDAY NIGHTS IN HOLLYWOOD!! MORE DETAILS COMING SOON...
1	Wooohoooo nice sunny day but i'm going back to sleep it's not even 8am yet! Haha speak to you later twitterers
0	Vacation over  on the plane back to dc
0	Vacation over!!!  Looking forward to the next one........
1	vacation to D.R june 11th!
1	Vacation to Lake George! Will be back sometime on Friday. Text or call me if you need me. I'll miss you all  <33333
1	Vacation was awesomely relaxing. Coffee and Pocky are giving my week a good start
0	vacation. Just a dream
1	Vacation...summer...VACATION!!!  This is the best time of year
1	vacationing in mexico.
0	vacations makes me feel sick!
0	vacation's over  tomorrow back in the ghetto :-p seriously
0	Vacations... i need it!!!! ummmmm
0	Vacay delayed a day
1	vacay in san luis and i'm pooped...in a good way
0	Vacay is over  Back to life, back to reality.
0	Vacay's almost over  I miss my gemmabear like crazy though.
0	vaccine...the worst thing ever; I'm headache, stomachache and I'm SO asleep and just because one stupid vaccine and I NEED to study math! 
1	Vachel is texting to many people and its getting on my last nerveee!!!!!!!!!!
0	vacs goin on bt too busy in tutns......
0	vacuum just died. it is simply pushing dog hair into piles
0	Vacuum zip lock bags must be the next best thing after sliced bread. Packing for 3 hours and it's been insane. 3am already
0	vacuuming cars in the hot sun on a SUNNY day. boo
0	vagabond are coming to my town (one of the towns that bands NEVER come to) in 3 days, i only just found out and it's sold out. not happy 
0	Val in Kansas visiting UD friend.....car hit deer last night.......totaled car.....   girls ok......  ....THANK THE LORD!!!
1	val says: finishing up the new week's schedule layout & wrapping up monday's editing.
1	VaLaleuf (Valerie Laleuf): Just passed the intrepid...that's what she said...zing sauce  http://twurl.nl/pdz2vy
0	Valerie chicken has just gone to the big coop in the sky  but coincidentally we're rescuing two more today
0	Valet scratched my car
0	valium makes you feel goood. i need more. i can't fall back asleep. i want my mommy
0	Valium, I needz it 
1	Valuable precious time ... Good night tweets.  sweet dreams
1	Vamos a Wall-Mart
0	VAMOS DURMIR STHEFANY... to com sono
1	vampire weekend covered fleetwood mac, thats special 
1	Vampires at the festival!  http://twitpic.com/4h2qd
1	Van Morrison - Dancing in the moonlight  This song makes me so happy!
1	Van Wylder Party Liasion proposes to Scarlett Johansson via SMS...those crazy cats   http://bit.ly/21ZS97
1	Vancouver Apple Store, Sunday afternoon, mall location, only store packed with customers - if only this was church 
1	Vanessa is soo beautiful !!! I really love her dress  Zac you're lucky haha
0	Vanessa just told me she would like a break and to see other people  I hope it has nothing to do with me wanting to get married at 40
1	Vanessa posted that vid on my thread, it's all her but I know she hates twitter and couldn't get it around  I did it for humanity
1	Vanessa Williams on The View and she is GORGEOUS.Need 2 take care of myself so i can look that good at that age. Although Im 27 lookin 20
1	WOOOHOOOO! Tony's 1st in points!
1	wooohoooo. playin WoW before work.
1	Woooo Bank Holiday! This of course means you've got more time to visit us!
1	Woooo Diversity, they deserved it were actually amazing  x
1	WOOOO Don't care who goes from BB now
1	woooo elliot minor in 8 days!!! and i got my EM hoodie today!!! i'm tired and sick so it was a good...."cheer myself up  " thing
1	WOOOO Going to see Coraline 3D today
1	Woooo I got accepted!
1	woooo im done for the night  --  haha dont flatter yourself =]
1	Woooo its the weekend and its sunny  x
0	Woooo MSY are opening in Elizabeth. Damn the attraction to want to spend money will be close at hand
1	woooo pps love me alot now!  haha - i shouldn't get a thick head should i?   ah oh well! i'm loving it! XD
1	woooo supernatural tonight!! possibly going to miss some of it due to basketball but im taping it
1	Woooo!  Updates.
1	Woooo! is playing Dick In A Box! But its not new! D= Its been out for ages, Matty & Renee! I still love it 
1	WOOOO! Half day, GEEK SQUAD!, lwood afterwards 
1	woooo! i just pierced my smiley! myself!
1	WOOOO! Starting school at 9:20am tomorrow! YAYYYYY
1	WoooO! Well that's nice of ya. On both counts. If yr in/near Florida, LET ME KNOW. 
1	woooo, I had chinese for dinner  this weekend gets better everyday, and its only been one day hahah...aweshum (:
0	wooooh i got nothin to do today BUT study    agh whellll.
1	wooooh! first day of classes! darn... it's raining... tsk. but anyways, good thing all my classes this morning went okay!!! 
1	WOOOOHOOO  Just handed in my final assignment for this semester   Happy Happy Sal
1	Woooohooo! Finally getting some time off after working 9 weeks solid without a day off. Ok one day off for easter Sunday butthat's all!
1	WooooHoooooo A week from Tuesday Lines, Vines and Trying Times comes out can't wait 
1	wooooo driving was sick ayeee  went 80km/h wooahhh big achievment for brittanyyy  first set of lights hahah
1	Wooooo fire alarms gone off standing outside in the sun
0	Wooooo looking forward to Friday ~ except for going to the office    Guess I need to get at it before I change my mind ~ lol.
1	wooooo only 2 chapters left to read of this book  then I can read coleen's book
1	Wooooo running around in an attempt to play tennis is invigorating!
1	WOOOOO was just something on music channel and flava is loving JLS video ;) there goin through what music channels like
1	Wooooo! Party timeeeee!
1	Wooooo. I've been at the five dollar spot all day!
1	woooooh under 100 again in spider solitaire soo excitingg
1	Woooooo just picked up new Vans (trainers) from post office - they're so pretty
1	woooooo tina turner on with loving it!!  she is amazing.
1	woooooo...rice krispities. Bought new heels for Moscars today. And I'm tryin' to figure out what dress I'm gonna wear!
1	woooooohooooo BoyZone Tomorrow 1st june 5th row boyzone 2nd june 2nd Row
1	Train time!!!  I love the train!
1	train, train, train, tai chi, work out, train train train. eat. rinse, repeat. 
0	Trained a little bit.. The weather is not so good right now.. Some clouds are coming this way and the sun is gone..
1	Trainin' ta.marr for chickfillaaaaaa . Yes finally gettin' paid
0	Training at 4  dont really want to go, still sore from monday.
1	Training days for the week: Tomorrow, Wednesday, Friday then Game on Saturday in Ateneo \/ we have to win! 
1	training for my new job...and i had to get up early for it!  Wish me luck
0	training for work  ahhh
1	Training for work ends tomorrow. Then I start making MUCHO tips on Monday!!    Work = 5pm.
1	Training going well, cycled 7.5k this morning 
0	Training in celebration all day tomorrow...  The upside is lunch at the Colombian....Text me something to make me smile
1	training in Londen! Straks indian food
0	training soon
1	training started!!! not so bad so far!! kimchi is great here!!
1	training success
0	Training tonight was great, but I was really struggling  
1	training tonight yeah!!
1	Training was epic tonight  really released some tension.Imagining the punch bag as the frustration is a gd stress reliever
1	training was fun. Now time for dinner and shower. What a wonderful Monday evening
1	Training.. Song motions... Admin game.. Lots of diet coke
1	Trains suck. See aimee and Scott in half
0	Trains today from Bondi Junction to city cancelled/not working. Not happy Jan. Had to catch a bus - first time in around 12 years
1	Tralee and Mike... IT'S YOUR WEDDING DAY!  Can't wait to photograph it!
0	tram, alone. this is not what we planned 
0	Trample i mean. Damn this medication is kickin my ass
0	Trampoline II ... We barely got to know each other. Too soon.   It's not fair
0	tramps like us.. what a weekend, so not ready for back to college 
1	trance is God's gift to the world
1	Trancecast 24 is AWESOME! It is making my night of tedium so much more bearable!
1	transcribing my tenth (and last) report for the night
1	transcribing texts and lyrics in www.upodn.com.. Thanks for the provider of this site..
1	Transdesign.com! Why do you exist? Ok, so a hauled again  *wallet is hurting*
0	Transferring away from Drexel ... I have to
0	transferring to ku was by far the best decision of my life. taking summer bio at joco is by far the worst.
0	transformers 2 =21% on rottentomatoes.  Much as I hate critics I've never seen a movie that low end up good.  watch anyway or...
1	Transformers 2 and Harry Potter 6! must-watch.
0	Transformers 2 is already sold out for friday night  This sucks lol
0	Transformers 2 is coming out tomorrow! Sadly I acn't see it 'til Saturday...
1	transformers 2 is releasin its ass off on the june 24  *our first anniversaryyyy
0	Transformers 2 looks to be good! Shame on me...I haven't seen the first one yet  But plan to before I see the second one...
0	Transformers 2 ruined my childhood. One shall stand, two shall fail 
0	Vango Peace Tepee with flowers on, ideal for festivals? http://tinyurl.com/nyy4gt Glasto soon, which would explain the rain 
1	Vani gonno attain her motherhood soon!! I am very very happy for her
1	vanilla  citron with nutella was not that great
1	Vanilla chai because i'm loved.
1	Vanilla doubleshots and shopping w/ jack and ellie
1	Vanka, are you hitch hiking to UK?  I wish you good luck and happy meeting with Tery. Save trip to you both on your way back to BG 
0	vans in the shop for the 4th time. poor beast
1	VÃ­tejte na oficiÃ¡lnÃ­m Twitter ÃºÄ?tu webu http://MW2.cz... Follow us
0	vattoz closed!  I feel alone now.
0	VB code can be painfully for my brain
0	Vb to richmond to charlottesville. Work at 11 in the morning
0	VBS Day #4 bites the dust!  Great day, although I'm supposed to have jury duty tomorrow   It's been an awesome week all together....
1	VBS Day 1..
1	VBS day one went rather well for a first day!!  now time to catch some breath n rest up for tomorrow ;) day two here we come!!
0	-ve = Muse have sold out       +ve = dressing up like an ancient Greek at work
0	've just having my linear algebra quiz,, 
0	Veanme veanme ya tengo twitter! Alguien pongame atencion
1	vectorisering for media studies  Damn that fro is hard to draw >
0	veera is molesting some belgium ga... guy.. eating last MAMA chicken noodles! boo-hoo
1	VEGA UNDER FIREEEEEE
1	Vegan chicken is pretty good.
1	vegan for almost three weeks
1	Vegan oatmeal pancakes
0	Vegas does NOT drink beer  nothing but wine and limited cocktails with awful beer selections. Bummer
1	Vegas I'd like you to meet Sydney
1	vegas is sooo soon. I can taste the sunshine...
0	vegas til monday ... then back to westwood to pack away the last 2 years of my life
0	Vegas, Tao, got Jay-Z & Diddy on stage, & it's my bday. But the only thing I want is WATER which I haven't been able to get. WTH? 
1	vegetable soup for me.
0	Vegetables grow too slowly  and slugs move too fast!
1	Veggietales!!!!! ohh i love them! classic, might i say...WHAT TIME IS IT?...it's time for Veggitaaaaaaaaaaales! 
1	Vegging day 2day-Xcept clean kitchen..maybe 'Ben Hur' L8r, didn't get 2 it last weekend 
1	vejo vcs WHAZZZAP Kitsch Club  bombeitor
1	Velez Rubio Is Vaair Depressin. Stupid Lil Spanish Town.. Cantt Wait til I Moveeee
1	Velvet Underground - Venus In Furs http://bit.ly/IHXjp  Ahhhhh!
0	vem sono,veeeeeeeeem 
1	vendetta (named after Super Star Destroyer) is up since May 30th, midnight. Having phun 
1	VENICE....high water...high water......  WAAAAAAAAA!!!!
0	ventured out, did far too much today = regret.  
1	Ventured to the Basketball Hall of Fame today...my personal heaven on earth
1	venturing out for lunch to take one holiday dress back - after boyfriend quoted ' you look like you've come off a xmas tree
1	Venturing out to The Theme with Britt and potentially Amanda tonight,...wonder what stories we'll have tomorrow  haha 
1	wooooooo Chocolate cake !!!!!!!!!!!
1	Wooooooo LAKERS. 119-92! Time for finals!  wooooo
1	Wooooooo LOVED Shaheen As Well!..Awesomeee.. & He Sang The MJ Song As Well (Y) Goosebumps!!!  OMG What A Voice!!! Jeeeeeezzz
1	wooooooo.  #simpleplan is a great band.
1	woooooooo bagels and grapes. today is going to be amazing, i can already tell. 
1	WOOOOOOOO DIVERSITY WON WOOOOO!!!!!!!! sorry, i was a bit late LOL. I watched it when i came home, SO good! Well done to the cypriots! 
1	woooooooo FOBISSEA IN 3 days babbbbyyy
0	woooooooo i have fast computer again! thanksabunchesbabes! -- now just to get my speakers to work  --
1	wooooooooh 12 hours!! i hope this song is better than Touch My Body
1	WooOoooooooooo go you!
1	wooooooooooooooooooooo, 25 followers!! its a round number again, at last 
1	WOOOOOOOOOOT end of exams i as rather happy
1	woooooooooow, now this is just b.e.a.u.tiful! http://bit.ly/FFoau  
0	WOOOOOOOOW LOL thought they would trick them with a fake trailer but now they showing the real 1
0	wooooooow, totes missed my 1000th update 
0	woooooop I just woke up and it's after noon and my stupid grey's anatomy illicitness is only on 64%  NOT GOOD!
1	wooooop its my birthday tomorrow  finaly going to be 17  xx
0	wooooorrrrkk. no lunch partner today. so bummed
1	wooooot! David A and C doing handstands  http://bit.ly/vnCue  verrry nice and kinda funny
1	WooOooW I'm On Bebo, Twitter, Msn, Bebo & Listening To Music With Radio1 On In The Back Ground I'm A Multi-Tasker Hahaha ! 
1	Wooooow it's like 30 degreese here it's BOILING!!! it's lovely!!!
0	Wooooow! Its a 3-point game! Ughhhh Im sneezing now.
1	woooop chelseea did it FA cup champs
1	woooopsies  bring on wednesday i say..more so bring on september 12th. mwahaha. i love <3
1	Woooot! SATs were long, not too hard. Graduation was hectic as usual. Eating steeeak 
1	Woooot!!  gonna have fun tonight. :3
1	woooow,they now have put gay & lesbian pride month banners around work  makes a YellaStud smile
0	wooooww tweeting again, i'm attepting an assignment, but have to get off my laptop at 2pm  no point in starting reallyy :/
1	Wooop, massive picnic and the weather is perfect 
1	Wooot - lucky jolly ol' London to have  My cap'n Hammer in a browncoat who lives in Castle nowadays!
0	woooT! why this day is boring? its my aunt and grandmother's birthday today, yesterday's my uncles.... geeezh,   
1	wooot!! Harry Potter weekend on ABC Family
1	wooot; my mommy might let me die my haiiir, 
1	wooow I missed twitter
0	wooow of course the blockbuster near me doesn't sell livenation tix, no ATL tic til tomorrow 
1	Wooowooo it's nearly the weekend
0	wooowww, yorkies r pretty costly .... maybe I won't be gettin one after all !!!  
1	Woop at my glass of pink elephant rose at the O2  xx http://short.to/6xmh
1	Woop being discharged soon! Not so good at playing the waiting game
1	Woop I got a reply from the almighty  how awesome?
0	Transformers 2 sold out  now at Denny's w V-town crew
0	TRANSFORMERS 2 TONIIIIIIGHT!!! but first...work
0	Transformers 2 was AMAZING ! But I miss JAZZ  he was the coolest robot ! Ha the twins r tite now !
0	Transformers 2 was amazing! I really enjoyed it! Lots of action, and new bots!  But now I have to study again..and it's 4 am 
0	Transformers 2 was soldout today for the 12.10 session so i couldn't go  daaaang it
0	Transformers 2!! Wooo  On the BBC right now  no Shia....darn it
1	Transformers 2: Revenge of the fallen in 9 days, who else is going to see it first thing?  I know I will
1	TRANSFORMERS 24TH JUNE. yay qld
