0	almost missed David on Larry King..  I'm watching it now thouggggh! <3
0	Almost never happens: we stopped a DVD before the end because the movie was so bad. Don't rent to netflix "The Breakup". Totally blows
0	But whenever I see bdsm gone badly I feel all sad and horrible.
1	mmm SOUNDS MIGHTY TASTY  (drinking laws, what drinking laws?)
0	Money?  Sadly is the only reason I can think of, baby. *pats your head*
1	that is sort of crazy
0	aw man i totally would have napped next to you if i had read it earlier  did you try siam?
0	Poor dog   Looks like HE & Katie aren't a match.  Anyone know of a NO KILL shelter in DeSoto County?  Please help!
1	dude thanks! im glad you like it  it really means a lot from you.
1	how did you do? how did we do?
0	I dont have 300.  and I have never seen it.
1	happy birthday to your mother!
1	Get 100 followers a day using www.tweeteradder.com Once you add everyone you are on the train or pay vip
1	I hope you do the same
1	I saw it and I was oohing and awwing. I bet your proud-so am I
1	i knew you called me
0	aw bummer  wonder if it will be out at  just about twelve tonight or in the morning
1	I guess there are 'blind' optimists out there too
1	oohhh, maybe he could get posessed by the ghost of an ancient kid or something... hey, weirder things have happened  hehehe
0	did I holler right? lol. I was denied from eharmony years ago.
0	nightmare  Can I help? We offer hosting and would love to chat to see if we can get you up and running?
1	It wasn't me!  Hope you having the time of your life. Hugs from me to ya. Love Kj
1	I honestly cannot wait for your wedding. It's going to be so much fun
1	YUM what do you guys think you're gonna serve?
1	raid 0 with ssd's is total security.. They don't fail! And are even fastr!
0	 that sounds miserable!
1	a bit yep  and stacks of canned stuff
0	blah! when need some kind of Web 2.0 solution to that CBR fog problem!
0	My serious answer is probably equally as unhelpful though
1	the advertisers ...not the 1.6kg
1	Wendy used to work in the Corp web space Customs, she interviewed me a couple of yrs ago, and is real nice  #publicsphere #govloop
1	good to see your blog
0	YES. That one is a nightmare and it is absolutely my most favouritest song from that genre and era.  <3
1	Strange - listening to "No You Girls" just as I'm reading your Tweet
1	good nite.  get home safe. i had fun!
1	I SOOOO CANT WAIT  we better take a photo all together
0	oops, Gina. I missed your tweet. 
0	i update my imac, right? like normal one. then my HDD doesnt work on mac! it doesnt even come up to desktop. what should i do?? 
0	I know where you are but I can't get there
1	How are you going to celebrate
1	almost off of work.....then bak home to my bed.
1	Almost off work!  I have to help a friend set up a new computer then i'm off for the weekend.
0	Almost off!  Then home 2 rela... Oh no... The lawn...
0	Almost on her way home! I wanna take a dip in the pool but i dont have one
1	almost out
0	Almost out of AAA I hate my job
1	almost quitting time. Tim Horton's for breakfast sounds good.  Morning Twitter!
0	Almost ready for school. last day at nimitz!
0	almost ready to depart for my favorite aunt's funeral. kinda sucks I lost my favorite aunt & grandparent first...
0	Almost ready to sell comics. But, I left my giant Diet Coke in the car. 
1	Almost summer!  's album tomorrow! <3
1	Almost the weekend people
1	Almost there
1	almost there!
1	Almost there!  It's been a long ride but I think there's one more hour to go...
1	Almost there, tomorrow it's my last day of school. The year is almost finished and I'm going to the next class. 
1	Almost threw accomplishing my goal for today... Sit by the pool side all day
0	almost time for a ride. Q: will i get it done and stay dry? A: No. cos my shoes are still sopping from yesterday. boo.
0	Almost time for lunch... yay Happy Hot Pockets... sheesh...
1	almost time for me to go get up close & personal with Sarah
0	almost time for me to say bye bye...
0	Almost time for round 3! here we go, so sad its the last one 
1	almost time for VEGAS... i promised some pix... comin soon!!...
0	almost time for work
0	almost time to go back to real life. The family leaves today
0	almost time to go home. Leaving Phoenix in a few hours
0	Almost time to go home... work sux.
1	Almost time to go jogging
1	Almost time to head home!
0	Almost time to head into the site entertainment. Blue/red/orange/green coats - you are all gits. Self important gits. Poor rach is burnt
1	Almost time to roll out.....Korea here I come
1	Almost to 100 followers
1	almost to 30 followers
1	Almost to 500,000 followers guys...  Let's get to 600,000 my fellow tweepers !!  LOL..  Please, just let me have my moment  haha..
1	Almost to cincy to drop off the sod cutter and get some cash
1	Almost to florida. It should be like 2 hours. Georgias trees are so pretty when its sunny.
0	Almost to my parents house in Tn. When i get there i have to do school work!
0	almost to nashville... driving sux lol especially without my ipod cuz it died
0	Almost to the end of Mother 3. I don't want it to ever end.
1	Almost to the show in Zanesville, oh tonite. W/ john Reuben. new hope church. 6 pm. Free! 
0	Almost to work I over slept
0	Almost to work. I didn't wanna leave bed this mornin.. I left jnt home
0	almost tripped  back to treadmilling
0	Almost two fucking months...
0	Almost two years to the day and my MacBook Pro appears to have died. Black screen, won't boot 
0	 I was knocked out I didn't feel good. Did you watch?  :-" you know Stephen is 's type so is that who she gets?
0	)))) idk either and I know Yao and Tracy :|  Yao don't do nothin but foul anyway.
0	Doodie Head...front desk duty awww
0	;( that's too bad, it was a cool race. i did well, 21:15 unofficial. 102nd male, i know because i missed getting a medal by 2 
1	thanks! here's my next. westland, june 13th http://tinyurl.com/nrykmn -- sign up and get erika to as well  ~$24 after fees.
0	ekaa din. when she first had her braces i was like "comfort".
1	hey Tricia  we're having a confe  wanna join us?
1	HEY!!!  really! good for you. I'm stuck inside the house. sick :-& but now recovering
1	 Just going through my tweets hehe
1	I'll admit - I have a cheat sheet.  LOL!  Am also trying to come up with a huge #Chuck follow list to post somewhere
1	Interesting. Of all the things I've read about him, that isn't highlighted much. Layers and layers. 
1	LMAO!  You're on a roll today!
1	Thats so awesome!
1	well, we just don't like those people! Haha 
1	Alexis FTW! YEAH! She's my favourite little girl!!!! <3 and I do like Collin too. He's my favourite little boy.
0	oh my god! i think that the whole group needs a lot of work! we don't stay together i keep going to fastt.  just dance mostly
1	I wish! Airports suck!
1	lol. aside from the Davids, he's my other guilty pleasure. 
1	I love u too Tricia! My girl!  XO
1	Stellar = will get out and cycle. We are on the same page today
0	 no replies yet? )))))
0	diba sabi mo dati im not really jologs?  ...coz we watch dot dot dot )) shuttit! ) plan it? Di ka kasama! Onceamonth...
0	The LAX Club! ))) Don't say that, baka layuan ako   ))
0	i miss kickboxing
1	hahaha oh yes!  he just better hope I don't see him go into the mens room...I might not be able to control myself ;)
1	I did, esp. the DJ Quik & Kurupt track. Will defo listen again 
1	That's good. She's sooocute! My kitty's here purring her happy little heart out  She's such a princess!!!
1	I am SO PUMPED for football season  You a Tampa Bay fan?
0	Any date on the DVD release?!
1	oooh sounds like a fun way to spend the time!
1	Have a good night! enjoy the silence
1	but there again it would make us laugh if you did lol
1	Lol Get him to hold yours eh??? There is a fetish for that sort of thing eh!  lol xx
1	obviously LOL LOL
1	that's her
1	Almost whole week spent on the road. Not much building. Now it's time to dig into the "Appreciation Quotes" section... Thanx for~~~
0	almost work time with no muppy to snorggle
0	Almost!!!! Goodness knows I love money, but I sure don't want 2 go 2 work n the morn 
0	Almost.... Finished...... Decorating,.... My....... Rooooomm.... Shit I'm tired. Got work in 4 hours!!! 
0	Almost?!?! Whoa I cant believe you thought about it and DIDN'T!!!
0	ALO is so sad and quiet and empty tonight
0	Aloe has become my new bestfriend
1	aloe vera, arnica gel, and eye cream applied. gooodnighttt 
1	Aloha & welcome new follower Sch�nes Wochenende
1	Aloha its so nice of you to follow us
1	aloha was okaaaay not the best but still,  a million times better than sadies  thanks to everyone who made it fun!
1	alohas twitters
0	ALONE AGAiN.
0	Alone again. This sucks
0	alone and sad
0	alone and sad...
0	Alone at home...just saw something on tv that made me think about...stuff
0	alone at my house. heard scary sounds
0	Alone in a hotel in boise. Feelin sad bout leaving great friends in WA   ...said mj
0	alone in my house..everybody's gone poor me
0	Alone in the Dark is really pissing me off now, I cannot do this bit, its solid 
0	alone in the house
0	Alone in the office while everyone heads out to Skamania for 3 days. #pdx rental market is making me stick around to hunt for a new place
1	Alone in the pub now       billy no mates
0	alone on friday...    i better not be alone 2morrow... i need a hug... ok dis movie already booorrriiinnnggg
1	Alone time with Baboo
0	Alone today
0	Alone tonight...
0	Alone... Out of school & waiting for edgar
0	alone~ so lone~~ly~~~~~~~~~~~
0	Aloney with my oney
0	Alonso hits the crossbar again, poor guy 
1	Alonso is not leaving  kthanks
0	Aloohaaa ..hehe..im wishing to have a vacation like u in lombok..
0	alot of people think it's a hoax, but cats and kittens are being used as live sharkbait  sad
0	alot of werk to do
0	Alota people hate twitter ..peroo whyyy   Oh well. Gnightttt :-D*
1	Alpha Dog was good
1	alphabet pony by the kills  LOL
1	Alphabetically speaking, you're ok! 
1	Alpha-version of client released, you know where to get it 
1	alphonso milkshake in the morning, lassi in the afternoon and fresh nimbupaani in the evening....summers can be fun 
0	Already 365 pages into Eclipse .... sadly over half way through the book
0	Already a bit tired and have night shift coming up later
0	already a crazy day the park.... ouch
1	Already at bali
0	Already back in Dallas...
0	Already broke 2 pairs of sunglasses this week
0	Already coming home!!!!!!
0	Already daydreaming of my bed  ...TODAY WILL FLY BY.
1	and alright for sure no lagging from any of us tho
0	 other than that, how are you doin?
0	I dont know what ur talking about...I apologize
0	I'm skurrrrred.  Will you hold my hand and take me? lol jk Ughhh I feel your pain.
1	so whats up?
1	cool  �hm i'm just doing my homework x______X..nd i'm listening to McFLY ;)
0	Twitter, if you think about it, is a LiveJournal in a way. You just don't have to write your life's story! Which sucks.. 
1	http://www.doomsdaytube.com/ just so you know
1	thought one of my followers from Widnes would correct me if needed  Wikipedia has it right too you'll be glad to hear
1	haha  see its makes your brain work
1	yes I am, sorry I just ate something =D call meee 
1	no! I love my cards too much
0	YES YOU DID. WUT HAPPENED.
0	Relationship issues....
0	Cool... She isn't now though.
1	 hehe. im ok  kinda feel weird. tummy hurts and im a little scared. going to the dentist 2morrow (weissheitszahnOP)
1	can you tell me what city you exactly live in?  not only where it is near to lol
1	that school wouldnt suck all the time
1	wow, I'm only in 40 now. 
1	m in d car on ma way to d hill station matheran.....
0	IM SAVING AND I HATE IT. i want a new camera though. but i want the dd stuff aswell.  fml
0	i cant stop thinking of bonnaroo either
1	It's all good  I still love ya lol Thanks for the support
0	Haha No problem! ;) All jobs are taken tho hun!  Its only for 3 months tho! But at least Ive got something to do now! x
0	haha the gigs sold out
0	but mom said I'm going to auditions anyway. Stupid that you have to have a note to go BACK to school with mono
0	damn!! I was hopin u were gonna persuade me to get out.. I better get heating that milk up!!
0	really?? yeah i have no idea why!! i want it to stop lol
1	Haha yeah  Maybe on of or parents could give us a ride.
0	Yeah I think so...
1	then maybe we don't have to go to school  we can just go to the post office.
0	are you mad at me
0	hahha my mom got on to me cus I was on a kids bike. I told her I wanted a bike and she said no
0	yea it is but I didn't have that  ummm I'm sorry red bulls are better.
1	it made for an enjoyable read. Yeah kettle corn is great but chocolate is my own personal heroine.   Have a great day.
0	-No "real" boyfriends, and no girlfriends. All of my relationships fail. 
1	-Yeah, really.  Sorry, I didn't mean to worry you.
0	  is it good so far?!
0	I didn't get a chance to talk to many people actually. Then I got kicked out for no good reason
0	too busy guessing what you would blip next. Naaa, I have ME/CFS so sometimes have weird sleeping (or not) patterns 
1	Yeh Yeh Nic, dont blame your incontinence on Big Brother!!! hee hee  Get that Tena Lady Bumper Kit on! MWAH xxx
1	You too Tricky  xx
1	That's how I roll
1	Good luck mang
1	thanking for adding
1	�'m plannong on going there tomorrow morning! If that guy doesn't have it, no one has  Tried the curry masala there?
0	 That's no good.
0	Fuck the lack of lupus
0	All those post-it notes, all those dead trees 
1	Hmmm...color me curious.
0	So sorry to hear about yr journalist frnd.Am in same situation  tho' yr friend prob diff from mine.May've sent msg 2 yr frnd
1	Sounds like a plan- My curiousity just has to see this! Ridiculous. I'll punch around 2!
1	True, but I can be very annoying...I mean persuasive.  
0	Why are you bummed?
0	I moved on what felt like the hottest day on record - it was awful!  Sounds like you need to buy some pledge!
0	Aw hope all is well though. Oh my, it made me sad that they lost too.  They were doing soo good there!! How's the business?
0	it's like when i click "find match" on shoddy, switch to IRC, then deplete my timer 
0	You're absolutely correct! So why do some still have the opportunity to speak freely when they clearly don't deserve it?
0	I wish I could use those. But because MRSA likes to make its home in my nostrils through my skin, I can't. 
0	I hate drawers.
0	I would sooo love to do that, sadly I think my dad would kill me though 
0	no, but I should have - whites were sold out. 
1	All I had to do was mention that a few members of the SAA were going and he was encouraging me to go too.  I love him.
1	"Your musical compatibility with Smmithyyy is Low" .  Ah well, I added you anyway 
1	Perfect revising weather. Not.
1	well, I am glad somebody thinks this f-bomb droppin' no coffee havin' this am, tired of trailer park tweekers is funny!!! 
1	I've been at the daily iphone photo thing for over 100 days. It gets very easy if you stick at it. Don't worry about text.
0	that's so sad
1	ask for one in your next review
1	i'm gonna check them out some time.
1	I bet we do! I think you know why I'm happy
0	Happy belated birthday. Was out of office and on the road, so I missed it. 
1	wow, I am accidentally perceptive! hahah authentic and abundant living is true happiness or constant work towards true happiness 
1	looks like youre making good use of your new dslr!  congrats again on graduating! =D
0	Perfect to begin ANOTHER day of work
1	already done work for the day  i guess i should try to find a couple more early clients to make getting up so early payoff better. hmmm
1	already forget yes !!!!!!!
0	Already getting Twitter spam.
0	Already gone through my  work stuff and bored
0	Already got a papercut.
0	Already got up  It's #music time! Wes Montgomery - Mo�a Flor playing now. Good morning, jazz!
0	Already half way through my book. Don't wanna read too much of it or else I'll have nothing to read
0	Already have a gaming backlog in the dozens. Trying to resist urge to purchase Ghostbusters on Steam.
0	already home...
0	Already into disc two of EVERYBODY LOVES RAYMOND season 3.. Yep.. This is how I'm spending my summer..
0	already it's 2:00 am  i am going to bed. need to have a good sleep because i should drive 5 hours tomorrow.
0	already june huh...  half the year is gone.
1	already knows 3 dishes: Torta, Hotdog, & Itlog. Hurrah for me! 
0	Already last call?. Fucking Connecticut. Party was just getting started.
1	Already looking foreward to the weekend
0	Already looking forward to Chelsea Chelsea Bang Bang, yet have to wait until next March 
1	Already looking forward to the extended weekend, nothing like Summertime in Northern Michigan 
1	already looking forward to the return of the on #BBCRadio6 Monday - give it a try
0	already lost important keys
1	already made a friend.  but forgot her name...
0	Already miss
1	already miss besties
0	already missed her China tweeples
0	already misses debate
0	Already misses the Dunhams.
0	Already missing and
0	already missing  wish you were comin with me, df <3
0	already missing Harry and Lincy
0	Already missing home  I'll tough it, though. 10 more days... Goodnight! <3
0	Already missing husband, he's in DC until Sat  glad I have help though
0	Already missing May's flavor of the month, orange dream, from eegee's 
0	already missing michigan  <3 you guys.
0	Already missing my boyfriend!  This is going to be a tough summer!
0	Already missing my man
0	Already missing Pushing Daisies. Watching the musical numbers on youtube.
0	already missing yall!!  ... but still keepin' hope.....anyway cannot wait this Friday!!! soo excited !!!
0	Already more than 24hrs of FLU
1	Already new here  Ashley and Miley are also coming (: - Perfect day, only tireeeed.
0	Already off work and drinking a beer! Wait no I'm not
0	Already raining at the concert.
0	Already raining prob no softball tn
0	Already removed from the cache
1	Already replaced a broken networkswitch and printed last weeks invoices. Looking forward to reading my weekend newspaper with a coffee
0	Already six months since I tweeted last time?
1	already started to pack nice floral dresses, flip flops, mini skirts, bikinis 
1	Already starting to "look smaller" according to Alan. That's why he's my homie!!
1	ooh yay, glad you liked it! 
0	I wish.  any closer with saving for yours?
0	no kidding. i want joe back.
1	Metric is one of my all time favorite bands!
1	oh yes, and i really dont care where as long as it's not here 
0	we want to see pics of the new Commack Deli! I still think he should have called it Georgie's
1	ooh close, was a tiger! my impression must be improving then 
1	text me!! Why don't you me and Emma hit the beach!
0	that sucks hon  but yeah, paying $150 to get a cavity filled is way better than the few hundred a root canal costs
0	lol i know i wld like to get a reply from seann william scott but he dont reply  and hes one of my favourite actors
1	lmao xD!! your an amazing friend to ! sooo whats up?
1	lol, I had ice-cream, how hardcore are we?! 
0	Sadly, I have a passionate hatred for dance music 
0	good to know im not the only one who has it anymore!
1	I love you 2  and Ur more awesome. And i'm already missing you. What if Mr. Garland release a single when you're not here?
0	i'm already missing you  one week without my little bitch... that's gonna be horrible...
0	aww why's it been cancelled??
0	yeah i will if i keep putting the key terminology in!!! haa that's all he goes on about. i have had killerrr hayfever today
0	me too, kindaa 
1	yeah its gonna be
0	ugh, don't talk about food.  I'm so hungry and my mom was like "figure it out" and I was like "yes, with my imaginary car" xD
1	when u read this, be ready to leave random posts again 
0	Hahahah Ahhkk We will Lol . . .Wish U wer Cumin Too Do Lol Sry  . .I Wonder If We'll Find Our Way :O Hahahah
1	thanx qirl !
1	Yeah Stealing my Faces they are like totally copy written.  White chocolate is so the best especially with oreos in em..
0	help me out, c'mon, our sis is saadd 
0	wow sorry 2 hear that ma  I'm at werk tambien! I was debatin on whether 2 call u last night to sayy HII! Pero I didn't!
0	haha its ok about last night i understand, but what where you doing??? and today has gone really fast 
1	i don't really know where that come from it just happened
1	i was going to be but then i went to HMV sorry, it went ok not the best but ok and im fine today thanks 
1	mabrooook! can't wait to find out what it is
1	Me, I'm a fan from Scotland! 
1	hey serra! i miss you. what's up? is everything okay? uhm. just text me if you need someone to talk to.
1	me too  but i love the sims 2 and i heard the sims 3 is sliiiiiiick and i LOVE video games of any sort :]
1	http://twitpic.com/6qivs - Your way too lucky!    aww!  was he nice in person? x
0	I wish I were SOMEBODY'S boss.. not that much responsibility yet
0	Damn you are going through it.
1	I'm jus saying....we are OutHere....
1	Omm! We grew up on those!  i love don knotts!
1	hhahahahah yea - well any steps mom takes to gaming is awesome  I am proud that she tries and has fun now
0	whats in new york in november (besides you!) cant remember if youve told me already! shame we're not there the same time
1	LOL! You love it!
1	lol oh ok.. im at home  felt like being home for a change lol
1	use the BIG brush with your brain bleach!  HAVE FUN TONIGHT!!
1	and wht subject r we on? I said a few things
0	LOL, awwwh, yes u do! And u on my faves list!  See, I knew I'd forget people  It's too many of ya'll now...
0	Hi, Marek. Good to meet you. I like trilobites, too, and have personally collected marine fossils from New Jersey; no TBs 
1	Welcome home! We're happy to have you.
1	and then rammstein would be in trending topics instead of Jay-Z - I wouldn't mind that!  lmao http://twurl.nl/g3dz3t
1	hi mate, yes well settled now, dogs lovin the new strolls and walks, me too  u ok?
1	my Custom URL doesn't work. is it my fault or is there something fishy on your side? ;) see my email to support@tr.im. THX!
1	What did you eat? Did those two pesky kids chew on your house again? I for one see being eaten as appropriate punishment
1	hey gurl, I'm following per Amber 
1	OMG! I'm also having one right now  Hi!  Haha.
1	Thank you for the #followfriday
1	thats what i was shooting for with the image.
0	I did it the hard way    looked at who I followed then clicked on everyone individually.  then hit "remove"
1	Not yet, you still have 2 hour and 25 minutes 
0	and so u know the weather isn't the best in our city right now  hopefully it will clear up later
1	but then again I'd be offened if you didn't shake mine. When I'm like your biggest fan.
1	LOVE YOU TRINA!!! OMG ur the BADDEST B  CANT WAIT FOR YOUR NEW ALBUM. YOU INSPIRE ME!!!!!!
1	Watching JR Swexy Smith closely tonight  Nugget fans unite
1	Gnight Ms. Trina! Soooo glad to know you're a bball fan! That's awesome! Rock on Diamond Princess!
1	I like to confuse people   I also added myself to wefollow (as a dad)
1	 Children should be seen and not herded... but I know what you mean, with just one school aged kid!
1	and a very good morning.
1	I was with you until the lycra and gym bit
0	that's no good
0	Well yeah. But my hands have been fused together, rendering the keys more than useless. The key is literally in my pocket 
1	it was soo amusing! i'm tempted to watch it again!    haha! Which is your favourite JoBro though? haha!    x
0	me lmao weird, nick was just quiet :L then me and kevin went in my garden and played with my dog haha wish it was real 
1	omg im so excited haha =D yay
1	shut up stebo, i dont care if im sad  xx
0	awwww what's wrong babe?
0	LOL!! I used to have all the "Too Hot For TV" VHS tapes...yeah they werent hot at all  LOL
1	ok that one cracked me up
1	what drink you getting?  I love the white chocolate mocha   listen to any birds singing lately?
1	Yankees are going down once more, the Evil Empire will not rise this year 
1	Yankees up 10-3 going into the bottom of the 9th...I think it's safe to say we won this game!
1	I know you really skipped cause you knew I wasn't going to be there. (@Brock_Langdon doesn't appreciate my sarcasm.
1	I thought it would!!
0	no, i'm not! 
1	- Hi K   - People are way more complicated - Computers alway function in a logical fashion, even when they break! 
0	- No She Isnt! - Say it Isn't So!  - Gretta Is an awesome Name!!! Peaches??? WTF???
0	- Right now I'm just plain Scott Tomson!
1	Awwww! Bye xybil! Had a fun time tweeting with ya!
1	I'll play L4D with you as soon as I get home  and where have you been? gah
0	why would you need pdanet if you can use your 3G tether. As for me, it looks like my EDGE tethering is screwed and gone then 
1	can't wait talking to you again.  and i hope you'll find your leed. I wanna see those pictures of you and really bad.
0	I miss you.
0	Sigh. And people wonder why I don't particularly care for LA.
0	Bad times for everyone  Whywhywhy do we have to write essays  No fair!
0	Okay I'm trying, she's not giving in though. 
1	my Twitter profile only worth $5, still have a long way to go 
1	The book?!  I am very proud of u Y
1	since when you play? Lol.
0	Urgh, they're trying to turn it into Britain's got talent I swear 
1	wedding dress?
0	That's cruel   Thought you were dead-set on Gencon over #BlogIndiana
1	Yeah, we are. http://tinyurl.com/d5woc7 
0	 I hope you get better soon
0	Meanie. Of course I would love some. Please
0	So many tears...Why oh why?
0	That's good. So you went crazy without twitter?
1	You posted a one-word thread. And we were saying yesterday 140 is not enough
1	Security is our BFF and until wire transfers can play nice in the security sandbox they are grounded. (via I <3 ING
1	you went to college here? Didn't know that
1	Yes you are an official "tweeter"  now you stalk me and I'll stalk you!
1	Lucky us  The ones by the windows are suffering right now.
1	Grattis med snart 1000 followers!!  Any luck with the Ellen show?
1	Just relax and emancipate... Time will kill your superego... Hezky den!
