1	I didn't smoke by tha way� lol
0	I didn't speed my video up you twats.
0	I didn't take a nap today.  Hahaha.
0	i didn't take any this time.well actually there wasn't much of a storm.just a rain cloud.didn't last long
1	i didnt thnk anythng could cheer me up but someone just did
1	I didn't tweet a lot of time ^^" miss yooou
1	I didn't understand how twitter works so ... hope to discover it soon!!
1	I didn't vote for David Ortiz a.k.a. Big Crappi to get into the Home Run Hitting contest...I didn't want to see someone strike out in it
1	i didnt walk myself, but fiance and family did. congratulations go to them as weather was sooooo bad 
0	I didn't wanna wake up from my bed  but I must read this fucking book!
0	i didn't want cairon to go
0	I didn't want Ed to leave  WES NEEDS TO GO HOME UGH!
0	I didnt want Laverne to die. This is honestly upsetting.
0	I didn't want the night to end.
0	I didn't want to spend $1100 on my car today.
1	I didn't want to vomit but....I won't use barley..Ill use rice when I make it.  The chef told me to use brown rice. I'm gonna use white.
0	I didn't want you to leave. Starting the countdown all over again.
0	i didn't watch aaron stone yet.  is it good?
0	I didnt watch it tonight  I forgot
0	I didn't win  I only won 140
1	I didn't win anything in poker, but definitely had a fun time. 
0	I didn't win at Demi's contest  That contest was my only chance to meet Demi  I can't do anything now  I never can meet her (
1	I didn't win but I didn't lose though. Drinking time!
0	I didn't win Chicago Idol.    I'll be waiting in line with the other 10,000 people on Saturday.
0	I didn't win tha beat batttle.  dis dude from cali took tha 1st place... I'm good tho! OPENED A LOT OF DOORS!
1	I didn't win the jet ski yesterday but I was THIS close!!!! It was fun!
0	i didn't win the marlins tickets that 790 was giving out
0	i didn't win. i thought my entry was good  oh well....i'm seeing donnie today. every cloud has a silver lining!
0	i didnt win...
0	i didnt wrte that last post ok...but otherwise..im still procrastinating on this paper...uggh...i dont think i'll ever get it done..
0	I did't make it  Oh well, I'll still give u praises Lord!!!
0	I digests ... difficult ...
0	i dinny want to go drawing by myself
0	I dint feel good my throat is a lil sore
0	I disagree.  http://bit.ly/mWlWx
0	I disconnect from Twitter    to make one for my older sister
1	I discovered another relatively quiet area to sit in uni
0	I dislike cooking greatly
0	I dislike it when security gaurds talk to me about their cats and energy efficiency air conditioners.
0	i dislike last minute notice or call or sms or whatever which forces me to reschedule my plan.
0	I dislike Microsoft products more and more every day
0	I dislike Mondays
0	I dislike nathan  Rachael got hit with a hockey ball in Pe today hahahahahaha.. suck a dick bitch
0	I dislike rainy days
0	I dislike the neighbor kids. I'm not nice either. I just realized though that they probably think I'm like the old man in Monster House.
0	I dislike typos  (Now watching Cristina's Court )
0	i dislike when my hair is frizzy
0	I dispise being sick. I was soo good at being unable to get anything for the past year.
1	I distracted my cousin, dunno he's playing Pet Society pala.. Sory toby, ate loves you! mwaaaahhh! 
1	I ditched girls night for a night by myself... too tired!  At least I still have a bottle of wine!
0	i ditched school ( i hate it ) and im taking a huge dump.......    it hurts REAL BAD!
1	I ditched summer school with Katlyn. Don't tell.
1	I ditched twitterfon for twitteriffic
0	i djust dont get it john!! its like facebook status without pictures!!
0	I dnt feel good! Fuck the whole Buffalo scene 2night! I'm goin 2 bed.
0	I dnt feel good...
0	I dnt get to go play lasertag w/ my besties!     *old me's dead and gone*
0	I dnt have any PTO tho,  and wont have any for a long time so IM SCREWED!!!!!! 
0	I dnt knw why, but I'm pretty pessimist bout 2day 
0	I dnt like it whn ur sad, it makes me sad too 
0	i dnt like the fact iphones die quick  buhh then again i do keep playin around with it
0	I dnt think this is a happy birthday fa my baby Melo  lol oh well , I'm ready to see this Lakers/Cavs match-up!!
0	I dnt waaaaanna wake up  I'm still sleepy! Grrr to ariel and raina lol
0	i dnt wanna give away my dog!  i love her
1	i dnt wnt u to hate me, i wnt u to wanna hate me. i dnt wnt u to date me, i wnt u to wanna date me <-- totallyyy my song 
0	I do 1 day of real work and now my hips sore as hell. I feel like an old man
1	I do agree
0	i do and don't want summer. i wnt it bcuz well, NO SKOOL!!but then i don't get to see my friends a lot 
1	I do appreciate Dell's customer service using their real names however
0	i do believe hates me for some reason now. She keeps ignoring me
1	I do believe I have smoked-glittered-cat-eyes.
1	I do believe I just knocked the socks off that casting director. I've got the "rocked audition" high going on now
1	I do believe my teaching certificate came today.
0	I do believe that my fingers are far too skinny to be able to play my ukulele.  *sniffle*  I guess that's what I get for being a pianist.
0	I do everything again  rendering, uploading... ugh
0	I do feel bad for my other 2 dogs. They just get dog food.  I guess there are some benefits to being sick???
0	I do feel bad for the nice people there though, just not whover it was that said we were out of line 
0	I do hate exams  x
0	i DO hate to think that some kid might get up 2morrow looking for their kitten and they won't find it
0	I do hate work  really wanna get home early then head to holy
0	I do hate work  really wanna get home early then head to holytown then work at 6 tomorow morning  but its all good ;-)
0	I do have health issues afterall
0	I do have to brave West Quay today  need a new power lead for the MacBook.
0	I do have to say, it is way better today than yesterday except for the shot clinic. Poor lil 4 year olds getting their shots today. 
0	i do indeed have tonsillitis. the only good thing: ive been advised to eat lots of ice cream. [but no solid foods  & im bed ridden.]
0	i do know and understand
1	I do like a good wedding rehearsal
1	I do like a wet grand prix. Well done vettel
0	I do like the carrot to get people to join the PPA and I have to mail a entry since I'm already a member
1	i do like tim tams there like cookie and chocolate in 1!!!  yeaaa
1	I DO love a 3 day weekend! And here's a brand new Feel Up podcast mix from Fabien to get you in the mood... http://feelup.podomatic.com/
1	i do love my kenwood food processor. in a minute ive chopped loooooads of greens. and now to figure out what proteins to buy.
0	i do love u &&& i'll neva hurt u.. mentally, physically, or emotionally BUT i'll neva b a boy so i have 2 let u go 
0	I do miss regularly sewing buffy each week on tv. Was a great show. And great eye candy. The series fanalie sucked though I felt
0	I do much prefer Procedural Programming Languages as opposed to Object Oritentated Languages
0	I do my best. Why didn't she tell me before now that that isn't good enough?
0	i do my homework now
0	I do not appreciate rain, thunder & lightening storms at 6:15am which make my house shake 
0	I do not appreciate the black widow spider I just found on the chair outside.
1	I do not enjoy humidity. Phone will be off all day. Don't miss me as much as i'll miss you guys. Jesus loves you!
0	I do not enjoy not being able to breathe out of my nose while laying in bed
0	i do not enjoy sleeping alone
0	I do not feel good
0	I do not feel good  Here is to hoping work goes by quickly.
0	I do not feel good right now
0	I do not feel like being at work today.
0	I do not feel like going to this meeting.
0	I do not feel so well
0	i do not has big boobies  http://tumblr.com/xyx1xccyq
0	i do not have a boyfriend eney more he does not like me but i am ok we r just friends now but i am still sad
1	I do not hook up-kelly clarkson
0	I do not know how I am going to make it through another shift without a nap  Im already so tired..... is this the moment I start crying?
0	I do NOT know how to freelance.
0	i do not know what to do tonight  i am currently so so bored!
0	i do not know what to do with myself.
0	I do not like Firefox 3.5 Beta 4. I hope that the actual release changes a bit... that tab icon reminds me of Internet Explorer. Dnw.
0	i do not like having to plan clothing for the rain  especially coz most of my rainy stuff is in edbur
0	I do not like mean people. Feeling a bit beat up this morning.
0	i do not like my cooking. food taste much better when someone else makes it for me
0	I do not like robin williams.
0	i do NOT like school at all.... i just wanna go home. friday needs to come nowwwww.
0	i do not like the Cone of Shame   !
0	I do not like the Cone of Shame.
0	I do not like to take pictures while I sleep
0	I do not mind very aggressive these days and my relative passivity not lead me anywhere.
1	i do not need a boyfriend  i'm better off alone
1	I do not now nor ever will, trust the structural integrity of roller coasters, hence i will not ride them. 
0	I do not see any sleeping in my near future.
0	I do not seem to be able to sleep past 9  O'clock any longer! Not good when you fall asleep at 5 in the morning
0	I do not understand my statistics assignment due tomorrow..  what is the significance to all of this! Bah damng math! ! ! !
0	i do not wanna get outta bed! But i gotta go to the DMV and wait in that never ending line
0	i do not wanna have my tonsils out
0	I do not want to be at work right now.
0	I do NOT want to be awake right now. And starbucks is on the wrong side of town
0	I do NOT want to be here.
0	I do not want to buy a new car  I has the cheaps...
0	i do NOT want to go back and work now
0	I do not want to go back to work tomorrow
0	i do not want to go home  at least i get to see the jonai in 5 days =]
0	I do not want to go out
0	i do not want to go to math revision on my birthday
0	I do not want to leave my house with this rain!!  Possibly going to stay home all day and get work done here. This weather is depressing
0	I DO not want to work tomorrow
0	i do nothing
0	I do nothing tonight  ...
1	I do oral so wat get over yeesh
0	I do the same thing to my parents and my best friend too
0	I do the test and now I am relaxing but on Friday I have other test
0	I do this particular patient every day, & it gets harder everytime, bcuz we always have a fun time & I see her getting worst every day 
1	i do too  but your kitty better not bully timmy..cause he's just a wittle guy
1	I do too talk to you! hi  mister MIA...
0	I do wish that she wasn't mad at me... ugh.
0	I do, but I need a wee again 
0	I do.... ahooooo  lol jk jk what its trailers before the movie they all awesome!!!!
1	i doing too many things at once, thats what im doing 
1	I don`t Like the futbol but ARGENTINA win
0	I DON`T WANNA GO BACK TO SCHOOL TOMORROW  gettin ready then movies w. Kev!
1	i don´t have homework to do. i´m free hahaha
0	I don´t want to school... I´will fail maths
0	I don’t like conditioners, because I always get a cold from them.  
0	I don’t want to go to school!!  http://tumblr.com/xqp23vl2k
0	I donated sperm this afternoon and it really made me think about my own mortality. Poor little buggers are probably frozen now.
0	i done a whoops, killed 2 django sites because i dont know anything about them  a little help someone?
0	I done missed Wezzy on my B-day...if this aint some shit !!!  , so you couldn't have put him on the flier though?
0	i done video chatting no one wanted to join  haha
0	I don�t feel very well
1	I don�t have school tomorrow, and that makes me very happy! 
0	I don�t know what I can do. My friends aren�t can meet me.
0	i don�t know what i�ll do later
0	I don't  mean to sound like a tool, but fuck scheduled maintenance!  I wanted to play my druid before work. 
0	I don't appreciate my twitter ID being used to promote spam!!!!!!!!
1	i don't believe - , cinema bizarre is my favourite band *-* i love them. they're the best 
1	I don't believe in horoscope's but they are fun to read.
0	I don't believe it, 36 seconds  The shade on the pitch is crap, it's high summer and the pitch is in darkness.
0	I dont believe it.  My boss is away for another month... So that's another month of sitting on my arse!
1	I don't believe it. My cousin who keeps teasing me is actually having a serious talk with me! Haha  Maybe he's changed over the summer
0	I don't believe there's anything worse than losing a best friend
1	I don't care about netsexor cams or the route to heaven, however, #lobster sounds super good.  I'm almost tempted to go get some. 
0	I don't care about this stupid girl..i love someone else but maybe tomorrow is the last day when I can see him that's awful
1	I don't care if I did discover it 17 minutes late, I'm totally recording it. 
1	I don't care if other parents let their kids do things..I swear, most teens can talk parents into anything these days....I'm just so mean 
0	I don't care if she want's me or not, I'm still feeling the effects of her love. I'm still in love with her...  
0	i dont care that its only 1am im going to bed :/ (i do care really  i wanna stay up)
1	I don't celebrate "Mother's Day" much all. BUT Happy Mother's Day to all the mothers out there. Greatest job in the world!!!
1	''I don't come and bite YOUR beard!''
0	i dont do anything important. i shouldnt have a twitter.
1	i don't do drugs btw..just so you know. god, that reply went all wrong nerimon, haha sorry! 
0	I don't do play for a while
1	I don't do things for people cause I have a motive.....I do it cause I love ya! I'm told I'm one of a kind !
1	I DON'T drive too fast! Lol ppl r weird. Guess am not gonna work netime soon... Sigh
0	I don't either he was another foreclosure...so sad
0	I don't enjoy finance work on the weekend. I feel like I just can't catch up with life sometimes. I'm not my ma in law's b-day party.
0	I dont even care about the main event anymore cuz my boy Andrei got destroyed he cant take a hit
1	i don't even care if i'm in trouble. i had a badass night.  summer 09', you're the shit.
0	I dont even count
0	i dont even feel like eating today  i dont think im gonna eat and oops i just realized i twitted instead of FAIL.
0	I don't even feel like I slept, but yet I did!  I'm still so exhausted!  Boo.    #BSB
0	i dont even feel like reaching for the remote what am i goin to do
0	i dont even get free food
0	I don't even get why 60 people are following meh... I'm not that cool.
0	i don't even have anyone to crush on
0	I don't even have health insurance. Which sucks. Because my arm pain could be a serious health issue and I dunno what to do.
0	I don't even know anymore!
0	i dont even know how i feel
0	I don't even know how to add a profile picture!!!! I feel so out of touch
0	I don't even know really how to use this silly thing. . . frustrating!!
0	I don't even know what bag claim. Ughhhhh I was in such a hurry.
0	I don't even know what to do...
0	i don't even know what's going on, mayyyybe with taylor? today sucked 
0	i dont even know why im doing this for  http://bit.ly/JugcH
0	I don't even like soccer but yeah  I feel bad that Mexico lost vs  el salvador!
0	i dont even think i have close friends over there
0	I don't even want to go to work tomorrow- i might be in trouble
0	I dont even want to know and it happened to me  -Chad
0	I don't even want to talk about it
0	I dont ever want to leave this school. I dont know what im going to do without all of you guys
1	I don't ever want to miss, being with you like this. 
0	I don't feeeel good  I wanna go home.
0	i don't feeeel good. :/ my head hurts. and i have too much homework to do.  schools no fun. :p hehe
0	I don't feeeel gooood. Ugh  I'm about to watch some YouTube videos to make me laugh. HE IS FUNNYYYYY
0	i don't feel any slight of happiness eventhough i'm turning 19 tomorrow
0	I don't feel awake and I'm awfully tired
0	I dont feel complete with you here
0	I don't feel cute today...
0	I don't feel fa-bu today  http://myloc.me/5xXg
0	I dont feel good  cleaning up the house, doing some laundry, and relaxing. Hopefully I'll get some sleep!
0	I dont feel good  hopefully i can sleep. Goodnight.
0	i don't feel good  i think i'm going to taking a warm bath.
0	I don't feel good  Make me feel better please ?
0	I don't feel good  taking a nap.
0	I don't feel good  text me I guess.
0	I don't feel good  watching mom get her haircut. Me next.
0	I dont feel good and i dont want to go tomorrow.
0	I don't feel good at all!!!...smh
0	I don't feel good at all. I hate thunderstorm ((I'm a big ol baby)) and my allergies are kicking my butt
0	I don't feel good at all...
0	i dont feel good at all..my stomach is killing me..
0	I dont feel good guys   my side hurts
0	I dont feel good so i lay in bed trying to go to sleep but i cant  i just wanna feel better!
0	i dont feel good! sick to my stomach
0	I don't feel good.  .My throat hurts!!!!
0	I don't feel good.  going to bed...gotta be up in 5 hours!
1	I dont feel good. I want to go out tonite
1	i don't feel good. laying down watching disney channel
0	i don't feel good..
0	I don't feel good...
0	I don't feel good..frustrated
0	I dont feel great  =(  my legs really ache, my sunburn is still really sore, im very tired, and im starting to feel a bit sick  
0	I dont feel like doing anymore studying for my two finals  *11 hours*...>O<
0	I don't feel like doing anything.
0	I dont feel like doing anything. Let alone working.
0	I don't feel like doing hw.... It's Ickyyyy!  On the bright side, I finally learn My Heart! Yaya!
0	I don't feel like eating and I haven't eaten since this morning
0	I don't feel like going home right now, but i miss my mom 
0	I don't feel like going out anymore!  I'm just not in the mood!
0	I don't feel like going to back to church tonight.  If I do then I'll have to leave early to catch the MTV Movie Awards!!
0	I don't feel like going to school anymore..
0	I don't feel like going to school this morning
0	i don't feel like i did all too well on my test today
0	i don't feel like i should be awake. bro is doing much better. wish i was home.
0	I don't feel like making a post today..
0	I don't feel like reading anymore  I hate finals.
0	I don't feel like sleeping again!
0	I dont feel like studying. My parents pissed me off.
0	i don't feel like tweeting anymore.
0	I don't feel like twittering this morning, I'm still very sick 
0	I dont feel like waiting
0	I don't feel like watching Tayong Dalawa later ( Ingrid's going to lock Audrey in a closet  > (
0	i don't feel like working tmw  <3
0	i don't feel OK  today i`m tired and sick that really suck
0	I don't feel so good  So...sleepy....
0	I dont feel so good and have to work all day  a certain someone didnt get back to me
0	I don't feel so good, I feel dizzy and weak... 
0	i dont feel so good. i think i got strep throat and a massive headache. i think northside's water got me sick
0	i dont feel so great, i think im getting sick 
0	I don't feel so hot right now  I hope I didn't catch a stomach bug tonight... That'd be my luck! Ughhhh!!! Bedtime for me
0	I don't feel so well.
0	I don't feel sorry for Jon & Kate--it's the eight that I worry about. Poor kids!
0	I don't feel special at all... That's all I have to say  i thought I was the only person you said sweet things to.
0	i dont feel to good  ... hmm sadly single. its all about the choices you make and you shouldve made better ones.
0	i dont feel too good
0	I don't feel too good
0	i dont feel very good
0	i don't feel very good
0	I don't feel very good today...
