1	Dont Forget to check out my Online Avon Site at http://www.youravon.com/krystalmoore   Any and all orders will be greatly apperiated.
1	Don't forget to hug your mamas today!! Heading to jerz to see mine
1	Don't forget to pick up Smallville season 8 DVD set August 25th!!!
1	dont forget to pick up three cd's today! Emerson Drive, Rascal Flatts and Jason Aldean 
1	Don't forget to tell GOD Thank you for all that he's done for you! Take time out now to tell him Thank You with a sincere heart!
1	Don't forget to unsubscribe to fred!
1	Don't forget to vote for for Ms Twitter.   http://bit.ly/17qOiK
1	Don't forget to watch the MTV Movie Awards!  New Moon trailer!
1	Don't forget with the start of each month there is also a new SCENT of the month! June's is "Coconut Palm" perfect summer scent
1	Don't forget, Thursday is International Hug A Musician Day! 
1	Don't forget:  Conan O'Brien tonight!
1	Don't forgot to check my blog out. Www.aidenashblogspot.com
0	Don't get gassed! Alcohol will only make you feel worse. I miss her soooo much and I don't know what to do to stop hurting
1	Don't get Mad, and be Happy forever 
0	Don't get me wrong I love the News-Leader and Momslikeme.com but they lost my W-9 and payment information. No check for me yet!
1	Don't get me wrong, I like Harry Potter, but I need a fantasy movie of a different kind every once in a while.
1	Dont get me wrong. Im ecstatic that u guys have decided to join twitter, it's been so much more fun! im just gonna have 2 get used 2 it. 
0	dont get this twitter thing
0	dont get too close or you will get hurt and i do get hurt, really bad 
1	Don't get your dad another tie this Father's Day! Let us help  http://bit.ly/MEqgk
0	Dont go for ballet today.
1	Don't go see ghost of girlfriend past  Not good
0	dont go... im sorry for disappointing you
0	don't goooooooo...don't GOOOOOOOOOOOOO...it's already over, now  JSR
1	Don't hate me because I am sane and executing my first and second amendment rights.  Find another reason--I'm plenty flawed!
1	Don't hate me, I'm back 
1	don't hate me...but i love the rain!!!!!!!!
0	dont have a clue how to use this  :| x
0	don't have cable so I cant watch the MTV Movie Awards.  PISSED!
0	Don't have desirable # of followers anymore.  Now I have to find a song called 43
0	Don't have my ipod
0	dont have my phone right now
0	Don't have the Will power to finish hour two of my work out
0	Don't have to work my usual Saturday double today, so I an enjoying a peaceful morning with the children. Still have to work late tonight 
0	dont have to work tomorrow. who wants to party? ehh its ok if you don't i understand
0	don't have to work. cleaning
0	Don't help that I smacked the shit outta my head jumping into bed though!! Fack, got a bump forming. 
0	Don't hv any idea how to play YOUTUBE on my berry device,keep Loading,but nothin happen,its kinda weird  anyone know? Helppp me (
1	Don't just see the change... Be a part of that change !!!!  cool
1	Dont know about it but tryin something different. I know what didnt work in the past. (im shocked...people are following me  )
0	Don't know about ya'll but as much as there is good, great programming on HBO, I miss the hell out of The Wire. They shoulda kept going 
1	Don't know about you all, but I NEED some coffee 
0	Don't know adsene is not accepting me to be their publisher
1	don't know but I think I'm in a good mood right now.. been following all my new followers..  though I might unfollow some.. nah nevermind.
0	Don't know how but I deleted my first ever Twitter updates. Ughh...what were they? Somethin' from Apr24 about takin' Rusty out for a look
0	Don't know how I'm going to say goodbye.
0	don't know how i'm suppose to be..  breaks my heart
1	Dont know how this twitter works... argh! Invite me on facebook! Cuan David Walker  like meeting ppl
0	Don't know how to add a profile pic, it's not letting me!   Any help?
0	don't know how to put on eyeliner  Even the supposedly idiot-proof, really easy to handle kind.
0	dont know how to upload my default pic
0	Don't know if I can make it til Friday.....
0	Dont know if I'm tweeting or twitting? Cloudy here today. Betsy has cold/flu?  Got to service my tractor- oil & filters. Feed the bugs 2
0	dont know wat to do, will miss them a lot  especially our leader...his puppy face ..lol
0	Don't know what choice Twitter really has
0	Dont know what the heck is wrong with my pc. It isnt working!
0	Don't know what the hell I'm doin up so early on a sunday
0	Don't know what to do   I'm so bored. Wish I had gone town now tbh. Although having no sister all day is a bonus   x
0	don't know what to do  didn't feel sleepy.
0	dont know what to do anymore
0	Don't know what to do anymore
0	don't know what to do nih -____- soooooo bored, ice creaaaaam! pengen 
1	Dont know what to do on this beautiful day, but im with morgan so it should be fun! 
0	Don't know what to do or think today
1	Don't know what to do right now...pretty bored, but I refuse to study. Any suggestions? 
0	dont' know what to do tonight, plans ll went wrong. know ones coming anymore 
0	dont know what to do with my life atm.
0	don't know what to do with myself today
0	Don't know what to do with myself!
0	Don't know what to do...  Today is boring.
0	Dont know what to have for tea  Home alone and everything in my freezer is for more then one person
0	don't know what's wrong, but i'm feeling a little bit sad   #bsb
0	don't Know Where To Go
0	don't know where to go tonight
0	dont know where to start with all these packing/cleaning...i just want to go home now  x
0	don't know where to study  i dont even have any "spirit" to read
0	don't know whether to audition?!?!?!?!?! probably would have done if it wasn't in front of a live audience :S boo hooo
0	Don't know who U R anymore!!!
0	Don't know why but I just tuned in to BBC1 expecting Jake...  http://tinyurl.com/cfd9zk
0	don't know why, but i want grey nail polish. but  i can't find it anywhere. 
0	Don't know why, but when I click on Home, it always goes to my first Twitter Page, instead of this one.  Frustrating!  
0	dont know.. still figuring it out
0	Dont knw how to kill time... but its surely is killing me...
0	Dont knw wht u do  dnt make me sad, pls :'(
0	Don't leave rogue commas at the end of js lists, they'll break you scripts on IE. 1H wasted  #protip #IE6 #IE7 #Explorer
0	DONT let #BTS drop...btw   were r the miley supporters?? miley isnt on the dot com top 3 on radio disney! KEEP REQUESTING MILEY! #BTS
1	don't let go! you've got the music in you!
1	Don't let the sun catch you crying - Oh my.. so cool  http://tinyurl.com/cugy8c
0	Don't let there be more Nedas.  #IranElection
1	Don't let this be you, keep your perspective!  The Guess Who - No Time  http://bit.ly/INz11
0	Don't like arguing with my sister...
1	Don't like black used as base (for most cases)... It's sinister  and it's hard for the eyes to relax - the readability's compromised...
0	don't like going to work when it's sunny outside!!
0	Dont like my hairstyle
0	Don't like the twitterfon update. Makes it look like I got a lot of to  me and I didn't
0	Don't like the way twitterific shows embedded pictures  1 point to tweetie.
0	Don't like the weather report on the met office site for tomorrow  Going to try another site for a better result.
0	don't like this feeling  walking over to Nick's for a bit.
0	Don't like Tweetie's new selection style. Cant really see what is highlighted. Liked the last style
0	Don't like wash contact lens.
0	Dont like working on sunny days
1	dont look at my toes... put shoes on, then painted big toe! 
0	Don't look like it's gonna be as hot as yesterday
1	DONT LOOK UP WHAT THE NOVEL IS ABOUT. it gives too much information away already. just trust me like jack and rose
0	don't make fun of me! lol that's mean austin
0	don't make me go back to Lancaster
1	Don't mess with the Basil...HE MADE THE NEWSPAPER!  Such a brilliant movie.
1	dont mind the boo. Kris Allen did Great!
0	Don't mind the cracking noise that's just the pieces of my heart chippinf off piece by piece. Sigh this is not going to be a good day
1	Don't Miss "An Unfinished Life" on "FX" Tomorrow at 11:30PM. Check Ur Local Listings 4 More Info!
1	Dont miss church 2mrw 4 anything in the world! U dont know what God has planned just 4 U! Come expecting
1	Don't miss it were going live again in 20 minutes WWW.FRCLIVE.TV  WATCH AS WE LET IT ROCK
1	Dont miss this beauty alert  http://tinyurl.com/lnqct5
1	Don't mistake me; he's still hilarious, just completely purposeless. 
0	dont mix alcohol and boiling water - my arm is burnt
1	Don't need to go out to have fun, I am having a blast here with my maverick, watching yo gabba gabba 
0	dont no why but i can never concentrate on coursework!
1	Don't often thank people (mybad) should do more often so many thanks for the #FollowFriday recommendations tweeps! Really appreciate them
1	Don't play games with people who have been playing them for like the past 6 years  MeaNmean.Mean
0	DON'T PLAY WIT RICA DYM3 DIVA'S FOOOD...
0	dont put washin up liquid in the dishwasher, be patient and wait till the morn when u can get proper dishwasher tablets haha 
1	DON'T READ MAX AND THE CATS, Moacry Scliar is a softy - cry - baby who likes to sue better authors because their books win awards 
1	Don't realise how much difference  a bad seat makes until you get a decent one
0	dont really feel good anymore  [[his<3]]
0	Don't really feel good. Ugh. Apparently the awards were huge last night can't wait to finally see it. Feeeel siiiccckkk.
0	Don't really feel like I got a tan  I gave up and am working out instead. Skin cancer is overrated. <3 CJ
0	Don't really wanna go school on Monday to be honest
0	DONT REFRESH JTV. u wont be able to go back in
1	Don't rele feel good..tummy n ankle hurt and can't half talk.   (: Codys Kat
0	Don't ruin my day mr. Orthodontist
0	don't ruin my travel plans!
0	Don't say no, puh-leaseeeeeeeee!!!! 
1	Don't say that. I made it safe.  lol. We're having a good time. I'm sleeping here.
0	dont see any photos from day 2 of #barcampnyc4 on flickr yet   #barcampnyc
1	Don't see hot guy, thinkin it might be safe for me to go outside again. Off to lounge in my hammock & read! 
1	Don't seem to be able to wake up this morning! Far to much Champage & Good Times with Good Friends over the last 4 days! Morning All
0	DON'T SELL MY PS2
0	Dont stand in line behind me at the iTunes store, tried and filed 4x to get 3.0 
1	Dont stand in me way or make me mad. it will just be worse for you  but anyways i never get mad so no worries ^-^
0	don't start work till 12  so bored so OVER wow ehhhh
0	Don't start work until the 10th
0	don't stress baby cause you just make me stress toooooo
0	Don't suppose I'll be able to tweet from the courtroom.
0	don't talk quietly!
1	Don't talk shit about our future home
0	don't talk to me until I've had my coffee
0	Don't Tell Anyone - Jonas Brothers. Why did I leave LVATT in that car?
0	dont tell me cause it hurts
0	Don't tell me everyone is asleep
0	Don't text me saying "text me when you're up" and then ring me before I've texted because that probably means I'm not up yet! Tired
1	Don't they know that you don't buy a security door with glass in it  http://tinyurl.com/qldjnz Via #Security #Fail
0	Don't think about jenn, don't think about jenn, don't think about jenn. Can't even do it. 
0	Dont think I am going to see Joe Nichols at the Bull on friday!
0	dont think i am using my twitter properly since i am only using it to have a  long running convo with daggers... oh well
0	Don't think I can do my run today because my iPod is knackered...can't run without music.
0	Don't think I can get the stream stable on this connection.  Sorry #smcchs   (SMC Charleston live > http://ustre.am/3Dae)
0	don't think i can make it to shibuya tonight. i still have to clean and prepare the beats for soi.
0	Don't think I ever thought to myself "Damn, I took way too many pictures." Almost always it's quite the opposite. 
0	dont think i like this twitter thing
0	don't think I really get this whole Twitter thing
0	Don't think I tweeted at all yesterday! Sorry!
0	Don't think I will make it to 100 before I'm off to bed.
0	Don't think I'll make it to see rubylux  not even home yet.
0	don't think im going to dye my hair tonight, im really tired 
0	don't think i'm going to the miley tour  sad times.
0	don't think I'm gonna make the graduation
0	Don't think it's fair to advertise McD's when I don't drive and they don't deliver
0	don't think my phone is working
0	Don't think she'll pass this paper. Don't think so at all
0	don't think that way
0	don't think that we can hang out before she leaves  i'm really gonna miss her so much :'( ... doing quizzing i guess..
0	don't think that went well, was only in there for 15 mins 
1	Don't think twice Just be nice
1	Don't trust the German postal service, so I made a quick cross-country trip to deliver a certified translation in person. No phones 
0	don't try and bribe your sister into cleaning your car.... it doesnt work
1	don't try to understand it.. just listen to it..
0	don't u h8 gettin disclaimers u should of gotten b4 hand?? (ex.. u should check the top on dat cuz da contents cud burn u chemically)
0	Dont u hate it when magazine screw up they put the same article in twice and wasnt of the band i wanted to read
0	Don't u hate when u have a long day ahead of u but u can't fall asleep
0	Don't u hate when u know u have to do something but u still just can't seem to make urself do it
1	Dont u love finding weed in unexpected places  ima continue cleaning n see what else pops up. earlier i found sum valium
0	don't understand twitter
0	dont upgrade to Chrome 2 if you require NTLM authentication,., Its not supported yet    :'(   http://tinyurl.com/nwop39
1	Don't use Amazon! Use http://www.goodshop.com and earn money for your favourite charity while you shop! The pennies add up! Do good
1	Don't use MySpace or Facebook. Use http://r.yuwie.com/j_income/ Get paid to network with your friends. Make friends and money.
1	Don't walk in front of me, I may not follow. Don't walk behind me, I may not lead. Just walk beside me and be my friend.  
0	Dont wanaaa goo school  can u come to my school n drag me out ppleaseeexxx
0	Don't wanna b back in NY....and it's still raining.
0	Don't wanna be here
0	dont wanna be where i am now        .
0	Don't wanna become a workaholic at a tender age!  But I have no choice. More files are piling up on my table!
0	Don't wanna do no laundry today
1	dont wanna get shaved for my new pics! ale!
0	Don't wanna go back to Vegas  not ready yet!!
0	Don't wanna go back to work tomorrow...
0	Don't wanna go but the money is more important
0	Don't wanna go out. Hoping plans get cancelled. I hate being the one to cancel. Ugh.
0	dont wanna go to college tomoz . im well burnt and its gunna be sunny more
0	don't wanna go to school tomorrow, but i have to..! 
0	Don't wanna go to school tomorrow... it's going to be sooo boring
0	Don't wanna go to summer school again tomorrow
0	Don't wanna go to the dentist!
0	Dont wanna go to work in the morning  got soo much other stuff to do! Blahh. Good night
0	don't wanna go to work tomorrow
0	dont wanna go to workkkkkk
0	Dont wanna leave work  So much fun  Im hungry :/
0	Don't wanna leave.    ((((
0	Dont wanna play netball today
0	don't wanna travel tomorrow
0	Don't wanna work sunday  but need the money
0	dont wanna work tomorrow  northies tmw nighttt & lily allen on tuesday
0	Don't wannae learn suffering, death and resurrection 
0	dont want 2 go 2 leave the beach on saturday!!!! leaving stinks
0	Dont want Maths exam!  Havnt done enough revision! :O
0	Dont want more than u can handle, the rest just goez to waste  2 mny ppl in need right now !
0	Don't want the O2 ppl confiscating it again!!   resolution size my ass. Lame excuse!!
0	Don't want to be alone in the flat because I'm scared of Charles Manson. Actually terrified.
0	don't want to be tomorow...
0	Don't want to but I'm gonna!
0	dont want to come home
0	Don't want to do French homework
0	Don't want to do my 2 hours of punishment today
0	Dont want to do the stuff i'm supposed to do
0	don't want to drive to boston
0	Dont want to get into a confrontation with the grenade!
