1	Thank you! She has her daddy's eyes. Even his eyes aren't as beautiful.
1	Do we have a date, darling? 
1	 It was nice seeing you at the softball game, glad to see you take some time to have some fun!  Good game!  
1	Get 100 followers a day using www.tweeterfollow.com Once you add everyone you are on the train or pay vip
0	the only down side of your shows are the high-pitch screams. Ir hurts my ears as much as camera flashes hurt yours..
0	wow, that's crazy! I'm left handed 
0	I hope everything is ok.  I mistook ER as an acronym for a place to eat  Be good and healthy please!
1	 I hope the night was so much better then you expected! Have a safe trip home.
1	good morning woman!  you upload that song yet??
0	okay. sorry. it won't happen again.
1	need a version irl
0	why is it your last tour??
1	thank u so much
0	Yeah i was there on Thursday. Brilliant gig it was, poor Nicky having to wear a back brace though 
1	all the best for friday chris
1	Is it because I'm sooo Naturally Fresh??? Oh, myyy bad! I work ON Naturally Fresh! 
0	why in the world didn't you send me the events? Are you and trying to have fun without me?
0	You may be right! I'll just have to have my team look to other way as I nod off during the day! Plus I have to hit the gym
1	Not eating isn't a diet. You go into starvation mode and then your body stores everything you eat...in fat.
1	TweetDeck is where it's at, though. 
1	 ich sag nur halb vier! HAHA  have a great day yourself!
1	The Kooks' cover is also really awesome.
1	Both of you should get some rest
1	hahah I ate them   I miss you chris!
1	Okay chris! haha. whats the most embrassing thing you've done in public? im curious
1	you don't say goodbye/goodnight anymore? HOW RUDE!! lol ily chris  (full house lol)
1	- yes, sir.  Teaming up with my crew down here - producing partners - promoters - marketing ppl - we're making it happen.
0	you know, you can't access hulu when you aren't in america.  
1	I didn't realize 777s have been around long enough to become ghetto.  ... have fun mixing the recording tracks!
0	oh shi.... (that's a no)  sorry. Will get my arse in gear and send it ASAP.
1	Mornin to ya! You have a great weekend too.
0	REALLY graphic - more so than any other account I've ever seen on Twitter.
1	just got to my house. I'm sure 85c cafe will be in the agenda sometime tonight.  any OC people want to tweetup say about 9pm
0	went from zero to infuriated in no time flat. also, he says words that hurt my ears. 
0	If I wasn't going to disney in the morning i'd be there. Plus I heard it's pretty terrible
1	why thank u
1	 Wait until you're obsessed like me  Did you cry when Angel died? Xoxox
1	Good songs for youu hmm, Kiss Me Thru The Phone - Soulja Boy Tell 'Em    or     Sugar - Flo Ridaa 
1	I think you should go with HP, thats what i have and its working great without problems 
0	think you could well be right Mate, think still have a year left on mine 
0	I am lost. Please help me find a good home.
0	pierre flew away about an hour ago.  that brick phone takes some mighty fine pictures!! :]
1	You are welcome. Just trying to let more people know about it. I'll def go there too
0	I am sorry
0	had wasabi oysters inyo(now ninyo). friend's bday party.
0	I have 3 apps that need updating, and I cannot seem to get them to install properly. The badge saying "3" won't go away 
0	not sure, probably not till it's cold again.  
1	twice? haha. sociology sac today; epic pass  fell asleep; was good
0	damn bae   i wish i could make you feel better
0	i miss you too babylove
0	my poor baby  how you feeling?
0	 good luck with it all man!
1	"And I'm packing your ANGRY eyes, just incase" 
1	are you going to do another questions video on youtube? the last one was tres amusant
1	at airports you can use any currency so use your dollars
0	aw! i just realized you're here in LA for our worst bit of weather! it's usually so much nicer! it's been all overcast!
1	don't quit Twitter
1	frequent videos are cool  do ittttt
0	http://twitpic.com/4c7ce - owwwie!
1	http://twitpic.com/4jg09 - looks exactly like I do when I get that GH guitar in my hand
1	http://twitpic.com/5dc1e - hahaha i love this
1	http://twitpic.com/7j985 - waaaaaaaa! this is awesomeeee!
0	http://twitpic.com/8d0kq - I wish I got DWM. I live in the states, so no luck there 
0	Im sooo jealous....I wanna go
0	most likely there is more commercial than tv show on american television. it's horrible
0	my sister just went to thorp park
0	omg dude i cant believe i missed the e3 episodes  il watch them now =D
0	test failed
1	The more the better!!
0	There's no sub button!
1	 You are a lover of Ellora's Cave too?  Well aren't we the naughty girl
0	uhh naw stay'd iN another nite  but i did pass my first 2prts of my bartending test!! takin tha last prts of it la8rr!!!
1	good morning 2 u hillybilly
1	yeah surrrrrously. we win
0	its a disease dogs can get from i think mosquitos or something? yeh she is a puppy we only got her friday  x
1	lol thats ok  mofo myspace isnt working
1	lol yeah there seems to be more these days, but thats good, means people are taking them more seriously 
0	omg i looooooooooove nintendo 64! i have one lol. i have loads of games except for zelda  loll
1	yeah  thats what i reckon
1	yer im like whoop! ha I get like a week off  but I have the GAT =( it goes for 3 hours, GAY!
0	 so going to the gc with out me...bummin make sure u get lot's of pics ;)
0	What up baby!! Sucks about your team
0	BB so far... It's weird just watching the highlights, can't really get into it  Not a classic so far, but good.
0	 hope you and your ass feel better!
1	Hope you brought some mhc trademarked earplugs!  Hope you have lots of good family times...or at least stay family!
0	I work from 2-10
0	lol, I get out too late for that. lol.  if only I was off.
0	nomnomnom NO.
1	- how ya like to sautee yours bud?
0	& can you post a good example of where the singleton example is going wrong? I'm using that in my (shipping) app
1	his code is already slower - in asm, breaking the pattern involves moving self around so it isn't clobbered by the return value. 
1	 No problem, Hail is actually heavy at times here right now lol 
1	Here......feel productive now?
0	man I am envious. About to hit the freeway to work   you guys hiring? ;) http://myloc.me/15Vs
0	Afghanistan isn't going to be any better for us than it was for the USSR.
1	LOL - I have to be. I skipped a movie to watch this abomination of a baseball game.
1	You should come over and see for yourself, you'd have a field day, actually you'd need a field month at least 
1	 most def!
0	 I want to Gloria but it's PG.
1	Thank you so much!
0	sorry Tammy! I know you will...
1	i've seen a car lately whichs license plate said ROFL...  ... anyWHOOO. chatzy??!
0	You mean the Alien in me isn't appealing to you??  see you tonight??
0	friend u always on vacay I'm tryin to get like u my nxt vacay isn't til labor day wkend
0	i know   but its better than nothing
0	yeah. shani's brain loves making her like guys she doesn't have a chance with.
0	Sounds wonderful!  I envy you.  We haven't camped in about 6 years, I think.    Glad you're out enjoying Jehovah's creation!
0	seriously...how bad was it? I have an appointment for root canal on 8th...I don't want to go!
0	 i've got 10 exams left , i have 2 days where i have 1 in the morning and 2 in the afternoon  how am i gonna remember it all
0	I really don't wanna be a vampire loving tween
1	I was wondering where you were, haha. 
0	HAPPY COMMUNION DAY TO YOU! too bad it's boring
1	Hey lovely... was wondering where you'd disappeared to!
1	I get that way sometimes, too.  It's ok to be quiet.    I'm well & in a ridiculously good mood!  You ok?
0	if i dont get hubby some coffee in this house before he runs out, I'm going to be in BIG time trouble. 
1	I'm good.  I have tons of chores, but I would rather sit here and chat with you. 
0	I know, my mom told me but I was at wrk!  Why?? I BET IT WASN'T MORE HIDEOUS THAN WORK!!!!  I put in my 2 weeks yesterday! :/
1	oh and to listen to it during the long drive to SoCal this weekend
0	Snuffies?!? *gulp* But...but... it's HAUNTED!
1	You're even MORE HIDEOUS for tweeting to yourself!!!! WHHYY was I hideous!?? I don't remember!??
0	u considered those nice girls as sluts  That made me sad u generalized a woman into that category just cuz of a bikini..
1	and just when did you arrive? hiya girlie
1	hellllllooooooooooo just getting ready fir church
1	thanks!   I could use a jug of that Kool Aid about now! I'm dying out here!
1	at least they try
0	i'm stuck inside doing work
1	just FYI, Health Privacy Project is NOT fro ACLU, it's under  www.cdt.org #cdt    thanks for orig tweet!
1	well done for spotting it!
1	no is the "popular" mns like
1	How are you enjoying this EXCITING shift??
1	i look forward to it.
0	Boo!  At least let you get some coffee first.
1	You told me to remind you about the panties I want. hehe You can surprise me with any kind of thong or tanga.
0	Haha. I got a bold now. Don't get all the fun of flashy os updates  but I still love it
0	Pls Tell to me how you did!  I cannot!
0	Yours and mine both, though what happens upstream of it is even worse today 
0	 basically, i wanna broadcast but not really is the blog equivalent to im horny but im not gonna have sex w/ you. 
0	no i want my lvl 55 back
0	SWEET! Was totally tryin to think of other pixar puns-i got nothing!
1	LOL... true true! it's actually a funny story.... but it wasnt back then!
1	I love that starbucks! It's the coolest one I've been to
0	On vacation and I only have my MB pro with me
1	toy story pwns
0	When I was on 2.2.1 I had this problem turned out my internal speaker was broke  took it to a O2 shop and they gave me a new one
1	while you're here, I challenge you to rent a car & drive on the right side of the road. Please. 
1	Why do you look so familiar?
1	Your mum has been so good to you today!  First clothes, then mac and cheese. 
0	awe! you're right!!! slacking over here
0	Your not the only one.. right on my nose �_� feels like im being stalked.
0	he said no!!!
1	Hey Simon that is funny glad to hear you have good friends   Take care!
1	welcome to my friends list
1	ahhh alvin! didn't know you had one of these
0	Psh no. I missed my grandpas birthday. Our whole fam was together. I had to work late
0	Dang, what kind of flu is it?  Nasty, sneaky flu!  Yuck.   Poor kiddos.
0	Sorry to hear that the boy is sick.     Do you want me to look for some phrase stamps for you at a cheap price?
1	*hand to ear* waiting...
1	dang. you'll be missed!
1	I absolutely wanted your opinion! Wonderful thoughts!
1	it's nice to know I have fans ...
1	Cool! Not my bag, but I'm glad it's yours!  San Antonio is a pretty cool place. I like it!
0	no, i'm not crazy  but nick is just mine, hehe, miley go kill(?) i'm so bad in english
0	 i'm sorry bby, i know how it is... do you want to talk? i'll listen.
0	Ergh no. Kate
0	ive moved inside now coz its a bit warm  is tonight the bgt finale?
0	haha and I have no choice  fml...this girl..smh
1	prob not a bad idea to carry one if you still have allergies! Grown men will also succumb to a closed throat & no air!
1	we need to go town soonn  x x
0	shut up! its not that bad babe! gee i want to watch some series! one tree hill for example - last episode  is Peyton alive?
1	now try and calculate the carbs!
1	umm so July 20-24=the best time of our lives..get ready!
0	i was gonna come back but then i changed my mind! I'm sorry  ily
1	well just think of all the sales opportunities that could be hidden in there somewhere. . . .
0	It's about  as likely as hitman being shown  vaporware
1	i too am catching up, i've been catching up for two weeks  hopefully soon i'll be caught up...
0	I hope you feel better!
1	You'd probably like to follow  Happy birthday.
0	lmao, u didn't catch any fish 4 me?  what kinda fish u caught & ate?
0	I wish I worked Friday so I could have Saturday or Monday off  F'ing nutmeg.
0	which one i dont go out ever
0	aw boo  i'm sorry! i understand... but you get to travel, which will benefit you more in the long run then some concert
0	I'm back in action nigga! Lol and I'm back in hampton  lol
0	 yeah... I think she just got a little bug
0	I leave on July 16th. Seems so far away
1	happy birffffday to your son! have a great weekend
0	I have 8 open currently - below average
0	Not wanting 2 be insensitive but my dog, my BABY GIRL, has mammory lumps I found rubbing her tummy ... I feel the need to be pink 
1	The Ribbon Walk was brill! Hats off to you guys for ace organising and gallons of water. The marshals were amazing, real heroes 
1	That's probably the best question from last night.  When you have 6 time outs- USE THEM.  At the same time, I'm not complaining. 
1	So again, I wonder, what is wrong with all my first paragraphs... 
0	nope still don't see
1	oh no I wish those were gone even at the party last night. I got some cupcakes to go though!!
0	how did you get to meet TR and the band???  Am so jealous
0	me too....& I'm an outdoor concert
0	Hey hot pants... my phone's dead  I'm gonna get some food with my daddy and then head home. I'll call you when I get my charger
1	that's right ladies and gentlemen, a puzzle, but if a certain jdrobasaur tries to get her to do something she's much too busy 
1	 i'm home but have stuff i have to do so i will not b online
0	oh now i'm just gokey girl?
1	AWESOME!!!    But that one i can wait for. I dont want to be that long but those are the breaks.he hasnt posted today.
1	Congrats brotha.  You gonna teach him Flex 3 or take him straight to Gumbo?
0	I had to miss it. And Hannah Montana. And JONAS. Ugh. I want my Disney.
0	i know. i want to be section 3.  AND chesca is section 3 daw. ;)
1	ok, good  Cause i didn't mean it the way it sounded.  Yea i doubt i ever will either...oh well
1	I know what that's like
1	treacle, melted chocolate, the topping on a sticky toffee pudding 
1	oh, it's not on your account at all. I just looked at it, did a few things, don't see the point right now. 
0	is jealous that I won't sleep with him.... Poor guy
1	At a first look, its pretty fun. 
1	just chilling downtown being as lazy as possible
0	nope but I'd hope it would use IP and surround hotspots as an approximation
0	my phone was DEAD!!! I had called u earlier bcuz I was in ur vicinity!!! Where were u??? I never see u
0	is ryan bothering you again? i'm sorry.
1	They were delicious!! I didn't let them get super big... the weekend was too crazy for me to be all horticultural
1	not just any cupcakes, the best ever. Weep for me, my friend! 
0	 For sure post pics!  Jealous they aren't stopping in Dallas.
0	I totally feel like a square, and I know you don't miss me 
0	what makes you so expensive now?
1	I gotta ask whats your message to about Twilight?????  (sorry being nosy)
0	 Your avatar not showing here
0	 I'm sorry. It at least teaches me to start saving now or look for a sponsor sooner.
1	haha, you're right! We're supercreative 
0	I am sorry  Don't put up with his B.S. Life is FAR too short.
1	I need to introduce you and to each other - you guys are both artists and awesome
1	Thanks....You to
0	I'd rather not know as I paid a ridiculus amount for my 16gb
0	ahh you almost made me pee my pants, saw a new tweet then no update on pwn  http://bartzworld.com/chat.html
0	So sorry to hear about your uncle - we'll be thinking about you
1	Thanks, Alyssa - you too 
1	sad that he read the Daily Mail, or that you remember  ?
0	dude, r u tweeting + driving?? looks like you're in Deliverance country! Good luck at work tmrw 
0	i never got invited after i sent the message to them  i'm not exclusive
1	i forget the i  delicious
0	ho oh.that's sucks.how pity am I
1	Heh. It sounds so much better when I don't tell the rest of the story.
0	 I thought SUMMER just started! Wanna get cheap fish again next week?
0	check out the most recent post on my blog  The girl is Christine.
0	good old primark ;D but its only 8 hours
0	yes it is our time is rather limited at the moment  but we're all about pot leaf pasties
0	oh no! is it really bad?  poor you!  im sure it will be ok by tonight
1	Sor juju dài b jai ..... See you tmr
0	AMAMEEEEEEEEE   You don't love me anymoreeeeee
1	thank you so much!  I have been plotting this for weeks! Anyone impeeding this is in serious danger. Lookin at u Dr Cook...
0	I hate when all I want to do is sleep but no matter what I can't fall asleep
1	 ah! what are you guys doing?
0	so skyyed. showed him 2 me last week! - I'm still reeling from that crafted (& hyphenated) last name.
0	interesting, but yeah... $30 
0	you are so mean.
1	 Go you!  Get some fresh air before tackling the next one.
0	i've heard it costs $3/month extra, true? that and no howard stern 
0	Lol. A community member built that; down now  Our site went live yesterday, was on Techcrunch, see it? http://twurl.nl/zmwu2b
0	who is she I looked at her page but says nothing.  Honestly?? First impression not good
1	no way. Magic in 6 or 7. Fo reals. Also Raj, I want my $5. Deliver on that this week? 
1	 I scoffed far too much last night! Inspired by your ramsons in buttery mash!
1	a very belated thanks for the #followfriday
1	Morning  Howwww you doin?
0	i dont think ive logged in in like a month or more! work too much. my town is probably all run down
0	yoo why wasn't i invited?
1	Haha, it's true. Have you heard that song? I loooovvee it. 
0	working on exercising brain rather than legs, ideas welcomed! Wish we could help out on the homes front - only room for one atm 
0	That NBA non-call by the ref was horrible.  In a playoff game too!    Keep your chin up!
0	im need u to believe me if u dont who will  LOL
0	birds freak me out- I'd like to thank Hitchcock for that  I have fish and sea monkeys... Bc I'm fascinating like that (not)
0	lol and I'm stuffed!!! Wish I hadn't eatin all that now
0	As of now no  Le sigh...have fun though!
1	brenda! Add me on fb Andrea Tamburrini in the avatar im in a park  and i look like a child!
0	unfortunately not, just checked 
0	You got there ahead of me.
1	The pink zebra one  I don't care so much about the zebra, but I love the rest of it!
1	sweet. you name the time, because i can show up when ever. 
1	my brother lives 2 blocks away from the park west theater
0	try and check out Chick-fil-a or Boston Market. We don't have those in Oregon
1	Gl�ckw�nsche! I would have said TXL earlier, but I didn't know if you were going into Tegel or Schonefeld. With LH, Tegel = duh. 
0	Oh no! Hope everything's okay, Brittany!  *hugs*
0	haha of courseee! is that bad?  does that name actually ring a bell? haha
0	yeah, when you start reaching your early-mid-20s 
1	Heh. Apparently I am one in practice.
0	Exactly! Wot was she thinking! But can i send he off to bed? Nooooo I'll just have put poo in her sho hrrumph!
0	 aaaah maan.. i always miss hanging ou with LIG ...  I need to make sure I make it to the next Retreat event :-D
1	Toddlers and *any* kind of gadget don't go well together. As for my Storm, that's what the screen lock is for. 
1	Ooooh yum! Brownies it is! I'll save you some  *Goes to look up brownie recipe*
1	WOO! I'm seeing KOL in Copenhagen july 7th instead
0	golf season began.yay! also inspired by ur progress.i shld get fit too.but lazy and procrastinate
1	aw hahah we guessed you might hurt yourself... :T but i thought you would have a fun time & mm, sounds tasty 
0	hahaha, its all good. <3! work today 
1	*high fives*
1	Nothing wrong with appreciating your own work in hindsight. It's a comfort to the over-self-critical.
0	& I'm sorry if my updates seemes cocky or rude!!
1	Chris Via, you are my whole world. Please reply back? I L Y with the O U 
1	i love strong cheeder, but this colliers one is the stronest i've tasted, it was bloody gorgeous 
1	http://twitpic.com/6pyo7 - yummy! *jealous* haha you know how to cheer me up.
1	Oh, and LOVE the Doctor Who desktop! I have LOST as mine, but DW pics as the screen saver. Love it! 
0	 yeah, I noticed
1	I am going to work on that!
1	well, owes a lot of what she has to that friendly car rental company. 
1	aren't you the island poster child.  I learned that game ON the island from Nanaimo kids.
0	You better keep us updated. You'll be posting pics and such? I'm wicked jealous  ... I'm doing it next summer for sure.
1	You're intoxicatingly awesome. Best. Straight. Partner In Crime. Ever
0	1Password touch Pro can do it. An update for the regular version has been stick in the review process for 3+ weeks.
0	I know  Useful if mugged though, surely ;) Product description: 95% metal, 4% cotton, 1% silk!
0	I had a french oral on 'The French Stereotype' this week. I wanted to get striking in but I didn't have enough time
1	cool! And everything is all sorted for your return to the land of the long White cloud?
0	Canned air is supposed to work, but that only lasted, ohhh, a week? 
0	Soo ready for BBQ tonight....ive only had a PB&J sandwich today  ooh and some fruit
1	on our way had to turn around to get my wallet but we are in route now  hold tight sexy panther
1	Yea, new camera 
1	I rode Thurs. + discovered my computer on bike was out. Emailed Cateye and replacement was here on Sat.
0	I tried reading Lamb and just didn't get into it.  I'll have to try again.
0	awwwwwww  how'd tht hap?!
1	I saw you at brunch but you where to buzzy.   Next time you have to drop by to say hallo.
1	 Did you see the last two episodes of #tv Prison Break yet? 23/24 that aired after the season finale?  How was it?
0	http://www.justin.tv/g4tv_e3 Do you get a choppy video here?
1	Oh no, I want to break you body just as much... well, maybe not quite as much. 
0	Where can I find that package? I've been waiting for so long!
1	lol, my birthday is also voting day for the daylight saving referendum, and i get to vote! voting a big fat NO btw 
0	not for me yet
1	having awesome day thanks. Hope you are having the same
0	 Sorry to hear this. Glad you have such good friends that get it.
1	I know it's really sad I'm always going to be around, and when your in the city you give me a call 
0	vai l�, :* q inveja 
1	hey Corbin, have a great day  and good luck in New York, this July... 
0	i'd call but my phone's dead  i always forget to charge it.i'll try it next time...a call from me can change lives :-P
1	Oh my gosh he is adorable!!!  What did you name him?  I am such a sucker for kittens
0	too bad it's not my money
0	oooh he he idk omg im gonna end up going to britney alone
1	Thanks poppet will check it out
1	Ahhh.. thanks
1	lmao. Whyy? And yes I'm watchin #kickingandscreaming
1	you saw I have your cases in my collection too
0	y can't i open the file???? i was downloading it just now and now nothing???
1	yup, it's awesome. 
1	oh fosho doe! straight up gangster
0	playoff tix are 175 (or more) for nosebleeds  so spensive?
0	Again, I'm no good at this sort of thing. 
0	I SO wish I could cone hang out for your bday  yes yes come visit!!!
1	aren't I tho  n u love it!
1	awwwwwww yaaaaay!!! I love it!  just that smile makes me think of you and u say awesome all the time too so hehe!!
0	The voice acting is really bad too  I was looking forward to this one.
1	im so proud of u corwin!!!!
0	Hmmmm sorry I can't be of any help
0	No clue at all
0	me & my lil one watch his shows on saturday mornings. I was amazed when I heard he was coming. I'm in Dells tho so will miss it
1	woot woot  hey call me tomorrow. Much to discuss.
0	sure, you'll have to wait till January though  too far away!
1	1 & 2, of the new ones. I'm gonna get started tonight 
0	YUM! I never thought of putting pepperoni but that's gotta rock! Gnocchi failed. It tasted really floury. Sucha letdown.
1	hey! me too!
1	I love you babe. Thanks for putting up with my bullshit for the past year  You're my everything.
0	 That didn't come out right.... did it
1	 I know.  How far the Cubs have fallen.
1	Steeler fans are everywhere.  People are just smart and pick the greatest team ever
1	2-1 my man, Steelers record against Cowboys in Super Bowls 
0	He didn't ask for your hat did he?  Nah, you wouldn't do that to me. Would ya? HMMMM
0	you're welcome ;) nope but i wish i was there! i'm suck in CA
1	I wish I could've come last night. I was asleep in Oberlin.
1	it was awesome having you here! Thanks a lot for joining in!!!
0	lol exactly! But my boyfriend broke up with of once cus of upward bound and my europe trip
1	ohh it is. It involves a screaming drunk kid, a backpack full of illegal substances, and Bobby bodyslamming people 
0	How was the trip (with Randi?) Don't get to see you much lately   ,,,,,,,we may be family soon...check back on Wed. Hope Hope!
0	Have fun! I don't think we're going to make it!
1	im aware it says that but you only have to swim if you want to... most people don't...
1	it's not that exciting, but waterford is going out of business so i figured i'd invest in something that won't "crash" 
1	that possible plausible, can't have plausible rumours..  #3feliciadayrumors
1	lol! that is too funny
1	BTW I was in La Chaux-de-Fonds this morning  business trip, mind you. Back to LSN this aft.
0	the installer is crashing towards the end of the installation
0	i fkcin' love that movie!! ugh!! that movie was so great.. that movie made me tear *sniff  anyways i love that movie
0	thx. When is it planned? Duplication of information is cumbersome...
1	very cool, things like gift cards, gift vouchers, free coffee on your coffee card, paying a couple dollars for someone's parking 
0	just the red Dell one. I wish Macbooks weren't so expensive! Unfortunately I don't have an extra �1000 spare
1	Lies. It's always good
1	Get 100 followers a day using www.tweeterfollow.com Once you add everyone you are on the train or pay vip
1	i got to sleep by the way, prepare for tomorrow. bye, see ya 
1	I can think of ZERO good reasons for you to go to Dallas this week! Just sayin.
1	 chillin, tryna keep busy aswell...Watchu up to?
0	beeelll where are youuuu? gue ngga ada pulsaaa BBM matiii  twitter aja kali ya booo hahahaha.. kabarin klo udah di rumah
