1	is wishing all the beautiful mother's an amazing mother's day
1	is wishing andrea a safe trip to NY!
1	is wishing Chrisie luck for the shoot today
0	is wishing everyone a Happy Mother's Day and taking care of a sick Blake
0	is wishing he was talking to his girl.
0	is wishing he'd brought some of the chocolaty treats to work.
0	is wishing his back felt better.  I wanna go to Disneyland.
0	is wishing his mom a very Happy Mother's Day & his older sister an awesome 29th birthday & Mother's Day! . Gym, pack & goodbye Stilly 
0	is wishing i could be watching the griffster at the comfort of my los angeles home...  thank god for tivo
0	is wishing i could sleep.  *tear*
0	Is wishing i had sumthing to do !!
0	is wishing i was going to be in LA w/ da fam for the LAKERS Parade  but I gotta stay on my grind .. operation: get out of san diego!! <3
0	Is wishing I was wearing flip flips instead of a coat
0	Is wishing i was with babe
1	is wishing on a star
0	is wishing she could be with Hal today instead of work.....
0	is wishing she could book the 8 out of 10 cats tickets now.
0	is wishing she could download videos from purevolume
0	is wishing she could go out into the sunshine not sitting with the blind down trying to edit!  the life of an editor!!!
0	is wishing she could go overseas
0	is wishing she didnt have work later
0	is wishing she didn't have work today, cause look at the weather!  
0	is wishing she had the whole week off, not just parts of it 
0	is wishing she knew what 2 do!!
0	is wishing she took the day off like everyone else
0	is wishing she was at Dang... all the cool kids are doin' it. I wanna do it too.
0	is wishing she was at graduation and listening to hollywood undead - circles, to drown out her sorrow.  
0	is wishing she was at the Ring Dance with Drew in Annapolis!
0	is wishing she was goin to glastonbury fest
0	is wishing she wasnt leaving so everything could work out with youuuuu, maybeeeee another time another place 
0	Is wishing she were in TO this weekend
0	Is wishing some thing's & people didn't ever change
0	is wishing that he could go to office NOW!! *sigh* at least.. there I find some purpose.. alone and miserable
0	is wishing that I was able to catch a glimpse of Brody in the falls this weekend. Checked out the wrong casino and had no luck
0	is wishing that is was october
0	is wishing that K is not leaving her so soon. There is still much to see, say and do together. 
0	Is wishing that she could be Terrence J's date to the BET awards
1	is wishing that the rain will go away in time for the 6pm Mass
0	is wishing that the sun would come back out. Not enjoying all the rain
0	Is wishing the best for Jon and Kate Gossling. I feel so bad for them
0	im bored and hungry but i feel like i cant eat now hahaha
0	im bored and i miss dennoria
0	Im bored and i wanna do something
1	I'm bored and I'm on Kevin's phone yaw.j'adore thrive uth group!!!
0	IM BORED and my arms hurt from playing wii
0	im bored and none of my ppl are here...@FrankLee_
0	Im bored and none to hang out with this day sucks,i guess is the same old routine a walk by the park alone 
0	I'm bored and really wanna cuddle
0	I'm bored and tired but really do not want to go to bed yet
0	im bored and whos fault is it? my mom. she's mean.
0	Im bored andsick to death of Bear In the Big Blue House :| I wanna go the beach or something
0	im bored as hell, and still in pain from my vasectomy! 
0	im bored as shit too!  since i gave you something to make, give me something to do 
0	im bored at home. I wish I had Sumbody over here 2 chill wit
0	I'm bored at work!
0	Im bored being the only one on summer holiday kind of sucks
0	im bored but if I take the bus into seattle theres on one there to really see!
1	im bored but im loving the sunshine
0	I'm bored I feel like vaining using my webcam but it's disfunctional!
0	Im bored I have my science exam today
0	im bored i think thats why i keep eattin
0	i'm bored in my house cause my friends are boring and they don't want to go out
0	im bored in science, menna be revising for the exam this thursday, cba to do it tbh. gotta tho! 
1	im bored it 1:06am here but i cant b asked 2 go 2 sleep it takes 2 much energy hehe lol
0	I'm bored jajaja no one connected.
0	I'm bored nobody's online
0	Im bored now  what to do?
0	Im bored now that my best friend is gone
0	Im bored of cleaning now ... My back fucking kills
0	I'm bored of my life. Need to gtfo on vacation
0	I'm bored pff.. this is lame. I didn't go out at all today haha. tiring weekend
1	im bored right now
0	I'm bored right now
0	i'm bored right now !! Holidays are almost over
1	I'm bored right now and I need someone to talk to
0	IM BORED SHITLESS , someone entertain me please ?  
1	im bored so yeah talk to me
1	im bored to death and im with aweshume friends!!!!!!!
0	I'm bored to death in class and the internet is refusing to provide entertainment
0	i'm bored today
0	I'm bored watching big brother. It's so bad
0	Im bored with being sick  another night in house.
0	I'm bored with studying  still have to do it through. Anyone reccommend a good fantasy/romance book?
0	I'm bored with this studying stuff. Help me
0	Im bored!  Cant wait for the weekend!!!!!
0	IM BORED! LIKE REALLY BORED! AND IT'S ONLY MY HUNDREDTH POST  LISTENING: TONIGHT(LIVE) - JONAS BROTHERS
0	I'm bored, and i don't want to go learn  Why does school exist? I wish it was a nightmare.. Than i can wake up and it's over!
0	im bored, and im stuck in the house watching jeremy kyle cause my parents are working and i cant get anywhere  but kis down laterr woo! :L
0	is wishing the best for my bestie.
0	is wishing this friday didn't have like 6 diff things going on so i could actually see all of my friends
0	is wishing this weekend was already here
1	Is wishing to watch more of Nodame Cantabile Live Action
1	is wishing USD 266 would go ahead and put teacher assignments out on skyward like last year. Hate waiting until after enrollment.
1	is wishing you a happy sunny monday morning!!!
1	is with waiting for the others.
1	is with and hoping to see the delicious laterr!!!  txts
1	is with  going to buy LVATT together!!  everyone go buy it tomorrow!!
1	is with Aimi right now!
1	Is with alyssa
1	is with arianne here at SM  http://plurk.com/p/xml3w
1	Is with brittany!  and macy and drew!
1	is with Erika
0	is with great friends at Grimey's records hearing MUTEMATH play live. They are flippin amazing. Crowds to big though so we can't see them
1	is with her aunt&cousin. benihana tonite
1	is with his lady! All is well
1	Is with luce and khia!
1	is with marissa
1	is with micheaaaaaaaaaaaaaaaaaaal and daaaaaaaaaante
1	is with my bestie
0	is with my dad this weekend
1	Is with nikki  <3
1	is with rachael atm  today was very enjoyable. ilu.
1	is with ryan and coatise, waiting for hollie and rachel to get here  hope the weather stays sunny this afternoon 
1	is with sasha
1	is with sweet ansley eating pizza and playing outside. this is the life!
1	Is with tasha watching V and P  didnt hear noting outside!!!
1	Is with the one she loves  nite twitter!
1	is with vianca chua
1	Is with vicky in jesus christ superstar rehersals... all week
0	is witness to a new addition in a long list of Cleveland disappointments.
0	is wodering why Port and Eagles can beat the top teams this week but my Crows can't
0	is wonderign why when Davod finally comes to England near where I live, he doesn't arrange to meet up 
0	is wonderin how u write '@ omebody' bc i cant figure it out! help plz
0	Is wonderin if she is the only one left in Valdosta due 2 birthday bash and the Greek picnic back home!!!!....  not cool!
0	is wonderin why he's so freakin busy these days
0	is wondering  y the sun has gone away
0	Is Wondering How Is
0	is wondering how do you update plurk through cellphone bah?  http://plurk.com/p/rooj4
0	is wondering how hard it is going to be to get an appointment at mayo. im sick of being sick
1	is wondering how he is going to keep up with all three (myspace, facebook and twitter)... mm a challenge 
0	is wondering how he will get on doing the london to brighton bike ride having had no practice and a bad chest infection
0	is wondering how i always manage to get myself into these kinda situations....seriously.. All the tyme
0	is wondering how I'm gonna pay the rest of my bills when there's no more money in the bank account.....
0	In need of some serious bengay...ouch! And some fooooood! I forgot to eat yesterday!  Lol.
0	In need of stimulation and entertainment
0	In neros removing all old saved messages from 'him' from my phone at last. Hopeless romantic i know but the words  seem kinda hollow now
1	IN NEW HOUSEE!!
0	IN NEW ORLEANS@drakkardnoir TOO BADD IM NOT GOING
0	In New York City and kinda freaked out  lol  Michelle~JM09
0	in new york city till tomorrow morning  wish i could stay longer
1	in new york cityyy  meeting up with friends laterr <3
0	in New York without     Life sucks this way
1	in new york! YAYYY
1	In next in manchester
0	In NJ for father's day and it is raining buckets. Can't the weather just give us a teeny break for the dads?
1	In no circumstances do I hate you  ...
1	in Notre Dame with Belinda
0	In NYC at firm offsite.  Readjusting to humidity
0	in nyc where the internet is expensive  back tuesday
0	in odd saddened state of shock, grandpa passed away 
0	in Office again..
0	In office and working after the marriage ceremony  need to head home and crash ASAP
1	in office now with a BIG smile. The movie "A lot like love" is happening to me again! I'm just gonna enjoy it this time around
0	in office now...trying to sort out 10000s of credit card statements
0	In office on Saturday... Yet again
1	in office working.....might be surfing web as the same time
0	In office. Feeling veryyyyyyyyyyyy sleepy
0	In Ohio again! But going to go west soon   I'll miss Ohio
0	In Ohio. Ate too much again.
1	in ohio. heading back to rochester in a few hours. not missing the students
1	in ohiooo for the weekend, 9 days till California 
1	In omaha at a random carnival  live music and friends WOOT
1	In on a Saturday to print  shirts and keep packing up all our stuff.. Moving on Tuesday!  Need a shirt.. We've got some.. www.cdtees.net
1	in on school hangin with friends yay
1	In one day...got a lot of work done, got to see brother and nieces, long phone convos with one old friend and one new.  How sweet it is. 
1	In one hour, I will br brace free! =D Expect Pictures! 
0	in one of those gloomy moods   dont feel like doin much . Almost feelin sorry for myself but tryin to remember people have it worse th ...
0	In Oregon and have been enjoying my time.. but I'll be coming home tomorrow, sad I'll miss my sis 
1	IN Orlando till wednesday
0	In other Apple-related news, my new MacBook Pro has shipped! And of course it gets here on Friday morning, right before I go out of town. 
1	In other news my solo debut EP is being released for free d/load today!    follow for info.Today i am mostly nervous excitement.
0	In other news, days like today never last as long as I want them to. I hate this situation sometimes  Time for vino & WW to cheer me up.
1	in other news, ez link card was found and returned after 3 days. praise God 
0	In other news, I ate too much cake 
1	is wondering how in the heck her scalp ended up burnt with all this hair??? Oh well the sunscreen did its job and what a great pool party
0	is wondering how it can be very cloudy when it has been lovely the past few days
0	is wondering how long Gossip Girl will last once they've all left school
0	is wondering how long it'll be 'til she's even changed colour
1	Is wondering how many other ppl her inlaws annoy with all the twittering.  <*GRAIER*>
0	is wondering how many times I can get dicked over before I just give up. I'm seriously at the end of my rope tonight
0	is wondering how much longer she can manage with no food, no sleep, and lots of crying and stress 
0	Is wondering how much sorer my knee can get before I cry!
0	is wondering how ppl do long distance  relationship. I need physical contact.
1	is wondering how the academic world would respond to a group scholarly paper created from Tweets.
0	is wondering how the inside of her nose got cut...I am not a big fan of this
0	is wondering how these competetitions work, I dont want to over spam my timeline anymore #trackle #squarespace 
0	Is wondering how to make things work
0	is wondering if Andain will ever release an album! I've been waiting for years now!.
1	is wondering if anyone has any Nintendo Wii club points (card inside Nintendo products) spare. Message me please if you do  x
0	Is wondering if he should go back to quacks (but REALLY doesn't want to) foot is still bright red & sore 72 hrs after penicillin started
0	is wondering if her hubby is dying in this heat? poor guy
0	is wondering if it is possible to write on therealbeach's post thing, but i dont think so  and random people are following me ? :| :o
1	Is wondering if Lilli is going to sleep all day
0	is wondering if losing half a stone didnt make me shift a size...wtf will?!?!
0	Is wondering if the deployment will go by fast this time....  Hard to not think about anymore... especially at night.
1	is wondering if the end goal is worth this 1,500 calories per day nightmare I'm going through  .... making weight SUCKS!!
0	Is wondering if the insane is possible, though being scuppered by a website atm. "File Not Found" & "Gateway Timeout" aren't helpful 
0	is wondering if tomorrow might not be his last as a travel soccer coach ... they grow up so fast
0	Is wondering if/when I'll ever have a happy tweet.
0	is wondering wen this rain is gonna stop
1	is wondering what all this twitter stuff is all about...
1	is wondering what it would be like to become a Snow Crab fisherman- oh I know how to find out- DEADLIEST CATCH- yet again
0	Is wondering WHAT THE HECK is going on with her tummy  don't feel good.
1	is wondering what the heck to do with this... and is craving chips and salsa.. mmm
1	is wondering what to do with her first day of freedom
0	is wondering what to do with the laptop on life support at home, while on a trip to San Angelo. I guess it'll be a lack of internet. 
1	is wondering what to do, chill out watching One Tree Hill or see if there are any hidden treasures on the T.V, listen to music or read!  x
0	In other news, I just found out my wife may not be back a couple days   I miss her
0	In other news, Juan Carlos lost yesterday in another 5 seter  but is though. Good luck as always Andy.
0	In other news, like a jackass I did gardening in a bikini top.  Now I'm still translucent on the front and lobsterized on the back.  Ouch 
1	In other news, submitting awards for Carrot Creative is really rewarding. Doing lots of fun stuff & proud to write it all up. 
0	In other news, why must the Distant Worlds concert take place before I get more vacation time? Why? 
1	In other news, ZOMJ BACKGROUND!  Shame you can't see Sammy, but I assure you he's hot. 
0	in other news. myka leaves me in 12 hours and i'm sad about that.  i will miss her!
0	in other news...learning the hard way not to give myself a haircut
1	In other news: Oobleck went down a treat with my Neice, as did the making of playdough  Much fun was had by all :-D
1	In other non-orange smelling shower news, the bank-job was also a great success! I now have a tiny bit of money to spend!! 
1	in other words, I can enjoy the afternoon 
1	In over my head.... Right where I want to be.... Where Gods love always covers me.
0	in oxford and just ate at jamie's kitchen.... but where the hell is jamie oliver
0	In Pa. majority of the dayy with the fffaaaavvvvssss...can u say.."One random ass day..."...i kno i can...{{will b missin' my Bubba  }}
0	in padre. about to load up the bus soon  imma miss this place
0	in pain  laying in bed with a heating pad, watching the graduate.
0	In pain  sucks
0	In pain after a simple medical procedure...
0	in pain just got my 2 wisdom teeth removed
0	in pain. had surjury friday.  missin my gurl friend..
0	IN PAIN. my big toe got stomped on during the hokey cokeu. it's throbbing. anyone have any suggestions to heal it?
0	In pain. Sunburns really hurt.
0	In pain. Us poor women.
0	in pain... and sun burnt. every part of my body is killing me.
0	In pain....my tummy is cramping & my legs are sore.
1	In palm beach for NSCRA!!
1	in Palmdale CA and it's time to get up and get the caches
1	in panara bread waiting 2 get an upgrade  2day gets better. i graduated nd im gettin a new cell
0	In paper cut city...clicking my red heels, wishing I were home in bed 
1	in Parc now, some air pressure adjustments and that's it. Phil got asked for his first autograph. 
0	In Paris and already planning a return trip when I'm not stuck in the hotel doing hw
1	In Paris and picked up by limo too  Lovely hotel with the biggest bed I've ever seen! Going out for a walk to meet the Parisians!  xxx
0	In Paris for the weekend. It's raining
0	In Paris june 2,3,4 will spend as much time in the plane than there 
1	in penn estates Troi'sss house...jus woke up
1	in perth with bronte, laura and caz  just went shopping xx
0	In Peru is 3:43 AM and i haven't finished my homework yet
1	In Philly for doves concert! Just arrived!  off to jims steakhouse!
0	is wondering what to have for lunch... Sianz....
0	is wondering when he will actually get to work on his psychology work.
1	is wondering when he will have some good luck
0	is wondering when he'll find that special someone
0	Is wondering when it is ever going to stop raining
0	is wondering when it'll get easier dropping little man off at nursery. 2 years in and still tears from both of us
0	Is wondering when the suns coming out again
0	is wondering when this is all gonna stop!! hopefully soon tho, its killing me 
0	Is wondering when will he actually has his friday off?
0	is wondering where all the tall guys went...
0	Is wondering where lauren is.
0	is wondering where my bestie is?
1	Is wondering where Sally have been at Wirtschaftrecht???!!! BAD BAD GIRL
0	is wondering where the eff has mauri23 been
1	is wondering where the meeting place will end up being...Vegas? Napa? Ny???
0	is wondering where the summer's gone
0	is wondering whether or not it will rain tomorrow,,,,  nothing like a henna tent in the rain....
1	is wondering who came up with putting an i in front of Phone.. And why is the P capitalized in iPhone?... Hmm.. Mind boggling.....
1	is wondering who else is goin for urbanscapes
0	is wondering who sent him a video message. Can't open it
0	is wondering why and are not replying to my tweets!
0	Is wondering why a two year old has better vocabulary then me!
0	Is wondering why Alan doesnt love me
0	is wondering why everyone in her house is in a bad mood?! Going outside on the beautiful day...to study.
0	is wondering why facebook won't load
0	is wondering why he is hungry. Then with a bright yellow bulb lighting up on top of his head he remembers, "I haven't had breakfast yet." 
0	is wondering why her mood keeps changing so quickly
0	is wondering why her shoulder still hurts
1	is wondering why i always get myself in these situations!! I know im smarter than this crap!
0	is wondering why I cannot stop watching this clip of New Moon!! The movie is done why oh why do I have to wait until November
0	is wondering why i keep watching creepy things on the internet when i know i'm not gonna be able to sleep
0	is wondering why it only ever rains when i have to venture outside
0	Is wondering why it's always warm when she leaves London in the morning & freezing when she gets to Woking
0	is wondering why it's IMPOSSIBLE to find people on this damn thing. Twitter is gay
0	is wondering why it's IMPOSSIBLE to find people on this damn thing. Twitter is gay  http://twurl.nl/rwlzkv
0	is wondering why my name is earl has been cancelled    lol
0	is wondering why no 1 is following me
1	is wondering why people care what he is doing in the first place
0	is wondering why ppl waste so much food when the world is starving??? really really sad
0	is wondering why she can't change her profile picture  o_O i dont look like thaaat
0	In philly on the way to DC. Wish i had time to go to china town and get vegan sesame chicken.
1	In philly with trio<3
0	in phone-choosing hell and my contract doesn't even expire until August. damn you Sony Ericcsson Satio, Nokia 96 and HTC Touch diamond2. 
1	In plane on my way to texas
1	In plymland again 2nite for Katie's 21st!  Happy Birthday luv  X
0	In pool med waiting for
1	In Portland Oregon and it was a magnificent sunny day...
0	In Portsmouth now. Off to bid a final farewell to my Grandad...
0	In Post Office queue
0	in prague. sobrang ganda.  at miss sophie's pink grey and white hotel room <3 air - photograph ahhhhhhhh <3
0	in preparation for the new iPhone/iPod OS release, i think i lost some saved files for good. 
1	in press room yet again, enjoying a cup of free coffee 
1	In Primary Colours, shoegaze in reborn. Scarlet Fields. 
1	In process of selling my orange beaded pickup truck. Will be sad to see it go, but happy it is going to London & to someone I have met! 
1	in process of uploading all my Sharon photos, will let u all know when available to see 
0	in product design in the dt computer room writing my specification its so boring
1	in psych with Muffin... yeeeeee
0	in Pueblo at a NAIFA meeting. working late on Friday
0	in queue for autograph. Its freezing! We are semi open air
1	in r.e with kimmy!!
0	in RaLeigh, eating BojangLe's with Jeff ;-), getting ready 4 the baby shower. I miss him 
1	in RE Huts tis now  waiting til second period so I can go to accounts ;D
0	In really deep for the calorie count tonight. My new "diet" isn't going as well as planned. Will have to burn 900+ calories tonight!
0	In recovery... kind of missing him arrgh
1	in reference to my application to whitewater, "No To Do's."  
0	In regents park, boy it's hot, warm and sunny!! But the wind is not letting us play frizbi 
1	In relationship with ditto darlan
0	in Religious Studies class about to do our  group presentation ... ugh school/finals all weekend
1	In Reno at the condo
1	In Reno/Sparks Nevada, in the Holiday Inn on Nugget, WOW! Nice place!!!! 
0	In response to an earlier blog, I only lend in Illinois 
1	In response to tweeps, If you are interested in receiving my band's semimonthly newsletter (I sing and play keys) please DM me your email 
0	In resting mode after last night ;) I'm disappointed..
0	in retrospect, I should've just gone to bed.  goodnight 4:40am
0	In RIO without my bb
0	In Ripon, WI and missing Madison! 
1	In riverside wif my daddyy.
1	In Rodanthe, NC, staying at a beach house with some family..fun times 
1	In Rome! About to take a night stroll through the streets of Rome
1	In route to Liars Club to hang out with the guys
1	In Rugby watching Dark side of the wall, a Pink Floyd tribute band. They are very convincing I reckon 
1	Is wondering why some 'mates' continue to be toss wads. What good does it do? Meh. Goodbye Sydney. Bring on Melbourne.
0	is wondering why someone looked a "something" up on youtube???
0	is wondering why the microwave just stopped working...bummer
0	is wondering why the music on Webster Avenue is louder than her own TV in her apt...I guess I'll be listening to Spanish music all night
0	Is wondering why there are no whales in Hermanus when my parents flew from so far to see them
0	is wondering why there are TVM vs Kochi debates everywhere?
1	is wondering why there is never acqualta when I'm in Venice - they should pay me to be there
0	is wondering why we only get the OK magazine 2 months later...?
0	is wondering WHY.
0	Is wondering y I can't find a summer job? Depressing how many apps I filled out n received nada in return
1	is wondering...ghetto or gorgeous? what would YOU pick?
0	is wordlinx okey now...
0	Is work, work, work, and no time for fun  man summer's used to be the best time of the year!!
0	is workin tonight and ive still got the damn flue. How do i get rid of it?
0	is working
0	Is working a late one tonight  won't b home till half 7/8
1	is working all day-- next day off is sunday  yayyy
0	is working and bored
0	is working and fretting that her hubby is going back to the homelands for 2 weeks - who will look after me?
0	is working at planet smoothie all day...wishing I was at home planting flowers
1	is working at the Best Workplace in Europe  http://bit.ly/TfYLy
0	is working away, silly me forgot to bring a new tub of sugar to work so i haven't had a cup of tea today  booo!!
0	is working but sad after learning of the death of a colleague,aged only 52 
0	is working early in the morning  then studying  then writing a 6 page paper  THEN GOING TO COLORADO =]
1	is working from 10 to 2 tomorrow morning so keep me sane by texting me  good night
0	is working from home but wishing it was 'home time'
0	is working from home today and is not being very productive.  #fb
1	Is working hard at hollister ....
0	is working hard for no money  I need to negotiate better!
0	Is working hard today!!  Kinda wish i could have stayed in bed though.  I hate having to get up on cold and dim days.
0	is working her last week in the Sears Tower.
0	is working in a server room where the air con isn't working properley on a hot and sunny day - not nice!!!
0	is working in it-should-be-a-holiday..
0	is working in office...
0	is working late
0	is working late tonight again
1	is working on a "Banner" for a Photoshop Contest!
1	is working on a cup of joe and what to work on today! Clean, clean, clean is the name of this game  http://plurk.com/p/rd943
0	is working on a sunny sunday.
1	Is working on a translation template for web content.  Soon www.lightalantern.com will be in loads of different languages
0	is working on art isp's. god, what a fantastic torture device... 
1	in rye..happy mothers day mums  ily mummy  lol
0	In San Antonio, TX. Just got news this morn, wife was arrested last night for DWI. Life just keeps getting better. 
