1	tell me when!
1	I'm on my blackberry so can't listen to the link but if it's shattered dreams ur right!
1	My pleasure, you are worth it  
1	Thanks, you do the same! 
0	I WISH! omg it's so sad
0	I just got home.  Our circ system was down all day yesterday, so it was all hands on deck today. We're almost caught up. :/
1	I'm excited about it
1	my pleasure  I hope that you get a few more signatures through my link too
1	No problem, Jeanne! We all gotta support each other, right? 
1	yeah, being sick on any day sucks; but on your birthday is the worst. Lucky for me I had a great guy who made it great 
1	<3 awww i miss you too!  enjoy your night!
1	All that beautiful people partying late into the night, no doubt. 
0	semester and no...I'm slacking on exam 2...heee hee...see what happens when you don't scold me!
1	Thanks for letting and use your photos, and for posting them on Facebook.  #anuheatheft
0	will do sorry to hear dat   what's wrong?
1	what time?! because we have finals that whole week and we only go in til 11:30 to take them...
0	4real? Dam I'd say go to the store and get some maximum strength hydrocorisone cream Its strong and medicated hope it helps
0	 Ouch, that's a rough time change! I'm sure it will take a few days to recover  I liked your pics btw!
1	ouch! I take it your feelin the burn 2day! No pain, no gain as they say  Once u get over the 1st few hurdles youll b fine 
1	Star Trek at the IMAX that would be so awesome!!! I hope that they show it here on the IMAX sometime. Just seen it yes2day
0	You haven't been around any people who have been to Mexico, have you! 
0	lucky you get to hear the angels lol. Will we hear JJ sing clearly this time? lol in NLt is was always backup
1	yes, years ago 
1	Yeah, sure. 
1	especially when he speaks with his natural accent... I've always had a thing for a guy with a british accent. *sighs*
1	Can't get enough
1	You're a veggie too? Cool. Please share a few.
0	susah nyari yang banana, mesti di carrefour cilandak 
1	and now it's figured out!    not you will know what I'm up to (watching House reruns for a bit until I go to bed...)
1	thank u, Jean. Am glad to see you all after so many months!  rocks!! Sorry for been bad host, too many ppl! Fainted*
1	mornin Jean  it's just 18 days left of school ;D;D;D
1	yeah, I suppose. I really dig Robin's character too  and the show overall is awesome too!
1	And I do it daily ...particularly today.  I know this is hard to believe  but I am 72 years old today.   HA
1	yay you  did you have a good day out ?
1	you should check out the web site 8ball.co.uk got a few good friday the 13th t-shirts on there & other geek t-shirts
0	aww I know who won. Not too sure I agree
1	sure  thanks a lot!
1	Nahh, I'll do it too. I love tweet spamming 
0	yeah... in the 1st, i thought the ending was forced,... turns out all the books miss out on fights/deaths/love scenes etc 
1	 haha AGREEED!! def does dance it better and i totally forgot joey did that  haha joey n joe dance off. joey wins
0	take all the rain you want. I don't want it!!!
0	please tell me your joking  let's go babe! Haha I have a blue eyed adorable brunette waiting!
1	Good, thanks. How's everything going with you? I'm off to work  Hope your projects are going well.
0	Not going according to plan much?
1	 good plan. I hope it does all work out, though. It makes me happy to think of you being able to zip about at will!
1	i will after my dinner  the brother is gettin a french stick at sainsburys so i wil come at lyk 2ish?
1	I think it's worth it. We'll definitely be back to The Lingnan #yeg
1	miss you! Baby come back lmao I'm still with Johana
1	At the muse? What's that?
0	 Chelsea is also sorry she left you in silver lipped glory
0	 its almost your weekend, loverpants. Wuuuuv you! (And think its totally acceptable to twitter at soupplantation)
1	You're awesome
0	awww I wish I could have been there  I'm stuck here about to jab out my eyes with knitting needles
0	I caaaaaant. Gotta paint!
0	Me too... but thats not the life thats meant for us right now
0	Swimming is a no go for me
1	guuurl I think you may have a plan  hit me up post game, we'll talk!!
0	FUCK you guys for going without me  I have been dreaming about it all day.....
0	CONRAD is gonna be signing books tomorrow at the mall of america and i can't go!!!!!!!!!!!!!!!!  i'm gonna die.i'm gonna die.
1	no for a dance show
1	OMG!! Lauren Bacall
1	fixed it!!!!  what did you do?
0	hey! are u on twitter? im the only one on rite now
0	I don't know how to pronounce them  I'll get Amy to help she did french lol german swear words are easier to pronounce
0	has a sloww laptop and the c does not work
1	- Not a prob  Congrats on the new pad!
0	i didnt know you had it!  im sorry!!!
1	dude i cant wait till you're up here and we can just walk around downtown & the SU hill
0	& I'm already getting a taste of what it feels like when you guys leave the country  once is enough
0	wow, thank you  have a nice weekend anyway
1	why limit your story to 140 ch. Tell all what is annoying you at www.iamsoannoyed.com
1	aaah I love Munchy Boxes
1	Oh I might consider changing to divs then. Thanks
1	ok no problem nothing worse when folks do that, I hate it....yeah it was my weekend of heaven racing all day sunday 
1	Space Raiders dude, Space Raiders. The cheapest and Tastiest snack known to anyone sane 
1	That so sounds like a Viz 'top tip' it's not true
0	whcih you could stay next to me
1	I use jamglue.com and download straight from the internet. You took a whole 48 hrs to twit a nigga back!!
1	I learn a lot from my daughter...
1	Hi Jeb, got the software name? Wud luv to know that too! Cheers 
1	How's the move-bustin' coming along?
1	I'm neutral on result but... would love to see a Game 7
0	told me that barefoot gypsy has "moved on from twitter"
1	Since ACLU I have been trying to figure out who you reminded me of...and I finally remembered! You look like Jacob on LOST! AHA!
0	YOU'RE SO MEAN. When I go there this sept, I WILL WATCH EVERY DAY. 
1	you're watching it right now too? LOL yeah this game is ecstatic!
1	foreach by byl ide�ln�
1	fanny pack, I mean bum bag, either way they both sound wrong 
0	& FYI...that suuucckkks! (bout the carrrr)
0	Sorry I couldn't deliver food for you.
1	As long as I keep drinking blood, i should be okay... 
1	LOL, whenever i see FFS, i think 'for fuck's sake'. naturally. but thank you. thank you as well. 
1	real artists dont use rulers. Draw a boomer
1	As in, you can do more   Like, drag things around properly and little things that you can get in normal progs but no online
0	it's always a shame when the good local places close  4beans is on Randell/Wilson next 2 Tacobell let me know if u ckexk it out
1	Did last vote 4 night, if still in mornin will try again.  U guys are all ahead of  did da ladies & funnies 2
1	Hee-hee! Thanks! Hey, have you seen my comics? http://officialmidge.com Be sure to read about the #pawpawty contest, too! 
1	thanks for #teddytuesday
1	heh very fun there. I've known a couple places having themed conference rooms like that.
0	Your face makes me cry
1	Have fun! I have never been to SC but I have been to Southern NC
0	wait what, that makes no sense, and furthermore, I have no money 
1	forks <3 gotta love the rain
0	 yes unfortunately  I was expecting something else... you got me
0	Yup. The whole game was amazing technically, it looked great. Gutted I sold the game and my original Xbox now actually. 
1	definitely good to get ahead if you have a heat pump or something in winter.  it's how I'd RATHER be doing things.
1	how much stuff did you lose? I recovered most of my stuff from the mac mini HDD when it died. it can be done
0	not so far, that I'm aware of. Just assignments - two of which are due tomorrow morning. Not well staggered between units. 
1	if your looking for some edward pics theres some on the spin website.
1	I live here like Jack lives in tennessee  figure it's as comfortable a home for my words as any, and suitably disjointed
1	Concert is on the 8th Aug. i *CANNOT* wait! We are gonna have fuuuun!!
0	  i kinda miss working there.
1	thanks doll
0	you can at least be nice about it meanie.
0	yeah! no babies yet  poor jessie face! 15 hours almost!
1	 Glad to see you on the tube this morning.  FYI...The Black Eyed Peas song lyric is "Boom Boom Pow" not "Boom Pow"
0	ahhh no no! knock knock on the wood! haha, dont speak of funerals  but i will be there if anything happens x)
0	im so pale too  i used to get tan A LOT when i was little
1	As for biz just try and learn those chapters really well so you can get full marks on the questions you know. Hope that helps
1	My two sisters and I are Caspar's cousins, the sun doesn't tan us, it bleaches us! 
0	WTF mine just did that sleep shit and it made me log back in and now my effin thing didnt save so i have to start all over
1	awwwwww hope your ok
1	happy birthday! i love you! see you tonight
0	hey we need to talk ichat later?
0	at least they cover you...my insurance is claiming preexisting conditions so i get to foot the whole bill for $300/mo ins.
0	i cannot beleive were being split up in forms
1	You're welcome.
1	i like it so far
1	ur on twitter!  everyone was talking about you at work today; still hurtin from shovelin that there gravel yesterday? lol
1	yay! She'll forgive you later. I hope she continues to get better.
0	wish i could be there to celebrate with you today  but saturday will be here soooon enough lady! party time party time!
1	have fun at the MTV awards
1	I think you look really nice in the one you have!   Have a great day!
1	it was sweet you and everyone eles were so pretty
0	I wish I knew why your life was redic.
1	Hahaa, L-A-U...'R-A whatt?'....Noooo L-A....'sorry start again!' Hahaaa 
0	this makes it sound like i did something wrong.  i'm not even part of that race man!
1	I'm decenttttt. Just listening to Kelly Clarkson. Relating to her lyrics  What about you?!
1	Brighton is good in the sun, other than that I've never really cared for it to be honest. Not sure why  Ja! Moving to KBH 
1	louder could work  ahaa
0	 I can't seem to get the links for the stories of the shirts to work.
0	nothing to be said... Just nothing.
1	Eh I dunno, a friend brought it to my house so I'm not sure what it actually costs now. 
0	i cried so hard after UP    and all during...
0	It's very discouraging and sad   I've only gotten one call to even go through in the last two weeks.
0	 Rob Thomas & Prince best male!! Female.. Don't really have a fav
1	 nice to meet u !!! ;) where are u from boy?? kisss
0	http://twitpic.com/6eer1 - ohhhh man.....still weepy, yikes!!  I'm so sorry 
1	hi there mike! guess who just arrived in twitter world!  ME! is it ur worst nightmare??? :K
1	YES!!! Best picture ever!!
1	ahh I see. Thank you.
0	 couldn't make it. Sad
0	oohh nice....I was just wondering though.The missus won't let me spend ACTUAL money!!! She only lets me have monoply cash
0	i'd adore diversity or stavros flately to win, but i find it hard to believe Boyle won't win 
1	great voice!
1	thanks for letting me follow you
1	wow! bold and curve?! nice..
1	Yes thanks a lot just a sandwich for now
1	bahahah 69 followers. well thats a bit awkward
1	lol its on the 17th
0	ohh i forgot about that  what time did it start?
0	you don't realize how jealous i am. no one would take me  and i wasn't allowed to go see them  my life is ruined !
1	We've had an office since April  WE ARE LEGIT, JOSEPH. I AM CHASIN MY DREAMS.
0	 sorry the hear that mate...
0	wheres my motherfuckin comp tix  no love for the jolz
1	about 8.15 (ish)? i'll tweet when i find out more!
1	Err yeah...me too...can we sue ?
0	how are U robot boy? caught up on yr tweets - 3 day stretch sounded bad. hope SF program going well4u. Sydney raining  miss B,CO
1	did i name any side - both BN and PR people accuse the govt is in denial and it was the fault of the press not reporting it
0	oh, you were forcing me?  bully. urhm dunt mind really, nothing too expensive x
1	the full trailer is gonna be shown during the mtv movie awards tomorrow night.
1	Wore mine for like 7 hours and mine didn't hurt.  lol.
0	 You're making me hungry.
0	I know it's sad. But back in 05 the auto industry didn't understand that iPhones would change our lives
0	I hate you and your ability to play golf when I'm at work.
1	Get 100 followers a day using www.tweeterfollow.com Once you add everyone you are on the train or pay vip
1	dat klinkt erg enthousiast
1	hahah  well maybe not, but it is still very early.
1	Interesting contribution but more importantly congratulations on the arrival of Poppy
1	Congratulations!!!!  So seriously no pushing at all?? Wow! I'm so happy for you!
1	glad we got to see you, too! We have GOT to hang asap!! 
0	 Am gutted you are leaving the hills!! Won't be the same  xx
0	- are you in NYC? Stinks that your visit had to be so rainy  it's been like this for weeks!
0	 Awww Take Me Take Me Lol  Sick Of Old England Not Leaving it Til December  Soo . . .  lol
0	- hey , why r u leaving the hills, ?  
0	- LC tha best hills star ever!!!! i really hope u make a couple stops in on a couple people, would be really nice.... 
1	 Lindsay H. Frucci- creator of "No Pudge Brownies"
1	 Thank you for the glare down at kristin Cavallari at Heidi's wedding
0	, very bummed !! I live in CT and there was no audio!! 
1	are you doing a book? if u do, can I buy it in Sweden? and what is the book about? 
1	audio was in and out the last 20 minutes in hamilton, ontario.. we just turned it WAY up so we could hear. i'll miss you 
1	aww.. the last epsode was pritey sick no lie Lauren. hope everything works out for you.. best wishes from me
0	awwww, i want your book 
0	can I travel w/ you?
0	dang i missed it  glad to hear it went good
1	do the standard trick suck it in and jump into the dress
0	Dont want it to end
0	go back to the hills, lauren! 
1	gutted that you're leavin! The show has been awesome and I hope Lo is your successor!
1	have fun  sad your not doing "The Hills anymore" wont be the same without ya x
1	hello!!cool that you vere soon
1	hi LC. Hope your having a great time at the game
1	http://laurenconrad.seenon.com/ I love the dresses you are amazing Lauren
1	http://twitpic.com/4wh4d - LAUREN is AMAZING....well from what I see on the hills lol  Seem like a great friend to have!!
1	http://twitpic.com/4wh4d - this is a very pretty picture
1	http://twitpic.com/5c46l - hahaha... I was there!
1	http://twitpic.com/5c46l - that's Cute  ilove U!
0	http://twitpic.com/6otml - awww i want one with your signature !!!!
1	http://twitpic.com/6otml - fancy coming to England?  XOXO
0	I can't believe he lost... I'm so sad.
0	i cant believe you will not be on the hills anymore
0	I cant believe you wont be on The Hills anymore  Cant believe that the end of the finale was messed up, couldnt hear 
0	I can't belive you only have one episode to go  xx
1	i can't wait to get a copy of your book  your the best
0	Paris & London. I am so jealous. No parents allowed  As long as she raises fundage, it's likely yes..
1	goddd I could watch those vids and laugh for hours lmao
0	I can't hear you on ustream.tv  sorry, I won't watch then.
0	i wish u happy birthday... but i cant come im too far
0	mike I got kicked from warlock fir no reason
1	Oh No! What ever will he do now
0	Thanks for letting me in on your game yesterday.  I would love to play again but I was lagging too badly.
0	Not much luck finding 80's stuff today   Will look again tomorrow...
1	were going to get snocones.....they are way cooler and you dont have to wait for happy hour!
0	Sori nope. I watch online.
0	ugh, that article is misisng some important pics 
0	Calgary's zoo stomps our Zoo  The one thing they have thats better than us.
0	snow?? Poor you
1	I have so much desk space now  never really used the numpad - though suspect I might miss the delete key!
0	dan she dissed me  lol
0	Hey! NM resting im not feeling well
1	btw, if you grill all the time. or almost, check out blogbque.com - wld love a guest post - get going 
1	hey how are you today ?
1	it was put on by our neighborhood, so just a little one. Like 25 runners. I got 1st place, with an okay time. I was happy. 
0	heheh awwww did u drink alot?? - if it makes u feel any better im getting my wisdom teeth removed today AND i havent slept yet
0	well City Car Share took my pod away, no more car in the garage for me 
0	sorry to hear your days have been less than awesome  i hope your weekend kicks the ass of all your bad days!
1	- No, no contact, unless I missed the call...  Thanks for passing it along though! 
1	check out the new site: http://two24studios.com
1	love that Blink 182 tribute
1	 amen ! not 2 race  there ? More short tracks
