1	LOL!!! Yep!! I still have those, How did I get here moments-she just laughs at me 
0	NO!!! R U SERIOUS???
1	thank you darling
0	yeah me too! i think he'd have more success with that, but oh well  i guess he's doing what he loves
0	Awwww man. I'm in route to the valley.
0	yeah but i never was able to register as a grad so i wont be recognized  sad day! But I'm still going
1	Greece scored quite high for the camp man jumping about showing his nipples and dancing on what looked like a big stapler
0	i had to request it! i was so confused about it the first time i thought doing it again might help. it didn't
0	HAHA what a nice message to get lol. Yes i want a slize of pizza, save some  ? I hope ur grandma's not2sad 2b leaving  x
1	I so wanna see it!! I wonder how short u got it!! I'm really excited haha  *dances* xoxo. I love you so much sexy pooh bum
1	YAY  haha u good girl *pets head* xoxo 143. xxx.
0	cuz it was raining and my friend didn't feel like driving anymore  i missed my boo's party
0	Good luck with your little ratbag. Def call a doctor or nurse and let us know how you go! Worried about you all now!
1	Love to.  He supports bi sexual women. He's dating me, after all. 
0	lol romy! He was like 2 years old! But his mom kept pulling him by his arm all rough...ugh
1	are you ok??..I know its not really any of my business but I'm here if you want to talk to anyone
0	I knoww  & My poor hair, I'm pissed. Where were the showers in April, Mother Nature youre 2months late b*tch!
1	thanks for the #followfriday shout-out, and back at ya! I hope you're having a great day. 
1	A series of books
0	awww  lol put a pic up plz!!!
0	awww poor Tyson  ...You should post pics!
1	cann u c0ongraduate mii please!!!!
1	can't wait to see u on Sunday at summer ball!  x
0	Cavs down by 20 3 mins left... just in case u arent watching.. its over for Lebron
0	Ciara are you gonna tell us whats going on? is 'like a suregon" coming before "Work" i really want "Work" to come
1	funny pic, ci 
0	Goodbye CiCi.  Come back soon! London misses you!
1	great job tonight at the O2, loved it! 
1	have fun Cici  hope the concert was amazing^^ will u support Brit on her concert in Germany too? hope to see u there then*
1	Hey Ciara. Please come to Germany for your tour! I will finally see you on stage!  *Ciara To Tha Stage*
1	hey cici showing much love! follow me
1	Hey cici! Good morning 4 u 2 ;) i hope today is THE day!  good luck 4 another amazin show! but above all: have fun girl
1	hey! how did the concerts go? and ur album is amazing !
1	Hey, just watched tha Kiss Concert SC.Com Posted, yu did great performance, really enjoyed it!! 
0	Hey..how come you werent supportin Britney last night in Manchester?..i was excited to see you perform  x
1	lmao! that is why im sending myself off to germany if them tour dates are true!
1	So i paid £15 for 5 days worth of net! haha so yeah im sure i put pics up tomorrow!
1	I'm laying on the floor listening to backstabber
1	haha,thank u! sorry for the delays...a lot going on at the same time 
1	he cud have ACTED mad...that shit aint hard to pull for Em...actually,there's very little thats hard to pull for Em! 
1	I pondered just laying down and sleeping the head wound off.. is that bad?
1	is the fount from which all bastards are spawned.  Just thought you should know
1	I know! The worst part is it's all being scrobbled to last.fm!  #Spotify #GuiltyPleasures
1	Wow! You really cleaned our aquarium? Bianca and I will love you for it if you do it regularly. Thank you so much, brother 6! 
0	what about me  LOL!
1	6 more months time is ticking  homie!
0	#nicerfilmtitles The Towering Infernyes. (sorry) Star Peace Treaties: Pyjama-Party of the Clones, Gums, The Exercised 
0	heck no! It won't be the same without her
1	thank you very much for following me back, have a great day too 
0	- ughhhh I'm trying, I can't sleep!! Lol, 
1	Thanks for the #followfriday
1	You're welcome!
0	oh dear  not fun
0	sorry I've been mia with my phone but its all fudge up  miss you! hope ur feeling better
0	 grr that sucks....we can talk on here right?
0	did u really stay up so late for me???? i feel awful now
0	yea..u should never actually get up in the middle of the night unless u gotta pee..I can never get back to sleep
0	honnestly I'm not going to miss the Janitor as the show was seriously loseing its tracks in seasons 6, 7 and even 8 
1	sounds like a good day to me! I love Target
0	kh�ng th?y ? ?�u l�m blog ???c Joe ?!
1	 yes it is great, you should upload some of the shots so i can see the quality 
0	ouch dave  that hurts
1	i wish i could be a billionaire by 2011
1	You know i'm ALWAYS DOWN with YOU, & YOU ARE A STAR! ;) You are my sunshine 
0	u said u were a good driver, I said me 2 using the logic u used... get it? kinda? now im kinda lost 
1	I LOVE it, Thank u! Luv the different mood-spin urs & Gary's version of Just Dance has.  Do u work with Gary often? Chloe x.
1	Umm! Gemini is  lol
1	I #lovesouthafrica !
1	good luck young man, keep us updated with your success 
0	I asked if we could stay later for the concert...no go.  I'm at home.
1	http://twitpic.com/50vrw - Beautiful As Allways!!  Goodnight, Sleep Well!! 
0	I heard that supernatural and click flash didn't make the cut on the final product.....why Ciara why?
1	I know your gonna kill it on the tour C, it's gonna be AMAZING, I can't wait!!! 
0	i misss youhhhhhhh ci! Tell dem japenese ppl to give yu a computer or sumthinnn. Ya twit fam misssesss supa c!
0	is it true your not supporting britney at manchester tomorrow?
1	make sure you come london on your world tour!! i can't wait  xx
0	the links to your website on the side don't work  Good luck tonight x
1	we're at the concert now; and you just said tweet you so here you go!  xoxo
0	yeey! i read about that a few days ago... i'm so happy 4 u! i wish i could be there with u and britney
1	Night Princess Q
0	i knowwww  but no more for a whileeee
0	 I envy u right now! I'm stuck at work
1	We've had fun, but I think that we are all worn out.  It will be great to sleep in our own beds tonight. 
1	hi bestfriend!!!!! I hope you enjoy your college life!!!
0	awww, what accident? 
1	I think she's too brash and rude for me. But that's prob for an issue for me.
0	so i have a story to tell you but twatter wont let me tell you bc apparently its too long of a story.  stupid twatter.
1	welcome to twitter Gabby  now we can talk on the phone text ND twitter at the same time lol
0	 feel better buttercup
1	I wuld been like thats tooo bad aint my fault prob sumtin wrng wit u...tantan tarantan big cunt
0	i dont have  a blog  I dont know what to write in mine. LOL
0	Awww, that's terrible. Particularly so far away. 
0	Sorry hun, it's never fun to have critical family members. 
1	THANK YOU, SWEETIE!! 
1	thanks  that sexy pic was taken right outside our local dollar store... i didnt buy the hat
0	so..what about me
0	i know  can i live in your basement? at least can i leave my camera there?
1	3 nightbusses in one week.... one of them yesterday, did the trick I believe 
0	Grrr. We don't finish until July 3rd.
0	Just realized I forgot to pack the t-shirt I made.
0	Oh you poor girl!!
1	love the captain caveman pic
0	aww Sam!  I am so sorry.. hang in there hun!  let me know if you need someone to talk to
0	gotta get my June fix...lol  Nope, no other shows planned 
1	thanks! I did eventually get 19 ideas, which is what I wanted.  I'm sure people could comment with good additions though!
1	 Reggie has been like this since a pup. Now he's a 55 lb border collie that wants 2 b a lap dog during a storm.
1	you better believe ill drink a few for u!
0	I want a polo....
1	 Good Morning! How was ur weekend?
1	i wasn't gonna say anythin, but since u pointed it out ..yep 
0	Oh  Anyway, I watch Las Vegas everyday, You're such an incredible actor. Much Love From Paris ! All my light and support.
0	Oh you've already found your winnerS
1	there's also a kitty following me. Haha. , not just one, there are three of them. 
0	that may not be until August  ::tears::
1	They despise you too
0	Gutted  wanna do anything toniht? My phone has died on me  bahh humbug. I like snails <33xx
1	oh at least you don't have to worry about anything but your grades.  you wanna transfer to temple?
0	my favorite TV-show theme song has to be The Wire's. i miss that show.
0	haha! i was indeed! :-D i didn't see you, sadly 
0	Ooo!  Salem's Lot sounds fun.  Too bad I gave all of my paperbacks to my niece     I figured hand down the good stuff, ya know?
1	golf is boring period.  except driving ranges
0	Awww, thats such a shame  is there no change?
1	oh hey thanks for the recommendation there
0	well, cleaned car this morning and then sorting the pond out this afternoon, lots of green slime weed infestation!  how r u?
0	Yeah back at work  WHats the holiday for? any special one or just a holiday?
0	haha noooo just for my ortho appointment.  lol what will u do tomorrow??
1	haha ohhh well I'm still not good... Love the sport tho
1	he will eat it with me.
0	I just got back from my lunch break.  This was like dessert for me.  Waaaah!
1	I wasn't joking, I really did have asthma. Hahaha. Oh well. 
1	oh hes happy alread, fed, saw star trek and now snoring on the couch 
1	ok i'll try not to reply to you when you are sleeping seem like you desperately need sleep! you are slurring your words
1	Yanks 7-0 over Indians going into 5th.
1	lol...it's DOPE
1	Yeah, of course!  I won last year. Technically, I still have the title till someone takes it from me! 
1	eh..I checked the name of the app again and it's called Hotspot Shield http://hotspotshield.com/ . I hope it will make your friend
1	OMG YOU'RE MY NEW BEST FRIEND
1	aw lucky u! Live it up!!! WhoOooOo!!!
0	i had an extra tix too
1	or somethin how you dont tell people it, & i just wanted to know why, but thx for answering my question 
1	With any luck they checked out the website and will become geohashers too very soon!
1	don't you feel special?
0	Sorry it has been a bad day
1	OmG!! I Know I Read YouR Msg EarlieR!! LoL!! Let's PaRty ToNight!!
0	~ aww, I was supposed to go with you!  but I have my board exam today  ON A FRIDAY! jealous. but glad you had fun partz!
0	~ aww, you left! we didn't even get to go swimming  how was your flight? missing you already.
0	~ sorry to hear about her partz  I hope you feel better. I know how much saying goodbye sucks.
0	Darling i miss you  We have to watch Jurassic Park, because you got the job ;) u know? xD
0	 this is why i need a bike... or a damn horse!
1	Read your post on the release. Looking forward to it  And for the record, Lo-Fi Funk is one of my fuckin' FAVORITE songs!
1	BWWWWWHAHAHAHAAHHA. See. thats what I like abt u.
1	anong wishes mo?
1	LOL i thought so.  good luck   *waves to momma*
0	my plans: guess....yes, studying for Bank-Controlling and due dilligance  but weather is fine, so I'll do it outside 
0	:no performances on the horizon.
1	Thanks for the retweet  http://tinyurl.com/pmanz
1	Not biscuits, but most definitely lots of love and fuss.   She and our other dog Bailey do have the occasional treat.
1	hhahahhahhaahahaha pacarku Lampard dong dari Chelsea!! ya paling cuma pengen liat mukanya doang
1	I love last.fm but find it a lot easier (and more content) on spotify  add me on http://last.fm/user/an0key if you like
1	it's amazing, i just love it 
0	LOL ikr? I tweeted Taylor and he hasn't tweeted back yet.  I want him to verrry baddddly.he says he gets 100ish DMs a day.
0	Bugger (an exclamation not a request) - how close was I
1	ahaaa, i can't believe you missed the Grad.. shamme.  ?
1	oh yeah; I know what that's like - I have those "after" jeans too!
0	 I miss having a Mac  Too bad I can't afford one. Bleh.
0	i bawled my eyes out during left behind  they were both soooo good
0	http://twitpic.com/3krq4 - yabut then everyones gonna see it . and talk to him  and then he won't reply to me anymore
0	neglects her best friend
1	no isnt stupid.....see
1	well 5 whites and 1 yoke, since the yoke is a good fat to have in small portions 
0	haha we girls complain too much! lol. and priscx, yes when they start working and we're working, we'll all not see each other 
0	so sad  but its not because of swine flu dear. he had other complications! he was just diagnosed with swine flu yday. dont worry!
0	but what about mee?  I don't count? & why didn't you go today?
1	 haha well im just looking up my friends
1	shes got you hiiiigh and you dont even know yeah
0	yes hun im in 4 the day .. im takn summa classes online & i have 2 test due 2day ..ugh  shoutout 2 all my college barbies!
1	hope so too! i wish i had someone to wake up to lls! awww.
0	And within minutes of my previous post the sun disappeared under a huuuuuuge black cloud.
0	TY bff. i feel like i haven't seen U in months. hope U all have fun Ronnie's party.  i will take all the drunk dials!;D
1	cool  when are u coming bk from Ireland?
1	Thanks for the heads up on the "lunch meeting" today.
0	Arghh, I'm afraid that's a little too techie for me  But thanks anyway!
1	maybe you should. that's what i'm doing now
1	Try your best to go to the gig!  i'm going through some past english exam papers right now. >.< Eep
1	Money is good!
1	this is true  lets do it
0	My sources say no
0	Outlook not so good
1	Hey Names Charlene. I see yoiu live in NY and like ashley. i love getting to know new people. comment back
0	Oh, it's the house I'm in  It's SWEETCORN! Meriden get a flower, Warwick a castle, Priory a ... duck...Lichfield a weird cross
0	I faced it, and now  have wet feet 
0	sorry I left you  but I was sleepy hehehe
0	Oh wow I hear there's an awesome festival going on in germany today OH WE MISSED IT HOW COME  It's ok we're too cool for it
1	I figure if I'm online I should been building and incorporating other hobbies
0	that's all I can do is shoot people ... its broken
1	you know youve made it when my music player finds your cover art for your songs
1	We got mentioned twice! Very nice!
1	20? Wow! That's commendable, in this day and age.  That's AWESOME!
1	haha gnite my dear!  I know, its hard to peel away. Like a band-aid!  There's always tomorrow.  SUCCESS 
1	I love being home, I stay up till 11:30 now!!  This is the life... wish I could keep it 
1	And its a wonderful thing!  I'm all in favor of using the entire English language (shit, I use #expletives too, I think) 
1	Dude, for you, it'll cost nada. 
1	I love twitter for just that reason, you can be sitting by yourself and still feel like you have a hundred friends with you 
1	I wish it would rain here. Sometimes it makes me happier than the sunshine does
1	Positive change? Feel free to talk to my resident therapist
1	tried both, went with your suggestion   http://twitpic.com/68wow http://twitpic.com/68wpm
0	shite . . . reception is on a rooftop
1	I want to know why Bottega Veneta came up with the intrecciato  design 
0	OH man I LOVE coffee drinks but they give me a stomach ache. So I cant have them.
0	Finally someone admits it! Storyline is unique, but once it was over I felt a little gypped with the casual/nonchalant ending. 
1	http://twitpic.com/4gi7w - I love your bangs!
0	I hate when that happens  sorry hon
1	I've learnt my lesson about driving in pj's - broke down once - not a good look! Have fun - hope it's a productive night
1	ha well thats okay then, i'll make sure its in under 6 months 
0	when it starts beatboxing and receiving cheque's in the mail - it's time to move on
0	aww I wish I was there
0	lol I wish. But these chilren don't come in on fridays so its jus the adults
1	you'll have more fun hanging out with us tonight
0	noo oi want one!!! ma old friend use to! n we use to do it every weekend!! uhh i want 1
0	yeah i know. well...i'm going to bed. first day of my summer class tmrw. omg 4 hours for one class!
0	FOLLOW FRIDAY....
1	Great toss cheers.  Braved the whole 18 despite 5 being its usual boggy self.  Course looks great. Managed 75 after a year off
1	ahah indeed!  By the way, just read your article on your travel endeavours. Great reading ;)
1	cool, I will check that out 
0	even i don't know it lol i know the roman transliterations and maybe recongize words but not really  i have awful lingo skillz
1	get well soon  hiccup!
0	I don't think I'm very good at it - most of Europe and Asia tends to close its ports so I can't infect them.
1	It is a lot faster!  But, we'll be working on it more tomorrow to make it perform even better!  
1	Thanks for the FF
1	can you play Nine Black Alps - Buy Nothing - The new single  Thankyou!!!
0	poor sean  I hope he gets better, he's such an awesome guy
0	You can't get sick! Get better!! We don't want anyone missing out on that amazing personality of yours 'cos you're down.
0	 to both of your tweets. You depress me.
0	I never go raw hun. But the only way to be 100% sure iz to not do it at all...
1	Q-Vole George ! Thanks for telling our story
