0	gosh!!! whts wrong!!???....dis is more dan i cud take!!! spare me.....
0	gosh!seriously?! i cant stop thinking about my bf Sebastian.i miss him so MUCH! havent seen him since the 16th.
0	gosh, final exams is coming, im not ready 
1	Gosh, I had not realised how much film studies work Pete had set us. Meanwhile, I'm going to watch 'The Motorcycle Diaries' 
1	Gosh, I still feel weird after those hamburgers for dinner yesterday... hopefully the chicken soup today will help me feel better. 
1	gosh, i thought i was gonna sleep but then David started tweeting.. hahaha 
1	gosh, I'm full. :p maybe I should give my computer a rest already.. 
1	Gosh, I'm good. Fixed the whole ant-virus problem. Computers happy now 
0	gosh, im so hungry  can someone cook for me?
0	Gosh, I'm soooo sick of doing assignments. This P.E. one is driving me crazy! And it's due tomorrow...!!!  
0	gosh, looks like i'm housebound for the next wee while. this is horrible 
0	gosh, my bachelor paper=52 pages of bullshit 
1	Gosh, my tution for tomorrow morning postpone  tution teacher sms me at 0240 ! - http://tweet.sg
1	gosh, people, please stop asking me "how did I get my double thumb". it doesn't grow during the night, not even if you go to Lourdes 
1	gosh, so tired.... woke up at eleven this morning. then watched old 'the nanny' episodes 
0	gosh, still dizzy yaaay 
0	gosh, this Air France news is very sad...   dunno if they are going to find this one. been hearing the  same news since morning.
0	Gosh, this connection really fcked me up! Aah ga bs bbm dan browsing 
0	Gosh, today is soooo effing horrible because its raining  me no like like rain :p
0	gosh, why does my mother worry TOO MUCH about me? I mean that's cool, but I'm not a child anymore. I can totally take care of myself. GRR 
0	Gosh.  Wanna sleep, but still lots to do.
1	gosh. hols not so good. got sunburnt today from golf. =.= oh well, least i realised i have potential to do really well.  boring day tmr
0	Gosh. I would have texted you but we had a huge rush
0	gosh. it's early pa. but g2g.  :| hmpph. bye guys :-h
0	GOSH. trending topics are so sad today.  the iran election, woman beaters, metro crashes, divorce...
0	gosh.. can't go out this week  gatta study all week.. this week is ganna be crazy!
0	Gosh.. I hate it when a smoker's near me.. But she's so nice !
0	gosh.. i think i got CRAMPS! ouch..
0	Gosh... 3 more hours...  at least those three hours will give me $30 bucks
0	gosh... summer vacation is almost over here at the philippines.. kinda sad..  i wonder what section will i be in?
0	gosh....its so hot now....i wish the rain gods were a little cautious abt me
0	gosh...i think i only got 4hours sleep  it's going to be a long day!
1	gosh...i'm 22 years old...an old lady!  thanks for all the great birthday wishes! it was a wonderful day! now it's bedtime!
0	gosh...it makes me sad when people don't give God a chance
0	Gosh...my back is hurting.
0	gosh..i'm not a bank nor a millionaire!! I was just trying to help,but please don't take advantage of it 
0	Goshh I hate when I put chapstick in the washer by accident  my lips are not dingling...
0	goshh.everybody is this house in a crap mood.Renee just got back from a funeral.Ive had an extremely crap day.Mum has to go2thehospital.
0	goshhh i'm hungry and want it to go to starbucks soooo badly =/ but it's far away from our home ok it's not that far away but still
0	Goshhh this beautiful sunny day made me so tired! Im gonna sleep because i have to wake up very early ..  goodnight and sleep tight
0	Goshhhh. I'm tired of school. Kill me people. My plans are all ruined.
0	Goslings! So cute  And me without my camera
1	gospelfamily is always fun
0	gosshhh......... tooooo hot
0	Gossiip Girl, the best!! the last episode next week 
1	Gossip girl *.* I love it  Chuck is sooo....UGH xDD And Nate...O.O WOOOW xDD But not so great like xDD
1	gossip girl .. nails .. shower .. hair .. make up .. getting dressed .. out .. cant wait to see the girls tonight  gonna be FuNn
1	gossip girl in one hour  fuck fuck fuck fuck X(
0	Gossip Girl is so predictable and i am so lonely,i need a someone to be with  
0	Gossip Girl isn't on next week ahhh no! I have to wait another week more  why do they do this to me lol
1	Gossip Girl Marathon
1	gossip girl season II last episode airing today
0	GOSSIP GIRL, WHEN ARE YOU COMING BACK  ! chaceeeeeee..
0	Gossip time with mom. OMG my relative past away today  malaria jahatnya, anaknya br lahir dan ada yg msh kcl bgt.umur emg gda yg tau 
1	GOSSIP: A person who will never tell a lie  if the truth will do more damage.
1	Gossip: My favorite is www.justjaredjr.com, they keep it simple w/ enough of info. Style site: www.dresslikemiley.net that's my favorite 
1	gossip-ing after the final exam is really good
0	gosssip girl was hot, poor chuck bass 
0	Gossssssssssh power cut at this time   no i dont want to leave twitter right now ......... Shit its going off after making me HORNY :|
0	Got  a B on psych final--B for the class. Math final monday! good-bye first summer!! helllooooo second
1	Got #andyhurleyday  TT screen shot... on my Twitpic...
0	Got $360 today.Can´t decide between new shoes or new iPod. 0.o So many things to buy,so little money. 
1	got 1 after school detention. 2 lunch times and if i dont go to them. i will get 2 more after schools
1	got 1 bag of WHITE MUSK full set from my mom.. anyway, we went out for celebrating our beloved Pop birthday.. 
1	Got 1/2 of dinner marinating and the other 1/2 in the crock pot.  Easy cooking tonight.
0	Got 1/4 of the way home & had to turn around because I missed my dog too much. I know that's pathetic but I got really emotional about it
1	got 10tix terminatorsalvation w/ me, now i need a bodyguard 
1	Got 12 hours of work in today. And 12 tomorrow
1	Got 1700plus tweets! Yayy to me!
1	Got 2 A's today  Hacked off by M. I just don't wanna see your ugly pictures!!!
0	got 2 do history projects
1	got 2 free periods at school today  double biology in the afternoon |-) exciting eh ? NAAAATTTT
0	Got 2 go more dump runs
1	Got 2 more exams today people, please pray  bit of keys. Bit of corrine bailey rae...fun times
1	Got 2 new free books via Bookcrossing! ^^ So after I've finished them, I'll leave them for someone else to read, always fun. 
0	Got 2 of the 3 dogs back from groomers. Too bad SuperDog (Bella) isn't ready yet. She's my favorite.
0	got 2 paper cuts at work
1	Got 2 spend some time with john today and discuss some business over a private show. Lucky girl... I know.  check him out.
1	Got 21st Century Breakdown.  Might be a bit absent for a while...
1	got 3 Bohol shirts! Thank you Ate Karen  http://plurk.com/p/xsrmn
1	Got 30/05/09-07/06/09 booked off work! Ahhh..9 Days of glorious relaxation
0	got 7 bug bites last night!!!
1	Got 98% at Canon Rock!
1	Got a "thing" for doctor chics.
1	Got a 15" Mac Book Pro at a student price with free wireless Mighty Mouse and display adapter
0	Got a 3 hour power nap & now can't sleep  so I shall eat candy. Mmmm
1	Got a 3.5 in French!      bobo sa exam!  YEY! 75% lang haha///
0	got a 69 on the test!! hahaha exams week
0	got a 7 hour shift ahead  dunno how i'm going to get through this one!! wouldn't be so bad if i worked somewhere i wanted to...
0	Got a 97 on my English final!!!! Got A's in both of my classes but I still have that dirty A- from last mod bringing me down.......
1	Got a awesome dress from H&M...
1	Got a B in Andrew's report, yay! Just waiting for washing machine to finish, then heading to Asda to pick up dinner for me and Nabil 
0	Got a backup from 4/24 to work. Have most my numbers except anyone new in the last month and a half. Back is hurting pretty bad today
0	got a bad feeling that my laptop hdd is dying  making weird grinding noises :S
0	Got a bad haircut
1	Got a bad head from too many Babychams, Cherry B's, and Snowballs at the 70's party last night. A day of paper reading and movies. Bliss. 
0	got a bad headache
0	Got a bad headache  xoxo
0	got a BAD toothache  think I might have an abcess(?)  soooooo painful  Got the dentist at 3.30
0	Got a bangin' headache ... not good when you're playing out six hours of dance music
0	got a basket of skincare to check out, jap mags to buy, hair to cut & rebond, guzheng / dance  & painting classes to take but no $ 
1	Got a beautiful past, present & future necklace with earings for my 7th anniversary yesterday 
0	Got a binary clock on my itouch, but now I can't see my Aperature Science battery 
0	Got a bit of a hot and poorlyish boy on my hands atm. Poor baby
1	Got a bit of sun today!  Awesomeee.
1	got a bit of sunburn yesterday. Suncream today I think! Only going to do 6 miles today  #fb
0	got a blackberry and the "a" key doesn't work...that's an unfortunate problem  Why do I have such terribly luck recently???
0	Got a boo-boo at work.
1	Got a brand new and custom designed #twitter background from http://is.gd/Rg7r get yourself one too
1	Got a brilliant idea for a keychain! Warrior Cat Keychains.
0	got a call from the boys dad, i guess he's still alive 
0	Got a call my son vomiting in the wee hours of the morn may have to bring him to the e.r. not good when you wake up to bad newz
1	got a check today. Thanks, DC. Now if Marvel could do the same. 
0	got a chest infection
0	Got a chicken salad #chamlunch which is pretty tasty, but my wooden fork just snapped 
1	Got a chicken wrap
0	Got a choir concert performance tomorrow
1	got a clue
1	Got a coffee, eaten a donut, prepping for my appraisal, it's a good day so far 
0	got a cold      + revising
0	Got a cold shower
0	Got a cold. Sore nose, not nice... 
1	Got a couple 'you look shiny' comments today
1	got a cup of tea and just got up!
1	got a cute balinese wooden pen from m classmate
1	Got a cute new outfit for TC graduation tonight. Yay I love my Besties. Hope ya always remember it
0	got a day of spanish and re to day....... ow fun
1	got a day off today
0	Got a driving lesson in less than an hour and the gym at 4..and still not feeling 100%
1	Got a DVD with the Mail On Sunday, Nobel Son. Looks cool, love the cast... Alan Rickman, Eliza Dushku, Danny DeVito, Bill Pullman. Nice 
1	got a email from my campsite at silverstone...  all sorted! thanks guys ;)
1	Got a email from my wife that she stays at her parents' house tonight. Yeah, I'm single for tonight  Yatta!!
0	Got a F in maths back  I hate maths ^^ okay... I got a german 5 and 6 is the worst (1-6) 10 of 31 points
0	Got a farewell party at school tomorrow... It's gonna be my last day at school
1	got a few errands then tryin to hit the gym then its work...a new week thank GOD i only work 4 days a week
1	Got a free MTB yesterday that needs some work . . . or I can use the components to upgrade my other bike.
1	Got a free ticket to Take That in Croke Park next weekend. Woohooo!!  Looking 4ward 2it. Oh,+just found out little Diane is pregnant. 
0	Got a friggen headache
0	Got a full day ahead of me. No time to tweet
1	Got a fully belly of chico's tacos. Gonna sleep like a baby and probably wake up with a "stomach ache"  lol
1	Got a fun package from my dear friend Lina from Canada!! Totoro folder, syugogetten stationary & spirited away ost 
0	Got a gig next Thursday, still haven't practiced with the others in like a month 
1	got a good feeling going  i can do this , aja!
1	Got a good tan.
1	Got a good tan. SWIMMING TOMORROW!
1	Got a great comp back on the blog I am producing. Very excited!  Hope my boss feels the same way.
1	got a great first verse and chorus goin' i love this song
0	Got a great swiss army knife. Cut myself by accedent
0	Got a hair cut and it looks funny this morning because I am too tired to straighten my hair in the morning.
0	got a haircut finally, thanks Mollypop!  now time to clean 
0	Got a haircut. It's really short. Also, I seem to be grounded. Which means I can't come tomorrow 
0	got a haircut...I haven't decided if I like the new length...I miss my damaged long locks!
0	Got a head ache  and bored
0	Got a head ache  its sad.. Waiting for the aspirin to kick in
0	got a headache
0	Got a Headache ...2 bad i dont have a Boyfriend to take care of me
0	got a headache and feeling down in my spirit    >_<
0	got a headache boooo
0	got a headache from analyzing PandaStream.
0	Got a headache peoples
0	Got a headache that has not shifted all day. Getting a bit fed up with it now. Feel a bit ill
0	Got a headache. Takin a nap.
0	Got a headache...
1	got a job at baskin robins
1	got a job interview 2morrow  .....and i fucken hate Centrelink lol its just gives me the shits!!
0	Got a job, finally!  But I have to shave my beard...  RIP beard...
1	Got a late start today. 7:00am!!!
1	Got a late start. Im good now
1	got a lie in...7am, wwooohooo!  2weeks till new baby (should) be here 
0	got a litle buzzed tonite but blew my high
1	Got a little beat up from the bull and inflatables, but it was totally worth it 
1	Got a little messed up during service while doing security. I don't have a weak heart, I have a sensitive heart. I'm not a bad friend 
1	Got a look at the Visual Studio 2010 beta.. not bad, says I. 
1	Got a lot accomplished today
1	got a lot of cool clothes from my dad
1	got a lot of fish, puuuuhhhh... 
1	got a lot of shit for the apt ikea.  so awesome. didn't spend tons of $$ even better.  going home time.
1	got a lot of shopping done today...really excited bout my new travel journal! Going to go to sleep watching a movie with my cousins
1	Got a lot of things to do hehe daya sa mga walang ginagawa
1	got a lot of value out of the Mission Control seminar!!! Worth every penny! Looking forward to Day 2
1	got A LOT of work done today! Holy productivity, Batman! Time to watch a movie! 
1	Got a lot on my mind... All good things tho  I'm happy w my relationships w all the ppl who matter in my life
0	got a lot to do this weekend, work-wise  
0	Got a maltepoo puppy today, he's 4 months old. So cute BUT don't know if we can keep him w our Food allergy son 
0	Got a massive bruise on my calf
0	got a massive head ache  !!
1	Got a Maths exam in a few hours. I'm still in bed!
0	got a maths test 2day
0	Got a meeaannn hangover!!  Didn't even make it to work.
1	Got a meeting at the Thirt Hotel this morning so I'm taking advantage of the weather and just walking in. It's lovely
0	got a monster headache yet i'm still writing code
0	Got a mother of a storm here  No fair...hate the thunder and lightning!
0	got a mouth ulcer thats really starting to get on my nerves now, it hurts 
0	got a much better response from my dad than I expected, but I still don't feel well  UGH! Bought 10 Stephen King books today.  Obsession?
1	got a new bigger chair.. nice! thanks daddy
0	got a new blackberry still trying to learn how to use it?!.... and its late! have to be a work 2mrw! Its the Kentucky Derby!... Who ppi!
1	got a new book (actually two, lol) a glass of wine... now it's quiet time 
1	Got a new cell phone
1	Got a new computer and going to the teen choice awards. Thanks best friends
0	got a new desk today. It's got a hutch and laptop doesn't open up properly
1	got a new dog
1	Got a new dvd album.
1	got a new fone today...it is AMAZING!!!
0	Got a new guitar today. Les paul, however there was a lil dmg on it from shipping.. 
1	got a new hair cut. mohawk haha
0	got a new haircut man im ugly its not the haircut the haircut's beautiful its me  im hideous DX
0	got a new hairdo, but I'm not to happy about it. it's way to short 
1	got a new hoodie. pretty good day. i love the beach  okay, goodnight.
1	got a new HP Mini and methinks you'll be seeing a lot more of me now
1	got a new inspiration for her future bakery....!!
0	got a new ipod . but its not yellow
0	got a new iPod nano and spent the weekend trying to figure out how to download music to it...now my husband has my iPod
1	Got a new Johnny Cash Shirt  ♥ .. tomorrow french test :S hope it'll be weekend soon >.<
