0	i'm not even dressed and i'm supposed to be at work in 10 min. It takes 20 for me to get there.
0	Im not even n da mood to go out anymore
0	im not even remotely thrilled ab this class i have at 1pm. im startin to question my decision on summer classes  i jus wanna eat cocoa...
1	I'm not even sad I don't get ABC. I have all the Harry Potter movies on dvd. I can fast forward Cedric "going to sleep".
0	im not excited for camp nomores due to the shit weather. and mossimo is having a mid season season omfgggg.
0	I'm not exciting enough for Twitter...
0	im not feelin to great today, and the sun's out 
0	Im not feeling good
0	i'm not feeling good
0	i'm not feeling good today   on my way to cologne - hope it's gonna be as good as manchester!? going to twitter from the show ;-)
0	I'm not feeling great health wise.
0	I'm not feeling so hot
0	I'm not feeling that "Hit Me on Twitter" song by Mistah Fab.
0	I'm not feeling too awesome tonight, think it was something I ate 
0	im not feeling too goood today
0	I'm not feeling too hot today
0	I'm not feeling too well
0	i'm not feeling well  sometimes u gotta sacrifice healthfor the love of fasheeen
0	im not feeling well ... darn! i have a bday party to attend to!
0	I'm not feeling well at all but I'm not sick. Maybe I should take some advil.
0	I'm not feeling well today. Got a cold.
0	i'm not feeling well.  darn, the hot weather!
0	I'm not felling well
0	i'm not finding it interesting.logging in to see only status updates? boring
0	I'm not finding those answers
1	i'm not fond of buying albums which are "malaysia edition" that's so lame. if u wanna get an album buy the ori one.
0	I'm not frantically getting ready to go to award shows  Soon.
0	I'm not getting all my twitters.
0	Im not getting any cock
0	I'm not getting any more fantastic ideas for F5
0	I'm not getting my new phone, 
0	I'm not getting one, stll have 4+ months remaining on contract  but might jailbreak and swap to a different carrier then. #o2fail
0	I'm not getting updates on my phone
0	I'm not going out anymore my friends suck   after I got dress and evrything
0	I'm not going to be able to make this weeks blogtv show, sorry everyone! 
0	I'm not going to be able to see one of my favorite patients before I leave.
0	I'm not going to be fortunate enough to buy LVTT on midnight  Hopefully I do get a chance to buy it though. I want to show my ...
0	I'm not going to BlogHer, and it makes me sad. 
1	i'm not going to bother trying to talk to you anymore
0	I'm not going to Disneyland with Ms. Norwick
0	I'm not going to dxc,  sorry and - we had fun last year
1	Im NOT going to have a conversation on stupid twitter... That is what telephones are for. also, dave is the gay one 
0	I'm not going to make june 9th
0	i'm not going to say anything this time .. but now i feel i gotta babysit
0	I'm not going to school to B a vet so explain to me why I need to knw a Cat's anatomy i'm about to throw this bk out the window
0	im not going to school today im so sick  school is almost done 2 weeks birthday is on saturday!!!
0	im not going to school tomorrow  T-T im sick.
0	i'm not going to sleep today as i can now see the light so ......
0	I'm not going to TCR when I go to NYC cuz my dialysis days changed and Mark can't switch the tickets back
0	I'm not going to tweet everyday . And not often  soo ..
0	I'm not going to watch PCD  http://myloc.me/2bxx
0	I'm not gonna be able to make it tonight it's my line sisters birthday.  thanks 4 the invite
0	I'm not gonna fuck up again.  I cant.
0	I'm not gonna get to go to a summit  But I'm going to the Air Force Museum
1	I'm not gonna lie? I'm going to watch the MTV Awards! Because I love em! But I'm not going to tweet about them! Do I look like an idiot!
0	im not gonna see james for a month and a half
0	i'm not good enough for you..
0	I'm not good in Physical Education, and I'm gonna suck in tomorrow's lesson. 
0	i'm not good in this heat
0	im not gwtting on twitter as much, cuz im studyin for finals 
0	I'm not happy in this days and never been sad this much
0	I'm not happy that I can't watch communitychannel's videos on my iPod.
0	I'm not happy that the student union night SQUIDS is now £1.20 a drink
0	I'm not happy the sun is gone! Especially when we were going to the beach with Ashton!
0	I'm not happy today
0	Im not happy w myself bc I started back smoking
0	I'm not happy with Barry Hall at all
0	I'm not happy.
0	I'm not having a good day  I need something good to happen to me..#trackle?
0	Im NOT having a good day!! Ugh.. I just want it to be over.
0	Im not having a good day....
0	I'm not having a very good Monday...
1	I'm not having any of trouble I was having with the bad computer, took in to the geek squad, even they were stumped, they gave me new 1, 
0	Im not having the most carefullest of days
1	I'm not home, come rob me. Nah I'm just kidding, please DON'T rob me. 
1	I'm not hopeless anyomoreee.  ILY, Stereo... :* ><
1	Im not hormonal! Im just a bitch! Duh
0	I'm not hungover but I'm heaps tired. Wanna sleep but have assigs to do. Plus have an EC evo begging me to write some of it. What to do?
1	im not hungover today
0	Im not ignoring ya'll, im having tech. difficulties right now 
0	i'm not impresed with the bbq smell coming through my window  bleuch!
0	im not impressed by my picture thats gonna be on the center wall for the next year
0	Im not in a good mood 2day so im at the mall right now then goin 2 watch a movie&  will be missing Maddhouse's live chat
0	I'm not in it
0	I'm not in mood+situation to write internals but will have to write DMW tomo
0	I'm not in the mood for chemistry
0	i'm not in the mood of studying  can i nottt??
0	I'm not in the twittering or follow Friday mood.
1	I'm not into your alter ego because I don't know that person . Thanks
0	It's car crash tv at it's worst.
1	It's Cate Blanchett's birthday apparently  LOVE HER.  Anyone know wen BB's out on dvd?
1	it's chill time..
1	Its chill wit mom day lol!!!
1	It's chilly here but the sun is ashinin'!  Now if it can infuse me with the energy I need all will be well.  Happy Saturday twittuns!
1	it's chilly outside
1	It's chilly. Am chatting with my new #childfree #cf friend.
1	it's clear, he's just not that into me 
0	its clearly june is this cali weather is lame...im ready to break out the mini skirts and over sized sun glasses
0	It's cloudy
0	its cloudy today
0	its cloudy...i likey!! my salad sucked btw...
0	It's coffee break, but I have to finish the EC-TEL Paper 
0	It's cold  .
0	its cold  hug me
1	Its cold & raining in Melburn, Laying on tha couch watching 'Tha Hills' waiting for Neighbours to start & for my daddy to bring me dinner 
0	It's cold and cloudy and I have a million loads of washing to do
0	Its cold and gloomy 2day
0	Its cold and I get to walk 2 miles to church...burrrr
0	its cold and i want to go to bed.
0	It's cold and rainy in the OC today
0	Its cold and wet and I'm waiting outside for this girl to come to start work
0	It's cold and wet outside...not good geocaching weather
0	Its cold freezing cold! And my husband is addicted to World of Warcraft.
0	Its cold here  last week before the massacre-exams
1	it's cold here!
0	It's cold in IL...
1	its cold in my house. thank God for hoodies!
0	It's cold in the Black Hole today
0	it's cold in this hotel room.  In Denver, yay!
0	It's cold out here!!! I need some pantyhose on!!!!   I knew it wasn't quite time 2 retire my ugg  IM COLD!
1	It's cold out today which makes it hard to believe that it's June 2nd  We should be swimming in the swimming pool not wearing jackets!
0	It's COLD out. No beach today
0	It's cold outside
1	''Its Cold Outside and The Sun Is Gone But Im allright Cuz Im Loving It....''
1	it's cold outside.
0	It's cold so naturally the A/C is pumping at full blast
0	its cold today  sad times
1	its cold where i am, but at least we got a cabin  ... kind of went with luck on that one lol
1	It's cold, gray, and fogged in - but the ride must go on.    Around the lake now with arm warmers, leg warmers, vest, toe covers. Summer!
0	its cold, im bored and super lonely 
1	Its cold.. I need drink to warm myself.. The alcoholic kind
1	It's comforting to know that John Lewis are there to help if I need help with my recent purchase - a child's rugby shirt
0	Its coming out the socket  I feel like my phones hole is not a virgin. That's how loose it is... :'(
0	It's coming today! It's coming today! Too bad I have a boring family BBQ
1	It's comming ...   #asot400
0	It's confusing
0	it's cool but I can't see the text to the right...
0	I'm not kelly clarkson and I don't want to be tonight either...or any night for that matter.
0	im not kidding! i hate the bugs with wings
1	I'm not lauryn hill but I'll clap you wit that thing/du wop ya moms home ; everything is everything ! - nobody fuckin wit me right now
0	im not like ever allowed to go anywhere so still,here i am,laying on my bed. 
0	I'm not liking all this rain what's even worse is I have to go out in this to get to work
0	i'm not liking being stuck indorrs on a sunday day
0	I'm not liking this stormy weather
0	I'm not looking forward to being in this weather tonight
0	I'm not looking forward to going to second period today
0	I'm not looking forward to my wake up call in 4 hours
0	I'm not looking forward to today..Ashley has left for South Carolina
0	Im not looking forward to tomorrow
0	I'm not looking fwd to getting up early tomorrow  Better go to sleep now I guess...
0	I'm not much of a party animal, I'm afraid. I tried snorting coke once but the bubbles made me sneeze. 
1	I'M NOT NEW TO TWITTER ANYMORE, BTW!  hahaha. chillin'
0	i'm not ok. i'm going to sleep now
0	I'm not pretty anymore
0	I'm not quite sure why I'm still on this, noone's following or anything. 
0	i'm NOT READY for final exam !!
0	I'm not ready for school, yet!! 
0	im not ready if i have to leave my classmates.i mean,we will not be in one class again in 11th grade 
0	I'm not ready to go to Korea on Sunday
0	I'm not ready to go to school yet.
0	I'm not ready to leave yet....
0	i'm not ready to see that thing!
0	i'm not really good in playing Time for me to rest, been walking for 3 hours with a heavy bag!!  
0	I'm not really leaving tomorrow am I ?
0	I'm not really understanding this....I'm not getting updates on my phone, even though I signed up.  
0	I'm not saying anything naughty and I'm not sellng anything, why am I losing followers...boo hoo 
0	I'm not sleeping well again ugh don't feel right
0	im not sleepy at all and its almost 1!!!
0	Im not sleepy but need to get sleep because of work early tommorrow
0	i'm not so sure if i could watch  my mom just started talking to me yesterday.
0	im not so sure to finish the movie this summer. in spite some of the crews wont be here for couple of weeks  we'll try though. planning!
1	i'm not street but i do what i gotta do, so what u gotta crew, i gotta crew too 
0	IM NOT STRONG
0	i'm not strong enough as you, so i can't do all this stuff alone sorry 
0	i'm not such a fan of my cheap electric kettle any more. drinking hot water without tea, i can taste the plastic  need a non-plastic one
0	I'm not sure how it happened but I went to update a post I had scheduled for tomorrow and LOST the enitre post....  ::SIGH::
1	Im not sure i can afford life atm. BUT im looking to invest in my own decks. Make some money doing gigs
1	I'm not sure I want to follow Brian Scheuble but he was in the room when I signed up for this shit. Always Mr. Nice Guy
0	I'm not sure it will ever stop raining
0	I'm not sure I've ever moved without actually moving ... Hahahahahahahaha poor hubby!!
1	I'm not sure there are too many megatons left to announce... We'll have to wait and see  #E3
1	I'm not sure to go to Kelly's resto for videoke thing and stuff today. Such a baad weather. Don't want to get cold again, Summer Beejays! 
0	I'm not sure why I bother fixing my hair in the summer. The second I leave the house it's going to friz!
0	im not sure why, but i just have a really bad mood at the moment  no reason. Oh dear i hope im not on the verge of depression 
0	Im not sure yet!  i might have a match but i wont know until 2morrow morning!
0	I'm not sure!  it is a possibility! Idk whos going yet cept michael and syd
1	I'm not syncing my Google contacts b/c I dont want everyone I've ever emailed on my phone
1	I'm not teenager anymore yeeeeiiii  20's great...and drunk
0	I'm Not That Girl never fails to make me sad. I'm more of an Elphaba than a Galinda.  And yes, I'm listening to Wicked in the car.
0	im not that tired....but i open tomorrow....
1	I'm Not There en verdad rifa... est� bien chingona.
0	i'm not this girl  i want "me" back
0	Im not tired  textt me
1	I'm not trying to build a cult here people. #s don't mean anything if ya'll are quiet. DM me if you're shy.
0	Im not tweeting!! What happens to mee?!?!?!? xD jajajaja I guess Im sleepy
1	I'm not unfollowing anyone that is following me... or that I speak to regularly! So no worries ppl
1	i'm not up to too much twitter.com just signed up so thats it?
0	I'm not used to working on Saturdays...but I gotta do it...
1	I'm not using often...lol
1	I'm not using twitter anymore  sorry!
0	I'm not very happy today, because I didn't talk to my favourite friends!!!! x.x 
1	i'm not wanna do my homework, late i do 
0	I'M NOT WATCHING THE MTV MOVIE AWARDS AM I IRRELEVANT
0	I'm not wearing pants to sleep tonight. it's hot in my bed
0	im not well
0	I'm not well and baby is sick too
1	I'm not working today. Lmao and a TB is god. I can't wait to own one
0	Im not worth it
0	im not zac, PLEASE ADD again His account was hacked  ! tell everyone to add him again please! god bless you!
0	im not zac, PLEASE ADD again His account was hacked  ! tell everyone to add him again please! god bless you!
1	Im not. But i like when im not getting texts all weekend. I hope my summer isnt like this -.-  NemoNemesis
1	I'm now a certified YOG Ambassador-in-training! I'm so excited!
1	I'm now a home owner! OMG, what have I done? 
1	Im' now a twitter girl  <3
1	I'm now addicted to http://omegle.com thanks
1	i'm now addicted to watching brilliant legacy [korean drama]. typical love story, actors/actresses are cute, what's not to love? HAHA. 
1	I'm now at the cutest tot's birthday, Samantha. Happy birthday Tata, love you much fashion baby 
1	It's Cool to Get Your Mouth Burned By Pizza
0	its cooold in my room
0	Its cooooold
0	It's couple time in Team International. Y yo solita
1	Its crazy how much shopping changes my mood
1	It's crazy in Orlando. Last time the magic went to the finals was 15yrs ago. Go Orlando
0	its crazyy mann. listenin too j stalin murder rateee. really thinkinn. i misss yeww guyss.
0	it's currently raining in downtown Seattle....the 29 day streak without rain is over!  unless... it's not raining at sea-tac.
0	Its Daddy day and I'm working and not being wif my daddy
0	Its daddy's day tomorrow and i dont get 2 see my dad, boo  
0	It's daily walk time. Too bad it's 95 degrees out.
1	It's DailyBooth email time!   Yay!
1	It's Day 6 of Entrepreneurs do it yourself marketing month - Yes, some entrepreneurs work weekends   -  http://bit.ly/rFIUg #ediymm
0	It's day like today that I wish I had a dog
0	Its days like these when i dont like the rain
0	its days like today i wish i were in australia.
1	It's days like today that make me think 'global warming, my ass,' but I do believe in global warming...just not that it's manmade. 
0	It's days like today when I all I want is better gaming support for Mac's... I don't want to boot Windows anymore
0	Its definitly Monday!
0	its depressing outside today
0	It's depressing when I check my inbox and there's no new mail
0	It's Derby day...23.75 years of life and I've still never been to Churchhill Downs.
1	Its Derbyy Weekendd  , im bouts to Go on Broadwayy && Act a foo.
1	Its difficult to be a pedestrian in the states
0	It's difficult to go to a decision in griffin vs bonnar classic fight.  I keep knocking him out
0	it's difficult when a customer says: what u did is wrong cause now my requirements have changed and what u did is not what I want now
0	IT'S dificult because i don't know how the restaurant looks like...
1	Its dinner time and then soon sleep time!But before that where did my ipod go,I'm in the mood for some "clue" 
1	It's dinnertime!! Time for breakfast before work
0	it's disappointing.  here, the sky gets dark..it gets really windy..and then it just blows over 
1	It's done. 10,000 gamerscore  (Thanks, Hasbro Family Game Night!)
0	Its down for me too!  re: http://ff.im/3pYtA
0	IT'S DRAFT DAY!!!! Yay for basketball talk today!!!! WOOT!!! WOOT!!! (Boo for being at work and not glued to the tv
0	Its Drafting Financial Statements 2day PPL. I feel sick in my belly I really dnt like exams  I do often ask myself Y I do dis 2 myself?
1	It's dried out a lot & we've had kids watch our last 2 shows - hurrah
0	Its driving me crazy. I think he changed his mind.
1	It's driving me out of my mind that's why it's hard for me to find, can't get it out of my mind...  haha
0	It's dull today  sad times but on the plus side I'm away to spend more moneys I'm town again today!!!
0	It's e x t r e m e l y hot right now! haha, but is whatevs 'cause it's my last day in DaNang with family on my mom's side.   So sad!
1	I'm now available on Skype.  Am I really that pasty, or does computer video make most people look that way?  
1	I'm now awake friends!
1	I'm now being featured on another site. Hmmm...feels goooOOood!   http://bit.ly/dILnO
1	I'm now convinced this month result in the biggest bank wire transfer yet ever
1	I'm now following Liz Taylor.... I hope that's ok under my restraining order
1	I'm now having a break and shall continue practising edelweiss on my guitar. why? cos I'm cool
1	i'm now in Twitter! twit! twit! hehehe
1	i'm now officially manny's fan. lol. he stayed humble, love it.  http://plurk.com/p/rhyfk
1	I'm now on ep 10 of code geass r2, I have mixed emotions on Lelouch!.. 
1	Im now online
1	i'm now over it.  no joke.
1	im now playing piano version of sweet  will do live st venue pobably next week!!!!! ;)
1	im now reading abt the lewis and clark expedition, and sacajawea! 
1	I'm now the proud father of two sons.  http://twitpic.com/2y73a
0	I'm now the proud owner of a Nikon D60 DSLR, woo! I'd head out to take some photos if my car started 
1	I'm now totally addicted to Farm Town. Frankly, it's more fun that fixing laptops or studying the diseases that will kill us all. 
0	i'm now uber pissed off at Catherine Hardwicke and watching DieHard 4.0, should be revising 
1	Im now watching "the perfect man".
0	im nt by a cpu 
0	im nursing an out of commission left foot. im od'n on benadryl. its swollen
0	i'm nusy being emo about missing the love of my life
0	i'm nuts. i just got back from westfield to buy coke. lol  bad!
1	I'm observing in theatre today much more interesting than sitting in the office
1	im obsessed with you guys dont even knwo how much i love her . shes my idol and she is soo pretty!  just wanted to say that!
0	i'm obsessed with benefit benetint lip stain, but idk where to buy 
1	Im obsessed with Elmo
1	i'm obsessed with FML. happy mothers' day
1	I'm obsessed with giving people high fives hahahaha high fives are never overrated
0	Im obsessed with ipod apps.
1	i'm obsessed with the streets' song 'trust me' since yesterday ... makes me want to get back to london asap. has any1 the lyrics?
1	im obsessed:cuteoverload.com
0	I'M OBSESSED? puhlease. monday cannn't come fast enouugh
1	I'm oddly excited to start memorising the criminal investigations book... I sooo love taking tests
1	im of to work for a little while
1	i'm off   ....... i don't know wether i still have the TINIEST bit of a thing for,, mango. TOTALLY over milo but just cause mango,
1	im off  2get me & my 3 yr old ready for the day. enjoy the humpty day
1	I'M OFF  Bye  And don't forget to Do The Hoedown Throwdown xD ? Case it's Mileylicious xD
0	im off !!cant cope with vdodgy keyboard
0	i'm off 2 bed...its 1.00AM and my eyes r closing!!! chat 2morow...wanted 2 get more work done, but cant stay up any longer 
1	Im off 2 beddddddd  besoss my twiends
0	it's early  but for a good cause. red beers starting in the air in approximately 2 hours.
1	It's early and I'm tired. Coffee please!
1	It's early, I'm havin' my coffee, I think I'll check on those upside down tomato and pepper plants out back ~  Have a great day everyone 
0	It's early. I'm tired. I hate high school.  only two. more. weeks.
1	It's easier to build boys than to mend men.  Heard that this morning on the radio - not sure who coined that quote but it's quite true.
1	it's emma here  just making abbie a twitter. follow please? she's the drummer for these walls are talking. ilux
0	It's entirely possible that I just butchered Talking Heads
0	It's entirely possible that my severe allergies are in fact a.... cold
1	it's exciting in sch00L ..
0	Its f*cking freezing in forensics. And my stomch hurts
0	Its F@#&ing snowing!
1	It's fancy dinner night! dressing up and going out to eat with lora and
0	Its far to hot to be in work today...
0	its far too cold to be at work
0	It's far too goddamn warm.
0	It's far too hot.
0	it's far too nice a day to be stuck at work
0	its fa-reeeeeezing. ihy winter
0	It's farking hot outside the house and heaty inside. I'm falling sick
0	its fathers day for all those who have fathers
0	It's father's day in the states so I just told my stepfather how much I love him because he's my real father. However, gotta call BioDad. 
0	Its Fathers day tomoro. Anybody know heavens address?  I miss you daddy, happy Fathers day
1	Its feed outside cats time!
1	its feels grea out! but it looks like shit lol....cant wait to hit nyc...waiting for the best to get here
0	its feels like a friday because ...(wait for it)...i'm on holiday for a week. so you'll have to get your twit fix elsewhere for a week
1	It's fiiiinally nice out today! Heading out for some food
1	it's final. i'm not going to bintan. uh-oh... someone's really pissed right now. peace and love, sarah! 
0	Its finally Friday! Yay!! Going to Menard this weekend hope its fun. I cant wait to see the river. But I have to get off work first.
0	It's finally getting warm here in Minnesota!!! YAY! but i still miss Vancouver Island, Canada! 
0	It's finally here!!!...and I have to go to work!
1	Its finally here, the beautyblog!!!  www.ditzymake-up.blogspot.com Check it ouy 
1	Its finally JUNE yessss
1	Its finally my actual birthday, yay! Going 2 Mom's 2 celebrate our day 2gether. 
0	It's finally raining   I miss Max.
1	It's finally raining in Bergen again  Don't get me wrong, I like the sun and all, but I LOVE rain. I'm weird that way ;)
1	It's finally saturday!
1	its finally the weekend.. but it feels like the rest of the week to me lol
1	Its First Fridays tonite! Come on by and say hi and maybe pick up some nice art   Roosevelt and 6th street form 7pm to 11pm
1	Its five o clock  Ohhhhh mannnnn. Wtf. I want to sleep more /:
0	its fizzy its ginger its phenomonal...its IRN BRU!!!! Tryin to find my friend sophie on twitter...hav u guys seen her...
1	its fizzy,its ginger,its phenomenal.got to love the irn bru adverts. 
0	its flippin morning already..
0	it's floor cleaning day again. not looking forward to it
0	its f'n hot out here. shit! 2bad I can't do bbqs 2day
1	its follow Friday come on and follow me
1	It's follow Friday guys! I may follow some of you! I'm going to click on my 'followers' button, and just follow some random people! 
1	its follow friday! go follow  this is my first time doing follow friday, hehe. i hope someone would follow friday me, lol.
1	its fooking roasting ! Happy 21st to my best girl
1	It's 'forest', dummy. =P Tell I said hi. 
0	it's four in the morning and i can't fucking sleep. uhg! i'm getting frustrated
0	Its freakin' cold here the relay.
1	its freeeezzzzing outside. had my guitar lesson and just got takeaway.. gonna go eat now..
1	It's freezing in my office!  Wrapped up in my NFL fleece blanket..wish I had a snuggie
0	it's freezing in this office
1	Its French
1	it's fridaaaaay!  and i have homework a lot :| i kill a ugly and big bug x.x
1	its friday
1	it's friday  gonna go force myself to study homework for my test on monday. uggh! i just remembered the assignment. not cool. so not cool.
1	ITS FRIDAY !    in a good wee mood.
0	it's friday !! And i just got on the bus .. Going to work later today again
1	it's Friday ,,,, looks like a goodie 
0	It's friday ... finally ... and yes, it's another stressful day  But you know what? Only a few days and this job is history ... woohoooo!
1	It's Friday and I want to go out, but I have to wake up early and hop on the End of the World Train  (Tren del fin del Mundo) tomorrow. 
1	it's Friday and it's warm and sunny we're driving into Queens in a few to pick up Nick for the weekend!!! Can't wait to see him!
0	Its Friday and my work week isn't over yet, still have one more day of work left 
0	it's friday and still no jailbreake and no beejive 3
1	it's friday and the weather is beautiful in Randers (Denmark)!.. We should go out for a beer later on
1	it's Friday I'm in loveee! woohoo 3-day weekend  ? http://blip.fm/~6t0vg
0	it's friday night and i'm in my home.. hahahaha nothing to dooooo!
0	it's friday night. i'm home. no party this weekend
1	It's friday party at BIG B'Z House tonight
0	It's Friday yet again and again no plans this weekend boo
1	It's Friday! It's Friday!!! IT'S FRIDAY!!!! So glad, but lots of work to do this weekend 
0	Its Friday! Only 5 more hours until I'm free!.....until tomorrow.  oh well
0	Its Friday! Yay! But Im working
0	Its Friday!! Too bad I have work tonight  its all good though....Gotta make $$, that's wats important
0	It's Friday!!! Can I get a WHAT WHAT and a HEY HEY!? Moving this weekend. Sad times  but excited at the same time. I hope all goes well.
1	It's Friday!!!!
1	IT'S FRIDAY!!!!!  &  Monday is one of very few paid holidays I get!! & my boss is making us omelettes 2day....I couldn't be happier!
